title,text,author,published,tags,source
Hansi Flick plant mit Thiago und Alaba,,,1599720790,"Sport,FC Bayern München",welt
Heute testet Deutschland den Katastrophenfall - das müssen Sie über den „Warntag“ wissen,"Es ist eine Kakofonie der schrillen Töne, die Deutschland am Donnerstag bevorsteht. Sie wird aus einem einminütigen, anhaltenden Dauerton, einem einminütigen auf- und abschwellendem Heulton und einem weiteren einminütigen Dauerton bestehen. Zwischen dem Sirenenorchester, das beispielsweise in der Stadt Hamm auf 38 Lautsprechern ertönen wird, werden jeweils fünf Minuten vergehen.

So zumindest will es das Bundesamt für Bevölkerungsschutz und Katastrophenhilfe (BBK), das mit dem ersten bundesweiten „Warntag“ am 10. September um 11.00 Uhr im ganzen Land den Ernstfall proben will. Was passiert, wenn in Deutschland die Erde bebt, wenn landesweit der Strom ausfällt oder Terroristen das Land attackieren?",Florian Gehm,1599720300,"Wirtschaft,Terror, Naturkatastrophen, Super-GAU",welt
Tempo 100 – So teuer wäre dieses Limit für Deutschland,"Was würde es die deutsche Volkswirtschaft kosten, wenn auf den Autobahnen ein Tempolimit gelten würde? Eine Studie kommt trotz CO2-Einsparung und geretteten Menschenleben auf Kosten in Milliardenhöhe. Doch die Rechnung hat ein entscheidendes Problem.

Anzeige

Über ein allgemeines Tempolimit auf deutschen Autobahnen wird meist vor allem ideologisch diskutiert – die Fronten sind verhärtet. Nun bringt eine Studie des Instituts für Weltwirtschaft Kiel (IfW) zumindest neuen Diskussionsstoff in die Debatte. Das Institut hat in einer Studie errechnet, welche Kosten ein allgemeines Tempolimit verursachen würde. Demnach würde das langsamere Fahren auf den Autobahnen die deutsche Volkswirtschaft Milliarden kosten.

Die Studie dürfte allerdings durchaus kontrovers diskutiert werden, denn Autor Ulrich Schmidt, der beim IfW die Abteilung Sozial- und verhaltensökonomische Ansätze zur Lösung globaler Probleme leitet, trifft für seine Rechnung einige Annahmen, die Anhänger eines allgemeinen Tempolimits anzweifeln könnten.

Lesen Sie auch Automobilgipfel Die Staats-Cloud wird für die Autobauer zum teuren Projekt

Im Prinzip vergleicht Schmidt die Kosten für eine längere Fahrtzeit, die ein Tempolimit verursachen würde, mit dem Nutzen, den eine Beschränkung bringen könnte. Dabei berücksichtigt er sowohl die CO 2 -Einsparung als auch die sinkende Zahl von Verkehrstoten. Dennoch würde ein Tempolimit von 130 Kilometern pro Stunde nach den IfW-Berechnungen zu einem Wohlfahrtsverlust von 990 Millionen Euro führen. Läge die Beschränkung sogar bei 100 Stundenkilometern, wäre der Verlust entsprechend größer und würde 6,7 Milliarden Euro betragen.

Bis zu 321,3 Millionen Stunden Zeitverlust

Anzeige

Schmidt hat sich dafür angesehen, mit welchen Durchschnittsgeschwindigkeiten bei welcher Beschränkung heute gefahren wird. Gibt es kein Tempolimit, liegt die Geschwindigkeit im Schnitt bei 124,7 km/h. Darf man maximal 130 Stundenkilometer schnell fahren, sinkt der Durchschnitt auf nur noch 118,3 km/h, und bei einer Tempo-100-Beschränkung liegt der Schnitt noch bei 103,3 km/h.

Würde man nun auf allen Autobahnabschnitten ohne Begrenzung ein Tempolimit einführen, würde die durchschnittliche Geschwindigkeit auf diesen Strecken sinken. Man käme entsprechend langsamer ans Ziel.

Lesen Sie auch Elektromobilität Die Deutschen entdecken ihre Liebe zum E-Auto

Bei einem Tempolimit von 100 km/h käme so ein rechnerischer Zeitverlust von 321,3 Millionen Stunden für alle Fahrer zusammen. Bei einer allgemeinen Beschränkung auf 130 km/h gäbe es immerhin noch einen Zeitverlust von 65 Millionen Stunden. Diese Werte multipliziert Schmidt mit dem aktuellen durchschnittlichen Bruttostundenlohn von 26,22 Euro.

Anzeige

Bei der Berechnung der CO 2 -Einsparung greift Schmidt auf eine Studie des Umweltbundesamtes (UBA) zurück, das zu den Befürwortern eines Tempolimits zählt. Demnach würde ein Tempolimit von 130 km/h rund 1,9 Tonnen CO 2 einsparen, eine Beschränkung auf 100 km/h brächte 5,4 Tonnen.

Lesen Sie auch Betriebsratschef Osterloh „Das Projekt Artemis soll dafür sorgen, dass VW vor Tesla liegt“

Diese Werte multipliziert Schmidt mit 25 Euro – dem Preis, den man im europäischen Emissionshandel derzeit für eine Tonne CO 2 zahlen muss. Ob dieser Preis allerdings die tatsächlichen Kosten des Ausstoßes einer Tonne CO 2 widerspiegelt, dürften Kritiker bezweifeln.

356 Tote bei Autobahnunfällen im Jahr 2019

Befürworter eines allgemeinen Tempolimits führen jedoch gar nicht die CO 2 -Einsparung als Hauptargument ins Feld, sondern den Sicherheitsgewinn, den eine Geschwindigkeitsbegrenzung mit sich brächte. Es gibt nur wenige Untersuchungen, wie sich ein Tempolimit auf die Zahl der Unfälle und vor allem der Verkehrstoten auswirken würde.

Anzeige

Allerdings wurde bereits im Jahr 2007 eine Studie veröffentlicht, die für Autobahnabschnitte in Brandenburg untersuchte, wie sich die Zahlen vor und nach Einführung eines Tempolimits verhielten. Demnach sank durch ein Tempolimit von 130 km/h die Zahl der Unfälle um 48 Prozent, die der Verletzten und Getöteten sogar um 57 Prozent.

Lesen Sie auch Taycan im Test Nach 2000 Kilometern im E-Porsche – jetzt hat Tesla seinen ersten echten Gegner

IfW-Forscher Schmidt nimmt an, dass von den 2019 bei Autobahnunfällen verstorbenen 356 Menschen mit einem Tempolimit von 130 km/h 80 gerettet worden wären. Bei einer Beschränkung von 100 km/h hätten sogar 148 überlebt. Er halte diese Zahlen für optimistisch, schreibt Schmidt. Die Studie aus Brandenburg würde jedoch sogar noch höhere Zahlen erwarten lassen. Den Wert, den der Forscher für ein Menschenleben ansetzt, lehnt Schmidt ebenfalls an eine UBA-Studie zu den Auswirkungen von Feinstaub an.

Darin wird mit einem Wert von 3,66 Millionen Euro gerechnet. Schmidt bewertet jeden Geretteten mit 4 Millionen Euro. Diese rein ökonomische Sicht eines geretteten Menschenlebens dürfte der Hauptkritikpunkt von Befürwortern des Tempolimits sein. „Natürlich versieht man ein Menschenleben nie gern mit einem Preis“, sagt Schmidt im Gespräch mit WELT. Dennoch müsse man ständig solche Entscheidungen treffen, bei denen man abwäge, wie viel ein Menschenleben im Verkehr, aber auch im Gesundheitswesen wert sei.

Lesen Sie auch Mobilität in Metropolen Autofreie Innenstädte? Dafür müssen wir erst die Planwirtschaft einführen

Schmidt hat in seiner Rechnung allerdings einige Variablen weggelassen: So werden beispielsweise Kosten nicht berücksichtigt, die sich aus Verletzungen und Sachschäden bei Unfällen ergeben, die sich durch ein Tempolimit vermeiden ließen. Dafür gebe es keine zuverlässigen Daten, argumentiert Schmidt.

Er glaube zudem nicht, dass dieser Nutzen die hohen Kosten durch den Zeitverlust ausgleichen könnte. „Mir ging es darum zu zeigen, dass im Gegensatz zur Einschätzung des Umweltbundesamtes ein Tempolimit und die damit verbundene CO 2 -Einsparung keineswegs gar keine Kosten verursachen würde“, sagt Schmidt. Er wolle mit seiner Studie einen Anstoß für die Diskussion geben.",Philipp Vetter,1599720130,"Wirtschaft,Kontroverse Studie",welt
„Wir brauchen eine gute Qualität in der Breite“,,,1599719110,"Sport,Hansi Flick",welt
