title,text,author,published,tags,source
Politisch motivierte Straftaten kommen in Hamburg meist von rechts,"Die Zahl der Fälle von Hasskriminalität in Hamburg ist leicht zurückgegangen. Grund zur Entwarnung sieht die Politik allerdings nicht – denn: „Hass zersetzt unsere Gesellschaft“, sagt die grüne Justizsenatorin.

Anzeige

Etwas mehr als einen Monat ist es her, da wählte Hamburgs neue Justizsenatorin Anna Gallina deutliche Worte. „Wir alle wissen“, sagte die Grünen-Politikerin bei der Vorstellung ihrer Pläne im Rathaus, „dass Hass unsere Gesellschaft zersetzt.“ Umso wichtiger sei es, „dass wir bei Hassdelikten eine direkte Anlaufstelle schaffen, bei Hass im Netz weiter klare Kante zeigen und deutlich machen: Auch das Internet ist kein rechtsfreier Raum“. Eine erste Auswertung der bisherigen Lage in 2020 hat nun einen leichten Rückgang bei der Hasskriminalität ergeben.

Demnach ist die Zahl der polizeilich erfassten Fälle in den ersten sechs Monaten dieses Jahres in Hamburg im Vergleich zum Vorjahr etwas zurückgegangen. Laut einer Senatsantwort auf eine Kleine Anfrage der Linksfraktion in der Bürgerschaft wurden im ersten Halbjahr 69 Fälle von Hasskriminalität registriert. Bei den vorgelegten Quartalszahlen handele es sich um vorläufige Angaben. Im Vergleichszeitraum 2019 waren es 81 Fälle.

Erfasst sind Taten im Bereich der politisch motivierten Kriminalität. Mit 57 Fällen machten auch in diesem Jahr rechtsmotivierte Straftaten den überwiegenden Teil der Fälle von Hass und Hetze aus. Sie reichten von fremdenfeindlichen, rassistischen oder volksverhetzenden Kommentaren im Internet über Schmierereien und das Zeigen des Hitlergrußes bis zur Körperverletzung. In zwei Fällen wurden Taten der Hasskriminalität dem Phänomenbereich „religiöse Ideologie“ zugeordnet, in einem dem Bereich „ausländische Ideologie“. Neunmal konnten die Taten keinem Bereich zugeordnet werden.

Lesen Sie auch Bedrohte Kommunalpolitiker „Ich gehe nicht mehr wie früher allein wandern“

Lesen Sie auch Politisch motivierte Straftaten „Die größte Gefahr kommt von rechts“

Anzeige

SPD und Grüne haben in Hamburg in ihrem kürzlich vereinbarten Koalitionsvertrag eine Verstärkung des Kampfes gegen Hasskriminalität vereinbart. So sollen Verfassungsschutz und polizeilicher Staatsschutz gestärkt werden, „um insbesondere gegen Hass und Hetze, gegen rechtsextremistische Aktivitäten im Internet und den sozialen Medien vorzugehen“.

Im rot-grünen Koalitionsvertrag heißt es dazu weiter: „Wir wollen die Strafverfolgungsbehörden in die Lage versetzen, Hasskriminalität effektiv zu bekämpfen, und werden daher die mit der Einrichtung der Koordinierungsstelle OHNe Hass begonnene Zusammenarbeit zwischen Staatsanwaltschaft, Medienunternehmen, Polizei und Zivilgesellschaft fortführen.“ Ziel sei es, Betroffene zu ermutigen, Anzeigen zu erstatten, Hasstaten konsequent zu verfolgen und alle Beteiligten für das Thema zu sensibilisieren. Dafür soll eine neue Sonderabteilung bei der Staatsanwaltschaft sowie eine entsprechende personelle Verstärkung der polizeilichen Ermittlungskapazitäten geschaffen werden.

Erst Anfang des Monats hatte der Bundesrat grünes Licht für ein neues Gesetz gegen Hass und Hetze im Internet gegeben. Danach müssen Internetnutzer, die online Hassbotschaften verbreiten oder Menschen bedrohen, künftig mit schärferer Verfolgung rechnen. Soziale Netzwerke wie Facebook oder Twitter werden strafbare Postings etwa mit Volksverhetzungen, Mord- oder Vergewaltigungsdrohungen nicht mehr nur löschen. In bestimmten schweren Fällen müssen sie diese ferner dem Bundeskriminalamt (BKA) melden, damit die strafrechtliche Verfolgung möglich wird. Um Täter schnell zu identifizieren, müssen soziale Netzwerke dem BKA zudem die IP-Adresse und Port-Nummer mitteilen, die dem Nutzerprofil zuletzt zugeteilt war.

Lesen Sie auch Was ist los bei der Polizei? Deutschland hat mindestens ein Hessen-Problem

Lesen Sie auch Streit um Kennzeichnung Twitter braucht ein demokratisch legitimiertes Regelwerk

Lesen Sie auch Hackerangriff Ein Warnschuss, der zeigt, wie schlimm es werden kann

Anzeige

Aus Sicht von Bundesjustizministerin Christine Lambrecht (SPD) ist das Gesetzespaket gegen Hass und Hetze „für die Verteidigung unserer Demokratie und unseres Rechtsstaats von zentraler Bedeutung“. Es diene dem Schutz aller Menschen, die von Rassisten und Rechtsextremisten bedroht und diffamiert würden. „Wir senden damit das ganz klare Signal aus, dass wir diese Taten nicht hinnehmen und uns mit Nachdruck dagegen zur Wehr setzen“, betont Lambrecht auf der Internetseite des Bundesjustizministeriums.

Der Mord am Kasseler Regierungspräsidenten Walter Lübcke (CDU), der antisemitische Terroranschlag in Halle, die rassistischen Morde in Hanau und die hohe Zahl weiterer rechtsextremistischer Gewalttaten haben Lambrecht zufolge gezeigt, „wie dringend nötig unser Gesetzespaket ist, um die Spirale von Hass und Gewalt zu durchbrechen“. Damit erhalte die Justiz die notwendigen Instrumente, um gegen Hasskriminalität endlich konsequent vorzugehen. „Dafür verschärfen wir das Strafrecht deutlich. Mit der Meldepflicht der sozialen Netzwerke an das Bundeskriminalamt sorgen wir dafür, dass Ermittlungen schnell beginnen“, erklärt die Ministerin. Wer hetze und drohe, müsse mit Anklagen und Verurteilungen rechnen.

Lesen Sie auch Verfassungsschutzbericht Ganz rechts tut sich ein Abgrund auf

Polizei und Staatsanwaltschaft in Hamburg rechnen bei der Bearbeitung von Straftaten nach dem geplanten Gesetz gegen Hasskriminalität im Netz intern offenbar mit zahlreichen zusätzlichen Planstellen. Im Landeskriminalamt (LKA) kursiert nach Informationen des NDR-„Hamburg-Journals“ eine Analyse, wonach von mehr als 50 Polizistinnen und Polizisten sowie Polizeiangestellten ausgegangen werden müsse. Die Generalstaatsanwaltschaft Hamburg rechnet mit fünf bis sechs zusätzlichen Ermittlerinnen und Ermittlern, die die Fälle bearbeiten müssten.

Anzeige

Das LKA Hamburg geht von bis zu 4000 zusätzlichen Straftaten jährlich aus. Die Personalkosten sollen nach ersten Berechnungen jährlich vier Millionen Euro betragen, plus einmalig 15 Millionen Euro für die Anschaffung moderner IT-Ausrüstung. Wie viele neue Staatsanwältinnen und Staatsanwälte der Justiz vom Finanzsenator genehmigt werden, ist derzeit unklar. Aus der Justizbehörde heißt es, dass eine Aufstockung des Personals notwendig sei.","Martin Fischer, Jana Werner",1594984521,"Hamburg,Hasskriminalität",welt
"„Wir wollen jedem zeigen, wie normal es ist, dass wir uns lieben“","Pernille Harder eilt mit dem VfL Wolfsburg von Erfolg zu Erfolg. In England triumphierte Magdalena Eriksson mit dem FC Chelsea in der Liga. Beide vereint die Liebe zum Fußball – und zueinander.

Frage: Glauben Sie, dass es eines Tages solch ein Interview auch mit einem männlichen Fußball-Paar gibt?

Pernille Harder: Ich hoffe es sehr. Es war lange nicht möglich, und ich befürchte, dass es auch noch eine Weile dauern wird. Aber vielleicht ändern sich die Zeiten.

Magdalena Eriksson: Der erste Schritt wäre, dass sich die Kultur im Männerfußball ändert: in den Mannschaften, in den Klubs, bei den Fans. Es wäre einfach: Man müsste das Thema schon in Jugendmannschaften anders behandeln – nicht totschweigen. Die Trainer müssten es offen ansprechen und Akzeptanz ausstrahlen.

Frage: Sie hatten sich mit Dänemark nicht für die WM 2019 qualifiziert und saßen im Schweden-Trikot ihrer Freundin im Fanblock. Nach einem Spiel entstand ein Foto, auf dem Sie sich küssen. Plötzlich wusste die ganze Welt von Ihrer Liebe …",Robert Schreier,1594984163,"Sport,Lesbische Spielerinnen",welt
Ab 40 mit leichtem Übergewicht sollten Sie Ihre Leber checken lassen,,Nicole Fuchs-Wiecha,1594984155,"Wissenschaft,Gefährliche Fettleber",welt
„Wir werden mit Dreck beschmissen“,"Anzeige

WELT: Herr Radek, in Hessen sind Polizisten in einen Skandal um rechtsextreme Drohmails verwickelt; in Stuttgart steht die Polizei unter Rassismusverdacht, weil sie die Abstammung von Tatverdächtigen erforscht. Was ist denn da los bei der Polizei?

Jörg Radek: Laut Umfragen vertrauen 86 Prozent der Deutschen der Polizei. Viele Kollegen fragen sich deshalb zunehmend verunsichert, woher dann dieses Misstrauen von Politik und Medien gegen ihre Arbeit kommt. In Stuttgart hatte der Oberbürgermeister selbst unmittelbar nach der Krawallnacht gefordert, die Herkunft der mutmaßlichen Täter aufzuklären. Trotzdem wurde das Vorgehen der Beamten skandalisiert.

Lesen Sie auch „Stammbaumforschung“ Das Wort, das nie fiel – und was Kretschmann damit zu tun hat

Der Eindruck der Polizisten ist: Wir werden mit Dreck beschmissen, und anschließend müssen wir uns den Vorwurf gefallen lassen: Ihr seid ja total schmutzig. Ich bin im 42. Dienstjahr, aber so ein Jahr wie dieses habe ich noch nicht erlebt.

Jörg Radek ist Hauptkommissar und stellvertretender Bundesvorsitzender der Gewerkschaft der Polizei Quelle: pa/dpa/Kay Nietfeld

Anzeige

WELT: Was meinen Sie damit?

Radek: Eine gewaltige Einsatzbelastung der Kollegen trifft auf eine populistische Art, wie diese Einsätze bewertet werden. Da fehlt die Wertschätzung. Die SPD-Bundesvorsitzende Saskia Esken importiert mal eben so den Rassismus-Vorwurf aus den USA nach Deutschland, ohne zu wissen, wie die Polizei Personal gewinnt und ausbildet. Dieselbe Vorsitzende hatte nach den Silvesterausschreitungen von Leipzig-Connewitz die Einsatztaktik infrage gestellt.

Als die Bundespolizei Anfang Juni im Saarland bei einer Grenzkontrolle ein Einreiseverbot gegen einen Franzosen verhängte, forderte der Saarbrücker CDU-Oberbürgermeister Uwe Conradt empört eine Entschuldigung. Es stellte sich heraus, dass die Kollegen nach Recht und Gesetz gehandelt hatten, doch der OB kam seinerseits aber nicht auf die Idee, sich zu entschuldigen. Der Vorwurf blieb einfach im Raum stehen.

Infolge der Tötung von George Floyd in den USA wurden auch hierzulande Rassismusvorwürfe gegen die Polizei laut. Hier eine Demo von Black Lives Matter in Berlin Anfang Juni Quelle: pa/Eventpress/Eventpress Porikys

Anzeige

WELT: Die Beamten sollen einen älteren Franzosen aus einem Kiosk gezerrt und am Boden fixiert haben. Es existiert ein Video.

Radek: Nach unseren Informationen hat sich der Mann zunächst der Kontrolle entziehen wollen, keinen zulässigen Einreisegrund nennen können und keinen Mund-Nase-Schutz getragen. Die Einreiseverweigerung ignorierte er, um Lotto zu spielen. Als ihn die Beamten aus dem Kiosk führten, ließ er sich vor der Tür zu Boden fallen. Ohne Hintergründe des Vorfalls zu kennen, hat der Oberbürgermeister den Vorfall politisiert und skandalisiert.

An dieser Stelle finden Sie Inhalte aus YouTube Um mit Inhalten aus YouTube und anderen sozialen Netzwerken zu interagieren oder diese darzustellen, brauchen wir Ihre Zustimmung. Soziale Netzwerke aktivieren

WELT: Das klingt, als sehe sich die Polizei vor allem als Ziel ungerechter und unfairer Kritik von Politik und Medien. Wie passt diese Opferrolle zu den Geschehnissen rund um Todesdrohungen in Hessen?

Anzeige

Radek: Diese Vorfälle sind nicht vergleichbar. Es ist abscheulich, was da passiert ist. Wer das Polizei-Datensystem missbraucht, muss identifiziert, rechtsstaatlich verfolgt und aus der Polizei entfernt werden. Die Kollegen vor Ort berichten mir, dass der interne Ermittlungsdruck unglaublich groß ist. Es geht schließlich auch um das Berufsethos.

WELT: Wenn so intensiv ermittelt wird, wieso kommt dann seit zwei Jahren nichts dabei heraus?

Radek: Die hessische Polizei hat reagiert. Es wurde eine 60-köpfige Kommission zur Ermittlung gebildet. Es gab Durchsuchungen und Sicherstellungen. Die rechtstreuen Kollegen wissen, dass der Sachverhalt ihrem Image schadet, und wollen ihn aufgeklärt wissen. Schon jetzt ist massiver Schaden am Ruf der Polizei angerichtet und Vertrauen zerstört.

Lesen Sie auch Was ist los bei der Polizei? Deutschland hat mindestens ein Hessen-Problem

WELT: Wie schwer kann die Tätersuche in einem überschaubaren Polizeirevier sein? Gilt eine Omertà, schwärzt man bei der Polizei Kollegen nicht an, egal welcher Gesinnung sie sind?

Radek: Das will ich für diesen Fall ausschließen. Aber es ist richtig und wichtig, dass jetzt ein Sonderermittler eingesetzt wurde, der einen Blick von außen mitbringt, ganz andere Fragen stellt und unvoreingenommen ist.

WELT: Die Polizei-Datenbank Polas wurde in Hessen offenbar häufiger auch privat genutzt. Als Helene Fischer 2018 in Frankfurt auftrat, gab es 83 Zugriffe auf ihre Daten. Ist das bundesweit Usus?

Radek: Solche Abfragen sind generell nicht erlaubt. Das informelle Recht ist für uns Polizisten ein hohes Gut. Ungerechtfertigte Zugriffe werden disziplinarisch geahndet.

Anzeige

WELT: Wenn sie entdeckt werden. In Hessen wird erst seit 2018 kontrolliert, und auch nur jede 200. Abfrage. Wird bundesweit ebenfalls so selten oder gar nicht hingeschaut?

Radek: Jedes Land hat seine eigenen Systeme und Abläufe. In der Alltagshektik ist aber kaum zu verhindern, dass ein Beamter zum Einsatz sprinten muss und sich nicht aus dem System ausloggt. Dann könnten theoretisch andere seine Kennung nutzen für eine unerlaubte Abfrage. Nötig sind daher praxistaugliche Systeme, die Missbrauch verhindern, beispielsweise durch Fingerabdruckkennung oder ein Passwort-Management.

Rechtsextreme Drohbriefe an Kabarettistin verschickt In Hessen hat es erneut eine unberechtigte Datenabfrage auf einem Polizeirechner gegeben. Es gehe um persönliche Daten der Kabarettistin Idil Baydar, berichtet die „Frankfurter Rundschau“. Sie soll schon länger rechtsextreme Drohbriefe erhalten. Quelle: WELT

WELT: Mittlerweile schließt auch Hessens Innenminister Peter Beuth (CDU) die Existenz rechtsradikaler Netzwerke bei der Polizei nicht mehr aus. Wie groß ist die Gefahr – in Hessen und anderswo?

Radek: Die Fälle in Hessen sind extrem, das lässt sich nicht leugnen. Sie müssen rechtsstaatlich aufgeklärt und abgeschlossen werden. Aber ich halte es für gefährlich, für andere Behörden etwas herbeizureden. Polizei ist Ländersache und jede Polizei unterschiedlich organisiert.

WELT: Wäre die von Bundesinnenminister Horst Seehofer (CSU) abgesagte Rassismus-Studie bei der Polizei nicht doch sinnvoll für eine valide Datenlage?

Radek: Die Polizei ist Bestandteil dieser Gesellschaft. Daher muss die Frage einer solchen Studie lauten, wie rassistisch die deutsche Gesellschaft ist, nicht allein die Polizei. Gleichwohl übt die Polizei das staatliche Gewaltmonopol aus. Dafür wird sie zu Recht vom Parlament und den Gerichten kontrolliert.

Integrationsbeauftragte will Studie zu Rassismus in der Polizei, Seehofer will sie nicht Soll es eine Studie zum so genannten Racial Profiling geben? Die Polizeiverbände und die Integrationsbeauftragte wollen sie, der Bundesinnenminister will sie nicht. Nahegelegt worden war sie von der Kommission gegen Rassismus und Intoleranz des Europarates. Quelle: WELT

WELT: Sie sprachen vor einem Jahr von einer „Schieflage“ und Sympathien in der Polizei für das rechtsnationale Parteienspektrum. Hält die Tendenz an?

Radek: Es ist richtig, dass es mehrere Mandats- und Funktionsträger der AfD gibt, die Polizisten sind. Seit Teile der AfD unter Beobachtung des Verfassungsschutzes stehen, ist für mich ganz klar: Polizisten müssen sich entscheiden. Folgen sie ihrem Amtseid, dann müssen sie ihr Mandat niederlegen, oder sie müssen die Polizei verlassen. Diesen Extremismus dürfen wir in der Polizei nicht dulden. Wir brauchen eine klare Haltung als Verfassungspatrioten.

Lesen Sie auch AfD Heimat für viele Polizisten und Soldaten

Anzeige

WELT: Entweder AfD oder Polizist – wird damit das Problem beseitigt?

Radek: Das Augenmerk muss auch stärker auf Sympathisanten innerhalb der Polizei gerichtet werden, damit Beamte nicht zu AfD-Wählern oder gar Mandatsträgern werden. Die Kollegen brauchen dafür einen Raum, wo sie über Erlebtes sprechen und es verarbeiten können, aktuell beispielsweise über Hygiene-Demos oder den Trend, dass sich bei Einsätzen immer öfter Umstehende solidarisieren und die Nazi-Keule schwingen – und das, obwohl die Beamten nur Recht und Ordnung durchsetzen. Polizeiarbeit ist jedoch konfliktträchtig. In bestimmten Bereichen unserer Gesellschaft wird nicht mehr verstanden, dass meine Kolleginnen und Kollegen nur ihre Aufgabe erfüllen.

Lesen Sie auch Berlin „Mit diesem Gesetz werden Polizisten zum Freiwild“

WELT: In Berlin soll künftig ein unabhängiger Polizeibeauftragter Konflikte zwischen Bürgern und Behörden schlichten. Warum lehnen Sie diesen Ansatz ab?

Radek: Das ist für mich eine Schattenjustiz. Die Kontrolle der Polizei findet entweder durch unabhängige Gerichte statt oder durch das Parlament. Ebenso wie eine Rassismus-Studie trägt der Beauftragte nicht dazu bei, dass der Polizei mehr Vertrauen entgegengebracht wird.",Hannelore Crolly,1594983452,"Deutschland,Polizei beklagt Skandalisierung",welt
Hai zerrt Zehnjährigen von Boot – Vater rettet seinen Sohn,"Es sind Szenen wie aus einem Film: Als ein Vater mit seinem Sohn vor der Küste Tasmaniens angeln will, springt ein Hai aus dem Wasser und zieht den Jungen vom Boot ins Wasser. Dank der mutigen Rettung des Vaters überlebt er den Angriff mit Bisswunden am Kopf.

Anzeige

Vor der Küste Tasmaniens hat ein Hai ein Fischerboot attackiert und einen zehnjährigen Jungen ins Wasser gezerrt – mit einem mutigen Einsatz konnte der Vater seinen Sohn jedoch aus den Fängen des Raubtiers retten.

Nach Angaben der australischen Behörden ereignete sich der Angriff am Freitag, als der Junge mit seinem Vater und zwei weiteren Männern fünf Kilometer vor der Küste des Inselstaates mit einem Fischerboot unterwegs war.

An dieser Stelle finden Sie Inhalte aus Facebook Um mit Inhalten aus Facebook und anderen sozialen Netzwerken zu interagieren oder diese darzustellen, brauchen wir Ihre Zustimmung. Soziale Netzwerke aktivieren

Der Junge trug eine Schwimmweste. Plötzlich griff der Hai an, sprang aus dem Wasser, packte den Zehnjährigen und zerrte ihn von Bord, so Taucher Ben Allen zu ABC Radio Hobart.

Anzeige

Der entsetzte Vater sprang hinterher. Es gelang ihm, den Raubfisch in die Flucht zu schlagen. Der Junge erlitt Bisswunden am Kopf, an den Armen und der Brust und wurde in ein Krankenhaus gebracht. Sein Zustand sei stabil, teilten die Behörden weiter mit.

Lesen Sie auch Heldengeschichten Die Reparatur der Ozeane. Eine Recherchereise um die Welt

Allen glaubt, dass der Hai „im Fressmodus“ gewesen sein könnte, da eine Robbenkolonie in der Nähe sei. Die Annahme, es könnte sich um einen Weißen Hai gehandelt haben, sei nicht bestätigt.

Tasmanien ist die größte australische Insel und liegt rund 300 Kilometer südlich von Melbourne im Südosten des Kontinents. Angriffe von Haien sind dort selten. Australien ist jedoch weltweit das Land mit den meisten Haiangriffen. Allein in diesem Jahr kamen bisher fünf Menschen bei solchen Attacken ums Leben. Erst vergangene Woche wurde ein 15-jähriger Surfer vor der Ostküste Australiens getötet.",'Berthold Seewald',1594983256,"Panorama,Tasmanien",welt
