title,text,author,published,tags,source
Im BVB-Trikot macht Schalkes Matondo fleißig Klimmzüge,"Anzeige

Durch ein Foto im Trikot seines beim Erzrivalen Borussia Dortmund spielenden Freundes Jadon Sancho hat sich Jungstar Rabbi Matondo viel Ärger bei seinem Arbeitgeber Schalke 04 eingebrockt.

„Ich habe Rabbi Matondo am Telefon mehr als deutlich gemacht, was ich von so einer unüberlegten Aktion halte“, sagte Sportvorstand Jochen Schneider zu Sky: „Er ist zwar erst 19 Jahre alt, aber das darf ihm trotzdem nicht passieren.“

Das über die sozialen Medien verbreitete Foto zeigt den Waliser offenbar beim Fitnesstraining in Cardiff. Es führte bereits zu heftigen Protesten der Schalker Fans in den sozialen Netzwerken. Unklar ist jedoch, wann die Aufnahme im BVB-Trikot entstanden ist. Matondo spielt seit Januar 2019 für Schalke.

An dieser Stelle finden Sie Inhalte aus Twitter Um mit Inhalten aus Twitter und anderen sozialen Netzwerken zu interagieren oder diese darzustellen, brauchen wir Ihre Zustimmung. Soziale Netzwerke aktivieren

Anzeige

Schneider jedenfalls forderte, Matondo müsse sich entschuldigen. Zudem habe man ihm „klar gesagt, dass er auf und neben dem Platz die passende Reaktion auf sein Fehlverhalten zeigen muss“.

Matondo sieht BVB-Star als Vorbild





Unter dem jüngsten Foto auf Matondos Instagram-Account ließen einige Fans ihrer Wut freien Lauf. Ein paar Auszüge: „Zurück nach Manchester mit dir du Vogel“ oder „So einer hat kein Schalke-Trikot verdient“.

Anzeige

Vor seinem Wechsel nach Gelsenkirchen – für rund zehn Millionen Euro – spielte Matondo in der Jugend von Manchester City, gemeinsam mit Sancho. Beide wagten als Teenager den Schritt nach Deutschland.

Lesen Sie auch Krise auf allen Ebenen „Das darf sich kein Verein erlauben – schon gar nicht Schalke 04“

Matondo hatte in der Vergangenheit schon mehrfach betont, dass er Sancho als Vorbild sehe und davon träume, in der Bundesliga einen ähnlichen Weg zu gehen wie der 20 Jahre alte englische Nationalspieler des BVB.

Trotz seines enormen Tempos wartet Matondo allerdings noch auf seinen Durchbruch in der Bundesliga. Seit seinem Wechsel aus Manchester kommt er bislang auf 29 Bundesliga-Spiele für Schalke; dabei gelangen ihm zwei Treffer. Bei Fans und Verantwortlichen ist Matondo nun mehr denn je in der Bringschuld.","'Jörg Althoff', 'Oliver Müller', 'Torsten Rumpf'",1594744786,"Bundesliga,„Darf nicht passieren“",welt
Kanzleramt erwägt lokale Ausreiseverbote aus Corona-Hotspots,,,1594744016,"Deutschland,Um zweite Welle zu verhindern",welt
Jetzt bricht im Polizeiskandal von Hessen die Schlammschlacht los,"Der Skandal um unerlaubte Datenabfragen bei der Polizei in Hessen rückt immer näher an die Politik heran. Ein Vertrauter des Innenministers trat jetzt zurück. Doch damit ist die Frage der Verantwortung längst nicht geklärt: Wer hat seinen Laden nicht im Griff?

Hessens Landespolizeipräsident Udo Münch tritt wegen der Affäre um rechtsextreme Drohmails zurück. Münch habe um seine Versetzung in den einstweiligen Ruhestand gebeten, teilte Innenminister Peter Beuth (CDU) in Wiesbaden mit.

„Udo Münch hat mich um seine Versetzung in den einstweiligen Ruhestand gebeten“

Innenminister vs. LKA

Anzeige

Der Polizeiskandal von Wiesbaden weitet sich immer weiter aus: Der hessische Innenminister und das Landeskriminalamt (LKA) liefern sich mittlerweise vor den Augen der Öffentlichkeit eine gnadenlose Schlammschlacht, die die Sicherheitsstrukturen des Landes Hessen zu schwächen droht.

Es gab sogar bereits erste personelle Konsequenzen: Landespolizeipräsident Udo Münch, ein enger Vertrauter von Innenminister Peter Beuth und Ministerpräsident Volker Bouffier (beide CDU), hat um seine Entlassung gebeten. Damit steht die Landespolizei mitten in einer ihrer größten Krisen zumindest vorübergehend führungslos da. Münch hatte das Präsidium zehn Jahre lang geführt und befindet sich nun im einstweiligen Ruhestand.

Auslöser für das Entlassungsgesuch des 64-Jährigen, das Innenminister Beuth am Morgen annahm, war eine weitere Zuspitzung der Drohmail-Affäre. Der Innenminister musste bei einem eilig einberufenen Presseauftritt notgedrungen heikle Medienberichte bestätigen. Demnach haben nicht allein die Linke-Politikerin Janine Wissler und die Frankfurter Rechtsanwältin Seda Basay-Yildiz Todesdrohungen per Mail erhalten, nachdem persönliche Daten von hessischen Polizeicomputern aus abgefragt worden waren. Auch eine weitere „Person des öffentlichen Lebens“ sei in ähnlicher Weise betroffen, gestand Beuth ein. Der Minister nannte zwar keinen Namen; es handelt sich aber um die Berliner Schauspielerin und Kabarettistin Idil Baydar.

Rechtsextreme Drohbriefe an Kabarettistin verschickt In Hessen hat es erneut eine unberechtigte Datenabfrage auf einem Polizeirechner gegeben. Es gehe um persönliche Daten der Kabarettistin Idil Baydar, berichtet die „Frankfurter Rundschau“. Sie soll schon länger rechtsextreme Drohbriefe erhalten. Quelle: WELT

Anzeige

Die Daten wurden laut Beuth im März 2019 von Unbekannten von einem Wiesbadener Polizeicomputer abgefragt, ohne dass es dafür einen nachvollziehbaren Anlass gab. Der Beamte, mit dessen Zugangsdaten die Abfrage gestartet wurde, werde als „Zeuge“ vernommen, sagte Beuth. Laut der Frankfurter Staatsanwaltschaft waren die Drohmails an Baydar in „ähnlichem Duktus“ gehalten wie die vorhergehenden Schmähungen und Todesandrohungen. Baydar erhält seit Anfang 2019 schwere Drohungen, von denen zumindest eine – wie im Fall von Politikerin Wissler und Anwältin Basay-Yildiz – mit dem Absender „NSU 2.0“ unterzeichnet war.

Im ARD-„Mittagsmagazin“ kritisierte Baydar wenige Stunden vor Beuths Pressekonferenz die hessische Polizei scharf. Sie habe erst am Tag zuvor durch einen Journalisten erfahren, dass es mehr als ein Jahr zuvor eine Datenbankabfrage gegeben hatte. „Das trägt auch nicht gerade zur Vertrauensbildung bei“, sagte sie und zweifelte sogar daran, ob sich die Polizei sonderlich um Aufklärung bemühen werde, sollte ihr etwas zustoßen.

Lesen Sie auch Was ist los bei der Polizei? Deutschland hat mindestens ein Hessen-Problem

Die Abfrage von Wisslers Frankfurter Wohnadresse und Handynummer war im Februar ebenfalls von Wiesbaden aus erfolgt. Von beiden Fällen – Baydar wie Basay – hat Innenminister Beuth nach eigener Darstellung erst in der vergangenen Woche erfahren. Er gerät durch den Polizeiskandal immer stärker unter Druck. Dabei galt der 52-Jährige eigentlich als einer der Kronprinzen in der hessischen CDU und heißer Anwärter auf den Ministerpräsidentenposten nach einem Ende der Amtszeit von Bouffier. Doch Beuth machte beim Versuch, die Missstände abzustellen und aufzuarbeiten, keine gute Figur. Die Opposition verlangt bereits eine Sondersitzung des Innenausschusses im Landtag und Akteneinsicht.

Anzeige

Vor allem Beuths Attacke gegen das Landeskriminalamt, dem er bei einem Auftritt Ende vergangener Woche stümperhaftes Vorgehen und „mangelnde Sensibilität“ vorgeworfen hatte, sorgt intern für großen Ärger und eine gestörte Zusammenarbeit zwischen wichtigen Sicherheitsbehörden des Landes. Beuth hatte sich vor der Presse verbittert darüber beklagt, dass er viel zu spät über die Wissler-Datenabfrage informiert worden sei, nämlich erst zwei Tage zuvor.

Doch das LKA unter Chefin Sabine Thurau verteidigte sich: Das Landespolizeipräsidium sei sehr wohl bereits im März informiert worden, dazu existierten sogar Protokollvermerke. Soll heißen: Wenn Landespolizeichef Münch als enger Vertrauter Beuths seinen eigenen Dienstherrn nicht auf dem Laufenden halte, dann solle der Innenminister lieber erst mal vor der eigenen Tür kehren. Offenkundig habe er seinen eigenen Laden nicht im Griff.

V. l.: Der zurückgetretene hessische Polizeipräsident Udo Münch, Innenminister Peter Beuth (CDU) und LKA-Präsidentin Sabine Thurau (Foto vom Februar) Quelle: dpa/Arne Dedert

In seinem jüngsten Presseauftritt versuchte Beuth nun, wieder Richtung Thurau und LKA zurückzuschlagen. Seinen ausscheidenden Polizeipräsidenten lobte er in den höchsten Tönen als „redlichen und verbindlichen Mann, der immer zu seinem Wort gestanden hat“. Hessen verliere seinen obersten Schutzmann, der große Verdienste erworben habe, nun aber die Verantwortung übernehme für Vorfälle, „die er nicht allein zu verantworten hat“. Münch habe die im März mündlich übermittelte Information zur Wissler-Abfrage „nicht bewusst wahrgenommen“; daher habe er dem Innenministerium auch nichts wissentlich vorenthalten. Umso ehrenhafter sei seine Entscheidung zum Rückzug.

Anzeige

Das eigentliche Problem, so stellte es Beuth dar, liege aber im „Kommunikationsverhalten“. Beuth deutete zwischen den Zeilen sogar mögliche Schummeleien beim LKA an: Die bisherige Darstellung der Behörde zur Informationsweitergabe bedürfe „der weiteren Aufklärung“. Es gebe nur „Gedächtnisprotokolle, die erst letzte Woche erstellt wurden“. Und selbst wenn im März tatsächlich mündlich berichtet worden sei: Bis Anfang vergangener Woche habe es keine weiteren und schon gar keine schriftlichen Mitteilungen gegeben – und das, obwohl er selbst fortlaufend Informationen im LKA angefordert habe. Beuth wiederholte damit seinen Vorwurf an die Adresse des Kriminalamts und Thurau: „Diese Meldepraxis ist nicht akzeptabel. Die erforderliche Sensibilität wurde nicht erbracht.“ Damit liegt der Ball wieder im Feld der LKA-Chefin.

„Das grundsätzliche Problem ist die fehlende beziehungsweise marginale Kontrolle der Polizei“, sagt der Datenexperte und Journalist für IT-Sicherheit, Moritz Tremmel. Beim IT-Portal Golem beschäftigt er sich mit Datenschutz, Überwachung und Netzpolitik. Rechtsverstöße durch die Polizei würden nur selten aufgedeckt und noch seltener geahndet. Zwar sei es zu begrüßen, dass Hessen wegen der Datenbankabfrage zu Basay-Yildiz vor gut zwei Jahren überhaupt eine Kontrolle eingeführt habe. Aber dabei handele es sich lediglich um Stichproben. „Dass eine Kontrolle nur bei jeder 200. Abfrage stattfindet und bei 199 nicht, kann einen nur fassungslos zurücklassen.“

Hessens Polizeichef Udo Münch wegen Drohmail-Affäre zurückgetreten Hessens Landespolizeichef Udo Münch ist nach einem weiteren Fall von rechtsextremen Drohmails im Zusammenhang mit hessischen Ermittlern zurückgetreten. Das gab Hessens Innenminister Peter Beuth bekannt. Quelle: WELT

Die 45-jährige Kabarettistin Idil Baydar wurde unter anderem durch ihren YouTube-Kanal bekannt. Ihr Bühnenprogramm beschäftigt sich stark mit Themen wie Rassismus, Diskriminierung und Migration. Schon seit Anfang 2019 erhielt sie Schmäh- und Drohschreiben in rechtsextremistischem Duktus. Ein Bezug zu Hessen entstand Mitte November vorigen Jahres, als sie im Historischen Museum in Frankfurt bei einer Gedenkfeier mit dem Titel „Möllner Rede im Exil“ sprechen sollte. Damit sollte an die Opfer des rassistischen Brandanschlags 1992 von Mölln erinnert werden.

Baydar war als Hauptrednerin eingeplant und erhielt noch vor dem Auftritt Morddrohungen, wie die Veranstalter bekannt gaben. Schon damals thematisierte Baydar ihr mangelndes Vertrauen in die Sicherheitsbehörden. Auch jetzt habe sie nicht den Eindruck, adäquat geschützt zu werden: „Ich habe kein Vertrauen mehr in die Behörden und glaube auch nicht an eine tatsächliche Aufklärung der Geschehnisse.“",Hannelore Crolly,1594742726,"Deutschland,Innenminister vs. LKA",welt
Mini-Flugzeugträger brennt – im Hafen von San Diego droht die Katastrophe,"Seit zwei Tagen brennt im Hafen von San Diego ein Kriegsschiff der US-Marine. Jetzt droht der Flugzeugträger im Hafen zu versinken. Es wäre einer der größten Verluste in der Geschichte der US-Marine. Ein brisanter Umstand förderte die Ausbreitung des Feuers.

Über San Diego war eine große, dunkle Rauchwolke zu sehen. Der Brand war am Sonntag auf der „USS Bonhomme Richard“ gemeldet worden, einem 255 Meter langen sogenannten amphibischen Angriffsschiff, das für Wartungsarbeiten im Hafen lag.

Anzeige

Das US-Marineschiff Bonhomme Richard hat eine Besonderheit. Es wird zur amphibischen Kriegsführung eingesetzt. Auf dem Oberdeck können Hubschrauber und Senkrechtstarter starten und landen. Im Inneren des Schiffes transportiert es zusätzlich Landungsboote, die aus gefluteten Decks im Wasser herausfahren können. Jetzt droht dem 23 Jahre alten Super-Mini-Flugzeugträger durch ein Feuer der Untergang im Heimathafen von San Diego. Es wäre einer der größten Verluste in der Geschichte der US-Marine.

Am Sonntag Vormittag um 08:30 Uhr Ortszeit wurde das Feuer nach einer Explosion in einem unteren Frachtdeck des Kriegsschiffs bemerkt. Die genaue Ursache und die Details sind unbekannt. Aber selbst 48 Stunden nach dem Alarm ist das Megafeuer trotz des Einsatzes von Hunderten von Feuerwehrkräften, Löschhubschraubern und -booten sowie Spezialkräften nicht komplett besiegt.

Lesen Sie auch Ex-Navy-Seals Hilfe per Superyacht – die geheime Spezialtruppe des Google-Gründers

Experten gehen davon aus, dass die enorme Hitze im Inneren des Schiffes von angeblich über 1000 Grad Celsius wohl die Stahlkonstruktion schwer beschädigt hat. Das vom US-Rüstungskonzern Northrop Grumman gebaute Schiff im Wert von schätzungsweise einer dreiviertel Milliarde Dollar sei wohl zerstört.

Bei dem Feuer auf dem US-Kriegsschiff sind nach Angaben der Marine mehrere Soldaten verletzt worden Quelle: dpa-infocom GmbH

Anzeige

Die US-Nachrichtenagentur AP befürchtet sogar das Schlimmste: Das 255 Meter lange Schiff könnte noch brennend untergehen und Millionen Liter Treibstoff an Bord würden zu einer Umweltkatastrophe führen. Die US-Küstenwache habe bereits Ölsäuberungsmannschaften für den Notfall angeheuert.

Einer der schlimmsten Verluste der Geschichte droht

Der Mini-Flugzeugträger war für rund zweijährige Wartungs- und Modernisierungsarbeiten mit Gesamtkosten über 250 Millionen Dollar in seinem Heimathafen. So soll das Schiff künftig den neuen US-Kampfjet F-35B mit seinen Senkrechtflug-Eigenschaften transportieren.

Das Schiff liegt für zweijährige Wartungsarbeiten in seinem Heimathafen in San Diego Quelle: AFP/CHRISTINA ROSS

Während der Wartungsarbeiten waren nur 160 statt der sonst üblichen 1.000 Personen an Bord. Daher gibt es trotz des Megafeuers zum Glück keine Todesopfer. Mindestens 59 Personen, darunter 36 Besatzungsmitglieder und 23 Zivilisten, wurden mit Brandwunden, Rauchvergiftungen und leichten Verletzungen behandelt.

Das Feuerlöschsystem wurde gerade gewartet - so konnte sich das Feuer ausbreiten Quelle: AP/Denis Poroy

Anzeige

Auf der einen Seite war die geringe Zahl von Menschen an Bord ein Vorteil. Auf der anderen Seite verweisen Experten darauf, dass ein Kriegsschiff mit kompletter Besatzung darauf trainiert ist, Brände einzudämmen und zu löschen.

Lesen Sie auch ECRS-Technologie Superradar des Eurofighters bringt Deutschland zurück an die Weltspitze

Das Feuer konnte sich wohl umfassend ausbreiten, weil nach Angaben der US-Militärpublikation „Stars and Stripes“ das Feuerlöschsysstem gerade gewartet wurde und nicht einsatzbereit war. Das Feuerlöschsystem des Kriegsschiffs arbeitet vor allem mit dem die Ozonschicht schädigenden Halon-Gas.

Sollte das US-Kriegsschiff sinken, wäre es eine der schlimmsten Schiffsverluste in der US-Geschichte Quelle: REUTERS

Dabei wird die Ausbreitung eines Brandes durch den Entzug von Sauerstoff gestoppt. Halon-Löschanlagen sind in der EU seit 2004 mit wenigen Ausnahmen wie bei den Militärs oder der Luftfahrt verboten.

Lesen Sie auch Rüstungsindustrie Plötzlich werden Deutschlands Panzer zum Ladenhüter

Anzeige

Sollte der Mini-Flugzeugträger Bonhomme Richard tatsächlich komplett zerstört sein, wäre es nach Ansicht von „Stars and Stripes“ nach der Größe und Tonnage einer der schlimmsten Schiffsverluste in der Geschichte der US-Marine.

Der Mini-Flugzeugträger, der 1997 seinen Stapellauf hatte und im Herbst 1998 in Dienst gestellt wurde, ist 257 Meter lang und hat eine Wasserverdrängung von etwa 40.000 Tonnen. Der US-Flugzeugträger Lexington, der im Zweiten Weltkrieg 1942 in der Schlacht in der Korallensee vor Australien von den Japanern attackiert wurde und letztlich sank, war 270 Meter lang und etwa 42.000 Tonnen schwer.",Gerhard Hegmann,1594742672,"Wirtschaft,Kriegsschiff der US-Marine",welt
Corona-Lockerungen in Sicht,"Anzeige

Wer aus einem Risikogebiet wie der Türkei nach Nordrhein-Westfalen einreist und eine Quarantäne durch einen Corona-Test umgehen möchte, muss sich auf Kosten einstellen. „Es ist geplant, dass die zu testenden Urlauber anteilig für die Testungen aufkommen“, teilte ein Sprecher des NRW-Gesundheitsministeriums am 14. Juli mit. „Weitere Details, wie zum Beispiel eine unbürokratische und einfach handhabbare Gebührenordnung, werden derzeit erarbeitet.“ Das Land Österreich hat unterdessen seine Einreisebeschränkungen für Menschen aus dem Kreis Gütersloh aufgehoben. Auch die Reisewarnung für ganz NRW wurde aufgehoben.

Seit Ende Juni mussten Menschen aus dem Kreis Gütersloh ein ärztliches Attest für einen negativen Corona-Test vorweisen, wenn sie nach Österreich wollten. Umgekehrt galt für Österreicher eine „partielle Reisewarnung“ – NRW stand damit in einer Reihe unter anderem mit der chinesischen Provinz Hubei oder der italienischen Lombardei.

Lesen Sie auch Stressfaktor Corona So gefährlich wäre ein zweiter Lockdown

Wer wiederum aus Risikogebieten nach NRW zurückkehrt, muss laut der ab dem 15. Juli geltenden Corona-Einreiseverordnung in eine 14-tägige Quarantäne. Außer, man kann dem Gesundheitsamt ein ärztliches Attest vorlegen, „dass keine Anhaltspunkte für das Vorliegen einer Infektion mit dem Coronavirus Sars-CoV-2 vorhanden sind“. Weitere Ausnahmen gelten unter anderem für Durchreisende und „zwingende berufliche Angelegenheiten“.

Anzeige

Ausnahmen entfallen auch für Beschäftigte aus kritischen Infrastrukturen: Wer aus dem Sommerurlaub oder vom Verwandtschaftsbesuch aus Corona-Risikogebieten zurückkommt, muss jetzt ebenfalls einen negativen Test vorlegen. Damit werde ausreichenden Testkapazitäten Rechnung getragen, hatte das Gesundheitsministerium mitgeteilt.

Zukünftig 150 statt 50 Gäste erlaubt

Ab dem 15. Juli werden aber auch Regeln etwas gelockert. Unter anderem für Hochzeiten, Taufen oder Geburtstage: Für Feste aus besonderem Anlass dürfen 150 Gäste kommen, also deutlich mehr als die bisherigen 50. Das NRW-Kabinett hatte die Änderungen für die Corona-Schutzverordnung beschlossen, die in der neuen Version bis zum 11. August verlängert wurde.

Eine Änderung wird die Schausteller in NRW freuen: Bei den sogenannten temporären Freizeitparks, die zurzeit als Kirmes-Ersatz zum Beispiel in Düsseldorf oder Dortmund stehen, darf ab Mittwoch auch Alkohol ausgeschenkt werden. Wenn die örtlichen Behörden mitspielen. Im „Düsselland“ auf dem Messegelände der Landeshauptstadt hatte man darauf bereits gewartet – und will sofort loslegen.

Anzeige

Apropos loslegen: Während der Moerser Dönerfleischhersteller Öztas am Niederrhein nach einem Corona-Ausbruch und einer rund zweiwöchigen Schließung seit dem 14. Juli wieder produzieren darf, heißt es bei Tönnies weiter warten. Am Stammsitz des Konzerns in Rheda-Wiedenbrück sind die Beratungen der Behörden über die Wiederaufnahme des Schlacht- und Zerlegebetriebs in Deutschlands größtem Fleischwerk noch nicht abgeschlossen.

Lesen Sie auch Fleischersatzprodukte Liebe Fleischesser, es gibt wirklich Alternativen!

Seit Mitte Juni ruht die Produktion bei Tönnies, nachdem bei rund 1400 Mitarbeitern das Coronavirus nachgewiesen wurde. Die Schließungsverfügung der Stadt Rheda-Wiedenbrück endet am 17. Juli. Für einige Teile bei Tönnies hat die Stadt inzwischen die Schließungsverfügung aufgehoben.

Dazu gehören die Verwaltung, die technischen Dienste, Logistik und zuletzt die Konzerntochter Tillmann‘s Convenience. In diesem Bereich werden Lebensmittel jetzt nach Belieferung durch andere Schlachthäuser produziert. Der weitaus größte Teil der Produktion, also das Schlachten von täglich bis zu rund 25.000 Schweinen und deren Zerlegung, bleibt weiterhin untersagt.

Anzeige

Im Kreis Gütersloh war im Juni die Zahl der Corona-Infektionen durch einen massiven Ausbruch bei Tönnies in die Höhe geschnellt. Für die Menschen im Kreis hatte der Ausbruch Einschränkungen im Alltagsleben zur Folge, zudem reagierten viele Urlaubsregionen unter anderem mit Beherbergungsverboten für Corona-Hotspots.



","'Sven Flohr', 'Katja Mitic', 'Laura Wolf', 'Till-R. Stoldt'",1594741522,"Nordrhein-Westfalen,NRW",welt
Nun gibt es Zweifel am Corona-Schutz von Gesichtsvisieren,"Anzeige

Warnungen aus der Schweiz nähren Zweifel an dem Schutz von Gesichtsvisieren vor einer Ansteckung mit dem Coronavirus. Das Gesundheitsamt des nach Fläche größten Kantons Graubünden riet am Dienstag vor der alleinigen Verwendung von Plastikvisieren ab.

Bei der zuletzt gestiegenen Zahl an Infektionen in dem Kanton sei besonders auffällig, dass sich auch Personen, die Visiere trugen, angesteckt hätten. Eine Analyse der Fälle und der Übertragungswege habe gezeigt, dass die vor allem in der Gastronomie verbreiteten Visiere ungenügend Schutz vor einer Infektion böten. Sie vermittelten ein falsches Gefühl von Sicherheit, erklärte die Kantonsärztin Marina Jamnicki.

Das Gesundheitsamt des Kantons empfahl Betrieben, deren Mitarbeiter bisher Visiere nutzen, eine Überarbeitung ihrer Schutzkonzepte. Sollte ein Sicherheitsabstand von 1,5 Metern nicht eingehalten werden können, sei ein Mundschutz zu empfehlen.

Fragen zur Wiedereröffnungsstrategie von Hotels

Anzeige

Visiere sind zum Schutz vor dem Coronavirus umstritten. Die Warnung des an Italien und Österreich grenzenden Kantons wirft Fragen zur Wiedereröffnungsstrategie einiger Restaurants, Hotels und anderer vom Tourismus abhängiger Unternehmen in Europa auf.

Lesen Sie auch Brand Story Naturschutz Er schützt den Urwald mit alten Handys Anzeige

In Deutschland sind Visiere in mehreren Bundesländern erlaubt, teils unter Bedingungen, etwa in Niedersachsen, Rheinland-Pfalz und Hessen – auch auf Druck von Unternehmen, die sich davon eine Erleichterung für ihre Mitarbeiter erhoffen. Das Bundesgesundheitsministerium verweist an das Robert-Koch-Institut. Dieses empfiehlt der Tragen einer Mund-Nasen-Bedeckung, da mit ihr infektiöse Tröpfchen abgefangen werden könnten.

Visiere seien keine gleichwertige Alternative. Auch die Bundesanstalt für Arbeitsschutz und Arbeitsmedizin rät von Visieren ab, da sie nicht vor erregerhaltigen Aerosolen schützten. Diese könnten durch den Spalt zwischen Gesicht und Visier ungehindert zum Gesicht gelangen.","'Daniela Will', 'Birgit Herden', 'Martin Lewicki'",1594741361,"Wissenschaft,Schweizer Gesundheitsamt warnt",welt
Warum die USA im Kampf gegen Corona so machtlos sind,"Die Zahl der täglichen Neuinfektionen in den USA liegt nach jüngsten Zahlen der Nachrichtenagentur Reuters bei 75.255, mehr als je zuvor seit Beginn der Krise. Allein in Florida wurden am vergangenen Sonntag gut 15.000 Menschen positiv auf Covid-19 getestet. Am schlimmsten Tag in New York, dem ersten Epizentrum der Pandemie, waren es Anfang April 12.274. „Es ist eine Höllenshow“, schreibt Dr. Richard Loftus, Internist beim Eisenhower Medical Center in Rancho Mirage in der Nähe von Los Angeles im Facebook-Post einer Ärzte-Gruppe.

Bilder, Berichte und Zahlen wie aus einer Wiederholungsschleife der Corona-Pandemie, nur noch extremer als vor einigen Wochen. Während in den meisten Ländern Europas und Asiens die Fallzahlen sinken, schnellen sie in den USA seit Ende Juni in neue Rekordhöhen. Und viele Beobachter auf beiden Seiten des Ozeans fragen: Warum?",Katja Ridderbusch,1594990358,"Gesundheit,Steigende Fallzahlen",welt
