title,text,author,published,tags,source
Als Friedrich der Große von seinen Reitergenerälen gerettet wurde,"Am Ende des Dreißigjährigen Krieges war Brandenburg ruiniert. Doch in wenigen Generationen machten seine Kurfürsten und Könige daraus die zweite Großmacht im Heiligen Römischen Reich.

Anzeige

Als die ersten Schüsse in der Nacht losgingen, glaubte Friedrich der Große noch an das übliche Geplänkel umherstreifender österreichischer Kavallerie. Seinen Generälen hatte es der Preußenkönig schließlich zu verdanken, dass sich die Schlacht bei Hochkirch am 14. Oktober 1758 nicht zu einer Katastrophe weitete, sondern „nur“ zu einer schweren Niederlage. 9000 Preußen blieben als Tote, Verwundete oder Gefangene auf dem Schlachtfeld im heutigen Landkreis Bautzen in Sachsen zurück.

Wahrscheinlich zählen die 34 Skelette, die jetzt beim Bau eines Einfamilienhauses in Hochkirch im Landkreis Bautzen entdeckt wurden, dazu. Wie das Landesamt für Archäologie (LfA) bestätigt, handelt es sich um ein Massengrab mit den Überresten von Toten aus dem Siebenjährigen Krieg (1756–1763). Die Opfer seien hastig, zum Teil in Bauchlage und mit Kalk bedeckt, aber ordentlich in Gruben vergraben worden, sagt die Sprecherin Cornelia Rupp.

Die Skelette in dem Massengrab im ostsächsischen Hochkirch (Landkreis Bautzen) Quelle: Christian Kurtze/ Landesamt für Archäologie Sachsen

Das Grab kam bei Bauarbeiten für ein Einfamilienhaus ans Licht Quelle: Landesamt für Archäologie Sachsen/ dpa

Das Grab war den Angaben zufolge am 8. Juli entdeckt worden. Nachdem zuerst die Polizei alarmiert worden war, wurde anschließend das LfA informiert. Die Archäologen legten dann die 34 Skelette frei. Nach ersten Erkenntnissen handelt es sich um männliche Tote. Die Knochen seien in einem schlechten Zustand gewesen, heißt es. Dennoch wurden bei mindestens drei Opfern vermutlich tödliche Schussverletzungen festgestellt.

Anzeige

Neben den Toten wurden auch stark korrodierte Uniformknöpfe gefunden. Diese sollen untersucht werden und Aufschluss darüber bringen, ob es sich um preußische oder österreichische Soldaten gehandelt hat. „Wir vermuten, dass es Preußen sind“, sagt Cornelia Rupp. Nach einer Lage- und Funddokumentation wurden die Skelette geborgen und ins Landesamt nach Dresden gebracht. Dort sollen noch einmal begutachtet werden, da die Entnahme aus dem sehr harten Boden besser verlief als zunächst gedacht und möglicherweise doch noch weiter Erkenntnisse zu erwarten sind. Auf dem Friedhof in Hochkirch sollen sie dann ihre letzten Ruhe finden.

Die Episode, Friedrich der Große habe bei Hochkirch auf dem Schoß eines Soldaten geschlafen, ging in die borussische Folklore ein Quelle: picture alliance / akg-images

Die Niederlage bei Hochkirch ging ganz und gar auf das Konto Friedrichs des Großen. „Die große Verachtung, die er für den Feind hatte, und seine ... mangelnde Bereitschaft, Nachrichten, die ihm nicht in seine Einbildungen passen, irgendwelchen Glauben zu schenken“, hatten seine Armee in eine unhaltbare Lage gebracht, notierte ein englischer Beobachter.

Über Wochen hinweg hatten der König und die Österreicher unter Feldmarschall Leopold Joseph von Daun durch geschickte Manöver versucht, sich einen entscheidenden Vorteil im Ringen um Sachsen zu verschaffen. Schließlich hatte Friedrich seine 30.000 Mann in die Oberlausitz geführt, um seinen Gegner zum Rückzug ins böhmische Winterquartier zu zwingen. Dabei verlor seine Aufklärung den Kontakt zum Feind.

Die verbissene Verteidigung des Kirchhofs von Hochkirch verschaffte den Preußen eine Atempause Quelle: picture alliance / Bildagentur-o

Anzeige

Daun, der über mehr als 70.000 Soldaten verfügte, erkannte seine Chance und rückte in der Nacht gegen das preußische Lager vor: „Die Haubitzengranaten fielen wie Schlossen (Hagel) ... das Quetschen der treffenden Kugeln und Säbeln sowohl, als die gewöhnlichen Ausrufungen der nicht todt, sondern verwundet fallenden Streiter erfulleten das Ohr“, schrieb ein Augenzeuge.

Es dauerte einige Zeit, bis der schlaftrunkene König den Ernst der Lage erkannte. Dass seine Soldaten standhielten, verdankten sie ihrer Disziplin, ihrer Feuergeschwindigkeit und der Umsicht ihrer Offiziere. Nur weil Friedrichs Reitergeneräle gegen den Befehl ihre Pferde gesattelt gelassen hatten, gelang den Preußen ein einigermaßen geordneter Rückzug.

Lesen Sie auch Preußen Warum Friedrich der Große den Siebenjährigen Krieg überlebte

Dass der Verlust von einem Drittel der Armee samt 101 Kanonen den Kriegsverlauf kaum veränderte, lag an Daun. Im Überschwang, den großen Friedrich geschlagen zu haben, unterließ er die schnelle Verfolgung. Stattdessen wandte er sich nach Schlesien, um die Festung Neisse zu belagern.

Anzeige

Die sächsischen Archäologen rechnen daher damit, dass es in der Gegend um Hochkirch noch weitere Kriegsgräber gibt. „Es wird nicht danach gesucht. Sie kommen zufällig ans Tageslicht“, sagt Cornelia Rupp.

Sie finden „Weltgeschichte“ auch auf Facebook. Wir freuen uns über ein Like.",Florian Stark,1594990274,"Geschichte,Schlacht bei Hochkirch 1758",welt
Starbucks-Barista weist Kundin ohne Maske ab – sie will 50.000 Dollar von ihm,"Anzeige

Es begann mit einem Facebook-Post: Die US-Amerikanerin Amber Gilles beschwerte sich Mitte Juni in einem Beitrag, dass sie ein Barista in einem Starbucks in San Diego nicht bedienen wollte, weil sie keine Maske getragen habe:

„Ich möchte euch Lenin von Starbucks vorstellen, der sich geweigert hat, mich zu bedienen, weil ich keine Maske trage“, schrieb sie und veröffentlichte ein Foto des Starbucks-Mitarbeiters. Und kündigte an: „Das nächste Mal werde ich auf die Polizei warten und eine medizinische Ausnahmegenehmigung mitbringen.“ In San Diego gilt seit 1. Mai eine Maskenpflicht in vielen öffentlichen Bereichen.

Was dann folgte, dürfe Gilles nicht vorausgesehen haben. Ein Internetnutzer startete eine GoFundMe-Kampagne für den Barista, der Lenin Gutierrez heißt, und sammelte insgesamt 105.000 US-Dollar an Spenden für ihn ein. Medien wie der US-Sender CNN oder die „New York Times“ berichteten über die Spendenaktion. Ein Video auf YouTube zeigt die Übergabe des Geldes an Gutierrez.

Starbucks-Mitarbeiter Lenin Gutierrez Quelle: pa/abaca/TNS/ABACA

Anzeige

Doch hier hört die Geschichte noch nicht auf. Bereits Ende Juni kündigte Gilles im Gespräch mit der „NYT“ an, dass sie die Hälfte der Spenden von dem Barista fordern werde. „Sie benutzen meinen Namen, sie benutzen mein Gesicht und sie verleumden mich“, sagte sie zur Begründung.

In einem Interview mit dem lokalen US-Sender KGTV unterstrich Gilles diese Woche noch einmal ihre Forderung: Sie wolle die Hälfte der Spenden, also rund 50.000 US-Dollar. „Es war Diskriminierung. Und jeder ist damit einverstanden und ermöglicht und belohnt dieses Verhalten“, sagte sie.

Sie habe Asthma. Ihr werde schwindlig und sie bekomme schlecht Luft, wenn sie eine Maske trage.

Lesen Sie auch Neue Corona-Welle Jetzt rächt sich Kaliforniens Ungeduld

Anzeige

Um ihre Aussagen zu belegen, legte sie dem Sender zwei Dokumente vor. Bei einem handele es sich um den Bericht einer Untersuchung ihres Beckens aus dem Jahr 2015.

Bei dem zweiten um die handgeschriebene Notiz eines Chiropraktikers. „Amber hat grundlegende Atembeschwerden, die sie daran hindern, eine Maske oder irgendeine Art von Gesichtsbedeckung zu tragen“, heiße es darin. Auf die Frage, warum ein Chiropraktiker ihr ein Dokument über ihre Atembeschwerden ausgestellt habe, antwortete die Frau, Chiropraktiker seien der „nicht-invasiven personalisierten Pflege und Behandlung verschrieben“ und „echte Ärzte“.

Am 2. Juli hat Gilles zudem ihre eigene Spendenkampagne gestartet. Sie berichtete, dass sie Hassnachrichten und Todesdrohungen erhalten habe. Ein Foto von ihr und ihr Name seien ohne ihre Einwilligung bei der Spendenaktion für den Starbucks-Barista verwendet worden. Bisher kamen 430 Dollar für sie zusammen.","'Sandra Ward', 'Bari Weiss', 'Clemens Wergin', 'Benedikt Fuest', 'Don Alphonso', 'Stefan Beutelsbacher'",1594990017,"Panorama,USA",welt
NRW erlaubt keine Notschlachtungen wegen „Schweine-Stau“,"Durch die Corona-bedingten Schließungen von Schlachthöfen wurde der Platz in Mastbetrieben knapp. NRW-Landwirtschaftsministerin Ursula Heinen-Esser hat nun klargestellt: Notschlachtungen widersprechen dem Tierschutzgesetz.

Anzeige

Nordrhein-Westfalen wird keine Notschlachtungen von Schweinen wegen Platzmangels in den Ställen erlauben. Das hat NRW-Landwirtschaftsministerin Ursula Heinen-Esser (CDU) am Freitag in einer Sondersitzung im Düsseldorfer Landtag klargestellt. Eine Tötung von Tieren aus dem Bestand schließe das Tierschutzgesetz aus, sagte sie im Landwirtschaftsausschuss. „Wir werden das nicht unterstützen, falls Anträge kommen sollten.“

Der Ausschuss trat mitten in der Sommerpause zu einer außerordentlichen Sitzung zusammen, um die Folgen des „Schweine-Staus“ zu erörtern, der nach Corona-bedingten Schließungen von Schlachthöfen in Mastbetrieben entstanden ist.

Lesen Sie auch „Ich mach mein Ding“ Das System Tönnies

Dass der Großschlachter Tönnies nun wieder den Betrieb hochfahre, werde die Situation etwas entspannen, sagte Heinen-Esser. Die Lage werde aber über die gesamte Zeit der Corona-Pandemie angespannt bleiben. Niemand könne davon ausgehen, dass die Schlachtkapazitäten wieder so hochgefahren würden wie vor der Corona-Krise. Ein Systemwandel sei nötig.

Anzeige

Für die betroffene Branche gebe es derzeit mehrere Probleme, erklärte die Ministerin: Neben dem „Schweine-Stau“ in den Ställen, hätten die Erzeuger mit Preisverfall zu kämpfen und müssten sich auf deutlich höhere Hygiene- und Arbeitsschutzstandards einstellen. Zudem seien nun viele Mitarbeiter in die Sommerferien nach Hause gefahren. Die personelle Lage werde sich erst Mitte September wieder entspannen.","'Jan Hegenberg', 'Florian Gehm', 'Carsten Dierig', 'Karsten Seibel', 'Kristian Frigelj'",1594988980,"Nordrhein-Westfalen,Corona-bedingte Schließungen",welt
Kranke Migrantenkinder und Angehörige fliegen nach Kassel,"Anzeige

Die Bundesregierung will am kommenden Freitag eine Gruppe von kranken Kindern mit ihren Angehörigen aus griechischen Flüchtlingslagern nach Deutschland holen. Geplant sei, dass die Kinder und ihre Eltern – insgesamt rund 100 Menschen – in Kassel landen und dann auf neun Bundesländer verteilt werden, hieß es am Freitag aus dem Bundesinnenministerium. Zu den Nationalitäten der 24 Familien machte das Ministerium zunächst keine Angaben.

Die Neuankömmlinge müssen demnach nach ihrer Ankunft grundsätzlich nicht in Corona-Quarantäne, da Griechenland nicht als Risikogebiet gilt. Außerdem waren sie laut Ministerium schon vor Abflug gemeinsam untergebracht und auf das Virus Sars-CoV-2 getestet worden. Die Entscheidung über Infektionsschutzmaßnahmen liege letztlich aber bei den einzelnen Bundesländern, hieß es.

Hintergrund des geplanten Fluges ist ein Koalitionsbeschluss der Bundesregierung vom März, mehrere schwer kranke Kinder sowie ihre engen Verwandten aus Flüchtlingslagern in Griechenland aufzunehmen. In einem ersten Schritt waren bereits 53 unbegleitete Minderjährige nach Deutschland gebracht worden.

Lesen Sie auch Migration Deutschland holt zu wenige Schutzsuchende aus Griechenland? Ein Trugschluss

Anzeige

Insgesamt sollen laut Innenministerium 928 Migranten aus den überfüllten Lagern auf den griechischen Inseln nach Deutschland kommen, um hier ein Asylverfahren zu durchlaufen: 243 kranke Kinder, ihre Eltern und Geschwister. Wie die jeweiligen Landesregierungen diese Woche mitgeteilt hatten, sollen 82 Migranten nach Bayern kommen, nach Rheinland-Pfalz 66 und nach Baden-Württemberg 50. Berlin hatte angekündigt, 142 Menschen aufzunehmen.

Neben Deutschland beteiligen sich unter anderem Luxemburg und Portugal an der Aufnahme, die sich wegen der Corona-Pandemie verzögert hat.","'Sabine Menkens', 'Marcel Leubecher', 'Iason Athanasiadis', 'Ricarda Breyton'",1594988822,"Deutschland,Griechische Lager",welt
"„Niemand sollte Kinder bekommen, weil er eine Sinnkrise durchmacht“","Warum wollen wir überhaupt eigene Kinder? Und wie rechtfertigt man, dass man keinen Nachwuchs will? Zwei Schweizerinnen, die Philosophin Barbara Bleisch und die Rechtswissenschaftlerin Andrea Büchler, haben die Kinderfrage ergründet. Im Zoom-Gespräch erklären sie, wieso Kinder zu bekommen heute eine Entscheidung und keine Frage des Schicksals mehr ist.

WELT: Wieso haben Sie Ihr Buch „Kinder wollen“ genannt?

Andrea Büchler: Kinder zu bekommen ist heute meist eine Entscheidung und nicht mehr eine Frage des Schicksals. Das bedeutet, dass man sich mit den Möglichkeiten, die sich uns bieten, auseinandersetzt und auseinandersetzen muss. Es gibt eine ganze Reihe von Optionen, zu denen wir uns irgendwie verhalten müssen, weswegen die Entscheidung eher einem Wollen entspricht.

Barbara Bleisch: Die Frage „Willst du eigentlich Kinder?“ ist ja fast schon so etwas wie die Gretchenfrage in Beziehungen geworden. Ob man eine Familie gründen möchte oder lieber kinderfrei bleibt, ist heute oft eine Wahl, die bewusst getroffen wird. Entsprechend kann die Frage Paare näher zusammenbringen, aber auch spalten. In den Generationen vor uns war das nicht so, nicht nur wegen der nicht vorhandenen Verhütungsmöglichkeiten.

WELT: Sie sagen bewusst „kinderfrei“ und nicht „kinderlos“.",Clara Ott,1594988811,"Gesundheit,Kinderwunsch-Dilemma",welt
John Bolton attestiert Trump ausgeprägte Abneigung gegen Merkel,"Der US-Sender CNN will erfahren haben, dass sich Donald Trump am Telefon gegenüber anderen Staats- und Regierungschefs öfter ungewöhnlich verhält. So soll er Angela Merkel im Telefonat als „dumm“ bezeichnet und beschuldigt haben, „unter dem Einfluss der Russen zu stehen“.

So soll Trump Merkel am Telefon beleidigt haben

Anzeige

Das Verhältnis zwischen Donald Trump und Angela Merkel wirkt stets distanziert – laut Trumps ehemaligem Sicherheitsberater John Bolton hat der US-Präsident sogar eine ausgeprägte Abneigung gegen die Bundeskanzlerin. Das Verhältnis sei eines der problematischsten, die er je beobachtet habe, sagte er dem „Spiegel“.

„Der Präsident hat mitunter Schwierigkeiten mit weiblichen Regierungschefs“, so Bolton. Als weiteren möglichen Grund nannte er die deutschen Wurzeln in Trumps Familie. „Die Gründe sind aber auch politisch. Wir hatten eine Menge Handelsstreitigkeiten mit Europa, und darüber hinaus war Deutschland nicht bereit, zwei Prozent seiner Wirtschaftsleistung in das Militär zu stecken.“ Genau das sei in der Nato verabredet worden.

Das Verhältnis zwischen Trump und Merkel sei eines der problematischsten, die er je beobachtet habe, so Bolton Quelle: dpa-infocom GmbH

Bolton diente Trump bis September 2019. Er zählt sich zum konservativen Flügel der Republikaner. Die deutsche Bundesregierung solle sich hinsichtlich der Strafzölle auf deutsche Autos nicht in falscher Sicherheit wiegen, warnte er im Gespräch mit dem „Spiegel“ außerdem. Diese könne Trump ohne Zustimmung des Kongresses erheben.

Lesen Sie auch Truppenverlagerung Polen braucht Trump – aber auch Merkel

Anzeige

Auf die Frage nach der US-Präsidentschaftswahl sagte Bolton, er halte den Ausgang für offen – auch, wenn Trump aktuell wegen der Corona-Krise zurückliege. „Wir sollten auf keinen Fall das Talent der Demokraten unterschätzen, einen Wahlkampf zu vermasseln“, so Bolton.","'Clemens Wergin', 'Daniel Friedrich Sturm'",1594988483,"Ausland,Ehemaliger Sicherheitsberater",welt
Von der Leyen warnt vor Debakel – „Die ganze Welt beobachtet uns“,,,1594988220,"Ausland,EU-Gipfel",welt
Ungewöhnlich verpackte Drogen am Mailänder Flughafen entdeckt,,,1594987678,"Panorama,Kokain im Kaffee",welt
"Fußball-Weltmeister André Schürrle, 29, beendet überraschend Karriere","Anzeige

Eine Flanke brachte André Schürrle in die Geschichtsbücher des Fußballs. Der Außenstürmer bereitete im WM-Finale 2014 gegen Argentinien das entscheidende Tor vor. Mario Götze verwandelte die Vorlage Schürrles und traf in der Verlängerung zum Sieg. Es war der Höhepunkt in der Karriere Schürrles, die jetzt mit nur 29 Jahren endet. Schürrle, der am vergangenen Mittwoch seinen Vertrag mit Borussia Dortmund aufgelöst hat, hört mit dem professionellen Fußball auf.

Die Flanke zum WM-Titel: Schürrle (r.) setzt sich gegen die Argentinier Javier Mascherano und Pablo Zabaleta (l.) durch Quelle: pa/Pressefoto UL/Pressefoto ULMER/Michael Kienzle

„Die Entscheidung ist lange in mir gereift“, erklärt Schürrle „Spiegel“. „Ich brauche keinen Beifall mehr.“ Der gebürtige Ludwigshafener schildert, wie es ihm im Fußballgeschäft in den vergangenen Jahren gegangen ist, in dem ihm zufolge „nur die Leistung auf dem Platz zählt, in dem Verletzlichkeit und Schwäche zu keinem Zeitpunkt existieren dürfen“.

Grenzenloser Jubel nach dem Treffer: Schürrle und Torschütze Mario Götze (r.) Quelle: pa/dpa/Chema Moya

„Man muss ja immer eine gewisse Rolle spielen, um in dem Business zu überleben, sonst verlierst du deinen Job und bekommst auch keinen neuen mehr“, sagte Schürrle.

Andre Schürrle (r.) hat mit 29 Jahren seine Karriere beendet. Er war der Vorlagengeber für das entscheidende Finaltor bei der WM 2014 von Mario Götze Quelle: dpa/Bongarts/Getty Images/DFB

Anzeige

Er offenbart, dass er oft einsam gewesen sei, gerade als „die Tiefen immer tiefer wurden und die Höhepunkte immer weniger“. Die Fußballbranche habe es ihm aber nicht erlaubt zu zeigen, wie er sich wirklich gefühlt habe.

An dieser Stelle finden Sie Inhalte aus Instagram Um mit Inhalten von Instagram und anderen sozialen Netzwerken zu interagieren oder diese darzustellen, brauchen wir Ihre Zustimmung. Soziale Netzwerke aktivieren

Schürrle kam im Sommer 2016 für etwa 30 Millionen Euro vom VfL Wolfsburg zum BVB und absolvierte in zwei Jahren 51 Pflichtspiele für Dortmund. In den vergangenen beiden Jahren wurde er zunächst für eine Saison an den FC Fulham verliehen und zuletzt an Spartak Moskau. Bei keinem dieser Klubs konnte er sich durchsetzen, seine Leistungskurve ging stetig bergab.

Schürrle war zuletzt vom BVB an Spartak Moskau ausgeliehen Quelle: dpa/Alexander Stupnikov

„Es war für beide Seiten definitiv keine Erfolgsgeschichte. Aus diesem Grund war es das Beste, dass wir den Vertrag nun vorzeitig aufgelöst haben“, sagte BVB-Geschäftsführer Hans-Joachim Watzke sport1.de. „Für die Zukunft wünschen wir André alles erdenklich Gute“, sagte Watzke.

Anzeige

Auch in der Mitteilung, die der BVB veröffentlicht hat, klingt bei Schürrle durch, dass er mit dem Business Profifußball haderte: „Rückblickend war es eine Zeit mit Höhen und Tiefen, aber auch mit vielen wertvollen Erfahrungen sowohl im sportlichen als auch insbesondere im privaten Bereich. Ich danke den Verantwortlichen des BVB und wünsche dem Verein und seinen besonderen Fans alles Gute für die Zukunft.“









Anzeige















","'Oliver Müller', 'Julien Wolff'",1594987553,"Fußball,„Brauche keinen Beifall mehr“",welt
"Was haben Sie mit Real vor, Herr Jewtuschenkow?","WELT: 2006 wollten Sie bei der Deutschen Telekom einsteigen, dann bei Infineon – beide Vorhaben scheiterten. Nun kauften Sie die Real-Supermärkte. Warum versuchen Sie es immer wieder in Deutschland?

Wladimir Jewtuschenkow: Vielleicht weil ich die Deutschen so gern mag. Wir sind ein in Moskau und London notiertes Unternehmen mit einem breiten Portfolio. Da ist es selbstverständlich, dass wir auch international wie in Deutschland immer wieder Investitionsmöglichkeiten prüfen.

Warum brauchen Sie Real?",Eduard Steiner,1594987495,"Wirtschaft,Russischer Supermarkt-Investor",welt
"„Es geht nicht nur um Geld, es geht um die richtigen Projekte“",,,1594986508,"Videos,Ex-EU-Kommissar Oettinger",welt
Kinder dürfen wieder in die Kita – auch mit laufender Nase,"Anzeige

Nach monatelangen Corona-Einschränkungen sollen die rund 1100 Hamburger Kindertagesstätten nach den Sommerferien wieder in den Regelbetrieb gehen. Das geringe Infektionsgeschehen mache es möglich, dass Eltern ab dem 6. August wieder die volle Betreuungszeit für ihre Kinder beanspruchen können, sagte am Freitag der Sprecher der Sozialbehörde, Martin Helfrich. Zuvor hatte das „Hamburger Abendblatt“ darüber berichtet. Nach den Sommerferien sollen auch alle Schüler wieder in den Schulen unterrichtet werden.

Schon seit Mitte Juni können in Hamburg wieder alle Kinder in die Kitas, allerdings wird im eingeschränkten Regelbetrieb nur eine Mindestbetreuung von 20 Stunden pro Woche möglichst an drei Wochentagen garantiert. Mit der Rückkehr zur vollen Betreuungszeit würden auch wieder die Elternbeiträge im Rahmen des Kita-Gutschein-Systems fällig, sagte Helfrich. Im eingeschränkten Betrieb hatte die Stadt das übernommen.

Lesen Sie auch Kita in Corona-Zeiten „Wir werden uns nicht nur ans Schwierige erinnern“

Lesen Sie auch Corona-Angst in Kitas „Sollen Kindern ein Attest ausstellen, denen ein bisschen die Nase lief“

Es würden auch weiter strenge Hygieneregeln gelten. Kranke Kinder dürften zum Beispiel nicht in die Kita. Zuletzt habe es Irritationen darüber gegeben, ab wann ein Kind als krank einzustufen sei, sagte Helfrich. Dies werde in den „Handlungsempfehlungen im Umgang mit dem Coronavirus für die Kindertageseinrichtungen“ in der kommenden Woche konkretisiert. „Krank sind Kinder mit Husten und/oder Fieber einzustufen, und zwar spätestens ab 38 Grad.“ Klar sei aber auch: „Nicht jede laufende Nase ist ein Grund, die Kinder von der Betreuung auszuschließen.“

Sechs weitere Corona-Infektionen in Hamburg

Anzeige

In Hamburg sind seit Donnerstag sechs weitere Corona-Infektionen nachgewiesen worden. Die Zahl der seit Ausbruch der Pandemie in der Stadt positiv getesteten Menschen stieg damit auf 5236, wie die Gesundheitsbehörde am Freitag mitteilte. Rund 4900 davon können nach Schätzung des Robert-Koch-Instituts (RKI) als genesen angesehen werden. Unverändert blieb die Zahl der Corona-Toten: Laut Institut für Rechtsmedizin am Universitätsklinikum Eppendorf starben in Hamburg bisher 231 Menschen an Covid-19. Das RKI, das unabhängig von der Todesursache alle mit dem Virus infizierten Toten erfasst, kommt auf 260.

Mit 0,6 Neuinfektionen pro 100.000 Menschen binnen sieben Tagen liegt das Infektionsgeschehen in Hamburg weit unter dem Grenzwert von 50 Neuinfektionen, ab dem der Senat über erneute Einschränkungen zur Eindämmung der Pandemie beraten müsste.","'Marlen Dannoritzer', 'Jana Werner', 'Jörn Lauterbach'",1594986098,"Hamburg,Regelbetrieb nach den Ferien",welt
Klopp macht Druck – Thiago vor Weggang aus München,,"'Julien Wolff', 'Robert Schreier', 'Lars Gartenschläger'",1594985962,"Sport,FC Bayern",welt
