title;text
"Leise Hybrid-Autos gefährden Blinde;""Handy-Navigationssysteme und RFID bieten Abhilfe"
Die National Federation for the Blind (NFB) hat in dieser Woche im US-Bundesstaat Maryland vor den Gefahren zu leisen Elektrobetriebs bei Hybrid-Autos gewarnt. Blinde, aber auch andere Verkehrsteilnehmer, würden diese Fahrzeuge nicht kommen hören," so die NFB vor dem dortigen Senat. """"Hier in Deutschland rückt das Problem ebenfalls in den Fokus""""", meint Bernhard Claus, Mitglied im Gemeinsamen Fachausschuß für Umwelt und Verkehr (GFUV) des Deutschen Blinden- und Sehbehindertenverband (DBSV) http://www.dbsv.org ," im Gespräch mit pressetext. """"Wir sind uns der Problematik um die Inverkehrssetzung der Hybrid- und Elektroautos im Zusammenhang mit blinden und sehbehinderten Menschen bewusst""""", meint auch René Mathys vom Schweizerischen Blinden- und Sehbehindertenverband (SBV-FSA) http://www.sbv-fsa.ch auf Anfrage von pressetext. Intensive Lobby-Bestrebungen wie die des amerikanischen NFB, Mindestgeräuschpegel vorzuschreiben, seien dem SBV-FSA Europa betreffend aber nicht bekannt. Das mag auch daran liegen, dass Verbände die Gefahr erst genauer erforschen wollen. Der GFUV sei an konkreten Test mit Hybridautos interessiert," meint Claus. Entscheidend sei auch der Geräuschkontext. Speziell bei hohem Umgebungslärm und neben lauten Verbrennungsmotor-Fahrzeugen könne für Blinde und Sehbehinderte Gefahr von zu leisen Hybrid- und Elektroautos ausgehen. """"Wenn nur noch solche Autos fahren"," sind sie wahrscheinlich wieder zu hören""""", meint jedoch Claus.Aktueller von Bedeutung für Blinde und Sehbehinderte ist die Entwicklung im Bereich technischer Hilfen zur Bewältigung des Verkehrsalltages. Dazu zählen die im Straßenbild mancher Großstädte schon verbreiterten akustischen Signalgeber bei Ampeln. Auch mit akustischen Informationssystemen wird bereits häufiger experimentiert. Hier warnt Claus vor Insellösungen, wo Systeme von einer Stadt zur nächsten völlig anders funktionieren. Zu begrüßen seien Bestrebungen für großflächige Navigationssysteme auf UMTS-Basis. Generell sind mobile Navigationshilfen interessant.Mit LoadStone http://www.loadstone-gps.com gibt es ein Handy-Navigationssystem, das speziell für Blinde und Sehbehinderte entwickelt wurde. Es erfordert ein Symbian-S60-Mobiltelefon sowie einen Bluetooth-GPS-Empfänger und ist laut Jürg Cathomas vom SBV-FSA besonders für solche Anwender geeignet, die häufig die gleiche Strecken nutzen. Bei kartengestützten Navigationssystemen für den (sehenden) Massenmarkt fehlen dagegen in der Regel für Blinde und Sehbehinderte wesentliche Informationen, resümiert Cathomas. Das umfasst etwa Angaben über Unterführungen, Ampeln oder das Vorhandensein von Gehsteigen auf der einen oder anderen Straßenseite. Auch die RFID-Technologie könnte trotz geringer Reichweite und vermeintlich hoher Kosten für Hilfssysteme dienen. Claus verweist auf ein Projekt in Laveno am Lago Maggiore. Dort wurden ursprünglich zur Identifikation von Schlachtvieh genutzte RFID-Transponder wiederverwertet, was die Kosten begrenzt. Auf einer zwei Kilometer langen Strecke im Boden versenkt, können sie jetzt in Verbindung mit einem passenden Stock-Sensor bei der Bewältigung der Teststrecke helfen. RFID-Testprojekte gäbe es auch in Japan," so Claus. """"Es ist immer ein elektronisches Zusatzgerät notwendig""""", warnt Claus allerdings. Daraus ergibt sich ein Ausfallrisiko," weshalb technische Geräte rein mechanische Hilfen nicht gänzlich ersetzen können. """"Taktile Bodenindikatoren bleiben unerlässlich"""""," betont Claus."""
"Integrationspotenzial neuer Medien wird kaum genutzt;""Initiative D21 will Informationsgesellschaft in Deutschland vorantreiben"
"Das Potenzial neuer Medien wie des Internets wird bisher noch zu wenig für die Integration von Menschen mit Migrationshintergrund genutzt. Dies kritisiert die Initiative D21 http://www.initiatived21.de und unterstreicht gleichzeitig die Notwendigkeit der digitalen Integration für die Informationsgesellschaft in Deutschland. """"Wir sind davon überzeugt"," dass Informations- und Kommunikationstechnologien eine wesentliche Unterstützung zur gesellschaftlichen Integration leisten können""""", erklärt Bernd Bischoff, Präsident der Initiative. Das Internet schaffe aber nicht per se schon alleine durch seine Existenz Bildung und Wohlstand. Vielen Bevölkerungsschichten - und dazu gehören insbesondere Minderheiten wie Migranten - müsse zunächst ein großes Maß an digitaler Ausbildung zuteil werden," um nicht außen vor zu bleiben. """"Hauptziel unserer Initiative ist es"," die Informationsgesellschaft im Deutschland des 21. Jahrhunderts voranzutreiben""""", erläutert D21-Sprecher Stefan Jaekel im pressetext-Interview. Mit ihren gemeinnützigen Projekten setze sich die Initiative insbesondere für mehr digitale Integration," Kompetenz und Exzellenz ein. """"Neben der Bildung und Förderung des IKT-Nachwuchses setzen wir den Schwerpunkt aktuell auch auf den Integrationsbereich"""""," ergänzt Jaekel. Bislang werde das Potenzial der neuen Medien sowohl innerhalb der Gruppe der Personen mit Migrationshintergrund als auch in Wirtschaft und Verwaltung zu wenig für Integrationszwecke genutzt. """"Wir wollen hier wichtige Vorarbeit leisten"," denn die bisherigen Bemühungen in diese Richtung sind uns einfach zu wenig"""""," stellt Jaekel zusammenfassend fest.""""Dabei bieten gerade die neuen Medien in dieser Hinsicht vielerlei Möglichkeiten""""", meint Jaekel. Durch sie ergebe sich die Chance, den eigenen kulturellen Hintergrund für Arbeitsplätze zu nutzen," den interkulturellen Austausch zwischen den Nationen zu fördern und die Basis für gesellschaftliche Integration zu bilden. """"Ein bekanntes Problem in Deutschland ist beispielsweise der Bereich der Sprachförderung""""", erklärt Jaekel. Hier könnten sich spezielle E-Learning-Angebote im Internet als hilfreich erweisen. Die Unterstützung beim Spracherwerb sei allerdings nur ein erster Schritt zur gesellschaftlichen Integration von Menschen mit Migrationshintergrund. Die bereits 1999 gegründete Initiative D21 ist Europas größte Partnerschaft von Politik und Wirtschaft für die Informationsgesellschaft. Sie umfasst ein parteien- und branchenübergreifendes Netzwerk von 200 Mitgliedsunternehmen und -institutionen sowie politischen Partnern aus Bund," Ländern und Kommunen."""
"Weiblicher G-Punkt kann lokalisiert werden;""Forscher machen Stimulationspunkt mit Ultraschall sichtbar"
Der mysteriöse G-Punkt, der Frauen zum sicheren Höhepunkt verhilft, hat es wieder einmal in die aktuellen Wissenschaftsmagazine geschafft: Italienische Forscher haben bei 20 Frauen den Stimulationspunkt mit Hilfe von Ultraschall sichtbar gemacht, berichten sie im Journal of Sexual Medicine und in der Online Ausgabe von New Scientist. Bisher war die Existenz des G-Punkts wissenschaftlich äußerst umstritten, weil es keinen Hinweis darauf gab, wo er sich tatsächlich befindet.Mit Hilfe von Ultraschall ist es Emmanuele Jannini von der Universität in L'Aquila http://www.univaq.it gelungen, im Gewebe an der vorderen Vaginawand etwas zu finden: Bei den neun Probandinnen, die über heftige vaginale Orgasmen berichteten, die sich aus einer Stimulation dieser Region ergab, zeigte sich zwischen der Harnröhre und der Vagina ein dickeres Gewebe, als bei den elf Probandinnen," die noch nie einen vaginalen Orgasmus hatten. """"Es ist das erste Mal", dass wir mit Hilfe einer einfachen, schnellen und günstigen Methode bestimmen können," ob eine Frau einen G-Punkt hat oder nicht""""", schreibt Jannini. Das bedeute auch," dass Frauen ohne sichtbaren Beweis eines G-Punkts keinen vaginalen Orgasmus haben können. Als sehr interessant und aufschlussreich empfindet die Urologin und Sexualmedizinerin Elia Bragagna http://www.eliabragagna.at die Untersuchungsergebnisse. """"Eigentlich müsste ich froh über das Ergebnis sein"," denn damit wird vielen Frauen der enorme Druck über den vaginalen Orgasmus genommen""""", so die Medizinerin gegenüber pressetext. Es wäre gut, wenn man diesen Frauen, die einen solchen Höhepunkt nicht erreichen können, mitteilen würde, dass es strukturell eben nur bei manchen möglich sei," einen solchen vaginalen Orgasmus zu bekommen. """"Es wäre viel klüger sich auf die Stimulation jener Regionen zu konzentrieren"," die tatsächlich Lust erzeugen und die sich leicht stimulieren lassen""""", so die Forscherin. Das gelte auch im Austausch mit dem Partner. Experten sind mit den Bildern von Jannini noch nicht vollständig zufrieden, erklärt auch Bragagna. Es könne sich bei den abgebildeten Regionen auch um die Paraurethraldrüse - auch Skene-Drüse genannt - handeln," meint die Wissenschaftlerin. """"Diese wird auch als weibliche Prostata bezeichnet. Ihr Sekret ähnelt in Zusammensetzung und Enzymmustern dem aus der Prostata des Mannes. Wenn man davon ausgeht", dass im Embryonalstadium beide Geschlechter gleich aussehen und sich ähnlich entwickeln," ist das nachvollziehbar"""""," so die Urologin. Experten bezeichnen die Prostata als männlichen G-Punkt. """"Durch sexuelle Stimulation kann ein Orgasmus herbeigeführt werden"," der sich von einem phallisch generierten Orgasmus deutlich unterscheidet"""""," führt die Sexualmedizinerin an. Unter homosexuellen Männern ist die Prostatamassage weiter verbreitet als unter heterosexuellen"""""," erklärt die Forscherin abschließend."""
"Private Haushalte: Anteil erneuerbarer Energien nimmt zu;""Förderung wichtigster Anreiz - Novellierung des EEG im Bundestag"
Die Nutzung von erneuerbaren Energien hat in privaten Haushalten während der vergangenen Jahre deutlich zugenommen. Knapp fünf Prozent aller bewohnten Gebäude nutzen Ende 2006 Solarkollektoren zum Heizen und zur Warmwasseraufbereitung, zeigt eine Erhebung des Rheinisch-Westfälischen Instituts für Wirtschaftsforschung (RWI Essen) http://www.rwi-essen.de . 2,4 Prozent setzen Wärmepumpen ein, gefolgt von Pelletheizungen (2,2 Prozent) und Solarstromanlagen (1,8 Prozent). Herkömmliche Energieträger wie Erdgas und Heizöl führen die Liste der meistgenutzten Energien jedoch weiterhin deutlich an. Um den Ausbau der erneuerbaren Energien weiter zu fördern, beriet der deutsche Bundestag in dieser Woche zudem erstmals über die Novellierung des EEG.Der Anteil der Solarstromanlagen in Privathaushalten verdoppelte sich demnach zwischen 2005 und 2006, die Nutzung von Solarkollektoren stieg um 0,5 Prozent an, wie die nach Angaben des RWI weltweit bislang umfangreichste Erhebung zum Energieverbrauch in privaten Haushalten zeigt. Der Großteil der bewohnten Gebäude setzt weiterhin auf Erdgas (36,7 Prozent), Heizöl (28 Prozent) und Strom (18,3 Prozent). Vor allem die Förderungen würden eine wichtige Rolle beim Einsatz erneuerbarer Energien in privaten Haushalten spielen, sagt Manuel Frondel," Leiter des Kompetenzbereichs """"Umwelt und Ressourcen"""" am RWI Essen. """"So konnte man nach der Novellierung des Erneuerbare-Energien-Gesetzes (EEG) 2004", durch die unter anderem eine deutlich bessere Einspeisevergütung für Solarstrom eingeführt wurde," einen Boom bei Photovoltaik-Anlagen beobachten""""", so Frondel im Gespräch mit pressetext. Das Interesse privater Haushalte sei insofern vorhanden, als finanzielle Anreize gesetzt sind.In Verbindung mit den derzeit anfallenden hohen Kosten und dem gleichzeitig geringen Anteil der erneuerbaren Energien an der gesamten Stromerzeugung stelle sich jedoch die Frage, ob man sich den Luxus der erneuerbaren Energien weiter leisten wolle," betont Frondel. """"Im Bereich der Photovoltaik", einer der teuersten Erneuerbare-Energien-Technologien, könnte beispielsweise versucht werden, durch staatliche Förderung der Forschung und Entwicklung den technologischen Wirkungsgrad der Anlagen erheblich zu verbessern, ehe Anreize gesetzt werden," die den Einsatz der noch wenig effektiven Anlagen fördern.""""Nach vorläufigen Entwürfen zur anstehenden Novellierung des EEG würden die Anreize zur Nutzung erneuerbarer Energien weiterhin hoch bleiben", wodurch in den kommenden Jahren mit einem ähnlichen Anstieg wie in der Vergangenheit zu rechnen ist, sagt Frondel. Die Neuregelung sieht unter anderem vor, die Windenergienutzung auf See sowie das Einspeisemanagement erneuerbarer Energien zu fördern. Nachdem Donnerstag die erste Lesung der Regierungsentwürfe zur Novellierung des EEG im Bundestag stattgefunden hat," befassen sich nun Fachausschüsse im Detail mit den Gesetzesvorhaben.Erneuerbare Energien sind auch eines der wichtigsten Themen bei der diesjährigen """"Bauen & Energie""""-Messe http://www.bauen-energie.at in Wien. Rund 570 Aussteller informieren hier noch bis 24. Februar über gesundes und nachhaltiges Bauen"," Energiesparen und Gärten. Im vergangenen Jahr wurden bereits mehr als 50.000 Besucher gezählt."""
"Fotodienst: Wochenvorschau 25. bis 29. Februar 2008;""UPC Austria", TOSHIBA Medical Systems, AMA Marketing, FFG, VCÖ
Der Fotodienst-Service der Nachrichtenagentur pressetext wird in der kommenden Woche folgende Foto-Termine wahrnehmen. Die Pressefotos werden unmittelbar nach den Veranstaltungen auf http://www.fotodienst.at , http://www.fotodienst.cc und http://www.fotodienst.ch zum Download bereitgestellt.Fotodienst-Termine ÖsterreichMontag, 25. 02. 20089:30 Uhr
Verkehrsentwicklung in Österreich seit dem EU-Beitritt
VCÖDienstag, 26. 02. 200810:00 Uhr
Vorstellung von Produktneuheiten wie Digital TV
UPC Austria 10:00 Uhr
"Offizielle Inbetriebnahme des Volumen Computertomographen """"AquilionONE"""" "
TOSHIBA Medical Systems GmbH17:00 Uhr
Stars der IT Forschung! - Prämierung der besten FIT-IT-Projekteinreichungen 2007
Österreichische Forschungsförderungsgesellschaft mbHMittwoch, 27. 02. 200814:30 Uhr
Kinderernährungs-Tagung
AMA MarketingFotodienst-Termine DeutschlandMontag, 25. 02. 200812:30 Uhr
72. Jahrestagung: Berlin 2008
