title;text
Das Freeport International Outlet in Kleinhaugsdorf ist ab März 2008 um einen Shop reicher: Der traditionsreiche italienische Sportartikelhersteller Briko ist seit über 20 Jahren erfolgreich in der Entwicklung von innovativer, moderner und komfortabler Schutzausrüstung für Winter-, Rad- und Outdoorsport. Bei Sportbrillen und Helmen ist das Unternehmen marktführender Hersteller sowie Sponsor von Skiassen wie Benjamin Raich, Nicole Hosp oder Bode Miller.Der neue Briko-Shop im Freeport International Outlet bietet eine große Auswahl an innovativen, komfortablen Sportartikeln im attraktiven, hochwertigen Design, stets gemäß neuester Qualitäts- und Sicherheitsstandards. Zahlreiche Profisportler im Ski- und Radrennbereich gehen mit Briko-Produkten an den Start - ein Qualitätsbeweis für alle Sportbegeisterte.Begonnen hat die Erfolgsgeschichte von Briko im Jahr 1985 mit der Produktion von hochwertigem Wachs für das italienische Ski-Team. Bald wurde der Schwerpunkt auf Skihelme und Brillen gelegt und Briko wurde zum offiziellen Ausrüster der italienischen Skilegende Alberto Tomba. Anfang der 90er Jahre wurde das Sortiment um Fahrradhelme und Sportbekleidung erweitert, wodurch Briko sich als Top-Marke unter den Sportausstattern etablieren konnte.
Nähere Details unter http://www.freeport.at . 65 Shops, 200 Top-Marken, 7 Tage geöffnet
Freeport International Outlet bietet in 65 Shops internationale Top-Designer-Marken um 30 bis 70% günstiger an als vergleichbare österreichische Markengeschäfte. Freeport garantiert Designer-Ware zum besten Preis. Sind idente Artikel in einem Geschäft in Österreich billiger erhältlich, wird die Differenz zurückerstattet (31 Tage Garantie ab Kaufdatum, nicht gültig für Internet-Käufe," Ausverkaufsware oder Sonderangebote). 200 Top-Brands laden zum Gustieren ein. Das Besondere am Outlet Center sind die Öffnungszeiten: Täglich von 10:00 bis 21:00 Uhr - selbst an Sonn- und Feiertagen - kann eingekauft und gestöbert werden."""
"StreamMyGame bringt Office auf die Playstation 3;""""""Es gibt definitiv eine Nachfrage nach Anwendungs-Streaming"""""
Die StreamMyGame-Software http://www.streammygame.com bietet seit gestern, Donnerstag, die Möglichkeit," auch 2D-Anwendungen per Stream auf unterschiedlichen Wiedergabegeräten zu nutzen. Damit kann etwa das auf einem PC installierte Microsoft Office auf Linux-Geräten oder auf einer Playstation 3 genutzt werden. Das ist eine große Änderung für das im Oktober 2007 gestartete Angebot der Firma Tenomichi http://www.tenomichi.com . """"Bei unserer Technologie ging es darum"," 3D-Spiele zu streamen""""", bestätigt Richard Faria, Tenomichi CEO, im Gespräch mit pressetext.Nutzer der Spiele-Vertriebsplattform Steam http://www.steampowered.com hätten ein 2D-Interface für StreamMyGame gefordert," um es zum Start ihrer Steam-Spiele nutzen zu können. Die nun vorliegende Software bietet aber deutlich umfassendere Möglichkeiten. """"Wir haben es so weit geöffnet"," wie wir konnten""""", meint Faria. Dadurch können jetzt auch diverse 2D-Anwendungen wie Microsoft Office," E-Mail-Programme oder der SAP Database Manager per Stream ferngenutzt werden. Das könnte StreamMyGame auch jenseits der Games-Community bis hin in den Business-Bereich interessant machen. """"Es gibt definitiv eine Nachfrage nach Anwendungs-Streaming""""", betont Faria und verweist auf den kommerziellen Erfolg von Citrix http://www.citrix.de mit Anwendungsbereitstellung. Das PC-System, das ferngenutzte Programme ausführt, sollte möglichst über eine PCI-Express-Grafikkarte verfügen und muss den Stream Server von StreamMyGame installiert haben. Die Wiedergabegeräte für die Fernnutzung brauchen den passenden Stream Player. Diesen gibt es seit dem Start für Windows-Systeme und seit Mitte Januar auch für Linux. Damit kann StreamMyGame auch mit einer Playstation 3 genutzt werden, soweit darauf Linux installiert ist. Als Stream Player sei von der Rechenleistung her laut Faria eigentlich jedes Gerät geeignet, das zumindest über eine CPU mit 500 Megahertz verfügt.Momentan ist mit StreamMyGame nur eine Fernnutzung von Programmen innerhalb lokaler Netzwerke möglich. Bereits im März 2008 sollen aber Streams via Breitband-Internet möglich werden und auch eine Unterstützung aller Universal-Plug-and-Play-Geräte, die MP4-Streams wiedergeben können, ist geplant. Eine Office-Version der Technologie ist für den weiteren Verlauf des Jahres vorgesehen. Auch an weiteren Anwendungsmöglichkeiten, etwa für Webcam-Aufnahmen," werde gearbeitet. """"Unser Plan ist es"," alles legal zu streamen""""", steckt Faria das Ziel hoch. Der Faktor Legalität ist ihm dabei wichtig: Anwender sollen nur ihre legale Software nutzen, aber dank StreamMyGame nicht zwangsläufig direkt auf dem PC, wo sie installiert ist," oder immer mit demselben Endgerät."""
"Nervenfreilegung verhindert Amputationen bei Diabetes;""Neuartiger Therapieansatz hilft Patienten mit offenen Wunden"
Eine neuartige Therapie gegen Nervenschädigungen bei Diabetes mellitus bietet die Klinik der Medizinischen Hochschule Hannover http://www.mh-hannover.de/ an. Durch Freilegung von Nerven können Patienten mit Schmerzen und nicht mehr heilenden Wunden vor Amputationen geschützt werden. Die MHH-Klinik wendet im Zusammenarbeit mit der Klinik für Neurologie und der Klinik für Hepatologie und Endokrinologie das in der USA entwickelte Konzept der vorsorglichen Nerven-Entlastung an.In Deutschland leiden mehr als vier Mio. Menschen an Diabetes mellitus (Zuckerkrankheit). Bei 30 bis 50 Prozent entwickelt sich die diabetische Nervenschädigung, genannt Neuropathie. Häufigste Symptome sind zuerst ein lästiges Kribbeln, später oft extreme Brennschmerzen und weitgehende Gefühllosigkeit an Händen und Füßen. Der Verlust der Schutzsensibilität ist die Hauptursache für das diabetische Fußsyndrom, verbunden mit Infektionen und Geschwüren. Mehr als 25.000 Amputationen an Fuß, Unter- oder Oberschenkel werden allein in Deutschland durchgeführt. Da die gesundheitliche Belastung bei einer Amputation extrem hoch ist, sterben laut Kontrollstudien mehr als 30 Prozent der Diabetiker innerhalb von zwei Jahren, nach einer Unterschenkelamputation. Die Behandlungskosten sind zudem sind enorm.Eine diabetische Nervenschädigung kann zwar durch Medikamente verlangsamt werden," aber auch bei guter Blutzuckereinstellung schreitet sie unumkehrbar fort. """"Es ist tierexperimentell und klinisch eindeutig bewiesen"," dass die diabetische Neuropathie auch durch die langandauernde Nerveneinengung verursacht sein kann. Hier ist ein wirksamer Therapieansatz möglich""""", erklärt Experte Peter Vogt von der Plastischen," Hand- und Wiederherstellungschirurgie der MHH-Klinik Hannover. """"An anatomisch vorgegebenen Engstellen", etwa im Verlauf nahe des Knochens," kommt es zu einer chronischen Druckschädigung des diabetischen Nervens. """"Mit einer Entlastung des Nervens wird die Ursache der Schädigung beseitigt""""", betont Professor Vogt mit Blick auf die Entwicklung des Therapieansatzes von Lee A. Dellon. Mit der Entlastung der Bein-Nerven wird eine Nervenlösung bewirkt," die eine deutliche Schmerzlinderung und die Wiederkehr der Schutzsensibilität zur Folge hat. """"Bisher wurden in den USA schon mehr als 1.000 Patienten operiert"," in mehr als 80 Prozent der Fälle besserten sich die oft kaum erträglichen Schmerzen deutlich. Auch war keine Amputation mehr notwendig""""", erklärt Andreas Gohritz, Arzt in der MHH-Klinik für Plastische, Hand-und Wiederherstellungschirurgie. Voraussetzung für eine Operation ist der Nachweis einer Nervenkompression an Hand oder Bein als Ursache für eine Neuropathie sowie eine adäquate Blutzuckereinstellung und Beindurchblutung," um eine gute Wundheilung zu erreichen. Jeder Patient wird neurologisch und chirurgisch untersucht. Das Ausmaß der Neuropathie wird durch ein speziell entwickeltes Sensibilitätsgerät (PSSD) bestimmt und dokumentiert."""
"Bankensektor drohen weitere Filialschließungen;""Genossenschaftsbanken und Sparkassen besonders betroffen"
Die steigende Konsolidierung am deutschen Bankensektor bringt weitere Filialschließungen mit sich. Bankkunden müssen damit rechnen, dass vor allem Genossenschaftsbanken und Sparkassen die Zahl ihrer Filialen in den kommenden fünf Jahren deutlich verringern," prognostizieren Experten am Zentrum für Europäische Wirtschaftsforschung (ZEW) http://www.zew.de . """"Insgesamt wird die Zahl der Bankfilialen in Deutschland weiterhin abnehmen. Die wachsende Zahl der Filialen ausländischer Privatbanken kann die Masse der Sparkassen und Genossenschaftsbanken", die geschlossen werden," nicht ausgleichen""""", sagt Matthias Köhler, wissenschaftlicher Mitarbeiter im Bereich Internationale Finanzmärkte und Finanzmanagement am ZEW, gegenüber pressetext.Bereits in den vergangenen Jahren war die Anzahl der Bankfilialen deutlich rückläufig. Wurden 1995 noch 70.000 Filialen gezählt, sind es mittlerweile nur noch 40.000. Im Rahmen einer Umfrage des ZEW gaben knapp 70 Prozent der befragten Finanzmarktexperten an, mit einer weiteren Reduktion der Filialanzahl zu rechnen. Sowohl die zunehmende Konsolidierung als auch die Verbreitung alternativer Vertriebskanäle treiben die Schließungen voran. Während die Filialanzahl der inländischen Privatbanken nach Ansicht von 45 Prozent der Experten stabil bleiben wird, sagt nur ein Viertel der Befragten eine ähnliche Entwicklung für Sparkassen voraus. Bei Genossenschaftsbanken sehen nur 20 Prozent eine gleichbleibende Filialanzahl.Für ausländische Privatbanken zeigt die Expertenprognose jedoch ein Wachstum des Filialnetzes voraus. Diese hätten nun erkannt, dass im Retail-Banking nicht alle Produkte über das Internet verkauft werden können, erläutert Köhler im pressetext-Gespräch. Um den Kontakt zum Kunden zu verstärken," setzen ausländische Anbieter nun zunehmend auf Filialen. Trotzdem konzentrieren sie sich primär auf den städtischen Bereich. """"In ländlichen Regionen ist es notwendig", eine ganze Reihe an Zweigstellen aufzubauen," was mit hohen Kosten verbunden ist und damit den Wettbewerbsvorteil der ausländischen Privatbanken reduzieren würde""""", so Köhler.Der Trend zur Schließung von Genossenschaftsbanken und Sparkassen sei jedoch auch am Land zu beobachten. Stattdessen würden hier künftig auch Service-Terminals und mobile Berater zum Einsatz kommen. Insgesamt rechnen die Experten damit," dass rund 40 Prozent der Retail-Banking-Produkte auch in den kommenden Jahren über Filialen vertrieben werden."""
"Streikende Autoren verursachten Schaden in Milliardenhöhe;""Dreimonatiger Ausfall hatte Auswirkungen auf zahlreiche Branchen"
Der Streik der Drehbuchautoren in Los Angeles hat einen wirtschaftlichen Schaden in Milliardenhöhe verursacht. Umsatzausfälle machen sich nicht nur bei den betroffenen Hollywood-Studios bemerkbar. Die Auswirkungen ziehen darüber hinaus weite Kreise in andere Branchen und schaden vornehmlich in Los Angeles ansässigen Unternehmen. Der US-amerikanische Wirtschaftsexperte Jack Kyser kommt zu dem Ergebnis, dass der Autorenstreik 1,"7 Mrd. Euro kostete. """"Hierzulande ist mit einer ähnlichen Situation nicht zu rechnen. Zwar haben die Maßnahmen in den USA auch deutsche Autoren beflügelt und es sind einige Aktionen geplant"," Streiks sind aber nicht zu erwarten""""", sagt Margarete Evers, Geschäftsführende Justiziarin bei der Arbeitsgemeinschaft Neuer Deutscher Spielfilmproduzenten http://www.ag-spielfilm.de , im Gespräch mit pressetext.Rechtzeitig zur Oscar-Verleihung wurde der Arbeitskampf in Hollywood, der seit dem 5. November des Vorjahres andauerte (pressetext berichtete: http://www.pte.at/pte.mc?pte=071217040 ), zwar vergangene Woche beendet, alleine die Absage der Golden-Globe-Verleihung verursachte aber Ausfälle von 40 Mio. Euro, so der Internetdienst E!online. Der Gesamtschaden betrifft neben den aktiv am Film- und Fernsehgeschäft Beteiligten vor allem Zuliefererbetriebe. Laut Kyser sollen die Einnahmeausfälle neben Limousinenanbietern," Maskenbildnern und Friseuren sogar bei Blumenhändlern spürbar gewesen sein.""""Ob der Streik in Hollywood auch wirtschaftliche Folgen für die deutsche Filmwirtschaft nach sich ziehen wird"," ist derzeit noch nicht abzusehen. Für solche Aussagen ist es noch zu früh"""""," erklärt Evers. Langzeitauswirkungen sind aber nicht auszuschließen. Über die Ergebnisse aus den Verhandlungen zwischen Autoren und Produzenten sei aktuell noch relativ wenig bekannt. """"Eine höhere Beteiligung wird auch von deutschen Schreibern gefordert. Im Moment steht die Angemessenheit der Vergütung zur Debatte. Dafür wurden bisher noch keine Ergebnisse erzielt"""""," heißt es von der Expertin abschließend."""
"ziegler-metall.de: Schneller suchen und finden;""Stadtausrüster zeigt neuen Internetauftritt"
Mit dem Versand der Kataloge für die Saison 2008 schaltet die Ziegler Metallbearbeitung auch einen erneuerten Webauftritt online. Neben optischen Retuschen wurde vor allem an der Nutzerfreundlichkeit gearbeitet. Im Suchfenster führt eine Vorauswahlliste von Stichwörtern den Benutzer schnell zur richtigen Seite. Über ständig sichtbare Pull-Down-Menüs kann der Nutzer an jeder Stelle innerhalb der Internetseite navigieren. Ein virtueller Merkzettel unterstützt beim Stöbern in einer Auswahl von über 3.500 Produkten. Architekten und Planer können Ausschreibungstexte in Formaten wie GAEB, Önorm, Pdf, Doc und so weiter auf die eigene Festplatte exportieren. Ein RAL-Schema hilft bei der Farbauswahl. Um zum Beispiel die Fahrradabstellanlagen für Mehrfamilienhäuser oder Sporthallen ausreichend zu bemessen, liefert der Bereich Planungshilfen aktuelle Richtwerte. Neu sind auch die Karten zur Berechnung von Schneelasten. Auf den jeweiligen Länderseiten findet der Fachplaner die gesetzlich festgelegte und in den verbindlichen Normen fixierte Schneelastzone für das gesuchte Gebiet. Trotz umfangreichem Internetangebot muss keiner auf eine persönliche Beratung verzichten, der Bereich Kundenservice wurde übersichtlich gestaltet. Auf einen Blick ist die nächstgelegene Vertretung erkennbar und der richtige Ansprechpartner gefunden. Über E. Ziegler Metallbearbeitung GmbH: Die Ziegler Metallbearbeitung GmbH entwickelt, fertigt und montiert Stahlleichtbaukonstruktionen aller Art. Dazu gehören beispielsweise Überdachungen, Vordachkonstruktionen und Pavillons. Außerdem liefern und montieren wir bundesweit Produkte von A wie Abfallbehälter bis Z wie Zaunsysteme. Ein knapp 800 Seiten starker Katalog informiert über mehr als 3.500 Produkte. Typische Kunden kommen aus den Bereichen der öffentlichen Verwaltung, Garten- und Landschaftsgestaltung, Architektur, Gewerbe, Industrie und Hausverwaltung. Das 1993 gegründete Unternehmen beschäftigt 110 Mitarbeiter. Der Produktions- und Verwaltungsstandort befindet sich im sächsischen Nebelschütz, nordöstlich von Dresden. Dazu gibt es Niederlassungen bei Stuttgart, Köln/Bonn und Chemnitz. Im europäischen Ausland ist die Firma über Tochterunternehmen in Österreich," der Schweiz und Polen vertreten. Weitere Standorte sind im Gespräch."""
"Friesischer Frühling - Der Tee zum Husumer Krokusblütenfest;""Husumer Krokusblüte - das Frühlingsfest mit mehr als 4 Mio. Krokussen"
Seit die Holländer 1610 den Tee von China nach Europa brachten entwickelte sich der Tee vom Genuß zur Passion und es entstanden aus verschiedenen Teesorten zahlreiche Tee-Spezialitäten. Für die Husumer Krokusblüte - das in Norddeutschland weit bekannte Frühlingsfest am 15./16.3. (http://www.husum-tourismus.de) mit mehr als 4 Millionen blühenden Krokussen und einem großen Fest hat das Teekontor Nordfriesland http://www.teekontor-nf.de einen besonderen Tee, den Friesischen Frühling, entwickelt. Die Zutaten aus einer Ceylon-China-Mischung, Malven-, Sonnenblumenblüten und Aroma schaffen ein frühlingshaftes und fein abgestimmtes Flair. Teekontor Nordfriesland bietet seit 1985 den passionierten Teefreunden, wie auch den neugierigen Teeinteressierten mehr als 500 verschiedene Teesorten an. Dazu auch Palm-, Ingwer-, Dattel- und Masala-Kandis, Teezubehör, Geschirr, besondere Accessoires und ausgewählte Geschenksets, ebenso viele Honig- und Bonbonsorten wie zu Großmutters Zeiten. Alle Angebote sind in den verschiedenen Geschäften in Husum, Flensburg, Westerland, Friedrichstadt, Heide," etc. und auch unter http://www.teekontor-nf.de erhältlich. """"Unsere Reisen in die Anbauländer und die Erfahrungen in den Teeplantagen vor Ort"," wie auch die Freundschaft mit den Anbauern ermöglichen uns die beste Tee-Qualität der einzelnen Sorten herauszufinden"""""," so Gerhard Biel vom Teekontor Nordfriesland. """"Und dabei entstehen auch einzigartige Teemischungen wie der Moin-Moin Frühstückstee", der Original Schietwetter Kräutertee und der Dünenzauber. Eine Besonderheit sind auch die Chinesischen Teerosen, zu Kugeln geformte Teeblätter mit eingeschlossenen Blüten, die sich dann in der Tasse öffnen und zauberhaft aussehen. Die Schwarz- und Grüntees vermittelten das Bewusstsein für die Aroma-Vielfalt und die vielen Duftnuancen, Farbtöne und Blattformen. Tees liefern wir nicht nur nach Deutschland, sondern z. B. auch nach Canada, England, Frankreich," USA und auch zu unseren Nachbarn nach Dänemark."""" Das Teekontor Nordfriesland begleitet Teefreunde auf dem Weg zum Teekenner", berät bei der Auswahl der Aromen, hilft bei der Orientierung in der Welt des Tees und hält ein führendes Angebot an Qualität und Sorten dafür bereit. Kontakt: 
Teekontor Nordfriesland 
Tel. 04846 1523 
E-Mail: info@teekontor-nf.de 
"http://www.teekontor-nf.de"""
"SAS schützt HBOS vor Debitkartenbetrug;""SAS wird Finanzdienstleister umfassende Plattform für Betrugsbekämpfung liefern"
Der britische Finanzdienstleister HBOS wird mit dem weltgrößten Business-Intelligence-Anbieter SAS zusammenarbeiten," um seine Kunden besser vor Betrug zu schützen. Die Kooperation erstreckt sich über einen Zeitraum von sieben Jahren. HBOS wendet sich mit seinen Bankingleistungen an Privat- und Firmenkunden und ist Großbritanniens größter Hypothekenfinanzierer.In einem ersten Schritt wird HBOS die Lösung """"SAS Fraud Management"""" - eines der umfassendsten derzeit verfügbaren Betrugserkennungssysteme - einsetzen", um den Missbrauch von Millionen von Debitkarten zu verhindern. Die Antibetrugslösung von SAS ermöglicht es dem Finanzdienstleister, illegale Transaktionen schneller, früher und präziser zu identifizieren. Die Analytics-Anwendung ist eines der umfassendsten derzeit verfügbaren Betrugserkennungssysteme und analysiert in Echtzeit jeden einzelnen Vorgang, der mit einer Debitkarte durchgeführt wird. Dazu wird die Transaktion innerhalb von Sekundenbruchteilen auf ungewöhnliches Zahlungs- und Abhebeverhalten untersucht. Erst wenn alle Parameter überprüft sind, wird der Vorgang durchgeführt.HBOS kann die SAS Lösung auch dazu nutzen," seine Kunden vor anderen Formen des Transaktionsbetrugs zu schützen - etwa vor dem Missbrauch von Kredit- und Bankkarten. HBOS und SAS arbeiten bereits seit vielen Jahren im Bereich Risikomanagement zusammen.""""Wir ziehen SAS anderen Anbietern vor"," weil das Unternehmen erwiesenermaßen über fundiertes Know-how in der Betrugsbekämpfung verfügt""""", erklärt Ian Fielder," Head of Risk Operations bei HBOS. """"Zudem bietet SAS eine zentrale", unternehmensweit einsetzbare Plattform für zahlreiche unserer Antibetrugsaktivitäten. SAS ist der Partner, mit dem wir in den nächsten Jahren nicht nur unsere Kunden," sondern auch unser Geschäft optimal vor der andauernden Gefahr durch Betrug schützen werden.""""""""Aufgrund täglich wachsender Transaktionsvolumina wird es für Finanzdienstleister immer wichtiger", ein unternehmensweites System zu etablieren, das Betrügereien in Echtzeit entlarvt. Doch die Betrugsmuster werden immer komplexer. Das bedeutet," dass eine rein regelbasierte Prüfung auf Betrugsverdacht nicht mehr ausreichend ist""""", so Wilhelm Petersmann," Country Manager bei SAS Austria. """"Basierend auf ausgefeilten analytischen Verfahren und Simulationsmöglichkeiten kombiniert SAS Fraud Management daher den Regelansatz mit On-Demand-Scoring und ermöglicht eine Echtzeitintegration in das Autorisierungssystem der Bank. Komplettiert wird die Lösung durch Case Management und umfangreiche Reportingfunktionalitäten.""""Über SAS:"
SAS ist mit 2,15 Milliarden US-Dollar Umsatz weltweit größter Anbieter von Business-Intelligence-Software. Die strategisch-analytischen Lösungen von SAS werden von 4,5 Millionen Anwendern in 112 Ländern eingesetzt - darunter in 96 der Top-100 der Fortune-500-Unternehmen. Die Fach- und Branchenlösungen von SAS helfen Unternehmen dabei, aus ihren vielfältigen Geschäftsdaten konkrete Informationen für strategische Entscheidungen zu gewinnen. Mit den SAS Lösungen können Unternehmen Strategien entwickeln und umsetzen, die eigene Leistungsfähigkeit messen, ihre Kunden- und Lieferantenbeziehungen profitabel gestalten sowie die gesamte Organisation steuern und zugleich regulatorische Vorgaben erfüllen. Als weltweit einziger Hersteller bietet SAS alle Komponenten der Business-Intelligence-Prozesskette aus einer Hand - von Datenintegration, -management und -analyse über das Reporting bis hin zur grafischen Aufbereitung der Informationen. Firmensitz der 1976 gegründeten US-amerikanischen Muttergesellschaft ist Cary," North Carolina (USA). SAS Austria hat seinen Sitz in Wien und beschäftigt 50 Mitarbeiter."""
"Neue Automatisierungsprozesse für das Bauwesen;""RIB Software und Topcon Europe schließen Technologiepartnerschaft"
Die RIB Software AG und die Topcon Europe Positioning B.V. geben im Rahmen des VDBUM-Seminars (Verband der Baumaschinen-Ingenieure und -Meister e.V.) in Braunlage ihre technologische Zusammenarbeit bekannt. Ziel der Partnerschaft ist die Bündelung der Kompetenzen im Infrastrukturbereich. Die neuen Lösungen der beiden Unternehmen werden insbesondere für ausführende Unternehmen im Straßen-, Tief- und Verkehrswegebau einen Mehrwert bieten.Durch die Integration der RIB-Projektmanagementlösung ARRIBA®* mit SiteLINK, dem neuen Kommunikations- und Management-System von Topcon, realisieren die Unternehmen derzeit eine Plattform, mit der Projektleiter erstmals in der Lage sein werden," den aktuellen Planungsstand sowie den Baufortschritt in Echtzeit zu verfolgen. Sowohl mit Maschinen erbrachte Leistungen als auch verbrauchte Ressourcen werden vom Baumanagement-Team permanent """"live"""" abgefragt. RIB und Topcon entwickeln somit ein durchgängiges System für alle Projektphasen. Ob in Planung", Ausführung," in der Bauabrechnung oder im Controlling.""""Durch das Zusammenspiel unserer Softwarelösungen mit den Hardware-Komponenten von Topcon zeigen wir neue Wege für Automatisierungsprozesse im Bauwesen auf """"", erklärt Michael Sauer," Vorstand der RIB Software AG.""""Im Weiteren planen wir eine strategische Kooperation mit RIB für die europaweite Vermarktung unserer gemeinsamen Lösung""""", ergänzt Ewout Korpershoek, Director Marketing und Sales bei der Topcon Europe Positioning.* Die in Deutschland etablierte Projektmanagement-Softwarelösung ARRIBA® wird international unter dem Namen RIB CSuite vermarktet.Über die RIB Software AG
RIB Software AG - der Name steht im Softwaremarkt für Bauwesen, Anlagenbau und Infrastrukturmanagement schon seit fast 50 Jahren für innovative Planungsideen und zuverlässige Kostenkontrolle. Mit weltweit über 100.000 Installationen zählt RIB zu den führenden Anbietern für Projektmanagement-Softwarelösungen. Dabei baut RIB-Software die Brücke zwischen Computer Aided Design-Anwendungen (CAD) und den Enterprise Resource Planning-Systemen (ERP). Die RIB Lösungen decken die gesamte Wertschöpfungskette im Bau-, Anlagenbau- und Infrastrukturbereich ab, inklusive Projektierung, Planung, Kalkulation, Koordination, Controlling, Beschaffung und Nutzung. Zu den Anwendern zählen führende Baukonzerne, die öffentliche Hand, Architektur- und Ingenieurgesellschaften sowie Großunternehmen im Bereich des Industrie- und Anlagenbaus. Mehrsprachige und mehrwährungsfähige Lösungen gewährleisten auch international eine erfolgreiche Projektabwicklung. Über Vertriebs- und Servicebüros in Europa, in den USA, im Nahen Osten und Asien werden RIB-Lösungen rund um den Globus vermarktet.Über Topcon Europe Positioning
Topcon Europe Positioning B.V. ist der europäische Hauptsitz von Topcon Corporation Tokyo. Das Unternehmen koordiniert den Vertrieb und Verkauf, den technischen und Kundendienst-Support, die Entwicklung des Vertriebsnetzes sowie auch den Fluss von Informationen aus den europäischen Märkten zu den Ingenieuren in den Entwicklungsabteileungen. Die Topcon Corporation ist ein multinationales Unternehmen und führend in der Herstellung von optischen und elektronischen Instrumenten für die medizinische und ophthalmologische Anwendungen, sowie für die Vermessungs- und Bauindustrie. Topcon ist Entwickler und Hersteller von innovativen Positionsbestimmungsgeräten. Topcon Corporation wird auf der Börse in Tokio gehandelt (Tokyo Stock Exchange, 7732). Das Unternehmen hat die weltweit größte Auswahl an Präzisions-GPS+, Laser-," optischen Vermessungs- und Maschinensteuerungsprodukten sowie dazugehörige Software in seinem Programm."""
"Unfreiwillige Schläfchen tagsüber erhöhen Schlaganfall-Gefahr;""Risiko kann bis auf das Vierfache ansteigen"
