title;text
"Trump: Gefangenenlager Guantanamo wird nicht geschlossen;""In seiner Rede zur Lage der Nation beschwört Donald Trump den """"amerikanischen Augenblick"""". Guantanamo soll weiterhin bestehen bleiben. Und der US-Präsident will das Atomwaffenarsenal modernisieren.US-Präsident Donald Trump hat in seiner ersten Rede zur Lage der Nation Aufbruchstimmung und einen """"neuen amerikanischen Augenblick"""" beschworen. """"Die Lage der Nation ist stark"," weil das Volk stark ist""""", sagte der Präsident am Dienstagabend (Ortszeit) im Kapitol. Er kündigte an, mehr Geld für das Militär auszugeben, aber auch für die Infrastruktur, etwa beim Straßenbau oder dem Breitbandausbau.Der Präsident forderte darüber hinaus mehr Ausbildungsinitiativen. Er erklärte aber auch, das umstrittene Terroristen-Gefängnis Guantanamo Bay auf Kuba solle offen bleiben.>>>Kommentar: Spalten statt versöhnen<<<Die 80-minütige Rede war gespickt mit Pathos und viel Nationalstolz. Immer wieder wies der Präsident auf die Taten von im Publikum sitzenden Amerikanern hin, die dem amerikanischen Bild von Heldentum entsprächen. Viele derzeit in den USA heiß diskutierte Streitpunkte, darunter die Russland-Affäre oder das Freihandelsabkommen Nafta mit Mexiko und Kanada, erwähnte Trump mit keiner Silbe. Er habe einen Erlass unterzeichnet, das Lager Guantanamo entgegen einer Anordnung seines Vorgängers Barack Obama offen zu halten, sagte Trump. Terroristen seien nicht bloß Kriminelle," sie seien feindliche Kämpfer. """"Und wenn sie im Ausland gefangen genommen werden", sollten wir sie wie die Terroristen behandeln," die sie sind""""", sagte Trump. Er habe Verteidigungsminister James Mattis in dem Erlass zugleich beauftragt, die Inhaftierungspolitik des Militärs auf den Prüfstand zu stellen.Bis zu 1,8 Millionen illegal ins Land gekommenen jungen Einwanderern will Trump eine Einbürgerung ermöglichen. Migranten," die bestimmte Anforderungen erfüllten und einen """"guten moralischen Charakter"""" hätten", sollten die Möglichkeit haben, die US-Staatsbürgerschaft zu erlangen, sagte Trump. Der Republikaner machte aber zugleich klar, dass er im Gegenzug Geld für den geplanten Bau der Mauer an der Grenze zu Mexiko wolle.Das Weiße Haus hatte die Pläne für die Reform der Einwanderungspolitik in der vergangenen Woche vorgelegt. Sie sind höchst umstritten, weil sie die Abschaffung mehrerer Bestandteile des bisherigen Systems vorsehen. So will Trump etwa die sogenannte Greencard-Lotterie beenden, die Menschen aus vielen verschiedenen Ländern eine Chance auf eine Arbeits- und Aufenthaltserlaubnis in den USA gibt. In den nächsten Wochen muss er eine Einigung mit den Demokraten finden.


"USA: US-Amerikaner verfolgten die """"Rede zur Lage der Nation"""""






"Der US-Präsident zeigt sich zufrieden: In seiner Rede zur Lage der Nation beschwört Donald Trump den """"amerikanischen Geist"""".AFP"






Die 80-minütige Rede war gespickt mit Pathos und viel Nationalstolz - viele Streitpunkte wurden ausgeklammert.AFP






First Lady Melania Trump ist zur Rede ihres Mannes in einem weißen Hosenanzug im Kongress erschienen.AFP












Bei Trumps Rede vor dem Kongress im vergangenen Jahr hatten sich zahlreiche demokratische Frauen ganz in Weiß gekleidet, um an die Suffragetten-Bewegung Anfang des 20. Jahrhunderts zu erinnern. Damals protestierten Frauen in weißer Kleidung für ein flächendeckendes Frauenwahlrecht.AFP






Seit mehreren Tagen gibt es Spekulationen über mögliche Ehe-Probleme der Trumps. Ausgelöst wurden diese durch Berichte über eine angebliche Affäre zwischen Donald Trump und der Porno-Darstellerin Stephanie Clifford," die als """"Stormy Daniels"""" agiert. Sie veröffentlichte am Dienstag eine Stellungnahme", in der sie die Affäre dementierte.AFP






Befeuert wurden die Gerüchte über eine Ehe-Krise dadurch, dass Melania Trump ihren Mann vergangene Woche nicht zum Weltwirtschaftsforum nach Davos begleitet hatte und stattdessen allein nach Florida gereist war.AFP
