title;text
"Moser habe 2018 keine Richter-Stellenkürzungen vorgesehen;""Nachdem Richter und Staatsanwälte eindringlich vor Kürzungen an den Gerichten gewarnt hatten", versucht Justizminister Moser nun zu beruhigen. Justizminister Josef Moser (ÖVP) versucht," den Sorgen der Richter und Staatsanwälte über Planstellenkürzungen entgegenzutreten - zumindest für das laufende Jahr: """"Es ist von meiner Seite aus nicht vorgesehen"," die im Personalplan bisher ausgewiesenen Planstellen für Richter und Staatsanwälte im Jahr 2018 zu kürzen""""", sagte er laut einer schriftlichen Stellungnahme.Der Minister verwies darauf," dass die Budgetverhandlungen """"momentan im Gange"""" seien. Richter und Staatsanwälte befürchten", dass der - künftig verschärfte - Aufnahmestopp für den öffentlichen Dienst (nur mehr jede dritte Stelle soll nachbesetzt werden) anders als bisher auch für die Justiz gelten soll.Tja, ich sag nicht daß es nicht kommt," aber in dennächsten zehn Moonaten simma noch nicht so weit."""
"Den Schlagenden droht die Zerschlagung;""Der Burschenschaft Germania droht die Auflösung", die FPÖ will indes ihre Vergangenheit aufarbeiten. Vorbild für die angekündigte Historiker-Kommission könnte eine Studie zum Bund Sozialistischer Akademiker sein.Geht es der umstrittenen Wiener Neustädter Burschenschaft Germania wirklich an den Kragen? Oder stößt die in die Defensive geratene Bundesregierung bloß leere Drohungen aus," um sich in der Causa Luft zu verschaffen?Leiter der InnenpolitikLeiter der InnenpolitikParental advisoryExplizit content😊Wir sind schon darüber hinausNotstand! Auf Verdacht einbuchten! Mund 3 Jahre!!Jeder Imam wird ausgiebig überwachtnur bei den Kellernazis hört man geflissentlich weg.  Dabei dürften die staatsfeindlichen Verbalausritte bei deren Zusammenkünften nicht nur in vertonter Form hörbar werden.Das muß man sich erst einmal auf der Zunge zergehen lassenDa sitzt Herr Landbauer bei Herrn Wolf in der ZibII und ergeht sich dabei wie schiach man zu ihm sei das man ihm ein Buch vorwirft das veröffentlicht wurde als er 5 war. Nun sehen wir Bilder aus der Bude der Germania die alle Zweifel ausräumen. Da ging die """"Deutsche Post"""" ab. Darüber hinaus erfahren wir von einem Herrn das Singen solcher Lieder dort quasi zum Inhalt eines Treffens gehörte.Also hat Herr Landbauer gelogen das sich die sprichwörtlichen Bretter gebogen haben.Nun geht Herr Kickl", Symphatisant der Rechtsextremen vor. Gibt es da nicht ein süßes Video wo er mit Herrn Landbauer schunkelnd Liedchen singt? Das wird also ein grausames Verfahren.Und Herr Strache wird uns erneut fragen was wir dem Herrn eigentlich vorwerfen. Er hält uns sehr doof. Er selbst Mitglied einer schlagenden Burschenschaft weiß besser wie wir was dort abgeht. Aber uns," dem Fußvolk kann man alles erzählen. Man kann uns Durchschummler und Sozialschmarotzer schimpfen haben aber immer noch mehr Ehrhaftigkeit am Leibe wie diese Herren.Sehr interessant der Artikel in der Kleinen von heute der schon schwer zu finden ist. Er lautet. Arm vs. reich Expertin: Gesellschaftliche Spaltung von Politik erwünscht"""
"Causa Landbauer spaltet die ÖVP;""Landeshauptfrau Mikl-Leitner zieht alle Register", um Udo Landbauer politisch zu isolieren. Ihr Klubobmann sieht dies anders - aus Gründen des Machterhalts. Für Klaus Schneeberger, Klubobmann der ÖVP Niederösterreich, gilt in der NS-Liedgut-Affäre um Udo Landbauer die Unschuldsvermutung. Auch in der Zib2 Mittwochabend reagierte Schneebauer eher schaumgebremst - und ungleich diplomatischer als die niederösterreichische Landeshauptfrau Johanna Mikl-Leitner, die am heutigen Donnerstag die Spitzen der niederösterreichischen Parteien trifft, durch einen Trick aber verhindert, dass sie Landbauer überhaupt empfangen muss. Geladen sind nur die Parteichefs sowie die Klubobleute von SPÖ, FPÖ, Neos und Grünen, Landbauer ist  Spitzenkandidat der FPÖ.Mikl-Leitner hatte sich bereits vor dem Wahltag in der Causa exponiert und noch am Samstag eine Zusammenarbeit mit dem in die NS-Liedgutaffäre indirekt verwickelten Landbauer ausgeschlossen. Landbauer war immerhin Vizeobmann der umstrittenen Burschenschaft Germania, in der, so ein ehemaliges Mitglied am Mittwoch in der Zib2, sehr wohl immer wieder antisemitische, rassistische, NS-sympathisierende Lieder gesungen wurden. Der interviewte Ex-Burschenschafter widerspricht damit komplett den Beschwichtungsformeln der FPÖ.
Regierung will Burschenschaft Germania auflösen




Manche in der ÖVP hatten Mikl-Leitner geraten, erst am Wahlabend, also nach Wahlschluss, dem freiheitlichen Spitzenkandidaten die rote Karte zu zeigen, die ÖVP-Spitzenkandidatin zog es allerdings vor, noch vor dem Wahlsonntag Haltung zu zeigen.Schneeberger reagiert aus naheliegenden Gründen zurückhaltend: Schneeberger ist Bürgermeister von Wiener Neustadt und bildet gemeinsam mit den Grünen," zwei Listen und  der FPÖ eine """"bunte Koalition"""" in der vormals rot regierten Stadt. Mitglied der aktuellen Stadtregierung ist Landbauer", der 2017 mit 94 Prozent zum FPÖ-Parteichef von Wiener Neustadt gewählt wurde, also eine tragenden Rolle innerhalb der Wiener Neustädter FPÖ und somit auch innerhalb der Wiener Neustädter Koalition einnimmt. Eine zu harte Gangart könnte die bunte Koalition, die 2015 gegen die stimmenstärkste Partei, gegen die SPÖ, gebildet wurde, zum Platzen bringen. Er, Schneeberger, arbeite im kommunalen Bereich seit drei Jahren mit dem FPÖ-Politiker zusammen," meinte am Dienstag zur APA. Es sei dabei """"nicht einmal ansatzweise nationalistisches Gedankengut spürbar gewesen"""". Im Gegenteil"," betonte Schneeberger. Landbauer arbeite """"seriös und konstruktiv"""" mit. Die Liederbuch-Affäre der Burschenschaft des FPÖ-Stadtrats sei freilich eine """"ernste Sache.""""Die Unschuldsvermutung gelte für ihn vor allem insofern", als Landbauer beteuere," entsprechende Lieder """"weder gekannt noch gesungen zu haben"""". Die Sache sei """"sensibel"""""," sagte Schneeberger. Sollte """"nur ansatzweise etwas dahinter"""" sein"," sei """"klar"," dass es Konsequenzen gibt"""". Dann würde sofort gehandelt""""", so der Bürgermeister. Es bestehe derzeit nur ein Verdacht. Deshalb ermittle auch die Staatsanwaltschaft. Sollte sich der Verdacht erhärten," werde Landbauer gehen müssen. """"Wenn nicht"," bleibt er""""", machte Schneeberger klar. Kompromisslosigkeit sieht anders aus. Anmerkung: Die Wiener Neustädter Grünen beharren darauf, dass sie in keiner formellen Koalition mit der ÖVP und der FPÖ sitzenLeiter der InnenpolitikLeiter der InnenpolitikDie Unschuldsvermutung gelte für ihn vor allem insofern, als Landbauer beteuere," entsprechende Lieder """"weder gekannt noch gesungen zu haben"""". Heißt das auch", wenn Kinderpornos in einem Verein gefunden werden, dass der Obmann nur beteuern muss, dass er diese weder gekannt noch gesehen hat," und schon ist alles OK?Jetzt stecken die Grünen auch knietief im Landbauerskandal""""Schneeberger ist Bürgermeister von Wiener Neustadt und bildet gemeinsam mit den Grünen"," zwei Listen und  der FPÖ eine """"bunte Koalition"""" in der vormals rot regierten Stadt.""""Haben die Grünen in Wr.Neustadt gar keinen Anstand. Seit einer Woche Landbauer quer durch die Medien und die haben die Koalition mit Schneeberger noch nicht aufgekündigt. Ja", sind denn die Grünen auch schon rechtsrechte Verharmloser und Beschwichtiger. Sapperlot.@Gerhard: Und wieder ein echter Gerhard Kommentar...... es gibt ja etliche Trolle im Forum, aber du scheinst den Ehrgeiz zu besitzen,  hier den Troll der Trolle zu geben ...  ich mir sicher, dass du genug Stoff für ein Dutzend Diplomarbeiten von Psychologiestudenten hergibst!Türkis wartet bis Schwarzreagiert , um erst dann    eine   Aussage  zu wagen. Kurz  demonstriert hier eher  einen Opportunismus , der mit einem neuen Stil nichts am Hut hat.Die Mikl-Leitner soll still ein,sie hat damals nicht mitgekämpft, auch ein Landbauer nicht, ist doch alles ein Theater und künstliche Aufregung!Der Herr soll ja Migrationshintergrund haben,was haben Migranten aus dem nahen Osten mit der rechten Ideologie zu tun? Und warum verbeißen sich die Linken in einen Migranten?Alles ziemlich misteriös und durchsichtig.Sehr geehrte Kleine Zeitung !Es wäre mir ein Anliegen wenn ich in die Zeitung sehe nicht immer wieder in diese höchst unsympathische, überhebliche, zynische Visage dieses Braunen Übels sehen zu müssen !!Lasst die Staatsanwaltschaft urgieren und handeln, unwissend ist er sicher nicht, aber eben typisch für das Braune Übel, verharmlosen und überdecken !! naja - für's aussehen kann er nix (don't judge a book by its cover),"(und dann hätt' die hanni auch nicht so viele stimmen bekommen dürfen ;-)  ) - in der sache selbst wird die staatsanwaltschaft hoffentlich tiefer graben und die richtige entscheidung treffen."""
"Kern: ""Ein Burschenschafter kann in der SPÖ keinen Platz haben"";""Bei 185.000 Mitgliedern könne man zwar """"nicht generell etwas ausschließen"""""," erklärte SPÖ-Chef Kern. Dennoch dürfe es hier """"keine Toleranz geben"""".Eine Mitgliedschaft in einer schlagenden Burschenschaft ist nach Ansicht von SPÖ-Chef Christian Kern grundsätzlich nicht mit einer bei der SPÖ vereinbar. """"Ein Burschenschafter kann in der SPÖ keinen Platz haben"""""," sagte er laut Vorabmeldung der """"Tiroler Tageszeitung"""" (Donnerstag).Bei """"185.000 Parteimitgliedern kann man nicht generell etwas ausschließen""""", räumte Kern, angesprochen auf jenen Verdächtigen in der Germania-Affäre, der SPÖ-Mitglied war," ein. """"Aber wir reagierten in der Sekunde mit dem Parteiausschluss. Da darf es keine Toleranz geben."""" Denn """"mit den klaren Prinzipien in der Partei geht eine Mitgliedschaft in einer schlagenden Burschenschaft nicht zusammen"""".Zuvor war bekannt geworden", dass einer der vier Verdächtigen, gegen die in der NS-Liederbuch-Affäre ermittelt wird, ein Funktionär der SPÖ war. Er soll das Liederbuch der Germania illustriert zu haben. Die Bilder hätten jedoch keinen Bezug zu jener Strophe," um die sich der Skandal dreht: """" """"Gebt Gas", ihr alten Germanen," wir schaffen die siebte Million"""". Der SPÖ-ler wurde umgehend von der Partei ausgeschlossen. Aha",und ein SPÖ-Politiker, der seine Kinder bzw. Enkel sexuell missbraucht, schon??ichweissetwasIch hab immer gesagt, dass Mag. Kern in der Politik nichts verloren hat. Demokratie versteht dieser Mensch einfach nicht. Und das Wort Rechtsstaat ist für den ein Fremdwort. Das ist ein Manager aus dem geschützten Bereich, der die dortigen autokratischen Gepflogenheiten in der SPÖ eingeführt hat. Im Moment muss gottlob nur die SPÖ damit leben. Nicht auszudenken, was geschieht," wenn so ein Mensch mit absoluter Mehrheit (die er ja anstrebt) regiert. So spricht ein wahrer Demokrat!Der Magister Kern scheint jetzt mit dem """"Ausmisten"""" zu beginnen. Wenn er Ex-B.schaftler einschließt.... - aber vielleicht ist der BGM von Wien ja gar nicht SPÖ Mitglied. Schaut mal", wie Demokratie auf links funktioniert liebe Österreicherinnen und Österreicher. Ja," das habt ihr gewählt!"""
"Senat stimmte für umstrittenes Holocaust-Gesetz;""Das Gesetzt sieht Strafen für polnische Bürger und Ausländer vor"," welche die Todeslager der Nazis im besetzen Polen fälschlicherweise als """"polnische Lager"""" bezeichnen.Der polnische Senat hat das umstrittene Gesetz zum Umgang mit dem Holocaust verabschiedet. Das Oberhaus des Parlaments stimmte in der Nacht auf Donnerstag mit 57 Ja- und 23 Nein-Stimmen bei zwei Enthaltungen für den Gesetzentwurf. Es sieht Strafen für polnische Bürger und Ausländer vor"," welche die Todeslager der Nazis im besetzen Polen fälschlicherweise als """"polnische Lager"""" bezeichnen.Auch wenn der polnische Staat oder das polnische Volk der Komplizenschaft mit den Nazis bezichtigt wird", drohen Geldbußen oder bis zu dreijährigen Haftstrafen. Die Reform bedarf zum Inkrafttreten noch der Unterschrift von Präsident Andrzej Duda.
Umstrittenes Holocaust-Gesetz in Polen




Gegner des Gesetzes aus Israel und Polen bemängeln, das Gesetz sei unpräzise formuliert. Dies könne von Regierenden benutzt werden, um Fälle, bei denen die Verantwortung von Polen bei Verbrechen an Juden nachgewiesen wurde, zu leugnen, warnen sie. Die Warschauer Regierung streitet das ab und argumentiert," sie wolle Polens Ruf verteidigen und sich unter anderem gegen die oft nachlässig gebrauchte historisch falsche Bezeichnung """"polnische Todeslager"""" für deutsche Vernichtungslager der Nazis im besetzten Polen während des Zweiten Weltkriegs wehren.Die israelische Regierung hatte am Wochenende gegen das Gesetz protestiert"," das nach ihrer Ansicht zur Verschleierung polnischer Verbrechen an Juden im Zweiten Weltkrieg beitragen könnte. """"Man kann die Geschichte nicht ändern"," und der Holocaust kann nicht geleugnet werden""""", erklärte Israels Regierungschef Benjamin Netanyahu. Senatsmarschall Stanislaw Karczewski betonte, Polen wolle einen Dialog mit Israel führen und seine Intentionen und Ziele in Bezug auf das neue Gesetz erklären.Auch das US-Außenministerium zeigte sich am Mittwoch besorgt über das Gesetz. Eine Sprecherin erklärte, die US-Regierung befürchte," dass das Gesetz der Redefreiheit und der historischen Debatte schaden könne. Zugleich warnte sie Warschau vor möglichen """"Auswirkungen"""" auf die """"strategischen Interessen und Beziehungen Polens"," auch was die USA und Israel angeht"""". Tja", da bin ich ausnahmsweisemal mit dem Nationalisten Netanyahu gegen den Nationalisten Duda einig,Vergangenes gehört den Historikern und man kanns durch Schwachsinnsgesetze nicht ändern die es ohnehin nicht braucht wenn nichts war.Das erinnert an die antiamerikanischen Umtriebe bei den Lehmgekneteten oder an Vergehen gegen das Türkentum nebenan,sagt nie was über die Sachlage," nur über die Pimpelhuber die es tun."""
"50 IS-Kämpfer kamen per Fischerboot nach Italien;""Die Kämpfer aus Tunesien dürften aktuell versuchen", in andere EU-Länder zu gelangen. Vier von ihnen sind den europäischen Behörden bereits bekannt.Interpol hat eine Liste von 50 mutmaßlichen IS-Kämpfern veröffentlicht, die in den vergangenen Monaten in Italien an Bord von Flüchtlingsbooten angekommen sind und die jetzt versuchen könnten, andere EU-Länder zu erreichen. Dabei handelt es sich um tunesische Staatsbürger," berichtete die britische Tageszeitung """"The Guardian"""" auf ihrer Webseite am Mittwoch.Die Liste der Verdächtigten wurde dem italienischen Innenministerium am 29. November übermittelt. Dieses habe die Liste den europäischen Anti-Terrorismus-Behörden weitergeleitet. Tausende Tunesier sollen sich laut UNO-Prognosen den IS-Kämpfern angeschlossen haben. Nach den Niederlagen des Islamischen Staates (IS) in Syrien und im Irak sollen viele von ihnen versucht haben", Europa zu erreichen.Vier der verdächtigten Tunesier auf der Interpol-Liste seien bereits den europäischen Anti-Terrorismus-Behörden bekannt, berichtete das Blatt. Einer von ihnen soll die italienisch-französische Grenze überquert und Gard im südlichen Frankreich erreicht haben. Laut Informationen des britischen Blattes sollten die meisten Tunesier im Zeitraum zwischen Juli und Oktober 2017 Sizilien an Bord von Fischerbooten erreicht haben. Innenminister Marco Minniti hatte zuletzt wiederholt vor der Gefahr gewarnt, dass IS-Kämpfer versuchen könnten, an Bord von Flüchtlingsbooten nach Europa zu gelangen.3.000 Tunesier haben seit Juli die Küste nahe der sizilianischen Stadt Agrigent erreicht. Bisher konnten die italienischen Behörden lediglich 400 Migranten identifizieren. Das Blatt zitierte den Staatsanwalt von Agrigent, Luigi Patronaccio, demzufolge es nicht auszuschließen sei, dass sich unter den tunesischen Migranten, die in den vergangenen Monaten auf Sizilien eingetroffen seien," IS-Kämpfer befanden.Laut dem italienischen Innenministerium wurden 2017 5.500 Tunesier nach ihrer Landung in Italien identifiziert. 2.193 wurden mit Flügen aus Palermo in die Heimat zurückgeschickt. Diese werden zwei Mal wöchentlich durchgeführt nehmen die ngo's solche gefährlichen typen auch mit? wird da nicht selektiert?Die Selektion schaut ziemlich simpel aus...Alle dürfen an Bord!""""Die Kämpfer aus Tunesien..."""" -seit wann ist Tunesien Kriegsgebiet?"""
Experte hält Auflösung für wenig realistisch;Laut Anwalt Höhne ist eine gerichtliche Verurteilung keine Voraussetzung für eine Auflösung. Im Fall der Germania dürfte eine Auflösung dennoch nicht einfach sein.Wenn ein Verein gegen das Strafrecht verstößt, kann er von den Behörden aufgelöst werden. Eine gerichtliche Verurteilung ist keine Voraussetzung, erklärt der auf Vereinsrecht spezialisierte Anwalt Thomas Höhne. „Die Behörde beurteilt das autonom.“ Geregelt ist die behördliche Auflösung im Vereinsgesetz, zuständig ist die Landespolizeidirektion Niederösterreich.Die Schwierigkeit im aktuellen Fall ist laut Höhne, dem Verein nachzuweisen, dass hetzerische und NS-verherrlichende Lieder nicht nur im Liederbuch von 1997 abgedruckt, sondern auch aktuell gesungen wurden. Die bloße Herausgabe des Buches vor 20 Jahren könne - wegen der mittlerweile eingetretenen Verjährung - wohl kein Grund für die Auflösung sein. Höhne kann sich daher auch vorstellen, dass das Auflösungsverfahren nur eingeleitet wurde, um dann zum Ergebnis zu kommen, dass eine Auflösung nicht möglich ist. Dann könne man sagen: „Bitte sehr, das ist ein alter Hut, wir haben unsere Pflicht getan und das war's.“
"Araber für Ost-Jerusalem als Palästinenser-Hauptstadt;""Heute trifft sich die Arabischen Liga zur Entscheidung von US-Präsident Donald Trump"," Jerusalem als Hauptstadt Israels anzuerkennen. Mehrere führende arabische Staaten wollen sich um die internationale Anerkennung von Ost-Jerusalem als Hauptstadt eines künftigen Palästinenserstaates bemühen. Deshalb treffen sie sich heute in Kairo zu Gesprächen.Nach der """"politischen Entscheidung"""" der US-Regierung", Jerusalem als die Hauptstadt Israels anzuerkennen," kämpfen die arabischen Länder für """"die politische Entscheidung"," einen Palästinenserstaat anzuerkennen"""" mit Ost-Jerusalem als dessen Hauptstadt", sagte Jordaniens Außenminister Aiman Safadi Anfang des Jahres. Neben Safadi und dem Generalsekretär der Arabischen Liga, Ahmed Abul Gheit, hatten zu den Vorberatungen zum heutigen Treffen in Kairo auch die Außenminister von Ägypten, Saudi-Arabien," Marokko und der Palästinenserführung teilgenommen. Die Vereinigten Arabischen Emirate schickten einen Außen-Staatsminister.Jordaniens König Abdullah sprach sich bei einer Begegnung mit den Ministern für einen """"gerechten und dauerhaften Friedensvertrag zwischen Israel und den Palästinensern"""" aus.Der Status von Jerusalem ist eine der heikelsten Fragen im Nahost-Konflikt. US-Präsident Donald Trump hatte am 6. Dezember erklärt", Jerusalem als israelische Hauptstadt anzuerkennen und die US-Botschaft von Tel Aviv dorthin zu verlegen. Er brach damit mit einem jahrzehntelangen internationalen Konsens. Demnach soll der Status von Jerusalem erst in einer Friedensvereinbarung mit den Palästinensern festgelegt werden. Diese beanspruchen Ost-Jerusalem als Hauptstadt eines künftigen Palästinenserstaates.Trumps Jerusalem-Entscheidung hatte in den Palästinensergebieten teils gewaltsame Proteste ausgelöst. Jordanien, das die heiligen muslimischen Städten in Jerusalem verwaltet," hatte Trumps Vorgehen als """"Verletzung internationalen Rechts"""" verurteilt. Jordanien sowie Ägypten sind die einzigen arabischen Länder"," die einen Friedensvertrag mit Israel geschlossen haben."""
"Paris will Steuersünder an den Pranger stellen;""Die Regierung von Präsident Macron will Steuerbetrüger an den Pranger stellen. Die Namen von Unternehmen", die die Vorgaben zur Gleichberechtigung nicht erfüllen," werden bereits jetzt veröffentlicht.Die französische Regierung will die schlimmsten Steuerbetrüger an den Pranger stellen. """"Die Franzosen müssen bei schweren Vergehen wissen", wer versucht," seinen legitimen Steuerverpflichtungen zu entkommen""""", sagte Ministerpräsident Edouard Philippe am Mittwoch während einer Fragestunde im Parlament.Als weitere Maßnahmen sollen unter anderem Steuerberater bestraft werden, die ihren Kunden bei Gesetzesverstößen helfen. Die strengen Maßnahmen seien insbesondere deswegen nötig, weil die Steuern für Unternehmen und Privatpersonen sinken sollten, erklärte Philippe.Die Regierung in Paris hatte im vergangenen Jahr damit begonnen, die Namen von Unternehmen zu veröffentlichen, die Vorgaben zur Gleichbehandlung von Mann und Frau nicht erfüllen. Damit löste Präsident Emmanuel Macron ein Wahlversprechen ein. 🤔Er sollte auch Veröffentlichen wie viel Großkonzerne wie Facebook,Starbucks,Apple,"Microsoft und Co an den Staat an Steuern abliefern."""
"Volksbegehren für Rauchverbot wird eingeleitet;""Die Ärztekammer will am Freitag das Volksbegehren für ein generelles Rauchverbot in der Gastronomie starten. Ab Februar können Unterschriften gesammelt werden.Am kommenden Freitag will die Ärztekammer ihr Volksbegehren für ein Rauchverbot in der Gastronomie einleiten"," wie der """"Kurier"""" am Mittwoch (Abendausgabe) berichtete. Mehr als 450.000 Menschen hätten bereits die """"Don't Smoke""""-Petition unterstützt"," das sei eine Basis: """"Wir werden am Freitag das Volksbegehren anmelden"""" sagte der Wiener Ärztekammer-Präsident Thomas Szekeres der Zeitung.Ab Mitte Februar sollen dann auf Gemeinde- und Bezirksämtern Unterschriften gesammelt werden", 8.401 sind notwendig. Danach wird vom Innenministerium ein Termin für die Eintragungswoche festgesetzt. Damit das Volksbegehren dann im Parlament behandelt wird, werden 100.000 Unterschriften benötigt. Das Volksbegehren werde vorerst das Kippen des Rauchverbots durch die Regierung nicht verhindern können, deren Plan es ist," die aktuelle Regelung mit getrennten Räumen für Raucher beizubehalten.Die Wiener Ärztekammer und die Österreichische Krebshilfe machen bereits seit Anfang Jänner mit der Petition """"Don't Smoke"""" gegen den blauen Dunst und für die Beibehaltung des Nichtrauchergesetzes - das auch ein generelles Rauchverbot in der Gastronomie beinhaltet - mobil. Man wolle die Bundesregierung durch sachpolitische Argumente überzeugen", dass sie das Kippen des geplanten Rauchverbots in der Gastronomie nicht in die Tat umsetzt, hieß es von den Organisatoren.
Online-Petition


Initiative gegen Raucherpläne von ÖVP und FPÖ


Wir sollten der Regierungeinen ordentlichen Denkzettel verpassen und zeigen, dass von Politikern erwartet wird, dass sie ihre Arbeit, zu der auch der Schutz der Österreicher gehört, erledigen.Es kann nicht sein, dass ein Gesetz abgebogen wird, nur weil es ein paar Hanseln, die glauben das Sagen zu haben, nicht passt!Wo kann man unterschreiben?.Echt Schlimm, daß man sich FÜR seine Gesundheitauf die Beine stellen muss. Das die Regierung GEGEN die Gesundheit agiert.Faschistoid...bitte unbedingt unterschreiben!rauchverbot ist schon längst überfällig.Bin auch dabei,machen wir Österreich rauchfrei.Was wir für einen Aufwandbetreiben müssen nur weil ein Politiker auf unsere Bedürfnisse quasi ....... . 14.000 Tote jährlich sind für ihn kein Argument dem nachzugeben. Das vergleiche ich mit dem ..... was man auch noch ständig zu leugnen versucht. Der Vater eines bekannten Politikers war berühmt dafür.  Bin dabei......werden dann sehen was Herr Strache dann von direkter Demokratie hält.@calcitNichts," wenn es nicht seinen Interessen dient."""
