title;text


(c) AP (Gerald Herbert)






(c) AP (Gerald Herbert)






(c) AP (Mark Wallheiser)






(c) AP (Gerald Herbert)




1/12








            @media screen and (max-width: 699px){
                .diashow-pseudo-enlarge{
                    display: none;
                }
            }
        




Überlebende des Schulmassakers mit 17 Toten in Florida haben am Mittwoch in der Hauptstadt des Bundesstaates für eine Verschärfung des Waffenrechts in den USA demonstriert. In Tallahassee trafen sie sich mit Abgeordneten. Die Schülerin Rachel Cantania sagte dem Sender CNN, sie und ihre Mitstreiter wollten so lange für das Thema kämpfen," bis sich etwas ändere. """"Egal wie lange es dauern wird"," etwas wird passieren""""", sagte sie.In Parkland hatte der 19-jährige Nikolas Cruz an der Marjory Stoneman Douglas High School am Mittwoch vor einer Woche mit einer halbautomatischen Waffe 14 Schüler und drei Erwachsene getötet.In ganz Florida schlossen sich etliche weitere Schüler den Protesten mit Streiks an. Luftaufnahmen des Senders CNN zeigten, wie Dutzende Jugendliche sich etwa vor Schulen in den Bezirken Miami-Dade County und Broward County versammelten.Die Bewegung bringt die Politiker bereits jetzt in Zugzwang - und ein paar Erfolge hat sie auch schon erzielt. Präsident Donald Trump stellte am Mittwoch bei einem Treffen mit Parkland-Schülern im Weißen Haus verschärfte Überprüfungen von potenziellen Waffenkäufern in Aussicht - wie belastbar diese Zusage ist," bleibt freilich abzuwarten. Schon zuvor hatte Trump ein Verbot von """"bump stocks"""" angekündigt; dies sind Aufsatzvorrichtungen", die halbautomatische in vollautomatische Gewehre umfunktionieren.
Trump trifft Überlebende des Amoklaufs




Doch einen Rückschlag hat die junge Protestbewegung auch schon verkraften müssen. Eine Reise der Parkland-Schüler nach Tallahassee, die Hauptstadt des Bundesstaats Florida, blieb ohne greifbare Ergebnisse. Das Regionalparlament zeigte sich ungerührt von ihren Tränen und Brandreden - und schmetterte einen Vorstoß für ein Verbot von Sturmgewehren mit klarer Mehrheit ab.Die Schüler aus Parkland werden sich jedoch wohl nicht leicht kleinkriegen lassen. Ihre aus gut situierten Familien stammenden Wortführer sind selbstbewusst, redegewandt und wohlorganisiert. Sie verstehen es, die sozialen Medien für ihre Mobilisierungskampagne zu nutzen. Und sie orientieren sich in ihrer Organisationsarbeit an der Massendemo für die Frauenrechte," die kurz nach Trumps Vereidigung in der Hauptstadt stattfand.Einige der Schüler sind bereits zu landesweiter Berühmtheit gelangt. Cameron Kasky erfand den """"#NeverAgain""""-Slogan. Der 17-jährige David Hogg filmte noch während des Massakers Interviews mit Mitschülern", mit denen er sich in einem Kasten versteckt hatte. Und die 18-jährige Emma Gonzalez hielt eine Rede unter Tränen, die großen Widerhall fand. Darin prangerte sie Politiker an," die NRA-Spenden angenommen haben: """"Schande über Euch!"""" rief sie aus.Der Preis der Berühmtheit ist", dass die Jungaktivisten zum Objekt einer Gegenkampagne aus der ganz rechten Ecke geworden sind. Wilde Verschwörungstheorien kursieren, die Teens seien bezahlte Schauspieler, ihre Geschichten erfunden, sie würden von linksgerichteten PR-Experten gecoacht.Besonders hart angegriffen wird Hogg - weil er der Sohn eines früheren FBI-Beamten ist. Der von ultrarechten Medien gestreute Verdacht lautet, der 17-Jährige werde von der Bundespolizei benutzt," um von ihrem Versagen im Vorfeld des Parkland-Massakers abzulenken. Das FBI hatte im Jänner einen Warnhinweis auf den späteren Todesschützen Nikolas Cruz ignoriert.Er sei kein Schauspieler und handle nicht """"im Auftrag von irgendjemanden""""", konterte Hogg die Verschwörungstheorien. Im Interview mit dem Sender CNN machte er er auch deutlich," dass der Protest sein persönliches Trauma nicht bannt: Er habe das Blutbad durchlebt - """"und ich werde dies weiter tun müssen"""".Reaction students at stoneman Douglas high school two days after https://t.co/cig7Gtl50S— David Hogg (@davidhogg111) 17. Februar 2018"

"Reaction students at stoneman Douglas high school two days after https://t.co/cig7Gtl50S"""
"Trumps Vorschlag zur Bewaffnung von Lehrern stößt auf Kritik;""US-Präsident sagte Überlebenden strengere Kontrollen von"

Waffenkäufern zuAls Reaktion auf das Schulmassaker in Florida hat US-Präsident Donald Trump kein strikteres Waffenrecht, sondern die Bewaffnung von Lehrern vorgeschlagen. Einzelne Lehrer könnten zur Abschreckung möglicher Täter im Einsatz von Schusswaffen trainiert werden, sagte Trump am Mittwoch bei einem Treffen mit Überlebenden im Weißen Haus. Der Vorschlag des Präsidenten löste Kritik und Kopfschütteln aus.Etwa 20 Prozent der Lehrer kämen für ein solches Waffentraining infrage," sagte Trump. """"Dies wäre natürlich nur etwas für Leute"," die sehr geschickt im Umgang mit Waffen sind"""""," sagte er. Die Lehrer sollten die Waffen versteckt tragen. Sie könnten Attacken in Schulen dann """"sehr schnell beenden"""".Bei einer Podiumsdiskussion in Florida erntete Trump Kritik für seinen Vorstoß. """"Ich denke nicht"," dass Lehrer bewaffnet werden sollten. Lehrer sollten unterrichten""""", sagte der für Parkland zuständige Sheriff Scott Israel.Auch eine Lehrerin, die das Massaker überlebt hatte," äußerte ihr Unverständnis. """"Soll ich nun auch noch ausgebildet werden", um die Schüler nicht nur zu unterrichten," sondern auch zu beschützen?"""""," fragte Ashley Kurth. """"Soll ich eine Schutzweste tragen? Soll ich die Waffe am Bein tragen oder in meinem Schreibtisch verstauen?""""Trump erklärte bei dem Treffen im Weißen Haus"," es gebe """"viele Ideen"""" für eine Reaktion auf die Bluttat an der Marjory Stoneman Douglas High School. Bei dem Massaker hatte ein 19 Jahre alter ehemaliger Schüler 17 Menschen erschossen.Der Präsident sagte strengere Kontrollen von Waffenkäufern zu. Die Behörden würden künftig """"sehr strikt sein bei Hintergrund-Checks"""". Dabei werde vor allem die """"psychische Gesundheit"""" der Käufer beleuchtet werden.An dem Treffen nahm auch ein Vater teil"," dessen Tochter bei dem Massaker an der Marjory Stoneman Douglas High School erschossen worden war. """"Meine Tochter hat keine Stimme mehr. Sie wurde letzte Woche ermordet""""", sagte Andrew Pollack. Es verstehe nicht, wieso Flughäfen, Stadien und Botschaften beschützt würden," nicht aber Schulen.Der 15-jährige Schüler Justin Gruber forderte """"einen grundlegenden Wandel in diesem Land"," denn so etwas darf nie wieder geschehen"""". Sein Mitschüler Samuel Zeif appellierte an Trump"," das Waffenrecht zu verschärfen. """"Ich verstehe nicht"," wieso ich noch immer in ein Geschäft gehen und eine Kriegswaffe kaufen kann.""""Versuche", das Waffenrecht einzuschränken, stoßen in den USA immer wieder auf breiten Widerstand. Das Repräsentantenhaus von Florida stimmte am Dienstag mit großer Mehrheit gegen ein Verbot von Sturmwaffen und große Magazine. In der Sitzung, die mit einem Gebet für die Opfer von Parkland begann," stimmten 71 Abgeordnete gegen ein Verbot und 36 dafür."""
"Meryl Streep will nicht für Weinsteins Verteidigung herhalten;""Anwälte versuchten Gericht in New York zu überzeugen", Klage

von sechs Frauen abzulehnen. US-Starschauspielerin Meryl Streep will nicht für die juristische Verteidigung von Ex-Filmproduzent Harvey Weinstein herhalten. Ihre Aussage, dass er sie immer respektvoll behandelt habe," könne nicht als Beweis für seine Unschuld herangezogen werden - das sei """"erbärmlich und ausbeuterisch"""". So heißt es in einer Stellungnahme"," die Streeps Management laut US-Medien am Mittwoch (Ortszeit) verbreitete.Für Straftaten an Frauen sei der Filmproduzent selbst verantwortlich. """"Und wenn es noch ein bisschen Gerechtigkeit im System gibt"," wird er dafür bezahlen."""" Am Dienstag (Ortszeit) hatten Weinsteins Anwälte versucht", ein Gericht in New York davon zu überzeugen, dass eine Klage von sechs Frauen gegen den mutmaßlichen Sexualstraftäter abzulehnen sei. Die Anschuldigungen seien übertrieben, da die Klage impliziere, dass jede Frau, mit der Weinstein beruflich zu tun hatte, von ihm belästigt worden sei.Einige Schauspielerinnen hätten jedoch gesagt, dass Weinstein sie nicht belästigt habe, schrieben die Anwälte. Sie beriefen sich dabei auf eine Stellungnahme, in der Streep im Oktober angab, dass Weinstein sie immer respektvoll behandelt habe.He, cool!Ich kann einem reichen Menschen seine Habe klauen und dann anführen, dass ich hunderten Millionen anderer reicher Menschen nichts gestohlen habe! Selbst wenn ich fünftausend Leute abmurkse, kann ich geltend machen," dass ich acht Milliarden nichts getan habe. Da tun sich Möglichkeiten auf!"""
Mehr als 40 Tote bei Busunglück;Linienbus stürzte rund 200 Meter in die Tiefe.Die Zahl der Todesopfer bei einem Busunglück im Süden Perus am Mittwoch hat sich nach Medienberichten auf mehr als 40 erhöht. Das Innenministerium in Lima hatte zunächst von 35 Toten gesprochen. Ein Linienbus war von der Küstenstraße Panamericana nahe der Stadt Camana in der Region Arequipa rund 200 Meter in die Tiefe gestürzt.Der Bus habe Platz für 45 Passagiere gehabt, hieß es. Die Panamericana verbindet über Tausende Kilometer Süden und Norden im amerikanischen Doppelkontinent. An mehreren Etappen in Peru führt sie an einer bergigen Küstenregion am Pazifik entlang. In dem südamerikanischen Andenland kommt es häufig zu schweren Unfällen wegen des schlechten Zustands vieler Landstraßen.
Rekordwärme im Februar: 24 Grad Celsius in New York;Der bisher wärmste 21. Februar wurde im Jahr 1930 registriert, als 20 Grad erreicht wurden.Sommerliche Temperaturen mitten im Winter: Die Bewohner von New York haben sich am Mittwoch über einen neuen Wärmerekord im Monat Februar gefreut. Am frühen Nachmittag kletterte die Quecksilbersäule auf 24 Grad Celsius, wie der Nationale Wetterdienst meldete.Der bisher wärmste 21. Februar wurde im Jahr 1930 registriert, als 20 Grad erreicht wurden, wie die New Yorker Meteorologin Faye Morrone mitteilte. Die Temperaturen vom Mittwoch, gemessen im Central Park, sind ihren Angaben zufolge auch ein Rekord für den gesamten Monat Februar: Die bisher höchste Temperatur von 23,88 Grad wurde 1930 und 1985 gemessen.Das ungewöhnlich warme Wetter, das sich über weite Teile des Nordostens der USA erstreckt, wird allerdings nicht lange anhalten. Am Donnerstag wird das Thermometer laut Morrone nur noch 7,2 Grad erreichen.
Bus-Katastrophe verhindert: Pensionist erhält Tapferkeitsmedaille;Dem 65-jährigen Franzosen, der im September 2017 auf der Zillertaler Höhenstraße einen Bus mit einer 21-köpfigen Reisegruppe vor dem Absturz bewahrt hat, ist in Frankreich eine Tapferkeitsmedaille verliehen worden.Der Bus eines Tiroler Reiseunternehmens war von der Hirschbichlalm in Richtung Melchboden in Tirol unterwegs, als der 76-jährige Fahrer bewusstlos in den Mittelgang stürzte. Das Fahrzeug fuhr daraufhin ungelenkt weiter und streifte den bergseitigen Hang.Der Fahrgast Gilbert Sand (65), ein Pensionist aus dem Elsass, bremste den Bus noch rechtzeitig, bevor er rund 100 Meter ins Tal abstürzen konnte. Bereits die Hälfte des Fahrzeugs ragte über den Fahrbahnrand hinaus. Ein als Leitschiene dienender Baumstamm bohrte sich in den vorderen Teil des Busses, was das Fahrzeug zusätzlich bremste. Der Vorfall machte weltweit Schlagzeilen. Gilbert Sand brach sich bei seinem mutigen Einschreiten das Schienbein, lag sechs Wochen im Spital. Als ihm der Präfekt des Elsass, Jean-Luc Marx, in Straßburg den Orden verlieh, hatte er Tränen in den Augen.  Der Bus bohrte sich am Ende in einen Baumstamm © APA (Polizei Zell am Ziller)Ebenfalls ausgezeichnet wurde der 40-jährige Pierre Klin, der sich nach der heldenhaften Rettung durch Gilbert Sand um die Evakuierung und Erstversorgung der Insassen gekümmert hatte. Klin ist selbst Busfahrer und gehörte der Urlaubergruppe an. Insgesamt neun Menschen mussten nach dem gefährlichen Zwischenfall ins Krankenhaus gebracht werden.
111 Mädchen nach Boko-Haram-Angriff auf Schule vermisst;Dei betroffenen Eltern befürchten Entführung ihrer Töchter durch Islamisten. Nach einem Angriff der Islamistengruppe Boko Haram auf eine Mädchenschule in Nigeria werden mehr als hundert Mädchen vermisst. Es gebe keine Informationen über das Schicksal von 111 Schülerinnen, sagte der Polizeiminister des Bundesstaates Yobe am Mittwoch. 815 weitere Schülerinnen seien nach dem Überfall vom Montag in das Internat in Dapchi im Nordosten des Landes zurückgekehrt.Anrainer hatten nach dem Angriff zunächst berichtet, dass alle Schülerinnen mit ihren Lehrern fliehen konnten. Angehörige von Schülerinnen berichteten dagegen, sie hätten keine Nachricht von ihren Töchtern und in umliegenden Dörfern vergeblich nach ihnen gesucht. Die Eltern fürchten, dass ihre Kinder von den Islamisten entführt wurden. Polizeiminister Sumonu hob aber hervor, dass bisher kein Entführungsfall bestätigt sei.Boko Haram hatte im April 2014 aus einer Schule in Chibok 276 Mädchen entführt. Der Fall sorgte weltweit für Entsetzen und Empörung. Seitdem konnten 164 der Mädchen fliehen oder wurden freigelassen. 112 der Schülerinnen befinden sich bis heute in der Hand der Islamisten.Boko Haram kämpft seit dem Jahr 2009 gewaltsam für die Errichtung eines islamischen Gottesstaats im mehrheitlich muslimischen Nordosten Nigerias. In dem Konflikt wurden bisher mindestens 20.000 Menschen getötet und 2,6 Millionen in die Flucht getrieben. Immer wieder verüben die Extremisten Anschläge und Überfälle auf Dörfer, Kirchen, Schulen, Sicherheitskräfte, Politiker und Behördenvertreter. Seit 2009 entführten die Islamisten zudem tausende Menschen.
"Abwasser im Gazastreifen direkt ins Meer geleitet;""Die Städte im Gazastreifen rufen den Notstand aus. Städte rufen Notstand aus.Die Krise im Gazastreifen spitzt sich zu: Wegen der Energieknappheit werde das Abwasser künftig ungeklärt ins Meer geleitet", teilte der Bürgermeister von Gaza, Nizar Hejazi, am Mittwoch mit. Die Städte seien nicht mehr in der Lage," genügend Treibstoff für die Kläranlagen bereitzustellen. In der vergangenen Woche hatte das einzige Elektrizitätswerk in dem Küstenstreifen den Betrieb eingestellt.""""Wir verkünden den Notstand in den Städten und Gemeinden des Gazastreifens""""", erklärte Hejazi im Namen aller Bürgermeister. Die öffentlichen Dienstleistungen würden um die Hälfte reduziert.Der Gazastreifen leidet seit Jahren unter Stromknappheit," viele Haushalte und Einrichtungen müssen daher auf Generatoren zurückgreifen. Der aus Israel gelieferte Strom reicht nur für wenige Stunden Elektrizität pro Tag.Die Enklave und ihre rund zwei Millionen Bewohner unterliegen seit zehn Jahren einer israelischen Blockade. Auch Ägypten riegelte seine Grenze zum Gazastreifen weitgehend ab."""
"Lebenslang für rechtsradikalen ""Lasermann"" Ausonius;""Sicherheitsverwahrung für den 64-jährigen Schweden.In Schweden sitzt der als """"Lasermann"""" bekannt gewordene John Ausonius schon seit Jahren in Haft - nun ist er auch in Deutschland wegen Mordes zu lebenslanger Haft verurteilt worden. Das Landgericht Frankfurt am Main sprach ihn am Mittwoch schuldig"," vor mehr als 25 Jahren eine 68-jährige Garderobenfrau mit einem Kopfschuss getötet zu haben. Sein Verteidiger will das Urteil angreifen.Das Gericht ordnete auch die Sicherungsverwahrung für den 64-jährigen Ausonius an. """"Die Kammer hält den Angeklagten für die Allgemeinheit für sehr gefährlich"""""," sagte die Vorsitzende Richterin Bärbel Stock. Es handle sich um einen """"Gewohnheitstäter mit eingeschliffenem Verhaltensmuster"""". Er habe sich """"bewusst für ein kriminelles Leben entschieden"""".In Schweden war Ausonius bereits 1995 wegen Mordes und versuchten Mordes zu lebenslanger Haft verurteilt worden", weil er Anfang der 90er Jahre auf mehrere Migranten geschossen hatte. Ein Mann starb. Da er bei den Schüssen mehrfach ein Gewehr mit Laserzielvorrichtung benutzte," wurde er als """"Lasermann"""" bekannt. Ende 2016 wurde er für den Frankfurter Prozess nach Deutschland ausgeliefert.Er musste sich dort wegen des Todes der 68 Jahre alten Blanka Zmigrod verantworten. Die Frau", die mehrere Konzentrationslager überlebt hatte, arbeitete in Frankfurt als Garderobenfrau. Ausonius vermutete laut dem Urteil," dass sie ihm sein elektronisches Notizbuch aus seiner Manteltasche genommen habe. Darin befanden sich demnach wichtige Daten.Nach Überzeugung des Gerichts folgte Ausonius ihr von einem Restaurant am Opernplatz mit einem Fahrrad und schoss ihr schließlich auf ihrem Heimweg seitlich in den Kopf. Er nahm der Frau demnach ihre Handtasche ab und fuhr davon. """"Sie hat mehrere KZs überlebt"," aber nicht die Begegnung mit dem Angeklagten"""""," sagte Richterin Stock.Das Gericht habe nicht die """"geringsten Zweifel"""""," dass Ausonius die Tat begangen habe. """"Eine lückenlose Indizienkette belegt sein Schuld."""" Der Angeklagte hatte zu den Vorwürfen in dem Prozess geschwiegen. Die Richter folgten mit ihren Urteil weitgehend der Forderung der Staatsanwaltschaft", lediglich die besondere Schwere der Schuld stellten sie nicht fest.Die Verteidigung hatte dagegen auf Freispruch plädiert. Anwalt Joachim Bremer kündigte direkt nach der Urteilsverkündigung an," Revision einlegen zu wollen. Von einer """"lückenlosen Indizienkette"""" könne nicht ausgegangen werden. Ausonius bleibt nach seinen Angaben nun zunächst in Deutschland im Gefängnis", bis über eine Revision entschieden ist.Wenn das Urteil rechtskräftig werden sollte," wird er nach Angaben von Staatsanwaltschaft und Verteidigung aber wieder nach Schweden ausgeliefert. Dort würde er dann weiter in Haft bleiben."""
"US-Amerikaner zerstören ihre Waffen vor laufender Kamera;""Einer der Ersten", der seine Waffe vor laufender Kamera zersägt hat," war am Samstag ein Mann namens Scott Pappalardo aus dem Bundesstaat New York.Nach dem Schulmassaker in Florida mit 17 Toten haben einige US-Amerikaner ihre eigenen Waffen zerstört und das im Internet publik gemacht. Unter dem Hashtag #oneless (""""eine weniger"""") verbreiten sich seit dem Wochenende immer mehr Fotos und Videos in den Sozialen Medien. Einer der Ersten war am Samstag ein Mann namens Scott Pappalardo aus dem Bundesstaat New York", wie CNN berichtete.In seinem auf Facebook verbreiteten Video zeigt Pappalardo sein nach eigenen Angaben legal erworbenes Sturmgewehr AR-15 - den gleichen Typ Gewehr," den der Todesschütze in Parkland verwendete. Die Worte """"das Recht Waffen zu besitzen"""" habe er auf seinen Arm tätowiert"," sagt Pappalardo. Dann steht er auf und sägt die Waffe mit einer elektrischen Säge in zwei Hälften. """"Ist das Recht", diese Waffe zu besitzen," wichtiger als das Leben von jemandem?"""""," fragt er in die Kamera. """"Ich glaube nicht.""""  I did the same thing as Ms. Meyer. I also used an angle grinder on my AR-15 for the same reason as she did; I don't want my gun to be used to injure or kill an innocent person. #oneless pic.twitter.com/gonPEZXmYW— Deb Lentz (@Momin8tr) 21. Februar 2018"

"I did the same thing as Ms. Meyer. I also used an angle grinder on my AR-15 for the same reason as she did; I don't want my gun to be used to injure or kill an innocent person. #oneless pic.twitter.com/gonPEZXmYWGute Ideerein technisch - funktioniert die Waffe noch immer!"""
"Debatte um Waffen gewinnt an Fahrt;""Nach dem jüngsten Schulmassaker in Florida sind offenbar zwei Drittel der Amerikaner für strengere Regeln.Nach dem Schulmassaker in Florida mehren sich die Stimmen für eine Verschärfung des Waffenrechts in den USA. Mehrere Hollywood-Stars spendeten zusammen zwei Millionen Dollar für den Protest der Überlebenden des Massakers", die lautstark für striktere Waffengesetze eintreten.Einige US-Amerikaner begannen damit, ihre eigenen Waffen öffentlichkeitswirksam zu zerstören. Einer aktuellen Umfrage zufolge sprechen sich inzwischen zwei Drittel der amerikanischen Wähler für eine Verschärfung der Gesetze aus.Das Repräsentantenhaus von Florida erteilte einer Verschärfung des Waffenrechts am Dienstag (Ortszeit) dagegen eine klare Absage. Es ging um ein Gesetz," das ein Verbot bestimmter halbautomatischer Gewehre - etwa des bei dem Massaker verwendeten Typs AR-15 - und großer Magazine eingeleitet hätte. Vor den Augen mehrerer überlebender Schüler lehnten die Abgeordneten der republikanisch dominierten Volksvertretung den Entwurf mit 36 zu 71 Stimmen deutlich ab.Auf der Tribüne des Parlaments in Tallahassee brachen mehrere zuhörende Schüler der Schule in der Stadt Parkland in Tränen aus. """"Sie hatten heute die Chance"," es zu beenden"""""," sagte die 16-jährige Sheryl Acquaroli dem Sender CNN. """"Wenn es noch einmal tödliche Schüsse (in Florida) gibt"," dann ist das ihr Fehler.""""In Parkland hatte der 19-jährige Nikolas Cruz an der Marjory Stoneman Douglas High School am Mittwoch vor einer Woche mit einer halbautomatischen Waffe 14 Schüler und drei Erwachsene getötet.An diesem Mittwoch wollten Überlebende in Floridas Hauptstadt für schärfere Gesetze demonstrieren. In verschiedenen anderen US-Staaten kündigten Schüler Streiks mit dem gleichen Ziel an. Für den 24. März planen die Schüler eine Großdemonstration in der Hauptstadt Washington - in ihren Worten einen nationalen """"Marsch für unsere Leben"""".Die jugendlichen Anti-Waffen-Aktivisten erhielten dafür prominente Unterstützung. Schauspieler George Clooney", Star-Regisseur Steven Spielberg, US-Talkqueen Oprah Winfrey und der Produzent und Ex-Disney-Chef Jeffrey Katzenberg kündigten - teils mit ihren Partnern - Spenden an, zusammen zwei Millionen Dollar (1,"6 Mio. Euro) für die geplante Großdemonstration.""""Im Namen unserer Kinder Ella und Alexander spenden wir 500.000 Dollar"," um für diese wegweisende Veranstaltung zu bezahlen"""""," teilten Clooney und seine Frau Amal der Zeitung """"USA Today"""" zufolge mit. """"Die Leben unserer Kinder hängen davon ab.""""Eine aktuelle Umfrage zeigt zudem", dass die wiederholten Schusswaffen-Massaker die Meinung zu strikteren Waffengesetzen in den USA gedreht haben. Der repräsentativen landesweiten Befragung der Quinnipiac-Universität aus Hamden (Connecticut) zufolge sprechen sich zwei Drittel (66 Prozent) der US-Wähler für strengere Gesetze aus. Knapp ein Drittel ist dagegen (31 Prozent).Das ist die höchste Zustimmung für eine Verschärfung des Waffenrechts," seitdem die Quinnipiac-Umfrage im Jahr 2012 zum ersten Mal danach fragte. Kurz vor Weihnachten 2015 hatte sich noch eine knappe Mehrheit von 50 Prozent gegen striktere Gesetze ausgesprochen (47 Prozent dafür). Innerhalb von gut zwei Jahren ist die Zustimmung dazu somit um 19 Prozentpunkte gestiegen.US-Präsident Donald Trump hat bisher lediglich das Justizministerium zu einem Verbot von Schnellfeuerkolben aufgefordert. Mit ihnen können halbautomatische Waffen so schnell schießen wie Maschinengewehre. Einen solchen """"Bump Stock"""" genannten Plastikaufsatz hatte im Oktober 2017 auch der Attentäter von Las Vegas benutzt. Er tötete 58 Menschen und sich selbst. US-Medien kritisierten Trumps Aufforderung rasch als minimales Entgegenkommen", das inhaltlich wertlos sei. Das Verbot der Schnellfeuerkolben war nach dem Massaker von Las Vegas kurz im Kongress behandelt worden. Dann geriet es in Vergessenheit. Geschehen war seither nichts.Am Mittwoch wollte sich Trump im Weißen Haus mit Schülern und Lehrern treffen. Seine Sprecherin Sarah Sanders sagte am Dienstag," an der Unterredung würden auch Menschen aus Parkland teilnehmen. Wer genau an der """"Listening Session"""" genannten Gesprächsrunde teilnehmen soll", blieb zunächst offen, ebenso wie Rahmen und Länge der Veranstaltung. Sanders sagte," auch Betroffene anderer Schulmassaker würden ins Weiße Haus kommen.Zumindest unter einigen US-Waffenbesitzern scheint indes ein Umdenken stattzufinden. Unter dem Hashtag #oneless (""""eine weniger"""") verbreiten sich seit dem Wochenende immer mehr Fotos und Videos in den Sozialen Medien", auf denen Waffenbesitzer ihre Waffen zerstören oder an die Behörden abgeben.Einer der Ersten war am Samstag ein Mann namens Scott Pappalardo aus dem Staat New York, wie CNN berichtete. In seinem auf Facebook verbreiteten Video zeigt Pappalardo sein nach eigenen Angaben legal erworbenes Sturmgewehr AR-15 - den gleichen Typ Gewehr," den der Todesschütze in Florida verwendete.Die Worte """"das Recht Waffen zu besitzen"""" habe er auf seinen Arm tätowiert"," sagt Pappalardo. Dann steht er auf und sägt die Waffe mit einer elektrischen Säge in zwei Hälften. """"Ist das Recht", diese Waffe zu besitzen," wichtiger als das Leben von jemandem?"""""," fragt er in die Kamera. """"Ich glaube nicht."""""""
