title;text
Regelmäßiges unbeabsichtigtes Schlafen während des Tages könnte bei älteren Menschen ein frühes Warnzeichen für einen drohenden Schlaganfall sein. Wissenschaftler der Columbia University http://www.columbia.edu haben herausgefunden, dass bei jenen, die diese Angewohnheit hatten, das Risiko eines Schlaganfalles zwei bis vier Mal höher war als bei jenen, die tagsüber nie einschliefen. Anlässlich der International Stroke Conference http://strokeconference.americanheart.org/portal/strokeconference/sc forderte das Team die Ärzte auf, auf diese Risikogruppe ein verstärktes Augenmerk zu legen. Für die Studie wurden 2.000 Menschen befragt, wie oft sie in verschiedenen Situationen einnickten. Dazu gehörte das Fernsehen, Gespräche im Sitzen, ruhiges Sitzen nach einem Mittagessen ohne Alkohol und ein kurzer Halt mit dem Auto. Das Risiko in den nächsten zwei Jahren war bei Menschen, die ab und zu einnickten, 2,6 Mal höher als bei jenen, denen das nie passierte. Bei jenen, die immer wieder einschliefen, war das Risiko sogar 4,5 Prozent höher. Das Risiko eines Herzanfalls oder eines Todes durch eine kardiovaskuläre Erkrankung war bei der ersten Gruppe 1,6 Prozent, bei der zweiten 2,6 Prozent höher. Die leitende Wissenschaftlerin Bernadette Boden-Albala betonte," dass es sich dabei um maßgebliche Zahlen handle. """"Wir waren überrascht"," dass die Auswirkungen so groß waren."""" Frühere Studien hatten laut BBC ergeben", dass Menschen die unter Schlaf-Apnoe leiden, über ein erhöhtes Schlaganfall-Risiko verfügen. Es ist möglich, dass die Schläfrigkeit tagsüber ein Hinweis auf einen durch diese Krankheit bedingten schlechten Schlaf während der Nacht ist. Laut Boden-Albala mache der derzeitige Wissensstand es notwendig," dass Ärzte Schlafproblemen ihrer Patienten mehr Aufmerksamkeit schenkten. """"Wenn Patienten tagsüber immer wieder einnicken"," sollte man über eine genauere Untersuchung nachdenken."""" Die Neurologin fügte hinzu", dass andere Studien ergeben hätten," dass diese Menschen nicht genug Schlaf bekämen und daher dauern müde seien. """"Die entscheidende Frage ist aber: Was tun wir unseren Körpern an? Schläfrigkeit erhöht das Risiko eines Schlaganfalles offensichtlich."""" Allein in Großbritannien erleiden jährlich rund 150.000 Menschen einen Schlaganfall."""
"UNIQA Tower erhält EU-Auszeichnung von Österreichischer Energieagentur;""UNIQA Tower um bis zu 40 % energieeffizienter als vergleichbare Gebäude"
Seit 21.02.2008 darf der UNIQA Tower offiziell das GreenBuilding-Zertifikat der EU führen. Die Österreichische Energieagentur, die GreenBuilding in Österreich betreut," zeichnet das markante Gebäude in Wien 2 als """"Energiebewussten Neubau"""" aus. Der UNIQA Tower ist damit der erste Büroneubau in Österreich und europaweit einer der ersten", für den dieses Zertifikat ausgestellt wurde. Dr. Fritz Unterpertinger, Geschäftsführer der Österreichischen Energieagentur," überreichte UNIQA Vorstand Dr. Gottfried Wanitschek das GreenBuilding-Zertifikat als """"Energiebewusster Neubau"""". Dabei betonte Unterpertinger die Signalwirkung: """"Das GreenBuilding-Zertifikat spiegelt Ihre ökologische Vorreiterrolle wider. Ich bin davon überzeugt"," dass die erfreulichen Energiekennzahlen des UNIQA Tower die Entscheidungsträger in der Branche zur Nachahmung inspirieren werden."""" Dr. Gottfried Wanitschek: """"Wir haben beim Bau des UNIQA Tower vielfältige ökologische Anstrengungen vorgenommen - wir verfügen hier u.a. über ein umweltfreundliches Heiz- und Kühlsystem. Wir nutzen Erdwärme und Fernwärme", wodurch wir den jährlichen CO2-Ausstoß um 84 Tonnen reduzieren konnten. Wir freuen uns," dass diese Bemühungen nun auch von offizieller Seite bestätigt und anerkannt werden.""""Herkömmliche Glasbauten bestechen meist nicht durch Energieeffizienz. Beim von Neumann + Partner geplanten UNIQA Tower ist das anders. Um die bestmögliche Raumqualität für die 1.100 Beschäftigten zu schaffen", wurde eine Partnerschaft mit Altherm Engineering und arsenal research eingegangen. Diese ermöglichte es, sowohl die Situation im Sommer als auch im Winter zu analysieren und in der Folge das Gebäude zu optimieren. So konnten ideale Bedingungen in punkto Beleuchtung, Lüftung, Heizung und Kühlung erzielt werden.Mit einer Wärmeleistung von 880 kW deckt die Wärmepumpe ca. ein Drittel des Wärmebedarfs. Sie trägt so zu einem umweltfreundlichen Betrieb des Gebäudes bei. Für die Wärmepumpe wurden zwei Rückkühler auf dem Dach des Towers situiert, um Free-Cooling und eine zusätzliche Rückkühlung bei vollem Energiespeicher zu ermöglichen. Insgesamt wurden zu diesem Zweck 44 Kilometer Absorberleitungen in Energiepfählen in einer Tiefe von 34,5 Metern verlegt. Dadurch verbraucht der UNIQA Tower um bis zu 40 % weniger Energie als vergleichbare Gebäude.Das von der EU initiierte GreenBuilding-Programm will vorhandene wirtschaftliche Effizienzpotenziale bei Dienstleistungsgebäuden darstellen und ausschöpfen. Die Dokumentation der Wirtschaftlichkeit möglicher Maßnahmen soll dazu führen, dass eine Vielzahl von rentablen Investitionen umgesetzt werden. In Österreich betreut die Österreichische Energieagentur das GreenBuilding-Programm und berät Unternehmen und Politik in allen Fragen der Energieeffizienz. Energiesparende Maßnahmen nach den Grundsätzen der Raiffeisen Klimaschutz-Initiative beim Projekt Praterstraße 1 mit Architekt Jean Nouvel
Auch für das derzeit in Bau befindliche Hotelprojekt auf der Praterstraße 1 evaluierte UNIQA mögliche energiesparende Maßnahmen auf ihre Kosten und deren wirtschaftlichen und ökologischen Nutzen.Realisiert werden der Einsatz von Energiepfählen und Wärmepumpen, Wärmerückgewinnung aus Kälteerzeugung, Lüftungs- und Klimaanlagen aus Abwasser, Sonnenkollektoren für Warmwasserbereitung, Einsatz von Brunnenwasser u.a. zur Fassadenkühlung und für die Kühltürme, sowie der Einbau energiesparender Beleuchtungssysteme.In Summe können mit einem Gesamtinvestment von rund EUR 2,6 Mio. für die angeführten Maßnahmen - zusätzlich zum Baubudget - laut Berechnungen des Fachplaners eine CO2-Reduktion von 645 Tonnen und eine Energiekosteneinsparung (Strom, Fernwärme) auf Basis 11/2007 von rund EUR 450.000,"- p.a. erzielt werden.Ein druckfähige Foto von der Übergabe des GreenBuilding-Zertifikats an UNIQA können Sie unter http://www.uniqagroup.com/uniqagroup/cms/de/img/%C3%9Cbergabe_Greenbuilding_tcm52-314170.jpg abrufen.Bildtext: UNIQA Tower erhält EU Auszeichnung. Dr. Fritz Unterpertinger (links) von der Österr. Engerieagentur überreicht das GreenBuilding-Zertifikat an UNIQA Vorstand Dr. Gottfried Wantischek (Mitte) und UNIQA Generaldirektor Dr. Konstantin Klien (rechts)."""
"""Grüner"" Aufruf von Fujitsu Siemens Computers an KMUs: Weg mit den alten Servern;""Unternehmen startet Kampagne mit Sonderaktionen für PRIMERGY Einstiegs-Server"
"Weg mit alten Servern - dem Klimaschutz zuliebe"""": Das ist das Motto der neuen Marketing-Kampagne von Fujitsu Siemens Computers", die sich an kleinere und mittelständische Unternehmen richtet. Ihnen soll der Umstieg auf die neueste," energieeffizientere Servertechnologie leicht gemacht werden. Die Aktion wendet sich an Endkunden ebenso wie an Reseller und wird vom Wiener FSC Konzernkompetenzzentrum für Virtualisierung und Klimaschutz unterstützt.Die Kampagne läuft von Ende Februar bis Ende April 2008. Unter dem Titel """"Dump Your Old Server!"""" bietet sie zahlreiche Sonderaktionen für die Einstiegsmodelle der PRIMERGY Industriestandard-Server an. Gleichzeitig zeigt sie die Einsparungen auf", die Unternehmen erzielen können, wenn sie sich von ihren alten, ineffizienten Servern trennen, die oft auch sperrig und langsam sind.Im Mittelpunkt der Kampagne stehen die PRIMERGY-Tower-Modelle TX120 und TX200 S4 sowie der Rack-Server RX300 S4. Alle drei bieten eine neue Dimension an Effizienz - durch ihre hohe Rechenleistung," ihren reduzierten Energieverbrauch und ihre geringe Größe.""""Für viele kleine und mittelständische Unternehmen ist der alte Server zwar ein permanentes Thema"," das aber aufgrund von Zeitmangel oft zur Seite geschoben wird""""", sagt Wolfgang Horak," Managing Director von Fujitsu Siemens Computers Österreich. """"Dabei ist der alte Server laut", langsam," nimmt zuviel Platz ein und verbraucht weit mehr Strom als heutige Modelle. Mit unserer """"Dump Your Old Server""""-Kampagne wollen wir darauf hinweisen", dass die Ära für energieeffiziente," """"grüne"""" Rechner überreif ist: Als Anreiz stellen wir einige Super-Angebote vor."""" Genau wie alle anderen Server der PRIMERGY-Reihe ist das Entry-Level-Modell TX120 mit aktuellen Multi-Core-Prozessoren und modernen 2","5-Zoll-Festplatten ausgestattet. Der fast lautlos arbeitende TX120 verzeichnet einen Stromverbrauch von nur 163W und erfüllt mit Leichtigkeit alle Klimaanforderungen. Sein größerer """"Bruder""""", der TX200 S4, ist so leistungsstark, dass schon ein einziges Gerät die Anforderungen an einen Abteilungsserver erfüllt. Der RX300 S4 wiederum ist ein wahres Arbeitstier im Rack und bietet Hot-Plug-Technologie - das bedeutet mehr Systemverfügbarkeit, da Kernkomponenten wie Stromversorgung, Lüfter und Festplatten ohne Unterbrechung des Serverbetriebs ausgetauscht werden können.Hauptelemente der MarketingkampagneEine Hauptrolle der in vielen Ländern Europas gestarteten Marketing-Kampagne spielen drei visuelle Elemente, die in einer Werbe- und Telemarketing-Kampagne zum Einsatz kommen:* Old Server frisst Energie. Stoppen Sie ihn.
* Old Server: Wenig Leistung, viel Verbrauch. Wecken Sie ihn.
* Old Server verschwendet Ihr Geld. Stoppen Sie ihn.Zusätzlich zur Printwerbung in ausgewählten Publikationen spielt bei der Kampagne auch das Online-Marketing eine wichtige Rolle. Neben länderspezifischen Internet-Seiten wie beispielsweise http://www.dumpyouroldserver.at plant Fujitsu Siemens Computers eine Banner-Kampagne, die über 16 Millionen Ad-Impressions erbringen soll; hinzu kommen Suchmaschinen-Marketing über Keywords und eine Telemarketing-Kampagne.Starke Unterstützung für ResellerChannel-Partner leisten für Fujitsu Siemens Computers einen ganz entscheidenden Beitrag zu dieser Kampagne," erläutert Wolfgang Horak. """"Wir führen die Kampagne in enger Zusammenarbeit mit den Resellern durch. Zusätzlich zu Banner-Werbung auf Channel-Portalen und speziellen Aktionsseiten auf unserem eigenen Channel Partner Portal", unterstützen wir ausgewählte Fachhändler dabei, ihre Marketingaktivitäten zu maximieren," indem sie bei der Entwicklung ihrer eigenen Kampagnen auf das von uns bereitgestellte Material zurückgreifen.""""Über Fujitsu Siemens Computers: "
Fujitsu Siemens Computers ist der führende europäische IT-Infrastruktur Hersteller und zugleich Marktführer in Deutschland. Mit seinem strategischen Fokus auf innovativen Mobility und Dynamic Data Center Produkten, Services und Lösungen bietet das Unternehmen eine einzigartige Bandbreite an Produkten - vom Notebook über Desktops bis hin zu IT Infrastrukturlösungen und Services. Fujitsu Siemens Computers ist in allen Schlüsselmärkten Europas, Afrikas und des Nahen Ostens präsent, der Bereich Infrastructure Services ist in etwa 170 Ländern weltweit tätig. Das Unternehmen profitiert von der globalen Kooperation und der Innovationskraft seiner beiden Shareholder Fujitsu Ltd. und Siemens AG. Im Fokus stehen die spezifischen Anforderungen seiner Kunden: Großunternehmen," kleine und mittelständische Firmen sowie Privatkunden. Fujitsu Siemens Computers zählt über den ganzen Lebenszyklus eines Produkts hinweg zu den Pionieren beim Einsatz von umweltbewussten Technologien und Prozessen und ist Mitglied der """"Climate Savers Computing Initiative"""""," """"Green Grid"""" Organisationen und der """"Global Compact"""" Initiative der Vereinten Nationen. Weitere Informationen über Fujitsu Siemens Computers stehen im Internet bereit unter: http://www.fujitsu-siemens.at Weitere Informationen über das Thema soziales Verantwortungsbewusstsein stehen im Internet bereit unter: http://www.fujitsu-siemens.de/aboutus/sor/index.html ."""
"Hedge Fonds: Unternehmen häufig ausgeliefert;""Proaktives Handeln schützt vor kampferprobten Investoren"
Börsennotierte Aktiengesellschaften müssen stets darauf vorbereitet sein, dass aus passiven Aktionären plötzlich aktive Verwalter werden, die sich untereinander austauschen und mit aller Macht versuchen," die strategische Ausrichtung des Unternehmens zu verändern."""" Zu diesem Fazit gelangte Alexander Engelhardt", Managing Director der Beratungsgesellschaft Citigate Dewe Rogerson Frankfurt http://www.citigatedr.de , im Rahmen einer Veranstaltung des Cercle Investor Relations Austria http://www.cira.at . Der Experte weist im Gespräch mit pressetext darauf hin," dass sogenannte """"Activist Investors"""" zumeist in Gestalt von Hedge Fonds", Investmentbanken oder Family Offices streng opportunistisch handeln. Dabei werden Effizienzlücken aufgestöbert und geschickt Allianzen unter den Aktionären geschmiedet," um mit einer kritischen Masse das Management zu maximalem Profit zu zwingen.""""Solche aggressiv agierenden Aktivisten streben in erster Linie nach einer Strategieänderung. Dazu gehört oft", dass das Management dazu gebracht werden soll," sich auf das Kerngeschäft zu konzentrieren und nicht primär relevante Geschäftsfelder abzustoßen. Die daraus entstehen Veräußerungserlöse sollen vielmehr an die Anleger ausbezahlt werden""""", sagt der Insider. Auch sei die erzwungene Erhöhung des Verschuldungsgrades ein übliches Mittel, für die Anleger höhere Dividendenausschüttungen zu erwirken. Um diese Macht über Vorstand und Aufsichtsrat zu besitzen," bedarf es zuerst jedoch des Aufbaus einer kritischen Masse. Dazu bedienen sich """"Heuschrecken"""" anfänglich der Strategie des sogenannten """"Wake-up Letters"""""," in dem der Führungsstil des Managements auf ganzer Linie abgelehnt wird.""""Vor diesem Hintergrund ist es für ein börsennotiertes Unternehmen von Beginn an wichtig", sich generell proaktiv mit Hedge Fonds oder unzufriedenen Aktionären auseinanderzusetzen, um gar nicht erst eine Schockstarre entstehen zu lassen. Ist diese einmal eingetreten," gibt es gegen den Angreifer fast keine reelle Chance mehr""""", unterstreicht Dominic Köfner, Leiter Unternehmenskommunikation der Metis Group Wien," auf Nachfrage von pressetext. Laut dem ehemaligen Berater seien Activist Investors international hochgradig kampferprobt und """"machen unerfahrene Unternehmen platt"""". So sei es auch gang und gäbe", wenn Heuschrecken internationale Wirtschaftsdetekteien mit Bespitzelungen von Vorständen in Aufzügen, bei Conference Calls oder mit psychologischen Gutachten über Entscheidungsträger beauftragen.Um zu verhindern, dass Hedge Fonds auf diese Weise innerhalb von nur wenigen Wochen einen Kursanstieg bewirken, worauf Aktionäre ihre Aktien verkaufen und die Heuschrecken ihren Einfluss auf bis zu 50 Prozent im Aktionariat ausbauen, dürfen im Vorhinein keine Effizienzlücken eröffnet werden, unterstreicht Engelhardt. Das heißt, dass hohe Barmittel ohne risikoadäquaten Verwendungszweck nicht angehäuft werden sollten. Ebenfalls raten die Finanzexperten dazu, dass keine wertvernichtenden oder nicht erklärbaren Akquisitionen durchgeführt werden. Auch sei ein Aktienrückkauf nur dann sinnvoll, wenn dieser nicht zum Nachteil der bestehenden Aktionäre erfolge. Vor diesem Hintergrund sollten die Forderungen der Aktionäre ernst genommen," begründete Wünsche zeitnah erfüllt sowie unbegründete Bitten vom Management abgelehnt werden. """"In einem volatilen Marktumfeld wie diesem sind die Kriegskassen der Hedge Fonds prall gefüllt"," Unternehmen sollten daher vorbereitet sein"""""," so Köfner abschließend."""
"Adword Selling: Tausende Euro Strafe drohen;""Deutsche Gerichte mit unterschiedlichen Entscheidungen"
Das Buchen von Adwords - Werbeanzeigen," die mit Suchergebnissen bekannter Suchmaschinen wie Google verknüpft sind - birgt große rechtliche Risiken in Bezug auf Markenverletzungen und unlauteren Wettbewerb. """"Bei bekannten Marken können dabei Abmahnkosten in der Höhe von bis zu 5.300 Euro entstehen"," die Gerichtskosten können in der zweiten Instanz auf bis zu 38.000 Euro ansteigen""""", so Max-Lion Keller von der IT-Recht-Kanzlei München http://www.it-recht-kanzlei.de im pressetext-Interview.Keller rät dringend davon ab, markenrechtlich geschützte Adwords zu buchen, da die deutschen Gerichte in der Vergangenheit unterschiedlich entschieden haben. So hat zwar das LG Hamburg am 30. 3. 2004 (Az. 312 O 910/03) entschieden, dass die Verwendung eines markengeschützten Begriffs als Adword keine Verletzung des Markenrechts darstelle, da es an einer zeichenmäßigen Verwendung des Begriffs fehlen würde. Im vergangenen Jahr gab es jedoch zwei Entscheidungen, die genau in die gegenteilige Richtung weisen. So sah das LG Braunschweig 12. 7. 2007 (Az. 2 U 24/07) in der Verwendung einer Marke als Keyword eine kennzeichenmäßige Benutzung," die dem Markenrechtsinhaber die breite Palette der Anspruchsmöglichkeiten nach dem Markengesetz eröffnet. Ähnlich entschied das OLG Stuttgart am 9. 8. 2007 (Az. 2 U 23/07).""""Die Abmahnkosten einer bekannten Marke durch einen Anwalt können bis zu 2.647 Euro betragen. Wenn sich ein Patentanwalt an der Abmahnung beteiligt"," verdoppelt sich die Summe""""", so Keller. Geht es sogar zu Gericht und die erste Instanz verloren, stehen Gerichtskosten in der Höhe von 17.500 Euro an, in der zweiten Instanz werden bis zu 38.271 Euro fällig.Im übrigen sei es laut Keller unerheblich," dass die Adword-Werbeanzeigen """"nur"""" am rechten Bildschirmrand und nicht in der eigentlichen Trefferliste angezeigt würden. """"Denn in beiden Fällen wird die eigentliche Funktion der Marke genutzt"," über ihre kennzeichenspezifische Aussagekraft auf bestimmte Produkte aufmerksam zu machen bzw. zu diesen hinzuführen""""", so Keller. Internet-Suchmaschinen wie Google können in solchen Fällen eher nicht zur Rechenschaft gezogen werden," betont Keller. """"Die Verantwortung liegt bei der Person"," die die Adwords bucht."""" Besonders heikel ist dabei die bei der elektronischen Schaltung der Adword-Werbeanzeige wählbare Option """"weitgehend passende Keywords""""", durch die man als Werbender durch die automatische Verknüpfung der Suchmaschine zu einem Markenrechtsverletzer werden kann," obwohl man selbst kein markenrechtsverletzendes Keyword verwendet hat. Entwarnung gibt Keller zumindest bei allgemeinen und beschreibenden Begriffen. """"Diese sind rechtlich unproblematisch", selbst dann," wenn sie Bestandteil einer bestimmten Internetadresse oder Domain sind"""""," so Keller abschließend im pressetext-Interview."""
"Microsoft-Öffnung: ""Mehr Charmeoffensive als Strategiewechsel"";""Branchenexperten zweifeln an Open-Source-Ambitionen"
Microsoft will bisher gut gehütete Daten zu wichtigen Softwareprodukten verstärkt offen legen, um diese für Partner und Wettbewerber zugänglich zu machen. Dies kündigte das Unternehmen gestern, Donnerstagabend, an. Vor allem Open-Source-Entwickler sollen von der geänderten Strategie Microsofts profitieren. Sie können in Zukunft offen gelegte Schnittstelleninformationen und Kommunikationsprotokolle kostenlos für die Entwicklung und nicht-kommerzielle Verbreitung nutzen, ohne Klagen des Softwareriesens befürchten zu müssen. Analysten zeigen sich hinsichtlich der neuen Öffnung des Unternehmens skeptisch und vermuten," dass das Unternehmen vor allem diversen Wettbewerbsverfahren entgegensteuern möchte.""""Die Ankündigungen Microsofts sind eher vor dem Hintergrund zu bewerten"," dass Regulierungsbehörden immer wieder die Monopolstellung des Unternehmens kritisiert haben"""""," sagt RZB-Analyst Leopold Salcher gegenüber pressetext. Auch Erste-Bank-Analyst Ronald Stöferle sieht in Microsofts Bekanntmachung eher ein Zugeständnisse an die EU-Kommission. """"Hinter den Ankündigungen ist eher eine Charmeoffensive und weniger ein wirklicher Strategiewechsel zu sehen""""", so Stöferle im Gespräch mit pressetext. Auch bei Open-Source-Entwicklern sei eher mit geringem Interesse an den offen gelegten Daten zu rechnen. So erklärte etwa der Open-Source-Anbieter Red Hat in einer ersten Stellungnahme," man betrachte die Ankündigungen mit einer """"gesunden Portion Skepsis"""". Schon vorher hätte man ähnliche Bekanntmachungen gehört. Microsoft könne zudem versuchen", eigene Formate und Protokolle zu einem Industriestandard zu machen, wodurch die Macht des Unternehmens wiederum gestärkt werden könnte, zitiert die Financial Times Deutschland Analyst Roger Kay vom Marktforschungsinstitut Endpoint Technologies.Auch die EU-Kommission zeigte sich in einer ersten Stellungnahme skeptisch gegenüber dem angekündigten Strategiewechsel. Zwar begrüße man die Ankündigung, in der Vergangenheit hätte Microsoft jedoch mindestens vier ähnlich lautende Aussagen getätigt, die die Bedeutung der Interoperabilität zwischen den Programmen von Microsoft und anderen Unternehmen betone. Microsofts Senior Vice President Bob Muglia räumt zwar ein, dass die Offenlegung der technischen Informationen ein weiterer Schritt bei der Erfüllung der vom Europäischen Gerichtshof im vergangenen Herbst auferlegten Bestimmungen zu mehr Transparenz gegenüber Mitbewerbern ist. Die Ankündigungen seien jedoch kein Bestandteil einer mit der EU-Kommission geschlossenen Vereinbarung.Künftig will Microsoft anhand von vier Kernpunkten mehr Interoperabilität sicherstellen. So will das Unternehmen künftig offene Verbindungen gewährleisten, die Übertragbarkeit von Daten sowie Industriestandards unterstützen sowie die Zusammenarbeit mit Kunden und der Branche verstärken. Microsoft bezeichnet diese Maßnahmen als großen Schritt zu noch mehr Transparenz. Bereits gestern stellte das Softwareunternehmen mehr als 30.000 Seiten technischer Dokumentationen zu Windows Client- und Server-Protokollen online, die kostenlos zugänglich sind. In den kommenden Monaten sollen weitere Protokollinformationen zu anderen Microsoft-Produkten, darunter auch Windows Vista und Office 2007 veröffentlicht werden. Unternehmen, die Microsofts Software-Protokolle kommerziell verbreiten möchten," hätten die Möglichkeit kostengünstige Lizenzen zu erwerben."""
"Zehn Teams im Roboter-Rennen zum Mond;""Gewinner erwarten 20 Mio. Dollar vom Google Lunar X Prize"
