title;text
"Syrien: Zivilbevölkerung mitten im Schlachtfeld;""Im Zentrum Syriens gelegen erlebte Ost-Ghuta eine der blutigsten Angriffswellen seit Beginn des Konflikts mit rund 250 Toten innerhalb von 48 Stunden.Wegen der Eskalation der Kämpfe in Syrien wächst international die Besorgnis. UN-Generalsekretär Antonio Guterres zeigte sich am Dienstag (Ortszeit) """"zutiefst beunruhigt"""" über die Lage im Rebellengebiet Ost-Ghuta. Besonders die Folgen für die Zivilbevölkerung machten ihm Sorgen", sagte sein Sprecher Stephane Dujarric in New York.Im Zentrum Syriens gelegen erlebte Ost-Ghuta eine der blutigsten Angriffswellen seit Beginn des Konflikts mit rund 250 Toten innerhalb von 48 Stunden, wie die Syrische Beobachtungsstelle für Menschenrechte meldete. Mehr als 1.200 Menschen seien verletzt worden, viele davon schwer.Ost-Ghuta sei Teil der Deeskalationsvereinbarung von Astana, so Dujarric. Der UN-Generalsekretär erinnere alle Parteien an deren Verpflichtungen. Garantie-Mächte des Abkommens sind Russland," der Iran und die Türkei.Rotes Kreuz fordert Ende des """"Wahnsinns"""" Angesichts der Luftangriffe auf Ost-Ghouta in Syrien fordert das Internationale Komitee vom Roten Kreuz (IKRK)"," dass """"der Wahnsinn", Zivilisten ins Visier zu nehmen," aufhören"""" müsse. """"Es gibt viele Berichte von zerstörten Krankenhäusern und Hilfszentren""""", sagte Walter Hajek vom Österreichischen Roten Kreuz laut einer Aussendung vom Mittwoch.
Die Möglichkeiten zur medizinischen Versorgung schwinden weiter und Menschen sterben," weil ihnen nicht geholfen werden kann""""", warnte er. Die Hilfsorganisationen bräuchten dringend Zugang nach Ost-Ghouta.
Das unweit der Hauptstadt Damaskus liegende Ost-Ghouta erlebt eine der blutigsten Angriffswellen seit Beginn des Konflikt, mit rund 250 Toten innerhalb von 48 Stunden," wie die oppositionsnahe Syrische """"Beobachtungsstelle für Menschenrechte"""" am Mittwoch meldete. Mehr als 1.200 Menschen seien verletzt worden", viele davon schwer.
Laut dem Nuntius in Syrien, Kardinal Mario Zenari, werde Damaskus als Reaktion der Rebellen auf das Vorgehen der Regierungstruppen im Gebiet von Ost-Ghouta mit Raketen und Mörsern attackiert. Zwar sei die ganze Stadt von diesen Bombardements betroffen, doch konzentrierten sie sich stark auf die Altstadt, wo sich die christlichen Viertel befänden," so Zenari laut Kathpress gegenüber """"Vatican News"""" am Mittwoch. Die Hauptstadt erlebe ein """"Wiederaufleben des Krieges""""", sagte der Vatikan-Vertreter im Interview mit dem Nachrichtenportal.Angesichts der Luftangriffe auf Ost-Ghouta in Syrien fordert das Internationale Komitee vom Roten Kreuz (IKRK)," dass """"der Wahnsinn", Zivilisten ins Visier zu nehmen," aufhören"""" müsse. """"Es gibt viele Berichte von zerstörten Krankenhäusern und Hilfszentren"""""," sagte Walter Hajek vom Österreichischen Roten Kreuz laut einer Aussendung vom Mittwoch.""""Die Möglichkeiten zur medizinischen Versorgung schwinden weiter und Menschen sterben"," weil ihnen nicht geholfen werden kann""""", warnte er. Die Hilfsorganisationen bräuchten dringend Zugang nach Ost-Ghouta.Das unweit der Hauptstadt Damaskus liegende Ost-Ghouta erlebt eine der blutigsten Angriffswellen seit Beginn des Konflikt, mit rund 250 Toten innerhalb von 48 Stunden," wie die oppositionsnahe Syrische """"Beobachtungsstelle für Menschenrechte"""" am Mittwoch meldete. Mehr als 1.200 Menschen seien verletzt worden", viele davon schwer.Laut dem Nuntius in Syrien, Kardinal Mario Zenari, werde Damaskus als Reaktion der Rebellen auf das Vorgehen der Regierungstruppen im Gebiet von Ost-Ghouta mit Raketen und Mörsern attackiert. Zwar sei die ganze Stadt von diesen Bombardements betroffen, doch konzentrierten sie sich stark auf die Altstadt, wo sich die christlichen Viertel befänden," so Zenari laut Kathpress gegenüber """"Vatican News"""" am Mittwoch. Die Hauptstadt erlebe ein """"Wiederaufleben des Krieges""""", sagte der Vatikan-Vertreter im Interview mit dem Nachrichtenportal.Die Vereinten Nationen hätten wiederholt ein Ende der Kämpfe gefordert, um die Lieferung humanitärer Hilfsgüter zu ermöglichen sowie Kranke und Verwundete aus der Region schaffen zu können, so der Sprecher. Der Generalsekretär dringe darauf," die Zivilbevölkerung und die zivile Infrastruktur zu schützen.Auch das US-Außenministerium zeigte sich über die jüngsten Berichte aus Ost-Ghuta beunruhigt. Die """"Belagern-und-Aushungern""""-Taktik der syrischen Regierung verschlimmere das humanitäre Desaster vor Ort"," sagte Sprecherin Heather Nauert am Dienstag (Ortszeit) in Washington.""""Das Grauen von Aleppo droht sich nun wenige Kilometer von Damaskus entfernt zu wiederholen. Und wieder werden vor allem unschuldige Zivilisten", darunter viele Kinder," Opfer der zerstörerischen Gewalt des syrischen Regimes und seiner Unterstützer"""""," erklärte ein Sprecher des Auswärtigen Amtes in Berlin. """"Wir fordern das Regime auf"," seine Angriffe sofort einzustellen und endlich humanitären Zugang zu gewähren!"""" Zugleich kritisierte er", dass die von der Türkei angekündigte Blockade der von Kurden kontrollierten Region um Afrin zu weiterem Leid unter der Zivilbevölkerung führen werde.In dem Gebiet im Norden Syriens bombardierte die türkische Armee am Dienstag weiter, nachdem dort syrische Regierungskräfte zur Unterstützung kurdischer Truppen eingerückt waren, wie die staatliche syrische Nachrichtenagentur Sana meldete.In Afrin wächst mit der Konfrontation die Sorge vor einer größeren Eskalation zwischen der Türkei und Syrien. Am Dienstag rückten dort zunächst erste syrische Regierungskräfte ein," wie die Kurdenmiliz YPG bestätigte. Diese sollten sich an der Verteidigung der Einheit Syriens und der Grenzen beteiligen.Die Türkei sieht in der Miliz den syrischen Ableger der verbotenen kurdischen Arbeiterpartei PKK und bekämpft sie. Die YPG ist aber zugleich mit der US-geführten Koalition im Kampf gegen die Terrormiliz """"Islamischer Staat"""" (IS) in Syrien eng verbündet.Der Bürgerkrieg in Syrien hatte im März 2011 mit Protesten gegen die autoritäre Regierung von Machthaber Bashar al-Assad begonnen. Die Region Ost-Ghuta gehört zu den letzten Gebieten", die noch unter Kontrolle von Rebellen stehen. Dominiert werden sie von islamistischen Milizen.Ost-Ghuta ist seit Monaten von Regierungstruppen eingeschlossen. Rund 400.000 Menschen sind dort fast vollständig von der Außenwelt abgeschnitten. Helfer berichten von einer dramatischen humanitären Lage. Über Wochen durften keine Hilfslieferungen in das Gebiet. Das habe zu einem schlimmen Mangel an Nahrungsmitteln geführt, sagte der regionale UN-Nothilfekoordinator," Panos Moumtzis. """"Die humanitäre Lage der Zivilisten in Ost-Ghuta ist dabei"," außer Kontrolle zu geraten."""""""
19 Kinder bei Unfall mit Schulbus verletzt;Der Bus prallte mit mehreren Fahrzeugen zusammen, überrollte einen Stromkasten, streifte eine Ampel und stieß gegen eine Hauswand. Bei einem Schulbusunfall in Dortmund sind am Mittwoch 19 Kinder verletzt worden. Die Viertklässler waren auf dem Weg zum Schwimmunterricht. Der Bus prallte mit mehreren Fahrzeugen zusammen, überrollte einen Stromkasten, streifte eine Ampel und stieß gegen eine Hauswand. Die Windschutzscheibe des Busses brach heraus.Verursacher war nach ersten Ermittlungen der Polizei ein Autofahrer, der aus einer Seitenstraße auf die Hauptstraße einbiegen wollte. Der Fahrer habe den Bus offenbar übersehen. 18 Schüler erlitten leichte Verletzungen, ein Kleinkind, das in einem der Unfallautos saß, kam mit einem Bruch ins Krankenhaus.
"Oprah Winfrey und Steven Spielberg unterstützen Demo gegen Waffengesetze;""Die geplante Schülerdemonstration gegen die laxen US-Waffengesetze hat weitere prominente Unterstützer gefunden.Nach Hollywoodstar George Clooney und seiner Frau kündigten am Dienstag auch die TV-Moderatorin Oprah Winfrey und Regisseur Steven Spielberg an"," den für den 24. März geplanten """"Marsch für unsere Leben"""" mit 500.000 Dollar (405.000 Euro) zu unterstützen.Winfrey erklärte", die Mobilisierung erinnere sie an die Proteste gegen Rassendiskriminierung in den 60er-Jahren. Spielberg unterstützt die Schülerdemonstration gemeinsam mit seiner Frau, der Schauspielerin Kate Capshaw. Auch der Produzent Jeffrey Katzenberg und seine Frau Marilyn sagten eine Spende von 500.000 Dollar zu.Clooney will mit seiner Frau, der Menschenrechtsanwältin Amal Clooney," auch selbst an der Demonstration in Washington teilnehmen. Der Schauspieler hatte den Marsch als """"bahnbrechendes Ereignis"""" bezeichnet. """"Das Leben unserer Kinder hängt davon ab"""""," erklärte er am Dienstag. Winfrey schrieb danach im Kurzbotschaftendienst Twitter: """"George und Amal"," ich stimme Euch absolut zu. Ich schließe mich Euch an und spende ebenfalls 500.000 Dollar.""""George and Amal", I couldn’t agree with you more. I am joining forces with you and will match your $500,000 donation to ‘March For Our Lives.’  These inspiring young people remind me of the Freedom Riders of the 60s who also said we’ve had ENOUGH and our voices will be heard.— Oprah Winfrey (@Oprah) 20. Februar 2018

George and Amal, I couldn’t agree with you more. I am joining forces with you and will match your $500,000 donation to ‘March For Our Lives.’  These inspiring young people remind me of the Freedom Riders of the 60s who also said we’ve had ENOUGH and our voices will be heard.Die geplante Demonstration richtet sich vor allem gegen den enormen politischen Einfluss der Waffenlobby NRA. Veranstaltet wird sie von überlebenden Schülern des Massakers in Parkland im Bundesstaat Florida. An der Marjory Stoneman Douglas High School hatte ein früherer Mitschüler am Mittwoch vergangener Woche mit einem Schnellfeuergewehr 17 Menschen getötet.US-Präsident Donald Trump zeigte sich am Dienstag angesichts der Schülerproteste zu kleinen Änderungen im Waffenrecht bereit. Das Justizministerium arbeite auf seine Anweisung hin an einem Verbot der sogenannten bump stocks, teilte er mit. Dies sind Aufsatzvorrichtungen," die halbautomatische in vollautomatische Gewehre umfunktionieren. Außerdem unterstützt Trump eine effektivere Durchleuchtung von Waffenkäufern. Der 19-jährige Täter in Florida hatte seine Waffe nicht mit einem bump stock aufgerüstet."""
"6.000 Menschen auf Neuseeland abgeschnitten;""Mehrere Erdrutsche blockierten eine Straße .Die Straße freizuräumen werde mehrere Tage dauern. Ausläufer des Zyklons """"Gita"""" haben auf der Südinsel Neuseelands zu Erdrutschen und Stromausfällen geführt. An deren Nordspitze wurde die wichtigste Straße zur abgelegenen Golden Bay verschüttet. Bis zu 1.000 Urlauber saßen dort fest.Zehntausende Haushalte waren wegen des Unwetters ohne Strom. Die Stürme erreichten eine Spitzengeschwindigkeit von 140 Stundenkilometern. Sie entwurzelten Bäume und unterspülten Straßen.Am stärksten betroffen war die Spitze der Südinsel mit der Golden Bay. Bürgermeister Richard Kempthorne sagte", solange die Straße wegen mehrerer Erdrutsche gesperrt sei, würden alle Transportmöglichkeiten - Schiffe," Boote und Flugzeuge - in Betracht gezogen.In Nelson kam es zu Überschwemmungen Foto © AP""""Wir haben 5.000 Einwohner", die essen müssen," und wir haben Urlauber""""", sagte Kempthorne. Es seien hunderte, wenn nicht gar mehr als tausend Menschen dort," """"die vielleicht ihre Reise fortsetzen möchten"""".Vergangene Woche hatte """"Gita"""" auf den Inselstaaten Tonga und Samoa als Wirbelsturm der höchsten Kategorie fünf schwere Schäden angerichtet. Danach schwächte er sich leicht ab und fegte über Neuseeland hinweg.Sieben Bezirke", darunter die größte Südinsel-Stadt Christchurch, erklärten am Dienstag den Ausnahmezustand. Am Mittwoch hieß es," die schlimmsten Befürchtungen hätten sich nicht bewahrheitet. Nach Angaben der neuseeländischen Wetterbehörde zog der Sturm mittlerweile südlich von Christchurch aufs Meer hinaus."""
"Fünf Polizisten bei Überfall auf Polizeiwache erschossen;""Unbekannte haben in Südafrika eine Polizeiwache überfallen und fünf Polizisten erschossen. Unbekannte haben in Südafrika eine Polizeistation überfallen und fünf Polizisten und einen Passanten erschossen. Die Angreifer erbeuteten zehn Waffen und einen Dienstwagen", wie die Polizei am Mittwoch mitteilte. Sie stürmten demnach in der Früh in die Inspektion im Ort Ngcobo in der Provinz Ostkap im Süden des Landes und eröffneten ohne Warnung das Feuer. Dabei wurden drei Polizisten getötet.Ein Passant wurde tödlich verletzt, als die Täter mit einem Polizeiwagen flohen. Zwei Beamte, die sich in dem Auto befanden, wurden einige Kilometer weiter tot aufgefunden," wie die Polizei berichtete. """"Ersten Untersuchungen zufolge wurde sie mit einer Schusswaffe hingerichtet.""""Der südafrikanische Polizeichef Khehla John Sitole erklärte", es würden alle Mittel in Bewegung gesetzt," um """"diese herzlosen Killer zu finden und sie zur Rechenschaft zu ziehen"""". Der Angriff auf die Polizeiwache sei kaltblütig und feige gewesen.Das Motiv war zunächst unklar. Erste Indizien deuteten auf eine Räuberbande hin. Die Angreifer hätten kurz vor dem Angriff auf die Polizeistation einen Geldautomaten geplündert"," erklärten die Behörden. Derartige Angriffe auf Polizeiwachen sind in Südafrika höchst selten."""
Trump trifft sich nach Schulmassaker mit Schülern und Lehrern;Eine Woche nach dem Massaker an einer Schule in Florida mit 17 Toten will sich US-Präsident Donald Trump mit Schülern und Lehrern treffen. Das geht aus der Wochenübersicht der Regierungszentrale hervor. Einzelheiten blieben aber auch am Tag vor dem Treffen offen. So erklärte das Weiße Haus zunächst nicht, wer an dem Treffen teilnehmen wird.An der Marjorie Stoneman Douglas High School in Parkland hatte der 19-jährige Nikolas Cruz am vergangenen Mittwoch mit einer halbautomatischen Waffe 14 Schüler und drei Erwachsene getötet. Daraufhin entbrannte die Debatte um eine Verschärfung des Waffenrechts in den USA neu. Es kam zu Protesten. Am Mittwoch wollen Überlebende der Tat in Floridas Hauptstadt Tallahassee für schärfere Gesetze demonstrieren.
"Türkei erwägt Zwangskastration von Pädophilen;""Nach mehreren Fällen von schweren Kindesmissbrauch hat der türkische Justizminister eine Zwangskastration von Pädophilen ins Spiel gebracht. Die Regierung überlege", ob eine chemische Kastration per Gerichtsbeschluss möglich gemacht werden Nach Fällen von Kindesmissbrauch hat der türkische Justizminister eine Zwangskastration von Pädophilen ins Spiel gebracht. Die Regierung überlege, ob eine chemische Kastration per Gerichtsbeschluss möglich gemacht werden könne," sagte Abdulhamit Gül am Dienstag nach Angaben der Nachrichtenagentur Andolu.Das Thema solle """"innerhalb weniger Tage"""" angegangen werden", sagte er weiter, ohne Details zu nennen.In den vergangenen Wochen hatte es in der Türkei schwere Fälle von Kindesmissbrauch gegeben. Vor zehn Tagen etwa hatte ein 28-jähriger Mann während einer Hochzeit im südtürkischen Adana ein viereinhalbjähriges Kind missbraucht.Staatspräsident Recep Tayyip Erdogan sagte am Dienstag nach Angaben der staatlichen Nachrichtenagentur Anadolu vor türkischen Journalisten, Kindesmissbrauch sei unverzeihlich. Er kündigte zudem härtere Strafen für Sexualstraftäter an. Nach Angaben von Anadolu sagte er weiter, die Regierung erwäge auch," Ehebruch unter Strafe zu stellen. Details dazu nannte er allerdings nicht."""
"Wütende Menge prügelt mutmaßliche Kindsmörder zu Tode;""Bewaffnete zerren Verdächtige aus Polizeiwache. Ein wütende Menschenmenge hat in Indien zwei mutmaßliche Mörder eines kleinen Mädchens aus einem Polizeiverhör gezerrt und getötet. Mehrere hundert Bewaffnete hätten am Montag eine Polizeistation im Bundesstaat Arunachal Pradesh im Nordosten Indiens beschädigt und die Verdächtigen mit Knüppeln"," Hämmern und Steinen """"zu Tode geprügelt""""", sagte am Dienstag der örtliche Polizeichef Isaac Pertin.Auch mehrere Polizisten seien verletzt worden, sagte Pertin der Nachrichtenagentur AFP. Zuvor hätten die beiden Angeklagten - ein 30-jähriger und ein 25-jähriger Feldarbeiter aus einer Nachbarregion - im Verhör den Mord gestanden. Sie sollen demnach ein fünf Jahre altes Mädchen entführt und getötet haben. Die schwer entstellte Leiche des Mädchens war in der Nähe des Wohnorts der beiden Männer gefunden worden.Die Menschenrechtsorganisation Amnesty International in Indien kritisierte einen Akt der Selbstjustiz. Wer an dem Lynchmord beteiligt gewesen sei," müsse vor Gericht gebracht werden."""
"Ermittlungen gegen 'Ndrangheta führen auch nach Österreich;""In den italienischen Regionen Kalabrien und Toscana sind bei einem groß angelegten Zugriff von Anti-Mafia-Ermittlern 27 Verdächtige festgenommen worden.Außerdem wurden Sachwerte bzw. Konten im Wert von 100 Millionen Euro eingefroren. Bei einem Teil der Ermittlungen geht es um Geldwäsche", wobei eine Spur nach Wien führt," wie die """"Kronen-Zeitung"""" (Ausgabe Wien kompakt vom Dienstag) berichtete.Demnach tauchen in den Ermittlungsakten die Adressen zweier mittlerweile in Konkurs gegangener Firmen in der Innenstadt auf. Dorthin soll eine halbe Million Euro geflossen sein. Eine Untersuchungsrichterin in Florenz hat nach Angaben italienischer Medien das Vermögen von insgesamt zwölf Firmen vorläufig einfrieren lassen", sieben davon im Ausland. Es handle sich um Gesellschaften mit Sitz in Slowenien, Großbritannien, Österreich, Kroatien und Rumänien. Bei den verdächtigen Geldflüssen gehen nach Erkenntnissen der Ermittler um illegale Gewinne der 'Ndrangheta," der kalabresischen Mafia. Sie gilt seit Jahren als mächtigste italienische Mafia-Organisation."""
"Japaner erhielt Sorgerecht für 13 Leihmütter-Kinder;""Der Skandal um die """"Baby-Fabrik"""" des Japaners hatte zu einer Gesetzesverschärfung in Thailand geführt. Das Sorgerecht für gleich 13 von Leihmüttern ausgetragenen Kindern ist in Thailand einem wohlhabenden Japaner zugesprochen worden. Ein Gericht in der thailändischen Hauptstadt Bangkok gab am Dienstag dem Antrag des 28-jährigen Mitsutoki Shigeta auf das alleinige Sorgerecht für die Kinder statt.Das Bekanntwerden von Shigetas """"Baby-Fabrik"""" hatte 2014 einen Skandal in Thailand ausgelöst und eine Verschärfung der Regelungen für Leihmütter bewirkt. Das Sorgerechtsurteil sei nunmehr mit Blick auf das Wohlergehen der Kinder gefällt worden"," erklärte das Gericht in Bangkok zur Begründung. Der biologische Vater könne den 13 Kindern """"Glück und Möglichkeiten"""" bieten. Der Japaner habe sich bereits um eine Unterkunft und Kindermädchen gekümmert.Shigeta", der nicht persönlich an dem Prozess teilnahm, will die 13 Kinder in seine Heimat bringen lassen. Der thailändische Staat hatte sie 2014 in Obhut genommen, nachdem neun von ihnen in einer Wohnung in Bangkok entdeckt worden waren. Die Kinder, die damals zwischen zwei Wochen und zwei Jahren alt waren, wurden dort rund um die Uhr von Kindermädchen betreut.DNA-Tests ergaben, dass Shigeta ihr Vater ist. Später wurden vier weitere Babys gefunden, die er von Leihmüttern hatte austragen lassen. Der Japaner, der Sohn eines reichen IT-Unternehmers sein soll," verließ Thailand damals nach den Enthüllungen über seine """"Baby-Fabrik"""". Später verklagte er den thailändischen Staat", um das alleinige Sorgerecht für die Kinder zu bekommen.Den Ermittlungen zufolge hat der Japaner insgesamt 19 Kinder gezeugt, 17 davon brachten thailändische Leihmütter zur Welt. Sechs seiner Kinder leben in Kambodscha und Japan.Nach Angaben seines Anwalts will Shigeta den Umzug der Kinder nach Japan in die Wege leiten," sobald diese dazu bereit sind. Sein Mandant habe selbst viele Geschwister """"und möchte"," dass die Kinder zusammen aufwachsen""""", sagte sein Verteidiger Kong Suriyamontol.Die Leihmütter verzichteten nach Angaben des Gerichts auf das Sorgerecht. Ob sie dafür finanziell entschädigt wurden, blieb unklar. Shigeta hatte den thailändischen Frauen umgerechnet zwischen 7.500 und 10.000 Euro gezahlt, damit sie seine Kinder austragen.Shigetas Fall hatte in Thailand einen Aufschrei ausgelöst. Daraufhin wurde es Ausländern 2015 per Gesetz verboten, Leihmütter in Thailand zu engagieren. Das Geschäft verlagerte sich daraufhin nach Kambodscha," bis die dortige Regierung 2016 ebenfalls ein Verbot erließ. Der Nachbarstaat Laos lässt dagegen Leihmutterschaften noch uneingeschränkt zu."""
"Fukushima-Betreiber muss nach Suizid von 102-Jährigem zahlen;""Der betagte Japaner hatte sich aus Angst vor der Umsiedlung nach dem Atomunglück das Leben genommen. Der Betreiber des havarierten japanischen Atomkraftwerks Fukushima ist wegen des Suizids eines 102-jährigen Mannes zu Schadenersatz verurteilt worden. Das Energieunternehmen Tepco müsse den Hinterbliebenen von Fumio Okubo umgerechnet 116.000 Euro zahlen", sagte der Anwalt der Familie am Dienstag.Der Dorfälteste hatte sich einen Monat nach der Atomkatastrophe vor sieben Jahren das Leben genommen," kurz nachdem die Regierung die Evakuierung seines 40 Kilometer östlich von Fukushima gelegenen Heimartortes Iitate angeordnet hatte. """"Ich habe ein bisschen zu lange gelebt""""", soll Okubo damals gesagt haben.Das Gericht in Tokio habe anerkannt," dass der Suizid mit dem """"starken Stress"""" angesichts der bevorstehenden Umsiedlung zusammenhing", sagte der Anwalt Yukio Yasuda. Der 102-Jährige habe Angst davor gehabt, seiner Familie zur Last zu fallen. Die Familie, die eine Entschädigung von 60 Millionen Yen (gut 450.000 Euro) gefordert hatte, werde das Urteil anerkennen.Tepco kündigte an, den Richterspruch zu prüfen. Das Unternehmen war bereits in zwei ähnlichen Fällen zur Zahlung von Schadenersatz verurteilt worden.In Fukushima hatte sich nach dem schweren Erdbeben und dem Tsunami vom März 2011 das schlimmste Atomunglück seit der Tschernobyl-Katastrophe von 1986 ereignet. Weil das Kühlsystem ausfiel, kam es in drei der sechs Reaktoren zur Kernschmelze. Das Gebiet in einem weiten Umkreis wurde radioaktiv verseucht. Tausende Anrainer werden vermutlich nie mehr in ihre Häuser zurückkehren können.Es kann Ihnen geholfen werdenKreisen Ihre Gedanken darum, sich das Leben zu nehmen? Sprechen Sie mit anderen Menschen darüber. Hier finden Sie - auch anonyme - Hilfsangebote im vermeintlich ausweglosen Lebenslagen. Per Telefon, Chat , E-Mail oder im persönlichen Gespräch.Kreisen Ihre Gedanken darum, sich das Leben zu nehmen? Sprechen Sie mit anderen Menschen darüber. Hier finden Sie - auch anonyme - Hilfsangebote im vermeintlich ausweglosen Lebenslagen. Per Telefon, Chat ," E-Mail oder im persönlichen Gespräch."""
Temposünder entging mit legalem Trick seiner Strafe;Mit einem Trick hat ein Verkehrssünder in Deutschland ein Fahrverbot und eine Geldstrafe wegen Raserei umgangen - und bleibt straffrei. Das Oberlandesgericht Stuttgart bestätigte den Freispruch des Mannes am Landgericht Tübingen, wie es am Dienstag mitteilte.Der Mann war als Raser geblitzt worden - er soll auf einer Bundesstraße bei erlaubten 120 Kilometern pro Stunde fast Tempo 180 gefahren sein. Dafür flatterte ihm ein Strafzettel ins Haus: Er sollte 480 Euro zahlen und seinen Führerschein für einen Monat abgeben. Er wandte sich an eine Person, die im Internet damit warb, gegen eine Zahlung Fahrverbote zu übernehmen. Die Person füllte den sogenannten Anhörungsbogen des Rasers aus - wie sich herausstellte, gab sie darauf eine nicht existierende Person in Karlsruhe an. Der Anhörungsbogen ist vor allem dafür da, dem Lenker die Gelegenheit zu geben, sich zu der Sache zu äußern.Bis die Behörden das bemerkten, war die Raserei verjährt und der Mann konnte nicht mehr belangt werden. Wie das Oberlandesgericht jetzt bestätigte, hat er sich auch nicht der falschen Verdächtigung schuldig gemacht - dafür hätte er eine real existierende Person zu Unrecht belasten müssen.und wie gibt eine nicht existierente Person den Führerschein ab?war es vielleicht der von Max Mustermann ?Danke......für den ausführlichen Hinweis. Werde das bei Gelegenheit auch so machen, um einer Strafe zu entgehen... das funktioniert vielleicht in D, aber nicht bei uns.@wollanigBei uns in Kärnten funktionieren dafür ganz andere Sachen.Da wird einem amtierenden Landeshauptmann beschieden, das Ausmaß seines Handelns und die Folgen daraus nicht abschätzen und beurteilen zu können. Somit ein Freispruch für politisch-beamtete Idiotie!PS: Ich bin kein Jurist und will es mir nicht antun, den exakten Wortlaut zu recherchieren. Aber der Sinn ist klar.Damit mögen sich die Eiferer aus der rechten oder sonst einer blürkisen Ecke ersparen, hier nun herum zu geifern. Weil diesen Faxen glaubt eh keiner, der auch nur ein bisschen politischen Restverstand behalten hat, auch nur ein Wort mehr.Wir passen auf Kärnten auf / Aus Liebe zu Kärnten.Jo eh.Schon wissen.Weil D eine gewachsene Demokratie(mit all ihren Nach- aber auch Vorteilen) ist.......Österreich hingegen, ähnlich wie Italien, ein versteckter Polizeistaat wie es ihn schon unter Metternich gegeben hat. Darum muß z.b. in D auch der Fahrer klar erkannt werden, in Österreich geht es nur darum von irgendjemandem(meist dem Fahrzeughalter) schnell etwas Geld zu kassieren. Bei uns funktioniert einiges nicht was in D funktioniert, umgekehrt ist das eher nicht so....leider(außer man bezieht negatives in die Gleichung mit ein).
