title;text
Bereits zehn Teams haben sich für das Rennen um den Google Lunar X Prize (GLXP) http://www.googlelunarxprize.org registriert, wie die X Prize Foundation http://www.xprize.org gestern, Donnerstag, bekannt gegeben hat. Ihr Ziel ist es, ein privat finanziertes robotisches Fahrzeug sicher auf dem Mond zu landen, auf dessen Oberfläche zumindest 500 Meter zurückzulegen und Fotos und Daten zu übertragen. Dem Gewinner winken 20 Mio. Dollar für die Erfüllung der Aufgabe," die aber für Teilnehmer eher ein Zusatzanspron sein dürfte. """"Unser Hauptziel ist nicht einen Profit zu machen"," sondern die Forschung für zukünftige Projekte""""", meint Dumitru Popescu, Projektleiter der Aeronautics and Cosmonautics Romanian Association (ARCA) http://www.arcaspace.ro ," im pressetext-Gespräch.Das am GLXP teilnehmende ARCA-Projekt sei """"die Fortsetzung dessen"," was wir bislang schon gemacht haben""""", so Popescu. Die Rakete HAAS, benannt nach dem österreichisch-rumänischen Raketenpionier Conrad Haas aus dem 16. Jahrhundert," soll von einem Trägerballon aus starten. """"Grundsätzlich ist die Technologie sehr ähnlich der in unserem suborbitalen System STABILO"""""," erklärt Popescu. HAAS wird den """"European Lunar Explorer"""" (ELE) in den Erdorbit bringen"," von dem aus ELE die Reise zum Mond antritt. Dafür werde an der Weiterentwicklung von Treibstofftanks und Antriebssystemen gearbeitet. """"Wir werden mit neuen Problemen der Flugdynamik umgehen müssen""""", nennt Popescu eine weitere Herausforderung. Auch im Bereich Elektronik müsse noch geforscht werden. ELE soll das eigentliche Mondlandemodul der ARCA-Mission, den European Lunar Lander, sicher ans Ziel bringen.Obwohl die ARCA-Webseite relativ viele Informationen zu den Ansätzen des Teams hat," glaubt Popescu nicht an Ideenklau durch Mitbewerber. """"Wir arbeiten meistens sehr schnell""""", gibt er einen Grund dafür an. Außerdem sei es wohl effizienter für GLXP-Konkurrenten eigene Ideen weiterzuentwickeln. Das macht ganz eindeutig Micro-Space http://www.micro-space.com , das Erfahrung aus dem Rennen um den Ansari X Prize (AXP) für das erste wieder verwendbare bemannte Raumschiff einer Nicht-Regierungs-Organisation mitbringt. Im Vergleich zum AXP wächst das Teilnehmerfeld beim GLXP schnell, knapp sechs Monate nach der Ankündigung gibt es bereits zehn definitive Teilnehmer am Mond-Wettrennen. Um den AXP hatten sich in diesem Zeitraum nur zwei Teams beworben.Einen interessanten Ansatz hat Team FREDNET http://www.frednet.com , das sich als Open-Source-Teilnehmer positioniert und Linux für die Weltraumerforschung nutzen will. Immerhin eines der Projekte, Team Italia, steht mit Amalia Ercoli Finzi vom Politecnico di Milano http://www.polimi.it unter der Leitung einer Frau. Die Konkurrenz dürfte noch deutlich größer werden, die X Prize Foundation meldet über 560 Interessenten aus mehr als 50 Ländern.Um die 20 Mio. Dollar des GLXP zu gewinnen, muss ein Team die gestellte Aufgabe bis Ende 2012 erfüllen, bis Ende 2014 ist noch ein reduzierter Preis zu holen. Ferner sind fünf Mio. Dollar für das zweitplatzierte Team im Topf, weitere fünf Mio. werden für die Erfüllung von Zusatzaufgaben vergeben. Auch zusätzliche Preise sind möglich, etwa stellt Space Florida http://www.spaceflorida.gov zwei Mio. Dollar in Aussicht," sollte das Gewinner-Fahrzeug aus Florida starten. Den AXP hatte im Oktober 2004 Microsoft-Mitbegründer Paul Allen mit dem SpaceShipOne gewonnen."""
"Zentrum für Ein-Personen-Unternehmen gestartet;""Endlich echte Service-Angebote für EPU"
Der Verein Z.EPU - Zentrum für Ein-Personen-Unternehmen lud gestern ins Café Prückl zum Kick-off-Event. Die wichtigsten Ziele des Vereins sind: Die Förderung unternehmerischen Handelns, die Stärkung des Selbstbewusstseins und die laufende Professionalisierung von Ein-Personen-UnternehmerInnen. Die Mitgliedschaft steht allen EPU offen und kostet Eur 90,-. Der Beitrag berechtigt zur vergünstigten Inanspruchnahme der Serviceleistungen von Z.EPU.Mehr als 100 interessierte UnternehmerInnen und PartnerInnen waren anwesend, als der Vorstand den neuen Verein Z.EPU und dessen Ziele präsentierte: Z.EPU ist eine Anlaufstelle für Ein-Personen-Unternehmen - von EPU für EPU - durch die sich EPU aller Branchen treffen, austauschen, weiterbilden und unterstützen können. Da für GründerInnen bereits ein weites Angebot besteht, versteht sich das ZEPU im Besonderen als Beratungsstelle für Ein-Personen-Unternehmen nach der Gründungsphase.Die Z.EPU-Serviceleistungen umfassen die Unterstützung bei Behörden- und Amtswegen, prozessbegleitendes Coaching, Seminare, Workshops, und Vorträge von EPU für EPU. Darüber hinaus sind mittelfristig ein eigenes EPU-Zentrum mit mietbaren Besprechungs- und Vortragsräumen sowie die Benützung von Büro- und Kopiergeräten gegen einen Unkostenbeitrag geplant. Der Mitgliedsbeitrag beträgt Eur 90,- pro Jahr, wobei darin Gutscheine im Wert von Eur 50,- für Fortbildungsveranstaltungen inkludiert sind.Mag. Ursula Kriebisch-Satori, Obfrau von Z.EPU," hob die Unterschiede zwischen bereits existierenden Interessensvertretungen hervor: """"Unser vorrangiges Ziel ist die praktische Unterstützung von EPU zu EPU. Wir verstehen uns als Drehscheibe für EPU-Wissen und Erfahrung und bieten genau das an"," woran es den meisten EPU mangelt."""" Dr. Eva Broermann"," Schriftführerin des Vereins betont: """"Wir reden an der Basis von EPU zu EPU. Ziel ist Ein-Personen-Unternehmen durch gegenseitige Unterstützung und Kooperation zu fördern. Z.EPU ist parteiunabhängig"," wird sich aber gern beratend in den politischen Dialog einbringen.""""Weitere Informationen zu Z.EPU unter http://www.zepu.at"
Rückfragen bitte an: 
Dr. Eva Broermann, e.broermann@zepu.at , 0660 5545354
Ursula Kriebisch-Satori, u.kriebisch-satori@zepu.at ," 0664 500 72 51"""
"Management by Objectives - Von der Pflicht zur Kür;""Soreco auf der Personal Swiss: Enterprise Performance Management & e-Recruiting"
Personal Swiss, Fachmesse für Personalmanagement, Zürich
22. und 23. April 2008, Halle 5 - Stand B.07Auf der Personal Swiss 2008 präsentiert der Softwarehersteller Soreco AG die neue Version 3.0 der Enterprise Performance Management Lösung Xpert.EPM," welche das """"Führen durch Ziele"""" noch effizienter als bislang unterstützt. Durch eine deutliche Steigerung des Automatisierungsgrads bei der Zielmessung lassen sich nun rund 80 Prozent aller Messresultate automatisch in Xpert.EPM einlesen. Somit sinkt nicht nur das Fehlerpotential manueller Werteingaben. Auch der gesamte EPM-Prozess beschleunigt sich. Das Ergebnis: Maximale Produktivität durch fortlaufende automatisierte Zielmessung", verbesserte Transparenz und minimale Fehlerraten. Weiterer Messeschwerpunkt von Soreco ist das e-Recruiting. Mit Hilfe einer neuen Portallösung sind Unternehmen in der Lage, den gesamten Bewerbungsprozess webbasiert und prozessgestützt abzubilden. Darüber hinaus erfährt das interessierte Fachpublikum, wie das elektronische Personaldossier Xpert.EPD alle Mitarbeiterinformationen zentral und vor allem intelligent verwaltet. Obwohl das Führungsprinzip Management by Objectives . Weitere Informationen: http://www.personal-swiss.chLeistungsstarkes HR-Portal für das e-Recruiting
Mit einer Lösung für das internetbasierte Bewerbermanagement hat Soreco sein Portal-Portfolio im HRM-Bereich weiter ausgebaut. Die neue Portal-Anwendung versetzt Unternehmen in die Lage, alle administrativen Tätigkeiten rund um die Personalselektion effizient und prozessorientiert abzuwickeln. Das integrierte Business Process Management Werkzeug Xpert.ivy leitet dabei sowohl den Bewerber als auch den HR- bzw. Linien-Verantwortlichen durch die Funktionen des e-Recruiting-Portals. Dazu zählt zum einen das Einstellen offener Vakanzen und Personalbedarfsmeldungen, das Management von Bewerberdossiers, die Übersicht von Vakanzen und Bewerbungen sowie das Erstellen von Auswertungen. Zum anderen werden die Bewerber schrittweise durch den Rekrutierungsprozess geführt - von der Suche nach offenen Positionen über die Detailansicht der ausgeschriebenen Stelle bis hin zur Online-Dateneingabe und der Möglichkeit, Dokumente anzuhängen.Alle Informationen im Zugriff mit dem elektronischen Personaldossier
Das elektronische Personaldossier Xpert.EPD von Soreco basiert auf der Dokumenten-Management-Lösung Xpert.ECM und verfügt somit über umfassenden Funktionen zur Verwaltung, Klassifizierung, Verteilung und revisionssicheren Archivierung von Dokumenten. Durch die vollständige Integration in die Personalmanagement-Software Xpert.HRM sowie durch leistungsstarke Scanning-Funktionen lassen sich alle mitarbeiterrelevanten Dokumente komfortabel in Dossiers organisieren. Egal, ob Filme, Sprachdokumente, PDF-, Word-, oder Excel-Dateien - das elektronische Personaldossier verwaltet beliebige Objektarten, wobei eine intelligente Indexierung sowie die Volltextsuche das rasche Wiederfinden aller Informationen garantieren.Weitere Informationen:
Soreco AG - Thomas Koller 
Ringstrasse 7 - CH-8603 Schwerzenbach (ZH)
Tel. : 044 806 25 25 - Fax: 044 806 25 26
info@soreco.ch - http://www.soreco.chPresse- und Öffentlichkeitsarbeit:
Press'n'Relations GmbH - Monika Nyendick
Magirusstrasse 33 - D-89077 Ulm
Tel. : +49 731 96287-30 - Fax: +49 731 96287-97
mny@press-n-relations.de - http://www.press-n-relations.deSoreco AG
Gegründet im Jahr 1988, entwickelt und vermarktet die Soreco AG, mit Hauptsitz in Schwerzenbach bei Zürich, zukunftsgerichtete und branchenunabhängige Standardsoftware für den mittleren und oberen KMU- sowie Grossfirmenbereich. Die Zusammenarbeit mit Partnern im Lösungs-, Dienstleistungs- und Technologiebereich in Deutschland, Österreich und der Schweiz garantiert individuell zugeschnittene Lösungen aus einer Hand (Software, Dienstleistungen, Hardware, Netzwerk). Mit 120 Mitarbeitern und Mitarbeiterinnen betreuen Soreco und die Soreco Partner (rund 300 Mitarbeitende) derzeit über 2.000 Unternehmen aus den unterschiedlichsten Branchen," davon 30 % der Top 500 Schweizer Unternehmen."""
"Social Communities verlieren User in Europa;""""""Relevante Plattformen werden sich herauskristallisieren"""""
Während Social-Networking-Plattformen wie Facebook und MySpace in den USA weiter wachsen, haben sie in einigen Ländern Europas offenbar bereits den Höhepunkt ihrer Beliebtheit überschritten. Einer aktuellen Untersuchung des Marktforschungsunternehmens Nielsen Online http://www.nielsen-online.com zufolge, ist besonders England von diesem Rückgang betroffen. Dort sanken erstmals seit Beginn der Aufzeichnungen der Marktforscher die monatlichen Userzahlen. So suchten laut der Analyse nur noch 8,6 Mio. Nutzer im Januar das Portal von Facebook in England auf, im Dezember 2007 verzeichnete man noch 8,9 Mio. Besucher. Aber auch in Spanien (von 682.000 auf 659.000) und in Frankreich (von 1.89 Mio. auf 1.87 Mio.) fiel die Zahl der einzelnen User im vergangenen Monat. Wie Nielsen-Analyst Alex Burmaster bestätigt," sei nicht nur bei Facebook der Wachstumshöhepunkt mittlerweile überschritten. Auch bei den Konkurrenz-Plattformen MySpace und Bebo seien die gemessen Höchstwerte bereits im April bzw. Juli 2007 erreicht worden. """"Ich bin davon überzeugt"," dass im Social-Community-Bereich eine Welle der Konsolidierung auf uns zukommen wird""""", meint Markus Hübner, Web-Experte und Geschäftsführer der Agentur Brandflow http://www.brandflow.at ," auf Anfrage von pressetext. Dies liege auch an der sich zunehmend verschärfenden Konkurrenzsituation. """"War am Anfang des Community-Booms noch genug vom Gewinnkuchen für jeden Anbieter übrig", kristallisieren sich nun jene Plattformen heraus," die für die User wirklich relevant sind"""""," erklärt Hübner. Die unterschiedliche Entwicklung am europäischen und am US-Markt ergebe sich aufgrund verschiedener Marktsituationen. """"In den USA ist die Sättigung am Social-Networking-Sektor noch nicht so stark gegeben wie in Europa"""""," stellt der Web-Experte fest. Dort könnten Unternehmer mit innovativen Ansätzen sich noch erfolgreich am Markt positionieren. """"Sobald der Innovationsgrad ausgereizt ist"," wird aber auch in den USA eine Beruhigung im Community-Bereich eintreten"""""," ist Hübner sicher.Die Gründe für den Userrückgang liegen laut Hübner aber nicht nur alleine in der ausgeprägten Konkurrenzsituation am Markt. Auch der mit der Nutzung von Social-Networking-Portalen verbundene hohe Verwaltungs- und Kommunikationsaufwand wirke in diesem Zusammenhang vielfach kontraproduktiv. """"Die 'Registrierungs-Manie' ist dem einzelnen Nutzer mittlerweile einfach zu anstrengend"""""," führt Hübner aus. Verwaltungskomfort stellt demnach für Social-Community-Anbieter schon jetzt ein wesentliches Anliegen dar. """"Ein zunehmend wichtiges Entscheidungskriterium für den User wird künftig zudem die Beständigkeit einer Plattform sein"""""," ergänzt der Web-Experte.Für den deutschsprachigen Markt sei vor allem der für das erste Quartal 2008 angekündigte Deutschland-Start von Facebook (pressetext berichtete: http://www.pte.at/pte.mc?pte=080208025 ) interessant. """"Derzeit bleibt noch abzuwarten"," wie genau sich Facebook am deutschen Markt positionieren wird""""", meint Hübner. Wie sich die Situation der Social-Communities in Zukunft weiterentwickeln wird," sei zur Zeit schwer abzuschätzen. """"Generell besteht sicher noch einiges an Wachstumspotenzial. Wie genau es allerdings in diesem Bereich weitergeht", werden erst die nächsten ein," zwei Quartale zeigen"""""," so Hübner abschließend."""
"DRI überzeugt Hessen: Viel Feedback für Fachfotograf Kircher;""Die aktuelle """"HESSEN hat was!""""-Wochenschau vom 22. Februar 2008"
"Vor einem Monat berichtete die """"HESSEN hat was!""""-Wochenschau unter dem Titel """"Hessische Städte neu gesehen mit DRI-Fotografie"""" von einer faszinierenden Fototechnik"," bei der 10 bis 15 Fotos von unterschiedlicher Belichtung zu einem einzigen kontrastreichen Bild verschmelzen. """"DRI"""" steht für """"Dynamic Range Increase"""" (dynamische Kontrasterweiterung) und das verwandte """"HDR"""" für """"High Dynamic Range"""" (hohes Kontrastverhältnis). Fotograf und Medienproduzent Jürgen Kircher aus Hainburg", der mit der DRI/HDR-Technik arbeitet, hat daraufhin überraschend viel Feedback," Anfragen und Internet-Klicks bekommen. Das HR-Fernsehen hat ein Portrait von Kircher für die """"Hessenschau"""" gedreht. Offenbar kommt DRI gut an in Hessen. Grund genug für die Redaktion von """"HESSEN hat was!"""" http://www.hessen-hat-was.de"," den Foto-Experten zu einer Zusammenarbeit einzuladen. Die Wochenschau von """"HESSEN hat was!"""" blickt in dieser Ausgabe tiefer in die Geheimnisse und Möglichkeiten von DRI und präsentiert weitere Top-Leistungen", Veranstaltungen und Produkte aus Hessen.DRI/HDR - mit besonderen Fotos in der Öffentlichkeit auffallen
DRI/HDR-Fotografien mit ihren enormen Kontrasten verleihen Städten, Gebäuden, Objekten und Landschaften eine charakteristische, manchmal märchenhafte Ausstrahlung. Die Ästhetik der DRI-Fotos ist für sich genommen bereits ein hoher Wert. Gleichzeitig ist diese Technik perfekt geeignet für Stadtmarketing, Tourismus-Unternehmen und Aussteller, für Kunst- und Kulturschaffende, Museen und viele andere. Mit besonderen Fotos in der Öffentlichkeit auffallen: Das kann in unserer auf Bilder ausgerichteten Welt schnell zum Marktvorteil werden. Und wo gibt es Beispiele zum Anschauen? Bis zum 15. März kann man die Arbeiten Jürgen Kirchers täglich in der Galerie der Hugenottenhalle in Neu-Isenburg besichtigen; darunter auch Bilder einer Fotoreportage aus Nepal. Für diejenigen, die selbst die DRI-/HDR-Fotografie erlernen möchten," hat Kircher ein ganz besonderes Angebot: """"Im Juni startet unsere Workshop-Reihe mit einer exklusiven Reise in den Sinai", für eine kleine Gruppe von Fotografen und engagierten Fotoamateuren. Sie werden das geheimnisvolle Land kennen lernen und es mittels der faszinierenden Fototechnik festhalten," wie es noch nie zuvor gemacht wurde."""" Weitere Informationen über DRI/HDR und Jürgen Kircher sind unter http://www.fachfotograf.de zu finden. Wer eine Beratung und Angebote für DRI-Aufträge in Hessen wünscht"," kann sich an """"HESSEN hat was!"""" wenden"," unter info@hessenhatwas.de und den Kontaktdaten am Ende dieser Wochenschau. Die """"HESSEN hat was!""""-Redaktion berät Interessierte darüber"," wie sie zusammen mit dem Fotoprofi einmalige DRI-/HDR-Bilder herstellen und zum Beispiel in der Öffentlichkeitsarbeit verwenden können.""""Lust am Lesen"""" im Hotel Krone Assmannshausen"
Kultur und Kulinaria gehören im Hotel Krone Assmannshausen traditionell zusammen. Am Donnerstag, dem 13. März, kann man - nein, frau! - sich davon überzeugen," wenn es heißt: """"Seitenblicke"," oder die Lust am Lesen"""". Es ist ein Abend für Damen", die ihre Nasen gern in Bücher stecken. Die Auftaktveranstaltung versammelt Rheingauer Autoren und schlägt einen kulinarischen Bogen durch die feine regionale Küche. Gereicht werden Aperitif, Weine und ein 3-Gang-Menü, komponiert von Küchenchef Jens Kottke. Moderatorin Lydia Malethon führt die Gäste ab 19.30 Uhr durch den Abend. Die Veranstaltung kostet 45,00 Euro pro Person, eine rechtzeitige Reservierung ist erforderlich: Tel.: +49-(0)6722-4030, Fax: +49-(0)6722-3049, E-Mail: info@hotel-krone.com ReWoBau 2008 - Renovieren Wohnen Bauen
Mit mehr als 300 Ausstellern gehört die ReWoBau zu den größten branchenreinen Ausstellungen in Hessen. Auf einer Fläche von ca. 12.000 Quadratmetern findet der interessierte Besucher alles, was er braucht, um Heim und Haus nach individuellen Vorstellungen zu gestalten. Die zwölfte ReWoBau beginnt am Freitag, den 29.02.2008 um 10.00 Uhr in den Rhein-Main-Hallen Wiesbaden und ist bis Sonntag, den 02.03.2008, täglich von 10.00 Uhr bis 18.00 Uhr geöffnet. Der Eintrittspreis beträgt Eur 7,50, ermäßigt Eur 6,00; Kinder und Jugendliche bis 16 Jahren haben freien Eintritt. Nähere Informationen zur ReWoBau unter http://www.aumeco.de Mit dem Familienpass Willingens Highlights erleben
Sein einzigartiges Freizeitangebot und die malerische Landschaft machen Willingen zu einem attraktiven Urlaubsziel, insbesondere für Familien. Daher bietet die Stadt den Familienpass an und damit Urlaubserlebnisse zum familienfreundlichen Preis, zum Beispiel in den Osterferien. Im Familienpass sind Ausflüge zu allen Willinger Highlights enthalten. Von Wild- und Freizeitpark, Kletterhalle und Bowlingbahn, bis hin zu einer Fahrt auf der Sommerrodelbahn. Mit der neuen Ettelsberg-Kabinenbahn geht es hoch zu Ettelsberg-Hütte und Hochheideturm. Der Besuch der traditionellen Glasbläserei und des historischen Besucherbergwerks ist lehrreich und spannend. Und im Lagunen-Erlebnisbad fühlen sich die Gäste in subtropische Gefilde versetzt. Hinzu kommen sieben Tage lang freie Nutzung der Standseilbahn an der Mühlenkopfschanze, der Pit-Pat-Anlage und der Tennisplätze sowie des Sportstudios am Sauerland-Stern-Hotel. Während der Öffnungszeiten des Freizeitparks Fort Fun in Bestwig-Wasserfall erhalten die Besucher einmal freien Eintritt ins Abenteuerland. Der Willinger Familienpass kostet 39,50 Euro pro Person, für Kinder im Alter bis drei Jahren ist die Teilnahme kostenlos. Er gilt in den Oster-, Sommer- und Herbstferien. In den Osterferien beträgt der Preis nur 33,- Euro, da einige Freizeiteinrichtungen witterungsbedingt zu dieser Zeit noch nicht geöffnet sind. Mehr Informationen und weitere Angebote unter http://www.willingen.de .o.camp - Training für den Schulerfolg
"Die Deutsche Kinder- und Jugendstiftung und das Hessische Kultusministerium organisieren in diesem Jahr zum zweiten Mal das Förderprogramm """"o.camp."""" Die """"o.camps"""" geben versetzungsgefährdeten Haupt- und Realschülern der achten Klasse in den Osterferien vom 25. März bis 4. April 2008 die Möglichkeit", ihre Kenntnisse in den Fächern Deutsch, Englisch und Mathe zu verbessern. Ziel ist, dass die Jugendlichen nach dem Besuch der Camps ihre Versetzung schaffen und motiviert und mit Selbstvertrauen ins neue Schuljahr gehen. Gleichzeitig wird ein interessantes Freizeitprogramm geboten. Die 11-tägigen Camps finden statt im Schullandheim Wegscheide," in der Reinhardswaldschule Fuldatal und im Familienferiendorf Hübingen. Teilnehmen werden in diesem Jahr rund 180 Jugendliche. Im vergangenen Jahr hatten 85% der o.camps-Absolventen ihre Versetzung geschafft. Homepage zum Programm: http://www.ocamps.de""""Rhein im Feuerzauber"""" - das besondere Geschenk"
"Wenn der """"Rhein im Feuerzauber"""" leuchtet", verzaubern Lichterglanz, Bengalfeuer und sieben Feuerwerke Einheimische und tausende Besucher am Tor zum Mittelrheintal. Am 5. Juli, in der Zeit der großen Sommerfeste," feiern die Städte Rüdesheim am Rhein und Bingen den """"Feuerzauber"""". Der Kartenverkauf für das VIP-Schiff MS Asbach hat bereits begonnen. Wer Partnern", Freunden, der Familie oder Kollegen ein besonderes Geschenk machen möchte, kann mit der Fahrt ins romantische Obere Mittelrheintal einen unvergesslichen Abend verschenken. Das Schiff legt um 18.00 Uhr in Rüdesheim ab und fährt in Richtung Loreley. Begrüßungscocktail, kalt-warmes Galabuffet und Live-Musik umrahmen das Feuerzauber-Programm, das bis spät in die Nacht reicht. Die Karten kosten 99 Euro pro Person; eine Gruppe von 70 bis 80 Personen kann sogar ein ganzes Deck auf dem VIP-Schiff für sich reservieren. Weitere Informationen - auch zu anderen Kartenkategorien - hat die Rüdesheim Tourist AG, Geisenheimer Straße 22, 65385 Rüdesheim am Rhein, Tel.: +49-(0)6722-906-150, Fax: +49-(0)6722-3485; Website: http://www.ruedesheim.de, E-Mail: gaby.schaefer@ruedesheim.de .Festivals und Wanderungen in Rüdesheim und Umgebung
"In der aktuellen Ausgabe des wöchentlichen Newsletters """"Erlebnis Rüdesheim!"""" geht es um das Zwölfte Rheingau Gourmet & Wein Festival und das 33-Jahre-Gnoom-Festival mit drei Konzert-Highlights am ersten Märzwochenende. Eine Stippvisite zur Weinprobe in Rüdesheim wird vorgestellt und die Broschüre """"Wandern im Welterbe"""" mit den zehn besten Erlebnis-Touren in Rüdesheim und Umgebung. Dazu Updates im Veranstaltungskalender """"Schlemmen und Schlummern"""". Link zu """"Erlebnis Rüdesheim!"""" (6) vom 21.02.08: http://www.erlebnis-ruedesheim.de/newsletter/06.html Vorschau: Gary Moore live", 7. März um 20 Uhr - Hessenhalle, August-Balzer-Weg 18," 35398 Gießen / Alfons: """"Die Rückkehr der Kampfgiraffen""""", 8. März, Bürgerhaus Nieder-Roden, Tel.: +49-(0)6106-693-1226 / Chagall zu Gast in Offenbach,14. März bis 25. Mai - Klingspor Museum," Tel.: +49-(0)69-8065-2954 / """"Irish Spring"""" - Festival of Irish Folk Music", 16. März um 19 Uhr - Bensheim-Auerbach," http://www.festspiele-auerbach.de """"HESSEN hat was!""""-Die Wochenschau und die Aktionsplattform http://www.hessen-hat-was.de präsentieren das Beste", was Industrie, Handel, Städte," Dienstleister und Veranstalter des Bundeslandes Hessen zu bieten haben. Kostenfreies und unverbindliches Abo unter http://www.hessen-hat-was.de/kostenlos_anmelden.php . Redaktion und Projektbüro """"HESSEN hat was!"""": c/o NEWVICOM GmbH", Rudolf-Vogt-Straße 1, 65187 Wiesbaden, E-Mail: info@hessenhatwas.de , Tel.: 0611-26777-0," Fax: 0611-26777-16"""
"Blu-ray-Sieg - ""Hatten einfach die Nase vorne"";""Hara: """"Konsumenten haben sich für unser Format entschieden"""""
Der japanische Elektronikkonzern Sony ist im Rennen um das Format für hochaufgelöste Medien vor wenigen Tagen über die Ziellinie gelaufen. Konkurrent Toshiba hatte die Aufgabe der Produktion seiner HD-DVD-Medien ab sofort bekannt gegeben (pressetext berichtete: http://pte.at/pte.mc?pte=080219017 ). Nachdem die Schlacht um die Nachfolge der DVD über weite Strecken unentschieden verlaufen war, ist im Sony-Lager jetzt Feierstimmung angesagt. Selbstbewusst zeigte sich gegenüber pressetext auch Naofumi Hara, Corporate Executive Corporate Communications bei Sony International, der den größten Vorteil für Blu-ray im Wunsch der Konsumenten sieht.pressetext: Wie kommentieren Sie die Toshiba-Entscheidung?
Hara: Dass Blu-ray nun das alleinige HD-Format sein wird, ist natürlich sehr erfreulich für uns. Überraschend war es allerdings nicht. Die Entwicklungen in der vergangenen Zeit haben schon in diese Richtung hingewiesen. Die Entscheidung von Warner Brothers sowie weiterer Studios, künftig nur noch auf Blu-ray zu setzen, sowie auch der Einfluss von Geräteherstellern haben hierbei einen großen Ausschlag gegeben. pressetext: Worin sehen Sie die Gründe für diese Entscheidungen? 
Hara: Über die tatsächlichen Gründe Toshibas kann ich jetzt natürlich nur spekulieren. Wir sehen die Entwicklung zugunsten Blu-rays jedoch klar im Kundenwunsch begründet. Blu-ray hatte zuletzt die Nase klar voran und Konsumenten haben sich beim Kauf von Medien für unser Format entschieden. Es wurden einfach mehr Blu-ray-Medien verkauft als HD-DVDs. Ein großer Pluspunkt für Blu-ray war sicherlich die große Verbreitung der Playstation 3. Mit unserer Next-Generation-Konsole hatten wir Millionen von Blu-ray-Abspielgeräten in den Wohnzimmern der Menschen. Die Strategie hat funktioniert.pressetext: Wie wird es künftig weitergehen? Wird Sony versuchen, die bisherigen HD-DVD-Treiber auf seine Seite zu ziehen - Microsoft mit der Xbox 360 beispielsweise? 
Hara: Warum sollten wir das benötigen? Toshiba hat jedenfalls schon angekündigt, sich künftig aus bei HD-Medien heraushalten zu wollen. Was die anderen Unternehmen, die bislang im HD-DVD-Lager zu finden waren, machen werden, wird sich in Zukunft noch zeigen. Die Konsumenten haben sich jedenfalls für Blu-ray entschieden," daher wird es das Format der Zukunft sein. Der Rest wird sich ergeben."""
