title;text


"Schon derzeit gehöre Österreich hinsichtlich Gesundheitsvorsorge und Prävention zu den Schlusslichtern Europas. Die Ärztekammer habe sich zu dieser """"wohl nicht alltäglichen"""" Maßnahme entschlossen"," um doch noch der """"Vernunft in Österreich"""" zum Durchbruch zu verhelfen: """"Das sind wir unseren Patienten einfach schuldig.""""Die Abkehr vom Nichtrauchergesetz 2015 und vom generellen Rauchverbot in der Gastronomie würde laut Ärztekammer massive gesundheitliche Auswirkungen auf große Bereiche der Bevölkerung haben", warnte Szekeres. Es sei ein Faktum, dass ein Drittel aller Krebserkrankungen auf Rauchen zurückzuführen sei. Generelle Rauchverbote in anderen EU-Ländern hätten weiters gezeigt, dass damit Herzinfarkte, Atemwegserkrankungen, Angina Pectoris sowie die Frühgeburtenrate und die Anzahl der zu kleinen Neugeborenen reduziert werden konnten.Ab Mitte Februar sollen dann auf Gemeinde- und Bezirksämtern Unterschriften gesammelt werden, 8.401 sind notwendig. Danach wird vom Innenministerium ein Termin für die Eintragungswoche festgesetzt. Damit das Volksbegehren dann im Parlament behandelt wird, werden 100.000 Unterschriften benötigt. Das Volksbegehren werde vorerst das Kippen des Rauchverbots durch die Regierung nicht verhindern können, deren Plan es ist, die aktuelle Regelung mit getrennten Räumen für Raucher beizubehalten.EU-weit dominiert generelle Regelung Staaten wie Vorreiter Irland brauchten keine Einladung von der EU, um tätig zu werden. Dort ist das generelle Rauchverbot in geschlossenen öffentlichen Räumen und an allen Arbeitsplätzen, also auch in allen Pubs und Restaurants, bereits seit dem 29. März 2004 Realität. Ein Jahr später folgte Italien, wo seit dem Jänner 2005 der Rauchstopp in öffentlichen Gebäuden und in der Gastronomie gilt - hier sind Raucherbereiche zwar möglich, werden aber aufgrund der strikten Auflagen kaum in Anspruch genommen.
"In Österreich folgte mit 1. Jänner 2009 mit dem Tabakgesetz ein """"grundsätzliches"""" Rauchverbot in Lokalen mit Ausnahmen für abgetrennte Raucherzimmer und kleine Gaststätten. Zu diesem Zeitraum war ein generelles Rauchverbot bereits auch in Finnland oder in Frankreich in Kraft. Als EU-Nachzügler entpuppte sich Tschechien", doch seit dem Weltnichtrauchertag am 31. Mai 2017 ist das Verbot auch im ehemaligen Raucherparadies ein generelles.
Es gibt aber auch EU-Staaten, wo weiterhin Rauchverbote mit Ausnahmen gelten. So gab es in Deutschland den umfassenden Schutz vor den Gefahren des Rauchens nur in den Gaststätten Bayerns, Nordrhein-Westfalen und des Saarlandes. In den übrigen Bundesländern gibt es nach wie vor unterschiedliche Regelungen, wenn jedoch geraucht werden darf, dann dürfen Gaststätten erst ab 18 Jahren betreten werden.
Raucherräume oder -bereiche sind unter anderem auch in Polen oder der Slowakei zugelassen, in 17 Staaten gilt jedoch das generelle Rauchverbot.Staaten wie Vorreiter Irland brauchten keine Einladung von der EU, um tätig zu werden. Dort ist das generelle Rauchverbot in geschlossenen öffentlichen Räumen und an allen Arbeitsplätzen, also auch in allen Pubs und Restaurants, bereits seit dem 29. März 2004 Realität. Ein Jahr später folgte Italien, wo seit dem Jänner 2005 der Rauchstopp in öffentlichen Gebäuden und in der Gastronomie gilt - hier sind Raucherbereiche zwar möglich," werden aber aufgrund der strikten Auflagen kaum in Anspruch genommen.In Österreich folgte mit 1. Jänner 2009 mit dem Tabakgesetz ein """"grundsätzliches"""" Rauchverbot in Lokalen mit Ausnahmen für abgetrennte Raucherzimmer und kleine Gaststätten. Zu diesem Zeitraum war ein generelles Rauchverbot bereits auch in Finnland oder in Frankreich in Kraft. Als EU-Nachzügler entpuppte sich Tschechien", doch seit dem Weltnichtrauchertag am 31. Mai 2017 ist das Verbot auch im ehemaligen Raucherparadies ein generelles.Es gibt aber auch EU-Staaten, wo weiterhin Rauchverbote mit Ausnahmen gelten. So gab es in Deutschland den umfassenden Schutz vor den Gefahren des Rauchens nur in den Gaststätten Bayerns, Nordrhein-Westfalen und des Saarlandes. In den übrigen Bundesländern gibt es nach wie vor unterschiedliche Regelungen, wenn jedoch geraucht werden darf, dann dürfen Gaststätten erst ab 18 Jahren betreten werden.Raucherräume oder -bereiche sind unter anderem auch in Polen oder der Slowakei zugelassen," in 17 Staaten gilt jedoch das generelle Rauchverbot. VolksbegehrenDem Volksbegehren für    r a u c h f r e i    t o t al   wünsche ich besten Erfolg ! !"""
"Richterin bringt Petrikovics in Erklärungsnot;""Die Frage", wer das zweite Bieterverfahren im Verkauf der staatlichen Buwog initiiert hat, brachte Ex-Immofinanzchef Karl Petrikovics ins Strudeln.Wer hat das zweite Bieterverfahren beim Verkauf der staatlichen Buwog initiiert, wollte heute Richterin Marion Hohenecker im Korruptionsprozess gegen den ehemaligen Finanzminister Karl-Heinz Grasser (FPÖ/ÖVP) ganz genau wissen - und brachte damit den angeklagten Ex-Immofinanzchef Karl Petrikovics in Erklärungsnot.Zuerst meinte Petrikovics, dass es wohl im Interesse des mitangeklagten Lobbyisten Peter Hochegger gewesen sei, da er bei einem Nicht-Zuschlag an das Käuferkonsortium Immofinanz/RLB OÖ um seine millionenschwere Provision umgefallen wäre. Auf Einwurf von Hohenecker, dass ja Hochegger nicht die Kompetenz hätte als Berater ein zweites Bieterverfahren zu initiieren, räumte Petrikovics ein, dass dies wohl so stimme.Wer dann die Kompetenz habe, wollte Hohenecker wissen. Antwort von Petrikovics: Der Eigentümervertreter, also der Finanzminister.Und woher wusste Hochegger überhaupt, dass es ein zweites Bieterverfahren gibt, hakte Hohenecker nach. Wohl vom Mitbewerber CA Immo/Bank Austria, mutmaßte Petrikovics daraufhin. Dieser hätte zwar sein eigenes Gebot gewusst, aber doch nichts über eine zweite Bieterrunde, hakte die Richterin nach. Petrikovics meinte, er habe nie nachgefragt, woher Hochegger seine Informationen gehabt habe.Ein zweites Bieterverfahren wurde offenbar überhaupt erst angesetzt, nachdem Hochegger bei Petrikovics nachgefragt hatte, ob das Konsortium bereit wäre," mit seinem Angebot höher zu gehen - in Richtung 1 Mrd. Euro. Dies galt damals als der """"Wunschpreis"""" des damaligen Finanzministers Karl-Heinz Grasser (FPÖ/ÖVP)", den dieser für die Bundeswohnungen erzielen wollte. Nachdem sich Petrikovics beim Geschäftspartner Raiffeisen Oberösterreich, also beim RLB-OÖ-Vorstand Georg Starzer, rückversichert hatte, dass das Konsortium zu einer Preisanhebung bereit wäre, teilte er dies Hochegger mit. Daraufhin wurde im Bieterverfahren eine zweite Runde eröffnet.In der ersten Runde war die CA Immo mit einem großen Vorsprung von 80 Mio. Euro vorne gelegen. In der zweiten Runde gewann dann das Österreich-Konsortium mit RLB OÖ und Immofinanz mit einem haarscharfen Vorsprung von 1,2 Mio. Euro. Die CA Immo hatte in ihrem ersten Angebot ihr Finanzierungslimit von 960 Mio. Euro erwähnt. Hochegger sagte Petrikovics," das Konsortium müsse """"mehr als 960 Mio. Euro"""" bieten.jetzt verstehen wir auch besser ",warum sogar Böhmdorfer aktiviert wurde , um  die Richterin zu verhindern. Sie  arbeitet genauestens  um alle Widersprüche auszuräumen . Kompliment....2tes BieterverfahrenWas sagt Grasser dazu, dass das nur der Finanzminister starten darf?Grasser  wussteals Ex-Blauer sicher nichts davon, war nicht dabei," war vielleicht zu jung oder sonst noch was 😴🤢zu schönnatürlich.....und womöglich zu schlau?"""
"Hochegger-""Geheiminfos"" standen schon in Zeitungen;""Der ehemalige Immofinanzchef Karl Petrikovics beteuerte", nichts über die enge Verbindung von Hochegger zu Grasser und Meischberger gewusst zu haben.Im Korruptionsprozess gegen Ex-Finanzminister Karl-Heinz Grasser (FPÖ/ÖVP) wiederholte der mitangeklagte ehemalige Immofinanzchef Karl Petrikovics seine Sicht, wonach der ebenfalls angeklagte Lobbyist Peter Hochegger ihm einen wichtigen Tipp gab," dass hinter dem Mitbewerber CA Immo die Bank Austria steht - und somit die CA Immo ein potenter Gegner beim Kauf der Buwog war.""""Im Rahmen des Erstgesprächs kam von Dr. Hochegger", es geht nicht um die kleine CA Immo," sondern möglicherweise die Bank Austria""""", sagte Petrikovics heute in der Befragung durch Staatsanwalt Alexander Marchart. Zuvor habe er nicht verstanden, wie die kleine CA Immo die großen Bundeswohnungen stemmen hätte können.Dies ist insofern überraschend, da schon vor der Beauftragung von Hochegger am 10. Mai 2004 in mehreren Zeitungsberichten zu lesen war," dass die CA Immo mit der Bank Austria biete. So schrieb das """"WirtschaftsBlatt"""" am 24. April 2004 über die Bieter für die Bundeswohnungen: """"CA Immo mit Bank Austria-Creditanstalt"""". Was auch nicht überraschte", war doch die Bank an der CA Immo als Kernaktionär beteiligt, was auch kein Geheimnis war sondern im Firmenbuch stand und in Zeitungsberichten erörtert wurde.Oberstaatsanwalt Gerald Denk hielt Petrikovics zahlreiche Medienberichte zu den engen Geschäftsverbindungen zwischen Peter Hochegger, Walter Meischberger, Ernst Karl Plech sowie Grasser vor. Hochegger hatte etwa die KMU-Kampagne für das Finanzministerium im Auftrag Grassers organisiert. Hochegger war mit Meischberger und Plech im Seitenblicke-Magazin geschäftlich tätig. In Zeitungs- und Magazinberichten aus den Jahren 2002 und 2003, also vor und während der Privatisierung der Bundeswohnungen, wurden die guten Beziehungen zwischen den vier nunmehr Angeklagten ausführlich beschrieben.Er habe zu diesen Berichten keine Wahrnehmungen, sagte Petrikovics. Zu seinem Medienverhalten gab er an, er habe ab und zu Zeitungen gelesen, wenn er dafür Zeit hatte, aber nur die Wirtschaftsberichte. Politische Berichte hätten ihn nie interessiert. Auf die Frage, ob er wisse, wer damals Bundeskanzler und Finanzminister gewesen sei, räumte er ein," dass er das natürlich gewusst habe - aus der """"Zeit im Bild"""".Kurz aufhorchen ließ der derzeit eine Haftstrafe in einer anderen Causa in Haft absitzende Petrikovics auch mit der Aussage", dass er immer noch Immofinanz-Aktien halte. Die Aktie habe durch den Kauf der Bundeswohnungen enorm profitiert. Zum Zeitpunkt des Erwerbs habe er etwa 40.000 bis 50.000 Immofinanz-Aktien gehalten. Auf die Nachfrage des Staatsanwalts, wieviel genau er selber durch den Kauf der Bundeswohnungen verdient habe," gab Petrikovics keine Auskunft."""
"Trump für Friedensnobelpreis nominiert;""Bereits zum dritten Mal wurde US-Präsident Trump für den Preis vorgeschlagen. Neben ihm ist auch die regierungskritische russische Zeitung """"Nowaja Gaseta"""" nominiert.US-Präsident Donald Trump ist zum dritten Mal für den Friedensnobelpreis vorgeschlagen worden. """"Ich kann bestätigen"," dass Trump nominiert ist""""", sagte der Direktor des Osloer Friedensforschungsinstituts, Henrik Urdal," der Online-Zeitung """"Nettavisen"""". Wer ihn vorgeschlagen habe"," sei jedoch vertraulich.Ebenfalls auf der Liste steht nach Angaben der Nachrichtenagentur NTB die regierungskritische russische Zeitung """"Nowaja Gaseta"""". Er habe sie gemeinsam mit Menschenrechtsanwälten und -aktivisten nominiert", sagte ein Politiker der sozialistischen Linkspartei der Agentur. Es sei höchste Zeit, dass russische Aktivisten gewürdigt würden. Seit Ex-Staatschef Michail Gorbatschow 1990 hat kein Russe mehr den Friedensnobelpreis bekommen.Die Vorschlagsfrist für den diesjährigen Friedensnobelpreis war am Mittwoch abgelaufen. Endgültig steht die Liste allerdings noch nicht: Die fünf Mitglieder des Nobelkomitees können bis Ende Februar noch Nominierungen abgeben. Bisher bekannte Vorschläge sind laut NTB auch der Europäische Gerichtshof für Menschenrechte in Straßburg, Whistleblower Edward Snowden, das Flüchtlingshochkommissariat der Vereinten Nationen (UNHCR), der kongolesische Arzt Denis Mukwege und die kurdischen Peshmerga, die im Irak gegen den Islamischen Staat kämpfen.In Zeiten wie diesen ...wundert man sich nur mehr, was alles möglich ist ...Friedensnobelpreis für Kriegstreiber?Seit Hitler 1939 für den Friedensnobelpreis nominiert war und ihn Barack Obama 2009 sogar erhielt, frage ich mich, was mit diesem Preis wirklich bewertet wird.DaHat Netanjahu seinen Spezi vorgeschlagenFür eine Persönlichkeit wie Trumpwäre die Verleihung vielleicht das Nonplusultra? Damit hätte er vielleicht alles erreicht, was er sich als Präsident der USA vorgenommen hat und er kann beruhigt abdanken. Wenn dem so wäre: bitte gern! ;)Schön wär´s ja.Leider kann man von so einem machtbesessenen Egomanen nicht erwarten, dass er irgendwann irgendetwas zurückgibt. Schauen Sie sich nur seine bisherige Politik an.  Alles fast ausschließlich auf seinen eigenen Vorteil oder den Vorteil jener Leute ausgerichtet, von denen er weiss, dass sie ihn gewählt haben.So einer legt keine Ämter zurück. Nicht, wenn er auch nur irgendetwas dagegen unternehmen kann.Man müsste die amerikanische Bevölkerung für den Nobelpreis nominieren.Und zwar für die Tatsache," dass sie wunderbarerweise noch immer geschlossen einen kühlen Kopf bewahrt hat und ihn noch nicht - was in dieser Nation SEHR leicht möglich gewesen wäre - zum Präsidenten des nächstgelegenen Friedhofs gemacht hat.fassungslos....... Hr Nobel dreht sich im Grabe um 😔#dedamaroDu hast Herrn Nobel erwähnt. War da nicht irgendwas mit Dynamit? Wär' doch ein passendes Geschenk for Mr. President.Wer kann Personen für den Friedensnobelpreis nominieren:Antwort:""""Members of national assemblies and national governments (cabinet members/ministers) of sovereign states as well as current heads of states"""" Ich hab da schon eine gewisse Idee"," welcher """"head of state"""" Trump nominiert hat...War auch mein erster Gedanke...zuzutrauen wär´s dem stable genius auf jeden Fall. Eigentlich schade", dass das vertraulich behandelt wird. bleibt nur ein trump über, der sich da nominiert hat... Nicht unbedingtFalsch IsraelStopp: heute ist erst der 1. Februar........der 1. April kommt erst....das kann ja wohl nur ein schlechter Scherz sein???Der größte lebende Kriegstreiber und Waffenhänder der Welt ist für den Friedensnobelpreis nominiert?Welcher Volltrottel hat einen der größten derzeitigen Kriegstreibern für den Friedensnobelpreis vorgeschlagen????Wahrscheinlich IsraelRe: AcquarioDda bleibt im Ggrunde nur einer übrig, der das Motiv, die Möglichkeiten und vor allem die geistige Verfassung dafür hat. Einfach nur ekelhaft.Trump würde ihn nicht verdienen, Obama hat ihn unverdient.Trump für Friedensnobelpreis nominiertWos wor sein Leistung?Nobel - PreisträgerWann bekomm ich den Nobel - Preis für mein Lebenswerk ,als Allrounder dieser beschissenen Welt .Das ist ein Scherz,oder?Dieser Antidemokrat, diese lächerliche Witzfigur soll den Friedennobelpreis bekommen? Dann schlage ich bitte Jack the Ripper nachträglich vor!Obama hat ihn bekommen,obwohl er tausende Menschen töten ließ!Naja, Vilimsky hat ja darauf wohl keinenZugriff, ich wüßt zu gerne wer das war.Vielleicht das nächste Mal Idi Amin, posthum.TippeIsrael für JerusalemTrostpflasterWie wär’s, den Herrn Landbauer vorzuschlagen, als Trostpflaster für deinen Frieden stiftenden Rückzug aus allen politischen Funktionen? Dazu könnten sich auch noch die Herren Kickl, Hofer und strache gesellen,"  wegen ihrer permanenten Friedensbemühungen – im Zwietracht Fördern.Der Faschingsdienstag steht vor der TüreDie schaffen das noch Idi Amin posthum mit diesem Preis zu versehen."""
"Petrikovics verteidigt Geheimhaltung der Provision;""Die Rechnungen über Hocheggers Provision seien auf dessen Wunsch verschleiert worden"," erklärte Petrikovics. """"In Nachhinein ist man sicher klüger.""""Die Befragung des fünftangeklagten Ex-Immofinanz-Chefs Karl Petrikovics durch Richterin Marion Hohenecker hat sich heute wieder um die Abrechnung des Buwog-Honorars von Peter Hochegger gedreht. Petrikovics verteidigte die Geheimhaltung der Abrechnung", die mittels falscher Rechnungen an eine zypriotische Hochegger-Firma, die Astropolis, erfolgte. Hochegger habe dies so gewollt, meinte Petrikovics.Die Richterin hakte mehrmals nach: Wenn es sich bei der Beratung um eine normale Leistungserbringung handle, wie Petrikovics immer sage, warum seien die Rechnungen dann mit falschen Inhalten geschrieben worden? Weder Hochegger noch die Buwog seien in den Rechnungen erwähnt worden. Petrikovics meinte, das sei auf Wunsch Hocheggers so geschehen. Von ihm aus hätte man Buwog schon reinschreiben können, aber den Namen Hochegger nicht. Im Nachhinein sei man sicher klüger, räumte er ein. Auch in den Aufsichtsratsprotokollen der Immofinanz finde sich nirgends der Name Hochegger, so die Richterin.Petrikovics selber hatte im Bieterverfahren um die Bundeswohnungen Probleme," weil ihm ein Bruch der Vertraulichkeit vorgeworfen worden war. Er hatte laut eines Artikels in der """"Wiener Zeitung"""" vom 8. Mai 2004 gemeint", dass der Finanzminister für die rund 60.000 Wohnungen 1 Mrd. Euro bekomme, schließe er aus. Dies rief die begleitende Investmentbank Lehman Brothers auf den Plan, die einen Bruch der Vertraulichkeitsverpflichtung im geheimen Bieterverfahren rund um die Bundeswohnungen ortete und der Immofinanz mit dem Ausschluss aus dem Bieterverfahren drohte. Daraufhin musste Petrikovics eine eidesstattliche Erklärung unterschreiben, dass er das im Zeitungsbericht Geschriebene gar nicht gesagt habe. Der damalige Immofinanz-Chef stellte diesen Vorgang heute als eine reine Formsache dar," die ihn nicht beunruhigt habe.Richterin Hohenecker hielt Petrikovics dann seine Aussagen im parlamentarischen Untersuchungsausschuss vor. Petrikovics bezeichnete den U-Ausschuss als """"politische Bühne""""", die Abgeordneten hätten sich profilieren wollen. Oftmals seien sie schlecht vorbereitet gewesen, er habe den Eindruck gehabt," es ginge zeitweise nur um die """"Schlagzeile""""."""
"Bundestag beschließt Kompromiss zu Familiennachzug;""Der Nachzug für Angehörige von Flüchtlingen bleibt bis Mitte des Jahres ausgesetzt", ab August sollen 1000 Angehörige pro Monat nachziehen dürfen.Der Familiennachzug nach Deutschland für Angehörige von Flüchtlingen mit eingeschränktem Schutzstatus bleibt bis Mitte des Jahres ausgesetzt. Einen entsprechenden Kompromiss von Union und SPD zur Änderung des Aufenthaltsgesetzes verabschiedete der Bundestag am Donnerstag in Berlin.Von August an sollen dann pro Monat 1.000 Ehepartner, minderjährige Kinder und Eltern aus humanitären Gründen zu den subsidiär Schutzberechtigten nachziehen dürfen. Hinzu kommt eine bereits bestehende Härtefallregelung, auf deren Grundlage im Jahr 2017 aber weniger als 100 Visa vergeben worden sind. Für den Entwurf stimmten 376 Abgeordnete, mit Nein votierten 298, vier enthielten sich.Im Zuge der Koalitionsverhandlungen hatten sich Union und SPD in dieser Woche auf diesen Kompromiss verständigt. Eigentlich würde der vor zwei Jahren verhängte Stopp des Familiennachzugs für subsidiär geschützte Personen Mitte März auslaufen.Der Beschluss stellt eine Übergangsregelung dar. Innenminister Thomas de Maiziere sagte in der Debatte, das Nähere zum Familiennachzug werde in einem Folgegesetz geregelt," das bis Ende Juli fertig sein solle. Der gefundene Kompromiss stehe für """"Humanität und Verantwortung", für Integration und Begrenzung," für Großzügigkeit und Realismus"""". De Maiziere verteidigte das neue Gesetz gegen Kritik der Opposition. Es handle sich um eine Lösung", die die Debatte befriede.Linke und Grüne forderten eine Wiedereinführung des generellen Familiennachzuges," die AfD einen vollständigen Verzicht. Die FDP plädierte für eine weitere Aussetzung mit einer Härtefallregelung. Die Gesetzentwürfe der Opposition fanden aber keine Mehrheit."""
"Buwog-Prozess: Richterin löchert Petrikovics;""Richterin Hohenecker setzt die Befragung des derzeit inhaftieren Ex-Immofinanz-Chefs Karl Petrikovics fort. Danach können die Schöffen Fragen stellen.Richterin Marion Hohenecker hat den 14. Verhandlungstag im Buwog-Korruptionsprozess gegen Ex-Finanzminister Karl-Heinz Grasser (FPÖ/ÖVP) und weitere Angeklagte heute", Donnerstag, begonnen, wie sie ihn gestern beendet hat: Mit der Befragung des Fünftangeklagten, des ehemaligen Immofinanz-Chefs Karl Petrikovics, der derzeit eine sechsjährige Haftstrafe in einer anderen Untreue-Causa abbüßt.Nach Hohenecker sind die Schöffen mit ihren Fragen am Zug, so sie denn welche haben. Bisher haben die sechs Männer und eine Frau (zwei Hauptschöffen, fünf Ersatzschöffen) noch nicht in das Verfahren eingegriffen. Nach ihnen haben die beiden Oberstaatsanwälte und die Anwälte der Privatbeteiligen ihr Fragerecht, gefolgt von den Verteidigern.
ORF-Bericht vom BUWOG-Prozess




Geht sich diese Fragerunde heute noch aus, könnte Hohenecker mit der nächsten Befragung starten. Sie hat bereits angekündigt den ehemaligen Raiffeisen Landesbank Oberösterreich (RLB OÖ)-Vorstand Georg Starzer zu befragen, der von Petrikovics mehrfach belastet wurde.Vereinfacht gesagt wirft Petrikovics Starzer vor, er sei bei der Vereinbarung und Abwicklung der 9,6 Mio. Euro schweren Provision an den Lobbyisten Peter Hochegger voll mit dabei gewesen - was Starzer bestreitet. Die 9,6 Mio. Euro wurden von der Immofinanz an Hochegger als Provision gezahlt," laut Petrikovics wurde die Hälfte von der RLB OÖ geleistet und zwar """"verpackt"""" in den Verkauf von Anteilen an der Villacher Wohnbaugesellschaft ESG. Hochegger gab einen Teil des Geldes an den ehemaligen FPÖ-Spitzenpolitiker und Grasser-Trauzeugen Walter Meischberger weiter", der einen großen Teil des Geldes wiederum an Grasser und den Immobilienmakler Ernst Karl Plech weitergegeben haben soll - was Grasser," Meischberger und Plech bestreiten.Der heutige Verhandlungstag ist bis 17:30 Uhr anberaumt. Danach geht das Gericht für eine Woche in die """"Semesterferien""""."""
"""Dringende"" Warnung von Richtern und Staatsanwälten;""In einem """"dringenden Appell"""" warnen Richter und Staatsanwälte vor Kürzungen an den Gerichten. Die Belastungsgrenze sei """"bereits jetzt überschritten"""".Richter und Staatsanwälte befürchten finanzielle und personelle Kürzungen an den Gerichten - haben sie doch bisher keine Zusicherung erhalten", dass die Justiz von dem Vorhaben ausgenommen ist," nur mehr jede dritte Planstelle nachzubesetzen. Deshalb haben die Standesvertreter den Regierungsmitgliedern einen """"Dringenden Appell"""" geschickt"," die Gerichtsbarkeit nicht zum """"Flaschenhals"""" der Sicherheit zu machen.Anlass sind die laufenden Budgetverhandlungen - und die Tatsache", dass die Standesvertreter auch auf mehrfache Nachfragen weder von Justizminister Josef Moser (ÖVP) noch von anderen Regierungsvertretern das Bekenntnis bekommen haben, dass Richter und Staatsanwälte bzw. Rechtspfleger weiter vom Aufnahmestopp ausgenommen sind. Bisher waren sie nicht davon betroffen, dass nur jede zweite Planstelle nachbesetzt wurde.Betroffen war allerdings das nicht-richterliche Personal, also Kanzlei- und Schreibkräfte. In diesem Bereich gebe es deshalb schon Engpässe," der verschärfte Aufnahmestopp wäre """"die Katastrophe""""", sagte die Präsidentin der Richtervereinigung, Sabine Matejka," zur APA.Insgesamt sei in der Justiz """"durch personelle Einsparungen und unzureichende Mittel die Belastungsgrenze bereits jetzt überschritten"""""," konstatieren Matjeka und Justiz-Gewerkschafts-Vorsitzender Christian Haider in ihrem """"Appell"""" an die Regierung. Bei weiteren Kürzungen könne der jetzige Standard nicht aufrechterhalten werden"," sie würden """"unweigerlich zu längeren Verfahren und Qualitätseinbußen"""" führen - verwies Matejka darauf"," dass im Regierungsprogramm Justiz vielfach """"Verfahrensbeschleunigung"""" als Ziel genannt werde.Außerdem hat die schwarz-blaue Regierung """"mehr Sicherheit"""" als Motto ausgegeben - und stockt deshalb die Polizei auf. Kürzt man aber gleichzeitig bei den Richtern und Staatsanwälten"," """"wird die Gerichtsbarkeit zum Flaschenhals werden"""" und """"die sicherheitspolitischen Zielsetzungen verfehlt"""". Auch die am gestrigen Mittwoch von der Regierung beschlossene Antikorruptionsstrategie und das neue Erwachsenenschutzgesetz könnten ohne zusätzliche Mittel für die Justiz nicht umgesetzt werden.Aber es wurde doch die Diversion geschaffenund die ist ja auch möglich im Falle von Politiker- und Behördenvertretervergehen.Wie schlau.DAS entlastet die formelle Justiz doch gewaltig und sollte doch wohl Kapazitäten frei schaufeln für die Verfolgung von Schwarzfischern", Hendldieben, etca.Also was regen sich die Richter und Staatsanwälte auf.Die Politik schaut doch eh verständnisvoll auf sie.Jetzt schon katastrophal lange VerfahrensdauerDie ständig zunehmende Verrechtlichung in allen Lebensbereichen führt zu einer enormen Vervielfachung der Verfahren. Nur mehr wenige Streitfragen werden außergerichtlich erledigt und jeder Furz wir durch jegliche Instanzen geblasen. Schon jetzt trifft man fast nur noch auf gereiztes Justizpersonal. Entweder man schraubt die Ansprüche an die Justiz herunter oder man stellt genügend Personal ein," damit auch jede Bagatellinjurie hinreichen lange behandelt werden kann."""
