title;text

Der Grünen-Europapolitiker Sven Giegold schrieb auf Twitter über Donohoes Wahl: „Ein schlechtes Signal für den Kampf gegen Steuerdumping: Ein Steueroasenbetreiber wird Eurogruppenchef. Jeder verdient eine Chance," aber er steht unter besonderer Beobachtung.“ Irland hatte mit sehr günstigen Steuersätzen in den vergangenen Jahren unter anderen große US-Techkonzerne angelockt."""
Der mächtigste Player im globalen Kampf um den Impfstoff;Derzeit sind weltweit mehr als 155 Covid-Impfstoffe in Entwicklung, 23 davon werden an Menschen getestet. In Russland werden Fortschritte bei der Impfstoffentwicklung im staatlichen Fernsehen gezeigt. Es sollen bereits zwei Testrunden an Soldaten stattgefunden haben. Auch in China soll Ende Juni ein eigener Impfstoff für das Militär zugelassen worden sein. Doch der wahre mächtige Player ist ein anderer: Indien. Denn wer auch immer den Impfstoff findet – um ihn kosteneffizient zu produzieren, führt kein Weg an Indien vorbei.
Viele Anwohner haben genug von Touristen und Ausflüglern;
Dutzende Bundespolizisten wegen schwerwiegender Verstöße vom Dienst suspendiert;
Trennung zwischen Arbeit und Privatem fehlt oft im Homeoffice;
Darum kann auch ein Mückenstich gefährlich werden;
"Repetiergewehre vernichteten die konföderierte Kavallerie;""Anzeige"

Der Amerikanische Bürgerkrieg wird oft als erster totaler Krieg des Maschinenzeitalters bezeichnet. Das gilt nicht nur für die Mobilisierung von mehr als zwei Millionen Soldaten (und zahllosen Zivilisten), sondern auch für die eingesetzte Technik. Mörser, Kanonen und Schnellfeuergeschütze aus Stahl und mit gezogenem Lauf, Minen, Ballone, Dampf- und Panzerkreuzer kamen zum Einsatz, vom Norden in Massen, vom Süden oft nur in wenigen Exemplaren hergestellt oder erbeutet.

Szenen der totalen Zerstörung 1 von 13 Von Charleston (South Carolina) hatte die Sezession des Südens 1860 ihren Ausgang genommen. Fünf Jahre später war die Stadt ein Trümmermeer. Quelle: Archiv 2 von 13 Ulysses S. Grant (1822-1885), entwickelte beim Kampf um die Mississippi-Festung Vicksburg 1863 das Konzept des totalen Krieges. Quelle: Getty Images 3 von 13 Sein wichtigster Mitarbeiter wurde William T. Sherman (1820-1891)," der Georgia und North und South Carolina verwüstete. Quelle: AP/DAPD 4 von 13 Shermans Soldaten perfektionierten die Strategie der verbrannten Erde. Quelle: Archiv 5 von 13 """"Wir bekämpfen nicht nur feindliche Armeen"," sondern auch eine feindliche Bevölkerung""""", begründete Sherman die Vernichtung Atlantas. Quelle: Archiv 6 von 13 Auch Columbia, die Hauptstadt South Carolinas, sollte dieses Schicksal erleiden. Quelle: Archiv 7 von 13 Währenddessen legte Grant bei der Belagerung von Petersburg Schützengräben an, die das Grauen des Ersten Weltkriegs vorwegnahmen. Quelle: Archiv 8 von 13 Phil Sheridan (1831-1888) zog derart durch das Shenandoah-Tal," dass ein """"Vogel", der darüber fliegt," seinen Proviant mitnehmen muss"""". Quelle: picture alliance / united archiv/united archives / WHA 9 von 13 Die konföderierte Hauptstadt Richmond fiel am 2. April 1865 in die Hände der Unions-Armee Quelle: Archiv 10 von 13 Die Konföderierten versuchten", die Stadt anzuzünden – hier die Ruinen der Haxall-Mühlen. Quelle: picture-alliance / akg-images/akg 11 von 13 Auch die Gegend um das Arsenal erinnert an Bilder des Bombenkriegs 1945. Quelle: picture-alliance //Newscom 12 von 13 Der Süden war vollständig ruiniert und sollte in weiten Teilen erst ... Quelle: picture-alliance //Newscom 13 von 13 ... in der Konjunktur des Zweiten Weltkriegs zum Norden aufschließen. Quelle: picture-alliance //Newscom

Umso erstaunlicher ist die Tatsache, dass sich die Infanterie beider Seiten vor allem mit einschüssigen Vorderladergewehren bekämpfte. Dabei waren mehrschüssige Hinterlader längst erfunden. Mit ihrer überlegenen Feuerkraft brach die Kavallerie der Union am 11. Mai 1864 bei Yellow Tavern in Virginia endgültig die Überlegenheit ihrer konföderierten Gegner.

Bei Kriegsausbruch 1861 war die Reiterei die Waffengattung gewesen, mit der die Konföderation die Union um Klassen übertraf, in der Quantität nicht unbedingt, wohl aber in der Qualität. Ihre auf den Plantagen und Ranchen des Südens aufgewachsenen Soldaten wussten sich auf dem Rücken der Pferde ganz anders zu bewegen als die Nordstaatler, die aus Städten oder von kleinen Farmen in die Rekrutierungsbüros drängten. Und was für die Reiter galt, galt mehr noch für die Pferde.

James Ewell Brown „Jeb“ Stuart (1833-1864) führte die Kavallerie der konföderierten Nord-Virginia-Armee Quelle: Getty Images

Anzeige

Zudem verfügte der Süden über militärische Führer, die dieses Potenzial innovativ einsetzten. Nathan Bedford Forrest, ein wohlhabender Plantagenbesitzer aus Tennessee, entwickelte die Taktik des schnellen Raids zur Perfektion. Unvermutet tauchten seine Leute tief im Hinterland der Union auf, wobei sie ihre Reittiere vor allem zum schnellen Vormarsch gebrauchten, vor Ort aber zu Fuß kämpften. Immer wieder gelang es Forrest, den Nachschub der Union empfindlich zu stören.

Vom gleichen Kaliber war James Ewell Brown „Jeb“ Stuart. Als Absolvent der Militärakademie von West Point war er zur Kavallerie gegangen und hatte 1861 sein Hauptmannspatent zurückgegeben, nachdem sein Heimatstaat Virginia aus der Union ausgetreten war. Schnell stieg er in der konföderierten Armee zum Divisionskommandeur und General der Reiterei unter Robert E. Lee auf, der mit der Nord-Virginia-Armee die wichtigste Feldtruppe des Südens kommandierte. Mehrmals hatte Stuart die Reiterei des Nordens düpiert, indem er Nachschubdepots und -züge zerstörte und die Bewegungen von Lees Soldaten geschickt verschleierte.

Blaue und graue Generäle 1 von 19 US-Präsident Abraham Lincoln (mit Zylinder mit George B. McClellan ) zog als militärischer Laie zahlreiche Nieten. Quelle: picture alliance / Everett Colle/Everett Collection 2 von 19 Ulysses S. Grant (1822-1885) wurde 1864 zum Oberkommandierenden aller Unionstruppen ernannt. Seine Strategie führte den Norden zum Sieg. Quelle: picture alliance / Everett Colle/Everett Collection 3 von 19 William Tecumseh Sherman (1820-1891) eroberte mit drei Armeen Atlanta und perfektionierte die Strategie der verbrannten Erde. Quelle: picture alliance / Everett Colle/Everett Collection 4 von 19 Philip Sheridan (1831-1888) führte die Kavallerie der Potomac-Armee auf dem östlichen Kriegsschauplatz. Quelle: picture alliance / united archiv/united archives / WHA 5 von 19 George B. McClellan (1826-1885; r. mit Abraham Lincoln) war ein glänzender Organisator, aber ein furchtsamer Feldherr. Quelle: picture alliance / Everett Colle/Everett Collection 6 von 19 Das Hauptquartier von Joseph Hooker (1814-1879) war ein Ort, von dem sich ein sittsamer Mann tunlichst fernhielt. Quelle: picture-alliance //Newscom 7 von 19 Auch Ambrose Everett Burnside (1824-1881) erwies sich dem Südstaatler Robert E. Lee als klar unterlegen. Quelle: picture-alliance / newscom / Pi/Newscom 8 von 19 George Gordon Meade (1815-1872) schlug Lee im Juli 1863 bei Gettysburg und brach damit die Offensivkraft des Südens. Quelle: picture-alliance / newscom / Pi/Newscom 9 von 19 Konteradmiral David Farragut (1801-1870) eroberte 1862 New Orleans und blockierte die Mississippi-Mündung. Quelle: picture-alliance / imagestate/HI/The Print Collector / Heritage-I 10 von 19 George Armstrong Custer (1839-1876) führte eine Kavallerie-Division unter Sheridan und fiel später am Little Big Horn gegen die Sioux. Quelle: picture-alliance / newscom / Pi/Newscom 11 von 19 Der konföderierte Präsident Jefferson Davis (1808-1889) brachte als ehemaliger Kriegsminister militärische Erfahrung mit. Quelle: picture-alliance / (c) Illustrat/Mary Evans Picture Library 12 von 19 Robert E. Lee (1807-1870), Kommandeur der Nord-Virginia-Armee," galt und gilt im Norden und Süden als bester Stratege. Quelle: picture alliance / landov/MCT 13 von 19 Thomas """"Stonewall"""" Jackson (1824-1863) bewegte seine Infanteristen schneller"," als die Yankees reiten konnten. Quelle: picture alliance / Everett Colle/Everett Collection 14 von 19 James Longstreet (1821-1904) galt als Lees """"Arbeitspferd"""". Quelle: picture-alliance / (c) Illustrat/Mary Evans Picture Library 15 von 19 George Edward Pickett (1825-1875)", einer von Longstreets Divisionskommandeuren," führte den gescheiterten Angriff bei Gettysburg. Quelle: picture-alliance / newscom / Pi/Newscom 16 von 19 James Ewell """"Jeb"""" Stuart (1833-1864) kommandierte Lees Kavallerie und fiel gegen Sheridan. Quelle: picture-alliance / akg-images/akg 17 von 19 Braxton Bragg (1817-1876) führte Armeen auf dem westlichen Kriegsschauplatz", konnte sich aber nicht gegen Grant halten. Quelle: picture-alliance / newscom / Pi/Newscom 18 von 19 Nathan Bedford Forrest (1821-1877) führte mit unorthodoxen Methoden spektakuläre Kavallerie-Raids hinter die Linien der Union. Quelle: Wikipedia/Public Domain 19 von 19 Am 9. April 1865 verhandelten Grant und Lee im Haus von Wilmer McLean die Kapitulation der Nord-Virginia-Armee. Quelle: picture alliance / Everett Colle/Everett Collection

Mit den kniehohen Kavalleriestiefeln, den Stulpenhandschuhen, die bis zum Ellbogen reichten, einem rot gesäumten Cape mit gelber Schärpe und einem Filzhut mit hochgesteckter Krempe und Straußenfedern wirkte Jeb Stuart haargenau wie der schneidige Kavalier, der er sein wollte, schreibt der amerikanische Bürgerkriegsspezialist James M. McPherson. Zugleich war er ein exzellenter Aufklärer, der maßgeblich zu den Erfolgen Lees in den ersten Kriegsjahren beitrug. Was seine Abwesenheit bedeutete, zeigte sich im Juli 1863 bei Gettysburg, als Stuart fern von Lees Armee operierte und diese ohne Vorstellung von der Aufstellung des Gegners angriff und schwer geschlagen wurde.

Anzeige

Im Frühjahr 1864 plante der zum Oberkommandierenden aller Unionstruppen beförderte Ulysses S. Grant die entscheidende Offensive gegen den Süden. Das Ziel war die konföderierte Hauptstadt Richmond in Virginia. Am 5. Mai überquerte die blaue Potomac-Armee mit mehr als 100.000 Mann den Grenzfluss Rapidan. In der Wilderness, einem Urwald westlich von Fredericksburg, und bei Spotsylvania kam es zu schweren Gefechten. Trotz großer Verluste verzichtete Grant auf einen Rückzug, sondern gab stattdessen seinem Reitergeneral Philip Sheridan den Befehl zu einem weiträumigen Vorstoß, um Lee aus seinen Stellungen zu locken.

"Philip """"Little Phil"""" Sheridan (1831-1888) stieg später zum Oberkommandierenden der US Army auf Quelle: picture-alliance / newscom / Pi"

„Little Phil“ Sheridan hatte 1853, ein Jahr vor Stuart, West Point absolviert, war aber zunächst zur Infanterie gegangen. Seine Umsicht und seine Aggressivität hatten ihn schnell vom Quartiermeister zum Divisionskommandeur auf dem westlichen Kriegsschauplatz (Mississippital) gemacht, wo ihn Grant zum Chef seiner Reiterei beförderte. Als der 1864 an die Ostfront wechselte, übertrug er Sheridan das Kommando über das Kavalleriekorps der Potomac-Armee.

Während sich Grant und Lee im Norden Virginias belauerten, startete Sheridan seinen Vorstoß nach Süden. Im Gegensatz zu Stuart reichte dem 1,64 Meter großen General ein eigenwilliger Hut als Ausweis kavalleristischer Exzentrik. Stattdessen setzte er auf die Möglichkeiten der nordstaatlichen Rüstungsindustrie, die inzwischen Repetiergewehre in großer Zahl produzieren konnte.

Spencer-Karabiner Modell 1865 mit Kaliber .50 inch (1,27 Zentimeter) Quelle: Wikipedia/Public Domain

Anzeige

Die wichtigsten Typen waren der Spencer-Karabiner und das Henry-Rifle. Mit 15 Patronen war dessen Schussfolge dem Spencer-Gewehr deutlich überlegen. Dieses jedoch punktete mit einem geringeren Gewicht, einer stärkeren Durchschlagskraft und einer robusteren Mechanik. Ab 1863 wurden die Kavallerieeinheiten der Union mit der Waffe ausgerüstet, während der Süden bis zum Ende des Krieges nicht in der Lage war, überhaupt entsprechende Patronen zu produzieren.

Sheridan und seine 10.000 Reiter gaben sich nicht die Mühe, ihren Vormarsch geheim zu halten. Sein Plan war es, Stuarts Kavallerie zum Angriff zu provozieren und damit vor seine Spencer-Mehrschüsser zu locken. Die blaue Reitertruppe, die größte, die bis dahin eingesetzt worden war, erstreckte sich auf dem Marsch über ein Dutzend Meilen. Am 9. Mai erreichte sie die konföderierte Nachschubbasis Beaver Dam, wo Sheridans Leute umgehend darangingen, Gleise und Proviant für mehrere Wochen zu zerstören. Zudem wurden einige Hundert gefangene Unionssoldaten befreit.

Mit 4500 Mann setzte Stuart Sheridan nach und konnte sich zwischen ihn und Richmond schieben. Am 11. Mai trafen die beiden Armeen schließlich bei Yellow Tavern, nur gut zehn Kilometer nördlich der konföderierten Hauptstadt, aufeinander. Wie es inzwischen üblich geworden war, saßen die Reiter ab und kämpften zu Fuß. Drei Stunden lang hielten die Südstaatler dem übermächtigen Feuer der Unionstruppen stand.

Um ihre Linien nicht dem Geschosshagel auszusetzen, verwickelten die Südstaatler ihre Gegner in Gefechte auf engstem Raum. Dabei gelang es einem Unionssoldaten, sich Stuart auf Pistolenschussweite zu nähern. Der General mit der Feder am Hut brach zusammen, am Tag darauf erlag er seinen Verwundungen. Mit ihm verlor der Süden einen seiner größten Kriegshelden.

Lesen Sie auch Sezessionskrieg Als die Demokratie den totalen Krieg erfand

Bei Yellow Tavern hatte Sheridan gezeigt, dass das Konzept des Maschinenkrieges auch auf die Kavallerie übertragen werden konnte, die bis dahin noch die Aura der Ritterlichkeit umgab. Nachdem er das Hinterland Virginias erfolgreich verwüstet hatte, erhielt er von Grant das Kommando über die neu geschaffene Shenandoah-Armee mit dem Auftrag, das gleichnamige Tal zu einer Wüste zu machen, während die Potomac-Armee vor Richmond einen Stellungskrieg führte, der das Grauen des Ersten Weltkriegs vorwegnahm.

Europas Militärs erkannten allerdings nicht, dass diese Form der Kriegsführung auch ihnen bald bevorstehen würde.

Stuarts Grab bei Yellow Tavern Quelle: picture-alliance / newscom / Pi

Sie finden „Weltgeschichte“ auch auf Facebook. Wir freuen uns über ein Like.

Anzeige

"Dieser Artikel wurde erstmals im Mai2019 veröffentlicht."""
AfD attackiert Hamburgs Verfassungsschutzchef;
Jetzt begibt sich Gauland ins Fahrwasser des Höcke-Lagers;
"Tausende Gläubige strömen zum Gebet an die Hagia Sophia;""Anzeige"

In der Hagia Sophia in Istanbul ist am Freitag das erste muslimische Gebet seit der Umwandlung des Wahrzeichens in eine Moschee abgehalten worden. Rund 1000 Gläubige nahmen im Gebäude an der Zeremonie im Beisein des türkischen Präsidenten Recep Tayyip Erdogan teil. Der Staatschef hatte die Umwandlung der früheren byzantinischen Kathedrale in eine Moschee am 10. Juli angeordnet, nachdem das Oberste Verwaltungsgericht der Türkei zuvor den jahrzehntelang geltenden Museumstatus des Gebäudes aufgehoben hatte.

Vor dem historischen Kuppelbau versammelten sich Tausende Gläubige, einige hatten bereits die Nacht vor der Moschee verbracht. Wegen der Corona-Pandemie durften nicht mehr als 1000 Gläubige die Moschee betreten. Die ersten Gläubigen wurden ab 10 Uhr türkischer Zeit in das historische Bauwerk gelassen.

Vor Beginn des Gebetes sammeln sich Menschen vor der Moschee Quelle: Getty Images/Burak Kara

Präsident Erdogan saß bereits vor Beginn des eigentlichen Gebets in der Hagia Sophia und hörte der Predigt des Imams zu, wie Aufnahmen der staatlichen Nachrichtenagentur Anadolu zeigten. Der islamisch-konservative Präsident trug zwischenzeitlich eine Atemschutzmaske und befand sich in Begleitung einiger hoher Beamter.

Lesen Sie auch Cihangir Islam zu Hagia Sophia „Das wird kein Gebet, das wird eine politische Demonstration“

Anzeige

Das Oberhaupt der Kirche Griechenlands sprach anlässlich des ersten muslimischen Gebets seit 1934 in dem Bauwerk von einem Trauertag. „Heute ist ein Tag der Trauer für das gesamte Christentum“, sagte Erzbischof Hieronymos. Er bezeichnete die Umwandlung der Hagia Sophia in eine Moschee als einen „unheiligen Akt der Schändung“.

Die Hagia Sophia wurde 1934 zum Museum erklärt Quelle: Getty Images/Burak Kara

Die Hagia Sophia wurde im 6. Jahrhundert zunächst als Basilika errichtet und war über Jahrhunderte die Hauptkirche des Byzantinischen Reiches und eine der wichtigsten Kirchen der Christenheit. Nach der Eroberung Konstantinopels durch die Osmanen 1453 wurde sie in eine Moschee umgewandelt.

Nach der türkischen Republikgründung wurde sie 1934 zum Museum erklärt. Die Umrüstung in ein Museum war eine zentrale Reform der modernen Republik unter der Führung des säkularen Staatsgründers Mustafa Kemal Atatürk. Erdogans Entscheidung, den Kuppelbau wieder für muslimische Gebete zu öffnen," sorgte international für Kritik."""
„Besser Geisterwettkämpfe als gar keine“;Dressurreiterin Isabelle Werth hat sechs olympische Goldmedaillen gewonnen, Speerwerfer Thomas Röhler hat 2016 in Rio gesiegt, und Ringer Frank Stäbler ist dreifacher Weltmeister. Sie hatten den Traum von Olympia 2020 in Tokio. So gehen die drei mit der Verschiebung der Spiele um.
Gekündigt – So finden Sie heraus," ob sich eine Klage lohnt;""Anzeige"

Der deutsche Kündigungsschutz ist bekannt für seine Arbeitnehmerfreundlichkeit. Wer eine unbefristete Festanstellung hat, kann sich in Sicherheit wähnen, so die Annahme – sofern er sich nichts zuschulden kommen lässt. Doch ganz so ist es in der Realität nicht. Insbesondere bei wirtschaftlicher Schieflage eines Unternehmens ist eine Kündigung durchaus möglich.

Die Rechtsanwaltsgesellschaft Ratis und das Tech-Unternehmen One Logic haben 785 Kündigungsfälle von Arbeitnehmern mit Rechtsschutzversicherung im vergangenen Jahr ausgewertet. Mit dem Ergebnis: 68 Prozent der Kündigungen waren betriebsbedingt. Bei einem knappen Viertel ging es um die Person, bei neun Prozent um das Verhalten des Mitarbeiters.

„Die Gründe für Kündigungen können vielfältig sein, aber längst nicht alle sind zulässig“, erklärt Fenimore von Bredow, Fachanwalt für Arbeitsrecht in Köln. Bestehen Zweifel an der Wirksamkeit der Kündigung, können Arbeitnehmer eine Kündigungsschutzklage beim zuständigen Arbeitsgericht einreichen. Zwingend erforderlich ist ein Anwalt dafür nicht.

An dieser Stelle finden Sie Inhalte von Drittanbietern Um mit Inhalten von Drittanbietern zu interagieren oder diese darzustellen, brauchen wir Ihre Zustimmung. Externe Inhalte aktivieren

Anzeige

