title;text

Die Reproduktionszahl, kurz R-Wert, lag nach RKI-Schätzungen in Deutschland laut Lagebericht vom Mittwoch bei 1,04 (Vortag: 1,18). Das bedeutet, dass ein Infizierter im Mittel etwa einen weiteren Menschen ansteckt. Der R-Wert bildet jeweils das Infektionsgeschehen etwa eineinhalb Wochen zuvor ab.

Anzeige

Zudem gibt das RKI in seinem aktuellen Lagebericht ein sogenanntes Sieben-Tage-R an. Der Wert bezieht sich auf einen längeren Zeitraum und unterliegt daher weniger tagesaktuellen Schwankungen. Nach RKI-Schätzungen lag dieser Wert bei 1,16 (Vortag: 1,20). Er zeigt das Infektionsgeschehen von vor acht bis 16 Tagen.

An dieser Stelle finden Sie Inhalte von Drittanbietern Um mit Inhalten von Drittanbietern zu interagieren oder diese darzustellen, brauchen wir Ihre Zustimmung. Externe Inhalte aktivieren

Weltweit gibt es laut der Johns-Hopkins-Universität mindestens 38.510.263 mit Covid-19 infizierte Personen (Stand 15.10., 8 Uhr). Davon sind 1.092.144 Menschen am Virus gestorben.

Mehr als 900.000 Infektionen in Spanien

Spanien hat als erstes Land der Europäischen Union die Marke von 900.000 Coronavirus-Infektionen überschritten. Seit Beginn der Pandemie seien mehr als 908.000 Infektionen registriert worden, teilte das spanische Gesundheitsministerium mit. Spanien hat knapp 45 Millionen Einwohner. Offiziellen Angaben zufolge wurden mehr als 33.000 Todesfälle in Zusammenhang mit dem Virus registriert. Gesundheitsexperten glauben, dass die tatsächliche Zahl deutlich höher liegt, jedoch nicht ausreichend getestet wird.

An dieser Stelle finden Sie Inhalte von Drittanbietern Um mit Inhalten von Drittanbietern zu interagieren oder diese darzustellen, brauchen wir Ihre Zustimmung. Externe Inhalte aktivieren

Anzeige

In Großbritannien mit 66,6 Millionen Einwohnern haben sich innerhalb von 24 Stunden nachweislich knapp 20.000 Menschen mit dem Coronavirus angesteckt. Das entspricht einem Anstieg von etwa 2500 im Vergleich zum Vortag. 137 Menschen sind an einer Covid-19-Erkrankung gestorben, wie die Gesundheitsbehörden am Mittwoch mitteilten. Besonders stark betroffen von der Pandemie sind der Norden Englands, Nordirland, Schottland und Teile von Wales. Die tatsächliche Zahl der Neuinfektionen dürfte aber noch höher liegen, da nicht genügend Tests zur Verfügung stehen. Der britische Gesundheitsminister Matt Hancock rief für London die zweithöchste Corona-Warnstufe aus. Er begründete dies am Donnerstag im Unterhaus mit rasch steigenden Infektionsraten in der Hauptstadt. Schnelles Handeln sei erforderlich, um das Virus unter Kontrolle zu bekommen, sagte er.

Angesichts rapide steigender Infektionszahlen dürfen sich Angehörige verschiedener Haushalte demnach in Innenräumen nicht mehr treffen, wie der Londoner Bürgermeister Sadiq Khan am Donnerstag bekannt gab. Auch Treffen in Pubs oder Restaurants sind nicht erlaubt, während sie in Grünanlagen gestattet bleiben. Schulen und der Einzelhandel bleiben geöffnet.

Millionen Bewohner Nordenglands warten darauf, zu erfahren, ob sie unter die strengsten Corona-Regeln fallen. Für Liverpool wurden diese bereits angeordnet. Seit dieser Woche gibt es in Großbritannien ein dreistufiges Corona-Warnsystem.

An dieser Stelle finden Sie Inhalte von Drittanbietern Um mit Inhalten von Drittanbietern zu interagieren oder diese darzustellen, brauchen wir Ihre Zustimmung. Externe Inhalte aktivieren

Die Zahl der registrierten Neuinfektionen binnen 24 Stunden stieg am Mittwoch in Portugal mit 10,3 Millionen Einwohnern auf 2072 – das war der höchste Wert seit Beginn der Pandemie. Die Gesamtzahl der Fälle kletterte den amtlichen Angaben zufolge auf mehr als 91.000. Die Zahl der Menschen, die an Covid-19 starben, stieg um sieben auf 2117. Besonders betroffen sind der Norden und der Großraum Lissabon. Sorge bereitet vor allem die Tatsache, dass die Zahl der in Krankenhäusern behandelten Covid-19-Patienten in etwas mehr als einem Monat von gut 300 auf nun fast 1000 in die Höhe schoss.

Frankreichs Corona-Karte färbt sich immer tiefer rot

In Frankreich mit seinen knapp 67 Millionen Einwohnern haben die Gesundheitsbehörden 22.591 Neuinfektionen binnen 24 Stunden registriert. Es ist das dritte Mal in sechs Tagen, dass das Gesundheitsministerium einen Wert über 20.000 mitteilt. Insgesamt seien 779.063 Infektionsfälle verzeichnet worden. Die Zahl der Todesfälle in Kranken- und Pflegeheimen sei um 104 auf 33.037 gestiegen. Damit ist Frankreich weltweit das neunte Land weltweit, das mehr als 33.000 Todesfälle in Zusammenhang mit dem Coronavirus zu beklagen hat.

Zwar sank die Zahl der Neuinfektionen seit vergangenem Wochenende, wo zuletzt ein Rekordhoch von knapp 27.000 am Samstag verzeichnet wurde. Dennoch steigen die Infektionszahlen gegenüber der vergangenen Woche massiv. Die Karte des französischen Gesundheitsministeriums, auf der die Corona-Hotspots in Scharlachrot (auf Französisch „rouge écarlate“) markiert werden, färbt sich deshalb immer tiefer rot.

An dieser Stelle finden Sie Inhalte von Drittanbietern Um mit Inhalten von Drittanbietern zu interagieren oder diese darzustellen, brauchen wir Ihre Zustimmung. Externe Inhalte aktivieren

Dazu gehören mit der Hauptstadt Paris inzwischen neun Ballungsräume und ein Überseegebiet. Der Großraum Marseille, zu dem auch Aix-en-Provence zählt, ist ebenso betroffen wie die Großstädte Lyon, Grenoble, Saint-Etienne, Lille, Toulouse und Montpellier. Dazu gehört auch die Inselgruppe Guadeloupe in der Karibik.

Anzeige

In Bulgarien mit seinen sieben Millionen Einwohnern liegt die Zahl der neuen Positiv-Tests das vierte Mal binnen einer Woche auf Rekordniveau. Die Zahl der Fälle steigt nach offiziellen Daten um 785 auf insgesamt 25.774. Bislang starben 923 Menschen, die positiv auf das Coronavirus getestet wurden. Aktuell befinden sich 1307 Menschen in Krankenhäusern, 63 davon auf Intensivstationen.

In Tschechien meldet das Gesundheitsministerium 8325 neue Positiv-Tests. Das ist der bislang zweithöchste Wert in dem Land mit 10,7 Millionen Einwohnern, die meisten neuen Fälle gab es am vergangenen Freitag. Die Gesamtzahl der Fälle in Tschechien liegt inzwischen bei 129.747. Bislang starben 1106 Menschen, die positiv getestet wurden. Zu Monatsbeginn waren es noch 696 Todesfälle.

Rekorde in Polen und Kroatien

In Polen überschritt die Zahl der täglichen Neuinfektionen mit dem Coronavirus erstmals die Marke von 6000. Innerhalb von 24 Stunden kamen 6526 neue Fälle hinzu, die meisten davon in der Region um die Hauptstadt Warschau (1188). Das teilte das polnische Gesundheitsministerium am Mittwoch mit. Im gleichen Zeitraum starben 116 Menschen in Zusammenhang mit dem Virus. Seit Beginn der Pandemie gab es in Polen 3217 Todesfälle in Verbindung mit einer Covid-19-Erkrankung. Das Land hat rund 38 Millionen Einwohner. Polen ist das einzige Nachbarland Deutschlands, das bisher vom Auswärtigen Amt in Berlin noch nicht ganz oder teilweise als Risikogebiet eingestuft wurde.

Im EU-Land Kroatien verzeichneten die Behörden am Mittwoch einen Rekordwert an neuen Infektionen mit dem Coronavirus. In den vergangenen 24 Stunden sei bei 748 Menschen Sars-CoV-2 nachgewiesen worden, teilte der Krisenstab der kroatischen Regierung mit. Die bisher höchste Zahl von 542 Neuinfizierten hatte der Krisenstab am 8. Oktober registriert. Vier Menschen starben demnach in den letzte 24 Stunden in Verbindung mit einer Covid-19-Erkrankung. Seit Beginn der Pandemie im Februar haben sich in dem 4,2-Millionen-Einwohner-Land nachweislich 21.741 Menschen mit dem Coronavirus angesteckt. 334 Patienten starben mit dem Virus. Am Mittwoch wurden 441 Patienten im Krankenhaus behandelt, 27 von ihnen wurden künstlich beatmet.

Russland mit seinen 144,5 Millionen Einwohnern meldet einen Rekord an Neuinfektionen. Binnen der letzten 24 Stunden gibt es 14.231 weitere Coronavirus-Fälle. Die Gesamtzahl der Infektionen steigt damit auf 1,34 Millionen. Weitere 239 Menschen starben, wodurch sich die Zahl der Todesfälle auf 23.205 erhöht.

In Brasilien mit seinen 209,5 Millionen Einwohnern sterben nach Angaben des Gesundheitsministeriums 749 Menschen nach einer Infektion mit dem Coronavirus. In den vergangenen 24 Stunden sei die Zahl der positiv Getesteten um 27.235 auf 5.140.863 gestiegen. Insgesamt sind 151.747 Menschen an den Folgen der Ansteckung gestorben.

In Südkorea sind 110 neue Infektionen mit dem Coronavirus registriert worden. Die Hälfte der Fälle stehe in Verbindung mit einem Krankenhaus in der Stadt Busan, teilte die südkoreanische Behörde für Krankheitskontrolle und -prävention am Donnerstag mit. In dem Land mit gut 51 Millionen Einwohner liegt die offizielle Zahl der Fälle damit bei fast 25.000.

Mindestens 54 der Neuinfektionen stünden mit dem Krankenhaus für Ältere in Verbindung. Mehr als 40 seien in der dicht bevölkerten Metropolregion Seoul verzeichnet worden, mit Verbindungen zu Krankenhäusern, Kirchen, Schule und Büros.

Anzeige

Alle aktuellen und weltweiten Entwicklungen zum Coronavirus können Sie in unserem Live-Ticker verfolgen.

"Haben Sie Fragen zum Coronavirus? Hier finden Sie die wichtigsten Fakten und Informationen."""
"Sieben Tage ohne Google – ein waghalsiger Selbstversuch;""Anzeige"

Das Abschlusszeugnis – weg. Das Fotoalbum aus der Sächsischen Schweiz – weg. Das Album meiner Lieblingsband – weg. Es ist ein seltsames Gefühl, als immer mehr der Tausenden Dateien auf meinem Rechner verschwinden. Nach ein paar Minuten ist mein Computer leer gefegt. Mit wenigen Klicks habe ich ihn von meiner digitalen Lebenswelt abgenabelt.

Ein großer Teil dieser digitalen Lebenswelt gehört Google – genauer gesagt Google Drive, der virtuellen Festplatte des US-amerikanischen Konzerns. Dort habe ich über 800 Gigabyte Daten abgespeichert. Jede Datei, die ich auf meinem Laptop verändere, landet binnen Sekunden bei Google.

Quelle: Infografik WELT

Das ist praktisch, denn auf meinen Rechner würden sie alle nicht passen, und ich kann von überall darauf zugreifen. Doch jetzt, wo ich eine Woche auf alle Produkte, Dienste und Angebote von Google verzichten will, heißt es eben: Ich bin vor allem datenlos.

Anzeige

Wer im Internet unterwegs ist, kennt Google vor allem als die Suchmaschine. Auf Computern und Laptops lag der Marktanteil zuletzt weltweit bei 75 Prozent, auf Handys sogar 89. Die restlichen Anteile teilen sich der Microsoft-Dienst Bing und Yahoo. Wirkliche Konkurrenten gibt es nicht.

22. Geburtstag von Google

Nun feiert Google seinen 22. Geburtstag mit einem Doodle. Man kann wohl nur sagen: Glückwunsch. Und man muss feststellen: Google ist eine Macht.

Aber hinter Google steckt noch viel mehr. Der Browser Google Chrome, der Kartendienst Google Maps, den auch ich für Routenplanungen verwende, und einen Teil meiner E-Mails verwalte ich über Google Mail. In meiner Wohnung spielt ein mit dem Internet verbundener Google-Lautsprecher Musik: Seit 2006 gehört auch die Videoplattform YouTube zu Google, 1,9 Milliarden Menschen schauen dort jeden Monat Videos.

Anzeige

Im Oktober 2015 wurde das 1998 gegründete Universum restrukturiert, seitdem ist die börsennotierte US-Holding Alphabet Inc. die Muttergesellschaft dieser Firmensammlung. Der Umsatz des Unternehmens steigt – von rund 55 Milliarden US-Dollar im Jahr 2013 auf über 136 Milliarden im vergangenen Jahr. Mit 309 Milliarden US-Dollar Markenwert gehört Google laut der Datenbank BrandZ aktuell zu den wertvollsten Konzernen der Welt.

Lesen Sie auch Europäische Union Brüssels radikaler 173-Seiten-Plan gegen Trump, Apple & Co

Um sicherzugehen, dass ich mich nicht aus Versehen ins Google-Universum verirre, deinstalliere ich also auch sämtliche Google-Programme auf meinen Geräten und stelle meine Suchmaschine um. Fortan wird mich der Microsoft-Dienst Bing im Alltag mit Informationen versorgen, dazu kommt der hauseigene Apple-Kartendienst, auch für Nachrichten und Videos suche ich mir andere Anwendungen.

In meiner Wohnung muss ich auch durchgreifen. Meinem Google-Lautsprecher ziehe ich den Stecker, auch die Sprach-Assistentin Siri, verbaut in iPhone, MacBook und im Apple-Lautsprecher HomePod muss schweigen – seit 2017 werden für die Assistentin die Datenbanken von Google verwendet.

Anzeige

Mit den Ersatzdiensten verändert sich für mich erst mal nicht so viel. Aber ich merke bewusster, wie sehr Google sich schon in unseren Alltag eingeschlichen hat. Samstagnachmittag, Wochenendplanung mit Freunden – gesucht wird ein Burger-Restaurant in Berlin. „Googel doch mal schnell“, sage ich. Aus dem Sprachgebraucht kann ich die Dienste nicht so schnell verbannen. „Ich guck mal kurz auf Google Maps“ oder „Ich suche mal bei YouTube nach einer Anleitung“, solche Sätze rutschen mir während meiner Fastenzeit immer wieder heraus.

Sogar wenn ich sie umgehe. Im Duden steht „googeln“ schon seit 2004. Zeitgleich aufgenommen mit Worten wie „Dosenpfand“ oder „Kuckuckskind“. Durch den Alltag begleitet mich jetzt auch ein neues, mulmiges Gefühl der Datenlosigkeit. Abschlusszeugnis, Mietvertrag und Co. liegen jetzt nicht mehr auf meinem Rechner auf dem Schreibtisch, sondern auf einem Server von Google. Wo genau, weiß ich nicht – wie sicher sie dort sind, kann ich auch nicht einschätzen. Obwohl ich auf die Dienste verzichte, muss ich mich trotzdem auf Google verlassen.

