title;text

WELT: Wenn ein Mensch sterben würde, der dir am Herzen liegt, würdest du deinen Beruf ausüben und diese Person bestatten können, oder sollte das dann lieber jemand anderes machen?

[00:10:41]

Tim: Nee, tatsächlich überwiegt dann eher der Gedanke: Wenn das jemand ist, der mir vielleicht sogar selber am Herzen liegt oder den ich kenne, dann möchte ich ihm oder ihr auch den bestmöglichen Abschied beziehungsweise der Familie die bestmögliche Begleitung geben. Und wenn man Selbstvertrauen hat, dann hat man schon auch den Gedanken: „Okay, das nehme ich lieber in die eigenen Hände“, um das auch gewährleisten zu können, als das an Fremde weiterzugeben.

[00:11:04]

WELT: Das ist jetzt eine persönliche Frage, aber hast du dir schon mal Gedanken darüber gemacht, wie du bestattet werden möchtest?

[00:11:11]

Tim: Das habe ich. Das hat, glaube ich, jeder Bestatter auch schon. Das ist so wie in anderen Berufen auch, wo man sich genau auskennt, da weiß man auch, was man möchte und was man nicht möchte. Wie die Entscheidung für mich ist, möchte ich aber nicht sagen.

[00:11:25]

WELT: Wie reagieren deine Freunde oder auch Leute, die du nicht kennst, wenn du sagst, dass du Bestatter bist?

[00:11:32]

Tim: Also bei Freunden ist es so, dass sie das ja schon lange wissen, dass sie auch wissen, dass ich aus diesem familiären Umfeld komme. Deswegen sind die Reaktionen da gar nicht so ungewöhnlich. Das sind dann eher manchmal Detailfragen oder Dinge, die man mal gehört hat, wo man dann doch mal eine fachliche Meinung dazu haben möchte. Ein Unterschied ist es eigentlich in Gruppen von neuen Leuten oder Fremden. Da ist es schon so, wenn ich dort erzähle, was ich als Beruf mache, dass ich dann häufig sofort im Mittelpunkt stehe. Dann kommen ganz oft ganz viele interessierte Fragen, und man merkt auch eine große Unsicherheit, die mit der ganzen Thematik einhergeht. Und da habe ich nicht immer Lust drauf. Deswegen ist es sogar manchmal so, wenn ich in eine neue Gruppe komme, dass ich gar nicht unbedingt im Detail sage, was ich mache, sondern dann sage ich so was wie: „Ich arbeite im Büro.“ Und dann fragt meistens keiner nach, und das ist eigentlich im weitesten Sinne auch gar nicht gelogen.

Lesen Sie auch Tod im Krankenhaus Warum viele sterben, wo sie nicht sterben wollen

[00:12:25]

WELT: Kennst du Lucky Luke? Und wünschst du dir vielleicht auch manchmal einen Geier als Arbeitskollegen?

[00:12:31]

Tim: Klar kenne ich Lucky Luke. Neben Asterix und Tim und Struppi ein Held meiner Kindheit. Ich finde, ein Geier ist schon ein ziemlich cooles Maskottchen. Aber noch cooler bei Lucky Luke ist eigentlich der Bestatter, der die ganze Zeit vor den Duellen die Duellanten schon ausmisst, um dann die perfekte Sarggröße nachher vorbereiten zu können.

[00:12:50]

WELT: Aber das macht ihr wahrscheinlich nicht, oder?

[00:12:53]

Tim: Das machen wir nicht, nee. Die sind alle ziemlich ähnlich. Und nur, ich sage mal, in außergewöhnlichen Situationen, wenn ein Mensch wesentlich größer ist zum Beispiel, dann gibt es Särge, die auch eine größere Dimension haben.

[00:13:05]

WELT: Was sind so die gängigsten Klischees oder Vorurteile über Bestatter?

[00:13:10]

Tim: Da gibt es schon ein paar, zum Beispiel ein Vorurteil, dass wir nur am Leid der anderen Leute unser Geld verdienen. Und das kann ich eigentlich nur bedingt gelten lassen, weil der Tod tatsächlich zum Leben dazugehört und das was sehr Natürliches ist. Und diese Situation kommt irgendwann in jede Familie. Und dann ist es eigentlich gut, dass es jemanden gibt, der dann weiß, was zu tun ist. Und mit der gleichen Argumentation könnte man auch einen Arzt oder ein Krankenhaus kritisieren, dass die ja nur an der Krankheit der Menschen verdienen würden. Aber der ethische Hintergrund ist eigentlich ein anderer. Und so ist es bei uns auch. Wir versuchen, den Familien einen guten Weg in die Trauer zu geben.

Noch ein Klischee ist zum Beispiel, dass wir das Mitgefühl immer nur vorspielen würden. Und das stimmt eigentlich auch nicht. Natürlich gibt es Fälle, die einen mehr berühren als andere. Aber letztendlich braucht die Familie niemanden, der Mitgefühl heuchelt, sondern sie brauchen jemanden, der professionell und empathisch die Situation einschätzt und dabei unterstützt.

[00:14:13]

"WELT: Würdest du deinen Job einem guten Freund weiterempfehlen?"""
"Kultobjekt und Zielscheibe für blöde Witze;""Anzeige"

Schon ein imposantes Auto, das da auf dem Besucherparkplatz vor dem Opel-Werk in Rüsselsheim steht und darauf wartet, mal wieder gefahren zu werden: ein stahlgrauer Manta GSi in einer exklusiven Sonderausführung des Opel-Spezialisten Irmscher, Baujahr 1988, schön mit Schiebedach, Doppelscheinwerfern, roten Rennsitzen und einem ziemlich auffälligen Heckspoiler. Der Hersteller hat das nahezu makellos erhaltene Fahrzeug auf Anfrage von WELT AM SONNTAG aus seinem Klassiker-Depot geholt und für eine Ausfahrt zur Verfügung gestellt. In den 1970er- und 1980er-Jahren wurde der Manta über eine Million Mal gebaut, in diesem Jahr feiert er seinen 50. Geburtstag.

Rallye-Sport als Inspiration: Opel Manta 400 in Österreich Quelle: picture alliance/Sport Moments//SepaMedia

Und er hat noch immer mit einem äußerst zweifelhaften Ruf zu kämpfen. Der Opel Manta spielt in einer Liga mit Ostfriesen, Blondinen, Beamten und Jägern: Sie alle haben eine eigene Kategorie an Witzen hervorgebracht. Für eine Automarke ist das eine sehr seltene Errungenschaft. Der kürzeste Manta-Witz geht so: Steht ein Manta vor der Uni.

Lesen Sie auch Erst schneller Schick, dann schriller Kult Tradition: 50 Jahre Opel Manta

Bis heute gilt der Manta als das bevorzugte Verkehrsmittel von eher einfach gestrickten Typen mit voluminösen Frisuren, ausgelatschten Cowboystiefeln und gut gebräunten Ellenbogen, denen man auf Volksfesten besser aus dem Weg geht. Wenn man sich nun ans Steuer dieses Wagens setzt, wird man schlagartig daran erinnert, wie sehr sich das Automobil in den vergangenen 30 Jahren weiterentwickelt hat. Die wenigen Regler, Knöpfe und Schalthebel wirken seltsam zierlich, es gibt keinen Airbag, keinen Becherhalter, nicht einmal einen Zigarettenanzünder. Nur ein Kassettendeck mit Auto-Reverse-Funktion und einer Taste für den Verkehrsfunk.

Anzeige

Als der Kult um den Manta in den frühen Neunzigern seinen Höhepunkt erreichte, gehörte der Wagen eigentlich schon der Vergangenheit an. Die Produktion wurde bereits 1988 eingestellt, das stahlgraue Coupé aus dem Opel-Depot zählt also zu den Letzten seiner Art. Aus heutiger Sicht ist es kaum noch nachvollziehbar, dass die Kiste mal als eine Art Sportwagen durchging. Mit schlappen 110 PS ist der einstige König der Landstraße heute eher auf der rechten Autobahnspur zu Hause als auf der linken – und muss selbst einen Dacia Duster und einen Nissan Micra an sich vorbeiziehen lassen.

Nur echt mit Fuchsschwanz: Ausfahrt im Opel Manta GSi, Juli 2020 Quelle: Katrin Binner (2)

Der Vierzylindermotor produziert ein gutturales Brummen, wobei sich die Schwingungen auf den ganzen Wagen übertragen und damit auch auf die Unterarme des Fahrers. Schon nach einer zweistündigen Tour hat man den Eindruck, ganz schön was geleistet zu haben. Es ist ein erhebendes und auf eigenartige Weise vertrautes Gefühl, durch das man in Zeiten zurückversetzt wird, als einem 200 Kilometer noch unglaublich weit vorkamen.

Am liebsten möchte man den Wagen gar nicht mehr hergeben, auch wenn sich schon bei Außentemperaturen um die 25 Grad die Hitze im Innenraum staut und das Lenkrad bei direkter Sonneneinstrahlung schnell so heiß wird, dass man es kaum noch anfassen kann. Kein Wunder, dass Manta-Fahrer so gern Handschuhe trugen und die Seitenscheiben herunterkurbelten, wenn sie unterwegs waren.

Aufgemotzt über kurvige Landstraßen

Anzeige

Einen gepflegten Manta im Originalzustand findet man heute allerdings nur noch selten. Die meisten Exemplare wurden von ihren Besitzern mit Breitreifen versehen, mit Hosenträgergurten ausgestattet und mit Rennstreifen drapiert, sie wurden verbreitert und tiefergelegt, selbst die Armaturenbretter wurden aufgeschraubt und mit farbigen Folien beklebt, um die Potenz des Wagens zu betonen.

Die Inspiration kam aus dem Rallye-Sport, wo Opel damals ganz vorn mitfuhr. Bei den Eingriffen und Umbauarbeiten ging es jedoch nicht nur um eine Steigerung der Leistungsfähigkeit, sondern auch darum, eine Art von Stammeszughörigkeit und eine ständige Bereitschaft zum Kräftemessen zu signalisieren, wenn die aufgemotzten Karren über die kurvigen Landstraßen strukturschwacher Regionen gurkten und sich bei anderen Verkehrsteilnehmern unbeliebt machten.

Abitur war nichts für ihn: Til Schweiger als Bertie in „Manta, Manta“ Quelle: picture alliance/United Archives/Impress

Anfang der 1990er-Jahre wurde das negative Image des Opel Manta durch zwei Komödien zementiert, die jeweils über eine Million Zuschauer in die Kinos lockten und an Schlichtheit kaum zu überbieten waren. In „Manta, Manta“ fährt Til Schweiger in seiner ersten großen Rolle ein Breitbau-Ungetüm mit einer sagenhaft scheußlichen Multicolor-Lackierung und macht dabei ständig ein Gesicht, als würde er gleich losheulen.

Anzeige

In der lustigsten Szene des Films regt er sich darüber auf, dass einer seiner Manta-Kumpels heimlich das Abitur nachgeholt hat („Und als Nächstes willst du auch noch studieren – oder was?“). Nicht ganz so plump und albern ist „Manta – der Film“. Darin wünscht sich der Teenager Manfred zum 18. Geburtstag einen Golf GTI, bekommt aber einen Opel Manta und wird daraufhin von seiner Freundin verlassen. In beiden Manta-Filmen fahren die Autos ständig mit quietschenden und qualmenden Reifen an, es kommt mehrfach zu abenteuerlichen Wettrennen und Verfolgungsjagden.

Tiernamen passten zum Zeitgeist

Ursprünglich kam der Opel Manta als Antwort auf den populären Ford Capri auf den Markt. Der Weltöffentlichkeit wurde der Wagen im Herbst 1970 am Timmendorfer Strand vorgestellt. Den Namen hat sich der langjährige Opel-Designer George Gallion aus der Tierwelt geborgt. „Tiernamen passten damals zum Zeitgeist“, erinnert er sich in der Pressemeldung zum Jubiläum. „In den USA waren der Ford Mustang und die Corvette Stingray sehr erfolgreich. Ein solches Ponycar auf europäische Art war ja auch der Manta.“

Opel hatte damit junge Familienväter mit begrenztem Budget im Visier, die in ihrem Auto ein bisschen Platz brauchten, sich aber noch nicht ganz von ihrem Selbstbild als Draufgänger verabschieden wollten. Auch wenn der Wagen selbst für damalige Verhältnisse eher dürftig motorisiert war, ging die Strategie auf: Der Manta A verkaufte sich fast eine halbe Million Mal und war damit ein großer Erfolg für die Traditionsmarke, die damals ihre Blütezeit erlebte. Seine Konturen werden vom Opel Mokka-e wieder aufgenommen, einem elektrischen SUV, das Anfang nächsten Jahres auf den Markt kommen soll.

Testfahrt in Namibia Land Rover Defender Nach 787 Kilometern berühren die Reifen wieder Asphalt

