title,text,author,published,tags,source
RKI meldet 1256 neue Corona-Fälle – Memmingen schlägt Alarm,"Der britische Gesundheitsminister Matt Hancock hat für London die zweithöchste Corona-Warnstufe ausgerufen. Das RKI meldet mit 6638 so viele Neuinfektionen an einem Tag wie noch nie seit Ausbruch der Coronavirus-Pandemie in Deutschland. Ein Überblick in Grafiken und Zahlen.

Anzeige

Die Zahl der binnen eines Tages mit dem Coronavirus neu infizierten Menschen in Deutschland ist erneut sprunghaft gestiegen und hat damit einen Rekordwert erreicht. Die Gesundheitsämter meldeten nach Angaben des Robert-Koch-Instituts vom Donnerstagmorgen 6638 Neuinfektionen – rund 1500 mehr als am Mittwoch. Da waren noch 5132 neue Fälle gemeldet worden. Bislang waren Ende März mit knapp 6300 Neuinfizierten die meisten registriert worden. Allerdings sind die jetzigen Werte nicht mit denen aus dem Frühjahr vergleichbar, weil mittlerweile wesentlich mehr getestet wird – und deshalb auch mehr Infektionen entdeckt werden.

Am Mittwoch vergangener Woche hatten die Gesundheitsämter dem RKI 4059 Neuinfektionen mitgeteilt. Damit war zum ersten Mal seit April die 4000er-Marke überschritten worden.

Die Zahl der Corona-Tests schwankt seit Mitte August zwischen rund 1,1 Millionen und 1,2 Millionen pro Woche. Die Rate der positiven Tests ist nach RKI-Angaben vom Mittwochabend jedoch deutlich gestiegen: von 0,74 Prozent Ende August auf 2,48 Prozent in der Woche vom 5. bis 11. Oktober.

An dieser Stelle finden Sie Inhalte von Drittanbietern Um mit Inhalten von Drittanbietern zu interagieren oder diese darzustellen, brauchen wir Ihre Zustimmung. Externe Inhalte aktivieren

Anzeige

In mehreren Labors gebe es einen Rückstau, einige gaben laut RKI Lieferschwierigkeiten für Reagenzien an. „Das RKI erreichen in den letzten Wochen zunehmend Berichte von Laboren, die sich stark an den Grenzen ihrer Auslastung befinden“, schreibt das Institut im Lagebericht vom Mittwoch. Der zusätzliche Testbedarf durch Urlauber nach Einführung des Beherbergungsverbots mit der Option zu einer „Freitestung“ habe die Situation weiter verschärft.

Seit Beginn der Corona-Krise haben sich nach RKI-Angaben mindestens 341.223 Menschen in Deutschland nachweislich mit dem Virus Sars-CoV-2 infiziert (Datenstand 15.10., 0 Uhr). Die Zahl der Todesfälle im Zusammenhang mit einer Corona-Infektion lag demnach bei 9710. Das waren 33 mehr als am Vortag. Nach Schätzungen des RKI gibt es etwa 284.600 Genesene.

An dieser Stelle finden Sie Inhalte von Drittanbietern Um mit Inhalten von Drittanbietern zu interagieren oder diese darzustellen, brauchen wir Ihre Zustimmung. Externe Inhalte aktivieren

Die Reproduktionszahl, kurz R-Wert, lag nach RKI-Schätzungen in Deutschland laut Lagebericht vom Mittwoch bei 1,04 (Vortag: 1,18). Das bedeutet, dass ein Infizierter im Mittel etwa einen weiteren Menschen ansteckt. Der R-Wert bildet jeweils das Infektionsgeschehen etwa eineinhalb Wochen zuvor ab.

Anzeige

Zudem gibt das RKI in seinem aktuellen Lagebericht ein sogenanntes Sieben-Tage-R an. Der Wert bezieht sich auf einen längeren Zeitraum und unterliegt daher weniger tagesaktuellen Schwankungen. Nach RKI-Schätzungen lag dieser Wert bei 1,16 (Vortag: 1,20). Er zeigt das Infektionsgeschehen von vor acht bis 16 Tagen.

An dieser Stelle finden Sie Inhalte von Drittanbietern Um mit Inhalten von Drittanbietern zu interagieren oder diese darzustellen, brauchen wir Ihre Zustimmung. Externe Inhalte aktivieren

Weltweit gibt es laut der Johns-Hopkins-Universität mindestens 38.510.263 mit Covid-19 infizierte Personen (Stand 15.10., 8 Uhr). Davon sind 1.092.144 Menschen am Virus gestorben.

Mehr als 900.000 Infektionen in Spanien

Spanien hat als erstes Land der Europäischen Union die Marke von 900.000 Coronavirus-Infektionen überschritten. Seit Beginn der Pandemie seien mehr als 908.000 Infektionen registriert worden, teilte das spanische Gesundheitsministerium mit. Spanien hat knapp 45 Millionen Einwohner. Offiziellen Angaben zufolge wurden mehr als 33.000 Todesfälle in Zusammenhang mit dem Virus registriert. Gesundheitsexperten glauben, dass die tatsächliche Zahl deutlich höher liegt, jedoch nicht ausreichend getestet wird.

An dieser Stelle finden Sie Inhalte von Drittanbietern Um mit Inhalten von Drittanbietern zu interagieren oder diese darzustellen, brauchen wir Ihre Zustimmung. Externe Inhalte aktivieren

Anzeige

In Großbritannien mit 66,6 Millionen Einwohnern haben sich innerhalb von 24 Stunden nachweislich knapp 20.000 Menschen mit dem Coronavirus angesteckt. Das entspricht einem Anstieg von etwa 2500 im Vergleich zum Vortag. 137 Menschen sind an einer Covid-19-Erkrankung gestorben, wie die Gesundheitsbehörden am Mittwoch mitteilten. Besonders stark betroffen von der Pandemie sind der Norden Englands, Nordirland, Schottland und Teile von Wales. Die tatsächliche Zahl der Neuinfektionen dürfte aber noch höher liegen, da nicht genügend Tests zur Verfügung stehen. Der britische Gesundheitsminister Matt Hancock rief für London die zweithöchste Corona-Warnstufe aus. Er begründete dies am Donnerstag im Unterhaus mit rasch steigenden Infektionsraten in der Hauptstadt. Schnelles Handeln sei erforderlich, um das Virus unter Kontrolle zu bekommen, sagte er.

Angesichts rapide steigender Infektionszahlen dürfen sich Angehörige verschiedener Haushalte demnach in Innenräumen nicht mehr treffen, wie der Londoner Bürgermeister Sadiq Khan am Donnerstag bekannt gab. Auch Treffen in Pubs oder Restaurants sind nicht erlaubt, während sie in Grünanlagen gestattet bleiben. Schulen und der Einzelhandel bleiben geöffnet.

Millionen Bewohner Nordenglands warten darauf, zu erfahren, ob sie unter die strengsten Corona-Regeln fallen. Für Liverpool wurden diese bereits angeordnet. Seit dieser Woche gibt es in Großbritannien ein dreistufiges Corona-Warnsystem.

An dieser Stelle finden Sie Inhalte von Drittanbietern Um mit Inhalten von Drittanbietern zu interagieren oder diese darzustellen, brauchen wir Ihre Zustimmung. Externe Inhalte aktivieren

Die Zahl der registrierten Neuinfektionen binnen 24 Stunden stieg am Mittwoch in Portugal mit 10,3 Millionen Einwohnern auf 2072 – das war der höchste Wert seit Beginn der Pandemie. Die Gesamtzahl der Fälle kletterte den amtlichen Angaben zufolge auf mehr als 91.000. Die Zahl der Menschen, die an Covid-19 starben, stieg um sieben auf 2117. Besonders betroffen sind der Norden und der Großraum Lissabon. Sorge bereitet vor allem die Tatsache, dass die Zahl der in Krankenhäusern behandelten Covid-19-Patienten in etwas mehr als einem Monat von gut 300 auf nun fast 1000 in die Höhe schoss.

Frankreichs Corona-Karte färbt sich immer tiefer rot

In Frankreich mit seinen knapp 67 Millionen Einwohnern haben die Gesundheitsbehörden 22.591 Neuinfektionen binnen 24 Stunden registriert. Es ist das dritte Mal in sechs Tagen, dass das Gesundheitsministerium einen Wert über 20.000 mitteilt. Insgesamt seien 779.063 Infektionsfälle verzeichnet worden. Die Zahl der Todesfälle in Kranken- und Pflegeheimen sei um 104 auf 33.037 gestiegen. Damit ist Frankreich weltweit das neunte Land weltweit, das mehr als 33.000 Todesfälle in Zusammenhang mit dem Coronavirus zu beklagen hat.

Zwar sank die Zahl der Neuinfektionen seit vergangenem Wochenende, wo zuletzt ein Rekordhoch von knapp 27.000 am Samstag verzeichnet wurde. Dennoch steigen die Infektionszahlen gegenüber der vergangenen Woche massiv. Die Karte des französischen Gesundheitsministeriums, auf der die Corona-Hotspots in Scharlachrot (auf Französisch „rouge écarlate“) markiert werden, färbt sich deshalb immer tiefer rot.

An dieser Stelle finden Sie Inhalte von Drittanbietern Um mit Inhalten von Drittanbietern zu interagieren oder diese darzustellen, brauchen wir Ihre Zustimmung. Externe Inhalte aktivieren

Dazu gehören mit der Hauptstadt Paris inzwischen neun Ballungsräume und ein Überseegebiet. Der Großraum Marseille, zu dem auch Aix-en-Provence zählt, ist ebenso betroffen wie die Großstädte Lyon, Grenoble, Saint-Etienne, Lille, Toulouse und Montpellier. Dazu gehört auch die Inselgruppe Guadeloupe in der Karibik.

Anzeige

In Bulgarien mit seinen sieben Millionen Einwohnern liegt die Zahl der neuen Positiv-Tests das vierte Mal binnen einer Woche auf Rekordniveau. Die Zahl der Fälle steigt nach offiziellen Daten um 785 auf insgesamt 25.774. Bislang starben 923 Menschen, die positiv auf das Coronavirus getestet wurden. Aktuell befinden sich 1307 Menschen in Krankenhäusern, 63 davon auf Intensivstationen.

In Tschechien meldet das Gesundheitsministerium 8325 neue Positiv-Tests. Das ist der bislang zweithöchste Wert in dem Land mit 10,7 Millionen Einwohnern, die meisten neuen Fälle gab es am vergangenen Freitag. Die Gesamtzahl der Fälle in Tschechien liegt inzwischen bei 129.747. Bislang starben 1106 Menschen, die positiv getestet wurden. Zu Monatsbeginn waren es noch 696 Todesfälle.

Rekorde in Polen und Kroatien

In Polen überschritt die Zahl der täglichen Neuinfektionen mit dem Coronavirus erstmals die Marke von 6000. Innerhalb von 24 Stunden kamen 6526 neue Fälle hinzu, die meisten davon in der Region um die Hauptstadt Warschau (1188). Das teilte das polnische Gesundheitsministerium am Mittwoch mit. Im gleichen Zeitraum starben 116 Menschen in Zusammenhang mit dem Virus. Seit Beginn der Pandemie gab es in Polen 3217 Todesfälle in Verbindung mit einer Covid-19-Erkrankung. Das Land hat rund 38 Millionen Einwohner. Polen ist das einzige Nachbarland Deutschlands, das bisher vom Auswärtigen Amt in Berlin noch nicht ganz oder teilweise als Risikogebiet eingestuft wurde.

Im EU-Land Kroatien verzeichneten die Behörden am Mittwoch einen Rekordwert an neuen Infektionen mit dem Coronavirus. In den vergangenen 24 Stunden sei bei 748 Menschen Sars-CoV-2 nachgewiesen worden, teilte der Krisenstab der kroatischen Regierung mit. Die bisher höchste Zahl von 542 Neuinfizierten hatte der Krisenstab am 8. Oktober registriert. Vier Menschen starben demnach in den letzte 24 Stunden in Verbindung mit einer Covid-19-Erkrankung. Seit Beginn der Pandemie im Februar haben sich in dem 4,2-Millionen-Einwohner-Land nachweislich 21.741 Menschen mit dem Coronavirus angesteckt. 334 Patienten starben mit dem Virus. Am Mittwoch wurden 441 Patienten im Krankenhaus behandelt, 27 von ihnen wurden künstlich beatmet.

Russland mit seinen 144,5 Millionen Einwohnern meldet einen Rekord an Neuinfektionen. Binnen der letzten 24 Stunden gibt es 14.231 weitere Coronavirus-Fälle. Die Gesamtzahl der Infektionen steigt damit auf 1,34 Millionen. Weitere 239 Menschen starben, wodurch sich die Zahl der Todesfälle auf 23.205 erhöht.

In Brasilien mit seinen 209,5 Millionen Einwohnern sterben nach Angaben des Gesundheitsministeriums 749 Menschen nach einer Infektion mit dem Coronavirus. In den vergangenen 24 Stunden sei die Zahl der positiv Getesteten um 27.235 auf 5.140.863 gestiegen. Insgesamt sind 151.747 Menschen an den Folgen der Ansteckung gestorben.

In Südkorea sind 110 neue Infektionen mit dem Coronavirus registriert worden. Die Hälfte der Fälle stehe in Verbindung mit einem Krankenhaus in der Stadt Busan, teilte die südkoreanische Behörde für Krankheitskontrolle und -prävention am Donnerstag mit. In dem Land mit gut 51 Millionen Einwohner liegt die offizielle Zahl der Fälle damit bei fast 25.000.

Mindestens 54 der Neuinfektionen stünden mit dem Krankenhaus für Ältere in Verbindung. Mehr als 40 seien in der dicht bevölkerten Metropolregion Seoul verzeichnet worden, mit Verbindungen zu Krankenhäusern, Kirchen, Schule und Büros.

Anzeige

Alle aktuellen und weltweiten Entwicklungen zum Coronavirus können Sie in unserem Live-Ticker verfolgen.

Haben Sie Fragen zum Coronavirus? Hier finden Sie die wichtigsten Fakten und Informationen.",'Daniel Wetzel',1599050340,"Panorama,Daten und Zahlen",welt
Die Mehrheit befürwortet einheitliches Bildungssystem,,,1599050065,"Deutschland,Schulpolitik",welt
"„Große Zahl der Menschen, die demonstrierten, sind keine Rechtsradikalen“","Im Interview spricht der Chef des Brandenburger Verfassungsschutzes über die „verflügelte“ AfD in dem Bundesland, die Rolle Gaulands in der Causa Kalbitz und die „chaotische Anti-Corona-Mixtur“ bei den Protesten am Wochenende in Berlin.","Annelie Naumann, Manuel Bewarder",1599049618,"Deutschland,Verfassungsschützer",welt
Psychogramm der Mega-Manager,,Frank Stocker,1599049501,"Karriere,Zukunft der Bewerbung",welt
Verurteilter Wilfried W. soll Psychiatrie verlassen,"Anzeige

Rund zwei Jahre nach den Urteilen im Prozess um das sogenannte Horrorhaus von Höxter in Westfalen soll einer der damals Verurteilten aus der Psychiatrie in den regulären Strafvollzug wechseln. Nach einer Entscheidung des Landgerichts Münster ist der zu elf Jahren Haft verurteilte Mann nicht vermindert schuldfähig, wie das Landgericht Paderborn in seinem Urteil 2018 festgestellt hatte.

Die Strafvollstreckungskammer hatte einen neuen Gutachter beauftragt. Der fand keine psychischen Störungen, die sich auf seine Steuerungsfähigkeit auswirken würden.

In ihrem Haus hatten die Verurteilten jahrelang Frauen gequält Quelle: dpa/AFP/Archiv

„Der Verurteilte kann Recht und Unrecht unterscheiden“, heißt es in der Begründung des Gerichts. Der 50-Jährige war zuletzt in einer Psychiatrie bei Münster untergebracht. Hier waren bei einer vorgeschriebenen regelmäßigen Überprüfung Zweifel an der verminderten Schuldfähigkeit des Mannes aufgekommen.

Anwälte können noch Beschwerde einlegen

Anzeige

Die Entscheidung des Landgerichts Münster ist noch nicht rechtskräftig. Die Anwälte können Beschwerde am Oberlandesgericht in Hamm einlegen. Der heute 50-Jährige wurde im Oktober 2018 zu elf Jahren Freiheitsstrafe und seine Ex-Frau zu 13 Jahren Haft verurteilt. Fast zwei Jahre hatte das Verfahren gedauert. Das Gericht sah es als erwiesen an, dass das Paar über Jahre Frauen in dem Haus bei Höxter misshandelt und gequält haben, zwei der Opfer starben.

Über Jahre hinweg hatte das deutsche Paar Frauen mit Kontaktanzeigen in das Haus nach Ostwestfalen gelockt und dort gequält. Angelika W. hatte umfassend gestanden und ihren Ex-Mann Wilfried W. immer wieder schwer belastet. Wilfried W. hingegen beschuldigte seine Ex-Frau schwer.

Lesen Sie auch „Horrorhaus von Höxter“ „Menschenverachtendes Verhalten“

Nicht nur die beschriebene jahrelange Folter hat die Prozessbeobachter immer wieder schockiert, auch die absolut nüchterne, mitleidlose Schilderung von Angelika W. war bestürzend. Staatsanwaltschaft und Nebenkläger hatten für die beiden Angeklagten lebenslange Haftstrafen beantragt.","'Kristian Frigelj', 'Florian Sädler'",1599049302,"Panorama,Höxter „Horrorhaus“",welt
Pflegeheim-Mitarbeiterin verweigert Corona-Test – und wird gekündigt,,,1599048995,"Videos,Nach Demo-Teilnahme",welt
Thailands König begnadigt seine verstoßene Geliebte,"Anzeige

Thailands König Maha Vajiralongkorn, 68, hat seiner im vergangenen Herbst verstoßenen offiziellen Geliebten alle königlichen und militärischen Titel wiederverliehen. Die Versöhnung wurde am Mittwoch in der „Royal Gazette“ verkündet, der offiziellen Veröffentlichungsstelle für amtliche Bekanntmachungen. Unbestätigten Berichten zufolge ist die Geliebte nun in Bayern.

Die 35-jährige Sineenat „Koi“ Wongvajirapakdi war im Oktober degradiert worden, weil sie gegen den Willen des Königs verstoßen habe und illoyal gegenüber der Monarchie gewesen sei. Koi war im vergangenen Jahr einige Monate lang praktisch die Zweitfrau neben Königin Suthida, 42, und trug sogar zeitweise den Titel Königlich-Adelige Gemahlin.

Lesen Sie auch Thailand Der König urlaubt in Bayern – die Jugend kämpft um die Freiheit

Nachdem ihr die Titel entzogen wurden, war die frühere Konkubine ins Gefängnis gesteckt worden. Seither wurde sie nicht mehr öffentlich gesehen. Bereits am Wochenende hatte es unbestätigte Berichte gegeben, wonach Koi aus der Haft entlassen und nach Deutschland gebracht worden sei, wo Vajiralongkorn die meiste Zeit lebt. Er besitzt eine Villa am Starnberger See, soll aber in der Corona-Krise samt Entourage ins Grand Hotel „Sonnenbichl“ in Garmisch-Partenkirchen gezogen sein.

Thailands König, in vierter Ehe verheiratet

Anzeige

Die frühere Generalmajorin Koi war im Juli 2019 zur „Chao Khun Phra“ erhoben worden, einer Art Konkubine – auch in Thailand ein äußerst ungewöhnlicher Schritt. Das Königshaus veröffentlichte damals dazu mehr als 60 Fotos. Ebenso überraschend folgte im Oktober der Entzug der Titel.

König Maha Vajiralongkorn und seine Geliebte Sineenatra Wongvajirabhakdi Quelle: AP

König Maha Vajiralongkorn – auch Rama X. – ist in vierter Ehe verheiratet. Aus früheren Beziehungen hat er offiziell sieben Kinder. Königin Suthida nahm er erst wenige Tage vor seiner Krönung im Mai 2019 zur Ehefrau.","'Hannelore Crolly', 'Henryk M. Broder', 'Christina Zur Nedden', 'Martin Lewicki'",1599048986,"Ausland,Alle Titel zurück",welt
Warum bei Hafermilch-Fans die Nerven blank liegen,"Anzeige

Das schwedische Unternehmen Oatly steht mit seinem Sortiment an Milchersatzprodukten aus Hafer für Nachhaltigkeit und Umweltschutz. Doch aktuell stellen sich selbst langjährige Oatly-Fans gegen das Unternehmen – viele Aktivisten rufen gar zum Boykott auf.

Der Grund: Das Unternehmen hat im Juli einen Deal mit der Blackstone Group abgeschlossen. 200 Millionen US-Dollar sind dabei geflossen. Weitere Investoren in der Finanzierungsrunde waren laut einer Pressemitteilung Oprah Winfrey, Natalie Portman und der frühere Vorsitzende und CEO von Starbucks.

Für viele Hafermilch-Fans ist die Zusammenarbeit mit der Blackstone Group jedoch ein absolutes No-Go. Erst kürzlich stand die Firma für Investitionen in ein brasilianisches Infrastrukturunternehmen in der Kritik – laut einem Bericht von „The Intercept“ soll dieses für massive Rodungen im Amazonas-Regenwald verantwortlich sein. Das passt so gar nicht zu dem Image der Firma Oatly, die immer wieder ihre Klimafreundlichkeit betont.

Anzeige

Blackstone hat diesen Vorwurf zwar zurückgewiesen – es gibt jedoch einen weiteren Grund, der vielen bisherigen Unterstützern von Oatly sauer aufstößt: Blackstones CEO Steve Schwarzman hat laut CNBC drei Millionen US-Dollar an die Trump-Lobbygruppe America First Action gespendet und ist demnach seit dessen Amtseinführung ein enger Vertrauter des Präsidenten.

Lesen Sie auch Boom der Pflanzendrinks Die Flexitarier befeuern den Hype der Nicht-Milch

In den sozialen Medien wird Oatly für den Deal scharf kritisiert. „Ich möchte nicht, dass mein Geld für die Zerstörung des Planeten verwendet wird und das Leben und Land der Menschen gefährdet wird, nur damit ich morgens einen cremigen Kaffee trinken kann!“, schreibt dort etwa eine Aktivistin.

„Also wieder von vorne: Welche ist die beste Hafermilch nach Oatly?!“, fragt eine weitere.

An dieser Stelle finden Sie Inhalte aus Twitter Um mit Inhalten aus Twitter und anderen sozialen Netzwerken zu interagieren oder diese darzustellen, brauchen wir Ihre Zustimmung. Soziale Netzwerke aktivieren

An dieser Stelle finden Sie Inhalte aus Twitter Um mit Inhalten aus Twitter und anderen sozialen Netzwerken zu interagieren oder diese darzustellen, brauchen wir Ihre Zustimmung. Soziale Netzwerke aktivieren

Anzeige

Oatly verteidigt die Investition und entgegnet den wütenden Reaktionen, das Unternehmen verfolge immer noch die Mission, die Welt nachhaltiger zu machen. „Dass wir Investoren in der Finanzwelt (wo nur ein Bruchteil der Investitionen grün ist) anziehen, die in unsere Nachhaltigkeitsarbeit investieren, ist ein großer Schritt vorwärts. Wir glauben, dass wir einen Systemwandel in der globalen Finanzindustrie auslösen können, der unbedingt notwendig ist, um eine nachhaltige Zukunft auf diesem Planeten aufbauen zu können“, heißt es etwa in einer Antwort.

Lesen Sie auch Fleischersatzprodukte Liebe Fleischesser, es gibt wirklich Alternativen!

Auch einzelne Nutzer verteidigen den Deal: „Investoren sollen grüner und nachhaltiger werden, aber wenn sie dann in grüne und nachhaltige Produkte wie zum Beispiel Hafermilch investieren, ist das auch nicht richtig?“

An dieser Stelle finden Sie Inhalte aus Twitter Um mit Inhalten aus Twitter und anderen sozialen Netzwerken zu interagieren oder diese darzustellen, brauchen wir Ihre Zustimmung. Soziale Netzwerke aktivieren

An dieser Stelle finden Sie Inhalte aus Twitter Um mit Inhalten aus Twitter und anderen sozialen Netzwerken zu interagieren oder diese darzustellen, brauchen wir Ihre Zustimmung. Soziale Netzwerke aktivieren

Update: Die Firma Blackstone betont ihre Überparteilichkeit. So hätten Blackstone-Präsident Jon Gray und Blackstone-Vize Tony James seit langem die US-Demokraten unterstützt, etwa den Präsidentschaftskandidaten Joe Biden. Steve Schwartzman selbst habe US-Präsidenten beider Parteien beraten.","'Anette Dowideit', 'Jörg Zittlau', 'Marian Wendt', 'Frank Stocker', 'Hans Kollhoff'",1599048393,"Panorama,Oatly",welt
Vorsicht – dieses Handtuch könnte piepsen!,"Faszinierend, mit welchem Geschick dieses Zimmermädchen Handtücher zusammenfaltet. In weniger als einer Minute kreiert sie mit Leichtigkeit eine richtige Skulptur, die einen in Staunen versetzt.

Anzeige

Kennen Sie das? Man geht nach dem Bezahlen gerade aus einer Boutique, und plötzlich schrillt der Sicherheitsscanner. Alle anderen Kunden drehen sich um und mustern den vermeintlichen Delinquenten. Peinlich, peinlich, dabei hatte die schusselige Kassiererin nur vergessen, das Sicherheitsetikett an dem gekauften Mantel zu deaktivieren.

Längst sind das nicht mehr nur diese weißen Plastikeier, die an der Kasse umständlich aus dem Innenfutter montiert werden müssen, sondern winzige RFID-Funkchips, ein Gramm leicht, zwei Millimeter klein, die einfach per Funk deaktiviert werden.

RFID steht für Radiofrequenz-Identifikation. Strom holen sie sich drahtlos über die Lesegeräte durch elektromagnetische Wellen. Das Signal hat eine Reichweite von bis zu zehn Metern. Diese Chips können im Vorbeigehen ausgelesen werden. Sie sind so robust, dass sie viele Wäschen überstehen.

Hotels rüsten bei der Sicherheitstechnik auf

Anzeige

Künftig piepsen sie auch häufiger in Hotels – zumindest als Alarm auf dem Tablet beim Rezeptionisten oder bei der Hausdame. Selbst wenn Sie als Gast ohne böse Absichten mit dem gechipten Hotelhandtuch nur zum Strand oder Pool unterwegs sind – und es anschließend brav wieder mit aufs Zimmer nehmen.

„Lassen Sie es lieber sein! Das wird nur peinlich“, rät Hoteltester Tassilo Keilmann vom Wellness Heaven Hotel Guide. Er stellte in einer Umfrage unter 1157 Hoteliers im deutschsprachigen Raum fest: „Immer mehr Hotels arbeiten mit in Bademänteln oder Handtüchern eingenähten RFID-Chips.“

Auch wenn Handtücher liebvoll zu Schwänen geformt wurden, sind sie nur zum Abtrocknen gedacht Quelle: Getty Images/Pierre-Yves Babelon

Bei der Sicherheitstechnik rüsten vor allem Vier- und Fünf-Sterne-Hoteliers auf, auch wenn sie nicht gern darüber reden. Denn nicht nur auf dem Weg von und zur Wäscherei verschwinden viele hochwertige Textilien auf Nimmerwiedersehen; auch unter den zumeist unbescholtenen Hotelgästen gibt es einige Langfinger, die tatsächlich meinen, es sei bloß ein Kavaliersdelikt, Flauschwäsche als Souvenir einfach in den Koffer zu stecken.

Anzeige

Die Favoriten unter dem Diebesgut sind Handtücher und Bademäntel, auch wenn deren „Klau-Rate“ laut der alle zwei Jahre durchgeführten Umfrage im Vergleich zu 2017 immerhin leicht gesunken sei (minus 1,5 Prozent). Die Sicherheitstechnik schreckt offenbar diebische Gäste ab.

Die Diebe werden immer dreister

Wer dennoch mit piepsenden Koffern ausgecheckt ist, wird in der Regel immerhin nicht bloßgestellt oder gefilzt, erhält aber den Gegenwert des Diebesgutes auf seine Kreditkartenabrechnung. „Hoteliers wollen keine Gäste verprellen“, sagt Keilmann. Manchmal belassen sie es auch bei einer Notiz im Stammgästesystem: „Bademantel war schon wieder weg.“

Geklaut wird trotzdem – und das immer dreister. So melden 49 Hoteliers gestohlene Matratzen, vor allem in Fünf-Sterne-Häusern. Wie die sperrige Ware unbemerkt aus dem Hotel transportiert wurde, bleibt ein Rätsel. Die geschädigten Hoteliers vermuten, dass die Matratzen, eingerollt und verschnürt, über direkte Aufzüge in die Tiefgarage gezerrt wurden.

Anzeige

Es geht aber noch unverfrorener: Eine komplette Tesla-Ladestation wurde 2019 aus der Garage in einem Südtiroler Hotel abmontiert; und aus einem Spa-Resort bei Salzburg verschwanden die Saunabänke in einer Suite – handgefertigt aus Zirbenholz –, an denen offenbar jemand Gefallen gefunden hatte. Erst als sich ein neuer Gast über die seltsame Steh-Sauna beschwerte („Wo soll ich mich denn hinsetzen?“), flog dieser dreiste Diebstahl auf.

Lesen Sie auch Hackerangriffe Warum Experten vor der Nutzung von Hotel-WLAN warnen

Dieser Artikel wurde erstmals im Dezember 2019 veröffentlicht.

Der Text stammt aus der WELT AM SONNTAG. Wir liefern sie Ihnen gerne regelmäßig nach Hause.",Kira Hanser,1599048300,"Europa,Diebstahl im Hotel",welt
