title,text,author,published,tags,source
So begründen Sie Lücken im Lebenslauf geschickt,"Studienabbruch, Arbeitslosigkeit, Krankheit: Ein Leben verläuft nicht immer geradlinig. Wer Lücken oder Brüche in seinem Lebenslauf stehen hat, sollte sie in Bewerbungen nicht verheimlichen, raten Experten. So gehen Sie klug damit um.

Anzeige

Früher war es oft einfach: Nach der Schule kam die Ausbildung in einem Unternehmen, und dann blieb man dort ein Leben lang. Heute wechseln viele Arbeitnehmer – freiwillig oder unfreiwillig – ständig den Job, haben vielleicht kurzfristige Verträge oder Nebenjobs und machen dazwischen ein Praktikum oder eine Weltreise. Im Lebenslauf entstehen Brüche und Lücken. Steht dann eine Bewerbung an, sind viele Menschen verunsichert.

„Lücken machen Personaler natürlich immer neugierig“, sagt der Bewerbungscoach Jürgen Zech von der Agentur Make-it-better. Ein Ausschlusskriterium seien sie aber nicht. Nach Abschluss des Studiums sei eine „Sucharbeitslosigkeit“ von einigen Monaten in vielen Fällen sogar ganz normal.

Geht es nach der Karriereberaterin Viola Hoffmann-Scheurer, ist beim Umgang mit Lücken vor allem Ehrlichkeit gefragt. Sie war jahrelang in der Personalabteilung des französischen Autokonzerns PSA tätig und hat in ihrem Leben schon unzählige Lebensläufe gelesen. „Man will mit dem Arbeitgeber ja möglichst eine langfristige Beziehung eingehen. Wenn man dann schon am Anfang nicht ehrlich miteinander umgeht, kann das nicht funktionieren“, sagt sie.

Krankheit und private Probleme: Ehrlichkeit im Lebenslauf hilft

Anzeige

Das zeigt auch eine Befragung der Personalvermittlung Robert Half aus dem Jahr 2017. Demnach haben 71 Prozent der befragten Personaler schon mal Bewerber aussortiert, weil falsche Angaben im Lebenslauf aufgeflogen sind.

Deshalb sind Jobsuchende besser beraten, längere Lücken nicht zu vertuschen, sondern zu erklären. „Sie sollten nicht zu viel Energie aufbringen, den Lebenslauf zu beschönigen, sondern den Blick lieber auf dessen Stärken lenken“, sagt Hoffmann-Scheurer. Spätestens beim Vergleich der Daten mit den Arbeitszeugnissen fielen längere Lücken sowieso auf. Sehe sie eine längere Pause im Lebenslauf, suche sie im Anschreiben nach einer Erklärung.

Jobportal JOBS.WELT.DE Bleiben oder gehen? Der Job-Agent hilft weiter.

Solche Erklärungen können auch private Probleme oder Krankheiten sein. Eine Pause wegen einer schweren Erkrankung werde immer akzeptiert, sagt die Personalberaterin. Auch die Pflege von Angehörigen sei ein nachvollziehbarer Grund für eine Lücke im Lebenslauf.

Anzeige

Aber auch für andere Pausen gibt es Erklärungsmöglichkeiten. Der Bewerbungscoach Sven Emmrich vom Coaching-Portal „Karrierehelden“ empfiehlt, sich beim Schreiben des Lebenslaufes selbst in Erinnerung zu rufen, wie genau man die Zeit der vermeintlichen Lücke verbracht hat. Die wenigsten säßen schließlich nur herum und täten nichts. „Vielleicht hat man sich durch Lesen weitergebildet. Vielleicht hat man auf Reisen eine Sprache gelernt“, sagt Emmrich. „Oder es war einem einfach wichtig, sich Zeit für die Familie zu nehmen.“ Auch das könne von Personalern durchaus anerkannt werden.

Lücken im Lebenslauf: Geschickte Formulierungen finden

Solche Erklärungen könnten in kurzer Form bereits im tabellarischen Lebenslauf untergebracht werden, ausführlicher dann im Anschreiben. Auch in diesem Fall sollte man jedoch bei der Wahrheit bleiben: Einen reinen Partyurlaub als Bildungsreise zu verkaufen ist wenig überzeugend.

Wer in eine Phase der Arbeitslosigkeit gerät, versucht am besten schon währenddessen, die Zeit sinnvoll für sich zu nutzen. „Bahnt sich eine Lücke durch eine absehbare Kündigung an, sollte man sich Gedanken über eine sinnvolle Fortbildung machen oder über eine Nebentätigkeit oder Selbstständigkeit im kleinen Umfang nachdenken“, sagt Bewerbungscoach Zech. Optimal sind Tätigkeiten, die genau zum angestrebten Berufsfeld passen.

Lesen Sie auch Erfolg im Beruf Mit diesen drei Schritten verhindern Sie den Job-Infarkt

Anzeige

Auch geschickte Formulierungen können helfen, Lücken im Lebenslauf weniger negativ erscheinen zu lassen. „Arbeitssuchend“ klingt besser und aktiver als „arbeitslos“, „berufliche Neuorientierung“ wirkt besser als „Arbeitslosigkeit“. Wer gekündigt wurde, sollte im Lebenslauf direkt den Grund mit angeben, beispielsweise „betriebsbedingte Kündigung durch Unternehmensinsolvenz“. Auch Brüche im Lebenslauf wie etwa ein Wechsel des Studiengangs oder der Ausbildung müssen kein Problem sein. „Kein Leben verläuft perfekt“, sagt Beraterin Hoffmann-Scheurer.

Hinzu kommt: Wer einmal einen neuen Weg eingeschlagen hat, weiß hinterher womöglich besonders gut, was er will – auch das kann Personaler überzeugen. Genau diesen Punkt sollten Bewerber, die sich im Laufe des Lebens umorientiert haben, im Anschreiben und im Bewerbungsgespräch dann auch besonders betonen.

Menschen mit Brüchen im Lebenslauf nicht weniger gewissenhaft

Bewerbungscoach Sven Emmrich empfiehlt, die vermeintlichen Brüche im Lebenslauf möglichst gut auf die gewünschte Stelle auszurichten. Vielleicht habe jemand mal ein Praktikum in einer Branche gemacht, die auf den ersten Blick gar nicht zum angestrebten Job passe.

Dann solle man sich fragen: „Welche Fähigkeiten habe ich dort trotzdem gelernt, die mir im jetzigen Job nützen können?“ Diese sollten dann im Lebenslauf besonders hervorgehoben werden.

Lesen Sie auch Bewerbung Das sind die fiesesten Fragen im Vorstellungsgespräch

Ein Lebenslauf mit Lücken und Brüchen ist also kein Grund zur Verzweiflung. Eine Studie der Hochschule Osnabrück ergab bereits 2014, dass es nur geringe Zusammenhänge zwischen Lücken im Lebenslauf und Persönlichkeitsmerkmalen gibt.

Personen, die in ihrem Leben eine Phase der Arbeitslosigkeit hatten, erwiesen sich in der Untersuchung nicht als weniger gewissenhaft als andere. Die Studienautoren kamen zu dem Schluss, dass Personaler mit hoher Wahrscheinlichkeit Fehlentscheidungen träfen, wenn sie Bewerber allein aufgrund eines lückenhaften Lebenslaufes aussortierten.

An dieser Stelle finden Sie Inhalte von Drittanbietern Um mit Inhalten von Drittanbietern zu interagieren oder diese darzustellen, brauchen wir Ihre Zustimmung. Externe Inhalte aktivieren

Lesen Sie hier weitere Artikel aus unserer Ratgeber-Reihe zum Thema Lebenslauf:

Dieser Artikel wurde erstmals im Mai 2019 veröffentlicht.",Jan Wittenbrink,1602143100,"Karriere, Bewerbung",welt
Der wärmste aller Zyniker,"Anzeige

Zuerst hatte man immer Mitleid mit ihm; dann, erst nach und nach bröckelte das weg und wich einem Gefühl der Bewunderung: Chapeau, der Mann hat es faustdick hinter den Ohren – und den circa meterdicken Brillengläsern. Herbert Feuerstein, der irgendwie selbst in seinen jungen Jahren der große (kleine) alte Mann des zynischen Nonsens war.

Klingt komplett abwegig, unmöglich? Klar, alles andere würde ihm ja auch nicht gerecht werden. Zyniker und Berufsopfer, was er war und in einem Satz, mit einem Augenzucken alles auseinandernehmen konnte, immer so, dass man es nicht kommen sah. Ungeschickt wirkte er dabei nur.

Lesen Sie auch Herbert Feuerstein „Schön ist bei mir eigentlich gar nichts“

Bekannt wurde er dem breiten Publikum vor allem durch seine oft dadaistischen Auftritte als Sidekick von Harald Schmidt in dessen Rumpelkammershow „Schmidteinander“ im WDR der frühen Neunzigerjahre. Was viele nicht wissen: Feuerstein war der Erfinder dieser Sendung, in der er zusammen mit seiner künstlerischen Hassliebe Harald Schmidt in bester Hurz-Manier die überkopfte Pseudokultur auf den Arm nahm. Zum Beispiel im Ballett-Anzug beim Ausdruckstanz. Ein Zucken mit dem Mundwinkel war – wenn überhaupt – das Einzige, das einen Hinweis darauf gab: Hier wird gerade etwas in der Luft zerrissen. Wer das nicht merkt, kann es ja doof finden. Die anderen – und sie wurden immer mehr – erkannten, dass hier sehr unprätentiös Fernsehgeschichte geschrieben wurde.

Anzeige

Wobei das kaum vorkam: Der subtile Feuerstein wurde für diesen wichtigen Teil seines Lebenswerkes 1994 sogar mit dem Grimme-Preis ausgezeichnet.

""Schmidteinander"": Herbert Feuerstein und Harald Schmidt im Sommer 1992 Quelle: picture-alliance/ dpa

Da hatte er bereits eine Menge herrlichsten Unsinn auf dem Kerbholz, hatte als Chefredakteur das deutsche „Mad“-Magazin populär gemacht. Später als gänzlich untalentierter angeblicher Mega-Stuntman „Spartakus“ mit Billig-Heldenanzug die Privatfernsehcomedy eine Zeit lang noch vor dem Abrutsch ins Mario-Barth-Zeitalter bewahrt – verhindern konnte er es nicht. Wollte er wohl auch gar nicht. Erstens versteckte sich auf einer der vielen Ebenen des Herbert Feuerstein ein echter Menschenfreund, der keinem wirklich die Show oder Karriere vermiesen wollte – zum anderen genoss der in Österreich geborene Satiriker mit morbider Lust Szenen des Untergangs, zumindest kokettierte er damit.

Herbert Feuerstein (1937 bis 2020) als Chefredakteur des „Mad“-Magazins Quelle: picture alliance/ Heinz Wieseler

Was für eine Kunst, seine eigene Misere, schlechte Laune, Hoffnungslosigkeit nicht nur mit einem Schulterzucken abzutun, nein, sie als Inspiration zu genießen, den Humor in ihr auch da schon zu erkennen, wo man mit der Verarbeitung noch gar nicht begonnen hat!

Lesen Sie auch Herbert Feuerstein wird 80 Harald Schmidts ewiger Prügelknabe kann sich „nicht sonderlich leiden“

Anzeige

Schwächen, Unzulänglichkeiten, Selbstmitleid – das waren die Themen seines Schaffens. Allerdings augenzwinkernd, nein: zuckend zelebriert. Auch hier: Nur wer wirklich wollte, konnte hinter dem vermeintlichen Leid die Lust erkennen, mit der er durch sein berufliches Leben trippelte, jungenhaft bis ins Alter.

Müde wurde er einfach nicht – weder im wörtlichen Sinne, was ihn veranlasste, mehrmals ganze Nächte im TV durchzusenden, live und mit viel Improvisation, was sich schon immer daran zeigte, dass er sich kaum an einer Stelle ausruhen wollte, konnte. Musikstudium in Österreich: hingeschmissen, mit seiner ersten Frau ab nach New York, dort als Journalist gearbeitet. Später zwei weitere Ehen, Arbeit als Satiriker, Autor, Schauspieler, Sprecher. Beim „Jedermann“ im Berliner Dom spielte er eine Zeit lang den Teufel; passend, denn meist war es ja andersherum, in seinem Leben – da spielte er den harmlosen Opfertypen. Spielte ihn gut.

Lesen Sie auch Humor und „Cancel Culture“ Worüber sich Comedians heute nicht mehr lustig machen würden

Dieses Widersprüchliche, Subtile – es beschützte ihn auch davor, zu viel von sich preiszugeben. Ein Clown im besten Sinne, der sein wahres Wesen, das, was ihn wirklich beschäftigte, nie zeigte. So war er, so wird er fehlen in der von politisch korrekten Holzhämmern dominierten deutschen Satire. Diese vorsichtige, vielleicht misstrauische Maskierung, das war er, authentisch. Widerspricht sich das? Gut, denn das wäre in seinem Sinne gewesen. Reisen Sie gut, Herr Feuerstein; Ihr „Bubbligumm“ wird Sie niemals vergessen!",Oliver Rasche,1602143040,"Kultur, Herbert Feuerstein †",welt
Diese Fehler sollten Sie bei Ihrem Bewerbungsfoto vermeiden,"Eigentlich soll es gar keine Fotos in der Bewerbung mehr geben. Doch das hat sich in Deutschland nicht durchgesetzt. Stattdessen sind die Anforderungen sogar gestiegen. Was Jobkandidaten bei der Auswahl beachten müssen.

Anzeige

Im Hintergrund eine hellgraue Marmor-Optik, davor der Bewerber in adretter, heller Kleidung und mit einem leichten Lächeln auf den Lippen: Dreieinhalb mal viereinhalb Zentimeter große Passfotos mit den immer gleichen Posen zierten noch vor wenigen Jahren so gut wie alle Lebensläufe. Doch die Zeiten haben sich geändert.

Heute scheint es, als seien dem Design von Bewerbungen und insbesondere der Machart von Bewerbungsfotos kaum Grenzen gesetzt: Statt eines bescheidenen Bildes in der rechten oberen Ecke des Lebenslaufs prangen plötzlich große Porträtaufnahmen auf den Deckblättern der Unterlagen.

Jobportal JOBS.WELT.DE Bleiben oder gehen? Der Job-Agent hilft weiter.

Bewerber zeigen sich in starken Posen mit verschränkten Armen – oder auch dynamisch, also in Bewegung, mit Wind im Haar, während der Betrachter im Hintergrund eine verschwommene Häuserfassade erkennt.

Anzeige

Tatsächlich reicht es heutzutage oft nicht mehr, ein schnödes Passbild mitzuschicken, sagt Caroline Tillmann, Karrierecoach und Geschäftsführerin der Karriereberatung Tillmann Consulting in Freudenstadt. „Bewerbungen unterliegen genauso wie die Mode gewissen Trends“, sagt sie. „Die fortschreitende Digitalisierung und heutige Selbstdarstellung auf den Social-Media-Kanälen haben den Bewerbungsprozess und eben auch die Machart von Bewerbungsfotos neu buchstabiert.“

Bewerbungsfoto ja oder nein?

Dabei sollten Bewerbungsfotos eigentlich an Bedeutung verlieren. Im August 2006 hatte der Bundestag das Allgemeine Gleichbehandlungsgesetz verabschiedet, kurz AGG. Hintergrund: Ethnische Herkunft, Geschlecht oder Religion sollen Menschen im Bewerbungsverfahren nicht benachteiligen. Deshalb dürfen Arbeitgeber keine Fotos bei Bewerbungen mehr verlangen. Nur Studienabschluss, Berufserfahrung oder Motivation sollen Personaler überzeugen.

Doch anders als beispielsweise in der Schweiz haben sich Bewerbungen ohne Fotos nicht durchgesetzt. Der Grund: Unternehmen leben das AGG hierzulande anders. Während Schweizer Firmen ihre Bewerber explizit auffordern, kein Foto mitzusenden, stellen es die Deutschen ihren Kandidaten frei.

Anzeige

Es gibt heute wohl wenig Bewerbungen ohne Bild. Das legt zumindest eine Umfrage des Staufenbiel Instituts nahe. 82 Prozent der 297 Unternehmen, die das Karriere-Portals für seine „Recruiting Trends 2017“ befragte, waren der Meinung, dass erst das Foto eine Bewerbung komplett macht. Nur zehn Prozent bevorzugten Unterlagen ohne Fotos.

Mit einem Bild vor Augen erhoffen sich Personaler einen vollständigeren ersten Eindruck. Wie individuell ist der Bewerber? Wie authentisch? Passt er zur Stelle? Zum Unternehmen? „Ein Bewerbungsfoto sollte die Persönlichkeit der Bewerber widerspiegeln“, sagt Tillmann.

Das heißt konkret: Will man sich agil zeigen, darf es gerne ein Foto sein, auf dem man in Bewegung abgelichtet ist. Da kann das Fotostudio zum Beispiel der Kulisse einer Innenstadt weichen, vor der der Bewerber in Richtung Kamera läuft. An den wehenden Haaren erkennt der Personaler die Bewegung im Bild.

Anzeige

Will man für eine herausfordernde Stelle kämpferisch wirken, darf das Lächeln auch mal einem ernsteren Blick weichen. „Bilder sind Stimmungsträger. Am Ende zählt die Botschaft der Persönlichkeit und der Motivation“, erklärt die Karriereberaterin.

Bewerbungsfoto: Anzahl, Größe Kleidung

Jobsuchende könnten heute – anders als noch vor wenigen Jahren – auch mehrere Fotos in ihre Bewerbung integrieren, erklärt Tillmann. Wichtig dabei: Das Porträtfoto sollte dominant auf dem Deckblatt der Unterlagen platziert sein. Rechts oben im Lebenslauf habe dieses Bild inzwischen eher weniger zu suchen.

Die weiteren Fotos sollten dann keine Porträts mehr sein, vielmehr geht es hier um kleine, kreative Bilderstrecken, die zum Inhalt des Anschreibens passen. Das können fotografierte Hände oder Werkzeuge in Aktion sein – der Kreativität sind keine Grenzen gesetzt.

Kein übertriebenes Lächeln: Das kann Entschlossenheit demonstrieren Quelle: Getty Images/Westend61

Wer nicht weiß, was er mit seinen Händen anstellen soll, darf die Arme verschränken Quelle: Getty Images/Westend61

Ausschlaggebend für die Art des Bewerbungsfotos ist, für welche Branche sich der Jobkandidat interessiert – und wie er auf das Unternehmen wirken möchte. „Bewirbt sich jemand bei einer Bank, empfehle ich, die seriöse und klassische Fotovariante zu bevorzugen“, sagt Tillmann. „Ist das Ziel hingegen eine junge Werbeagentur, darf es gerne legerer, kreativer und witziger sein.“

Oft hilft ein Blick auf die Homepage des Unternehmens oder die hauseigenen Social-Media-Plattformen: Präsentieren sich dort alle Mitarbeiter mit Anzug, Krawatte und ernstem Blick, sollte sich der Bewerber an dieser Optik orientieren – das Gleiche gilt, wenn sich die Mitarbeiter in Hoodies, Sportkleidung, Käppis und einer witzigen Grimasse zeigen.

Bewerbungsfoto Tipps: Darauf sollte man achten

Doch egal wie individuell Bewerbungsfotos auch sein mögen: Sie müssen trotzdem immer noch gewissen Standards genügen, sagt der Fotograf Rainer Holz, Inhaber des auf Businessfotos spezialisierten Fotostudios Köln Süd. Die Kleidung sollte gepflegt sein, das Gesicht klar erkennbar, der Hintergrund soll nicht ablenken. „Ich würde empfehlen, Mütze und Schal abzulegen und darauf zu achten, dass beispielsweise nicht zu viele auffällige Piercings im Gesicht zu sehen sind“, sagt der Fotograf.

Zudem kommen unprofessionelle Fotos nicht gut bei Personalern an. So sagte fast jedes vierte befragte Unternehmen in der „Recruiting Trends“-Umfrage, dies sei sogar ein Ausschlusskriterium, mit dem sich der Bewerber disqualifiziert. Deshalb sollten Fotos beispielsweise besser nicht aus dem Kontext gerissen sein. Ein Bild, bei dem der Bewerber zwar in schicker Kleidung auf einer Hochzeit fotografiert wurde, scheint zwar auf den ersten Blick passend, allerdings ist der Kontext ein privates Fest – und somit nicht gut geeignet.

Anzeige

**Jetzt bei WELTJobs den Job finden, der wirklich zu Ihnen passt.**

Viele Fotografen bieten heute an, zum Styling zu beraten, und geben Tipps zu Outfit, Make-up und Frisur. Dabei würden die Porträtierten inzwischen oft selber schon zu Foto-Profis, beobachtet Fotograf Holz: Fast jeder habe sein Smartphone mit einer Topkamera bei sich, bearbeite Schnappschüsse mit Bildbearbeitungstools und poste sie später auf Facebook, Instagram und Co. „Die Porträtierten haben ein größeres Selbstbewusstsein. Sie wissen genau, wie sie auf Fotos gut rüberkommen – und wie eben nicht“, sagt Holz.

Dass man das am besten geeignete Foto trotzdem nicht alleine aussuchen sollte, legt eine Studie der University of New South Wales aus dem Jahr 2017 nahe. In der Untersuchung sollten Probanden Fotos für ihre Profile in sozialen Netzwerken aussuchen, darunter auch das Karriere-Portal LinkedIn. Auch Fremde wählten jeweils Bilder für sie aus.

Eine dritte Gruppe wiederum bewertete die Aufnahmen nach Merkmalen wie Kompetenz und Zuverlässigkeit. Das Ergebnis: Die Fremden hatten sich für die Fotos entschieden, die diese Eigenschaften besser transportieren. „Wenn es darum geht, die beste Version unserer Selbst zu wählen“, schreiben die Forscher, „kann es klug sein, andere Menschen für uns entscheiden zu lassen.“

Lesen Sie auch Eigenwillige Bewerbungen „Vor solchen Leuten fürchtet man sich in Organisationen geradezu“

An dieser Stelle finden Sie Inhalte von Drittanbietern Um mit Inhalten von Drittanbietern zu interagieren oder diese darzustellen, brauchen wir Ihre Zustimmung. Externe Inhalte aktivieren

Dieser Artikel wurde erstmals im November 2019 veröffentlicht.",Carina Winter,1602142500,"Karriere, Passbild war gestern",welt
„Sie sollten immer Exit-Strategien einplanen“,"Ob in den Bergen oder auch nur im flachen Land, immer mehr Menschen haben das Wandern für sich entdeckt. Gerade in diesen Zeiten, in denen sich das Reiseverhalten Corona-bedingt verändert hat. Es ist das Abenteuer, das die Menschen reizt, der Einklang mit der Natur, die Abwechslung und nicht zuletzt die sportliche Aktivität. Nick Wassong ist passionierter Wanderer und betreibt mit einem Freund einen erfolgreichen Wanderblog.

Schuhgröße, Sockenmaterial, Rucksackgröße, Wassermenge, Streckenplanung, Worauf es bei der Planung einer Wandertour ankommt und was es zu beachten gilt.",Lars Gartenschläger,1602142260,"Fitness, Wandern",welt
Diese Fliege wird im Internet zum wahren Helden des TV-Duells,,,1602142240,"Ausland, Harris vs. Pence",welt
"„Es ist möglich, dass wir am Tag 10.000 neue Fälle sehen“","Angesichts der hohen Neuinfektionsrate hat das Robert-Koch-Institut vor einer unkontrollierten Verbreitung des Coronavirus in Deutschland gewarnt. „Die aktuelle Situation beunruhigt mich sehr“, sagte RKI-Chef Lothar Wieler. Er warnte vor „10.000 neuen Fällen am Tag“.

Innerhalb eines Tages sind die Corona-Neuinfektionen in Deutschland sprunghaft angestiegen. Welche Konsequenzen daraus gezogen werden, darüber informieren Gesundheitsminister Jens Spahn und RKI-Chef Lothar Wieler.

Spahn und Wieler äußern sich zur aktuellen Corona-Lage in Deutschland

Anzeige

Bei einer gemeinsamen Pressekonferenz haben Bundesgesundheitsminister Jens Spahn (CDU) und der Chef des Robert Koch-Instituts (RKI), Lothar Wieler, vor einer unkontrollierten Ausbreitung des Coronavirus gewarnt. „Die aktuelle Situation beunruhigt mich sehr“, sagte Wieler und sprach damit die seit Anfang September gestiegenen Infektionszahlen an. „Es ist möglich, dass wir am Tag 10.000 neue Fälle sehen“, äußerte er seine Befürchtungen. „Es ist möglich, dass sich das Virus unkontrolliert verbreitet.“ Er hoffe, dass die Infektionen auf einem Level gehalten werden, mit dem man umgehen könne. „Unser Ziel ist, so wenig wie möglich Infektionen zuzulassen.“ Nur dann werde das Gesundheitssystem nicht überlastet, und nur dann verhindere man viele schwere Verläufe und Todesfälle.

Auch Spahn äußerte sich „sehr besorgt“ über die stark gestiegenen Zahlen. Dies gelte besonders für die aktuelle, sprunghafte Steigerung auf mehr als 4000 Neuinfektionen binnen eines Tages. Es gebe etwa in Berlin teilweise ein „sorgloses, ignorantes Verhalten“ von Menschen, weshalb er die neuen Corona-Maßnahmen des Berliner Senats begrüße. Vor allem jüngere Menschen würden sich nun infizieren, „weil sie Party machen wollen, weil sie reisen wollen, weil sie sich für unverletzlich halten. Das sind sie aber nicht“, sagte Spahn weiter. Bei Covid-19 handele es sich weiterhin um eine ernsthafte Erkrankung. Die Zahlen an Todesfällen und Intensivpatienten seien aber derzeit vergleichsweise niedrig.

An dieser Stelle finden Sie Inhalte von Drittanbietern Um mit Inhalten von Drittanbietern zu interagieren oder diese darzustellen, brauchen wir Ihre Zustimmung. Externe Inhalte aktivieren

Insgesamt sei Deutschland bisher aber im Vergleich zu anderen europäischen Ländern noch gut durch die Pandemie gekommen. „Das Gesundheitssystem kann sehr gut damit umgehen.“ Deshalb könne man zuversichtlich sein.

Anzeige

Es steckten sich zurzeit vor allem junge Leute an, bestätigte Wieler Spahns Äußerungen. Man sehe aber ebenso mehr Ausbrüche in Altenheimen und Krankenhäusern. „Das wird auch wieder zu mehr Hospitalisierung führen“, warnte Wieler. Wenn sich wieder mehr ältere Menschen ansteckten, werde es auch wieder mehr schwere Krankheitsverläufe und Todesfälle geben.

Seit September stiegen die Zahlen wieder, seit Anfang Oktober hätten sie sich verdoppelt, führte Wieler weiter aus. Die meisten Ansteckungen erfolgten jetzt im Inland. Nur noch acht Prozent der Neuinfektionen gingen auf Reisende zurück. Niemand könne derzeit voraussagen, wie sich die Lage weiter entwickeln werde, sagte Wieler. Die Gesundheitsämter hatten dem Robert Koch-Institut zuletzt binnen 24 Stunden 4.058 Neuinfektionen gemeldet, die bisher höchste Zahl seit den ersten Wochen der Pandemie.

Lesen Sie auch Drostens Antwort Ausnahmezustand für immer

Nach Einschätzung des RKI-Chefs ist Deutschland bisher wegen der Schutzmaßnahmen gut durch die Krise gekommen. „Es sind nicht so viele Menschen erkrankt und gestorben, weil wir gemeinsam Maßnahmen ergriffen haben und uns daran gehalten haben.“ Es sei ein Trugschluss, das Risiko durch das Virus deshalb zu unterschätzen, sagte Wieler. Er rief dazu auf, weiter die Hygiene- und Abstandsregeln einzuhalten.

AHA-Regeln plus App und Lüften

Anzeige

Es gelte zu verhindern, dass die Zahlen insgesamt wieder exponentiell steigen und es zu einem Moment komme, „wo wir die Kontrolle verlieren“, sagte der Minister Spahn. „Da sind wir noch nicht.“ Um die Entwicklung im Griff zu halten, gehe es um die richtige Balance aus Zuversicht wegen der bisher gut gemeisterten Krise, aber auch aus Wachsamkeit und Achtsamkeit. Es komme weiterhin auf Abstand, Hygieneregeln und Masken an – nun in der kalten Jahreszeit ergänzt um Lüften und ein möglichst breites Nutzen der Corona-Warn-App. Es gebe inzwischen mehr Wissen und Instrumente für den Kampf gegen das Virus.

„Es liegt an uns allen, ob wir es schaffen“, sagte Spahn. „Wenn 80 Millionen mitmachen, sinken die Chancen des Virus gewaltig.“ Diese Pandemie sei auch „ein Charaktertest für uns als Gesellschaft“, der nur gemeinsam zu bestehen sei.",'Jette Moche',1602142172,"Panorama, RKI-Chef Wieler warnt",welt
