title,text,author,published,tags,source
"Bundeskanzler Habeck? „Ja, diese Prüfung würde ich für mich bestehen“","Die Grünen lassen noch immer offen, ob sie in den Bundestagswahlkampf 2021 mit einem Kanzlerkandidaten oder einer -kandidatin ziehen. Parteichef Robert Habeck sagt, er habe einen Plan - und das Zeug zum Bundeskanzler.

Anzeige

Grünen-Chef Robert Habeck traut sich grundsätzlich die Übernahme der Kanzlerschaft zu. Man müsse „sich selbst überprüfen, ob man glaubt, man hat das moralische Rüstzeug und innere Ruhe, man hat einen Plan, was man will“, sagte Habeck am Mittwochabend in der ARD-Sendung „maischberger. die woche“ auf eine Frage nach der Kanzlerschaft. „Diesen Plan habe ich, und deshalb ist die Antwort: Ja, diese Prüfung würde ich für mich bestehen.“

Lesen Sie auch Talkshow „Sandra Maischberger“ Sogar Karl Lauterbach zerpflückt das neueste Corona-Verbot

Habeck machte klar, dass er großen Respekt vor dem Amt habe. Die Frage der Kanzlerschaft sei nicht einfach lässig mit „Hey, da hab ich Bock drauf“ zu beantworten. Er halte sich da an das Wort von Joschka Fischer, der das Spitzenamt die „Todeszone der Politik“ nannte. Er wisse um „die Größe der Verantwortung“.

Lesen Sie auch Habecks Machtambitionen Unverbindlich und unkalkulierbar – die grüne Strategie fürs Kanzleramt

Die Grünen lassen bislang offen, ob sie mit einem Kanzlerkandidaten oder einer -kandidatin in die Bundestagswahl 2021 ziehen werden. Neben Habeck gilt Co-Parteichefin Annalena Baerbock als mögliche Anwärterin. Bis zur Wahl „geben wir unser Bestes“, sagte Habeck in der ARD. „Ich gebe mein Bestes, Annalena gibt ihr Bestes, und dann werden wir sehen, was daraus wird.“",'Ulrich Exner',1602141351,"Deutschland, Grünen-Chef",welt
„Wir würden Angela Merkel in Deutschland nicht so behandeln“,"Der amerikanische Präsident ist nicht nur der berühmteste, er ist auch der am aufwändigsten behandelte Corona-Patient der Welt: Ob Kortison, Remdesivir oder sogar Medikamente, die bisher noch niemand richtig kennt – was auch immer gegen den Erreger helfen könnte, Donald Trump bekommt es.

Zwischenzeitlich konnte man den Eindruck haben, diese Mixtur würde eine erstaunlich rasante, ja fast eine Wunderheilung bewirken. Am Donnerstag hatte sich der 74-Jährige angeblich das erste Mal krank gefühlt. Am nächsten Morgen wurde das positive Testergebnis bekannt gegeben, Trump noch am Abend in ein Militärkrankenhaus verlegt. Am Samstag erfolgte per Video schon die Botschaft an die Nation: Es gehe ihm viel besser, hieß es aus dem Krankenbett. Am Montagabend wurde er nach nur drei Tagen aus der Klinik entlassen.

Bei Stefan Kluge, dem Leiter der Intensivmedizin am Hamburger Uniklinikum Eppendorf (UKE), löst das Verwunderung aus.",Michael Brendler,1602141300,"Gesundheit, Trumps Corona-Therapie",welt
