title,text,author,published,tags,source
Sieht so die Revolution aus?,"Anzeige

Revolutionen sehen anders aus. Sie bringen Hunderttausende auf die Straße. In Berlin ist davon kaum etwas zu spüren. Auch wenn manche Demonstranten davon träumen. Sie sprechen von Merkel-Diktatur, Lügenpresse und Sprechverboten, sie schwenken Fahnen, ihre Hymne ist ein Popsong: „Freiheit“ von Marius Müller-Westernhagen. Verglichen mit dem, was sich gerade in Minsk abspielt, läuft am letzten Augustsamstag in Berlin ein Travestieprogramm.

Die Corona-Demonstranten strömen am Vormittag aus Bussen und Bahnen, mit Rucksäcken und Rollkoffern, und bevölkern Berlins Mitte. Vor allem die kilometerlange Magistrale von der Siegessäule über das Brandenburger Tor bis zur Kreuzung Unter den Linden/Friedrichstraße. Sie tragen Regenbogenfahnen bei sich und Reichskriegsflaggen, russische, amerikanische oder norwegische Fahnen, ab und zu flattert auch Schwarz-Rot-Gold.

Der beliebteste Buchstabe dieser Gesellschaft scheint das Q zu sein. Q wie „Querdenken“ oder Q wie „QAnon“: eine Chiffre für Verschwörungsmythen, nach denen Staatsoberhäupter und Hollywood-Schauspieler in einen internationalen Kinderhändlerring verwickelt sind. Natürlich auch die Bundeskanzlerin.

Demonstranten halten Schilder hoch, die Politiker in Sträflingsanzügen zeigen Quelle: REUTERS

Anzeige

Ein Pärchen aus Bayern erklärt in Reichstagsnähe, was es mit mit diesem Q wie QAnon auf sich hat: Deutschland werde von der BRD GmbH geleitet, nehme Eltern die Kinder weg und verkaufe sie an reiche Eliten. Alles seien irgendwie verwickelt, Angela Merkel sowieso, aber auch der Markus Söder. Nur Donald Trump und Wladimir Putin, die seien „auf unserer Seite“. Deswegen müssten „wir“ einen Vertrag mit ihnen abschließen, bevor es zu spät sei.

Wo kommen diese Leute her? Sie tragen Schilder mit ihren Herkunftsorten: „Querdenker“ aus Plauen, aus Oldenburg, aus Bonn, aus Münster. Am Vormittag wirken die Szenen bisweilen wie ein harmloser Familienausflug. Ein Vater und eine Mutter ziehen einen Bollerwagen über den Parkweg am Tiergarten, drei kleine Kinder sitzen darin, sie betrachten interessiert das Gewusel ringsum.

Ein paar Meter weiter läuft ein durchtrainierter Mann in Lederhosen und scharfkantiger Frisur, daneben ein untersetzter Herr in kurzen Hosen und T-Shirt, Aufschrift: Deutsches Reich. Viele Neonazi-Organisationen hatten für die Demonstration mobilisiert, bekennende Neonazis sind hier in der Minderheit, aber sie sind sichtbar. Sicherheitsbehörden befürchteten Gewalttaten, in manchen Chatgruppen war die Stimmung aufgeheizt, sogar von Erschießungen oder einem Sturm auf den Verfassungsschutz war da die Rede.

Die Flagge des Deutschen Reichs wurden auch durch Berlin getragen Quelle: Getty Images

Anzeige

Schon am Vortag hatten sich einige Hundert Demonstranten auf den Plätzen vor dem Reichstagsgebäude und Brandenburger Tor eingefunden. Sie haben sich in Tücher gehüllt, ein Mann trägt ein Indianer-Kostüm. Daneben Männer mit Reichsflaggen. Wie das zusammengeht? Er würde von den Rechten Abstand halten, meint der Kostümierte. Trotzdem will er mit ihnen auf demselben Protestmarsch laufen.

Der beginnt am Samstag für manche mit Cappuccino und Croissants. Die Außentische des „Café Einstein“ sind um zehn bereits voll besetzt, die Corona-Demonstranten warten darauf, dass es losgeht. Unter der Woche ist das „Einstein“ ein beliebter Treffpunkt von Abgeordneten, Journalisten und Lobbyisten – also jener Klientel, die nach Ansicht vieler Demonstranten die Corona-Diktatur zusammenhalten. Oder die Deutschland GmbH. Eine Gruppe „Reichsbürger“ steht mit großem Transparent vis-à-vis vom Holocaust-Mahnmal.

Längst nicht alle Demonstranten wirken so, als würden sie in Berlin einen Staatsstreich planen oder die Regierung stürzen wollen. Ein junger Mann ist mit Freunden aus Niedersachsen angereist. Sie stammen aus dem Kreis Warendorf, der im Juni wegen des Corona-Ausbruchs beim Fleischfabrikanten Tönnies in einen erneuten Lockdown gehen musste. Sie sind mit dem Auto gekommen und haben weit weg in der Nähe des Olympiastadions geparkt. Der junge Mann will seinen Namen nicht verraten, aber er erklärt, warum er gekommen ist: Die Schutzmaßnahmen der Bundesregierung hält er für übertrieben, die Kommunikation für unzureichend. Er sei unzufrieden mit der Art und Weise, wie die Zahlen zur Pandemie aufbereitet würden. „Es geht immer um Neuinfektionen, aber nie um Kranke auf den Intensivstationen und um Tote.“ Er müsse ständig großen Aufwand betreiben, um an diese Informationen zu kommen.

Protest vor dem Brandenburger Tor Quelle: Getty Images

Anzeige

Diesen Unmut will er in Berlin kundtun. An Revolution denkt er nicht. Mit den Verschwörungstheoretikern, Identitären oder bekennenden Antisemiten, die auch heute wieder dabei sind, will er nichts zu tun haben. Andererseits: „Ich kann aber nicht die Verantwortung für alle übernehmen, die da mitlaufen.“

Doch sie sind da. Sämtliche Galionsfiguren der Neuen Rechten haben sich in die ehemalige Reichshauptstadt aufgemacht. Schon am Freitagabend lässt sich der Rechtspublizist Jürgen Elsässer von einer ein Dutzend Männer starken Eskorte begleiten, unter ihnen auch Martin Sellner, Kopf der deutschsprachigen rechtsextremen „identitären Bewegung“. Sie wandern vor dem Reichstag auf und ab und lassen sich beklatschen wie Popstars.

Auch der Thüringer Rechtsextremist und AfD-Politiker Björn Höcke sitzt am Samstagmittag auf einer Treppe an der Spree, zwischen Bundestagsgebäuden und Reichstag, sorgfältig abgeschirmt von einem halben Dutzend Bodyguards. Ein Polizeiboot schippert vorbei, Parolen schallen hinüber: „Wir weichen nicht!“

Lesen Sie auch Corona-Skeptiker in Berlin Wenn die Masken fallen

Die Polizei spricht von einem „breiten Spektrum“, „gutbürgerliche“ Demonstranten seien auf der Straße, aber auch „rechte und gewaltbereite“ Personen. Am Brandenburger Tor kommt es gegen Mittag zu ersten Rangeleien. „Macht das Tor frei“ rufen Demonstranten, sie wollen jetzt da durchdrängeln, obwohl die Veranstalter per Lautsprecher dazu aufrufen, Abstände einzuhalten und links und rechts über Nebenstraßen in das Berliner Zentrum zu laufen. Ein Demonstrant wird festgenommen, eine Flasche fliegt. Dann beruhigt sich die Lage wieder. 3000 Polizisten sind in Berlin im Einsatz, in den Nebenstraßen sind Wasserwerfer geparkt.

Die Polizisten können nicht alles verhindern. Im ICE von Leipzig nach Berlin habe am Samstagmorgen kaum ein Reisender eine Maske getragen, berichten Fahrgäste erbost. Offenbar waren viele Demonstranten an Bord. Wer am Samstag in der Friedrichstraße eine Maske im Gesicht trägt, wird mitunter schief angesehen und gefragt, ob er „zur Antifa“ gehört.

300 Meter weiter, auf dem Berliner Bebelplatz, läuft es genau andersherum. Hier hat sich der Gegenprotest versammelt, ein paar Hundert junge Menschen, eine Bühne, von der aus in schepperndem Ton klare Ansagen gemacht werden: „Wer keine Maske trägt, hat hier nichts verloren! Die Maske ist heute ein Symbol für den Antifaschismus!“ ruft ein Redner. Die Auflage wird von einem jungen Mann überprüft: „Bitte tragen Sie einen Mund-Nasenschutz!“ Danach zieht er die eigene Maske herunter und zündet sich eine Zigarette an. Der Antifa-Ordnerdienst strengt an.

Gegendemonstranten halten ein Banner ""Masken auf Nazis raus"" Quelle: dpa

Der Zug der Corona-Demonstranten gerät derweil Unter den Linden ins Stocken. Trotz der Aufforderungen der Leitung weigern sich viele, eine Maske im Gesicht zu tragen, auch die Abstände werden nicht eingehalten. Um 13.03 Uhr twittert die Berliner Polizei dann: „Es bleibt uns keine andere Möglichkeit: Wir sind an den Versammlungsleiter herangetreten und haben ihm mitgeteilt, dass seine Versammlung polizeilich aufgelöst wird. Alle bisherigen Maßnahmen haben nicht zu einem Einhalten der Auflagen geführt.“

Anzeige

Die Behörden sprechen am Abend von bis zu 38.000 Demonstranten. Die behördliche Zwischenbilanz am Samstag gegen 14.00 Uhr: Am Schiffbauerdamm hätten sich 40 Personen Boxbandagen angelegt. In der Taubenstraße stehen 70 Personen auf der Fahrbahn. In der Universitätsstraße werden Hindernisse aufgestellt. In der Friedrichstraße brennt ein Baucontainer. Außerdem vermelden die Ordnungshüter dort eine „Festnahme nach Flaschenwurf“. Für die Berliner Polizei klingt das, mit Verlaub, bisher eher nach einem normalen Wochenende. Im Bahnhof Friedrichstraße überprüfen Beamte in Kampfmontur derweil die Maskenpflicht. Wer keinen Mund-und-Nasenschutz dabeihat oder sich weigert, der muss heute draußen bleiben.

Eine Demonstrantin bläst in eine Vuvuzela vor einer Polizeikette Quelle: dpa

Die Auflösung der Demo ist zwar beschlossen und verkündet, aber die meisten reisenden Corona-Demonstranten wollen noch nicht zurück nach Plauen, Bonn oder Oldenburg. Die Räumung des Protestzugs geht nur schleppend voran. Einige Polizeibeamte steigen aus ihren Wagen, sie suchen das Gespräch, wollen sogar Masken verteilen. Sie werden wüst beschimpft. Auf Höhe der russischen Botschaft denken die Teilnehmer nicht daran, die Straße zu räumen und skandieren: „Wir bleiben hier!“ Flaschen werden geschmissen. Es kommt zu Rangeleien. Die Polizei zeigt zunächst große Geduld. Später räumt sie den Bereich.

Der große Pulk schiebt sich schließlich doch Richtung Siegessäule ab. Von Ferne heulen Sirenen, Hubschreiber knattern über dem Tiergarten, Berliner Abendstimmung eben. Eine kleine Gruppe von Demonstranten steht abgeschirmt vor dem Reichstagsgebäude. Auf die große grüne Wiese dürfen sie nicht. Einige versuchen es, die Polizei will die Rasensprenger anstellen.

Sieht so die Revolution aus? In Berlin wurden am 29. August zwischen Siegessäule und Friedrichstraße demonstrativ Infektionen riskiert. Das war dann aber auch schon alles. Und nun?

Lesen Sie auch Proteste gegen die Corona-Politik Was wir von den „Querdenkern“ lernen können

Dieser Text ist aus der WELT AM SONNTAG. Wir liefern sie Ihnen gerne regelmäßig nach Hause.","Claus Christian Malzahn, Annelie Naumann",1598725062,"Deutschland,Anti-Corona-Demo",welt
„Wir wollen den absoluten Weltfrieden!“ - Die bizarren Szenen einer Großdemo,,Martin Heller,1598719994,"Deutschland,Corona-Protest in Berlin",welt
So verlief der Demonstrationstag in Berlin,,,1598719721,"Deutschland,WELT-Reportage",welt
„Gegen polizeiliche Maßnahmen aufgelehnt und mit Flaschen geworfen“,,,1598710154,"Videos,Gewaltbereite Demonstranten",welt
