title,text,author,published,tags,source
Spahn geht „echt zuversichtlich in Herbst und Winter“,"„Wir wissen uns zu schützen“, sagt Gesundheitsminister Jens Spahn und sieht sich in den aktuellen RKI-Zahlen bestätigt. Auch in den kommenden Monaten werde man die Lage unter Kontrolle haben – unter einer Bedingung.

Anzeige

Gemeinsam wieder raus aus der Corona-Krise: Bundesgesundheitsminister Jens Spahn ist optimistisch für die nächsten Monate. „Wir haben echt ziemlich viel erreicht bis hierhin“, sagte der CDU-Politiker am Mittwoch in Berlin.

„Die Zahlen sind niedrig, das Gesundheitswesen kann gut damit umgehen, und wir wissen uns zu schützen.“ Man habe in den vergangenen Monaten viel gelernt: „Und damit können wir echt zuversichtlich in Herbst und Winter gehen.“ Selbst bei höheren Infektionszahlen werde man regional und lokal reagieren.

Man werde das sicherlich nicht noch einmal wie im März flächendeckend tun. „In bestimmten Bereichen wie im Einzelhandel sind die Dinge im Griff“, sagte Spahn, der am Dienstag in Bochum zugegeben hatte, dass einige Maßnahmen aus dem März und April unverhältnismäßig gewesen seien. Namentlich hatte Spahn die Schließung von Friseuren und des Einzelhandels genannt und Abstand von möglichen neuerlichen Kontaktverboten in Alten- und Pflegeeinrichtungen genommen. Auch dort sei die Lage unter Kontrolle.

Anzeige

Die Balance zwischen Sicherheit und Alltag gelinge zunehmend besser. „Ich bin sehr sicher, wir werden es in drei oder sechs Monaten noch besser können als heute.“

1256 neue Fälle am Mittwoch

Mit dem Ende der Urlaubszeit in den meisten Bundesländern waren die täglichen Infektionszahlen wieder gestiegen und hatten sogar die Marke von 2000 überstiegen.

Dies hatte teilweise auch an der stark erhöhten Zahl der Tests gelegen. In den vergangenen Tagen hatten dem Robert-Koch-Institut (RKI) zufolge aber die Ansteckungen nicht weiter zugenommen und waren wieder leicht zurückgegangen. Am Mittwoch wurden 1256 neue Fälle gemeldet.

Lesen Sie auch Coronavirus Das Rätsel um die sinkende Sterblichkeit

Anzeige

Corona-Hotspots, also Landkreise mit täglich mehr als 50 Infizierten pro 100.000 Einwohner über eine Woche, vermeldete das RKI nicht mehr. Auch die vom RKI ermittelten Ansteckungsraten liegen wieder unter eins. Das heißt, ein Infizierter gibt das Virus statistisch an weniger als einen weiteren Menschen weiter. Auch die Zahl der akut Infizierten – also solchen Menschen, die das Virus weiter geben können – ging wieder leicht zurück.

Spahn sagte, trotz der Corona-Demonstrationen der vergangenen Tage habe er den Eindruck, die große Mehrheit der Menschen stünde hinter dem Kurs der Bundesregierung. Die Abstands- und Hygieneregeln seien das entscheidende Instrument im Kampf gegen das Virus und würden auch überwiegend akzeptiert. Spahn sagte, er habe keine Antwort darauf, welche Situation in den vergangenen Monaten solchen Hass und Frust ausgelöst habe.

Spahn kritisiert Leipziger Stadion-Entscheidung

Skeptisch äußerte sich Spahn allerdings zur Entscheidung in Leipzig, zum Bundesliga-Start rund 8500 Zuschauer im Stadion zuzulassen. Zwar sollten Entscheidungen auch lokal getroffen werden. Zumindest in der Ersten Bundesliga solle es aber ein einheitliches Vorgehen geben. „Ich fände es besser, wenn wir es bundesweit wie besprochen abgestimmt machen.“","'Curd Wunderlich', 'Susanne Gaschke', 'Kaja Klapsa'",1599053760,"Deutschland,Corona-Prognose",welt
Diese Verbote würde Jens Spahn im Nachhinein nicht mehr aussprechen,"Die Aussagen gingen in den Protesten gegen den Gesundheitsminister in Bottrop fast unter: Spahn deutete in seiner Rede an, welche Anti-Corona-Maßnahmen der Bundesregierung nach heutigem Kenntnisstand unverhältnismäßig waren.

Anzeige

Schlagzeilen machte der Wahlkampfauftritt von Bundesgesundheitsminister Jens Spahn in Bottrop vor allem deshalb, weil der CDU-Politiker bei dem Auftritt am Montag von Demonstranten fast durchgehend niedergebrüllt wurde. Ein Video von seiner Rede, das die „Bild“-Zeitung auf YouTube gestellt hat, zeigt aber, dass der Minister dabei eine interessante Einschätzung abgegeben hat.

Spahn räumte in der aufgeheizten Atmosphäre von Bottrop ein, dass einige der von der Bundesregierung getroffenen Corona-Schutz-Maßnahmen im Rückblick womöglich unverhältnismäßig waren. Namentlich nannte Spahn die Schließung von Friseuren und des Einzelhandels. Gleichzeitig nahm er Abstand von möglichen neuerlichen Kontaktverboten in Alten- und Pflegeeinrichtungen.

Im März hatte die Regierung aus Sorge vor einer eskalierenden Lage in den Krankenhäusern Kontaktbeschränkungen erlassen, zudem Läden, Friseursalons, Gaststätten sowie Restaurants geschlossen und strenge Ausgangsbeschränkungen erlassen. Auch Angehörige in Pflegeeinrichtungen durften nicht mehr besucht werden.

Anzeige

Derzeit ist die Corona-Lage in Deutschland stabil. In den vergangenen sieben Tagen wurden laut RKI 7756 Neuinfektionen gemeldet. 235 Corona-Kranke liegen auf der Intensivstation, gestorben sind 9302 Menschen.

Lesen Sie auch Coronavirus Das Rätsel um die sinkende Sterblichkeit

Wörtlich sagte Spahn in Bottrop: „Man würde mit dem Wissen von heute, das kann ich ihnen sagen, keine Friseure mehr schließen und keinen Einzelhandel mehr schließen. Das wird nicht noch einmal passieren. Wir werden nicht noch einmal Besuchsverbote in den Pflegeeinrichtungen brauchen. Wir haben doch etwas dazugelernt in den letzten Monaten, wie wir uns schützen können, ohne dass es diese Maßnahmen braucht. Dafür braucht es aber vor allem eben zum Beispiel die Maske.“

„Und genau da bin ich bei ihnen“, sagte er dann weiter in Anspielung auf das lautstarke Pfeifkonzert. „Man muss immer das ganze Bild zeigen, das runde Bild.“ Er beispielsweise versuche immer, die Lage ausgewogen darzustellen und warnte im gleichen Atemzug vor einer „Endzeitstimmung“.

AHA-Regeln „beste Waffen“ gegen Corona

Anzeige

In Bochum wiederholte Spahn am Dienstag seine Einschätzung noch einmal am Rande eines Klinikbesuchs. „Wir können heute diese Abwägungsentscheidung zwischen Schutz und Alltag besser treffen, weil wir mehr wissen, weil wir mehr Erfahrung haben.“ Diesmal verteidigte er aber die Eindämmungsmaßnahmen im öffentlichen Leben, die im Hinblick auf die damalige Infektionsdynamik und nach damaligem Wissensstand nach bestem Wissen und Gewissen verhängt worden seien.

Lesen Sie auch Coronavirus Liegt doch Hoffnung in der Herdenimmunität?

Nun, Anfang September, wisse man aber, „wie wir gut etwa im Einzelhandel im Regelbetrieb damit umgehen können, vor allem, wenn wir Masken tragen und Abstand halten, ohne dass es zu Einschränkungen kommt“. Abstand, Hygiene und Alltagsmasken blieben die „besten Waffen“ im Kampf gegen das Virus.

Unterstützung bekam Spahn von FDP-Chef Christian Lindner, der in der „Bild“-Zeitung mit den Worten zitiert wird: „Vor einiger Zeit sprach Frau Merkel noch von Diskussionsorgien, wenn es um Öffnung ging. Die Worte von Herrn Spahn zeigen jetzt, wie richtig es ist, Entscheidungen der Regierung immer zu hinterfragen.“","'Kristian Frigelj', 'Manuel Bewarder'",1599053280,"Deutschland,Corona-Lockdown",welt
Noch mehr Ruhm für Lewis Hamilton?,,,1599053036,"Sport,Großer Preis von Italien",welt
Drostens Podcast-Partnerin rät Kollegen von Talkshow-Besuchen ab,"Künftig wird sich die Virologin Sandra Ciesek beim NDR-Podcast „Das Coronavirus-Update“ mit ihrem Kollegen Christian Drosten abwechseln. In einem Interview äußerte sie nun Kritik an einigen Vertretern ihrer Fachrichtung.

Nahezu täglich sind Virologen in den deutschen Talkshows zu sehen – in der Corona-Pandemie sind sie die Experten. Der Virologin Sandra Ciesek zufolge geben sie in den Sendungen allerdings oft Statements ab, die nicht richtig sind.

Anzeige

Die Virologin Sandra Ciesek hält es für gefährlich, wenn sich ihre Kollegen in Talkshows zu Themen äußern, bei denen sie sich nicht gut auskennen. „Viele reizt es, dass sie in Talkshows eingeladen werden. Da geben sie dann Statements ab, die nicht immer ganz richtig sind“, sagte Ciesek in der aktuellen Ausgabe der Wochenzeitung „Die Zeit“. „Ich finde, man sollte sich zu Themen nur äußern, wenn man dazu wirklich etwas sagen kann. Das ist wichtig für die Glaubwürdigkeit der Wissenschaft und der Virologie.“

Ciesek ist Direktorin des Instituts für Medizinische Virologie am Universitätsklinikum Frankfurt und wechselt sich von kommendem Dienstag an mit Christian Drosten als Gesprächsgast beim Corona-Podcast des NDR ab. Ihre Motivation dabei sei nicht, die Politik zu beeinflussen. „Ich möchte Menschen etwas erklären, die nicht Biologie oder Medizin studiert haben.“ Durch die Flut an Informationen würden viele geradezu abgehängt, „und um die möchte ich mich im Podcast kümmern“, sagte Ciesek der „Zeit“.

„Ich lasse mich gerne eines Besseren belehren“

Auf die Frage, wie sie selbst damit umgehe, dass sich die Fakten immer wieder änderten, sagte Ciesek: „Ich habe überhaupt kein Problem damit, dass ich etwas nicht weiß oder mich mal geirrt habe. Ich lasse mich auch gern eines Besseren belehren, wenn jemand mehr weiß als ich oder sich die Faktenlage ändert.“

Lesen Sie auch Kekulé zum Kampf gegen Corona „Ein echter Game Changer. Das würde unser Verhältnis zu dieser Pandemie verändern“

Anzeige

Nicht gerechnet habe sie „mit dieser extremen Spaltung der Gesellschaft und der Aggressivität, die auch in Berlin wieder sichtbar wurde. Man hat das Gefühl, das Coronavirus ist nur noch Auslöser – und nicht der wahre Grund“. In Berlin hatten am Wochenende mehrere Protestkundgebungen gegen die Corona-Politik der Regierung stattgefunden. Dabei eskalierte am Samstagabend die Lage vor dem Reichstagsgebäude: Mehrere Hundert rechtsextreme Demonstranten stürmten die Treppe des Sitzes des Bundestags.

Die bisher gut 50 Folgen des Podcasts „Das Coronavirus-Update“ wurden bislang mehr als 60 Millionen Mal abgerufen. Am Dienstag war die erste Folge nach der Sommerpause mit Christian Drosten erschienen.","'Kristina Schröder', 'Elke Bodderas', 'Julia Ruhs'",1599052835,"Panorama,Virologin Sandra Ciesek",welt
Treffpunkt Turnhalle,"Anzeige

Tilman Walther stellt ein paar Stühle auf die weitläufige Terrasse, die im Innenhof des Museums für Kunst und Gewerbe (MKG) wie eine Ruheinsel im Großstadtbetrieb liegt. Später, sagt der Künstler und Kurator, wird es hier Bänke geben. Der Außenbereich gehört zur sogenannten Turnhalle des Gebäudes, einem 330 Quadratmeter großen, lichtdurchfluteten Saal mit historischer Bogenarchitektur und bodentiefen, weit zu öffnenden Fenstern.

Innen- und Außenraum vereinen alle Qualitäten, die ein idealer Aufenthaltsort braucht, zumal in Pandemiezeiten. Unter dem Namen „Freiraum“ bekommt die ehemalige Ausstellungsfläche vom 4. September an eine neue, experimentelle Funktion.

Lesen Sie auch „Elbphilharmonie der Digitalisierung“ Diese finnische Bibliothek ist Hamburgs großes Vorbild

Lesen Sie auch Museen nach dem Shutdown „Die Blockbuster haben ausgedient“

„Es gab den Wunsch, das Haus zu öffnen“, sagt Walther, der zusammen mit der Kunsthistorikerin Nina Lucia Groß als „Gastgeber“ des Freiraums angetreten ist. Das Kuratorenduo wird dort Aktivitäten und Zusammenkünfte entwickeln und koordinieren. Das Wichtigste dabei: Der Raum soll offen für alles und frei zugänglich sein – für jeden und kostenlos.

Anzeige

Die multifunktionale Fläche ist als Treffpunkt, Pausenhalle und Besprechungszimmer, als Arbeitsplatz oder Leseort, zum Nachdenken, Ausruhen, Hausaufgaben machen oder Diskutieren gedacht, während drumherum der normale Museumsbetrieb läuft. Besucher, Nachbarn, Reisende, Museumsmitarbeiter, Familien, Schüler, Gruppen, Vereine und Institutionen sollen den Raum als Angebot verstehen, an einem sicheren Ort niedrigschwellig und konsumfreie Zeit zu verbringen – und dabei gerne auch Impulse, Ideen und Gedanken an das Museumsteam heranzutragen.

Treffpunkte einer offenen Gesellschaft

Tulga Beyerle, Chefin des MKG, möchte ihr Haus schon lange durchlässiger machen. „Ich bin überzeugt, dass ein Museum generell ein Diskursort ist“, sagt die Direktorin. Im Freiraum sieht sie die Möglichkeit, sich auf Augenhöhe auch mit den Menschen auszutauschen, die unter anderen Umständen nicht ins Museum kämen.

Ihre Einladung an alle sprechen Walther und Groß jetzt zuerst in der unmittelbaren Nachbarschaft aus. Im Stadtteil St. Georg führen sie Gespräche etwa mit Gruppen der Kinder- und Jugendarbeit oder auch mit postmigrantischen Gruppen, um sie für gemeinsame Projekte im Freiraum zu gewinnen. Die Reaktionen sind sehr positiv. Schließlich gibt es von der Museumsseite aus ein gutes Angebot: „Wir können eine Plattform sein, die stabil ist“, sagt Walther.

Anzeige

Für zunächst drei Jahre ist der Freiraum gesichert, die Mittel dafür kommen aus dem Innovationsfonds der Kulturbehörde. „Orte der Kultur werden immer mehr zu Treffpunkten unserer offenen Gesellschaft. Mit der ‚Innovationsoffensive Hamburger Museen‘ wollen wir deshalb innovative und zeitgemäße Museumsprojekte der Hamburger Museumsstiftungen besonders fördern“, sagt Kultursenator Carsten Brosda (SPD): „Unser Ziel ist es, die Museen über den Ausstellungsbetrieb hinaus in ihrer gesellschaftlichen Relevanz zu stärken und bei der Entwicklung hin zu offenen Orten zu unterstützen.“ Diese Strategie verfolgte der Kultursenator bereits vor der Corona-Pandemie.

Lesen Sie auch Cancel Culture Eine offene Gesellschaft muss Mehrdeutigkeiten aushalten

Lesen Sie auch Streit um Denkmäler Wie weiter mit Bismarck?

Lesen Sie auch Carsten Brosda zu Corona-Krise „Ich hoffe, dass wir als Gesellschaft den Schuss hören“

Der kulturell geprägte Raum soll, so die Idee hinter dem Projekt, die Funktion eines „Dritten Ortes“ einnehmen. Nach dem amerikanischen Soziologen Ray Oldenburg treffen an solchen informellen, für das Funktionieren der Zivilgesellschaft bedeutsamen Orten unterschiedliche Menschen aufeinander und pflegen den nachbarschaftlichen Austausch. Mithilfe des Freiraums könnte das Museum seine Rolle festigen als „Impulsgeber für gesellschaftliche Fragestellungen“, wie Brosda es ausdrückt. Im Freiraum, so der Senator, können die Besucher „das Themenspektrum des Museums für Kunst und Gewerbe neu entdecken, einfach nur eine gute Zeit an einem anregenden Ort verbringen oder mit anderen ins Gespräch kommen.“

Alle Abteilungen des Museums, sagt Beyerle, haben Interesse bekundet und wollen etwas zum Experiment beitragen. So werde „die Sammlung auf eine Art und Weise im Freiraum präsent sein.“ Allerdings sei diese Präsenz als offenes, unaufdringliches Angebot zu verstehen. Vielleicht werden die Mitarbeiter des Hauses einzelne Objekte im Freiraum vorstellen und mit Blick auf tagesaktuelle Themen neu befragen – Stichworte wären etwa Provenienz oder Islam. Online-Vorträge und Filmdarbietungen sind geplant. Beyerle kann sich auch vorstellen, dass beispielsweise eine Restauratorin im Freiraum an einem historischen Möbelstück arbeiten und den Besuchern die Möglichkeit geben wird, dabei zuzusehen oder sogar selbst mitzuhelfen.

„Wir müssen uns mehr über unser Wirken und nicht über unsere Zahlen definieren“

Anzeige

Auf das MKG mit seiner langen Geschichte als komplexe Bildungseinrichtung kommen heute neue Aufgaben zu. Wenn das Museum in die diverse Gesellschaft hinein wirken will, muss es ein offenes Ohr haben für deren Vielstimmigkeit. Zudem könnten die coronabedingten Reisebeschränkungen zu einer stärkeren Identifizierung der Menschen mit dem führen, was die Kulturinstitutionen vor der eigenen Haustür zu bieten haben. Darin liegt eine Chance – und eine Verantwortung.

„Wir müssen uns mehr über unser Wirken und nicht über unsere Zahlen definieren“, sagt die Museumschefin. In und trotz der Corona-Krise einen Ort für Begegnungen zu schaffen, sei der richtige Weg, um „der Vereinzelung in der Gesellschaft entgegenzuwirken“. Laut Beyerle hat der Freiraum eine Gelenkfunktion, durch die Impulse von innen nach außen, aber auch von außen nach innen gelangen: „Er ist der Resonanzraum des Hauses.“ Was und ob etwas aus der Bevölkerung kommen wird, ist noch ungewiss. Doch der Raum wird jeden Input aufnehmen, sich wandeln und erweitern. Das Museum arbeitet mit dem Architektur- und Design-Kollektiv Construct Lab zusammen, das bei Bedarf Umgestaltungen vornimmt.

Die wenigen bereits vorhandenen Möbel sind wandelbar. Zwei große Holzelemente können als Sitzgelegenheit sowie als Tribüne und Kommunikationsbox für Aufführungen, Vorträge, Filme und andere Präsentationen genutzt werden. Wie die großen Tische, die Kletterpyramide, das Technik- und das Küchenelement stehen sie auf Rollen und lassen sich beliebig arrangieren. Die Rückseite der kleinen Kaffeeküche dient als Tafel. Darauf befindet sich eine Kreidezeichnung des Ausstellungsdesigners Thomas Rustemeyer: Durch die skizzierte Architektur der Halle wandern Adjektive, die mit dem Freiraum assoziiert werden sollen – offen, spontan, lebendig, agil, frei, permeabel und veränderbar. „Der Raum erfüllt seine Funktion, wenn er einfach da ist“, sagt Tilman Walther. „Für uns wäre es fantastisch, wenn die Leute irgendwann sagen: Wir treffen uns im Freiraum.“

Dieser Text ist aus der WELT AM SONNTAG. Wir liefern sie Ihnen gerne regelmäßig nach Hause.",Julika Pohle,1599052774,"Hamburg,Museum für Kunst und Gewerbe",welt
Mein Training zwischen Türstehern und Porsche-Rentnern,"Anzeige

Die Menschen sehen mich an, als wäre ich von allen guten Geistern verlassen. Immer wieder. Ich dachte bislang, so werden ausschließlich Typen angesehen, die stolz sagen, ihr Lieblingsalbum sei von Scooter und ihre Lieblingsserie „Unter uns“. Ich kriege diese Blicke oft ab, wenn ich erzähle, wann ich zum Sport gehe. Um sechs Uhr morgens. Volle Power im Gym, noch vor dem Frühstück, vor der Arbeit, vor dem gesamten Tag.

Manche schütteln den Kopf, wenn sie das hören. Einige lachen ungläubig. Wieder andere sehen mich mitleidig an. „Kannst du nicht schlafen?“, fragen sie. Diejenigen, die gern einen Clown frühstücken, fragen: „Na, in deinem Alter schon senile Bettflucht?“ Haha, selten so gelacht. Hin und wieder gibt es auch respektvolle Blicke und Sätze wie: „Hut ab, so früh könnte ich nicht mal die Ein-Kilo-Hantel bewegen.“

Ist natürlich totaler Quatsch. Ja klar, jeder hat seinen Biorhythmus, und mancher ist abends leistungsfähiger. Doch generell kann jeder morgens ins Gym und im Workout an seine Grenze gehen. Alles nur Gewöhnungssache. Alles kein Hexenwerk.

Viel Platz: früh morgens hat man viel Freiraum im Fitnessstudio Quelle: pa/Jan Haas

Anzeige

Während meiner USA-Urlaube in den vergangenen Jahren habe ich gemerkt, dass man bei den Amerikanern um sechs Uhr ein Spätaufsteher ist – hier sind viele Studios schon 4.30 Uhr richtig voll. Musik aufgedreht, Hochbetrieb, jede Hantelbank besetzt.

In Deutschland ist es vor sieben ziemlich leer und ruhig, der Studioangestellte der Frühschicht gähnt beim Handtücher-Zusammenlegen, es kommen immer dieselben Mitglieder zu dieser Zeit. Quasi der harte Frühsportkern. Ein Gym ist ja immer ein ganz eigener Kosmos, und in diesen Stunden im Morgengrauen umso mehr.

Kann natürlich sein, dass beim Lesen dieser Zeilen jetzt die selbst ernannte Fitnesspolizei ihre Sirene anwirft und durch den Lautsprecher ruft: „Aber auf nüchternen Magen hat man doch gar keine Kraft und kann keine Muskeln aufbauen!“

Anzeige

Doch, klar. Die Glykogen-Speicher fülle ich mit einem vollwertigen Essen am Abend. Und ohne Mahlzeit in den Stunden vor dem Training fühle ich mich beim Workout viel leistungsfähiger und leichter.

Das sind die Vorteile des Trainings am Morgen

Man ist danach richtig wach. Und gut drauf. Der Körper schüttet Glückshormone aus. Es ist viel leerer im Gym als zur Rush-Hour zwischen 16 und 19 Uhr. Wer zu dieser Zeit in eines der großen Studios geht, fährt wahrscheinlich auch am Samstagvormittag zu Ikea. Und am Freitagnachmittag auf Autobahnen mit Langzeitbaustellen. Ihr seid doch Masochisten! Und außerdem besteht die Gruppe der Frühsport-Fitness-Menschen aus ganz besonderen Typen – ein kleines Augenzwinkern ist hier inklusive, niemand sollten den Gym-Alltag zu ernst nehmen, dafür ist er oft viel zu kurios:

Der Manager

Kommt strahlend in die Männerumkleide und freut sich, dass das Parkhaus um die Zeit noch so schön leer ist, „hab den neuen A8 jetzt als Dienstwagen, ist nicht so wendig irgendwie, da baut BMW dann doch anders, hab sie mir deswegen jetzt auch in mein Aktien-Portfolio gepackt, die Bayern“. Hat gestern Abend noch sein Hemd und Jackett aus der Reinigung geholt, hängt die in Zellophanfolie verpackte Kleidung in seinen Spind.

Anzeige

Gibt beim Umziehen ungefragt der gesamten Belegung die Nachrichten des Morgens wieder, „ich höre auf dem Weg hierher immer Deutschland-Funk Kultur“. Trainiert im dezenten, aber teuren Funktionsshirt und mit Airpods in den Ohren. Erledigt während der Satzpausen die ersten Telefonate des Tages – und auch mal in der Brustpresse oder am Kabelturm. Nach 30 Minuten winkt er einmal in Runde und ruft: „Ich muss meinen Flieger nach London kriegen, Meeting, trainiere morgen im Hotel-Gym. Bis bald!“

Der Türsteher

Kommt direkt nach der Schicht am Einlass eines In-Klubs. Zieht routiniert und konzentriert sein Programm durch. Hohe Gewichte, niedrige Wiederholungszahl. Hat in der Nacht so oft „Heute nur geschlossene Gesellschaft“ und „Hallo die Damen, viel Spaß!“ gesagt, dass er jetzt so gar keinen Bock mehr auf Reden hat.

Dicker Bizeps und Tattoos - Türstehertyp Quelle: dpa-infocom GmbH

Trägt im Training je nach Laune ein Gold’s-Gym-Tanktop oder einen Gorillawear-Hoodie. Benutzt als einziger die 50-Kilo-Kurzhanteln. Schaut irritiert, wenn der Manager mit ihm beim Hinausgehen abklatschen will.

Der München-Hipster

Mitte dreißig, trainiert im Philipp-Plein-Glitzer-Shirt. Zieht eine Tom-Ford-Parfüm-Wolke hinter sich her und drückt die Gewichte immer mit Blick Richtung der Frauen in der Cardio-Ecke. Prüft alle paar Sekunden, ob seine Sport-Kopfhörer in Neonfarben noch richtig im Nacken sitzen. Hat um sich herum einen wirren Zirkel aus Steppern, TRX-Bändern und einer Gummimatte gebaut und macht beinahe ausschließlich Übungen mit dem eigenen Körpergewicht. „Nur so wird die Tiefenmuskulatur effektiv angeregt, und das ist sowieso viel besser für die Gelenke. Ich will ja einfach nur fit sein und keine Muskelberge bekommen.“ Zieht sich jede Woche einen neuen Plan von Gymondo auf sein Smartphone. Trainiert rund 20 Minuten und dehnt sich danach rund 30 Minuten mit der Blackroll. Föhnt sich dann die Haare, wirft seinen Fellkragen-Daunen-Parka und den Fendi-Schal über und radelt mit dem Single-Speed-Rad zum nächsten Pitch.

Die Porsche-Rentnerin

Parkt ihren roten Luxusflitzer immer direkt am Eingang und ist bereits am frühen Morgen durchgestylt: Glitzer-Nicki-Anzug, Lippenstift, in der Hand den ersten Coffee to go. Das Studio ist für sie eine Art Lounge. Erst mal an die Bar setzen, Zeitung lesen, Make-up im Spiegel checken. Danach zum Yoga-Kurs, dann auf Empfehlung ihrer Personal-Trainerin ein paar Dehnübungen auf der Vibrationsplatte absolvieren. Im Anschluss gönnt sie sich einen Chia-Samen-Acaí-Beeren-Mandelmilch-Shake an der Bar.

Das Influencer-Paar

Sie: dunkelhaarig, jung und hübsch.

Er: blond, jung und hübsch.

Anzeige

Sie: filmt ihn bei jeder Übung für ihre Instagram-Story.

Er: filmt sie bei jeder Übung für ihre Instagram-Story.

Streiten sich im Laufe des Trainings vor allen anderen Trainierenden, weil ihre Outfits ihrer Meinung nach farblich heute nicht gut abgestimmt sind. Am Ende des Trainings geht sie live und erklärt ihren Followern, mit welchem Code es bei welchem Online-Shop heute Rabatt gibt. Und er stellt sich mit Denker-Blick vor die Beinbeuger-Maschine, macht ein Selfie und postet das Bild mit der Unterschrift: „Your only limit is you.“

Besser kann ein Tag nicht starten.

Dieser Artikel wurde erstmals im Februar 2019 veröffentlicht.",Julien Wolff,1599052620,"Fitness,Im Fitnessstudio",welt
Welche Test-Variante ist die sicherste?,,Pia Heinemann,1599052384,"Gesundheit,Corona-Tests",welt
