title,text,author,published,tags,source
Nie zuvor verschmolzen zwei so große Schwarze Löcher,"Anzeige

Vor rund sieben Milliarden Jahren – damals war das Universum erst halb so alt wie heute – verschmolzen zwei Schwarze Löcher zu einem riesigen Schwarzen Loch, dessen konzentrierte Masse 150 Sonnenmassen entspricht. Bei dieser Fusion wurde eine gigantische Energiemenge in Form von Gravitationswellen abgestrahlt.

Diese Welle wurde am 21. Mai 2019 von den beiden Ligo-Detektoren in den USA und dem Virgo-Detektor in Italien empfangen. Diese Messungen und deren astrophysikalische Bedeutung stellen die beteiligten Wissenschaftler jetzt in den Journalen „Physical Review Letters“ und „Astrophysical Journal Letters“ vor.

Die Forscher sprechen vom „bislang dicksten Fisch“, der ihnen mit den Gravitationswellendetektoren Ligo und Virgo ins Netz gegangen sei. Nie zuvor haben sie die Fusion von zwei so massereichen Schwarzen Löchern beobachten können. Zudem ist es das bislang am weitesten von der Erde entfernte Ereignis, das sie mit ihren empfindlichen Messgeräten registrieren konnten.

Anzeige

Zwischen diesen beiden Rekorden gibt es einen logischen Zusammenhang: Nur weil bei der Fusion von zwei so massereichen Objekten eine sehr große Energiemenge abgestrahlt wurde – die der Energie von sieben Sonnenmassen entspricht –, konnten die Gravitationswellen noch nach ihrer Reise von sieben Milliarden Lichtjahren von irdischen Detektoren aufgefangen werden.

Lesen Sie auch Gravitationswellen Das „Einstein Teleskop“ könnte bei Aachen gebaut werden

Lesen Sie auch Brand Story Naturschutz Er schützt den Urwald mit alten Handys Anzeige

Das registrierte Signal war ziemlich kurz: Es wurde von den drei beteiligten Detektoren nur rund eine Zehntelsekunde lang gemessen – was zwei gegenseitigen Umläufen der beiden Schwarzen Löcher entspricht. Während dieser kurzen Zeit stieg die Frequenz des Signals von 30 auf 80 Hertz, bevor es abrupt mit der Verschmelzung der Objekte endete.

„Von Anfang an stellte uns dieses sehr kurze Signal vor Herausforderungen, als wir seinen Ursprung identifizieren wollten“, sagt Professor Alessandra Buonanno, Direktorin am Max-Planck-Institut für Gravitationsphysik in Potsdam, „doch trotz seiner kurzen Dauer konnten wir zeigen, dass dieses Signal genau dem entspricht, was wir nach der Allgemeinen Relativitätstheorie von Albert Einstein von verschmelzenden Schwarzen Löchern erwarten.“

Lesen Sie auch Gravitationswellen Wie ein schwarzes Loch einen Neutronenstern verschlingt

Anzeige

Und so konnten die Forscher aus dem zwar kurzen, dafür aber sehr lauten Signal auch die Massen der beiden Schwarzen Löcher ermitteln. Das eine barg 66 und das andere 85 Sonnenmassen in sich. Durch die Fusion entstand ein massereicheres Schwarzes Loch mit 142 Sonnenmassen.

Dass sich dieser Wert nicht einfach aus der Summe der beiden Ursprungsmassen ergibt, liegt daran, dass beim Verschmelzungsvorgang Energie freigesetzt wird. Die mit GW190521 registrierte Fusion ist die erste direkte Beobachtung der Geburt eines mittelschweren Schwarzen Loches.

Wissenschaftlich besonders interessant ist, dass es ein Schwarzes Loch mit der 85-fachen Masse unserer Sonne nach den heutigen Theorien als Ergebnis einer Sternenexplosion gar nicht geben dürfte.

Anzeige

„Nach unserem Verständnis davon, wie Sterne altern und sich entwickeln, erwarten wir, dass wir Schwarze Löcher mit entweder weniger als 65 Sonnenmassen oder mehr als 135 Sonnenmassen finden, aber keine dazwischen“, erklärt Frank Ohme, Leiter einer Max-Planck-Forschungsgruppe am Albert-Einstein-Institut (AEI) in Hannover. „Das Schwarze Loch mit 85 Sonnenmassen im Ursprungssystem von GW190521 fällt genau in diese Lücke, wo es nicht sein sollte! Das kann zwei Dinge bedeuten: Unser Verständnis der Sternentwicklung ist unvollständig, oder hier hat sich etwas anderes ereignet.“

Alessandra Buonanno geht indes davon aus, „dass das massereichere der beiden Schwarzen Löcher höchstwahrscheinlich selbst aus einer früheren Verschmelzung eines Doppelsystems hervorgegangen ist“. Es könnte also sein, dass die Forscher mit der von GW190521 gesendeten Kurznachricht eine neue Klasse von Doppelsystemen aus Schwarzen Löchern entdeckt haben.

Lesen Sie auch Kosmologie So wird das Weltall sterben

„Wir wissen noch nicht, ob das so ist“, sagt Karsten Danzmann, Direktor am AEI Hannover und Direktor des Instituts für Gravitationsphysik der Leibniz Universität Hannover. „Bald, wenn wir alle Verschmelzungen Schwarzer Löcher analysiert haben, die Ligo und Virgo in ihrem dritten Beobachtungslauf beobachtet haben, wissen wir hoffentlich mehr.“",Norbert Lossau,1599052198,"Wissenschaft,Gravitationswellen registriert",welt
21 Minuten Flug im Privatjet – So läuft der Deutschland-Besuch von Elon Musk,"Der Tesla-Chef gibt sich öffentlich gern als Klimaretter und preist die CO2-Bilanz seiner Elektroautos. Doch bei seinem Besuch in Deutschland nutzt Elon Musk selbst für kürzeste Strecken einen eigenen Jet. Das Modell ist selbst für einen Privatflieger ungewöhnlich.

Überraschend hat Elon Musk der Firma Curevac einen Besuch abgestattet. Zuletzt ging ihn sogar Bill Gates an, er hätte keine Ahnung von der Corona-Pandemie – doch Musk hatte einen guten Grund für den Besuch in der Tübinger Biotechfirma.

Anzeige

Glaubt man den Worten von Elon Musk, geht es dem Tesla-Chef nicht in erster Linie darum, möglichst viele Autos zu verkaufen. Immer wieder hat Musk in der Vergangenheit von seiner Mission gesprochen: Angeblich geht es ihm vor allem darum den Planeten, mindestens aber die Menschheit zu retten.

Die Elektroautos sind in dieser Vision vor allem Mittel zum Zweck: Sie sollen den Ausstoß von Treibhausgasen im Verkehr reduzieren, um den menschengemachten Klimawandel zu stoppen oder wenigstens zu verlangsamen.

Doch ausgerechnet Musks Besuch in Deutschland in dieser Woche zeigt, dass er es selbst mit dem Klimaschutz nicht besonders ernst meinen kann. Seit Montag fliegt der Tesla-Chef nämlich kreuz und quer über Deutschland – und das auch noch im Privatjet.

Lesen Sie auch E-Revolution Das Mysterium hinter Tesla

Anzeige

Der Flieger mit der Kennung N628TS, gehört zwar nicht Musk persönlich, sondern der Firma Falcon Landing Llc. Die hat ihren Sitz an der gleichen Adresse, wie Elon Musks Raumfahrtunternehmen SpaceX. Der Tesla-Chef nutzt das Flugzeug regelmäßig selbst.

Musk hatte seinen Besuch in Deutschland per Tweet angekündigt, als der Privatjet bereits in der Luft war und von Los Angeles mit einem kurzen Stopp in Großbritannien nach Frankfurt-Hahn flog.

21 Minuten Flugzeit von Frankfurt nach Stuttgart

Von dem Flugplatz, den sonst vor allem die Passagiere von Billigfluglinien wie Ryanair kennen, die häufig von Frankfurt-Hahn starten, braucht man nur eine knappe Stunde mit dem Auto bis nach Prüm. In dem kleinen Ort in der Eifel sitzt die erste Tesla-Tochterfirma in Deutschland: Tesla Grohmann Automation.

Anzeige

Musk hatte die Spezialfirma für Maschinenbau bereits vor Jahren gekauft. Nun soll sie bei einem weiteren Projekt des Tesla-Chefs helfen, für das er nach eigener Auskunft nach Deutschland gekommen ist: eine Kooperation mit dem Impfstoff-Hersteller CureVac.

Lesen Sie auch Blackouts in den USA Der Strom wird knapp – jetzt greift eine deutsche Solarfirma Elon Musk an

Musk will Tesla Grohmann Automation sogenannte RNA-Drucker herstellen lassen, mit denen ein möglicher Impfstoff hergestellt werden soll. Sogar ein gemeinsames Patent dafür haben das deutsche Unternehmen und die Amerikaner dafür angemeldet.

Musk wollte jedoch nicht nur in der Eifel nach dem Rechten sehen, sondern auch beim CureVac-Management in Tübingen vorbeischauen. Und das führt zu einem ziemlich gewaltigen CO 2 -Fußabdruck, den Musk bei seinem Deutschland-Besuch hinterlässt. Denn der Tesla-Chef nahm auch für die Strecke von Frankfurt nach Stuttgart offenbar seinen Privatjet.

An dieser Stelle finden Sie Inhalte aus Twitter Um mit Inhalten aus Twitter und anderen sozialen Netzwerken zu interagieren oder diese darzustellen, brauchen wir Ihre Zustimmung. Soziale Netzwerke aktivieren

Anzeige

Der Flieger hob am Dienstag um 15.15 Uhr in Frankfurt-Hahn ab und landete nach nur 21 Minuten Flug auf dem Flughafen in Stuttgart. Dort blieb er ziemlich genau fünf Stunden lang stehen.

Erst um 22.51 Uhr hob das Flugzeug mit der Kennung N628TS erneut ab und landete 46 Minuten später auf dem Flughafen Berlin-Schönefeld. Es war der dritte Stopp, den Musk in seinem Tweet bereits angekündigt hatte, denn unweit vom Flughafen entsteht gerade im brandenburgischen Grünheide die erste europäische Tesla-Fabrik.

An dieser Stelle finden Sie Inhalte aus Twitter Um mit Inhalten aus Twitter und anderen sozialen Netzwerken zu interagieren oder diese darzustellen, brauchen wir Ihre Zustimmung. Soziale Netzwerke aktivieren

Allerdings wird Musk dort viele Elektroautos bauen müssen, um allein den CO 2 -Ausstoß seines Kurztrips durch ganz Deutschland zu kompensieren. Flüge mit Privatjets gelten als besonders klimaschädlich, da bei relativ hohem Ausstoß von Treibhausgasen nur wenige Personen transportiert werden.

Und Elon Musk fliegt gewissermaßen mit dem Rolls-Royce der Privatjets: Es handelt sich bei dem Flugzeug um eine Gulfstream G650ER.

Der Hersteller wirbt mit purem Luxus über den Wolken. Sitzend können bis zu 19 Passagiere transportiert werden, wollen die Fluggäste schlafen, bietet die Maschine Platz für zehn Menschen. Fast 14.000 Kilometer Reichweite hat das Flugzeug – ungewöhnlich viel für einen Privatflieger.

Eine Gulfstream G650ER: Das Flugzeug ist eines der wenigen Privatjets, dass Transatlantikflüge bewältigen kann Quelle: Getty Images

So schafft man es auch von der US-Westküste ohne Zwischenstopp bis nach Europa. Möglich machen das zwei Triebwerke vom Typ BR725 von Rolls-Royce, denen für die maximale Distanz knapp 22 Tonnen Kerosin zur Verfügung stehen.

Ein gewaltiger CO 2 -Fußabdruck, den Musk schon hätte reduzieren können, indem er statt auf eine private Maschine auf einen Linienflug über den Atlantik gesetzt hätte, mit dem nicht zehn, sondern ein paar Hundert Passagiere transportiert worden wären.

Auch ein Linienflug von Stuttgart nach Berlin hätte nur einen Bruchteil der klimaschädlichen Abgase produziert. Alternativ hätte Musk natürlich auch eines seiner Elektroautos benutzen können oder den Zug. Die Bahn schafft es in gut zwei Stunden von Frankfurt nach Stuttgart – der Zeitverlust wäre also überschaubar geblieben, der positive Effekt fürs Klima dafür umso größer.

Lesen Sie auch Erfolgscode der Superreichen Mit der Milliardärsformel erlangen Sie Wohlstand in drei Schritten",Philipp Vetter,1599051997,"Wirtschaft,Tesla-Chef",welt
Rasen düngen - Das müssen Sie beachten,,"'Annalena Griem', 'Claudia Enders'",1599051180,"garten,Gartenpflege",welt
Das zeichnet ein Handy mit guter Kamera aus,"Anzeige

Jederzeit überall gute Fotos machen können, ohne dafür eine Kamera mit sich herum zu tragen – inzwischen ganz normal für uns. Smartphone-Hersteller entwickeln immer leistungsstärkere Kameras mit beeindruckenden Funktionen, die in vielen Situationen sogar bereits teure Spiegelreflexkameras ersetzen können. Allerdings ist für Laien nicht immer ersichtlich, was ein Handy mit guter Kamera ausmacht. Erfahren Sie hier, worauf beim Kauf zu achten ist, damit Sie möglichst lange Freude am neuen Smartphone haben.

Gute Handykamera: Wodurch zeichnet sie sich aus?

Um gute Fotos zu machen, sind mehrere Aspekte von entscheidender Bedeutung: Zum Einen braucht es eine gute Auflösung – eine hohe Pixelanzahl ist somit ein Indikator, an dem man ein Handy mit guter Kamera erkennt. Doch das allein reicht noch nicht, denn es braucht auch einen leistungsstarken Bildsensor, der die gesammelten Informationen verarbeiten kann. Bei Smartphones muss dieser allerdings meist klein und flach ausfallen, was dazu führt, dass bei vielen günstigen Modellen trotz hoher Megapixel-Angaben die Fotoqualität zu wünschen übrig lässt.

Aber auch Begriffe wie Belichtungskorrektur, ISO und Weißabgleich spielen heutzutage eine wichtige Rolle beim Fotografieren mit Smartphones und sind deshalb nicht nur für versierte Fotografen entscheidend. Viele Einstellungen übernimmt ein Handy mit guter Kamera inzwischen automatisch, indem es die Lichtverhältnisse vor dem Auslösen analysiert. Dazu zählt auch der elektronische Bildstabilisator, der bei Bedarf die Verschlusszeit verkürzt, um ein Verwackeln zu vermeiden. Zudem hilft bei vielen Modellen ein Autofokus, um möglichst scharfe Bilder zu erzielen. Zusätzlich können auch Handy-Gadgets wie zusätzliche Objektive oder ein Stativ hilfreich sein,wenn man professionelle Fotos mit dem Smartphone aufzunehmen möchte.

Anzeige

Darüber hinaus ist die HDR-Funktion (High Dynamic Range) ein Indiz dafür, dass ein Smartphone gute Fotos liefern kann: Wenn die Belichtungskorrektur an ihre Grenzen kommt, können zu dunkle oder zu helle Bildbereiche dadurch angepasst werden – die Handykamera nimmt mehrere Fotos auf und kombiniert sie, sodass ein korrekt belichtetes Foto entsteht. Eine gute Handykamera hat inzwischen aber auch meist zusätzliche Linsen, die beispielsweise Weitwinkelaufnahmen ermöglichen, einen Bokeh-Effekt kreieren oder den digitalen Zoom unterstützen können. Sollen zudem professionelle Videos gedreht werden, ist es von Vorteil, wenn die Clips in hochauflösendem 4K oder zumindest in Full HD aufgenommen werden können.

Anzeige Jetzt Prime gratis testen und Schnäppchen finden

Handy mit guter Kamera: Die Top-Modelle

Derzeit zählt unter anderem das Samsung Galaxy S20 Ultra 5G* dank zahlreicher nützlicher Features zu den Favoriten. Seine Triple-Kamera liefert Nutzern ein Ultraweitwinkelobjektiv sowie ein Teleobjektiv, sodass sowohl professionelle Landschaftsaufnahmen als auch weiter entfernte Schnappschüsse gelingen. Mit der Frontkamera kann zudem der beliebte Bokeh-Effekt erzielt werden – ein Plus für alle Selfie-Liebhaber.

Anzeige Samsung Samsung Galaxy S20 Ultra 5G online kaufen

Was Nachtaufnahmen angeht, kann das Huawei P40 Pro* sogar noch überholen: Die Vierfach-Kamera in Kombination mit dem 50-Megapixel-Hauptsensor kann auch bei schlechten Lichtverhältnissen noch atemberaubende Fotos liefern. Darüber hinaus loben Nutzer den Bokeh-Effekt im Porträtmodus sowie den 50-fachen Zoom, mit dem sogar durchaus ansehnliche Bilder vom Mond gelingen. Der sogenannte Time-of-Flight-Sensor sorgt dafür, dass das Handy detaillierte Infos über die Distanz zum Motiv nutzen kann, um noch realistischere Aufnahmen zu machen. Dank des Bildstabilisators werden auch Videos noch besser – gerade bei Aufnahmen auf Konzerten oder bei rasanten Sportereignissen ein absolutes Plus.

Anzeige Huawei Huawei P40 Pro 256GB Handy online kaufen

Anzeige

Ebenfalls vorn dabei: das iPhone 11 Pro*. Das Smartphone hat ein Drei-Kamera-System mit jeweils 12 Megapixeln und ermöglicht Weitwinkel- und Teleaufnahmen. Auch mit der Frontkamera sind Bokeh- und Porträtaufnahmen möglich.

Anzeige Apple iPhone 11 Pro online kaufen

Günstiges Handy mit guter Kamera: Die besten Schnäppchen-Modelle

Ein Smartphone mit guter Handykamera muss nicht unbedingt teuer sein – bei den No-Name-Produkten, die im Netz erhältlich sind, gibt es einige erwähnenswerte Modelle, die durchaus tolle Fotos machen können. Natürlich sollte man gerade bei einem Handy unter 100 Euro keine Wunder erwarten, doch auch Schnäppchen-Modelle wie das Blackview A60* können Einsteigern bereits eine erstaunlich gute Fotoqualität bieten. Die verbaute Dual-Kamera (mit 13 und zwei Megapixeln) erzeugt einen Tiefenschärfeeffekt und das weiche Licht der Fünf-Megapixel-Frontkamera schmeichelt beim Aufnehmen von Selfies.

Tipp: Ein günstiges Handy mit guter Kamera ohne Vertrag – so wie das Blackview A60* – eignet sich auch für Kinder und Jugendliche, die sich ein eigenes Handy wünschen.

Anzeige Blackview Blackview A60 (2019) online kaufen

Anzeige

Etwas teurer, aber noch immer ein vergleichsweise günstiges Handy mit Top-Kamera: das Xiaomi Mi Note 10*. Die Triple-Kamera des chinesischen Smartphones liefert dank 108MP ultrahochauflösende Penta Rückkamera und dem Kamera-Sensor S5KHMX von Samsung detailreiche Aufnahmen. Aber auch die Frontkamera mit 32 Megapixeln ermöglicht professionelle Fotos, die der Hauptkamera fast in nichts nachstehen.

Anzeige Xiaomi Xiaomi Mi Note 10 jetzt online kaufen

Auch das Huawei Mate 20 Pro* ist aufgrund seines vergleichsweise moderaten Preises ein Mittelklasse-Smartphone mit guter Kamera. Die intelligente Leica-Triple-Kamera liefert beeindruckende Weitwinkel-, Ultraweitwinkel- sowie Teleaufnahmen und sogar herausragende Makro-Fotos sind möglich. Auch bei wenig Licht gelingen gute Aufnahmen, die selbst das noch mehr als doppelt so teure iPhone XS Max in den Schatten stellen.

Anzeige Huawei Mate 20 Pro 128GB Handy online kaufen

Kleines Smartphone mit guter Kamera

Das UMIDIGI A5 Pro* mit einer Displaygröße von 6,3 Zoll liegt gut in der Hand und liefert, verglichen mit anderen Produkten seiner Preisklasse und Größe, bei guten Lichtverhältnissen durchaus brillante Bilder. Natürlich ist die Kamera des kleinen Smartphones nicht mit High-End-Produkten von Huawei, Apple und Samsung zu vergleichen, wer allerdings ein Einsteiger-Smartphone mit guter Kamera sucht, ist damit aber allemal gut beraten.

Anzeige Andriod-Smartphone UMIDIGI A5 Pro jetzt online kaufen

Smartphone mit Bildstabilisator

Beim Handykauf sollten Sie beachten, dass ein Smartphone mit Bildstabilisator die Qualität der Bilder deutlich verbessern kann. Bei Top-Modellen ist diese Funktion inzwischen Standard. Ein empfehlenswertes Modell ist daher auch das HTC One A9* mit optischem Bildstabilisator – bewegliche Objektivlinsen gleichen Verwackeln aus und vermeiden somit Unschärfe im Bild. Im Gegensatz zum elektronischen Bildstabilisator kann diese Technologie auch das Bildrauschen vermindern.

Anzeige HTC HTC ONE A9 online kaufen





Dieser Artikel wurde erstmals am 07.08.2019 veröffentlicht.



*Dieser Text enthält Affiliate Links. Das bedeutet: Sollten Sie über die mit einem Stern gekennzeichneten Links einen Kauf abschließen, erhält WELT eine kleine Provision. Die Berichterstattung beeinflusst das nicht. Unsere Standards der Transparenz und journalistischen Unabhängigkeit finden Sie unteraxelspringer.de/unabhaengigkeit.



",Kristina Baum,1599050940,"technik,Tipps für den Smartphone-Kauf",welt
So sieht die neue Mercedes S-Klasse von innen aus,"Der Fortschritt kommt manchmal mit großen Sprüngen, aber manchmal auch in Form von eher unscheinbaren Verbesserungen. Die Kuschelkissen an den Kopfstützen der Rücksitze gab es auf Wunsch schon im Vorgängermodell, in der neuen S-Klasse kann man sie nun auch beheizen. Vor allem bei den Kunden in China waren die Pölsterchen so gut angekommen, dass die Mercedes-Ingenieure lange darüber nachgedacht haben, wie man sie optimieren könne. Nun wärmt ein integriertes Heizgewebe, das bei Bedarf über die Sitzheizung aktiviert wird, den Nacken und den Hinterkopf der Passagiere.",Heiko Zwirner,1599050680,"Unterwegs,Luxuslimousine",welt
