title;text


Empört über seine plötzliche Entlassung: Friedrich

So sei Friedrich laut Friedrich zu zögerlich bei der  Aufarbeitung der Fehler bei der Aufklärung der NSU-Morde. Zudem entlasse  er willkürlich altgedientes Personal, verteidige den Staatstrojaner, sabotiere die Islamkonferenz und habe auch sonst sein Ressort nicht  im Griff.
"Kurz nach seiner Entlassung hat Friedrich die Vorwürfe empört zurückgewiesen: """"Die Beschuldigungen des Innenministerums sind völliger Unfug. Ich habe stets nach bestem Wissen und Gewissen gehandelt. Vielleicht war ich dem feinen Herrn Innenminister einfach zu unbequem."""""
Während Vertreter der Opposition die Personalentscheidung des Innenministers grundsätzlich begrüßen," gibt es auch Kritik. Viele halten seine Entlassung lediglich für ein """"Bauernopfer""""", um Bundeskanzlerin Angela Merkel zu schützen, die Friedrich überhaupt erst ins Amt gehoben hatte. Foto links: Freud, CC BY-SA 3.0, Foto rechts:  Freud," CC BY-SA 3.0"""
"Bundesverfassungsgericht erklärt Regierung für verfassungswidrig und übernimmt selbst;""Irgendwann ist es einfach genug: Das Bundesverfassungsgericht hat heute die Regierung Merkel für verfassungswidrig erklärt und mit sofortiger Wirkung entlassen. Bis zur nächsten Bundestagswahl wird nun das Gericht aus Karlsruhe selbst die Regierungsgeschäfte übernehmen. Die Richter wollen die Zeit für die Verabschiedung dringend nötiger Gesetze nutzen", die auch vor ihnen selbst Bestand haben.

Andreas Voßkuhle, der Präsident des Bundesverfassungsgerichts und damit auch neuer Bundeskanzler, begründete die vorübergehende Einführung einer Jurokratie gegenüber dem Postillon mit der offensichtlichen Unfähigkeit der Regierung, sich an das Grundgesetz zu halten.


Von l. nach r.: Justizminister, Justizminister, Justizministerin, Kanzler, Justizminister, Justizministerin, Justizminister, Justizministerin

"Voßkuhle: """"Nachdem wir in den letzten Jahren die Höhe der Hartz-IV-Sätze korrigieren mussten", zweimal das Wahlrecht für verfassungswidrig erklärt haben, mehrfach die Regierung gerügt haben, weil sie die Rechte des Parlaments verletzt hat, festgestellt haben, dass das Existenzminimum auch für Asylbewerber gilt und gerade noch ausknobeln müssen, ob ESM und Fiskalpakt verfassungskonform sind, haben wir uns überlegt," dass wir den ganzen Mist am besten gleich selbst machen."""" "
Aufgrund des bereits 2009 fehlerhaften Wahlrechts sei die Absetzung der aktuellen Regierung juristisch ohnehin kein Problem gewesen.
Die neue Richterregierung steht bereits: Ab sofort wird der 1. Senat (Foto oben) des Bundesverfassungsgerichts die Aufgaben des Bundestages und des Bundesrates erfüllen, während der 2. Senat (Foto rechts) die wichtigsten Ministerien übernimmt. Voßkuhle selbst wird an der Spitze der Regierung stehen.
"Neben der Korrektur der bereits genannten fehlerhaften Gesetzgebung der Vorgängerregierungen plant die Bundesverfassungsregierung weitere Maßnahmen. So sollen noch vor den Wahlen die Löhne für Richter erhöht und Jura als Pflichtschulfach ab der ersten Klasse eingeführt werden. Außerdem soll das Lachen über alberne rote Roben mit weißem Latz künftig mit drakonischen Strafen geahndet werden. Fotos: Bundesverfassungsgericht"""
"Europaweiter Jubel: Politiker beenden Krise durch effektive Maßnahme;""Gute Nachrichten! Die seit Jahren andauernde europäische Banken- und Wirtschaftskrise wurde heute durch eine effektive politische Maßnahme endlich beendet. In Brüssel gratulieren sich zur Stunde die Staatschefs der Eurozone gegenseitig zu der einfachen und brillanten Idee", mit der sie alle  Probleme auf einen Schlag lösen konnten. Währenddessen feiert das Volk überall auf dem Kontinent. 



Ihnen gebührt der Dank aller Europäer: Politiker

Das Ergebnis der erfolgreichen Krisenbewältigung kann sich sehen lassen: Griechenland, Irland und Portugal sind - wie auch alle anderen Euroländer - endlich wieder schuldenfrei, spanische und italienische Banken solventer als je zuvor. Auch die Hypo Real Estate  wirft satte Gewinne ab. Es gibt keine Verlierer.
Kein Wunder also, dass in den Hauptstädten Europas, in denen schon bald wieder Vollbeschäftigung herrschen wird, begeisterte  Bürger die Namen ihrer Staatsoberhäupter und Finanzminister skandieren.
Dabei sah lange Zeit alles danach aus, als wären die europäischen  Politiker zu machtlos oder zu inkompetent, um funktionierende Rezepte  gegen die Krise zu entwickeln. Zahllose Manöver wie Rettungsschirme, ESM, ESFS, Austeritätspolitik und Reformen der Finanzaufsicht scheiterten krachend, bevor endlich die effektive und gleichzeitig für alle verständliche Maßnahme gefunden und angewandt wurde, die jetzt das Ende der Krise eingeleitet hat.


Endlich gerettet und wieder stabil: Der Euro

"Es war ja auch wirklich an der Zeit"""""," sagte der Vorsitzende der Eurogruppe Jean-Claude Juncker dem Postillon. """"Wir Politiker stünden als Totalversager da"," wenn wir nach all den Jahren keine Lösung parat gehabt hätten. Dafür werden wir doch gewählt und bezahlt."""" Nun", so Juncker, könne man sich endlich wieder so dringlichen Themen wie etwa dem Umweltschutz, der Sicherung persönlicher Freiheiten, der Armutsbekämpfung oder der Bildung widmen.
Auf die Frage, welche Maßnahme genau jetzt eigentlich die Krise beendet habe," antwortete Juncker: """"Heute ist ein Tag um zu feiern. Wie wir das genau angestellt haben"," erkläre ich Ihnen gerne morgen."""" Foto links unten: © Eisenhans - Fotolia.com"""
"Verfassungsschutz wird künftig von Horde Schimpansen geführt;""Nach dem Versagen der Verfassungsschutzbehörden bei der Aufklärung der NSU-Morde soll der Inlandsgeheimdienst komplett umgekrempelt werden. Als wahrscheinlichstes Szenario gilt zum jetzigen Zeitpunkt", dass sämtliche Mitarbeiter des Verfassungsschutzes sukzessive entlassen und durch eine Horde Schimpansen ersetzt werden. Diese würden Experten zufolge bessere Arbeit bei geringeren Kosten leisten. 

"Hans-Peter Friedrich (CSU) bestätigte diese Pläne heute bei einer Pressekonferenz: """"Wir haben bereits damit begonnen"," erste Schlüsselpositionen willkürlich mit Schimpansen zu besetzen und verzeichnen seitdem eine Effizienzsteigerung von 234 Prozent""""", so der Innenminister," der von den neuen Geheimdienstmitarbeitern schwärmt. """"Schimpansen sind einfach von Natur aus besser für den Verfassungsschutz geeignet als Menschen. Sie vernichten deutlich seltener wichtige Akten und treffen allein schon aus Gründen des Zufalls hin und wieder auch richtige Entscheidungen im operativen Geschäft."""""


"Er soll den Thüringer Verfassungsschutz (künftig """"Veraffungsschutz"""") reformieren: Coco Straboni"

Besonders wichtig sei außerdem, dass Schimpansen nicht dazu neigen," die Gefahren von Rechts zu verharmlosen und überdies mit deutlich weniger Sold auskommen als die bisherigen Mitarbeiter. """"Eine Kiste Bananen im Monat reicht""""", so Friedrich.
Coco Straboni (34), ein Schimpanse mit langjähriger Berufserfahrung im Werfen von Fäkalien, hat einen Umschlag erhalten," laut dem er künftig den besonders stark kritisierten Thüringer Verfassungsschutz anführen wird. Gegenüber dem Postillon erklärte er: """"Oh", oh, oh. Aaaaah, aaaaaah," aaaaaah! Huhuhu? Uff."""" Damit beweist er", dass er deutlich mehr von seiner Arbeit versteht als etwa der ehemalige Thüringer Verfassungsschutzchef Helmut Roewer.
Sollte der Einsatz von Schimpansen in von Inkompetenz durchsetzten Institutionen Schule machen, könnten sie künftig auch das Innenministerium," die Redaktion der """"Bild""""-Zeitung sowie die Führung der FIFA übernehmen. Fotos oben: © Fotolia.com (Affen)", Foto rechts: © Lucky Dragon - Fotolia.com (Hut), Thomas Lersch," CC BY-SA 3.0 (Coco)"""
Petition, dass Politiker regelmäßig Backpfeifen erhalten," erreicht Quorum in 57 Sekunden;""Noch nie hat eine Online-Petition so schnell das benötigte Quorum erreicht wie die sogenannte Backpfeifen-Petition. Sie sieht vor", dass künftig alle 620 Abgeordneten des deutschen Bundestages regelmäßig eine zünftige Backpfeife erhalten sollen – es sei denn, der oder die Betroffene äußert einen deutlichen Widerspruch dagegen. Nur 57 Sekunden nachdem die Petition eingereicht wurde, fanden sich bereits über 50.000 Unterzeichner.

Dass seine Eingabe so schnell das nötige Quorum erreichen konnte, freut Frank Tafler (35). Der besorgte Bürger wollte eigentlich nur seiner Empörung hinsichtlich des neuen Meldegesetzes Luft machen. Nun soll er in einer öffentlichen Sitzung des Petitionsausschusses angehört werden und seine Gründe dafür vortragen, warum Politiker künftig regelmäßig vom Bürger abgewatscht werden sollen. 


Hätte eine Backpfeife besonders verdient: Uhl

Die Farce rund um das Meldegesetz verdeutlicht, dass zünftige Backpfeifen durch den Souverän dringend nötig sind, um Politiker daran zu erinnern," wer hier eigentlich der Boss ist"""""," so Tafler. """"Für die betroffenen Politiker ist das ohnehin ein Fortschritt. Immerhin gab es in vielen Bundesländern bislang überhaupt keine verbindlichen Regeln"," welchem Politiker wann eine gepfeffert werden durfte."""""
Außerdem hätten die Politiker die Möglichkeit, Widerspruch gegen die Ohrfeigen einzulegen. Allerdings gilt dieses Widerspruchsrecht nicht," wenn abzuwatschende """"Volksvertreter"""" es wirklich verdient haben – etwa weil sie während eines EM-Halbfinales für ein Gesetz gestimmt haben", für das nun keiner mehr verantwortlich sein will. Foto oben: © unitypix - Fotolia.com

"Nachtrag: Ein Leser hat die Petition inzwischen wirklich gestartet"""
"Innenministerium lässt Verfassungsschutz vom Verfassungsschutz beobachten;""Nach dem Rücktritt von Verfassungsschutzpräsident Heinz Fromm hat Innenminister Friedrich (CSU) drastische Maßnahmen angekündigt", um weitere Skandale innerhalb der Behörde ausschließen zu können: Der Verfassungsschutz soll künftig unter strenge Beobachtung des Verfassungsschutzes gestellt werden. Auch ein anschließendes Verbotsverfahren sei bei entsprechender Beweislage nicht ausgeschlossen.

"Hans-Peter Friedrich präzisierte seine Pläne heute bei einer Pressekonferenz: """"Glücklicherweise war uns der Verfassungsschutz schon lange verdächtig. Deshalb ist es uns bis zum heutigen Tag gelungen", rund 2640  Mitarbeiter des Verfassungsschutzes in den Verfassungsschutz  einzuschleusen. Die brennen schon darauf, sich gegenseitig auf Schritt und Tritt zu beobachten, um herauszufinden," ob sie eine Gefahr für die Demokratie sind."""" "


Fleißiger Verfassungsschützer bei der Arbeit

Bislang hatte sich die Beobachtung des Verfassungsschutzes durch den  Verfassungsschutz nur darauf beschränkt, öffentlich zugängliche  Dokumente und Zeitungsberichte über den Verfassungsschutz auszuwerten. 
Sollten sich durch die Beobachtung des Verfassungsschutzes durch den Verfassungsschutz die Hinweise auf demokratieschädigende Bestrebungen (z.B. willkürliches Ausspähen, Vernichtung brisanter Akten) innerhalb des Verfassungsschutzes verdichten, könnte auch ein Verbotsverfahren gegen den Verfassungsschutz angestrengt werden; dies geschähe natürlich nur, falls entsprechende Akten nicht auf mysteriöse Weise verschwinden.
Ein Verbotsverfahren könnte sich jedoch kompliziert gestalten. Ähnlich wie 2003 im Falle der NPD besteht die Gefahr einer Einstellung, weil mit rund 100 Prozent vor allem in der Führungsebene zu viele Mitarbeiter des Verfassungsschutzes beim Verfassungsschutz tätig sind.
Zu einem lückenlosen Abzug aller Verfassungsschutzmitarbeiter ist die Politik jedoch bislang nicht bereit (wir berichteten). Es wird nicht nur befürchtet, dass der Verfassungsschutz dann völlig außer Kontrolle gerät, auch die Errichtung einer Auffanggesellschaft für die bundesweit rund 2640 Mitarbeiter, die auf einen Schlag auf der Straße säßen, dürfte erfahrungsgemäß an der FDP scheitern. Foto oben: Wo st 01, CC BY-SA 3.0," Foto rechts: istockphoto © TommL"""
"Jahrzehntelange Misswirtschaft: Mond flüchtet unter Euro-Rettungsschirm;""Macht die Krise denn vor gar nichts mehr halt? Nachdem in nur kurzen Abständen die spanischen Banken und Zypern unter den Euro-Rettungsschirm geschlüpft sind", stellte der Mond heute ebenfalls einen Antrag auf europäische Hilfen. Nur kurz zuvor wurde die Kreditwürdigkeit des Erdtrabanten von den Ratingagenturen Moody's, Fitch und Standard & Poor's auf Ramschniveau abgewertet. 

Die Herabstufung kam nicht unerwartet, denn schon seit geraumer Zeit steht der Mond wegen Misswirtschaft in der Kritik. Nicht nur liegen Industrie und Landwirtschaft brach, auch der einst florierende Tourismus, der Ende der 60er und Anfang der 70er Jahre vor allem Besucher aus den USA angezogen hatte, ist inzwischen stark zurückgegangen. 


Schwache Infrastruktur: Die Straßen
sind untermondisch schlecht ausgebaut

Nun also der Antrag auf die Aufnahme in den Rettungsschirm. Zwar dürften die Notkredite bewilligt werden - alles andere wäre ein verheerendes Signal an die internationalen Finanzmärkte -, europäische Finanzpolitiker fordern allerdings strenge Sparmaßnahmen, um das hohe Trabantsdefizit zu drücken und die marode Wirtschaft wieder auf die Beine zu bringen. 
Das fängt beim Außenhandelsdefizit an," wie EU-Kommissar Jan van Brondhuist erklärt: """"Auf dem Mond hat man zu lange in der Sonne gelegen. Es kann nicht sein", dass der Mond High-Tech-Gerätschaften wie Mondrover oder Sonden importiert, und selbst nur Rohstoffe wie Gesteinsbrocken und Bodenproben gegen Selbstabholung ausführt. Wer glaubt, so wirtschaften zu können," lebt hinter dem Mond. Außerdem muss die offenbar überall grassierende Schwarzarbeit bekämpft werden."""" Die Steuereinnahmen des Mondes gehen derzeit gegen Null."
Es gibt aber auch Stimmen, die davor warnen, nur einseitig den kleinen Mann im Mond zu belasten, während die Verursacher der Krise ihre Vermögen in die Schweiz schaffen. 
Angesichts der desaströsen Lage fragen sich viele Beobachter, ob es nicht besser wäre, den Mond einfach in den Staatsbankrott gehen zu lassen. Dies sei Analysten zufolge jedoch unmöglich, da in diesem Falle nahezu sämtliche europäische Banken auf ihren wertlosen Mondanleihen sitzen bleiben würden.
"ssi"""
"Klaus Wowereit will Gangster-Rapper werden und eigenes Label gründen;""Klaus Wowereit (SPD) hat große Ambitionen und das ist auch gut so. Berlins regierender Bürgermeister hat nun offiziell angekündigt", dass er nach seiner 2016 endenden Amtszeit eine zweite Karriere als Gangster-Rapper anstrebt. Wie Wowereit im großen Postillon-Interview (Printausgabe) enthüllt, will er unter dem Künstlernamen MC WOW! nicht nur mit fetten Rhymes Missstände im Ghetto anprangern, sondern auch durch die Gründung eines eigenen Labels jede Menge Bitches und Bling-Bling abgreifen.

Zweifel, ob er als Rapper Erfolg haben wird," kennt MC WOW! keine: """"Wer so lange in der Politik war"," hat den nötigen kriminellen Hintergrund und - Stichwort """"Fuffis im Club"""" - wer das Nachtleben Berlins so gut kennt wie ich"," der ist eigentlich automatisch ein ausgezeichneter Gangster-Rapper"""""," bestätigt Wowereit seine Pläne. """"Ich habe mir außerdem schon einmal ein Rap-Video angesehen und so ein bisschen schnell und betont sprechen – das bekomme ich locker hin."""" "


Er wird es mit MC WOW! nicht leicht haben: Berlins künftiger regierender Bürgermeister Bushido

Zu dem mutigen Schritt veranlasst sah sich Wowereit, weil er sich als gutaussehender Mann Mitte 40 von den aktuellen Rappern einfach nicht mehr angesprochen fühlt.
"Ich habe mir neulich die Lyrics von Bushidos erstem Soloalbum """"Vom  Bordstein zur Skyline"""" von 2003 reingezogen. Das"," was da in  """"Dreckstück"""""," """"Eine Kugel reicht"""" oder """"Pussy"""" drinsteht"," das war noch richtig aggro"""""," so Wowereit. """"Aber ich  sehe heute niemanden", der wirklich  irgendwo steht. Die heutigen Rapper wie Bushido, Sido," Fler oder B-Tight sind alle Opfer und haben keinen Flow."""""
Wowereit möchte künftig auch sozialkritische Texte rappen, in denen er keine Rücksicht darauf nehmen will," ob er den Mächtigen auf den Schlips tritt: """"Word! Ich kann mir durchaus vorstellen", nach den Wahlen 2016 Bürgermeister Bushido zu dissen," weil der Willy-Brandt-Flughafen immer noch nicht fertig ist""""", so MC WOW! selbstbewusst. Foto oben (unbearbeitet): Oliver Wolters, CC BY-SA 3.0, Foto rechts: Philipp von Ostau," CC BY-SA 3.0"""
"Griechenland steigt aus Euro aus und führt ""gute alte"" D-Mark ein;""Könnte das die Lösung der griechischen Krise sein? Der Premierminister Griechenlands", Antonis Samaras, hat angekündigt, dass sein Land nun doch freiwillig aus dem Euro austreten wird. Anschließend soll aber nicht wieder die als eher weich geltende Drachme eingeführt werden, sondern eine Währung," die sich über Jahrzehnte als stabil erwiesen hat und somit einen hervorragenden Ruf genießt: die """"gute alte"""" Deutsche Mark (DM)."

Nachdem sowohl Pasok als auch die linke Sammelbewegung Syriza Zustimmung  signalisiert haben, wurden die Notenpressen der griechischen  Zentralbank (Bank of Greece) angeworfen. Dort werden nun  DM-Scheine im Akkord gedruckt und Münzen aller in Deutschland bis 2001 üblichen Pfennig- und Mark-Beträge geprägt. 


"Er kann sich seine Drachmen künftig sonstwo hinstecken: """"Bild""""-Reporter Paul Ronzheimer"

Der Ökonom Lukas Papadopoulos erklärt," warum dies möglich ist: """"Da Deutschland derzeit den Euro  als offizielles Zahlungsmittel nutzt", ist die Deutsche Mark - oder wie wir sie nennen: Δοἲτσε Μάρκ - sozusagen verfügbar. Hier gilt: Wer zuerst kommt," prägt zuerst."""""
Finanzexperten zufolge bringt dieser Schritt ausschließlich Vorteile. So war die D-Mark bis zur Einführung des Euros in Griechenland ohnehin als gern gesehenes Zahlungsmittel, wodurch die Hellenen bereits bestens mit ihr vertraut sind. Weiterhin führe eine derart stabile Währung wie die D-Mark dazu, dass die zwar horrenden," aber in """"weichen"""" Euros aufgenommenen Schulden Griechenlands in den nächsten Jahrzehnten dahinschrumpfen dürften wie ein Zitroneneis in der peloponnesischen Sonne."


Tschüss Ευρώ! Hallo Δοἲτσε Μάρκ!
