title;text
Jamaika ändert Landesflagge," um nicht mit Koalition in Verbindung gebracht zu werden;""Jamaika will sein Image retten: Die Regierung des Karibikstaates hat heute beschlossen", die Farben der seit 1962 bestehenden Landesflagge von Schwarz-Gelb-Grün in Weiß-Blau-Magenta zu ändern. Damit soll sichergestellt werden, dass Jamaika künftig nicht mehr mit der möglichen künftigen Regierungskoalition Deutschlands assoziiert wird.

"Jamaikas Premierminister Andrew Holness rechtfertigte den Schritt: """"Wir sind es leid", dass unser schönes Land mit einer derart schrecklichen Parteienzusammensetzung, in Verbindung gebracht wird. Wir wollen nicht, dass die Menschen Leute wie Katrin Göring-Eckardt, Christian Lindner, Horst Seehofer und Angela Merkel vor ihrem inneren Auge sehen," wenn sie an Jamaika denken."""""


Kämpft für den Ruf seines Landes: Jamaikas Premierminister Andrew Holness (links im Bild: alte Landesflagge)
Entsprechend wurde bei der Gestaltung der neuen Landesflagge strikt darauf geachtet, künftig farblich so weit wie möglich von Schwarz-Gelb-Grün entfernt zu sein: Bei den neuen Landesfarben Weiß, Blau und Magenta handelt es sich um die Komplementärfarben, also die farbliche Umkehrung der bisherigen Flagge.
"Zuvor hatten alle Jamaikaner die Bundestagswahl in großer Sorge  verfolgt: """"Ich habe so darauf gehofft"," dass die Große Koalition  fortgesetzt wird"""""," erzählt etwa Portia Simpson-Levington aus Kingston.  """"Oder Rot-Rot-Grün oder Ampel oder was auch immer. Alles nur nicht  Union"," FDP und Grüne!"""" "
"Premier Holness ist überzeugt: """"Durch die Änderung unserer Flagge werden die Deutschen gezwungen sein"," sich ein anderes Opfer für ihre Koalitionsspiele zu suchen."""""
Dies dürfte sich allerdings nicht eben einfach gestalten," da die Farbkombination Schwarz-Gelb-Grün nur selten vorkommt. Höchstwahrscheinlich wird die Regierungskoalition daher in Anlehnung an das Landeswappen künftig als Sachsen-Koalition bezeichnet werden: Foto oben [M]: Shutterstock"""
"Fünf-Prozent-Hürde geschafft: Sonstige ziehen in Bundestag ein;""Sie gehören neben FDP und AfD zu den großen Gewinnern des Abends: Die unter """"Sonstige"""" zusammengefassten Parteien sind mit einem Stimmenanteil von 5",0 Prozent erstmals seit 1949 wieder in den Bundestag eingezogen. Angeführt wird das Bündnis aus 35 Kleinparteien von Martin Sonneborn (Die Partei) und Hubert Aiwanger (Freie Wähler).

Offenbar haben die Wähler es belohnt, dass wir ihnen nach vier weiteren Jahren der großen Koalition eine - entschuldigen Sie," ich meine fünfunddreißig klare Alternativen zur Regierungspolitik angeboten haben""""", erklärte einer der vielen Sprecher der Fraktion. 
Traditionell hatten es die Sonstigen, die ein breites politisches Spektrum von ganz links bis ganz rechts sowie verschiedene esoterische Strömungen abdecken, nie einfach: Immer wieder verließen kleinere Parteien wie die Piraten oder die NPD das Bündnis, sobald sie mehr als ein Prozent der Wählerstimmen erhielten. Dass die Grauen es nun seit mehr als 60 Jahren wieder ins Parlament schaffen, kommt einer Sensation gleich. 
Die Sonstigen werden gemäß ihrem Stimmanteil voraussichtlich 34 Sitze im Bundestag erhalten und müssen sich nun untereinander einigen, wie diese auf die Freien Wähler, Die Partei, Piratenpartei, NPD, Tierschutzpartei, ÖDP, Bayernpartei, Volksabstimmung, Partei der Vernunft, MLPD, BüSo, Sozialistische Gleichheitspartei, Die Rechte, Allianz Deutscher Demokraten, Tierschutzallianz, bergpartei, Bündnis Grundeinkommen, Demokratie in Bewegung, DKP, Deutsche Mitte, Die Grauen, Die HipHop Partei, die Magdeburger Gartenpartei, Menschliche Welt, Partei der Humanisten, Partei für Gesundheitsforschung, V-Partei3, Bündnis C, Die Einheit, Die Violetten, Familien-Partei, Feministische Partei Die Frauen, Mieterpartei," Neue Liberale und Unabhängige für bürgernahe Demokratie verteilt werden sollen. Idee: mehrere Einsender"""
"SPD-Führung übernimmt Verantwortung für Wahl-Desaster und tritt geschlossen zurück;""Die SPD zieht Konsequenzen aus dem schlechtesten Wahlergebnis der Nachkriegszeit: Bei einer Pressekonferenz verkündeten heute die Hauptverantwortlichen der Niederlage Martin Schulz", Hubertus Heil, Thomas Oppermann, Andrea Nahles und Sigmar Gabriel geschlossen ihren Rücktritt. 

"Der erfolglose Kanzlerkandidat Schulz erklärte sich zuerst: """"20",5 Prozent sind das schlechteste Wahlergebnis der SPD in der Geschichte der Bundesrepublik. Ich übernehme Verantwortung für den trostlosen Wahlkampf, der es verpasst hat, die Bürger mit ihren Problemen direkt anzusprechen," und ziehe mich aus der Führungsspitze der Partei zurück. Jeder mit einem Funken Anstand würde so handeln. Die SPD braucht jetzt eine Rückbesinnung auf ihre Wurzeln."""""
"Einen Nachfolger wollte Schulz explizit nicht ernennen. """"Es wäre geradezu absurd"," wenn ich als Verlierer jetzt beispielsweise jemanden aus der bisherigen Führungsgarde wie etwa Andrea Nahles als meine Nachfolgerin ins Spiel bringen würde. Diese Kompetenz habe ich durch meine Niederlage verwirkt."""""
"Der langjährige Parteichef Sigmar Gabriel gab ebenfalls seinen Rückzug bekannt: """"Ich bin der wichtigste Architekt der großen Koalition", habe Martin Schulz persönlich zum Kanzlerkandidaten gekürt und bin federführend am Kurs der vergangenen 15 Jahre beteiligt. Jetzt müssen junge Leute her, die nicht mit der Agenda 2010 vorbelastet sind und für einen glaubwürdigen Neuanfang in der Opposition stehen. Jeder, der auch nur einen Funken Anstand besitzt," würde so handeln."""""
"Auch Fraktionsvorsitzender Thomas Oppermann tritt ab: """"Nach so einem Ergebnis weiterzumachen", als wäre nichts gewesen," das wäre eine Verhöhnung des Wählerwillens. Dann stünden wir bei der nächsten Wahl bei 15 Prozent."""" Er fügte hinzu: """"Ich bin sowieso nur ein seltsamer blasser Typ mit äußerst flexibler Meinung", von dem keiner weiß," wie er in die Parteispitze geraten ist."""""
Aus ähnlichen Gründen gaben auch Arbeitsministerin Andrea Nahles, Generalsekretär Hubertus Heil und Justizminister Heiko Maas und zahlreiche weitere SPD-Politiker der ersten Reihe ihren sofortigen Rücktritt bekannt.
Wer genau an die Spitze der SPD treten wird, ist bislang noch unklar. Allerdings, so die einhellige Meinung der zurückgetretenen Politiker, stünde es einer demokratischen Partei wie der SPD gut zu Gesicht, wenn die neue Spitze zur Abwechslung von der Parteibasis aufgestellt und gewählt werden würde, statt hinter verschlossenen Türen vom Vorstand ausgekungelt zu werden. Foto [M]: dpa," Grafik: Tagesschau; Hinweis: Artikel erschien traurigerweise schon einmal so ähnlich"""
"Wollte in die Elefantenrunde: Polizei nimmt Elfenbeinjäger vor TV-Studio fest;""Das ist ja gerade nochmal gut gegangen: Polizisten haben soeben einen mutmaßlichen Wilderer festgenommen", der mehrfach versuchte, sich Zutritt zum TV-Studio zu verschaffen, in dem gerade die sogenannte Elefantenrunde nach der Bundestagswahl stattfindet. 

