title;text
In der Woche vom  1. bis 7. September würden daher  Streifenpolizisten landesweit bei Parkverstößen," Kindergartenrangeleien und """"anderen vollkommen harmlosen Gelegenheiten"""" mindestens 98 Weiße erschießen oder auf einer Polizeiwache in den Suizid treiben. """"Angesichts von nur 96 grundlos getöteten Schwarzen pro Jahr wird dann jeder Rassismusvorwurf widerlegt sein."""" "
"Zwar hätten einige """"eher konservative Polizeichefs"""" aus den Südstaaten starke Vorbehalte gegen das Konzept der Aktionswoche geäußert", räumt McCluney ein. Die habe man aber mit dem Hinweis entkräften können, dass in der Polizeistatistik ja Hispanics als Weiße zählen.
"bep; Fotos: Shutterstock"""
9 bizarre CSU-Gesetze," die ebenfalls vor Gericht scheiterten;""Das Betreuungsgeld ist nicht das erste CSU-Gesetz", das an juristischen Hürden scheitert. Historiker haben nachgerechnet: 1962 ist es der CSU letztmals gelungen, ein Gesetz auf Bundesebene durchzusetzen, das vor den Augen der Justiz bestehen konnte. Der Postillon hat recherchiert und präsentiert Ihnen neun weitere unglaubliche Versuche der bayerischen Regionalpartei, Bundespolitik zu betreiben:

1. Brustwarzenverbot für Kruzifixe (1964-1965)
1964 rang die CSU Ludwig Erhard und Koalitionspartner FDP die Einführung des umstrittenen Brustwarzenverbots für Kruzifixe auf Bundesebene ab. Besonders der bayerische Kultusminister Theodor Maunz forderte mit Nachdruck, Schüler beim morgendlichen Vaterunser im Klassenzimmer nicht nackten Männerbrustwarzen auszusetzen, seien sie auch noch so geschnitzt. Nachdem landesweit schon zehntausenden Kruzifixen die Brustwarzen abgepickt oder mit einem BH verhüllt worden waren," kassierte schließlich im Juli 1965 das Bundesverwaltungsgericht das Gesetz – ausgerechnet wegen eines simplen Formfehlers: Das Gesetz sprach durchgehend von """"Duttln"""" statt """"Brustwarzen"""" und war deshalb ungültig. In Bayern jedoch kommt es bis heute zur Anwendung."

2. Fingerhakeln als Schulfach (1966-1967)
Für erneutes Aufsehen sorgte die CSU 1966, als sie Fingerhakeln als neues Fach an bayerischen Schulen einführte und Sport aus den Stundenplänen strich. Nach einem Aufschrei von Sportlern und Wissenschaftlern angesichts zahlreicher verletzter Schüler im gesamten Bundesgebiet wurde das Gesetz 1967 schließlich vom Kultusministerium auf unbefristete Zeit außer Kraft gesetzt. Studenten, die sich zu diesem Zeitpunkt bereits in einem Fingerhakelstudiengang (Magister und Lehramt Gymnasium) befanden, durften allerdings noch zu Ende studieren und sind heute als diplomierte Fingerhakler gefragte Spezialisten.

3. Wolpertingerzuchtverbot (1973)
Wer wohl die Idee hatte, ausgerechnet die Züchtung des bayerischsten Tiers schlechthin zu verbieten? Die CSU natürlich: 1973 war die Zahl der Wolpertinger in Gefangenschaft durch unkontrollierte Zucht so stark angestiegen," dass es immer wieder zu aufsehenerregenden Zwischenfällen kam (""""Erneut Mann von Wolpertinger zerfleischt"""""," """"Wolpertinger vernichten gesamte Kartoffelernte""""). Ein deutschlandweiter Zuchtstopp sollte Abhilfe schaffen. Doch gerade als die CSU das Gesetz einstimmig im Bundestag verabschiedet hatte", stoppte das Bundesverfassungsgericht die Pläne. Die abenteuerliche Begründung: Weil inzwischen Willy Brandt (SPD) regierte, konnte die CSU überhaupt keine Gesetze beschließen – ein Glück für hunderttausende Wolpertingerhalter. 

4. Bayern-München-Steuer (1984-1990)
Nachdem die Bayern zwischen 1981 und 1984 dreimal in Folge nicht die Meisterschaft gewinnen konnten (einmal Platz 3, zweimal Platz 4), sprang ihnen die CSU zur Seite. Rechtzeitig zur Saison 1984/85 wurde ein Gesetz verabschiedet, laut dem fünf Prozent des Bruttogehalts deutscher Arbeitnehmer direkt an die Säbener Straße abgeführt werden mussten, um den angeschlagenen Verein wieder auf die Beine zu bringen. Von den nächsten sechs Meisterschaften gewannen die Bayern dank der Steuermilliarden fünf. 1990 wurde die Bayern-Abgabe vom Bundesfinanzhof in München kassiert. Beim Vorsitzenden Richter soll es sich um einen 60er-Fan gehandelt haben.

5. Droaxlmoaßbuamgschiagladkniabieslapauschale (1987)
Kaum ein Gesetz war in Deutschland so umstritten wie die Droaxlmoaßbuamgschiagladkniabieslapauschale von 1987. Sogar Freundschaften sollen daran zerbrochen sein. Dabei weiß bis heute niemand außerhalb Bayerns genau, was das ausschließlich im boarischen Dialekt verfasste Gesetz eigentlich besagte. Das fand schließlich auch das Bundesverfassungsgericht, das der Kniabieslapauschale, wie das Gesetz auch abkürzend genannt wurde, noch im selben Jahr eine Abfuhr erteilte. Ganz Deutschland jubelte und war froh, einem weiteren CSU-Gesetz entgangen zu sein – was auch immer darin gestanden haben mag. 

6. Lederhosenpflicht an Sonn- und Feiertagen (1992)
Ein bayerisches Prestigeprojekt war die Einführung der bundesweiten Lederhosenpflicht an Sonn- und Feiertagen, die der Bundestag 1992 beschloss. Doch den Autoren des Gesetzes unterlief ein entscheidender Fehler: Sie vergaßen, zwischen Mann und Frau zu unterscheiden und machten so Lederhosen für beide Geschlechter verpflichtend. Den zweiten Anlauf der CSU, in dem für Frauen eine Dirndlpflicht vorgeschrieben werden sollte, kassierten acht schlecht gelaunte Bundesverfassungsrichter in Krachlederner an einem Feiertag.

7. Mindestpromillegrenze (1995)
Der unermüdlichen Lobbyarbeit der bayerischen Brauereien ist es wohl zu verdanken, dass der Bundestag 1995 eine weltweit wohl einzigartige Mindestpromillegrenze verabschiedete. Demnach sollten Autofahrer zwar nicht über 0,8 Promille Alkohol (damalige Promillegrenze) im Blut haben, aber auch nicht weniger als 0,3. Zusätzliche Polizeikontrollen sollten gewährleisten, dass die Mindestpromillegrenze auch eingehalten würde. Ein großer Safthersteller klagte gegen das Gesetz und hatte schließlich vor dem Bundesverfassungsgericht Erfolg. Kurios: Nachdem das Gesetz wieder abgeschafft wurde, stiegen die Unfallraten für einige Monate sprunghaft an. Solange dauerte es, bis Deutschlands Autofahrer nicht mehr unter Entzugserscheinungen litten.

8. Franz-Josef-Strauß-Namenspflicht für öffentliche Gebäude und Institutionen (1997) 
Damit machte sich die CSU im Bund keine Freunde: Nach langem Druck auf den Koalitionspartner CDU verabschiedete der Bundestag 1997 die umstrittene Franz-Josef-Strauß-Namenspflicht für öffentliche Gebäude und Institutionen. Fans des rüstigen Ex-Rüstungsministers waren entzückt – doch nach nur neun Monaten erklärte der Franz-Josef-Strauß-Gerichtshof in Karlsruhe die Franz-Josef-Strauß-Namenspflicht für unzumutbar und verfassungswidrig. Noch heute sind rund 193.529 Schulen, Brücken, Flüchtlingsunterkünfte und Flughäfen nach dem populären Politiker benannt. 

9. Pkw-Maut für Ausländer (2015)
Dass aufrechte Bayern in der Schweiz und Österreich Maut zahlen müssen, während die Ausländer das schöne bayerische Straßennetz kostenlos nutzen, ist in den Augen der CSU ein unzumutbarer Missstand – und Ursprung einer weiteren Schnapsidee der Christlich-Sozialen, die im März 2015 den Bundestag passierte: Eine Pkw-Maut, die nur von Ausländern bezahlt werden sollte, während Deutsche über einen Ausgleich der Kraftfahrzeugsteu… Jedenfalls scheiterte das Gesetz, das so wirr war, dass man meinen könnte, es stamme aus der Feder eines Satirikers, erwartungsgemäß an den Ansprüchen der EU-Kommission.

Fotos: Shutterstock; FJS: Bundesarchiv, B 145 Bild-F078543-0017 / Schaack," Lothar / CC-BY-SA"""
"Aus Angst vor Spionage: Regierung setzt bei Auslandsreisen auf Einwegminister;""Sicher ist sicher: Wenn eine Dienstreise nach Russland", China oder in die USA ansteht, will die Bundesregierung zukünftig sogenannte Einwegminister und Wegwerfstaatssekretäre einsetzen. Anlass ist die Angst vor Ausspähung durch ausländische Geheimdienste nach den neuesten Enthüllungen in der NSA-Affäre.



Sicherheitsrisiko: Mehrwegminister

Die jeweiligen Minister und Spitzenbeamten würden nach ihrer Rückkehr umgehend entsorgt und durch neues Personal ersetzt. Dies wurde am Montag aus dem Bundeskanzleramt in Berlin bekannt. Unsichere Mehrwegminister wie Frank-Walter Steinmeier gehören damit der Vergangenheit an.
Das Bundesamt für Sicherheit in der Informationstechnik (BSI) hatte zuvor gewarnt," dass eine Spionagegefahr nicht mehr nur bei Mobiltelefonen und Computern bestehe. Heutzutage drohe selbst im befreundeten Ausland """"eine persönliche Manipulation von Delegationsmitgliedern""""", etwa durch geschicktes Ausfragen oder unbedachte Äußerungen in vermeintlich vertraulichen Gesprächen.
Dem lasse sich nur begegnen, indem man grundsätzlich nur Minister und Staatssekretäre ohne jedes Insiderwissen ins Ausland fliegen lasse. Mitglieder von Regierungsdelegationen sollten deshalb nur noch mit den allernötigsten Informationen ausgestattet sein (Grundrechenarten, Vor- und Zuname, Flugroute und Reisedauer). 
Unklarheit herrscht indes über die Entsorgung der gebrauchten Wegwerfminister. Nachdem Menschenrechtsgruppen die bisher geplante Vernichtung als unmenschlich kritisierten, prüft das Kanzleramt nach eigenen Angaben eine nachhaltigere Recyclinglösung. Sie sieht vor, dass die ahnungslosen Einwegminister direkt als einfache Beamte in den öffentlichen Dienst übernommen werden.
bep, (ssi, dan); Foto oben: Shutterstock, Foto rechts: Mueller / MSC," CC BY 3.0 DE"""
Peinliche Stille am Familientisch," als Bernd Lucke schon wieder eine neue Partei nach Hause bringt;""Nur das Geklapper des Geschirrs und ein gelegentliches Hüsteln sind zu vernehmen", während Bernd Lucke mit seinen fünf Kindern, seiner Gattin sowie 28 Mitgliedern der neuen Partei ALFA (Allianz für Fortschritt und Aufbruch) am Tisch sitzt. Erst 2011 hatte Lucke nach 33 Jahren Mitgliedschaft seine erste große Liebe CDU verlassen. Seitdem waren mit den Freien Wählern und der AfD wechselnde Parteien an seiner Seite. 

Erzähl doch mal von der Schule," Anja""""", versucht Lucke die Stimmung aufzulockern, wobei er seinen Parteikollegen von ALFA einen verliebten Blick zuwirft. Während seine Tochter betreten im Salat stochert und Unverständliches vor sich hinmurmelt," fährt der Ökonom fort: """"Schaut mal", unser neuer Schatzmeister," der Herr Weber ist übrigens Lehrer. Da habt ihr doch schon ein paar Gemeinsamkeiten."""" Es folgt erneut eine längere Phase", in der niemand spricht.


Da hatten sie sich noch lieb: Lucke und seine Partei 2013

Naja, eigentlich sieht sie ja fast aus wie Papas alte Partei," nur ein bisschen jünger""""", raunt Luckes jüngster Sohn Alex (13) einem Postillon-Reporter zu," während er angeblich """"mal kurz auf die Toilette"""" geht"," tatsächlich aber hinter der Garage eine Zigarette raucht. """"Die AfD war schon seltsam"," mal unter uns gesagt. Aber als Kind kann man sich die Partei seines Vaters nun mal nicht aussuchen."""""
Dass er die AfD, mit der sein Vater zuletzt immer öfter gestritten hat, nun nicht mehr so oft sehen wird," findet Alex dennoch schade. """"Wir haben uns in den letzten zwei Jahren schon irgendwie an sie gewöhnt."""" Er wisse nun aber nicht so genau", wie er reagieren solle, wenn er das nächte Mal AfD-Mitglieder auf der Straße oder im Supermarkt treffe. 
Im Esszimmer der Familie ist inzwischen wieder peinlich berührtes Schweigen eingetreten, nachdem Lucke nun schon zum zweiten Mal an diesem Abend seine neue Partei AfD genannt hat, ohne es zu bemerken. Foto oben [M]: Shutterstock/Robin Krahl, CC BY-SA 4.0, Foto rechts: Mathesar," CC BY-SA 3.0"""
Merkels Bodyguard gefeuert," weil er weinendes Flüchtlingsmädchen nicht rechtzeitig entfernt hat;""Weil er eine Gefahrenlage nicht schnell genug erkannte", muss ein langjähriger Leibwächter von Angela Merkel nun seinen Posten räumen. Bei einem Bürgerdialog mit Schülern in Rostock war die Bundeskanzlerin minutenlang schutzlos einem weinenden Mädchen ausgesetzt, während ihre Sicherheitsleute untätig blieben (siehe Video rechts). 

Zwar war das politische Überleben Merkels durch die Fehleinschätzung des Leibwächters offenbar nie in ernsthafter Gefahr, doch das Image der Kanzlerin hat deutliche Kratzer abbekommen. 
"Die Konsequenz: """"Wir mussten uns leider von dem Mitarbeiter trennen"""""," so ein Sprecher des Kanzleramts. """"Er hätte die Gefahr früher erkennen und sofort handeln müssen.  Spätestens als die Augen des Mädchens feucht wurden"," hätte sich der Bodyguard schützend zwischen die Kanzlerin und die Gefahrenquelle werfen müssen."""""
Alternativ hätte er auch eine Decke oder einen Sack über die junge Palästinenserin stülpen und sie unauffällig aus der Gesprächsrunde entfernen können. Auch durch ein blitzschnelles Trockenföhnen der Augen des Mädchens hätte die Gefahr abgewehrt werden können.
Das Kanzleramt begrüßte zwar ausdrücklich, dass der Leibwächter seinen Fehler anschließend wieder gutmachen wollte, indem er anbot, das Mädchen persönlich nach Palästina auszufliegen. Doch der angerichtete Schaden sei zu groß gewesen – zumal der gelernte Personenschützer noch nicht einmal den dreist nachfragenden Moderator mit einem gezielten Schuss zur Strecke brachte. 
Trotz allem sei man ihm für seine langjährige Arbeit dankbar, heißt es aus dem Kanzleramt. Angela Merkel persönlich gab dem völlig niedergeschlagenen Mann, der nun nicht mehr weiß, wie er seine Familie ernähren soll, heute ein paar Streicheleinheiten und versicherte ihm," dass er doch alles ganz prima gemacht habe. Foto oben: Shutterstock"""
"Kolonie Deutsch-Südosteuropa verabschiedet auf Geheiß Berlins neue Gesetze;""Es herrscht dieser Tage eine seltene Emsigkeit in Deutsch-Südosteuropa. Bis Mitternacht hat der Eingeborenenrat des deutschen Schutzgebietes Griechenland Zeit", dem Willen Berlins mit der Durchsetzung eines umfangreichen Gesetzespakets zu entsprechen. Noch sträuben sich die stolzen Stammesfürsten gegen die leitende Hand der Zivilisation. Doch Bundeskommissar Schäuble zeigt sich zuversichtlich, dass der Grieche letztlich Vernunft annehmen möge.

"Wir haben die Zügel viel zu lange schleifen lassen""""", erklärte Herr Schäuble gestern in Berlin. So sei es eine Torheit gewesen, das Schicksal der Völker Griechenlands vorübergehend in deren eigene Hände zu legen. Immer wieder muss man nun Gelder an Deutsch-Südosteuropa überweisen, um überhaupt fristgerecht Tribut zu erhalten.


Die Flagge von Deutsch-Südosteuropa

"Dem Griechen ist der verantwortungsvolle Umgang mit Finanzen fremd. Von Wirtschaft versteht er nichts""""", so der Bundeskommissar," der als ausgewiesener Kenner des südländischen Gemüts gilt. """"Da kann der Grieche noch so sehr schreien und zetern"," dass er sich selbst verwalten will."""""
Mit dem Gesetzespaket, das spätestens zum heutigen Abend durch den Eingeborenenrat der Kolonie gezwungen werden soll, werden nun aller Voraussicht nach wieder Zucht und Ordnung im sonnigen Hellas Einkehr halten. 
Doch auch Strafe muss sein: Um den Eingeborenen die Lust am Aufruhr zu nehmen," werden griechische Besitztümer im Wert von 50 Milliarden Euro an reiche Händler und Companien veräußert. Das Militär dagegen bleibt unangetastet: Gegen das russische Zarenreich wird jede Hand gebraucht. dan"""
"Schäuble: ""Ich habe eigentlich den Kopf von Varoufakis auf einem Silbertablett gefordert"";""Nur einen Tag nach der Einigung in der Griechenlandkrise präsentiert der Postillon exklusiv das erste Interview mit Bundesfinanzminister Wolfgang Schäuble (CDU)", der uns unverblümte Einblicke in die beinharte Welt der EU-Diplomatie gewährt:

Postillon: Herr Schäuble, schön, dass Sie die Zeit für das erste Interview nach der historischen Einigung in Brüssel gefunden haben. 
Schäuble: Aber gern. Ich lese den Postillon schon seit der ersten Ausgabe 1845, besonders die Kontaktanzeigen und das Horoskop. Damals war ich übrigens Finanzminister des Großherzogtums Baden.


Kann in Sachen Wirtschaft jeder schwäbischen Hausfrau das Wasser reichen: Wolfgang Schäuble.
Postillon: Ohne Hitlerbart und Wehrmachtsuniform hätten wir sie beinahe nicht erkannt. 
Schäuble (knarzt seltsam; vermutlich Lachen): Haha. Ja, die griechischen Medien übertreiben gerne ein bisschen. Das sind jedoch alles Fotomontagen. Hitlerbart und Wehrmachtsuniform trage ich ausschließlich zu Hause. Privat. 
Postillon: Wie kommentieren Sie den Ausgang der Verhandlungen in Brüssel? Haben Sie die richtige Strategie gefunden?
Schäuble: Ja. Immerhin haben wir in den letzten Jahren 216 Milliarden Euro nach Griechenland transferiert, damit die ihre alten Schulden bei den deutschen Ban… äh… bei ihren Gläubigern bedienen konnten, und haben fünf Jahre lang zugeschaut, wie die Konjunktur durch die Sparmaßnahmen eingebrochen ist. Da haben wir uns überlegt: Wir versuchen's mal mit weiteren Hilfsgeldern und noch mehr Sparmaßnahmen. Nur weil was beim ersten und zweiten Mal nicht funktioniert hat, muss es ja beim dritten Mal nicht falsch sein. Das machen wir jetzt solange, bis es klappt.
Postillon: Kritiker sagen, dass Ihre Forderungen in den Verhandlungen zu hart waren. 
Schäuble: Alles Quatsch. In den Wochen zuvor habe ich eigentlich sogar den abgetrennten Kopf von Yanis Varoufakis auf einem Silbertablett gefordert. Da gab es allerdings dann doch Widerstand von einigen Kollegen. Trotzdem ist Varoufakis aus Angst inzwischen zurückgetreten. Aber den erwische ich schon noch irgendwann. Und wenn es das Letzte ist, was… Aber ich schweife ab...
Postillon: Wie lange muss Griechenland sparen, bis es wieder aufwärtsgeht? 
Schäuble: Schätzungsweise 1341 Jahre. Könnten aber auch 1344 Jahre sein. Aber spätestens, wenn sich Griechenland in die Steinzeit zurückgespart hat, folgt der Aufschwung. Erst Tauschhandel, dann Muschelwährung und schon im Jahr 3472 hat Griechenland wieder zum Rest der interstellaren EU aufgeschlossen. Wenn man bei Null anfängt, dann kann's ja nur aufwärtsgehen. Das ist Wirtschaft, erstes Semester meine ich. Als Nicht-Ökonome kann ich da letztlich nur Mutmaßungen anstellen.
Postillon: Sie haben Jura studiert. 
Schäuble: Genau. Deshalb weiß ich: Ein Vertrag ist ein Vertrag ist ein Vertrag. Er darf nie wieder gebrochen oder an die Realitäten angepasst werden und ist mächtiger als alle Volksabstimmungen der Welt. Ich bete abends zu Verträgen und wenn ich morgens aufwache, dann ist das Erste, woran ich denke, Marmelade. Aber gleich danach kommen Verträge.
Postillon: Sie würden also niemals gegen Verträge oder geltendes Recht verstoßen?
"Schäuble: Nie. So etwas machen nur Griechen. Das Wort """"Korruption"""" kommt ja schon aus dem Griechischen. Korruption und Vetternwirtschaft gehören da zum System. "
Postillon: Wir hätten hier einen relativ dicken Umschlag, den wir unkompliziert Ihrer Partei zukommen lassen wollen. Im Gegenzug erhoffen wir uns ein neues Gesetz, das großzügige Steuererleichterungen für Zeitungen vorsieht," deren Name auf """"illon"""" endet."
Schäuble: Her damit. Allerdings werde ich den Umschlag - was immer da auch drin sein mag - nicht öffnen, sondern direkt an CDU-Schatzmeister Philipp Murmann weiterreichen. Das ist dann juristisch einwandfrei.
Postillon: Zurück zu Griechenland. Die Krise dort dauert nun schon mindestens sieben Jahre. Finden Sie es gerechtfertigt, dass darunter auch griechische Kinder leiden müssen, die gar nichts dafür können? Was sagen Sie etwa zum kleinen Timotheos (9), der in Athen auf der Straße lebt?
Schäuble: Für diese Kinder habe ich keinerlei Verständnis. Zum einen arbeiten die meisten von ihnen nicht und kommen damit ganz nach ihren arbeitslosen Eltern (25,6%). Zum anderen hätte der kleine Timotheos, sobald er erwachsen ist, ja auch eine Zeitmaschine bauen können. Mit der hätte er in die Zeit vor der Krise zurückreisen und das ganze Desaster verhindern können. Dann müssten wir jetzt über diese Frage gar nicht sprechen. Weil er faul ist, hat er das aber nicht gemacht.
Postillon: Wie erklären Sie sich ihre große Popularität in aktuellen Umfragen unter der deutschen Bevölkerung?
Schäuble (stolz): Das liegt wahrscheinlich an meinem unglaublichen Charisma. Außerdem bade ich regelmäßig im Blut eines frisch geschlachteten Guttenberg. Oh. Ich lese gerade, dass mein Beliebtheitswert um ein Prozent gesunken ist. Ich muss weg.
Postillon: Herr Schäuble, wir bedanken uns für das Interview.
Schäuble: Isch over.
Postillon: Sagen Sie das jetzt immer?
Schäuble: Isch over.
