title;text
Lesen Sie auch „Patrioten-Bonds“ Italiens Sparer bekommen Renditen, von denen die Deutschen nur träumen können

Selbst wenn durch das Kapital wirklich neue Projekte angestoßen würden, so sei eben schwer nachzuweisen, dass diese wirklich den gewünschten Effekt haben, erklärt Giugale. Man benötige Experimente und Kontrollgruppen. „Richtige Bewertungen erfordern Zeit und Geld, und die Ergebnisse sind möglicherweise enttäuschend oder liegen nicht vor, bevor die Anleihen fällig werden.“ Kurz: Man wird es kaum jemals beurteilen können, ob die grünen Anleihen wirklich der Umwelt dienen.

"Dieser Text ist aus der WELT AM SONNTAG. Wir liefern sie Ihnen gerne regelmäßig nach Hause."""
"Aktivitäten im Schatten des großen Endspiels;""Anzeige"

Der FC Bayern und Paris St. Germain? KF Tirana, Qarabag Agdam und Sheriff Tiraspol! Schon vor dem Endspiel in Lissabon an diesem Sonntag (21 Uhr, DAZN, ZDF, Sky und im Liveticker der WELT) hatte die neue Saison der Champions League begonnen. Für Europas Königsklasse wird es ein weiteres Ausnahmejahr in Corona-Zeiten.

Während in Lissabon in den vergangenen zwei Wochen der Sieger der Champions League gesucht wurde, ging es parallel für viele kleine Vereine des Kontinents schon um das Ticket für die kommende Saison. Die Qualifikation für 2020/21, an der kein deutsches Team beteiligt ist, ist in vollem Gange – und bereitet auf eine erneut besondere Spielzeit vor.

Was sind die Besonderheiten?

Die Corona-Krise wird auch die Saison 2020/21 begleiten, nicht nur wegen des weit nach hinten verschobenen Starts der Qualifikation (8. August statt 23. Juni). Ein Beispiel: Der kosovarische Meister KF Drita schied bereits aus, weil der Club nach zwei Corona-Fällen in Quarantäne musste und in der Vorrunde der Qualifikation nicht mehr antreten konnte.

Anzeige

Die Europäische Fußball-Union wertete die Partie für den nordirischen Gegner FC Linfield, auch weil der dicht gestaffelte Spielplan keinen Ausweichtermin zuließ. Die Corona-Regeln für die Königsklassen-Spiele nach der Qualifikation muss die Uefa noch endgültig beschließen. Eine Maßnahme, die öfter auftreten könnte: Partien auf neutralem Platz, je nach Vorgabe der nationalen Behörden.

Wann beginnt die Gruppenphase?

Ausgelost werden die acht Vierergruppen am 1. Oktober in Athen, wo auch Europas Fußballer des Jahres gekürt werden soll. Der erste Spieltag ist für den 20. und 21. Oktober terminiert, der letzte in der Gruppenphase nur 48 Tage später für den 8. und 9. Dezember. Die K.-o.-Runde beginnt am 16. Februar mit dem Achtelfinale und endet mit dem Endspiel am 29. Mai im Atatürk Olympiastadion in Istanbul.

Lesen Sie auch Fußball So verdienen Sie mit Sportwetten systematisch Geld

Am 11. Juni beginnt die Europameisterschaft. In der Türkei sollte eigentlich schon das Finale in diesem Jahr stattfinden, ehe die Corona-Krise dazwischen kam. Die geplanten Gastgeber der folgenden Jahre rücken deshalb um ein Jahr weiter in die Zukunft. 2022 ist St. Petersburg Gastgeber, 2023 München und 2024 London.

Wer ist schon für die Gruppenphase qualifiziert?

Anzeige

Aus der Bundesliga wie gehabt die ersten Vier der Saison 2019/20: Der FC Bayern, Borussia Dortmund, RB Leipzig und Borussia Mönchengladbach. Sechs der insgesamt 32 Teilnehmer werden noch über die Qualifikation ermittelt.

Die Bayern sind als Meister bei der Auslosung in jedem Fall in Topf 1 gesetzt und können in der Gruppenphase nicht auf die Champions der weiteren Topligen treffen, unter anderem sind das Real Madrid und der FC Liverpool. Borussia Dortmund wird aufgrund des guten Klub-Koeffizienten in Topf 2 landen, Leipzig in Topf 3, die Gladbacher eher in Topf 4. Deutsche Duelle in der Gruppenphase sind ausgeschlossen.

Wie sieht die Zusammensetzung der Lostöpfe aus?

In diesem Jahr sind in Topf 1 Real Madrid, der FC Liverpool, der FC Bayern, Paris Saint-Germain, Juventus Turin, Zenit St. Petersburg, der FC Porto und FC Sevilla gesetzt. Einen dieser Gegner (die Bayern ausgenommen) werden der BVB, Leipzig und Gladbach zugelost bekommen. Dortmund ist in Topf 2 allerdings auch in bester Gesellschaft: Der FC Barcelona, Atlético Madrid, Manchester City, Manchester United, Schachtjor Donezk und der FC Chelsea drohen also den Bayern, Leipzig und Gladbach. Leipzig in Topf 3 wird Inter Mailand und Lazio Rom zunächst aus dem Weg gehen. Topf 4 setzt sich aus den laut Koeffizient schwächsten Teams zusammen.

Anzeige

Die endgültige Einteilung in den Töpfen 2 bis 4 ist noch abhängig davon, welche Klubs sich in den Play-offs (22. bis 30. September) durchsetzen. In jedem Fall qualifiziert sind Ajax Amsterdam, Istanbul Basaksehir, Stade Rennes, Atalanta Bergamo, Lokomotive Moskau, Olympique Marseille, Club Brügge und eben die Gladbacher.

Wird wieder ein Finalturnier gespielt?

Uefa-Präsident Aleksander Ceferin hatte solche Gedankenspiele zunächst ausgeschlossen. Zwar bot das Blitzturnier ab dem Viertelfinale in Lissabon hochklassigen Fußball und enorm spannende Partien in einem kurzen Zeitraum. „Das Format ist wie eine Welt- oder Europameisterschaft, so vom Gefühl her, wenn man ins Stadion geht. Wenn Zuschauer dabei wären, wäre das wahrscheinlich ähnlich“, sagte der Bayern-Vorstand Oliver Kahn, der sich aber auch nicht festlegen wollte, ob es so besser ist.

So will Thomas Tuchel Paris St. Germain zum Titel führen Erstmals in seiner Champions-League-Historie steht Paris St. Germain im Finale. Gegen den FC Bayern will das Star-Ensemble um Trainer Thomas Tuchel nun den Coup landen Wie sie das Spiel angehen, darüber sprechen Tuchel und Jungstar Mbappé hier. Quelle: UEFA

Weniger Spiele (pro Paarung nur ein K.-o.-Duell statt Hin- und Rückspiel) bedeuten für den Dachverband und damit für die Klubs weniger Einnahmen und Vermarktungsmöglichkeiten. Der bekannte Modus ist ohnehin bis 2024 weitgehend festgeschrieben, erst dann könnte wohl eine große Reform kommen, die zuletzt immer mal wieder Streitthema im europäischen Fußball war.

Nun aber hat sich Uefa-Boss Ceferin am Sonntag noch mal zu Wort gemeldet und denkt über einen möglichen Verzicht auf Hin- und Rückspiele im Europapokal nach. Es wäre eine Revolution. Ceferin kann sich plötzlich eine dauerhafte Einführung von Finalturnieren vorstellen. Das System mit einem Duell pro Begegnung erscheine „interessanter“, sagte Ceferin. „Es ist ziemlich kompliziert, ein Final 8 im Kalender unterzubringen. Aber wir haben gesehen, dass die Menschen spannende Spiele wollen, dass in einem Spiel jedes Team in der Champions League oder Europa League jedes Team schlagen kann. Deshalb ziehen wir das für die Zukunft in Erwägung. Ich denke, im September oder Oktober müssen wir anfangen, ernsthaft zu sprechen.“

Die Uefa hatte ihre Europapokal-Wettbewerbe wegen der Coronavirus-Pandemie an jeweils einem Standort und komplett von den Viertelfinals an mit nur einem Duell zu Ende gebracht. Der bislang bekannte Modus ist bis 2024 weitgehend festgeschrieben.

Bei einer Europapokal-Revolution müsste diskutiert werden, ab welcher Runde ein mögliches Finalturnier starten könnte. „Man wäre für eine Woche im Zentrum der Aufmerksamkeit der ganzen Welt und dies wäre fantastisch, aber wir müssen sehen“, sagte Ceferin.

Wo sind die Spiele im TV zu sehen?

In der kommenden Saison sind noch einmal alle Partien beim Bezahlsender Sky und beim kostenpflichtigen Streamingdienst DAZN zu sehen. Die beiden Pay-Anbieter haben sich die Rechte aufgeteilt und verteilen die Übertragungen nach einem komplizierten Schlüssel. Für Sky ist es die Abschiedssaison, denn von 2021/22 an sind die neuen Medienverträge der Uefa mit DAZN und Amazon gültig. Die Finals von 2022 bis 2024 zeigt das ZDF.

Lesen Sie auch Taktikanalyse Kein Team geht so ins Risiko wie die Bayern

Anzeige

_________

*Anzeige: Jeder Zuschauer hat die Möglichkeit, das Finale der Champions League an diesem Sonntag beim Streamingdienst DAZN (11,99 Euro pro Monat) live zu verfolgen. Wer noch kein Abo hat, kann das Spiel kostenlos sehen. DAZN bietet allen Neukunden die Möglichkeit," das Angebot zunächst einen Monat kostenlos zu testen. Innerhalb des ersten Monats kann man das Abo wieder kündigen."""
„Er ist immer noch fantastisch“;In Absprache mit Coach Buijs will Robben sein Pensum nun langsam steigern. Eine halbe Stunde sei für den Anfang das „maximal Machbare“ gewesen. „Darauf können wir aufbauen, die Anzahl der Spielminuten ausweiten“, sagte er. Es werde sicher auch mal Rückschläge geben und Spiele, bei denen er nicht auf dem Platz stehen werde. „Ich gebe mein Bestes, lasst uns das so gut wie möglich machen.“
Berliner Linke fordert staatliche Kaufhäuser;Zur Standortrettung von Galeria-Karstadt-Kaufhof-Filialen will die Berliner Linke landeseigene oder genossenschaftliche Kaufhäuser gründen. Das Modell gab es unter anderem in der DDR und der frühen Bundesrepublik in Form der Handelskette „Konsum“.
"Geringes Infektionsgeschehen an den Schulen;""Anzeige"

Maskenpflicht für Grundschüler, Maskenpflicht während des Unterrichts, Atteste zur Befreiung vom Unterricht, die Durchmischung auf dem Schulhof oder der fehlende Unterricht in Kleingruppen – zu diesen und vielen andere Themen meldeten sich in den vergangenen beiden Wochen Eltern bei der Hamburger CDU, die eine Art Sorgentelefon zum Schulstart eingerichtet hatte. Insgesamt hätten sich bis Freitag 73 Eltern oder Schüler über die Zustände an den Schulen beschwert oder Informationen eingeholt, hinzu kamen zwei Dutzend Mails. Daraus eine allgemeine Unzufriedenheit abzulesen, ist allerdings hakelig – in Hamburg gibt es immerhin 285.000 Schülerinnen und Schüler an allgemein- und berufsbildenden Schulen. Hamburgs Schulsenator Ties Rabe (SPD) rechnete am Mittwoch in der Bürgerschaft vor, dass Eltern und Lehrer mit eingerechnet, fast 600.000 Hamburger „mit Veränderungen in der Schule direkt beschäftigt sind“.

Lesen Sie auch Verordnung Schüler müssen ab Montag Masken tragen - aber nicht im Unterricht

Und so wird die Lage an den Schulen, die nach dem Ende der Sommerferien flächendeckend in einen Regelbetrieb mit Hygiene- und Abstandsregelungen übergegangen sind, derzeit höchst unterschiedlich interpretiert. Gleiches gilt für unterschiedliche Studien zur Ansteckungsgefahr für oder durch Kinder und Jugendliche. Längst sucht sich auch in den entsprechenden Hamburger Internetforen jeder die Zahl und die wissenschaftliche Einschätzung heraus, die gerade für die eigene Argumentation passend ist. Vorhanden ist von allem reichlich. Wie also ist die aktuelle Datenbasis? Auf Anfrage der WELT AM SONNTAG lieferte die Behörde am Freitagmittag die neuesten Zahlen zum Infektionsgeschehen. So wurden in den vergangenen zehn Tagen insgesamt 43 Infektionen an den Hamburger Schulen registriert. Darunter waren 39 infizierte Schüler, zwei Schulkräfte in Sekretariaten und zwei Lehrer. Ein Blick auf die Verteilung der Fälle auf die Schulen zeigt, dass es keine Clusterbildung gibt. Am Mittwoch, Donnerstag und Freitag vergangener Woche waren Einrichtungen in Eimsbüttel, Stellingen, am Heidberg, in Bergstedt, Horn, Wilhelmsburg und Poppenbüttel betroffen, jeweils mit einer Erkrankung. Von einer Ansteckungswelle kann also nicht die Rede sein.

Schulsenator Rabe stuft die Lage deswegen auch weiterhin als entspannt ein. „Wir mussten in wenigen Wochen praktisch ein neues Schulsystem für 255.000 Schülerinnen und Schüler sowie 30.000 Schulbeschäftigten erfinden und tief in den Alltag von Eltern und Kindern eingreifen. Das hohe Interesse und die Aufregung in den sozialen Medien waren deshalb zu erwarten“, sagte er WELT AM SONNTAG. Die Schulleitungen würden aber melden, dass der Start gut geklappt habe. Rabe: „Die vielen neuen Regeln werden befolgt und bewähren sich gut. Hamburgs Schulen sind ein sicherer Ort, an dem jetzt endlich wieder richtig gelernt werden kann.“ Das sei für Kinder und Jugendliche sehr wichtig, denn das Lernen zu Hause sei nicht so erfolgreich wie das Lernen in der Schule. Kinder und Jugendliche hätten nicht nur das Recht, vor Corona geschützt zu werden, sondern „auch ein Recht auf eine unbeschwerte Kindheit, soziale Kontakte und eine gute Bildung“.

Lesen Sie auch Schulalltag in Corona-Zeiten „Sechs Stunden in einem hochkonzentrierten Pool von Aerosolen“

Lesen Sie auch Regelunterricht an Schulen Warum nun doch viel weniger Lehrer zur Risikogruppe gehören

Anzeige

Die Hamburger CDU sieht die Situation an den Schulen jedoch weiterhin anders. Ihr neuer Fraktionschef Dennis Thering wirft Rabe vor, den „Schulstart verstolpert zu haben“. Viele Eltern, Lehrer und Schüler würden sich fragen, was der Senat in den vergangenen fünf Monaten und in den Sommerferien gemacht habe. „Vieles wirkt unvorbereitet und planlos: Es gibt keine klaren Vorgaben, funktionierende Hygienekonzepte und Alternativpläne. Noch immer fehlen an Schulen Masken oder ist das regelmäßige Durchlüften nicht möglich“, sagte Thering. Auch der Umgang mit den Reiserückkehrern an den Schulen sei nicht ausreichend erörtert worden. Mit dem aus seiner Sicht bestehenden „Missmanagement des Senats“ werde der wichtige Vorsprung bei der Pandemie-Bekämpfung „wieder verspielt“.

Mehrere Möglichkeiten der Ansteckung

Tatsächlich sind die Zahlen bei den Neuinfektionen in der Gruppe der Kinder und Jugendlichen – wie überall im Bundesgebiet – auch in Hamburg stärker gestiegen als bei den älteren Bevölkerungsgruppen. Allerdings sind nachweisbare Ansteckungen im Schulbetrieb selbst dabei die Ausnahme, viele Jugendliche haben das Virus von Reisen mitgebracht, insbesondere aus der Türkei oder aus dem Kosovo. Wie Zahlen der Gesundheitsbehörde zeigen, gibt es die meisten Neu-Ansteckungen im Bezirk Mitte, der auch den höchsten Ausländeranteil aufweist. Zudem sind die Kinder und Jugendlichen im Vergleich zum Frühjahr auch wieder in Sportvereinen aktiv und sie treffen sich – mal legal, mal illegal – zu Partys oder zum „Cornern“ an den Partymeilen. Aus diesem Grund hatte der Senat das abendliche Alkoholverkaufsverbot an Kiosken auch für dieses Wochenende ausgesprochen.

Insgesamt bleibt das Infektionsgeschehen in Hamburg aber überschaubar. In der vergangenen Woche wurden 171 Neuinfektionen gemeldet. Würde diese Zahl in einem Wochenzeitraum bei mehr als 900 Fällen liegen, müsste der Senat über die Rücknahme von Lockerungen oder andere Maßnahmen zur Pandemie-Bekämpfung beraten. Stationär behandelt wurden mit Stand Freitagmittag 18 Personen in Hamburger Krankenhäusern, davon neun Patienten auf Intensivstationen.

Anzeige

"Dieser Text ist aus der WELT AM SONNTAG. Wir liefern sie Ihnen gerne regelmäßig nach Hause."""
„Maskenpflicht am Arbeitsplatz – das könnte auf jeden Fall ein Schritt sein“;
Nawalny soll vor seinem Zusammenbruch überwacht worden sein;
"„Randale in der neuen Heimat“;""In mehreren deutschen Städten wird über die Umstände von Festnahmen durch Polizisten diskutiert. WELT-AM-SONNTAG-Herausgeber Stefan Aust sieht das Grundproblem auch in der Migrationspolitik. Zum Polizistenberuf hat er eine klare Meinung."
