title;text

Hatte er Anfang des Monats eine Pressekonferenz noch abgebrochen, als die Fragen zu jener umstrittenen Veranstaltung in Südeuropa anfingen, blieb er dieses Mal freundlich, offen und reflektiert. Man habe sich an alle geltenden Regeln gehalten, betonte Zverev wie zuletzt auch Organisator Novak Djokovic in einem Interview mit der „New York Times“. Er gab aber auch zu: „Mit 5000 Kindern einen Kids-Day zu machen oder vor Publikum zu spielen, war vielleicht nicht das Schlaueste aller Zeiten. Aber es war halt ein guter Versuch, Tennis zurückzubringen, damit die Leute auch wieder was zum Schauen haben. Es hat nicht so funktioniert, wie es gedacht war.“

„Ich wurde sieben Mal negativ auf Corona getestet“

Anzeige

Partys, Abklatschen, Zuschauer – am Ende waren neben Djokovic und dessen Ehefrau noch weitere Spieler und Betreuer mit dem Coronavirus infiziert und die Kritik laut. Zverev gab sich reumütig und kündigte eine Selbstisolation an. Kurz darauf tauchte ein Video von ihm beim Feiern auf. Weil er sich danach nicht mehr äußerte und auch die Teilnahme an einem Einladungsturnier in Berlin kurzfristig absagte, war der Ärger groß.

„Nach der Adria-Tour, da hat mein Management gesagt: Bleib lieber zu Hause“, erklärte Zverev. „Klar, ich war negativ. Ich wurde sieben Mal negativ getestet nach der Adria-Tour, was ich nachweisen kann. Aber in Berlin waren ja auch wieder ein paar Zuschauer, und ich wollte das Risiko einfach nicht noch mal eingehen.“

Lesen Sie auch Nadals Trainer Mit diesen sieben Regeln spielen Sie besser Tennis

Beim von Cincinnati nach New York verlegten Masters-Event nun werden – wenn überhaupt – nur andere Profis und Menschen, die ebenfalls in der Blase leben, zuschauen. Von vollen Rängen wie noch an der Adria ist man an der US-Ostküste weit entfernt.

Anzeige

Wer am Montagabend die Partie gegen Murray sah, konnte beobachten, wie Zverev immer noch zu oft Schwierigkeiten mit seinem zweiten Aufschlag hatte. „Daran habe ich die letzten sechs Monate gearbeitet. Während des Spiels war es eigentlich ganz okay, aber in den wichtigen Momenten war es wieder weg“, meinte Zverev, seit Kurzem mit dem spanischen Ex-Profi David Ferrer als Trainer unterwegs.

An dieser Stelle finden Sie Inhalte aus Twitter Um mit Inhalten aus Twitter und anderen sozialen Netzwerken zu interagieren oder diese darzustellen, brauchen wir Ihre Zustimmung. Soziale Netzwerke aktivieren

Die Niederlage gefiel Zverev nicht – schließlich gibt es bis zum Start des Grand Slams am Montag an gleicher Stelle keine weitere Chance mehr, unter Wettkampfbedingungen in Form zu kommen –, beunruhigte ihn aber auch nicht über Gebühr. „Es ist das erste offizielle Turnier nach sechs Monaten, da ist es normal, dass nicht jeder direkt sein bestes Tennis spielen kann“, erklärte Zverev.

Auch sein Kumpel Dominic Thiem schied aus (2:6, 1:6 gegen Filip Krajinovic) und war danach trotz des „furchtbaren“ Spiels nicht arg aufgeregt. „Beide Gegner von uns sind erstens einmal richtig gute Spieler, zweitens haben beide auch schon ein Wettkampfmatch in den Beinen, was ein Riesenunterschied ist, und von dem her würde ich sagen, dass das für beide nicht zu beunruhigend ist und es hoffentlich besser läuft nächste Woche“, sagte der Österreicher.

Lesen Sie auch Triathletin Nina Kraft (†51) Die Tragödie nach dem Betrug

Anzeige

"Hier finden Sie unseren Live-Ticker mit allen relevanten Updates zur Corona-Krise."""
Wie der Schweizer Rundfunk mit weniger Geld viel mehr erreichen will;Für rund 45 Millionen Euro im Jahr versuchen sich ARD und ZDF an einem Jugendangebot im Netz. Auch in der Schweiz will man ein jüngeres Publikum. Der Weg aber ist ein gänzlich anderer. „Horrende Preise“ will man dort nicht mehr zahlen.
Forscher stellen Methode zur Corona-Überwachung über das Abwasser vor;
„Das sind sehr kritische Worte gegenüber Armin Laschet“;Das Corona-Konzept der Landesregierung funktioniere überhaupt nicht. Das beklagen Schulleiter aus NRW in einem Brandbrief an Ministerpräsident Armin Laschet. WELT-Reporter Jens Reupert über die Lage an den Schulen.
RKI-Studie in bayerischem Hotspot – 6 Prozent haben Antikörper;
"Darum gibt es nur noch so selten Todesopfer;""Anzeige"

Seit einem halben Jahr ist Hamburg von der Corona-Pandemie betroffen. Die Stadt ist nach Einschätzung des Leiters der Intensivmedizin am Universitätsklinikum Eppendorf (UKE), Stefan Kluge (52), wie die benachbarten Bundesländer bislang glimpflich davongekommen. „Wir waren einfach gut vorbereitet, so dass wir in Deutschland keine starke Übersterblichkeit hatten“, sagt Kluge. Das heißt, es sind in Hamburg zwar 232 Menschen an Covid-19 gestorben, mehr als 9200 in ganz Deutschland, es gab aber insgesamt nur etwas mehr Tote als in anderen Jahren – im Unterschied zu Italien, England und den USA.

Lesen Sie auch Immobilienboom Große Villen retten Leben

Am 27. Februar war ein erster Fall eines Infizierten in Hamburg bestätigt worden: Ein Arzt an der Kinderklinik am UKE hatte sich bei einer Reise in die norditalienische Region Trentino infiziert. Der 1955 geborene Mediziner musste an seinem Wohnort Henstedt-Ulzburg (Kreis Segeberg) in Quarantäne gehen. Dann ergaben sich neue Fälle, deren Zahl besonders nach den Hamburger Skiferien im März zunahm. Knapp einen Monat nach dem ersten Fall verzeichneten die Gesundheitsämter den Höhepunkt der Neuinfektionen. 248 Fälle meldete die Gesundheitsbehörde für den 24. März. Auf denselben Tag datierte das Institut für Rechtsmedizin den ersten Todesfall. Wieder einen Monat später kam der Tag mit den meisten Opfern. Am 25. April starben in Hamburg 15 Patienten an Covid-19.

Inzwischen gibt es nur noch selten Todesopfer. Zuletzt starb jeweils ein Erkrankter am 27. Juni, am 30. Juli und am 20. August. Die Hamburger Krankenhäuser waren am 14. April am stärksten gefordert. Damals lagen nach Angaben der Gesundheitsbehörde 311 Corona-Patienten in den Kliniken, davon 100 auf Intensivstationen. Zurzeit werden nur etwa 20 Menschen wegen Covid-19 in den Krankenhäusern behandelt.

Anzeige

Mit den Sommerferien ist die Zahl der Neuinfektionen gestiegen, aber nicht die Zahl der Klinikpatienten oder der Todesfälle. Warum ist das so? „Der Altersdurchschnitt der Infizierten geht runter, und die Jüngeren haben ein geringeres Risiko zu erkranken, schwer zu erkranken und zu versterben“, sagt Kluge. Der Facharzt für Innere Medizin und Lungenheilkunde verweist auf die Statistik des Robert Koch-Instituts (RKI), wonach das Durchschnittsalter der Infizierten von 52 Jahren auf 32 gesunken ist. „Die typischen Mallorca-Urlauber am Ballermann sind alle unter 30, und die sterben zum Glück extrem selten.“ Das Durchschnittsalter der Verstorbenen in Deutschland liegt nach Angaben des RKI bei 81 Jahren.

Lesen Sie auch Bilanz nach zwei Wochen Geringes Infektionsgeschehen an den Schulen

Der Klinikdirektor sieht noch einen weiteren Grund für die positive Entwicklung: „Die ältere Bevölkerung ist sehr vorsichtig.“ Während die Jüngeren sich schon wieder mit Handschlag und Umarmung begrüßten, überlegten es sich die Älteren dreimal, ob sie zum Arzt oder in einen Supermarkt gingen. „Ich kann mir schon vorstellen, dass man als junger, gesunder Mensch sagt: „Was soll das alles? Die Maßnahmen waren völlig übertrieben““, sagt Kluge. Doch wer einen Angehörigen verloren oder Langzeitfolgen habe, sehe das ganz anders. In Deutschland seien auch junge Menschen an Covid-19 gestorben.

Mit den Hygieneregeln, dem Abstandsgebot und der Maskenpflicht habe Deutschland die richtigen Maßnahmen getroffen. Das Besondere am Sars-CoV-2-Errerger sei, dass Menschen ohne Anzeichen von Krankheit ansteckend sein könnten. Darum sei es auch sehr sinnvoll, großzügig zu testen. Während in Hamburg Ende März nur rund 3400 Menschen pro Tag auf das Virus untersucht wurden, waren es Mitte August laut Gesundheitsbehörde 9500.

Lesen Sie auch Treffen der Gesundheitsminister Was Reiserückkehrer aus Risikogebieten künftig an neuen Regelungen erwartet

Anzeige

„Wir haben extrem viel gelernt“, sagt Kluge mit Blick auf die Behandlung von Covid-19-Patienten. Erkrankte, die eine Lungenentzündung entwickelten, verblieben meist längere Zeit auf der Intensivstation. Zwei Drittel von ihnen müssten beatmet werden, meist zwei bis drei Wochen lang. Als wirksam hätten sich zwei Medikamente erwiesen, erklärt Kluge. In der Frühphase mildere das eigentlich gegen Ebola entwickelte Remdesivir die Symptome bei Krankenhauspatienten. In der Spätphase verbessere das Cortison-Präparat Dexamethason die Überlebenschance von beatmeten Patienten deutlich. Das habe eine britische Studie ergeben. Die Obduktionen im Institut für Rechtsmedizin hätten zudem gezeigt, dass Patienten auch an einer Lungenembolie gestorben seien. Darum sei wahrscheinlich die Verabreichung eines Blutverdünners hilfreich, sagt Kluge. Das werde gerade am UKE erforscht.

Auch nach der Genesung litten viele Klinikpatienten unter extremer Müdigkeit, der sogenannten Fatigue, Luftnot und Gelenkschmerzen, wie eine italienische Studie gezeigt habe. Die Nachuntersuchungen fanden zwei Monate nach der Entlassung aus dem Krankenhaus statt. Betroffen waren demnach knapp 90 Prozent der Patienten. Die Ärzte hofften jedoch, dass die Symptome sich mit der Zeit verlieren.

Kluge teilt die Sorge vor einer Zunahme der Infektionen im Herbst. Wenn sich die Menschen wieder mehr in geschlossenen Räumen aufhielten, könnten sie sich leichter durch das ausgeatmete Aerosol anstecken. Andererseits habe Deutschland ein gutes Kontroll- und Gesundheitssystem. „Ich glaube, wir müssen auf Sicht fahren“, sagte Kluge. Allerdings müsse unbedingt vermieden werden, andere Patienten mit Krebs, Herzinfarkt oder Schlaganfall schlechter zu behandeln.

Anzeige

Der Medizinprofessor setzt große Hoffnungen in einen guten Impfstoff. Dann könnte die Krankheit effektiv verhindert oder sogar vollständig eliminiert werden, vorausgesetzt, es ließen sich viele Menschen impfen. „Wir wären natürlich froh, wenn die Gesellschaft das Thema auch mal abschließen könnte“," sagt Kluge."""
"Zwei Banküberfälle in Berlin – Täter geflüchtet;""Am Dienstagmorgen ist es in Berlin zu zwei Banküberfällen gekommen. Der erste Alarm ging bei der Polizei gegen 9.25 Uhr aus Schöneberg ein. Um 10 Uhr folgte ein Alarm am Kurfürstendamm. Ein Zusammenhang liegt nahe – und wird von der Polizei überprüft."

Polizisten stehen nach einem Banküberfall im Eingangsbereich einer Bank am Kurfürstendamm in Charlottenburg

Anzeige

Zwei Banken sind am Dienstagvormittag in Berlin überfallen worden. In beiden Fällen soll es sich nach Angaben der Polizei um jeweils einen Täter handeln, der anschließend unerkannt flüchtete. Menschen wurden bei den Überfällen in der Hauptstraße in Schöneberg und am Kurfürstendamm in Charlottenburg nicht verletzt. Die Polizei prüft, ob es einen Zusammenhang gibt und beide Überfälle vom gleichen Täter verübt wurden. Ob Geld erbeutet wurde, teilte die Polizei nicht mit. Die Bereiche um die Banken wurden abgesperrt, die Spurensicherung der Kriminalpolizei war im Einsatz.

Der erste Alarm ging bei der Polizei gegen 9.25 Uhr aus Schöneberg ein. Um 10 Uhr folgte der Alarm vom Kurfürstendamm. In beiden Fällen traf es Filialen der Commerzbank. Sie liegen etwa drei Kilometer voneinander entfernt. Ein Bankangestellter stand anschließend unter Schock.

Banküberfälle sind inzwischen selten, weil Banken keine großen Bargeldsummen mehr offen aufbewahren, sondern das Geld über die Automaten auszahlen. Zudem gibt es meist Tresore mit Zeitschlössern, die sich nicht sofort öffnen lassen.

Anfang August weiterer Überfall

Anzeige

Allerdings gab es zuletzt Anfang August einen Überfall auf eine Bank am Bundesplatz. Die maskierten Täter rammten mit einem Transporter ein Fenstergitter der Bank in einem Hof und stiegen in die Filiale ein. Sie wurden von einem Wachmann überrascht, auf den sie mehrfach schossen und ihn verletzten. Danach zündeten die Räuber den Transporter an und flüchteten zu Fuß und ohne Beute zur nahen Stadtautobahn, wo sie einen wartenden Fluchtwagen bestiegen. Die Polizei suchte am folgenden Tag aufwendig die Autobahn nach Spuren ab.

Lesen Sie auch Berlin Schüsse bei versuchtem Banküberfall – Security-Mitarbeiter verletzt

Einige Tage zuvor hatten Räuber versucht, einen Geldboten in einer Bankfiliale am Hermannplatz in Neukölln zu überfallen. Die Polizei prüfte, ob es einen Zusammenhang gab und ob Spuren oder Hinweise zu kriminellen Mitgliedern arabischstämmiger Clans führen," die in den vergangenen Jahren mehrfach Überfälle auf Geldtransporte und Kaufhäuser sowie Einbrüche in Banken verübten."""
"Zwei Genesene infizieren sich erneut mit Corona;""Erst ein Fall in Hongkong", nun auch in Belgien und den Niederlanden: Bereits Genesene haben sich zum zweiten Mal mit dem Coronavirus infiziert. Der genetische Code der zweiten Infektion habe sich deutlich von dem der ersten Ansteckung unterschieden.

Nach einem ersten Fall in Hongkong berichten nun auch Forscher in Belgien und den Niederlanden von Nachweisen einer erneuten Corona-Infektion bei zuvor Genesenen. Nun stehen weitere Untersuchungen an.

Anzeige

Nach einem ersten Fall in Hongkong berichten nun auch Forscher in Belgien und den Niederlanden von Nachweisen einer erneuten Corona-Infektion bei von der Krankheit Genesenen. In den Niederlanden gehe es um einen älteren Patienten mit einem schwachen Immunsystem, sagte die Virologin und Beraterin der niederländischen Regierung, Marion Koopmans, am Dienstagmorgen im niederländischen Radio.

Jede Sars-CoV-2-Infektion hat nach ihren Worten einen „einzigartigen genetischen Fingerabdruck“. Bei Tests sei bei diesem Patienten festgestellt worden, dass der genetische Code der zweiten Infektion sich deutlich von dem der ersten unterscheide. Das spricht gegen ein Wiederaufflammen der ersten Infektion. Einzelheiten zu dem Krankheitsverlauf bei dem Patienten nannte sie nicht.

Über eine erneute Infektion ist die Virologin nach eigenen Worten nicht überrascht. „Von anderen Infektionen der Atemwege wissen wir, dass man nicht lebenslang geschützt ist, und das erwarten wir auch nicht von Covid-19.“ Nun müsse untersucht werden, ob es tatsächlich häufiger vorkomme oder ob es um Einzelfälle gehe.

