title;text

Anzeige LEGO Alternativen R.M.S. Titanic von Cobi jetzt online kaufen

Dass nicht nur Lego starke Lizenzen einkaufen kann, beweist die amerikanische Spielefirma Mattel. Unter dem Namen „Mega Construx“ vertreibt sie Lego-Kompatible Modelle aus „Game of Thrones“, „Assassins Creed“, „Star Trek“ oder Castle Grayskull* aus „He-Man“.

Anzeige LEGO Alternativen Grayskull von Mega Construx jetzt online kaufen

Lego-Alternativen: Fazit

Anzeige

Alternative Anbieter der beliebten Klemmbausteine gibt es mittlerweile in jedem Produktsegment. Häufig warten diese mit neuen Ideen, Verbesserungen oder einem verlockenden Preis-/Leistungsverhältnis auf. Um ein wirkliches Schnäppchen zu machen, sollte bei den einzelnen Sets immer auf vorangegangene Käufer-Rezensionen geachtet werden, ob die Qualität stimmt. Ausschließliche Fans des dänischen Konzerns müssen sich aber keine Sorgen machen. Auch Lego arbeitet daran, seine Kundenwünsche besser zu erfüllen. Wer sich gerne selbst in die Produktpolitik einbringen möchte, dem sei ein Blick auf Legos „Ideas“-Webseite ans Herz gelegt, auf der Bastler ihre Ideen einbringen und bewerten lassen können, mit einer Chance, dass Lego sie in Serie produziert.

Lesen Sie auch Robotik für Kinder So lernen Kinder spielend das Programmieren





*Dieser Text enthält Affiliate Links. Das bedeutet: Sollten Sie über die mit einem Stern gekennzeichneten Links einen Kauf abschließen, erhält WELT eine kleine Provision. Die Berichterstattung beeinflusst das nicht. Unsere Standards der Transparenz und journalistischen Unabhängigkeit finden Sie unter axelspringer.de/unabhaengigkeit.

"Dieser Artikel wurde erstmals am 11.02.2020 veröffentlicht."""
"Wieso die Krankheit Lupus erythematodes so schwer zu erkennen ist;""„Plötzlich rebellierte mein Körper gegen mich“ – so brachte Lady Gaga ihre Erfahrungen mit Lupus erythematodes auf den Punkt. Bei der Krankheit richtet sich das Immunsystem gegen den eigenen Körper. Sie zu erkennen ist schwierig. Professor Martin Aringer erklärt", warum die Erkrankung zwar nicht heilbar, aber behandelbar ist.

"WELT: Bei einem Begriff wie Lupus erythematodes denkt man an Erytheme und damit an eine Hauterkrankung. Doch jetzt sprechen wir gerade mit einem Rheumatologen und Internisten darüber … Sind wir an der falschen Adresse?"""
"Warum die meisten Haftstrafen in Deutschland sinnlos sind;""Thomas Galli arbeitete 15 Jahre in Führungspositionen im Strafvollzug. Was er in dieser Zeit erlebte", änderte sein Denken über fundamental

"Quelle: Cover/Getty Images/Matias Nieto; Ronald Hansch"""
„Was über mich und Vettel geschrieben wurde, ist totaler Schwachsinn“;
"So viel verdienen die Deutschen;""Für ein maximales Gehalt kommt es auf die perfekte Kombination von Branche und Job an. Wer viel verdienen will", braucht Personalverantwortung – muss aber nicht unbedingt studieren. Hier stehen Sie im Vergleich.

Anzeige

Geld macht nicht glücklich, aber es beruhigt. Das zu erwartende Gehalt bleibt auch für junge Menschen ein wichtiges Entscheidungskriterium für oder gegen eine Ausbildung. Aber, was ist überhaupt ein überdurchschnittlich hohes Gehalt, was verdienen eigentlich Führungskräfte, und muss man für finanzielle Sorglosigkeit immer studieren? WELT fasst wichtige Punkte zusammen.

1. Durchschnittsgehalt in Deutschland

Ein vollzeitbeschäftigter Arbeitnehmer in Deutschland verdiente im vergangenen Jahr im Schnitt 3994 Euro brutto im Monat, zeigen Zahlen des Statistischen Bundesamts. 2018 lag der Wert bei 3880 Euro, 2008 bei 3103 Euro. Sonderzahlungen wie Urlaubs- oder Weihnachtsgeld rechnen die Statistiker nicht mit ein.

Allerdings beziehen rund zwei Drittel der Deutschen Monatsgehälter, die unter dem Durchschnitt von 3994 Euro brutto liegen. Nur etwa ein Drittel erhält mehr als diesen Wert. Das liegt daran, dass diese Gruppe so hohe Verdienste hat, dass sie den Durchschnittswert für alle Beschäftigten „nach oben“ zieht.

Quelle: Infografik WELT

Anzeige

Das Jobportal Stepstone, das wie WELT zu Axel Springer gehört, analysiert speziell Gehälter von Fach- und Führungskräften. Demnach verdient eine Fachkraft in Deutschland im Schnitt 58.800 Euro brutto im Jahr. Basis sind 128.000 Gehälter, die von Oktober 2018 bis Oktober 2019 erhoben wurden. Zahlungen wie Boni und Provisionen werden hier miteinbezogen.

Mehr Informationen zum Thema Durchschnittsgehalt finden Sie hier:

Lesen Sie auch Persönlicher Gehaltscheck Verdiene ich mehr als die anderen – oder weniger?

2. Gehaltsvergleich: Diese Berufsgruppen verdienen am besten

Der Stepstone-Analyse zufolge sind Ärzte die bestverdienenden Akademiker. Im Schnitt erhalten sie ein Bruttogehalt von 92.300 Euro im Jahr. Auch wenn es zwischen den einzelnen medizinischen Berufen beträchtliche Unterschiede gibt, gilt doch: Keine andere Gruppe von Absolventen kann ein vergleichbar hohes Einkommen erzielen.

Jobportal JOBS.WELT.DE Bleiben oder gehen? Der Job-Agent hilft weiter.

Anzeige

Vermögensberater, Controller und andere Finanzexperten kommen auf 76.400 Euro im Jahr. Sie stellen damit die am zweitbesten bezahlte Akademikergruppe in der Republik. An dritter Stelle stehen Juristen. Der Abschluss eines Jurastudiums verhilft ihnen zu einem Durchschnittsgehalt von 70.000 Euro.

Mehr Informationen über Gehälter in Deutschland finden Sie hier:

Lesen Sie auch Gehaltsreport 2020 Hier verdienen Sie als Fachkraft am meisten

3. Ausbildungsberufe: Geringe aber auch hohe Einkommen

Den richtigen Beruf finden? Das ist für junge Leute oft alles andere als einfach. Es geht darum, Vorlieben und Neigungen auszuloten. Aber auch der Verdienst spielt eine große Rolle. Viele glauben, dass sie nur mit einem Studium ein gutes bis sehr gutes Einkommen erzielen können.

Anzeige

Zwar ist ein Studium im Vergleich durchaus lukrativ: Laut Statistischem Bundesamt kamen Akademiker im Jahr 2014 auf ein Bruttostundengehalt von durchschnittlich über 27 Euro, Beschäftigte mit einer abgeschlossenen Berufsausbildung nur auf rund 16 Euro. Doch auch in Ausbildungberufen sind mitunter Topgehälter drin.

An dieser Stelle finden Sie Inhalte von Drittanbietern Um mit Inhalten von Drittanbietern zu interagieren oder diese darzustellen, brauchen wir Ihre Zustimmung. Externe Inhalte aktivieren

Fluglotsen zum Beispiel gehören zu den Spitzenverdienern unter den Nichtakademikern: Die Tätigkeit ist komplex. Bewerber um einen Ausbildungsplatz müssen das Abitur haben, fließend Englisch sprechen und einen schwierigen Auswahltest meistern. Fluglotsen können laut Bundesagentur für Arbeit (BA) zwischen rund 6400 und 8900 Euro brutto im Monat verdienen.

Mehr Informationen über lukrative Ausbildungsberufe finden Sie hier:

Lesen Sie auch Einkommen In diesen Berufen erzielen Sie auch ohne Studium ein Top-Gehalt

Lesen Sie auch Fachkräfte In diesen Ausbildungsberufen können Sie ihr Gehalt schnell steigern

Lesen Sie auch Das erste eigene Geld Bis zu 1473 Euro – So unterschiedlich verdienen Auszubildende

4. Gehälter in verschiedenen Branchen

Auch die Branche hat einen Einfluss auf die Höhe des Gehalts. Dem Statistischen Bundesamt zufolge verdienten vollzeitbeschäftigte Arbeitnehmer im Bereich Energieversorgung mit einem Bruttomonatsverdienst von 5137 Euro ohne Sonderzahlungen am besten. Am wenigsten war im Gastgewerbe mit 2451 Euro drin.

Quelle: Infografik WELT

Die Stepstone-Tochter Compensation Partner verglich anhand von 132.218 Gehaltsdaten speziell branchenübergreifend vorkommende Berufsgruppen, also etwa Personaler oder Netzwerkadministratoren.

Das Ergebnis: In der Biotechnologie zahlen Arbeitgeber in diesen Berufen um bis zu 39 Prozent höhere Löhne als der Durchschnitt der Unternehmen aller Wirtschaftszweige. Ebenfalls gut verdienen Arbeitnehmer in der Halbleiterbranche (30 Prozent über dem Schnitt).

Hier können Sie unsere WELT-Podcasts hören Wir nutzen den Player des Anbieters Podigee für unsere WELT-Podcasts. Damit Sie den Podcast-Player sehen können und um mit Inhalten aus Podigee und anderen sozialen Netzwerken zu interagieren oder diese darzustellen, brauchen wir Ihre Zustimmung. Soziale Netzwerke aktivieren

Am schlechtesten schneidet der Bereich Callcenter ab. Arbeitgeber zahlen hier bis zu 31 Prozent niedrigere Löhne als der Durchschnitt der Unternehmen aller Wirtschaftszweige. Im Vergleich ebenfalls wenig erhalten Arbeitnehmer bei Zeitarbeitsfirmen (20 Prozent unter dem Schnitt).

Anzeige
