title;text

Ende Juni kehrte er wieder als reguläres Mitglied in den Aufsichtsrat zurück. Es war praktisch das offizielle Comeback von Thiele in den Gremien. Wie es heißt, wurde jetzt das Ausscheiden von Eulitz einstimmig in dem Kontrollgremium beschlossen.

Es stehe in keinem Zusammenhang mit der erfolgreichen Unternehmensentwicklung, betont der Konzern. An der Börse geriet die Aktie dennoch unter Druck. Am Donnerstagmittag lag das Minus bei fast vier Prozent auf 100,62 Euro.

Lesen Sie auch Schienentechnik Ein deutsches Unternehmen ist Chinas neues Einfallstor nach Europa

Anzeige

In der Vergangenheit hat Knorr-Bremse mehrfach von überraschenden Managerwechseln berichtet. Beispielsweise schied Ende April nach nur zwei Jahren Finanzvorstand Ralph Heuwing aus, dem auch Ambitionen auf den Vorstandsvorsitz nachgesagt wurden.

Während das Ausscheiden des Finanzchefs offen bedauert wurde, genoss längst nicht jeder Topmanager das Vertrauen von Thiele: Immer wieder mussten in der Vergangenheit Führungskräfte die Zentrale verlassen. Auch Thieles Sohn Henrik schied 2017 aus dem Unternehmen aus.

Unternehmenskenner verweisen allerdings auf eine schwierige Sandwich-Position für den Vorstandschef zwischen dem Aufsichtsrat mit dem Patriarchen Thiele sowie den Chefs der beiden Säulen Eisenbahn-Bremsen und Lkw-Bremsen. Als der jetzt wieder ausscheidende Manager Eulitz vom Gasekonzen Linde zu Knorr-Bremse wechselte," fehlte ihm die große Expertise aus dem Bremsengeschäft."""
Hier ist das Tragen von Schutzmasken ausdrücklich verboten;
"Junge verdurstet – „Schlicht im Stich gelassen“;""Anzeige"

Nach dem qualvollen Tod eines Zweijährigen in Grevenbroich hat das Landgericht Mönchengladbach die Mutter zu siebeneinhalb Jahren Haft verurteilt. Das Gericht sprach die 28-Jährige am Donnerstag des versuchten Totschlags und der Körperverletzung mit Todesfolge, jeweils durch Unterlassen, schuldig. Die Frau hatte das Kind demnach bewusst zwei Tage lang unversorgt in einem überhitzten Zimmer ihrer Wohnung liegen lassen. Es verdurstete.

Mutter von zwei Kindern

Nach Feststellung des Gerichts hatte die Mutter von zwei Kindern den kleinen Leon am Abend des 14. April 2019 in einen Schlafsack gepackt und ins Kinderbett gelegt. Weil die Heizung in der Wohnung ausgefallen war, drehte sie einen Heizlüfter voll auf und stellte ihn vor das Bett. Erst am Vormittag des übernächsten Tages ging sie wieder in das Zimmer, um nach ihrem Sohn zu schauen. Sie habe ihn „schlicht im Stich gelassen“, sagte der Richter.

Lesen Sie auch Kind weggenommen „Ich werde als Mutter kriminalisiert und entsorgt“

Mit dem Urteil folgte die Kammer dem Antrag der Staatsanwaltschaft. Da der genaue Todeszeitpunkt im Prozess nicht festgestellt werden konnte, habe der Angeklagten kein Tötungsvorsatz nachgewiesen werden können, sagte der Richter. Deshalb wurde sie nur wegen versuchten Totschlags durch Unterlassen verurteilt.

Anzeige

Die depressive Angeklagte hatte die Tat im Prozess gestanden und ausgesagt, sie sei überfordert gewesen. Sie habe aber nie gedacht," dass das Kind sterben könnte."""
"162.000 Erstklässler eingeschult – mit Einschränkungen;""Anzeige"

Erster Schultag mit Schultüte und Mund-Nasen-Schutz: Bei brütender Hitze und unter Corona-Schutzmaßnahmen sind am Donnerstag die meisten der rund 162.000 Erstklässler in Nordrhein-Westfalen eingeschult worden. Zwei Grundschulen in Viersen und Essen waren allerdings wegen Corona-Fällen geschlossen. Dort fielen die Einschulungsfeiern für die i-Dötzchen aus und wurden verschoben.

Großeltern mussten zu Hause bleiben

Überhaupt gab es bei den traditionell fröhlichen Einschulungen teilweise erhebliche Einschränkungen. So konnte an einigen Schulen wegen der Corona-Auflagen nur ein Elternteil dabei sein, oder Großeltern und Verwandte mussten zu Hause bleiben. Die Grundschüler müssen in Fluren und auf dem Schulgelände Maske tragen. Nur an ihrem Platz im Klassenzimmer dürfen sie die Masken ablegen – eine besondere Herausforderung für die Kinder und ihre Lehrer.

Zwei Schulen geschlossen

In der Elisabethschule in Essen fiel die Einschulung am Donnerstag ganz aus. Dort hatte sich eine Lehrerin mit dem Virus angesteckt. Sie musste zusammen mit vier Kollegen, die Kontakt mit ihr hatten, für 14 Tage in Quarantäne. Aus Mangel an Lehrkräften sei die Schule am Donnerstag daher geschlossen und die Einschulung auf Freitag verschoben worden, sagte eine Stadtsprecherin. Die Schule habe einen Vertretungsplan ausgearbeitet. Für die Klassen 2 bis 4 soll der Unterricht in einer Mischung aus Lernen in der Klasse und Hausaufgaben zu Hause fortgesetzt werden. Schüler seien von Corona-Infektionen nicht betroffen.

Anzeige

Im Viersener Stadtteil Süchteln war bereits am Mittwoch eine Grundschule geschlossen worden, weil sich eine Lehrerin mit dem Coronavirus angesteckt hatte. Da sie zuvor an der ersten Konferenz des Lehrerkollegiums teilgenommen hatte, sei vorsorglich das gesamte Personal unter Quarantäne gestellt worden. „Da ohne Lehrerinnen kein Unterricht mehr möglich ist, bleibt die Schule bis zum 24.8.2020 geschlossen“, hatte die Schule mitgeteilt.

Lesen Sie auch Schulstart trotz Corona Wie Schulunterricht jetzt funktionieren soll

Das Schulministerium appellierte an Schulen und Eltern, konsequent, aber auch unaufgeregt und professionell mit dem Coronavirus und der Bekämpfung von Infektionsketten umzugehen. „Die Coronavirus-Pandemie wird weiterhin zu Infektionen in allen Lebensbereichen Nordrhein-Westfalens führen, und auch Bildungseinrichtungen werden davon nicht ausgenommen sein“, sagte Schulstaatssekretär Mathias Richter der Deutschen Presse-Agentur.

Schulschließungen in Kauf nehmen

Die Landesregierung habe sämtliche Vorkehrungen getroffen, dass bei Corona-Fällen breit in Schulen getestet werde. Die zuständigen Gesundheitsbehörden verfügten über die nötige Expertise, Maßnahmen zu ergreifen, die verhältnismäßig und den jeweiligen Bedingungen vor Ort angemessen seien. „Wichtig ist, dass künftig nicht jegliche Infektion im Umfeld von Schulen automatisch zu einer kompletten Schulschließung führt, sondern die örtlich zuständigen Behörden auch mildere Maßnahmen prüfen“, sagte Richter.

Anzeige

Landesweit gebe es 2,5 Millionen Schüler und 5500 Schulen. Rechne man Eltern und Lehrer hinzu, dann sei etwa die Hälfte der Bevölkerung in NRW unmittelbar in das Schulleben involviert. „Corona ist auch im Schulsystem nicht zu vermeiden“, sagte Richter. Wenn vereinzelt Schulen wegen Corona-Fällen zeitweise geschlossen werden," „muss man das in Kauf nehmen“."""
Warum Jungen salzige Limonade ausspucken und Mädchen nicht;
1135 Euro Verlust pro Wagen – dieser deutsche Autobauer muss dringend handeln;
"Sehnsucht nach der Toskana? Dann ab nach Dinkelsbühl;""Anzeige"

Verschachtelte Gässchen und gepflasterte Plätze, windschiefe Fachwerkhäuser, Wassergräben und Weiher. Und alles umfriedet von einer mächtigen Stadtmauer, die sich kalt und geschichtsgeladen anfühlt und von Sicherheitsbedürfnissen des Mittelalters erzählt, als man sich vor Angreifern steinern wappnen musste und nicht vor einer viralen Gefahr. Der Feind war sichtbar – meistens.

Also sorgte man für den rechten Überblick – von oben. Noch heute stehen auf nur 200 Metern ehemaliger Stadtgrenze fünf Türme Spalier, vor Ort bekannt als „Turmparade“. Dinkelsbühl beheimatet mit seiner Altstadt eines der besterhaltenen mittelalterlichen Stadtbilder in Deutschland.

Und doch kommt man in Dinkelsbühl schnell auf Italien zu sprechen. Denn die Turmparade erinnert wissende Besucher und Einwohner der mittelfränkischen Stadt an das nicht minder mittelalterliche San Gimignano in der Toskana, das sich wegen ähnlicher Turmbauten einen Namen als das „Manhattan des Mittelalters“ gemacht hat. Ein Attribut, das auch Dinkelsbühl verdienen würde, wenn man auf die Einwohner hört.

Dinkelsbühl übertrifft San Gimignano in der Toskana

Anzeige

Unweit der Turmparade findet man also schnell eine Hausbewohnerin am Oberen Mauerweg, die sagt: „Ich war schon mal in San Gimignano – aber mir gefällt’s in Dinkelsbühl besser.“ Tauschen möge sie nicht, auch wenn es in der Altstadt inzwischen keinen Supermarkt mehr gebe.

Dafür schätzt sie die Gemeinschaft in dem mittelalterlichen Ensemble – zu der auch eine Storchenfamilie auf dem Rathaus zählt. „Die eine Familie ist das ganze Jahr bei uns“, sagt die Dame.

Die anderen vier Storchenpaare fliegen stets in ihr afrikanisches Winterquartier – vielleicht kommen sie auch über die Weinreben von San Gimignano und deren mittelalterliche Skyline, von der 13 von einst 72 Türmen erhalten sind. Sie stammen überwiegend aus dem elften und zwölften Jahrhundert.

Anzeige

Bei der puren Zahl liegt die deutsche Stadt sogar vor San Gimignano: „Dinkelsbühl hat noch 18 von früher 60 Türmen“, sagt Metzner. Als Wahrzeichen der Stadt fungiert exemplarisch der Bäuerlinsturm. Allesamt wurden die aufragenden Steinzeugen zwischen dem 14. bis 16. Jahrhundert errichtet – und sie dienten als reine Wehranlagen, berichtet Metzner.

Das Wörnitztor ist das älteste der vier Stadttore Quelle: picture alliance / Bildagentur-online/Gernhoefer-Mc

„Bei uns herrschten die Zünfte. Gerber und Schuhmacher, Tucher, Schneider und Korbmacher übten ihr Handwerk aus“, sagt die Stadthistorikerin. Diese sorgten für ihren eigenen baulichen und göttlichen Schutz, indem sie die Stadtmauer und die Kirche finanzierten. „Ein Brezenfenster im Münster St. Georg zeugt davon“, sagt sie.

In San Gimignano dienten die Türme weniger als Wehranlagen zu Verteidigungszwecken, denn als prestigeträchtige, aufragende Wohnanlagen, als sogenannte Geschlechtertürme, den Schönen und Reichen von damals. Vielleicht ist so zu begründen, dass sich die Bauten in San Gimignano im Wettstreit der Adelsfamilien auf bis zu 54 Meter hochschraubten, während der Dinkelsbühler Grüne Turm als größter der Stadt auf nur 42 Meter kommt.

Schafe brachten der Stadt in Franken Wohlstand

Anzeige

Unterschiede der beiden mittelalterlichen Manhattans gab es auch im Handel. Während in San Gimignano Safran und Wein für Wohlstand sorgten, waren es in Dinkelsbühl die Schafe. Mit ihrer Wolle wurde feines Tuch erzeugt. Den Wein aus Italien konnte man sich deshalb leisten. Und es wurde viel Wein getrunken, da das Wasser nicht sauber war.

Über solche historischen Umstände weiß Helmut Gerbeth berufsbedingt Bescheid. Seit 20 Jahren bittet er als „Nachtwächter“ der Stadt seine Gäste täglich um 21 Uhr zum Rundgang.

Er erzählt vom Bettelvogt, der die Lizenz zum Betteln vergab. Eine Blechmarke war der Bettelausweis, von der die schwäbische Redewendung „Heilig’s Blechle“ abgeleitet wurde.

Nachtwächter Gerbeth weist auch auf einen unscheinbaren Kasten am historischen, Schranne genannten Kornspeicher am Weinmarkt hin: „Hat jemand vier Euro? Und will die Stadt zum Leuchten bringen?“ Jeden Abend ab exakt 22.01 Uhr, nachdem die städtische Beleuchtung abgeschaltet ist, kann jedermann die Scheinwerfer anschalten, die die Sehenswürdigkeiten der Stadt in warmes Licht tauchen – für 20 Minuten. Wer mehr will, muss Münzen nachwerfen.

Die Romantische Straße führt durch den Ort
