title;text
Die beiden größten europäischen Häfen Rotterdam und Antwerpen nutzten in den vergangenen Jahren ihre geografischen Vorteile nahe an der Nordsee und bauten ihren Umschlag weiter aus. Hamburg hingegen konnte nach der Finanzmarktkrise nicht an das starke Wachstum der 1990er- und der Nullerjahre anknüpfen. Vor allem bei den Transitverkehren von Containern, die weiter in den Ostseeraum transportiert werden oder die von dort kommen, hat die Hansestadt Marktanteile verloren.

Erzkonkurrenten sprechen über Kooperation

Anzeige

Nun zeichnen sich Entwicklungen ab, die noch vor einem Jahr undenkbar erschienen. Das Unternehmen Eurogate – wichtigster Konkurrent des Hamburger Marktführers HHLA – verdient an seinen Containerterminals in Hamburg, Bremerhaven und Wilhelmshaven seit einiger Zeit kein Geld mehr. In einer Videobotschaft an die Mitarbeiter sagten Eurogate-Mitinhaber Thomas Eckelmann und sein Manager Michael Blach kürzlich, dass die deutschen Hafenanlagen des Unternehmens neu organisiert werden müssten. Obendrein habe man Gespräche mit der HHLA über eine Kooperation der deutschen Containerterminals aufgenommen – die womöglich sogar in ein gemeinsames Unternehmen münden könnten. „Doch zunächst muss sich Eurogate restrukturieren“, sagte Eckelmann. „Und dabei ist Eile geboten, weil wir mit der HHLA auf keinen Fall aus einer Position der Schwäche heraus verhandeln werden.“

Als würden Werder und der HSV zusammenarbeiten

Gespräche zwischen dem Ur-Hamburger Unternehmen HHLA und Eurogate, das teilweise auch der Hansestadt Bremen gehört – das ist so, als hätten der HSV und Werder Bremen sich gegenseitig freundlich Fußballprofis ausgeliehen, als sie noch in einer Liga spielten. Die Politik in Hamburg, Niedersachsen und Bremen begrüßt diese Gespräche dennoch. Denn die Not ist groß. „Wir müssen bei den Häfen anfangen, norddeutsch zu denken und nicht in Landesgrenzen“, erklärt Westhagemann den Perspektivwechsel an der Küste. Hamburgs wahre Konkurrenten seien Rotterdam und Antwerpen, nicht aber Bremerhaven und Wilhelmshaven.

Wie eine Zusammenarbeit zwischen HHLA und Eurogate aussehen könnte, ist noch völlig offen. „Die Gespräche befinden sich in einem frühen Anfangsstadium“, sagte HHLA-Chefin Angela Titzrath am Donnerstag bei der Hauptversammlung des Unternehmens, das zu mehr als zwei Dritteln der Stadt Hamburg gehört. Klar sei aber auch: „Es wäre wirtschaftlich nicht verantwortlich, wenn wir uns im eigenen Land im Wettbewerb verkämpfen würden.“

Marktmacht der wenigen Reedereien ist gestiegen

Anzeige

Kartellrechtlich gesehen allerdings wäre eine Kooperation oder gar Fusion der deutschen Containerterminals von HHLA und Eurogate ein heikles Unterfangen. In Hamburg haben die HHLA und Eurogate beim Containerumschlag gemeinsam fast 100 Prozent Marktanteil. Im Normalfall müssten die Beteiligten einen Teil ihrer Anlagen an andere Marktteilnehmer verkaufen. HHLA und Eurogate hoffen aber offenbar darauf, dass die Kartellwächter den Fall anders beurteilen. Denn in den vergangenen Jahren hat sich die Marktmacht der Reedereien massiv verdichtet, mit denen die Terminalbetreiber verhandeln. 2015 habe es noch 21 unabhängige Reedereien in der Containerschifffahrt gegeben, 2020 nur noch elf, und die seien auch noch in drei großen Allianzen vereint, sagte Titzrath ihren Aktionären.

Lesen Sie auch Wohnungsbau oder Industrie CDU drängt auf Zukunftsplan für den Hamburger Hafen

Götz Wiese, der wirtschaftspolitische Sprecher der CDU-Bürgerschaftsfraktion, sieht die Annäherung von HHLA und Eurogate kritisch: „Der Hamburger Hafen braucht ein Wertschöpfungsmodell für die sich rasant verändernde Welt. Das heißt auch: Effizienzgewinne und mehr Wettbewerb“, sagte er dieser Zeitung. „Die Zusammenlegung der Containerterminals mag Effizienzgewinne bringen – mehr Wettbewerb bringt sie nicht. Damit sind nicht nur ordnungspolitisch, sondern auch rechtlich viele Fragen offen.“ Diese Woche forderte die CDU in der Bürgerschaft einen neuen Hafenentwicklungsplan mit einer Perspektive bis zum Jahr 2040. Den will auch der neue rot-grüne Senat in dieser Legislaturperiode vorlegen, der Zeitplan dafür steht aber noch nicht: „Ein koordiniertes Regionalhafenmodell, wie es den Grünen vorschwebt“, sagt Wiese, „wäre für Hamburgs Hafen der Abstieg in die Zweite Liga.“

Wirtschaftssenator Westhagemann will Hamburgs Hafen vor allem mit neuen Technologien voranbringen – in enger Verzahnung auch mit der Energiewende, deren Zentrum das windreiche Norddeutschland ist. „Wir müssen eine Versorgung mit Wasserstoff aufbauen, der aus erneuerbaren Energien gewonnen wird“, sagt er. „Der Hafen wird nicht nur ein Erzeugungs- und Umschlagplatz für ,grünen‘ Wasserstoff sein, sondern auch der Sitz von Unternehmen, die daraus nahe der Kaikanten Grundstoffe und Produkte herstellen.“

Auch HHLA-Chefin Titzrath setzt auf den technologischen Fortschritt. Hamburg gilt in der Schifffahrtsbranche zwar als teurer Hafen, aber auch als derjenige mit der besten Güterbahnanbindung in Europa, vor allem auch durch das HHLA-Bahnunternehmen Metrans. Die HHLA will die Durchlaufzeiten für Container im Hafen beschleunigen und deren gesamten Transportverlauf in den kommenden Jahren weiter optimieren, speziell auch per Digitalisierung. „Der Hamburger Hafen wird auch in Zukunft nicht der größte in Europa sein“, sagt sie," „aber der beste bei den Technologien und der Innovation.“"""
Vettel rauswerfen? „Das wäre eine Schande“;
"Parteichef Lindner will Teuteberg durch Volker Wissing ersetzen;""Anzeige"

FDP-Parteichef Christian Lindner tauscht seine Generalsekretärin aus: Linda Teuteberg muss gehen, Nachfolger soll der rheinland-pfälzische Wirtschaftsminister Volker Wissing werden. Diesen Vorschlag unterbreitete Lindner den Mitgliedern des FDP-Bundesvorstands in einer Sitzung am Montag. Erste Reaktionen auf den Vorschlag fielen positiv aus. Wie WELT von Teilnehmern erfuhr, soll der Unternehmer Harald Christ außerdem als Schatzmeister auf Hermann Otto Solms folgen, der sein Amt niederlegt. Christ, der lange ein SPD-Parteibuch hatte, war erst im Frühjahr in die FDP eingetreten.

Im Präsidium wird außerdem der Beisitzerposten des sachsen-anhaltinischen FDP-Politikers Frank Sitta neu besetzt, der seine politischen Spitzenämter aufgibt. Nachfolgerin soll nach WELT-Informationen die Bundestagsabgeordnete Bettina-Stark Watzinger werden. Zunächst soll Lindner Teuteberg diesen Posten angeboten haben; wie der „Spiegel“ berichtete, habe Teuteberg jedoch abgelehnt.

Die Vorsitzende der Jungen Liberalen, Ria Schröder, hat am Montag Morgen mit Blick auf Lindner eine One-Man-Show in der Partei kritisiert. „Die One-Man-FDP hatten wir vielleicht in der außerparlamentarischen Opposition, als wir nur ein Gesicht hatten. Jetzt haben wir hier drüben 80 Bundestagsabgeordnete sitzen und ein Team aus vielen Erfahrungen von Fachpolitikerinnen und Fachpolitikern“, sagte Schröder am Montag im ARD-„Morgenmagazin“.

Anzeige

„Da kann es natürlich nicht sein, dass immer nur noch das eine Gesicht mit der FDP verbunden wird.“

Zur Debatte um die politische Zukunft von FDP-Generalsekretärin Linda Teuteberg sagte Schröder: „Ich finde diese ganze Posse, die tut uns als Partei überhaupt nicht gut.“ Die Wähler hätten keine Lust darauf, eine Partei zu wählen, die sich ständig streitet.

„Es ist an der Zeit, jetzt wirklich den Turbo anzuschmeißen, weil wir haben in gut einem Jahr eine Bundestagswahl“," sagte Schröder."""
"Söders Corona-Test-Debakel offenbart das gigantische Personalproblem der Union;""Es war schon alles bestens vorbereitet. Am Fähranleger von Schlüttsiel lag die „MS Seeadler“ mit ihrem Kapitän Heini von Holdt bereit", um Markus Söder mit seinem Tross an Bord zu nehmen. Im kleinen Tönning auf der Halbinsel Eiderstedt waren die Hotelbetten für die Bayern bereits gemacht. In der Schutzstation am Leuchtturm von Westerhever und im Multimar-Forum standen die Experten parat, um dem CSU-Star die Wunder des Watts zu erklären.

Daniel Günther, Schleswig-Holsteins Ministerpräsident," hatte sich ebenfalls gut vorbereitet: Er wollte mit Söder an diesem Donnerstagabend in einem Vier-Augen-Gespräch die komplizierte Personallage der Union erörtern."""
"Kirsten Boie liest im Wohnzimmer von Loki und Helmut Schmidt;""Aus der Corona-Not geboren", geht das Projekt „Schmidt-Kultur“ jetzt in Serie – Schriftstellerin Kirsten Boie macht am 27. August auf dem berühmten Ledersofa den Auftakt mit einer Lesung aus „Monis Jahr“.

Anzeige

Eine Dreiviertelstunde Kulturgenuss kommt am Donnerstag, 27. August, live aus dem Wohnzimmer von Helmut und Loki Schmidt in Langenhorn. Die Kinderbuchautorin und Hamburger Ehrenbürgerin Kirsten Boie liest aus ihrem Buch „Monis Jahr“. Die Geschichte spielt im Jahr 1955 in Hamburg und erzählt von einem jungen Mädchen, das auf die höhere Schule wechselt und auf unterschiedlichen Ebenen in neue Welten aufbricht.

Den musikalischen Rahmen gestalten Roman Gerber (Klarinette), Benedikt Loos (Violoncello), Nicolas Kierdorf (Klavier) und Stefania Secci (Kontrabass), allesamt von der Franz-Wirth-Gedächtnis-Stiftung geförderte Studierende oder Absolventen der Hochschule für Musik und Theater. Zu hören ist eine Auswahl aus „Acht Stücke op. 83“ für Klarinette, Violoncello und Klavier von Max Bruch sowie Teppo Hauta-Ahos „Kadenz“ für Kontrabass-Solo.

Max-Bruch-Werke auf Schmidts Steinway

Nicolas Kierdorf spielt auf Helmut Schmidts Flügel, der nicht mehr ganz so oft zum Einsatz kommt wie zu Lebzeiten des Altkanzlers und der deshalb direkt vor dem Konzert noch einmal gestimmt wird. „Die Literatur, die Musik und gleichzeitig den Nachwuchs zu fördern – diese Kombination wäre ganz im Sinne von Helmut und Loki Schmidt gewesen“, sagt Stefan Herms, geschäftsführender Vorstand der Stiftung Helmut und Loki Schmidt. „Diesem Anliegen fühlt sich die Stiftung deshalb sehr verbunden. Wir freuen uns auf den ersten Livestream aus dem Hause Schmidt und wünschen allen Zuschauerinnen und Zuschauern beste Unterhaltung.“ Das Haus des Ehepaares Schmidt steht für Musik- und Kunstgenuss. An den Wänden hängen zahlreiche Gemälde und Grafiken. Im Wohnzimmer steht zentral – gleich neben dem Schachtischchen – der Steinway-Flügel, auf dem Helmut Schmidt bis ins hohe Alter regelmäßig gespielt hat.

Livestream der Konzertlesung

Anzeige

Die Konzertlesung wird von 18 Uhr an live gestreamt und auf der Homepage der Helmut-und-Loki-Schmidt-Stiftung übertragen. Der Link zum Livestream: https://helmut-und-loki-schmidt-stiftung.de/live/

Für Interessierte, die am Donnerstag, 27. August nicht live oder online dabei sein können," ist die Konzertlesung auf der Homepage der Helmut-und-Loki-Schmidt-Stiftung weiterhin abrufbar."""
Müssen wir jetzt alle „asiatischer“ werden?;
"Schwere Vorwürfe Richtung Bayern – Lauterbach fordert andere Test-Methode;""Anzeige"

Nach der schweren Panne bei der Übermittlung von Corona-Testergebnissen kritisiert das Bayerische Rote Kreuz (BRK) die Behörden. Die Hilfsorganisationen seien vom Freistaat beauftragt worden, innerhalb eines Tages fünf Teststationen zu errichten. Dabei hätten sie sich an den Vorgaben des Landesamtes für Gesundheit und Lebensmittelsicherheit (LGL) und der Gesundheitsämter orientiert. „Da das LGL sich nicht in der Lage gesehen hat, in dieser kurzen Zeit eine entsprechende Software zur Verfügung zu stellen, mussten die Reisenden händisch mit Formularen erfasst werden“, hieß es in einer Mitteilung.

Das Rote Kreuz wies „Andeutungen zurück, die darauf schließen lassen, dass die Hilfsorganisationen eine (Teil-)Schuld an dieser Problematik haben“. Es sei bedauerlich, dass der „schweißtreibende Einsatz der Ehrenamtlichen“ in ein negatives Licht gerückt werde, sagte ein Sprecher.

Lesen Sie auch „Peinlich“ Söders Corona-Test-Debakel offenbart das gigantische Personalproblem der Union

Aus mehreren Bundestagsfraktionen kommt Kritik an der Vorgehensweise der Landesregierung im Freistaat. SPD-Gesundheitsexperte Karl Lauterbach fordert als Reaktion auf das Test-Debakel in Bayern eine andere Methode bei Reiserückkehrern. Bisher basieren die Testungen auf der sogenannten Polymerase-Kettenreaktion, kurz PCR, mit der das Erbgut des Virus nachgewiesen werden kann.

SPD-Gesundheitsexperte Karl Lauterbach fordert eine schnellere Zulassung von alternativen Test-Methoden Quelle: dpa-infocom GmbH

Anzeige

„Die PCR-Tests sind bei Massentestungen nicht wirklich geeignet“, sagte Lauterbach WELT. „Massentestungen sind nur möglich, wenn sie schnell und billig erfolgen.“ Die Kosten seien mit 60 Euro hoch, die Wartezeit bis zum Ergebnis lang. „Es ist ausgeschlossen, dass der hohe Testbedarf künftig allein über PCR-Tests gedeckt werden soll.“

Lesen Sie auch Tourismus und Corona Hurra, wir werden getestet!

Der SPD-Politiker und Epidemiologe fordert daher „dringend eine schnelle Zulassung“ von zum Beispiel sogenannten RT-LAMB Tests, wie es sie schon in Großbritannien gibt. Das Ergebnis der Speichel-Schnelltests sei nach 75 bis 80 Minuten da, und der Bürger werde direkt per SMS informiert. Die Kosten pro Test lägen unter zehn Euro, die Sensitivität sei „mehr als ausreichend“ gewährleistet.

Dass sich in Bayern von 40.000 Reiserückkehrern 900 infiziert haben, bestätige allerdings, „wie sinnvoll und richtig“ die Testung von Rückkehrern sei, so Lauterbach. Diese machten zu einem wesentlichen Teil den Anstieg der aktuellen Neuinfektionen aus. „Wenn wir uns nicht für die Testung der Reiserückkehrer entschieden hätten, wäre die zweite Welle noch viel stärker.“

Lesen Sie auch Zweite Welle? Die Gefahr hinter der Methode Lauterbach

Anzeige

„Es war zu erwarten, dass sich eine Vielzahl von Bürgerinnen und Bürgern testen lassen würde, da muss man die organisatorischen Abläufe, vor allem aber die absolut zeitnahe Benachrichtigung der positiv Getesteten sicherstellen“, sagte Kordula Schulz-Asche, Berichterstatterin für Infektionsschutz der Grünen-Bundestagsfraktion WELT. Wenn Reisende die Möglichkeit bekämen, sich testen zu lassen, dürfe „ein solches „Test-Debakel“ nicht passieren.

Der Fall sei erneut ein Zeichen dafür, dass mit „nicht bis zum Ende durchdachten“ Maßnahmen „viel Vertrauen in der Bevölkerung verspielt“ werde, so Schulz-Asche weiter. Vom bayerischen Ministerpräsidenten Markus Söder (CSU) erwarte sie nun, dass dieser sich persönlich für eine bessere Ausstattung der Gesundheitsämter stark mache, „statt sich laufend als vermeintlicher Corona-Krisenmanager in den Vordergrund zu drängen“.

Testpanne in Bayern - Ministerpräsident Söder unter Druck Nach einer massiven Corona-Testpanne wächst der Druck auf den bayerischen Ministerpräsidenten Söder. Die Übermittlung der Ergebnisse dauert so lang, dass die Corona-Tests für Urlaubsheimkehrer faktisch wertlos sind. Quelle: WELT/ Jana Wochnik

Als „Skandal“ bezeichnet der gesundheitspolitische Sprecher der Linksfraktion im Bundestag Achim Kessler die Tatsache, dass 44.000 Personen, die in Bayern leben oder auf der Durchreise waren, weiterhin um ihr Testergebnis bangten und hoffen müssten, nicht unter den 900 Positiv-Befunden zu sein. Tests für Reiserückkehrer aus Risikogebieten seien nach wie vor eine sinnvolle Angelegenheit, ebenso flächendeckende freiwillige Testangebote – aber nur, sofern sie tatsächlich funktionierten und gut organisiert seien.

