title;text

Die Grünen-Vorsitzende Annalena Baerbock hat im Augenblick keine Zeit, um etwas über Potsdam zu sagen, über „Respekt“ oder über die „neue Sprache“, die die Grünen für den Osten gefunden zu haben glauben. Die Kreisvorsitzenden Carolin Herrmann und Lars Gindele sind trotzdem sehr glücklich über ihre Kandidatin, „auch wenn die Mitglieder sie natürlich erst aufstellen müssen“.

Lesen Sie auch Früher die „Problemzone“ Ohne die Grünen läuft in der politischen Mitte im Osten nichts mehr

Linda Teuteberg sitzt bei einem Italiener in Babelsberg, isst Pasta und ärgert sich gerade etwas über Parteikollegen, die anonym Stimmung gegen sie machen. Sicher, die Umfragen sind nicht gut. Aber die FDP hatte es als einzige vernehmbare Oppositionspartei in Corona-Zeiten auch schwer, mit ihren freiheitsfreundlichen Grundsätzen durchzudringen.

„Manchmal gibt es Phasen, in denen man nicht so gut punkten kann“, sagt die Generalsekretärin der Liberalen. „Davon lasse ich mich aber nicht kirre machen. Nicht, wenn wir als Team funktionieren.“

Lesen Sie auch FDP-Generalsekretärin Lässt Lindner sie fallen?

Anzeige

Teuteberg stammt aus dem Osten, aus Königs Wusterhausen. Die heute 39-Jährige studierte an der Potsdamer Universität und absolvierte beide juristischen Staatsexamina. Die Juristin kennt sich gut aus im Wahlkreis und in ihrem Bundesland, fünf Jahre lang saß sie im Potsdamer Landtag.

Teuteberg hat nichts gegen politische Westimporte. „Westherkunft aber als besonderen Ausweis innerer Einheit zu verkaufen ist einigermaßen zynisch“, sagt sie. „Das passt auch nicht dazu, dass die SPD sonst gern mit dem Thema Ostquote Stimmung macht.“ Gerade das Aufwachsen in der Diktatur habe sie gelehrt, dass Menschen trotz widriger Umstände etwas leisten könnten – und nicht bevormundet werden wollten. Dieser Liberalen läge kaum etwas ferner, als eine Lebensleistung deshalb nicht anzuerkennen, weil sie die eines Plattenbaubewohners ist.

Die CDU-Bundestagsabgeordnete Saskia Ludwig ist die einzige Potsdamerin in dem sich abzeichnenden Bewerberfeld. „Geboren im städtischen Krankenhaus“, sagt sie. Ludwig verkörpert den Konflikt, der seit Langem in der Union schwelt: den zwischen Merkelianern und konservativen Christdemokraten. So einiges, was die Kanzlerin entschieden hat, hält sie für problematisch.

Saskia Ludwig (CDU, M.): „Die Potsdamer lassen sich nicht kaufen“ Quelle: pa/dpa/Christophe Gateau

Den CDU-Landesvorsitzenden Ingo Senftleben hinderte sie 2019 an einer Annäherung an die Linkspartei. Über den Wahlkreis sagt sie: „Die SPD hat Potsdam immer gern als Sprungbrett benutzt. Am Ende haben die Mitbürger aber nichts von dem gewählten SPD-Abgeordneten.“

Die Bundesprominenz bringe der Stadt mediale Aufmerksamkeit, sagt Ludwig, und auch Wahlgeschenke seien zu erwarten: „Aber die Potsdamer lassen sich nicht kaufen.“ Für Eis mit bunten Streuseln reicht es hier auch so.

"Dieser Text ist aus WELT AM SONNTAG. Wir liefern sie Ihnen gerne regelmäßig nach Hause."""
"Wie Terrorgruppen um EU-Fördergelder buhlen;""Mit 71 Millionen Euro will die EU den Menschen in den palästinensischen Gebieten in der Corona-Krise helfen. Doch zuletzt wurden Vorwürfe lauter", Gelder würden ins direkte Umfeld von Terroristen fließen. Besonders ein Vorfall ist für die EU beschämend.

"Die PFLP erlangte in den 1970er-Jahren Bekanntheit durch die Entführung der Lufthansa-Maschine """"Landshut"""". Zahlreichen NGO-Mitarbeitern werden Kontakte zur PFLP-Führung vorgeworfen"

Anzeige

Es ist der 30. März, als der Vertreter der EU in den palästinensischen Gebieten, Sven Kühn von Burgsdorff, einen folgenschweren Brief an mehr als 100 palästinensische Nichtregierungsorganisationen schreibt. Seit Monaten laufen bei ihm Palästinenservertreter Sturm. Sie fühlen sich von einer neuen EU-Richtlinie schikaniert.

Laut dieser müssen sich von der EU geförderte Organisationen verpflichten, dass unter ihren Angestellten und Teilnehmern von Workshops keine Mitglieder von Organisationen sind, die auf der EU-Terroristenliste stehen. Der deutsche EU-Diplomat will beschwichtigen.

In seinem Brief erklärt er, Personen, die Gruppierungen auf der EU-Anti-Terror-Liste unterstützten, seien nicht von EU-Fördergeldern ausgeschlossen. Nur als direkte Adressaten für die Fördermittel dürften diese Personen nicht gelistet sein. Ein Eklat: Nachdem das Schreiben bekannt wird, bestellt Israel den EU-Botschafter ein.

Kritik aus der ÖVP: „An Jenseitigkeit nicht zu überbieten“

Anzeige

Am vergangenen Mittwoch ist es ausgerechnet die palästinensische Terrororganisation Volksfront zur Befreiung Palästinas (PFLP), die die Kontroverse weiter befeuert. Die PFLP fordert alle Nichtregierungsorganisationen (NGOs) in den palästinensischen Gebieten auf, geschlossen Widerstand gegen die Anti-Terror-Klausel zu leisten. Mit dem Badil Resource Center hatte eine palästinensische NGO zuvor erstmals zugesagte EU-Fördergelder in Höhe von 1,7 Millionen Euro verloren. Die NGO hatte sich geweigert, der Klausel zuzustimmen.

Lesen Sie auch Annexionspläne „Wenn so ein Diebstahl akzeptiert wird, ist kein Land mehr geschützt“

Der Aufruf der PFLP wird von Beobachtern als weiteres Indiz gedeutet, dass die Gruppierung Kontakte zu NGOs unterhält, die in der Vergangenheit auch von der EU finanziert wurden. Die israelische Organisation NGO Monitor geht davon aus, dass mindestens fünf palästinensische Hilfsorganisationen, die auch aus Europa finanziert werden, Beziehungen zu Hamas oder PFLP pflegen. Die Experten dokumentieren seit Jahren personelle Überschneidungen zwischen NGOs und Terrorgruppen. Gerade erst hat die EU angesichts der Corona-Krise Hilfen über 71 Millionen Euro für die palästinensischen Gebiete beschlossen. Rund sieben Millionen Euro davon sind für NGOs bestimmt. Im vergangenen Jahr flossen insgesamt fast neun Millionen Euro EU-Fördergelder an palästinensische NGOs. Zu den wichtigsten Geldgebern zählt auch Deutschland: Allein das Auswärtige Amt schickte im Jahr 2018 auf verschiedenen Wegen 133,5 Millionen Euro in die palästinensischen Gebiete.

Auf Anfrage betont das Ministerium, Hinweise auf Verbindungen zu terroristischen Organisationen sehr ernst zu nehmen und laufend zu überprüfen. Eine ähnlich strenge Haltung habe auch Kühn von Burgsdorff in seinem Schreiben klargemacht. Der ÖVP-Europaabgeordnete Lukas Mandl, Präsident der Transatlantic Friends of Israel, sieht das anders: „Wenn EU-Vertreter auf EU-Briefpapier behaupten, dass EU-Finanzierungen für palästinensische Gruppen auch dann fortgesetzt werden können, wenn dort Terroristen oder deren Unterstützer beschäftigt sind, dann ist das an Jenseitigkeit nicht zu überbieten.“ Mandl spricht gegenüber WELT AM SONNTAG von „offensichtlichen personellen Fehlbesetzungen“, die dort, wo es um Leben und Tod geht, nicht passieren dürften. „Das gehört schnellstmöglich korrigiert.“ Dass EU-Fördergelder niemals Terroristen zugutekommen dürfen, sei „eine rote Linie, der wir uns nicht einmal nähern dürfen“.

Auswärtiges Amt und Grünen-Stiftung zeigen sich unbeirrt

Anzeige

In Deutschland halten derweil zahlreiche Geldgeber an fragwürdigen Kooperationen fest. Die Grünen-nahe Heinrich-Böll-Stiftung listet die Gefangenenhilfe Addameer als Partner. Ein ehemaliger Buchhalter der Organisation wird beschuldigt, einen Anschlag geplant zu haben, bei dem im August 2019 eine 17-jährige Israelin starb. „Addameer unterstützt weder Terror noch Gewalt“, beteuert die Böll-Stiftung in einer Stellungnahme.

Lesen Sie auch Terror-Vorwürfe aus Israel Deutsche NGOs im Zwielicht

Das Bischöfliche Hilfswerk Misereor fördert das Palestinian Center for Human Rights (PCHR), dem die israelische Regierung Kontakte zur Hamas und PFLP attestiert. Auf Nachfrage weist Misereor dies zurück: Die Anschuldigungen seien „häufig veraltet“ und basierten auf „selektiven Internetrecherchen“. Man behalte sich vor, die Organisation weiter zu unterstützen. Auch das Auswärtige Amt bekennt sich zur Förderung des PCHR und der Union of Agricultural Work Committees, die unter anderem die antisemitische BDS-Bewegung unterstützt. „Bei beiden Organisationen ließ sich der Vorwurf einer strukturellen Verbindung zu terroristischen Organisationen nicht erhärten“, teilte das Ministerium mit.

Quelle: WELT AM SONNTAG

"Dieser Text ist aus der WELT AM SONNTAG. Wir liefern sie Ihnen gerne regelmäßig nach Hause."""
"„Klinsmann lief wie wild umher. Beckenbauer machte alle zur Minna“;""Am 8. Juli 1990 wurde Deutschland in Rom wenige Monate nach dem Fall der Mauer Fußball-Weltmeister. Kommentator des Endspiels war ARD-Reporter Gerd Rubenbauer", der seine Landsleute kurz vor dem Schuss ins Glück eindringlich vor dem „Elfmetertöter Goycochea“ warnte.

Hier gibt er tiefe Einicke in vier für viele Deutsche unvergessliche Wochen, in den er vor allem auch einen völlig veränderten Franz Beckenbauer erlebte: „Er hatte immer die Hände in den Hosentaschen," damit die Hose nicht herunterrutscht. Sie hielt nicht mehr. Ich habe damals seine Mutter Antonie angerufen.“"""
"Werders Bus mit Steinen beworfen – Randale in Bremen;""Werder bleibt mit Glück in der Bundesliga. Nach dem Spiel in Heidenheim eskaliert vor dem Stadion die Situation. Nicht nur da: Auch in Bremen hat die Polizei viel zu tun", weil gegen Mitternacht die Stimmung kippt.

Nach dem Remis in der Relegation in Heidenheim und dem damit verbundenen Klassenerhalt von Werder zeigt sich Florian Kohfeldt zufrieden. Das es am Ende noch eng wird, passt zur Saison.

Anzeige

Es war ein emotionaler, aber bis dahin friedlicher Abend gewesen. Bis plötzlich Steine und Flaschen flogen. Eine Gruppe Fans des 1. FC Heidenheim attackierte in der Nacht nach dem zweiten Spiel in der Relegation (2:2) den Mannschaftsbus des Gegners Werder Bremen, der gerade das Stadiongelände verlassen sollte.

Eine Fensterscheibe ging zu Bruch. Die Bremer mussten die Abreise unter Polizeischutz antreten. Die Polizei hat Ermittlungen aufgenommen.

Lesen Sie auch Bundesliga-Chef Seifert „Das hält man auf Dauer nur bedingt durch“

In Bremen ging es in der Nacht zum Dienstag ähnlich zu: erst friedlich, dann aggressiv. Viele Werder-Fans hatten das Spiel vor und in den Kneipen nahe dem Weserstadion verfolgt.

So sah es in der Bremer City aus Quelle: dpa/Sina Schuldt

Anzeige

Im Laufe des Abends wurde es dann im Bremer „Viertel“ immer voller und voller. Zu Hunderten tanzten die Fans auf der Straße und bejubelten den Klassenerhalt ihres Klubs. Bis zu 700 Menschen sollen nach Polizeiangaben in der Stadt gefeiert haben.

Massiver Polizeieinsatz in Bremen Quelle: dpa/Sina Schuldt

Nach Mitternacht sei die Stimmung bei einigen Menschen gekippt, heißt es in einer Mitteilung der Polizei. Sie warfen mit Flaschen und Böllern auf Polizeikräfte. Dabei wurde ein Passant von einer Flasche getroffen. Der Mann musste wegen einer Kopfverletzung im Krankenhaus behandelt werden. Die Fans waren offenbar wütend darüber, dass die Polizei unter anderem Fußballspiele auf der Sielwallkreuzung unterbunden hatte.

Beamte setzen Tränengas sein

Zudem wurde immer wieder Pyrotechnik gezündet und es wurden die Mindestabstände nicht eingehalten. Nachdem einige Feiernde versucht hatten, eine Polizeikette zu durchbrechen, setzten die Beamten Reizgas ein. Mehrere Personen wurden nach Flaschen- und Pyrowürfen festgenommen. Beamte sollen getreten worden sein.

Lesen Sie auch Bielefeld-Trainer Neuhaus „Der kann keine erste Liga, hieß es“

Anzeige

Während der Partie in Heidenheim hatte die Heimmannschaft unerwartet Unterstützung der Spielerfamilien bekommen. In der 60. Minute der Partie tauchten rund 50 Fans auf der Tribüne auf, unter anderem Frauen und Kinder der Heidenheimer Fußballprofis.

