title;text
Allerdings ist der Präsident nicht der Staatsmann, der die revolutionären Flammen ersticken möchte. Er gießt Brandbeschleuniger ins Feuer, nicht als Revolutionär, sondern als rechter Reaktionär, der die USA wegzwingen möchte vom Kurs in eine Moderne, den sie seit Jahrzehnten steuern.

Dabei droht einer Gesellschaft, deren Polarisierung seit Dekaden an Schärfe zugenommen hat, erst unter George W. Bush, dann unter Barack Obama und nun nochmals stärker unter Trump, Maß und Mitte verloren zu gehen. Die brutale Tötung des Afroamerikaners George Floyd durch weiße Polizisten in Minneapolis ist nicht der Grund für die aktuellen Proteste und Gewalttätigkeiten, sondern sie war lediglich die Lunte, die an ein hochexplosives Fass gelegt wurde und nun glimmt. Es geht im Kräftemessen zwischen zwei radikalen Gesellschaftsentwürfen um den Umgang mit amerikanischer Geschichte, amerikanischer Größe, aber auch mit amerikanischen Verfehlungen. Der Ausgang des Ringens ist nicht nur bedeutsam für die Vereinigten Staaten, sondern für die Zukunft des ins Wanken geratenen Projekts der westlichen Welt.

Lesen Sie auch Nationalfeiertag 4. Juli Ich bin ein trauriger und stolzer amerikanischer Patriot

Anzeige

„Diese linke Kulturrevolution hat das Ziel, die amerikanische Revolution zu stürzen“, sagte der Präsident in der nur physischen Nähe zu den von vier in Stein gehauenen Übervätern George Washington, Thomas Jefferson, Teddy Roosevelt und Abraham Lincoln. Das ist allerdings Unsinn. Die „American Revolution“ steht für die Loslösung der zunächst 13 Kolonien vom britischen Mutterland und die Etablierung der inzwischen 50 Vereinigten Staaten von Amerika. Keiner der Demonstranten will diese Unabhängigkeit rückabwickeln.

Das Selbstverständnis der USA, wie es sich seit der Annahme der Unabhängigkeitserklärung durch den amerikanischen Kongress am 4. Juli 1776 entwickelte, ist gleichwohl erschüttert. Ins kollektive Gedächtnis der Bevölkerung als eine Ruhmestat eingebrannt hat sich der Sturz der Statue des irakischen Diktators Saddam Hussein im Zentrum Bagdads 2003. Ein Bildersturm im Namen der Demokratie! Auch wenn die erhoffte Demokratisierung des Irak dann in einen jahrelangen Krieg mündete.

Derzeit nun findet ein anderer Bildersturm statt: Seit dem Tod von George Floyd wurden in den USA fast 30 Statuen von Christopher Columbus gestürzt oder zerstört oder von den Kommunen rechtzeitig demontiert. Der italienische Seefahrer, der im Namen des spanischen Königs 1492 die „neue Welt“ entdeckte, wird nicht mehr als großartiger Entdecker gepriesen, sondern als Wegbereiter der Eroberung und Kolonialisierung Amerikas denunziert.

Amerika kämpft um seine Geschichte In den USA hat der Tod des Afroamerikaners George Floyd eine Protestwelle ausgelöst. Auch gegen die Denkmäler der Konföderierten. WELT-Korrespondent Steffen Schwarzkopf hat in Richmond, der Hauptstadt der Sklaven haltenden Südstaaten, mit Demonstranten und Gegnern gesprochen. Quelle: WELT/ Steffen Schwarzkopf

Anzeige

So ist in den USA ein historischer Gerichtsprozess zu beobachten, bei dem sich die Moral der Gegenwart zum Chefankläger gegen die Vergangenheit aufschwingt. Dabei werden eben nicht nur Denkmäler zerstört oder vorsorglich in Sicherheit gebracht, die an Politiker und Militärs der Konföderierten (und damit an Verteidiger der Sklavenhaltung) im amerikanischen Bürgerkrieg erinnerten wie Jefferson Davis, General Robert E. Lee oder Albert Pike. Dem Bildersturm entgingen weder ein Monument für General Ulysses S. Grant, den Oberbefehlshaber der Truppe des siegreichen Nordens, noch Standbilder von drei Präsidenten, nämlich dem Gründer George Washington, dem Verfassungsvater Thomas Jefferson (beide in Portland/Oregon) und dem Friedensnobelpreisträger Teddy Roosevelt (in New York City). Dran glauben musste auch eine Statue von Francis Scott Key, dem Autor der Nationalhymne „The Star-Spangled Banner“.

Ja, Washington und Jefferson besaßen Sklaven, Ersterer entließ die seinen erst nach seinem Tod testamentarisch in die Freiheit, Letzterer zeugte mit einer Schwarzen, die er zu seiner Mätresse gemacht hatte, Kinder, die er nie anerkannte. Roosevelt, hoch zu Ross, wurde auf seinem Standbild umrahmt von einem Indianer und einem Schwarzen, beide zu Fuß und unterwürfig.

All dies ist aus heutiger Perspektive verwerflich. Aber alle genannten Persönlichkeiten haben zugleich Großartiges geleistet. Wenn sie vor dem zivilisatorischen Hochmut unserer Gegenwart in den Staub gezwungen werden, welche historische Gestalt mag dann überhaupt noch bestehen? Polizisten schützen gegenwärtig ein Abraham-Lincoln-Denkmal in Washington D.C., dessen Abriss schwarze Aktivisten fordern, weil vor dem Befreier der Sklaven ein dankbarer Schwarzer kniet.

Lesen Sie auch Rassismusdebatte Statuen für Sklavenhalter – Das Rückzugsgefecht der Südstaaten-Nostalgiker

Anzeige

Viele (aber natürlich längst nicht alle) weiße Amerikaner haben sich in der Zeit der Sklaverei und noch lange danach an schwarzen Landsleuten versündigt. Gleiches gilt für den Umgang mit den indianischen Ureinwohnern. Das ist zu wenig aufgearbeitet worden, und auf diesen Nachholbedarf haben die Friedlichen unter den Demonstranten zurecht hingewiesen.

Doch die Amerikaner wären ohne ihren Stolz auf die Großen ihrer Geschichte und die Leistungen ihrer Nation kaum in der Lage gewesen, den Westen im 20. Jahrhundert ideell zu inspirieren und machtpolitisch zu stabilisieren. Im Kulturkampf der USA ringen gerade zwei geschichtsfeindliche, extremistische Lager miteinander. Die einen, am linken Rand des Spektrums, wollen der Gesellschaft, oder doch in einem bizarren Rückgriff auf „racial profiling“ zumindest seinem weißen Teil, die weiterhin positive Wahrnehmung selbst aller vier Mount-Rushmore-Präsidenten austreiben und es auf die Knie zwingen wegen angeblicher imperialistischer, kapitalistischer und rassistischer Dauerverirrungen. Die anderen, die Rechten, angeführt von Trump, geben sich beim Thema Rassismus taubstumm und zeigen keinerlei Verständnis für eine neue Epoche, in der die Symbole der Konföderierten, die im Bürgerkrieg erkennbar auf der falschen Seite standen, im Museum besser aufgehoben sind als auf öffentlichen Plätzen. Nicht einmal dafür, dass der Staat Mississippi aus seiner Fahne die Kriegsflagge der Konföderierten zu streichen beschlossen hat, zeigte Trump Zustimmung oder zumindest Verständnis.

Gelegentlich auch Kraftprotzerei

Nur wenn sich zwischen diesen beiden extremen Fronten die vernünftige Mitte der Amerikaner durchsetzt, die Reformbedarf anerkennt (insbesondere im Bildungssystem und in einigen Bereichen des Justiz- und Polizeiwesens), ohne die eigene Geschichte und damit die Werte des Landes zu vandalisieren und zu demontieren, können die USA als Führungsmacht überleben. Dazu gehören Selbstbewusstsein und eine ordentliche Portion von unbekümmertem Patriotismus, der großzügiger sein darf in der Abwägung von Stärken und Schwächen der eigenen Nation, als es einem geschichtlichen Oberseminar gestattet wäre.

Nur wenn sich die Amerikaner ihren bisherigen Level an pragmatischer Vernunft und an patriotischer Kraft, gelegentlich auch arroganter Kraftprotzerei gestatten, behält der Westen eine Führungsmacht, so anmaßend und dumpf sie in der Ära Trump daherkommen mag. In der Epoche der „Easternization“ und des Aufstiegs eines nach wie vor autoritären China bleibt ein starkes, nicht ständig an sich zweifelndes Amerika unverzichtbar – gerade auch für das selbst so machtlose und wenig geeinte Europa.

Ansgar Graw ist seit März 2020 Herausgeber des Debattenportals TheEuropean.de. Zuvor war Graw 22 Jahre lang für WELT und WELT AM SONNTAG tätig," unter anderem von 2009 bis 2017 als USA-Korrespondent und zuletzt als Chefreporter in Berlin. Er ist Autor des Buches „Trump verrückt die Welt. Wie der US-Präsident sein Land und die Geopolitik verändert.“ (Stuttgart 2017)"""
"Der Rechtsstaat bremst Trump. Gut so!;""Der Oberste Gerichtshof der USA hat der Staatsanwaltschaft in New York Einsicht in Steuererklärungen von US-Präsident Donald Trump erlaubt. Der US-Kongress erhält zunächst hingegen keine Einsicht. Dazu WELT-Reporter Steffen Schwarzkopf aus Washington."

Anzeige

In den USA ist es gute Tradition, dass Spitzenpolitiker, inklusive aller Präsidenten seit Jimmy Carter, ihre Steuererklärungen freiwillig veröffentlichen. Es ist eines der ungeschriebenen Gesetze, die die politische Kultur des Landes lange prägen. Jeder Bürger soll sich ein Bild machen können von der finanziellen Lage derer, die ihn vertreten – oder sich um ein solches Mandat bewerben.

Wenn Donald Trump für eine Tradition steht, dann die, noch jede bewährte Praxis über den Haufen zu werfen. Schon als Präsidentschaftskandidat widerrief er vorherige Zusagen, seine Steuererklärungen offenzulegen. Kein Bürger soll sich ein Bild machen können von der finanziellen Lage des Mannes an der Spitze.

Vor dem Obersten Gerichtshof hat Trump nun einen Sieg und eine Niederlage eingefahren. Der Supreme Court urteilte 117 Tage vor der Präsidentschaftswahl: Die New Yorker Staatsanwaltschaft erhält Einsicht in seine Steuererklärungen. Der Kongress hingegen, mithin das von den Demokraten dominierte Repräsentantenhaus, bekommt dieses Recht nicht.

Lesen Sie auch Enthüllungsbuch Die schrecklich dysfunktionale Familie Trump

Anzeige

In der Sache geht es unter anderem um Schweigegeldzahlungen an die Pornofilmschauspielerin Stormy Daniels, die behauptete, eine Affäre mit Trump gehabt zu haben, was dieser bestreitet. Hat Trumps Unternehmen Unterlagen gefälscht, um die Zahlungen an Daniels und eine weitere Frau zu verschleiern? Ginge es nach Trump, blieben seine Unterlagen unter Verschluss. Seine Anwälte argumentierten, Trump genieße Immunität bei allen Strafverfahren und Ermittlungen, solange er Präsident sei. Das ist die juristische Übersetzung seiner aberwitzigen Parole: „Ich kann als Präsident tun, was ich will.“

Der Supreme Court hat Trump in den letzten Wochen gleich mehrere Niederlagen beigebracht," etwa in Bezug auf Immigranten und die Rechte Homosexueller. Nun stimmten selbst die beiden von Trump ernannten Richter mit der Mehrheit – und für die Einsichtnahme der Staatsanwaltschaft. Der Präsident kann sich zu seinem Ärger nicht auf den Obersten Gerichtshof „verlassen“. Das ist gut und beruhigend. Man nennt das Ganze: Rechtsstaat."""
Europa darf sich nicht von Moskau einschüchtern lassen;
"Mutmaßlicher ägyptischer Spion beim Bundespresseamt enttarnt;""Anzeige"

Ein Mitarbeiter des Bundespresseamts soll über Jahre hinweg für einen ägyptischen Geheimdienst gearbeitet haben. Das berichtet die „Bild“-Zeitung unter Berufung auf den heute veröffentlichten Verfassungsschutzbericht. Dort heißt es, im Dezember 2019 seien durch das Bundeskriminalamt im Auftrag des Generalbundesanwalts Exekutivmaßnahmen gegen einen Mitarbeiter des Presse- und Informationsamtes der Bundesregierung durchgeführt worden, der über Jahre hinweg einem ägyptischen Nachrichtendienst zugearbeitet haben soll.

Der Spion hatte nach Angaben der Bundesregierung keinen umfangreichen Zugriff auf Daten. Dies betonte die stellvertretende Regierungssprecherin Martina Fietz am Freitag. Weitere Angaben zu dem Fall wollte sie mit Verweis auf das laufende Ermittlungsverfahren nicht machen.

Weiter berichtet der Verfassungsschutz: „Hinweisen zufolge versuchen ägyptische Dienste, in Deutschland lebende Landsleute für nachrichtendienstliche Zwecke zu gewinnen; hierzu nutzen sie Vorsprachen dieser Personen in den ägyptischen diplomatischen Vertretungen in Deutschland sowie deren Reisen nach Ägypten.“ Laut dem Verfassungsschutzbericht sind in Deutschland der ägyptische Auslandsdienst General Intelligence Service (GIS) und der Inlandsdienst National Security Service (NSS) tätig.

Lesen Sie auch Kanzlerin in Brüssel Merkel überrascht Europa mit einer klaren Ansage

Anzeige

Auf Anfrage der „Bild“ bestätigte der Generalbundesanwalt Ermittlungen wegen des Verdachts der geheimdienstlichen Agententätigkeit (§ 99 Abs. 1 Nr. 1 StGB). Derzeit ist noch unklar, welche Informationen der mutmaßliche Spion weitergab. Denkbar ist, dass der Mitarbeiter Daten ägyptischer Journalisten in Deutschland für die Regierung von Präsident Abdel Fattah as-Sisi beschaffte.

Wie die „Bild“-Zeitung berichtete, soll es sich um einen Mitarbeiter des Besucherdienstes des Bundespresseamtes handeln. Der Mann soll im mittleren Dienst tätig gewesen sein. Seine Räumlichkeiten seien durchsucht worden," berichtete „Bild“. Der Mann soll laut dem Blatt einen Migrationshintergrund haben."""
Merkels Ruf nach Reformen in der Corona-Krise;
So gefährlich ist das Coronavirus bei Chorproben;as richtige Lüften – damit beschäftigt sich seit 130 Jahren das Hermann-Rietschel-Institut für Energietechnik an der TU Berlin. Hier werden Fachleute ausgebildet, die gemeinsam mit Architekten Häuser planen. Normalerweise geht es dabei um Gesundheitsgefahren wie zu hohe CO2-Konzentrationen. Doch ihre Erfahrungswerte, Messtechniken und Formeln übertragen die Forscher nun auf die Abschätzung, wie stark sich potentielle infektiöse Aerosole in Räumern anreichern können.
Greenpeace – Ökosystemen in Nord- und Ostsee geht es schlechter denn je;
„Nach dieser Krise werden die Karten neu gemischt“," warnt Merkel;""Bundeskanzlerin Merkel und der niederländische Premier Rutte haben die Europäer zu Reformen aufgerufen. Beim Treffen in Berlin geht es um die Umsetzung des umstrittenen geplanten EU-Wiederaufbaufonds in der Corona-Pandemie."

Anzeige

Bundeskanzlerin Angela Merkel (CDU) hat die Europäer zu einem mutigen Reformkurs aufgerufen, um gestärkt aus der Corona-Krise zu kommen. Hilfen, die nicht mit Reformen und einer Ausrichtung auf die Zukunft verbunden seien, würden letztlich nichts helfen, sagte die Kanzlerin am Donnerstagabend in Berlin zum Auftakt eines Treffens mit dem niederländischen Premier Mark Rutte, von dem Impulse für das weitere Vorgehen bei den umstrittenen geplanten EU-Wiederaufbaufonds erwartet wurden. „Die Welt schläft nicht. Und nach dieser Krise werden mit Sicherheit die Karten neu gemischt“, warnte Merkel.

„Es wird geguckt, wer kann wirklich den Menschen in seinen Ländern Wohlstand garantieren. Und das geht nur mit einer wettbewerbsfähigen, zukunftsfähigen Wirtschaft.“ Eine große Rolle müsse zum Beispiel der Klimaschutz spielen, wo die Niederlande einen „sehr, sehr engagierten Weg“ gingen, sagte Merkel.

Lesen Sie auch Kanzlerin in Brüssel Merkel überrascht Europa mit einer klaren Ansage

Rutte sagte, die Corona-Pandemie habe großen Schaden angerichtet. „Es ist jetzt ganz wichtig, dass wir diesen Schlag, den Europa erlitten hat, gemeinsam meistern.“ Deutschland und die Niederlande könnten nur gut weitermachen, wenn es der ganzen Europäischen Union gut gehe. Alle Wirtschaftssysteme seien ganz eng miteinander verbunden.

Anzeige

Rutte betonte, es sei ganz wichtig, dass der europäische Wiederaufbaufonds komme. „Aber es ist auch wichtig, dass ein solcher Fonds zusammen mit Reformen durchgeführt wird, damit alle EU-Mitgliedsstaaten auch stark sind, und damit bei einem folgenden Schlag ein solcher Fonds gar nicht notwendig ist.“

„Wir haben sehr viel Vertrauen in Deine Person“

Mit Blick auf den geplanten mittelfristigen Finanzrahmen der EU betonte Rutte, die EU müsse sparsam sein. „Wir wollen nicht, dass der Nettobeitrag in Folge des Brexit und der Corona-Krise nun steigt.“ Rutte wünschte Merkel viel Erfolg für die deutsche EU-Ratspräsidentschaft. „Wir haben sehr viel Vertrauen in Deine Person“, versicherte er der Kanzlerin.

CSU-Landesgruppenchef Alexander Dobrindt hatte zuvor an Rutte appelliert, die Ablehnung der geplanten, nicht zurückzahlbaren EU-Milliardenhilfen in der Corona-Pandemie zu überdenken. „Wir müssen in ganz Europa darauf schauen, dass wir wieder wirtschaftlich erfolgreich sind. Wir müssen darauf schauen, dass wir in ganz Europa wieder Wachstum erzeugen“, sagte Dobrindt der Deutschen Presse-Agentur.

Lesen Sie auch Michael Clauß „Zu viele haben es sich in ihren Schützengräben gemütlich gemacht“

Anzeige
