title;text

Weltweit gibt es laut der Johns-Hopkins-Universität mindestens 38.510.263 mit Covid-19 infizierte Personen (Stand 15.10., 8 Uhr). Davon sind 1.092.144 Menschen am Virus gestorben.

Mehr als 900.000 Infektionen in Spanien

Anzeige

Spanien hat als erstes Land der Europäischen Union die Marke von 900.000 Coronavirus-Infektionen überschritten. Seit Beginn der Pandemie seien mehr als 908.000 Infektionen registriert worden, teilte das spanische Gesundheitsministerium mit. Spanien hat knapp 45 Millionen Einwohner. Offiziellen Angaben zufolge wurden mehr als 33.000 Todesfälle in Zusammenhang mit dem Virus registriert. Gesundheitsexperten glauben, dass die tatsächliche Zahl deutlich höher liegt, jedoch nicht ausreichend getestet wird.

An dieser Stelle finden Sie Inhalte von Drittanbietern Um mit Inhalten von Drittanbietern zu interagieren oder diese darzustellen, brauchen wir Ihre Zustimmung. Externe Inhalte aktivieren

In Großbritannien mit 66,6 Millionen Einwohnern haben sich innerhalb von 24 Stunden nachweislich knapp 20.000 Menschen mit dem Coronavirus angesteckt. Das entspricht einem Anstieg von etwa 2500 im Vergleich zum Vortag. 137 Menschen sind an einer Covid-19-Erkrankung gestorben, wie die Gesundheitsbehörden am Mittwoch mitteilten. Besonders stark betroffen von der Pandemie sind der Norden Englands, Nordirland, Schottland und Teile von Wales. Die tatsächliche Zahl der Neuinfektionen dürfte aber noch höher liegen, da nicht genügend Tests zur Verfügung stehen. Der britische Gesundheitsminister Matt Hancock rief für London die zweithöchste Corona-Warnstufe aus. Er begründete dies am Donnerstag im Unterhaus mit rasch steigenden Infektionsraten in der Hauptstadt. Schnelles Handeln sei erforderlich, um das Virus unter Kontrolle zu bekommen, sagte er.

Angesichts rapide steigender Infektionszahlen dürfen sich Angehörige verschiedener Haushalte demnach in Innenräumen nicht mehr treffen, wie der Londoner Bürgermeister Sadiq Khan am Donnerstag bekannt gab. Auch Treffen in Pubs oder Restaurants sind nicht erlaubt, während sie in Grünanlagen gestattet bleiben. Schulen und der Einzelhandel bleiben geöffnet.

Millionen Bewohner Nordenglands warten darauf, zu erfahren, ob sie unter die strengsten Corona-Regeln fallen. Für Liverpool wurden diese bereits angeordnet. Seit dieser Woche gibt es in Großbritannien ein dreistufiges Corona-Warnsystem.

An dieser Stelle finden Sie Inhalte von Drittanbietern Um mit Inhalten von Drittanbietern zu interagieren oder diese darzustellen, brauchen wir Ihre Zustimmung. Externe Inhalte aktivieren

Die Zahl der registrierten Neuinfektionen binnen 24 Stunden stieg am Mittwoch in Portugal mit 10,3 Millionen Einwohnern auf 2072 – das war der höchste Wert seit Beginn der Pandemie. Die Gesamtzahl der Fälle kletterte den amtlichen Angaben zufolge auf mehr als 91.000. Die Zahl der Menschen, die an Covid-19 starben, stieg um sieben auf 2117. Besonders betroffen sind der Norden und der Großraum Lissabon. Sorge bereitet vor allem die Tatsache, dass die Zahl der in Krankenhäusern behandelten Covid-19-Patienten in etwas mehr als einem Monat von gut 300 auf nun fast 1000 in die Höhe schoss.

Frankreichs Corona-Karte färbt sich immer tiefer rot

In Frankreich mit seinen knapp 67 Millionen Einwohnern haben die Gesundheitsbehörden 22.591 Neuinfektionen binnen 24 Stunden registriert. Es ist das dritte Mal in sechs Tagen, dass das Gesundheitsministerium einen Wert über 20.000 mitteilt. Insgesamt seien 779.063 Infektionsfälle verzeichnet worden. Die Zahl der Todesfälle in Kranken- und Pflegeheimen sei um 104 auf 33.037 gestiegen. Damit ist Frankreich weltweit das neunte Land weltweit, das mehr als 33.000 Todesfälle in Zusammenhang mit dem Coronavirus zu beklagen hat.

Zwar sank die Zahl der Neuinfektionen seit vergangenem Wochenende, wo zuletzt ein Rekordhoch von knapp 27.000 am Samstag verzeichnet wurde. Dennoch steigen die Infektionszahlen gegenüber der vergangenen Woche massiv. Die Karte des französischen Gesundheitsministeriums, auf der die Corona-Hotspots in Scharlachrot (auf Französisch „rouge écarlate“) markiert werden, färbt sich deshalb immer tiefer rot.

An dieser Stelle finden Sie Inhalte von Drittanbietern Um mit Inhalten von Drittanbietern zu interagieren oder diese darzustellen, brauchen wir Ihre Zustimmung. Externe Inhalte aktivieren

Anzeige

Dazu gehören mit der Hauptstadt Paris inzwischen neun Ballungsräume und ein Überseegebiet. Der Großraum Marseille, zu dem auch Aix-en-Provence zählt, ist ebenso betroffen wie die Großstädte Lyon, Grenoble, Saint-Etienne, Lille, Toulouse und Montpellier. Dazu gehört auch die Inselgruppe Guadeloupe in der Karibik.

In Bulgarien mit seinen sieben Millionen Einwohnern liegt die Zahl der neuen Positiv-Tests das vierte Mal binnen einer Woche auf Rekordniveau. Die Zahl der Fälle steigt nach offiziellen Daten um 785 auf insgesamt 25.774. Bislang starben 923 Menschen, die positiv auf das Coronavirus getestet wurden. Aktuell befinden sich 1307 Menschen in Krankenhäusern, 63 davon auf Intensivstationen.

In Tschechien meldet das Gesundheitsministerium 8325 neue Positiv-Tests. Das ist der bislang zweithöchste Wert in dem Land mit 10,7 Millionen Einwohnern, die meisten neuen Fälle gab es am vergangenen Freitag. Die Gesamtzahl der Fälle in Tschechien liegt inzwischen bei 129.747. Bislang starben 1106 Menschen, die positiv getestet wurden. Zu Monatsbeginn waren es noch 696 Todesfälle.

Rekorde in Polen und Kroatien

In Polen überschritt die Zahl der täglichen Neuinfektionen mit dem Coronavirus erstmals die Marke von 6000. Innerhalb von 24 Stunden kamen 6526 neue Fälle hinzu, die meisten davon in der Region um die Hauptstadt Warschau (1188). Das teilte das polnische Gesundheitsministerium am Mittwoch mit. Im gleichen Zeitraum starben 116 Menschen in Zusammenhang mit dem Virus. Seit Beginn der Pandemie gab es in Polen 3217 Todesfälle in Verbindung mit einer Covid-19-Erkrankung. Das Land hat rund 38 Millionen Einwohner. Polen ist das einzige Nachbarland Deutschlands, das bisher vom Auswärtigen Amt in Berlin noch nicht ganz oder teilweise als Risikogebiet eingestuft wurde.

Im EU-Land Kroatien verzeichneten die Behörden am Mittwoch einen Rekordwert an neuen Infektionen mit dem Coronavirus. In den vergangenen 24 Stunden sei bei 748 Menschen Sars-CoV-2 nachgewiesen worden, teilte der Krisenstab der kroatischen Regierung mit. Die bisher höchste Zahl von 542 Neuinfizierten hatte der Krisenstab am 8. Oktober registriert. Vier Menschen starben demnach in den letzte 24 Stunden in Verbindung mit einer Covid-19-Erkrankung. Seit Beginn der Pandemie im Februar haben sich in dem 4,2-Millionen-Einwohner-Land nachweislich 21.741 Menschen mit dem Coronavirus angesteckt. 334 Patienten starben mit dem Virus. Am Mittwoch wurden 441 Patienten im Krankenhaus behandelt, 27 von ihnen wurden künstlich beatmet.

Russland mit seinen 144,5 Millionen Einwohnern meldet einen Rekord an Neuinfektionen. Binnen der letzten 24 Stunden gibt es 14.231 weitere Coronavirus-Fälle. Die Gesamtzahl der Infektionen steigt damit auf 1,34 Millionen. Weitere 239 Menschen starben, wodurch sich die Zahl der Todesfälle auf 23.205 erhöht.

In Brasilien mit seinen 209,5 Millionen Einwohnern sterben nach Angaben des Gesundheitsministeriums 749 Menschen nach einer Infektion mit dem Coronavirus. In den vergangenen 24 Stunden sei die Zahl der positiv Getesteten um 27.235 auf 5.140.863 gestiegen. Insgesamt sind 151.747 Menschen an den Folgen der Ansteckung gestorben.

In Südkorea sind 110 neue Infektionen mit dem Coronavirus registriert worden. Die Hälfte der Fälle stehe in Verbindung mit einem Krankenhaus in der Stadt Busan, teilte die südkoreanische Behörde für Krankheitskontrolle und -prävention am Donnerstag mit. In dem Land mit gut 51 Millionen Einwohner liegt die offizielle Zahl der Fälle damit bei fast 25.000.

Anzeige

Mindestens 54 der Neuinfektionen stünden mit dem Krankenhaus für Ältere in Verbindung. Mehr als 40 seien in der dicht bevölkerten Metropolregion Seoul verzeichnet worden, mit Verbindungen zu Krankenhäusern, Kirchen, Schule und Büros.

Alle aktuellen und weltweiten Entwicklungen zum Coronavirus können Sie in unserem Live-Ticker verfolgen.

"Haben Sie Fragen zum Coronavirus? Hier finden Sie die wichtigsten Fakten und Informationen."""
Kindheit gibt es heute nicht mehr;Auf dem Sundance Festival, den von Robert Redford gegründeten Festspielen des unabhängigen Films in Utah, feierte im Januar das Coming-of-Age-Drama „Mignonnes“ seine Premiere. Die Regisseurin Maïmouna Doucouré erhielt für ihr Debüt einen Preis. Ihr autobiografisch inspirierter Film erzählt von der elfjährigen, aus dem Senegal stammenden Muslima Amy, die in Paris mit einer Mädchentruppe bei einem Tanzwettbewerb mitmacht. Auch die Berlinale-Premiere und der französische Kinostart im April liefen gut. Netflix war angetan und kaufte „Mignonnes“. Am 9. September soll der Film unter dem Titel „Cuties“ (so nennen sich die tanzenden Girlies) international auf der Streaming-Plattform anlaufen.
Klassiker," Newcomer und Geheimtipps – das erwartet Fans bei Disney+;""Anzeige"

Irgendwo in den ganz tiefen Untiefen von Twitter tauchte es irgendwann auf, dieses Gerücht. Corona, das ist doch von Disney verbreitet worden! Damit alle Menschen zu Hause bleiben, ohne Beschäftigung und gierig nach Unterhaltung, wenn das neue Streamingangebot Disney+ startet. Hashtag: Verschwörungstheorie, von der ganz absurden Sorte.

Tatsächlich schloss Disney in den Wochen vor dem Deutschland-Start seines Streaming-Dienstes nach und nach all seine Vergnügungsparks weltweit. Die Disney Cruise Line stellte ihre Kreuzfahrten ein. Die Hotels, die Shops weltweit, alles zu. Das gab es, natürlich, noch nie, nach dem 11. September 2001, nach dem Attentat auf John F. Kennedy schloss man mal Disneyland für einen Tag, alles nicht ansatzweise vergleichbar mit den Ausmaßen im März 2020. Es wäre ein ziemlich großer Preis, um eine Streamingplattform zu promoten – für die man gerade nicht mal mehr Inhalte herstellen kann, weil die Dreharbeiten für Disney-Projekte unterbrochen wurden.

Doch ja, das Timing für den Start von Disney+ schien zumindest irgendwie glücklich zu sein. Ein kleiner glücklicher Zufall in den eher unglücklichen Zeiten – der viele Disney-Fans zumindest ein wenig trösten dürfte. Darüber, dass es mehrere Wochen auf der Welt keine einzige Disney-Zuflucht gab, keinen einzigen „happy place“, wie der Konzern selbst ja seine Parks gerne nennt.

Disney Plus: Disney-Magie gegen Corona-Frust

Anzeige

Dann muss es also der eigene Laptop oder Fernseher sein, der für ein bisschen Ablenkung und Disney-Magie sorgen soll. Doch ganz ohne Corona-Probleme läuft auch das nicht, die Bandbreite der Streams wurde direkt zum Start am 24. März reduziert, um das Netz nicht zu überlasten. Der Preis ist moderat, das Jahresabo kostet 69,99 Euro, wer flexibel monatlich abonnieren will, zahlt 6,99 Euro. Das Passwort können sich derzeit theoretisch vier Menschen mit vier Geräten teilen, die ersten sieben Tage darf man kostenlos testen. Und zwar mehr als 500 Filme und 350 Serien, je nach Land ist das Angebot etwas unterschiedlich.

Anzeige Jetzt Disney+ entdecken 6,99 € im Monat oder 69 € für ein Jahresabo

Lohnt sich das Programm von Disney+?

Und die Frage nach dem Angebot ist am Ende sicherlich die wichtigste: Lohnt sich Disney Plus? Ist es nur was für Disney-Fans? Was sind die Highlights und Geheimtipps?

Klassiker auf Disney+

Die sind natürlich alle versammelt: „König der Löwen“, „Cinderella“, „Aladdin“, „Die Schöne und das Biest“, „Dschungelbuch“ – die Zeichentrick- und, wo vorhanden, Realversionen. Kleiner Kritikpunkt vieler deutscher Fans: „Arielle“ ist nur in der neu synchronisierten Variante von 1998 enthalten, hier sind Synchronsprecher, Songtexte und manche Dialoge gegenüber der Fassung von 1989 verändert worden.

Lesen Sie auch Große Aufregung Wieso sollte Arielle nicht schwarz sein?

Anzeige

Auch der allererste Auftritt von Micky Maus in „Steamboat Willie“ ist verfügbar und Superklassiker wie „Pinocchio“ (der seltsamerweise unter dem Titel „Die lebendige Puppe“ läuft), „Susi und Strolch“, „Bambi“, „Alice im Wunderland“ oder „101 Dalmatiner“. Manche dieser älteren Titel wurden restauriert, damit sie auch hochauflösend in gute Qualität zu schauen sind. Und wenn man schon von Klassikern spricht, sollte man auch erwähnen, dass Serien wie „Hannah Montana“, aber auch mehr als 600 Folgen der „Simpsons“ abrufbar sind.

Marvel, Star Wars, Pixar

Disney ist eben nicht nur Zeichentrick – längst hat man dafür gesorgt, wirklich alle Zielgruppen irgendwo einfangen zu können, (fast) das gesamte Marvel- und Star-Wars-Universum sowie die Spin-off-Serie „The Mandalorian“ steht auf Disney+ zur Verfügung. Ein paar Filme hält man derzeit noch zurück, die Spannung (und Neukundenakquise) muss ja noch etwas anhalten. Natürlich sind auch die Pixar-Filme am Start, von „Findet Nemo“ bis „Oben“.

Lesen Sie auch Neuer Streaming-Dienst Diese Serien und Filme erwarten Marvel-Fans bei Disney+

Neuheiten und Originale beim Disney-Stream

Weil der geneigte Fan das aber alles schon kennt, muss man auch exklusiven Content bieten. Da konzentriert sich Disney vor allem auf Marvel und Star-Wars-Fanatiker, drei Marvel-Serien starten noch dieses Jahr: „Loki“, „WandaVision“ und „The Falcon and the Winter Soldier“. Eine noch unbenannte Obi-Wan-Kenobi-Show soll 2021 starten.

Anzeige

Außerdem sind einige Filme extra für Disney+ produziert worden, darunter etwa „Togo“ mit Willem Dafoe, die Romanverfilmung „Stargirl“ oder „Timmy Flop“.
