title;text

Ohne großes Verfahren wurde Cromwell des Hochverrats und der Ketzerei für schuldig befunden. Darauf stand das Todesurteil, für dessen Vollstreckung der 28. Juli festgesetzt wurde. Mit seinen letzten Worten sorgte der Delinquent noch einmal für eine Überraschung. Denn sein Bekenntnis, „ich sterbe im katholischen Glauben noch zweifle ich an einem Sakrament der Kirche“, verschlug nicht nur den Kirchenleuten die Sprache, die gekommen waren, sich am Sterben ihres Feindes auf dem Tower Hill von London gütig zu tun.

Sein letzter Wunsch blieb Cromwell gleichwohl verwehrt. Wie einst Anne Boleyn hatte er Heinrich angefleht, von einem erfahrenen Henker „mit einem Schlag“ enthauptet zu werden. Der Spanier Gurrea erwies sich jedoch als das Gegenteil. Als „zerlumpten und ungeschickten Schlächter, der sein Geschäft schlecht versah“ und Cromwells Nacken wie einen Baumstumpf mit der Axt traktierte, beschrieb der Tudor-Chronist Edward Hall die blutige Tortur, die der Verurteilte „geduldig ertrug“. Anschließend wurde der Kopf auf der London Bridge zur Schau gestellt. Heinrich soll ihm übrigens bald danach verziehen haben.

Lesen Sie auch Brexit um jeden Preis Boris Johnsons Rambo-Kurs erinnert an diesen geköpften König

109 Jahre später war es kein hoher Beamter, sondern mit Karl I. der König selbst, dessen Kopf in den Sand fiel. Sein mitleidsloser Gegner hieß ebenfalls Cromwell, Oliver Cromwell. Der Sieger im Bürgerkrieg und spätere Lordprotektor war ein Urgroßneffe.

Anzeige

"Sie finden „Weltgeschichte“ auch auf Facebook. Wir freuen uns über ein Like."""
Bis zu zwei Stunden Wartezeit und noch viele offene Fragen;
"Zweiter Super-Bowl-Sieger verzichtet wegen Corona auf Saison;""Anzeige"

Immer mehr Footballspieler verzichten wegen der Coronavirus-Pandemie auf die kommende NFL-Saison. Am Dienstag entschied sich ein zweiter Profi von Super-Bowl-Champion Kansas City Chiefs gegen eine Teilnahme an dieser Spielzeit. Ligaweit haben sich in den vergangenen Tagen schon mehr als 30 Profis zu diesem Schritt entschlossen. Nach Laurent Duvernay-Tardif ist Runningback Damien Williams der zweite Chiefs-Spieler, der auf die Saison verzichtet. Der 28-Jährige zählte mit zwei Touchdowns im Februar zu den wichtigsten Spielern beim Super-Bowl-Sieg gegen die San Francisco 49ers und ist die erste Wahl auf seiner Position.

Bei den New England Patriots um den deutschen Profi Jakob Johnson entschieden sich zuvor neben dem prominenten Verteidiger Dont‘a Hightower auch Patrick Chung, Dan Vitale und Najee Toran gegen die kommende Saison. Die New York Giants müssen auf Nate Solger verzichten, Devin Funchess fehlt den Green Bay Packers, Michael Pierce den Minnesota Vikings.

107 NFL-Spieler mit Coronavirus infiziert

Diese Liste mag in den nächsten Tagen noch länger werden. Zwischen der NFL und der Spielergewerkschaft NFLPA gibt es noch keine Einigung über die genaue Formulierung der Klauseln im Tarifvertrag. Vom Tag der Unterschrift an haben Profis nach Angaben von US-Medien noch sieben Tage Zeit, sich von der Saison zu verabschieden.

„Ich habe schlecht geatmet, mich schlecht gefühlt“ Tennis-Star Grigor Dimitrow wurde im Juni positiv auf das Coronavirus getestet. Nun hat der Sportler erzählt, dass er erheblich gelitten hat, körperlich wie mental. Wieder auf höchstem Niveau Tennis spielen, könne er noch nicht. Quelle: WELT

Anzeige

Nach NFLPA-Angaben haben sich vor Beginn der Trainingscamps in den vergangenen Tagen 107 NFL-Spieler mit dem Coronavirus infiziert. Seitdem die Spieler bei ihren Klubs sind, gab es demnach 21 positiv getestete Profis. Die NFL will ihre Saison im September starten und ähnlich wie die Major League Baseball in den Stadien der Teams spielen. Zuschauer wird es wohl nicht geben. In der MLB hatten sich in den vergangenen Tagen mindestens 16 Spieler der Miami Marlins infiziert, einige Spiele sind infolgedessen bereits abgesagt.

Lesen Sie auch Sport und Zigaretten Wie Rauchen die sportliche Leistung wirklich beeinflusst

"Hier finden Sie unseren Live-Ticker mit allen relevanten Updates zur Corona-Krise."""
So lief die Fragestunde von Scholz und Altmaier im Finanzausschuss;
Die Tech-Giganten wehren sich gegen den Vorwurf der Marktdominanz;
Der Leitzins bleibt bei fast null;
"„Danke für die Kommentare zu meinem Aussehen!“;""Das Thema Schönheit wird Elisabeth Lechner wohl nie loslassen", schon allein, weil sie eine Frau ist. Hier erklärt die Kulturwissenschaftlerin, warum wir all die Arbeit am Äußeren auf uns nehmen und zu welchen teils kuriosen Phänomen sie führt.

ICONIST: Ich bin durch einen Wissenschaftspodcast auf Sie aufmerksam geworden. Sie haben über Ihre Forschung zum Schönheitsideal gesprochen und darüber, dass sie viele Reaktionen bekommen, wenn Sie Interviews geben – allerdings nicht zu Ihrer Forschung, sondern zu Ihrem Aussehen.

Elisabeth Lechner: Für die jüngsten Interviews habe ich immer dasselbe Foto verwendet, auf dem ich eine rote Bluse und dazu passenden Nagellack und Lippenstift trage. Unter einem Interview mit dem österreichischen „Standard“ gab es vergangenen Dezember mehr als 1500 Kommentare, die meisten diskutieren, wie ich aussehe, teilweise beleidigend. Als Wissenschaftlerin, die über Aussehen und Diskriminierung forscht und die notwendigerweise ein Aussehen hat, ist es doppelt schwer, Leute dazu zu bringen, sich auf das Gesagte zu konzentrieren. Ich verwende diese Kommentare jetzt in meiner Arbeit. Sie beweisen, dass wir in einer zutiefst lookistischen Gesellschaft leben, in der Menschen auf Grund ihres Aussehens bewertet," stereotypisiert und abgewertet werden."""
Schuften Sie im Garten? Wissen Sie eigentlich, wieso?;
"„Soll gegen mich antreten“ – Meuthen wirft Höcke mangelnden Mut vor;""AfD-Chef Meuthen macht deutlich", dass der Brandenburger Fraktionschef Kalbitz nach seinem Rauswurf nicht auf diesem Posten bleiben kann. Er spricht eine Warnung an seine Fraktionskollegen aus – und wirft Höcke Feigheit vor.

Anzeige

Nach dem Rauswurf aus der AfD muss der Brandenburger Fraktionschef Andreas Kalbitz aus Sicht des Bundesvorsitzenden Jörg Meuthen seinen Posten nun zügig räumen. Dass ein Nicht-Parteimitglied Vorsitzender einer Landtagsfraktion bleibe, sei „nicht hinnehmbar“, und dafür gebe es in der Partei keine Akzeptanz, sagte der Europaabgeordnete den Zeitungen der Funke-Mediengruppe.

„Das wäre eine Beschädigung der Partei im Ganzen. Und in der Fraktion sollten alle verstehen, dass ihnen Vasallentreue zu Andreas Kalbitz jetzt sicherlich nicht zum Vorteil gereicht.“

Dass Kalbitz nun vor ordentlichen Gerichten gegen seinen Rauswurf vorgeht, kommentierte Meuthen betont gelassen. „Parteiintern ist der Vorgang abgeschlossen. Herr Kalbitz ist kein Mitglied mehr. Und wenn er ein Zivilgericht anrufen will, dann soll er den Weg gehen.“

Meuthen möchte Partei bis Jahresende „befrieden“

Anzeige

Zu Warnungen vor einer Spaltung der rechtspopulistischen Partei sagte Meuthen: „Wir haben im Fall Kalbitz einen Dissens, der erhebliche Unruhe und Streit in der Partei auslöst. Manchmal muss das sein. Meine feste Zielsetzung ist, dass wir bis Jahresende die Partei so weit befriedet haben, dass wir geschlossen in die Wahlkämpfe des Jahres 2021 gehen können.“

Kalbitz war einer der Wortführer des offiziell inzwischen aufgelösten Flügels um den Thüringer AfD-Landes- und Fraktionsvorsitzenden Björn Höcke; der Verfassungsschutz stuft die Strömung als „gesichert rechtsextremistische Bestrebung“ ein.

Über Höcke sagte Meuthen, dieser sei kein Bundespolitiker, sondern von den Medien in eine Rolle reingeschrieben worden, die er gar nicht innehabe. Zudem vertrete Höcke Positionen, die nicht seine seien.

Lesen Sie auch Kalbitz-Konflikt Jetzt begibt sich Gauland ins Fahrwasser des Höcke-Lagers

Anzeige

„Wenn Herr Höcke Bundespolitik gestalten will – und den Anspruch formuliert er allenthalben -, dann soll er endlich einmal für den Bundesvorstand kandidieren und am besten gegen mich antreten.“ Aber das habe Höcke noch nie gemacht," obwohl er ihn mehrfach dazu aufgefordert habe. „Björn Höcke traut sich aus seinem Thüringer Sprengel nicht hinaus.“"""
"„Das Ding ist in Berlin: Man kann Partys nicht verbieten“;""„Das mit den illegalen Raves ging so vor drei", vier Wochen los. Da habe ich die ersten Einladungen für Partys in Berlin bekommen. Den Rave am vergangenen Wochenende habe ich dann sogar selbst organisiert. Ich habe in unserem Partykollektiv rumgefragt, ob jemand einen guten abgeschiedenen Ort kennt, den die Bullerei nicht findet.

"Der Platz war dann tatsächlich super:"""
Bewerbung, Gehalt," Kontakte - So wird das Praktikum ein Erfolg;""Anzeige"

Das Praktikum ist für einige Studenten der erste Kontakt mit der Arbeitswelt. Plötzlich sind sie nicht mehr einer unter Dutzenden in der Vorlesung, sondern müssen sich beweisen. Das kann Angst machen. Zudem hat die Corona-Pandemie vieles erschwert.

Zum einen hat die Krise die Zahl der Plätze deutlich verringert. Zum anderen arbeiteten viele Praktikanten in den vergangenen Monaten vor allem im Homeoffice, was die Einarbeitung komplizierter macht. Wichtiger denn je ist deshalb eine Begrüßungsmail oder sogar eine kurze Videobotschaft, um sich den Kollegen vorzustellen.

Alle Fragen und Antworten zu Praktika in der Corona-Krise finden Sie hier:

Lesen Sie auch Bewerbung bis Einarbeitung So wird das Praktikum Ihres Kindes trotz Krise ein Erfolg

Praktikanten: Was Unternehmen erwarten

Anzeige

Die Grundregeln in jedem Praktikum sind aber simpel, egal man im Büro oder von zu Hause mitarbeitet: pünktlich und zuverlässig sein, sorgfältig arbeiten, gut erreichbar sein. Damit kann man in jedem Unternehmen punkten.

Denn Arbeitgeber erwarten vor allem eines von Praktikanten: Motivation. Sie ist die am häufigsten genannte Anforderung an den Nachwuchs, heißt es im Praktikantenspiegel 2019, einer Befragung der Unternehmensberatung Clevis Consult. Auf Platz zwei folgen mit knapp 58 Prozent die sozialen Kompetenzen. Dass der Studiengang zur Stelle passt, war dagegen nur für 37 Prozent der Befragten wichtig. Wer also engagiert und sympathisch auftritt, macht schon das meiste richtig.

Und wie geht das genau? „Fragen, fragen, fragen“, rät Ludmilla Aufurth vom Career Service der FU Berlin. Wie sind die Mitarbeiter mit interessanten Positionen dort hingekommen? Was haben sie studiert? Was war für sie hilfreich? Warum sind die Arbeitsabläufe so und nicht anders?

Stellenmarkt jobs.welt.de Finden Sie Ihr Traumpraktikum

Anzeige

„Die Aufgaben sind nie zu 100 Prozent definiert“, sagt Aufurth. Das heißt, man muss sich nicht mit dem zufriedengeben, was der Praktikumsbetreuer vorgibt, sondern kann auch selbst etwas vorschlagen. Wenn es nicht ohnehin vorgesehen ist, sollte man um Feedback bitten.

Sich aber für zu wichtig halten und nur anspruchsvolle Aufgaben einfordern, das empfiehlt sich nicht. Selbst wenn man nur einfache Aufgaben bekommt, sollte man sie gut machen, rät Tamara Schrammel, Autorin eines Bewerbungsratgebers für Studenten, denn: „Das spricht sich herum.“ Am Ende zählt die Referenz und Bewertung im Zeugnis womöglich mehr als die Noten in der Universität.

So wichtig sind Praktika für die Karriere

Praktika sind nicht nur als Aushängeschild wichtig. Sie können Studenten auf mehrere Arten bei ihrer Karriere helfen. Durch Praktika lässt sich der Berufswunsch überprüfen, Kontakt in die Branche oder zu einem bestimmten Unternehmen knüpfen oder bereits etwas lernen, das man später im Beruf braucht.
