title;text
Anzeige

Tipp: Verzichten Sie beim Kauf auch auf eine Noise-Cancelling-Funktion, denn für Kinder ist das Feature ungeeignet. Auch wenn es praktisch sein kann, dass zum Beispiel Lärm am Flughafen ausgeblendet wird – Kinderkopfhörer mit Noise-Cancelling bergen auch das Risiko, dass Umgebungsgeräusche im Straßenverkehr nicht wahrgenommen werden können.

Anzeige Amazon-Aktion Sommerangebote sichten und Schnäppchen sichern Vom 1. bis einschließlich 15. Juli 2020 können Schnäppchenjäger bei über 1000 Produkten, die den Sommer schöner machen, bis zu 40% sparen. Täglich neue Deals und Blitzangebote bei Amazon.

Bluetooth-Kinderkopfhörer: Die besten kabellosen Kopfhörer

Bluetooth-Kopfhörer haben gerade für Kinder einen großen Vorteil: Es kann bei der Nutzung und beim Spielen nicht zu Kabelsalat oder gar einem Kabelbruch kommen. Der kabellose Bluetooth-Kopfhörer von Oxendure* mit Lautstärkebegrenzung erweist sich als günstiges, aber hochwertiges Modell für alle Eltern, die sowohl Wert auf komfortablen Sitz durch Over-Ear-Polster als auch auf nützliche Features wie ein integriertes Radio und Mikrofon legen. Die Headphones sind mit allen gängigen Tablets, Smartphones, Laptops sowie Flugzeugsitz-Audioanschlüssen kompatibel, was den Kinderkopfhörer zu einem idealen Reisebegleiter macht. Eine Akkuladung reicht bis zu zehn Stunden. Der Hersteller empfiehlt die Nutzung für Kinder ab fünf Jahren.

Anzeige Kinderkopfhörer Oxendure Bluetoothkopfhörer jetzt online kaufen

Darüber hinaus empfehlenswert: Die faltbaren Kopfhörer von Mpow* mit Over-Ear-Polstern sowie integriertem Gehörschutz und Bluetooth-Funktion. Sie wurden für Kinder zwischen vier und 16 Jahren entwickelt und sind dementsprechend stabil verarbeitet.

Anzeige Kinderkopfhörer Faltbare Kopfhörer von Mpow jetzt online kaufen

Anzeige

Auch der Hersteller Philips hat Kinderkopfhörer entwickelt, die auf die Bedürfnisse der Kleinen zugeschnitten sind. Vor allem der Bluetooth-Kopfhörer Philips KH402BL* ist ein praktischer Begleiter im Alltag. Der On-Ear-Kopfhörer ermöglicht es zudem, noch einige Umgebungsgeräusche wahrzunehmen. Für Kinder, die damit auch den Schulweg bestreiten, ist dies besonders wichtig, um Gefahrensituationen akustisch wahrzunehmen.

Anzeige Kinderkopfhörer Philips Kinderkopfhörer jetzt online kaufen

Tipp: In-Ear-Kopfhörer eignen sich nicht für Kinder, da ihr Gehörgang noch zu klein ist – greifen Sie stattdessen lieber zu Over-Ear-Varianten, die das Ohr komplett umschließen oder aufliegenden On-Ear-Kopfhörern. Letztere sind durch ihr geringes Gewicht besonders praktisch im Alltag.

Für Kleinkinder eignen sich vor allem Bluetooth-Kopfhörer

Als Kleinkind gelten Kinder zwischen zwei und drei Jahren – für sie sind vor allem Kopfhörer mit Bluetooth-Funktion geeignet, denn bei Modellen mit Kabel kann Strangulationsgefahr bestehen. Besonders auf die Bedürfnisse von Kleinkindern und Kindern zugeschnitten sind die kabellosen Bluetooth-Kopfhörer von Onanoff*: Mit 14 Stunden Akkulaufzeit sind die Kinderkopfhörer besonders ausdauernd, zudem sind sie extrem stabil gebaut und halten so auch wildes Spielen aus. Die Bluetooth-Kopfhörer bieten auch eine kindgerechte Lautstärkebegrenzung – für ein Kleinkind lässt sich diese sogar auf 75 Dezibel reduzieren.

Anzeige Kinderkopfhörer Onanoff Bluetooth-Kopfhörer jetzt online kaufen

Kopfhörer für Kinder: Kabellos unterwegs

Anzeige

Sollen die kabellosen Kopfhörer für Kinder auf einer Flugreise verwendet werden, informieren Sie sich im Vorfeld, ob die Fluggesellschaft die Nutzung von Bluetooth-Geräten erlaubt. In vielen Flugzeugen ist dies inzwischen kein Problem mehr, allerdings gibt es noch immer einige wenige Airlines, die aus Sicherheitsgründen eine Nutzung verbieten. Alternativ empfiehlt sich der Kauf eines Kinderkopfhörers mit Kabel, wie zum Beispiel das Stirnband mit integriertem Kopfhörer von CozyPhones*. Es ist vor allem für kleinere Kinder angenehm zu tragen und kann auf längeren Reisen zugleich als Schlafmaske genutzt werden.

Anzeige Kinderkopfhörer Stirnband von CozyPhones jetzt online kaufen

Aber auch das kindgerechte Design der KidRox-Tigerohr-Kinderkopfhörer* kommt bei kleinen Musik- und Hörspielfans gut an – und Eltern müssen sich dank der integrierten Lautstärkebegrenzung keine Sorgen um das Gehör ihrer Kinder machen.

Anzeige Kinderkopfhörer Kopfhörer von KidRox jetzt online kaufen

Kopfhörer für Mädchen: Für Fans von Rosa und Kätzchen

In ihrer Funktion unterscheiden sich Kopfhörer für Mädchen und Jungen selbstverständlich nicht, dafür wohl aber im Aussehen. Denn gerade Mädchen, die eine Vorliebe für die Farbe Rosa oder süße Kätzchen haben, werden bei diesen Kinderkopfhörern strahlende Augen bekommen: Die On-Ear-Kopfhörer von iclever* haben Katzenohren auf dem Bügel und sind aufgrund ihrer flexiblen Größe für Kinder zwischen drei und zwölf Jahren geeignet.

Anzeige kinderkopfhörer On-Ear-Kopfhörer von iclever jetzt online kaufen

Der EasySMX-Kinderkopfhörer* hat ein süßes Herzchen-Design – darüber hinaus schützt auch hier die Lautstärkebegrenzung vor Gehörschäden.

Anzeige Kinderkopfhörer Kopfhörer von EasySMX jetzt online kaufen

Die perfekten Kopfhörer für die Schule

Auch auf dem Weg zur Schule oder auf dem Schulhof können Kinderkopfhörer zum Einsatz kommen. Hier erweisen sich vor allem Kopfhörer mit Sharing-Funktion als besonders praktisch. Modelle wie der Mpow-Kopfhörer* für Kinder verfügen über einen Shareport, mit dem sich ein zweiter Kopfhörer anschließen lässt. So können Kinder Musik mit ihren Freunden teilen. Und auch der günstige Preis von 16,99 Euro überzeugt viele Eltern: Geht der Kopfhörer in der Schule doch einmal verloren, ist dies leichter zu verschmerzen als bei teureren Markenmodellen.

Anzeige Kinderkopfhörer Mpow-Kopfhörer jetzt online kaufen





Dieser Artikel wurde erstmals am 14.06.2019 veröffentlicht.

Anzeige

*Dieser Text enthält Affiliate Links. Das bedeutet: Sollten Sie über die mit einem Stern gekennzeichneten Links einen Kauf abschließen," erhält WELT eine kleine Provision. Die Berichterstattung beeinflusst das nicht. Unsere Standards der Transparenz und journalistischen Unabhängigkeit finden Sie unter axelspringer.de/unabhaengigkeit."""
"So finden Sie das richtige Tablet für ihr Kind;""Anzeige"

Der richtige Umgang mit Medien wie Handys, Tablet und Laptop will gelernt sein – Kinder, die heutzutage aufwachsen, sehen sich früher oder später ohnehin damit konfrontiert. Eltern können aber maßgeblich dazu beitragen, dass ihr Nachwuchs verantwortungsbewusst im Netz unterwegs ist und auch Apps und andere Angebote sicher nutzen kann. Das pädagogisch wertvolle Spielen mit einem Lerntablet macht nicht nur Spaß, es kann auch dazu beitragen, dass Kinder ein Gefühl für die Technologie und ihre Vorzüge bekommen. Dabei kann direkt ein Modell für Erwachsene zum Einsatz kommen, allerdings bietet auch ein spezielles Kinder-Tablet viele Vorteile, die wir ihnen hier erklären.

Tablet für Kinder: Die Vorteile im Überblick

günstiger Preis

Möglichkeiten zum Regulieren der Nutzungsdauer

Filter und Download von kinderfreundlichen Apps und Spielen

robuste Verarbeitung

ein farbenfrohes Aussehen

Spezielle Tablets für Kinder kosten oft deutlich weniger als herkömmliche Tablets, zudem haben viele Produkte eine Kindersicherung, die es ermöglicht, die Nutzungsdauer pro Tag zu regulieren. Mit einem Kinder-Tablet und dafür kompatiblen Apps lässt sich in vielen Fällen sogar per Smartphone kontrollieren, was das Kind sich anschaut. Besser ist dagegen aber der persönliche Kontakt und das Gespräch darüber, was erlaubt ist und was Kinder mit dem Tablet nicht tun sollten. Kinder sollten nicht unbeaufsichtigt mit Tablets spielen können – insbesondere dann, wenn es sich nicht um ein Kinder-Tablet sondern um ein Gerät für Erwachsene handelt. Der Grund: Eltern können einschreiten, wenn ihr Nachwuchs im Netz auf unangemessene Inhalte oder kostenpflichtige Dienste stößt. Denn: Sich allein auf Filter und kinderfreundliche Software zu verlassen, ist nicht immer die beste Idee. Die Nutzung zu begleiten, vermittelt dagegen das Gefühl, dass man gemeinsam lernt und spielt – das Tablet wird so nicht zum gesichtslosen Babysitter, sondern vielmehr ein weiterer Grund, um Zeit miteinander zu verbringen.

Auch die Optik vieler Kinder-Tablets spricht kleine Technik-Fans oft an. Sie sind bunt und zeichnen sich zudem oft auch durch eine robuste Hülle aus, sodass das Gerät auch Stürze unbeschadet wegstecken kann.

Lesen Sie auch Handy für Kinder Mit diesen Smartphone-Modellen liegen Eltern richtig

Anzeige Prime Day Jetzt bei Amazon stöbern und Schnäppchen sichern Am 13. & 14. Oktober ist Amazon Prime Day. Das bedeutet: Tausende Artikel sind teils stark reduziert. Einzelne Produkte gibt es jetzt schon zum Schnäppchenpreis.

Tablet für Kinder ab 6 Jahren: Zum Einstieg geeignet

Anzeige

Ein Tablet für Schulkinder muss nicht zwangsläufig sämtliche Features bieten, die auch für Erwachsene nützlich sind. Als Einstieg eignet sich oft bereits ein günstiges Kinder-Tablet, das den Kleinen das Gefühl vermittelt, einen eigenen Tablet-PC zum Erkunden und Spielen zu haben. Optimal ist hierfür beispielsweise der Fire HD 8 Kids Edition*. Das Gerät ist durch eine robuste Hülle geschützt. Die sichere und altersgerechte Nutzeroberfläche auf dem Tablet sorgt dafür, dass Eltern entscheiden können, wie lange und wofür das Kind sein Tablet nutzen kann. Der kinderfreundliche Webbrowser sperrt außerdem alle ungeeigneten Internetinhalte. Dank der Medienbibliothek FreeTime Unlimited können neue Spiele, Lern-Apps, Videos, Bücher und Hörspiele genutzt werden – im ersten Jahr der Nutzung sogar kostenlos.

Anzeige Amazon Tablet Fire HD 8 Kids Edition-Tablet online kaufen

Auch das Dragon Touch Kinder-Tablet* zeichnet sich durch eine robuste Silikonhülle aus, die Stöße und Stürze abfedert. Kinder und Eltern haben Zugang zu unterhaltsamen und lehrreichen Spielen, Videos, Apps und sicheren Webseiten. Der Speicher ist dank Micro SD auf bis zu 32 Gigabyte erweiterbar, sodass auch viele Fotos, Videos, Hörspiele und Musik auf dem Kinder-Tablet Platz finden.
