title;text
Weltweit gibt es laut der Johns-Hopkins-Universität mindestens 38.510.263 mit Covid-19 infizierte Personen (Stand 15.10., 8 Uhr). Davon sind 1.092.144 Menschen am Virus gestorben.

Mehr als 900.000 Infektionen in Spanien

Anzeige

Spanien hat als erstes Land der Europäischen Union die Marke von 900.000 Coronavirus-Infektionen überschritten. Seit Beginn der Pandemie seien mehr als 908.000 Infektionen registriert worden, teilte das spanische Gesundheitsministerium mit. Spanien hat knapp 45 Millionen Einwohner. Offiziellen Angaben zufolge wurden mehr als 33.000 Todesfälle in Zusammenhang mit dem Virus registriert. Gesundheitsexperten glauben, dass die tatsächliche Zahl deutlich höher liegt, jedoch nicht ausreichend getestet wird.

An dieser Stelle finden Sie Inhalte von Drittanbietern Um mit Inhalten von Drittanbietern zu interagieren oder diese darzustellen, brauchen wir Ihre Zustimmung. Externe Inhalte aktivieren

In Großbritannien mit 66,6 Millionen Einwohnern haben sich innerhalb von 24 Stunden nachweislich knapp 20.000 Menschen mit dem Coronavirus angesteckt. Das entspricht einem Anstieg von etwa 2500 im Vergleich zum Vortag. 137 Menschen sind an einer Covid-19-Erkrankung gestorben, wie die Gesundheitsbehörden am Mittwoch mitteilten. Besonders stark betroffen von der Pandemie sind der Norden Englands, Nordirland, Schottland und Teile von Wales. Die tatsächliche Zahl der Neuinfektionen dürfte aber noch höher liegen, da nicht genügend Tests zur Verfügung stehen. Der britische Gesundheitsminister Matt Hancock rief für London die zweithöchste Corona-Warnstufe aus. Er begründete dies am Donnerstag im Unterhaus mit rasch steigenden Infektionsraten in der Hauptstadt. Schnelles Handeln sei erforderlich, um das Virus unter Kontrolle zu bekommen, sagte er.

Angesichts rapide steigender Infektionszahlen dürfen sich Angehörige verschiedener Haushalte demnach in Innenräumen nicht mehr treffen, wie der Londoner Bürgermeister Sadiq Khan am Donnerstag bekannt gab. Auch Treffen in Pubs oder Restaurants sind nicht erlaubt, während sie in Grünanlagen gestattet bleiben. Schulen und der Einzelhandel bleiben geöffnet.

Millionen Bewohner Nordenglands warten darauf, zu erfahren, ob sie unter die strengsten Corona-Regeln fallen. Für Liverpool wurden diese bereits angeordnet. Seit dieser Woche gibt es in Großbritannien ein dreistufiges Corona-Warnsystem.

An dieser Stelle finden Sie Inhalte von Drittanbietern Um mit Inhalten von Drittanbietern zu interagieren oder diese darzustellen, brauchen wir Ihre Zustimmung. Externe Inhalte aktivieren

Die Zahl der registrierten Neuinfektionen binnen 24 Stunden stieg am Mittwoch in Portugal mit 10,3 Millionen Einwohnern auf 2072 – das war der höchste Wert seit Beginn der Pandemie. Die Gesamtzahl der Fälle kletterte den amtlichen Angaben zufolge auf mehr als 91.000. Die Zahl der Menschen, die an Covid-19 starben, stieg um sieben auf 2117. Besonders betroffen sind der Norden und der Großraum Lissabon. Sorge bereitet vor allem die Tatsache, dass die Zahl der in Krankenhäusern behandelten Covid-19-Patienten in etwas mehr als einem Monat von gut 300 auf nun fast 1000 in die Höhe schoss.

Frankreichs Corona-Karte färbt sich immer tiefer rot

In Frankreich mit seinen knapp 67 Millionen Einwohnern haben die Gesundheitsbehörden 22.591 Neuinfektionen binnen 24 Stunden registriert. Es ist das dritte Mal in sechs Tagen, dass das Gesundheitsministerium einen Wert über 20.000 mitteilt. Insgesamt seien 779.063 Infektionsfälle verzeichnet worden. Die Zahl der Todesfälle in Kranken- und Pflegeheimen sei um 104 auf 33.037 gestiegen. Damit ist Frankreich weltweit das neunte Land weltweit, das mehr als 33.000 Todesfälle in Zusammenhang mit dem Coronavirus zu beklagen hat.

Zwar sank die Zahl der Neuinfektionen seit vergangenem Wochenende, wo zuletzt ein Rekordhoch von knapp 27.000 am Samstag verzeichnet wurde. Dennoch steigen die Infektionszahlen gegenüber der vergangenen Woche massiv. Die Karte des französischen Gesundheitsministeriums, auf der die Corona-Hotspots in Scharlachrot (auf Französisch „rouge écarlate“) markiert werden, färbt sich deshalb immer tiefer rot.

An dieser Stelle finden Sie Inhalte von Drittanbietern Um mit Inhalten von Drittanbietern zu interagieren oder diese darzustellen, brauchen wir Ihre Zustimmung. Externe Inhalte aktivieren

Anzeige

Dazu gehören mit der Hauptstadt Paris inzwischen neun Ballungsräume und ein Überseegebiet. Der Großraum Marseille, zu dem auch Aix-en-Provence zählt, ist ebenso betroffen wie die Großstädte Lyon, Grenoble, Saint-Etienne, Lille, Toulouse und Montpellier. Dazu gehört auch die Inselgruppe Guadeloupe in der Karibik.

In Bulgarien mit seinen sieben Millionen Einwohnern liegt die Zahl der neuen Positiv-Tests das vierte Mal binnen einer Woche auf Rekordniveau. Die Zahl der Fälle steigt nach offiziellen Daten um 785 auf insgesamt 25.774. Bislang starben 923 Menschen, die positiv auf das Coronavirus getestet wurden. Aktuell befinden sich 1307 Menschen in Krankenhäusern, 63 davon auf Intensivstationen.

In Tschechien meldet das Gesundheitsministerium 8325 neue Positiv-Tests. Das ist der bislang zweithöchste Wert in dem Land mit 10,7 Millionen Einwohnern, die meisten neuen Fälle gab es am vergangenen Freitag. Die Gesamtzahl der Fälle in Tschechien liegt inzwischen bei 129.747. Bislang starben 1106 Menschen, die positiv getestet wurden. Zu Monatsbeginn waren es noch 696 Todesfälle.

Rekorde in Polen und Kroatien

In Polen überschritt die Zahl der täglichen Neuinfektionen mit dem Coronavirus erstmals die Marke von 6000. Innerhalb von 24 Stunden kamen 6526 neue Fälle hinzu, die meisten davon in der Region um die Hauptstadt Warschau (1188). Das teilte das polnische Gesundheitsministerium am Mittwoch mit. Im gleichen Zeitraum starben 116 Menschen in Zusammenhang mit dem Virus. Seit Beginn der Pandemie gab es in Polen 3217 Todesfälle in Verbindung mit einer Covid-19-Erkrankung. Das Land hat rund 38 Millionen Einwohner. Polen ist das einzige Nachbarland Deutschlands, das bisher vom Auswärtigen Amt in Berlin noch nicht ganz oder teilweise als Risikogebiet eingestuft wurde.

Im EU-Land Kroatien verzeichneten die Behörden am Mittwoch einen Rekordwert an neuen Infektionen mit dem Coronavirus. In den vergangenen 24 Stunden sei bei 748 Menschen Sars-CoV-2 nachgewiesen worden, teilte der Krisenstab der kroatischen Regierung mit. Die bisher höchste Zahl von 542 Neuinfizierten hatte der Krisenstab am 8. Oktober registriert. Vier Menschen starben demnach in den letzte 24 Stunden in Verbindung mit einer Covid-19-Erkrankung. Seit Beginn der Pandemie im Februar haben sich in dem 4,2-Millionen-Einwohner-Land nachweislich 21.741 Menschen mit dem Coronavirus angesteckt. 334 Patienten starben mit dem Virus. Am Mittwoch wurden 441 Patienten im Krankenhaus behandelt, 27 von ihnen wurden künstlich beatmet.

Russland mit seinen 144,5 Millionen Einwohnern meldet einen Rekord an Neuinfektionen. Binnen der letzten 24 Stunden gibt es 14.231 weitere Coronavirus-Fälle. Die Gesamtzahl der Infektionen steigt damit auf 1,34 Millionen. Weitere 239 Menschen starben, wodurch sich die Zahl der Todesfälle auf 23.205 erhöht.

In Brasilien mit seinen 209,5 Millionen Einwohnern sterben nach Angaben des Gesundheitsministeriums 749 Menschen nach einer Infektion mit dem Coronavirus. In den vergangenen 24 Stunden sei die Zahl der positiv Getesteten um 27.235 auf 5.140.863 gestiegen. Insgesamt sind 151.747 Menschen an den Folgen der Ansteckung gestorben.

In Südkorea sind 110 neue Infektionen mit dem Coronavirus registriert worden. Die Hälfte der Fälle stehe in Verbindung mit einem Krankenhaus in der Stadt Busan, teilte die südkoreanische Behörde für Krankheitskontrolle und -prävention am Donnerstag mit. In dem Land mit gut 51 Millionen Einwohner liegt die offizielle Zahl der Fälle damit bei fast 25.000.

Anzeige

Mindestens 54 der Neuinfektionen stünden mit dem Krankenhaus für Ältere in Verbindung. Mehr als 40 seien in der dicht bevölkerten Metropolregion Seoul verzeichnet worden, mit Verbindungen zu Krankenhäusern, Kirchen, Schule und Büros.

Alle aktuellen und weltweiten Entwicklungen zum Coronavirus können Sie in unserem Live-Ticker verfolgen.

"Haben Sie Fragen zum Coronavirus? Hier finden Sie die wichtigsten Fakten und Informationen."""
"Wer zerstörte die Monsterschiffe des wahnsinnigen Kaisers?;""Anzeige"

Über den Geisteszustand des römischen Kaisers Gaius Caesar Augustus, genannt Caligula (reg. 37–41 n. Chr.) ist viel spekuliert worden. Die einen halten ihn für einen zynischen Autokraten, die anderen für den Prototypen eines irrsinnigen Despoten. Wie dem auch sei: Dass er einen Hang zum Größenwahn hatte, machten zwei Schiffswracks deutlich, die aus dem kleinen Nemisee bei der gleichnamigen Ortschaft 27 Kilometer südöstlich von Rom geborgen wurden. Mit Längen von 73 und 71 Metern und Breiten von 24 und 20 Metern übertrafen sie die Maße des Schlachtschiffs „HMS Victory“, auf dem der britische Admiral Horatio Nelson in der Schlacht von Trafalgar 1805 seine Flagge führte.

Lesen Sie auch Caligula Der Kaiser, der Roms Adel zur Prostitution zwang

Diese Schiffe, von deren Existenz Fischer bereits in der Renaissance berichtet hatten, wurden unter Mussolini Ende der 1920er in einer aufwändigen Aktion geborgen, für die sogar das Wasser des Sees abgeleitet werden musste. In einem eigens am Ufer errichteten Museum sollten sie von der maritimen Macht des Römischen Imperiums künden, bis Haus und Wracks in der Nacht vom 31. Mai auf den 1. Juni 1944 durch ein Feuer zerstört wurden.

Wer den Großbrand gelegt hat, konnte nie abschließend geklärt werden. Der erste Verdacht fiel auf abziehende Einheiten der deutschen Wehrmacht. Aber auch nachrückende US-Truppen oder wild kampierende Flüchtlinge wurden als mögliche Verursacher ausgemacht. Nur einige Originalteile, die ins Nationalmuseum in Rom verbracht worden waren, überstanden unbeschadet den Zweiten Weltkrieg.

Das größere der beiden Schiffe Caligulas aus dem Nemisee Quelle: Wikipedia/Public Domain

Anzeige

Heute aber ist Alberto Bertucci, Bürgermeister der 2000 Einwohner zählenden Gemeinde Nemi, sicher: Die Schiffe wurden von deutschen Soldaten zerstört. Daher hat der Stadtrat beschlossen, von der Bundesrepublik Deutschland Schadenersatz zu fordern. „Wir fanden Berichte, umfangreiche Dokumente, Zeugnisse: Die Nazis vertrieben alle Bewohner und den Museumsverwalter. Sie beschlossen, diese Schätze in Brand zu setzen. Es gibt keinen Zweifel“, erklärt Bertucci. In italienischen Medien hieß es, die Stadt habe sich wegen der Ansprüche an einen deutschen Anwalt in Florenz gewandt, der auf Entschädigungsfragen spezialisiert sei. Mit den Mitteln aus Deutschland sollen Nachbauten von Caligulas Schiffen im Maßstab eins zu eins entstehen

Ob sich die Urheber des Brandes heute noch eindeutig feststellen lassen, war bislang eine offene Frage, übrigens nicht die einzige, die sich um die berühmten Schiffe rankt. Denn obwohl sich die römischen Autoren alle Mühe geben, die Untaten Caligulas in allen Details auszubreiten, finden sich über die Nemi-Schiffe und ihren aufwändigen Bau keine Hinweise in antiken Quellen.

Gaius Caesar Augustus Germanicus (12–41) regierte von 37 bis 41 Quelle: De Agostini via Getty Images

In seiner Biografie Caligulas berichtet der hohe kaiserliche Beamte Sueton (ca. 70–122 n. Chr.) nur, dass sich der Kaiser „Jachten mit zehn Ruderbänken bauen“ ließ, „die am Heck mit Edelsteinen geschmückt und mit farbig schillernden Segeln versehen waren. In ihrem Innern waren große Bäder, Säulenhallen und Speisesäle und alle Sorten von Obstbäumen und Reben.“ Auch habe Caligula „auf diesen Schiffen am hellichten Tag Gelage gegeben und Ballettaufführungen“. Aber als Route für Caligulas Spritztouren gab der Biograf die Küste Campaniens an.

Anzeige

Der Kratersee von Nemi aber liegt weit im Hinterland von Latium und ist mit 1,67 Quadratkilometern auch so klein, dass er sich kaum für die ausgedehnte Lustreisen des Kaisers geeignet haben wird. Zu den Aristokraten, die sich an den Ufern ihre Ferienvillen errichteten, gehörte auch Julius Caesar. Ein bekanntes Heiligtum der Diana Nemorensis sorgte für göttlichen Beistand und Pilgerbesuch.

In einer aufwändigen Operation wurden die Schiffe ab 1928 aus dem Nemisee geborgen Quelle: DeA / Biblioteca Ambrosiana

Durch die kaiserlichen Stempel auf den Bleirohren, die die Therme auf einem der Schiffe mit Wasser speisten, konnte Caligula aber zweifelsfrei als Bauherr identifiziert werden. Da die luxuriöse Ausstattung der Nemi-Schiffe durchaus zur Beschreibung Suetons passt, haben italienische Altertumswissenschaftler vor einigen Jahren die These entwickelt, am See habe es eine Basis der römischen Marine gegeben. Dort seien unter anderem die Technologien erprobt worden, die der Kaiser für seine Hochseejachten verlangte.

Doch es ging nicht allein um das Vergnügen des Imperators. „An diesem See befand sich wahrscheinlich eine Werft der römischen Marine, in der die Kriegsschiffe technologisch verbessert werden sollten“, erklärte seinerzeit der Wissenschaftshistoriker Antonio Lisi den Befund. „Die antiken Ingenieure testeten hier stromlinienförmigere Bug- und Heckflächen, um die Schiffe schneller zu machen. Hier wurde unter anderem auch ein 14 Meter hohes Heckruder entwickelt. Wir haben die ältesten Beispiele dieser Ruder im Wasser gefunden. Sie machten die Kriegsschiffe der Römer besonders lenkbar.“

So stellte man sich im 19. Jahrhundert Caligulas schwimmende Paläste vor Quelle: picture-alliance / Leemage

Anzeige

Dem widerspricht die Grazer Archäologin Sarah Wolfmayr-Dobrowsky: „Die Aufbauten und Gebäude auf den Schiffen, soweit sie, vor allem anhand der gefundenen Objekte, zu rekonstruieren sind, dienten vor allem kultischen Zwecken und dem Komfort der Kaiser, welche die Schiffe genutzt haben. Auch ist die Qualität der nautischen Geräte, sowie der Ausstattung der Gebäude extrem hochwertig. Auch dies lässt sich aus den Caligula zur Verfügung stehenden Mitteln und seinem hohen Luxusbedürfnis erklären.“

Das hatte für Caligula unangenehme Folgen. „Da seine Mittel durch solches Vorgehen vollständig aufgebraucht waren und er sich in Geldnöten befand“, griff der Kaiser nach Sueton zu „verschiedenen Arten von Rechtsverdrehungen, Versteigerungen und Steuern auf offensichtlichen Raub“. Die Betroffenen, zumeist Senatoren und Ritter, verschworen sich daraufhin, „einen Menschen, der sich zu solchen Verrücktheiten und Verbrechen verstieg, auf die Seite zu schaffen“. Im Januar 41 wurde Caligula ermordet. Er wurde 28 Jahre alt.

"Sie finden „Weltgeschichte“ auch auf Facebook. Wir freuen uns über ein Like."""
"„Schikane“ – Trump kämpft gegen Herausgabe seiner Steuererklärung;""Anzeige"

Im Wahlkampf des Jahres 2016 versprach Donald Trump immer wieder, er werde seine Steuererklärung veröffentlichen, sobald er Präsident sei. In den USA ist das üblich, Barack Obama, George W. Bush, Bill Clinton, sie alle gaben ihre Finanzunterlagen einst heraus. Trump hingegen, ein Mann, der sich oft selbst für seinen Reichtum rühmt, will sie entgegen seiner Ankündigung unbedingt geheim halten.

