title;text

An dieser Stelle finden Sie Inhalte von Drittanbietern Um mit Inhalten von Drittanbietern zu interagieren oder diese darzustellen, brauchen wir Ihre Zustimmung. Externe Inhalte aktivieren

Wer hingegen in Berlin oder Brandenburg zur Schule geht, wird sich gedulden müssen. Die Förderrichtlinien seien noch nicht fertig, teilen beide Länder mit. In der Hauptstadt wurden zwar 9500 Geräte gekauft, gebraucht werden allerdings rund 50.000.

In vielen weiteren Ländern beginnen die Bestellungen gerade erst. In Sachsen, Schleswig-Holstein, Rheinland-Pfalz und dem Saarland können Schulträger seit Mitte Juli Anträge stellen. In Sachsen-Anhalt sollen die ersten Leih-Computer zum Schuljahresbeginn zur Verfügung stehen, wie viele ist noch unklar.

In Hessen, Niedersachsen, Nordrhein-Westfalen und Mecklenburg-Vorpommern wissen die Ministerien nicht, wie viele Geräte die Schulträger bereits bestellt haben, weil die Beschaffung gerade erst begonnen hat. Thüringen antwortete nicht auf Fragen zu den Leih-Computern.

"Dieser Text ist aus der WELT AM SONNTAG. Wir liefern sie Ihnen gerne regelmäßig nach Hause."""
„Das Kontingent ist aufgebraucht," mehr geht nicht“;""Das Sommerwetter hat am Samstag viele Menschen an die Ostseestrände gelockt. Das sorgte teils für Staus", lange Wartezeiten und Sorgen bei der Polizei, ob die Corona-Regeln eingehalten werden. Sonntag könnte schon das Wetter für Ordnung sorgen.

Timmendorfer Strand am 1. August: Zahlreiche Menschen waren schon in den Morgenstunden am Ostseestrand unterwegs

Anzeige

Die Aussicht auf eine Erfrischung in der Ostsee bei sommerlichen Temperaturen hat am Samstag zahlreiche Kurzurlauber auf die Autobahnen gelockt und zu kilometerlangen Staus geführt. Schon zur Mittagszeit warnte die Polizei Kurzentschlossene und Nachzügler davor, ebenfalls noch den Weg an die Küste anzutreten. „Die Verkehrslage auf der A 1 ist katastrophal. Wer jetzt noch Richtung Ostsee losfährt, muss selbst wissen, was er sich antut“, sagte ein Sprecher der Polizei.

Zwischendurch habe sich der Verkehr auf bis zu 17 Kilometer gestaut, doch auch auf dem restlichen Streckenabschnitt zwischen Hamburg und Lübeck sei durchweg mit stockendem Verkehr zu rechnen. Auch an den Küsten selbst kam es bedingt durch das hohe Besucheraufkommen zu langen Wartezeiten: Gegen 12 Uhr waren in der Lübecker Bucht nach Angaben der Polizei nahezu alle Parkplätze belegt.

Auch die Strände, wie beispielsweise in Timmendorf an der Seebrücke oder in Scharbeutz seien zu dieser Zeit bereits stark ausgelastet gewesen. „Das Kontingent ist aufgebraucht, mehr geht nicht“, sagte eine Polizeisprecherin des Lagedienstes Schleswig-Holstein. Neben dem Aufruf, auf einen Strandbesuch zu verzichten, mahnte die Polizei zudem Urlauber zur Vorsicht. So lasse sich an den engen Strandpromenaden kaum kontrollieren, ob die geltenden Corona-Bestimmungen wie der Mindestabstand eingehalten werden.

Lesen Sie auch Rückkehr aus Risikogebieten Wer soll das bezahlen? Die offenen Fragen zur Corona-Testpflicht

Anzeige

Wer sich am Ende dann doch noch einen Platz an der Strandpromenade sichern konnte, entspannte sich auf dem eigenen Handtuch – oder suchte die Erfrischung in der rund 18 Grad kühlen Ostsee. André Rieckhoff, Abschnittsleiter im Seeheilbad Graal-Müritz (Kreis Rostock), sagte: „So voll wie heute war es an diesem Strand in diesem Jahr noch nicht.“

Das uneingeschränkte Sommergefühl an der Küste soll laut Angaben des Deutschen Wetterdienstes (DWD) jedoch nur von kurzer Dauer sein: am Sonntag sei morgens mit wechselhaftem Wetter zu rechnen," am Nachmittag könne es bei Temperaturen bis zu 23 Grad auch zu leichten Regenschauern kommen."""
USA melden über 4,"5 Millionen Infizierte und knapp 153.000 Tote;""Der britische Gesundheitsminister Matt Hancock hat für London die zweithöchste Corona-Warnstufe ausgerufen. Das RKI meldet mit 6638 so viele Neuinfektionen an einem Tag wie noch nie seit Ausbruch der Coronavirus-Pandemie in Deutschland. Ein Überblick in Grafiken und Zahlen."

Anzeige

Die Zahl der binnen eines Tages mit dem Coronavirus neu infizierten Menschen in Deutschland ist erneut sprunghaft gestiegen und hat damit einen Rekordwert erreicht. Die Gesundheitsämter meldeten nach Angaben des Robert-Koch-Instituts vom Donnerstagmorgen 6638 Neuinfektionen – rund 1500 mehr als am Mittwoch. Da waren noch 5132 neue Fälle gemeldet worden. Bislang waren Ende März mit knapp 6300 Neuinfizierten die meisten registriert worden. Allerdings sind die jetzigen Werte nicht mit denen aus dem Frühjahr vergleichbar, weil mittlerweile wesentlich mehr getestet wird – und deshalb auch mehr Infektionen entdeckt werden.

Am Mittwoch vergangener Woche hatten die Gesundheitsämter dem RKI 4059 Neuinfektionen mitgeteilt. Damit war zum ersten Mal seit April die 4000er-Marke überschritten worden.

Bei den intensivmedizinisch behandelten Covid-19-Patienten zeichnet sich ein deutlicher Anstieg ab. Laut RKI-Lagebericht wurden am Donnerstag 655 Corona-Infizierte intensivmedizinisch behandelt, 329 davon wurden beatmet. Eine Woche zuvor (8.10.) hatte der Wert noch bei 487 (239 beatmet) gelegen, in der Woche davor (1.10.) bei 362 (193 beatmet). Rund 8700 Intensivbetten sind in Deutschland derzeit jedoch noch frei.

Anzeige

Die Zahl der Corona-Tests schwankt seit Mitte August zwischen rund 1,1 Millionen und 1,2 Millionen pro Woche. Die Rate der positiven Tests ist nach RKI-Angaben vom Mittwochabend jedoch deutlich gestiegen: von 0,74 Prozent Ende August auf 2,48 Prozent in der Woche vom 5. bis 11. Oktober.

An dieser Stelle finden Sie Inhalte von Drittanbietern Um mit Inhalten von Drittanbietern zu interagieren oder diese darzustellen, brauchen wir Ihre Zustimmung. Externe Inhalte aktivieren

In mehreren Labors gebe es einen Rückstau, einige gaben laut RKI Lieferschwierigkeiten für Reagenzien an. „Das RKI erreichen in den letzten Wochen zunehmend Berichte von Laboren, die sich stark an den Grenzen ihrer Auslastung befinden“, schreibt das Institut im Lagebericht vom Mittwoch. Der zusätzliche Testbedarf durch Urlauber nach Einführung des Beherbergungsverbots mit der Option zu einer „Freitestung“ habe die Situation weiter verschärft.

Seit Beginn der Corona-Krise haben sich nach RKI-Angaben mindestens 341.223 Menschen in Deutschland nachweislich mit dem Virus Sars-CoV-2 infiziert (Datenstand 15.10., 0 Uhr). Die Zahl der Todesfälle im Zusammenhang mit einer Corona-Infektion lag demnach bei 9710. Das waren 33 mehr als am Vortag. Nach Schätzungen des RKI gibt es etwa 284.600 Genesene.

An dieser Stelle finden Sie Inhalte von Drittanbietern Um mit Inhalten von Drittanbietern zu interagieren oder diese darzustellen, brauchen wir Ihre Zustimmung. Externe Inhalte aktivieren

Anzeige

Die Reproduktionszahl, kurz R-Wert, lag nach RKI-Schätzungen in Deutschland laut Lagebericht vom Donnerstag bei 1,08 (Vortag: 1,04). Das bedeutet, dass ein Infizierter im Mittel etwa einen weiteren Menschen ansteckt. Der R-Wert bildet jeweils das Infektionsgeschehen etwa eineinhalb Wochen zuvor ab.

Zudem gibt das RKI in seinem aktuellen Lagebericht ein sogenanntes Sieben-Tage-R an. Der Wert bezieht sich auf einen längeren Zeitraum und unterliegt daher weniger tagesaktuellen Schwankungen. Nach RKI-Schätzungen lag dieser Wert bei 1,22 (Vortag: 1,16). Er zeigt das Infektionsgeschehen von vor 8 bis 16 Tagen.

An dieser Stelle finden Sie Inhalte von Drittanbietern Um mit Inhalten von Drittanbietern zu interagieren oder diese darzustellen, brauchen wir Ihre Zustimmung. Externe Inhalte aktivieren

Weltweit gibt es laut der Johns-Hopkins-Universität mindestens 38.510.263 mit Covid-19 infizierte Personen (Stand 15.10., 8 Uhr). Davon sind 1.092.144 Menschen am Virus gestorben.

Mehr als 900.000 Infektionen in Spanien

Anzeige

Spanien hat als erstes Land der Europäischen Union die Marke von 900.000 Coronavirus-Infektionen überschritten. Seit Beginn der Pandemie seien mehr als 908.000 Infektionen registriert worden, teilte das spanische Gesundheitsministerium mit. Spanien hat knapp 45 Millionen Einwohner. Offiziellen Angaben zufolge wurden mehr als 33.000 Todesfälle in Zusammenhang mit dem Virus registriert. Gesundheitsexperten glauben, dass die tatsächliche Zahl deutlich höher liegt, jedoch nicht ausreichend getestet wird.

An dieser Stelle finden Sie Inhalte von Drittanbietern Um mit Inhalten von Drittanbietern zu interagieren oder diese darzustellen, brauchen wir Ihre Zustimmung. Externe Inhalte aktivieren

In Großbritannien mit 66,6 Millionen Einwohnern haben sich innerhalb von 24 Stunden nachweislich knapp 20.000 Menschen mit dem Coronavirus angesteckt. Das entspricht einem Anstieg von etwa 2500 im Vergleich zum Vortag. 137 Menschen sind an einer Covid-19-Erkrankung gestorben, wie die Gesundheitsbehörden am Mittwoch mitteilten. Besonders stark betroffen von der Pandemie sind der Norden Englands, Nordirland, Schottland und Teile von Wales. Die tatsächliche Zahl der Neuinfektionen dürfte aber noch höher liegen, da nicht genügend Tests zur Verfügung stehen. Der britische Gesundheitsminister Matt Hancock rief für London die zweithöchste Corona-Warnstufe aus. Er begründete dies am Donnerstag im Unterhaus mit rasch steigenden Infektionsraten in der Hauptstadt. Schnelles Handeln sei erforderlich, um das Virus unter Kontrolle zu bekommen, sagte er.

Angesichts rapide steigender Infektionszahlen dürfen sich Angehörige verschiedener Haushalte demnach in Innenräumen nicht mehr treffen, wie der Londoner Bürgermeister Sadiq Khan am Donnerstag bekannt gab. Auch Treffen in Pubs oder Restaurants sind nicht erlaubt, während sie in Grünanlagen gestattet bleiben. Schulen und der Einzelhandel bleiben geöffnet.

Millionen Bewohner Nordenglands warten darauf, zu erfahren, ob sie unter die strengsten Corona-Regeln fallen. Für Liverpool wurden diese bereits angeordnet. Seit dieser Woche gibt es in Großbritannien ein dreistufiges Corona-Warnsystem.

An dieser Stelle finden Sie Inhalte von Drittanbietern Um mit Inhalten von Drittanbietern zu interagieren oder diese darzustellen, brauchen wir Ihre Zustimmung. Externe Inhalte aktivieren

Die Zahl der registrierten Neuinfektionen binnen 24 Stunden stieg am Mittwoch in Portugal mit 10,3 Millionen Einwohnern auf 2072 – das war der höchste Wert seit Beginn der Pandemie. Die Gesamtzahl der Fälle kletterte den amtlichen Angaben zufolge auf mehr als 91.000. Die Zahl der Menschen, die an Covid-19 starben, stieg um sieben auf 2117. Besonders betroffen sind der Norden und der Großraum Lissabon. Sorge bereitet vor allem die Tatsache, dass die Zahl der in Krankenhäusern behandelten Covid-19-Patienten in etwas mehr als einem Monat von gut 300 auf nun fast 1000 in die Höhe schoss.

Frankreichs Corona-Karte färbt sich immer tiefer rot

In Frankreich mit seinen knapp 67 Millionen Einwohnern haben die Gesundheitsbehörden 22.591 Neuinfektionen binnen 24 Stunden registriert. Es ist das dritte Mal in sechs Tagen, dass das Gesundheitsministerium einen Wert über 20.000 mitteilt. Insgesamt seien 779.063 Infektionsfälle verzeichnet worden. Die Zahl der Todesfälle in Kranken- und Pflegeheimen sei um 104 auf 33.037 gestiegen. Damit ist Frankreich weltweit das neunte Land weltweit, das mehr als 33.000 Todesfälle in Zusammenhang mit dem Coronavirus zu beklagen hat.

Zwar sank die Zahl der Neuinfektionen seit vergangenem Wochenende, wo zuletzt ein Rekordhoch von knapp 27.000 am Samstag verzeichnet wurde. Dennoch steigen die Infektionszahlen gegenüber der vergangenen Woche massiv. Die Karte des französischen Gesundheitsministeriums, auf der die Corona-Hotspots in Scharlachrot (auf Französisch „rouge écarlate“) markiert werden, färbt sich deshalb immer tiefer rot.

An dieser Stelle finden Sie Inhalte von Drittanbietern Um mit Inhalten von Drittanbietern zu interagieren oder diese darzustellen, brauchen wir Ihre Zustimmung. Externe Inhalte aktivieren

Anzeige

Dazu gehören mit der Hauptstadt Paris inzwischen neun Ballungsräume und ein Überseegebiet. Der Großraum Marseille, zu dem auch Aix-en-Provence zählt, ist ebenso betroffen wie die Großstädte Lyon, Grenoble, Saint-Etienne, Lille, Toulouse und Montpellier. Dazu gehört auch die Inselgruppe Guadeloupe in der Karibik.

In Bulgarien mit seinen sieben Millionen Einwohnern liegt die Zahl der neuen Positiv-Tests das vierte Mal binnen einer Woche auf Rekordniveau. Die Zahl der Fälle steigt nach offiziellen Daten um 785 auf insgesamt 25.774. Bislang starben 923 Menschen, die positiv auf das Coronavirus getestet wurden. Aktuell befinden sich 1307 Menschen in Krankenhäusern, 63 davon auf Intensivstationen.

In Tschechien meldet das Gesundheitsministerium 8325 neue Positiv-Tests. Das ist der bislang zweithöchste Wert in dem Land mit 10,7 Millionen Einwohnern, die meisten neuen Fälle gab es am vergangenen Freitag. Die Gesamtzahl der Fälle in Tschechien liegt inzwischen bei 129.747. Bislang starben 1106 Menschen, die positiv getestet wurden. Zu Monatsbeginn waren es noch 696 Todesfälle.

Rekorde in Polen und Kroatien

In Polen überschritt die Zahl der täglichen Neuinfektionen mit dem Coronavirus erstmals die Marke von 6000. Innerhalb von 24 Stunden kamen 6526 neue Fälle hinzu, die meisten davon in der Region um die Hauptstadt Warschau (1188). Das teilte das polnische Gesundheitsministerium am Mittwoch mit. Im gleichen Zeitraum starben 116 Menschen in Zusammenhang mit dem Virus. Seit Beginn der Pandemie gab es in Polen 3217 Todesfälle in Verbindung mit einer Covid-19-Erkrankung. Das Land hat rund 38 Millionen Einwohner. Polen ist das einzige Nachbarland Deutschlands, das bisher vom Auswärtigen Amt in Berlin noch nicht ganz oder teilweise als Risikogebiet eingestuft wurde.

Im EU-Land Kroatien verzeichneten die Behörden am Mittwoch einen Rekordwert an neuen Infektionen mit dem Coronavirus. In den vergangenen 24 Stunden sei bei 748 Menschen Sars-CoV-2 nachgewiesen worden, teilte der Krisenstab der kroatischen Regierung mit. Die bisher höchste Zahl von 542 Neuinfizierten hatte der Krisenstab am 8. Oktober registriert. Vier Menschen starben demnach in den letzte 24 Stunden in Verbindung mit einer Covid-19-Erkrankung. Seit Beginn der Pandemie im Februar haben sich in dem 4,2-Millionen-Einwohner-Land nachweislich 21.741 Menschen mit dem Coronavirus angesteckt. 334 Patienten starben mit dem Virus. Am Mittwoch wurden 441 Patienten im Krankenhaus behandelt, 27 von ihnen wurden künstlich beatmet.
