title;text

Wie Favre das Puzzle zusammensetzen will, wird sich vielleicht schon in Duisburg zeigen. Ob Reus, der wegen einer langwierigen Adduktorenverletzung seit Anfang Februar nicht mehr gespielt hat, gleich in die Startelf rücken wird, ist jedoch offen. „Wir werden sehen“, sagte der Trainer, der sich in jedem Fall freut, seinen alten und neuen Kapitän wieder an Bord zu haben. „Marco spürt Fußball. Er ist sehr, sehr clever“, erklärte Favre, der sich in Bezug auf den DFB-Pokal hohe Ziele gesetzt hat. „Ich kann sagen, dass wir den Pokal gewinnen wollen“, sagte er. Das sind für ihn ungewohnt forsche Worte. Zeit würde es zumindest, dass der viermalige DFB-Pokalsieger mal wieder eine erfolgreiche Pokalsaison spielt. In den vergangenen beiden Spielzeiten war der BVB jeweils im Achtelfinale an Werder Bremen gescheitert.

Lesen Sie auch Orthopäde erklärt Nackenschmerzen? „Manche wissen nicht mehr," was lockere Muskeln sind“"""
Zustand verbessert – Nawalny kann aufstehen;
"Brüderlich aus Herz und Holz;""Die Augsburger Puppenkiste ist ein Symbol der Bundesrepublik. Von ihren Anfängen in den Trümmern der Nachkriegszeit erzählt Thomas Hettche in seinem märchenhaften Roman „Herzfaden“. Jetzt steht er auf der Shortlist für den Deutschen Buchpreis."

Anzeige

Es gehört zu den Binsen der Kulturgeschichte, dass kein altes Medium durch ein neues einfach ersetzt wird. Der ganz unglaubliche Erfolg eines Marionettentheaters im deutschen Fernsehen ist ein schlagendes Beispiel dafür (Jim Hensons „Muppets“ wären ein amerikanisches Pendant). Es ist wohl umgekehrt: Ohne seine fortdauernde TV-Präsenz wäre die Augsburger Puppenkiste wohl kaum über den Status einer regionalen Attraktion hinausgekommen.

Heute hat das Fernsehen selbst längst vor allen bei den jüngeren Zielgruppen seinen Rang verloren, und so hat es eine gewisse paradoxe Logik, dass nun die gute alte Romankunst den Faden wieder aufnimmt. Denn aus Büchern, von Grimms Märchen über den „Kleinen Prinzen“ bis zu „Jim Knopf“, stammen die Vorlagen der erfolgreichsten Inszenierungen.

Lesen Sie auch Anti-AKW-Proteste Eine Kindheit im Schatten des Schnellen Brüters

Thomas Hettche erzählt in seinem neuen Roman „Herzfaden“, der auf der Shortlist für den Deutschen Buchpreis steht, von den Anfängen der Augsburger Puppenkiste in Kriegs- und Nachkriegszeit. Er tut das aus der Perspektive der Mitgründerin und langjährigen Leiterin Hannelore Oehmichen, genannt „Hatü“, die allerdings noch ein zwölfjähriges Mädchen war, als ihr Vater Walter, Oberspielleiter am Augsburger Stadttheater, 1943 nach seiner Entlassung aus der Wehrmacht zur Familienunterhaltung daheim ein Marionettentheater bastelte.

Hauptfigur des Romans: Die Erfinderin der Augsburger Puppenkiste Hannelore Marschall-Oehmichen zwischen ihren Söhnen 1997 Quelle: picture-alliance / dpa

Anzeige

Zunächst stehen Märchen auf dem Programm, doch geht es nicht nur um Kindertheater. „Hänsel und Gretel“ führt das Familienensemble auch vor Verwundeten im Wehrmachtslazaratt vor. „Man wünscht sich etwas, und es geht in Erfüllung. Das ist ein Märchen … Das Märchen sagt: Nichts ist folgenlos und nichts ist Schicksal“, das wird viel später der Märchenerzähler Michael Ende der nun erwachsenen Hatü sagen, die den Autor ihres Erfolgsstücks „Jim Knopf“ persönlich kennenlernen will.

Lesen Sie auch Hans Jürgen von der Wense Wandernd durch dunkelste Zeit

Aus Hatüs zunächst noch kindlich-neugieriger, dann jugendlich-verwirrter Sicht lässt Hettche eine Zeit des Schreckens Revue passieren: den Krieg und die Nazi-Indoktrination, den Holocaust – Hannelore wird erschrocken Zeugin, wie ihre jüdischen Nachbarn deportiert werden –, den Bombenkrieg, auch auf das Nazi-Rüstungszentrum Augsburg, dem beim verheerenden Luftangriff im Februar 1944 auch das Puppentheater zum Opfer fällt. Buchstäblich aus Trümmern bauen die Oehmichens nach dem Krieg ihre neue „Puppenkiste“ auf, als idealistisches, selbstausbeuterisches Gesamtkunstprojekt mit Freunden und jungen Schauspielschülern.

Der Fundus als Purgatorium

Doch Hettche belässt es nicht bei diesem Künstlerinnen-Roman mit historischem Material. Als gegenwärtige Rahmenhandlung hat er selbst ein Märchen entworfen. Ein Mädchen auf der Schwelle zum Teenager reißt sich nach einer Puppenkisten-Aufführung wütend von der Hand des Patchwork-Vaters los und gerät durch eine Geheimtür in eine Parallelwelt der Marionetten: Der Fundus als Jenseits oder besser Purgatorium, in dem die 2003 verstorbene Hatü inmitten ihrer quicklebendigen Geschöpfe wohnt.

Lesen Sie auch Ulrike Draesner „Eine irre implizite Gender-Regel“

Anzeige

Das ist ein bisschen „Alice im Wunderland“ und ein bisschen „Unendliche Geschichte“, aber auch sehr viel doch recht platte Medienkritik: Denn ein böser Kasperl klaut dem Mädchen das geliebte iPhone, und im Bunde mit dem furchtlosen Marionetten-Superheldenteam Jim Knopf, Urmel und dem Kleinen König Kalle Wirsch muss sie es wiederholen, weil der Kasperl damit sonst wie ein kleiner Hitler die Welt zerstört oder beherrscht oder so ähnlich.

Bei Hettche ist der Kasperl der Böse Quelle: picture alliance / dpa Augsburger Puppenkiste/dpa

Das ist leider ein ziemlicher Schmarrn, verglichen mit den tiefsinnigen Märchen, die die Puppenkiste selbst erzählt und die von Hettche wunderbar beschrieben (und zusätzlich von Matthias Beckmann illustriert) werden. Zudem wird um die Frage, warum der Kasperl eigentlich so böse ist, auch noch ein recht wackeliger und kruder Plot konstruiert, wo es um jugendliche Traumata, verführerische Nazi-Ideologie, Antisemitismus und verdrängte deutsche Schuld geht.

Lesen Sie auch Literarische Stadtsoziologie Stuttgart als geistige Lebensform

Seit seinem vor fast 20 Jahren erschienenen Roman „Der Fall Arbogast“ über ein vermeintliches Sexualverbrechen in den 50er-Jahren gilt Hettche als Spezialist für die moralischen Ambivalenzen der Nachkriegszeit. Seine Chronik der Puppenkiste als einer spezifischen deutschen Mediengeschichte funktioniert da besonders gut, wo er in den Plots verborgene biografische Spuren der Marionettenkünstler findet. Doch bot das historische Material allein wohl zu wenig Dramatik.

Spezialist für die Nachkriegszeit: Autor Thomas Hettche, geboren 1964 Quelle: picture alliance / dpa-Zentralbild

Anzeige

„Herzfaden“ ist eine hochromantische Hommage an eine Kunstform, die ganz von der Illusion lebt, dass ein Stück totes Holz zum lebendigen Wesen wird. Hettche wünscht sich, dass sich auch noch heute, im digitalen Zeitalter, Kinder und Erwachsene von analoger, sozusagen handgeschnitzter Kunst (und Literatur) in eine andere Welt versetzen lassen. Dass dieser Wunsch in Erfüllung geht, wenn man nur fest daran glaubt, ist an diesem Roman das eigentlich Märchenhafte.

Thomas Hettche: „Herzfaden“. Roman der Augsburger Puppenkiste. Kiepenheuer & Witsch, 288 Seiten, 24 Euro.

Quelle: Welt am Sonntag

"Dieser Text ist aus der WELT AM SONNTAG. Wir liefern sie Ihnen gerne regelmäßig nach Hause."""
Wie Deutschland lernt, Nein zu sagen;
"Nach Corona-Ausbruch – Staatsanwaltschaft ermittelt gegen „Superspreaderin“;""Anzeige"

Nach einem schweren Corona-Ausbruch in Garmisch-Partenkirchen ermittelt die Staatsanwaltschaft München II gegen eine mutmaßliche „Superspreaderin“. Dabei gehe es um den Verdacht der fahrlässigen Körperverletzung, sagte Oberstaatsanwältin Andrea Mayer am Montag. „Was im Raum steht, ist ein mögliche Verletzung der Quarantänevorschriften.“ Der „Münchner Merkur“ hatte zuerst darüber berichtet.

Eine 26-jährige US-Amerikanerin, die in Garmisch-Partenkirchen lebt, soll trotz Krankheitsanzeichen durch verschiedene Kneipen gezogen sein und dabei mehrere Menschen angesteckt haben. Nach Angaben des Landratsamts hatte sich testen lassen. Bis zum Ergebnis hätte sie in Quarantäne bleiben müssen. Die Anklagebehörde geht davon aus, dass deutsches Recht gilt. In Bayern kann bei Verstößen gegen Quarantäne-Auflagen ein Bußgeld von 2000 Euro verhängt werden.

Die Frau arbeitete in einem Hotel für US-Streitkräfte und deren Familien. Die Ferienunterkunft wurde am Montag für zwei Wochen geschlossen, nachdem mehrere Beschäftigte positiv getestet wurden, wie das Hotel auf seiner mitteilte.

Lesen Sie auch Corona-Cluster Wie wenige Superspreader die Pandemie am Laufen halten

Anzeige

„Die Dame hat Symptome gehabt, war bei uns bei der Teststation und wurde aufgrund der Symptome aufgefordert, in Quarantäne zu bleiben. Das hat sie aber nicht getan“, sagte der Sprecher des Landratsamtes, Stephan Scharf, bereits am Samstag. Die 26-Jährige sei kurz zuvor aus einem Urlaub in Griechenland zurückgekehrt. Ob sie sich auf der Reise angesteckt hat oder danach in Garmisch-Partenkirchen, sei unklar.

Söder fordert Konsequenzen

Auf Twitter regte sich Unmut über das vom Landratsamt beschriebene Verhalten der Frau. „Der Blick nach Garmisch zeigt aktuell ein Beispiel dafür, dass man den gesunden Menschenverstand und die Bereitschaft des Einzelnen nicht voraussetzen kann. So schade“, schrieb dort jemand. Es ist einer der höflicheren Posts.

Bayerns Ministerpräsident Markus Söder (CSU) forderte Konsequenzen für die mutmaßliche Verursacherin des Corona-Ausbruchs. „Garmisch-Partenkirchen ist ein Musterfall für Unvernunft“, sagte Söder am Montag nach einer Kabinettssitzung in München. Der Fall sei ein Beispiel dafür, wie schnell sich Corona-Infektionen verbreiten könnten. „Dieser Leichtsinn muss auch Konsequenzen haben.“ Es sei deshalb sinnvoll, mit entsprechend „hohen Bußgeldern“ zu agieren.

Am Wochenende haben sich etwa 700 Menschen in Garmisch-Partenkirchen auf das Virus testen lassen. Wie viele sich infiziert haben, sei noch unklar, sagte ein Sprecher des Landratsamts am Montag. „Wir haben aktuell noch keine Ergebnisse.“ Man hoffe," im Laufe des Tages erste Auswertungen zu bekommen. Unter anderem der Bayerische Rundfunk hatte zuerst über die Zahl der Tests berichtet. Insgesamt belief sich die Zahl der Neuinfektionen in der Marktgemeinde bis Samstag auf 37."""
Zusammenhang mit Kommunalwahl möglich;Die mutmaßlich islamistische Attacke in Stolberg steht laut Ermittlern möglicherweise in Zusammenhang mit der Kommunalwahl in Nordrhein-Westfalen. Der Vater des Opfers (23) sei auf einem Werbemotiv der AfD zu sehen gewesen.
„Viele Unternehmer investieren nicht mehr in China“;
"36 Schüler an Hamburger Schule infiziert;""In der vergangenen Woche waren die ersten Corona-Infektionen an der Heinrich-Hertz-Schule in Hamburg bekannt geworden. Nun deutet vieles darauf hin", dass es auch zu Ansteckungen im Schulkontext gekommen sein könnte.

Anzeige

In der Heinrich-Hertz-Schule in Hamburg-Winterhude haben sich mittlerweile 36 Schüler und drei Schulbeschäftigte mit dem Corona-Virus infiziert. Damit habe sich die Zahl der Corona-Fälle an der Stadtteilschule im Vergleich zur Vorwoche um zehn erhöht, sagte der Sprecher der Schulbehörde, Peter Albrecht, am Montag.

Insgesamt seien rund 400 Schüler und 200 Schulbeschäftigte auf das Virus getestet worden. Vier Klassen hätten die Quarantäne inzwischen verlassen können, weitere zwölf befinden sich weiterhin in einer präventiven Quarantäne. Es handelt sich um den bislang größten Corona-Ausbruch an einer Hamburger Schule.

Lesen Sie auch Bilanz nach sechs Monaten Was bei einer zweiten Welle anders laufen würde

Laut Auskunft des zuständigen Gesundheitsamtes Hamburg-Nord ist es außerhalb des schulischen Kontextes zu einer Reihe von Infektionen gekommen. In einer Klasse deute aber vieles auf eine Infektionskette innerhalb der Schule hin, sagte Albrecht. Bis zum Vorliegen der Ergebnisse gelte an der Schule weiterhin eine Maskenpflicht – auch im Unterricht.

Anzeige

Insgesamt liegen aktuell 79 Infektionen an 34 Schulen in Hamburg vor, davon 69 Schüler sowie zehn Schulbeschäftigte. 17 Klassen (von rund 9500) sowie 41 Schulbeschäftigte befinden sich in Quarantäne.

Insgesamt 21 Corona-Neuinfektionen in Hamburg

Die Zahl der registrierten Corona-Neuinfektionen in Hamburg ist am Montag im Vergleich zum Vortag um 21 auf 6845 gestiegen. Am Sonntag lag die Zahl der Neuinfektionen bei elf, am Samstag waren es noch 51. Am Sonntag und Montag kommt es aber häufig zu Verzögerungen bei der Auszählung, da nicht alle Gesundheitsämter Daten übertragen. Nach Angaben der Gesundheitsbehörde können 5900 Infizierte als genesen angesehen werden.

