title;text

Anzeige

Zudem sollen Schulgebäude regelmäßig gereinigt und gelüftet sowie allgemeine Vorsichtsmaßnahmen wie Händewaschen eingehalten werden. Der Plan empfiehlt außerdem die Benutzung der offiziellen Corona-Warnapp.

Mecklenburg-Vorpommern

In Mecklenburg-Vorpommern werden mehrere Jahrgangsstufen zu sogenannten definierten Gruppen zusammengeschlossen, meistens sind das zwei Jahrgänge. Beispielsweise in den Stufen fünf und sechs gilt deswegen das Gebot zum Mindestabstand nicht.

Lesen Sie auch Super-Lehrerin Wie geht perfektes Homeschooling, Frau Zafirakou?

Die Gruppen sollen einander im Idealfall etwa durch zeitversetzten Unterrichtsbeginn nicht begegnen. Die festen Gruppen könnten dabei helfen, etwaige Infektionsketten leichter nachzuverfolgen.

Anzeige

Weil etwa 400 der 13.000 Lehrer aufgrund ihres hohen Corona-Risikos weiter im Homeoffice arbeiten, muss der Präsenzunterricht teilweise durch Fernunterricht ergänzt werden, wie das Bildungsministerium mitteilte. Garantiert sind jedem Grundschüler demnach täglich vier Stunden Unterricht in der Schule. An den weiterführenden Schulen sind es mindestens fünf Stunden.

Berlin

In Berlin gilt nach den Sommerferien eine Maskenpflicht an Schulen. Diese gilt jedoch nicht im Unterricht. Auch auf den Pausenhöfen muss keine Maske getragen werden. Klassenverbände und Lerngruppen sollen sich auch in Berlin nicht miteinander vermischen, wenn es zu vermeiden ist. Schulpersonal kann sich auch ohne Symptome kostenlos testen lassen.

Brandenburg

Im Juli lief in Brandenburg eine Teststrategie für Kitas und Schulen an: Danach können sich alle dortigen Mitarbeiter dieses Jahr innerhalb von drei Monaten bis zu sechsmal auf das Virus testen lassen. Außerdem soll bis zu ein Prozent der Kitakinder und der Schüler einmal getestet werden. Noch in diesem Jahr soll außerdem entschieden werden, ob wegen Lernrückständen zusätzlicher Unterricht in den Herbstferien, an Samstagen oder in den Osterferien im kommenden Jahr angeboten wird.

Hamburg

Anzeige

Auch in Hamburg soll der Unterricht so organisiert werden, dass Kontakte reduziert werden und nicht über die eigene Klassenstufe hinausgehen. So dürfen Schüler etwa in Oberstufenkursen in zusammengesetzten Lerngruppen bleiben. Wegen der Ausfälle im Frühjahr sollen besonders für die Klassen drei, vier, fünf und sieben Förderkonzepte erstellt werden, um Lernrückstände aufzuholen.

Schleswig-Holstein

In Schleswig-Holstein sind ebenfalls feste Bezugsgruppen geplant, die als Kohorten bezeichnet werden. Innerhalb dieser Gruppen ist etwa das Abstandsgebot aufgehoben. Dabei kann eine Kohorte mehrere Lerngruppen und gegebenenfalls Jahrgänge umfassen. Sollte es zu einem Ausbruch kommen, sollen im Idealfall nur wenige Kohorten in Quarantäne geschickt werden und nicht gleich die ganze Schule.

Nordrhein-Westfalen

Der Regelbetrieb soll in Nordrhein-Westfalen nach den Sommerferien unter Wahrung von Auflagen weitergehen. Das Schulministerium sicherte jedoch für den Fall eines Ausbruchs zu, den Schulen für Distanzunterricht „schulfachliche und didaktisch-pädagogische Leitlinien“ an die Hand zu geben. Zudem gibt es die Sorge, dass es zum neuen Schuljahr zu wenige Lehrer gibt. Das Ministerium kündigte an, Schulen weitergehende Möglichkeiten zu geben, Lehrerbedarfe befristet auszuschreiben.

Thüringen

Ende August will Thüringen zum Regelbetrieb zurückkehren, allerdings wird eine Maske in den Schulen zum Normalbetrieb gehören. Diese muss bei dem Ampelsystem, das dann gelten soll, auch ohne hohe Infektionszahlen in den Schulgebäuden überall dort getragen werden, wo die nötigen Abstände zwischen den Schülern nicht immer eingehalten werden können. „Ich stelle aber ausdrücklich klar: Im Unterricht ist eine Mund-Nase-Bedeckung wie auch bisher nicht erforderlich“, sagte Bildungsminister Helmut Holter (Linke). Zu den weiteren Hygieneregeln, die nach den Sommerferien in Thüringer Schulen anzuwenden sind, gehören nach Angaben Holters das regelmäßige Händewaschen und das Stoßlüften in Räumen.

Lesen Sie auch Spaß am Lernen So wecken Sie den gesunden Ehrgeiz Ihres Kindes

Bayern

Die Schüler in Bayern haben noch bis 8. September Ferien. Das Land hat allerdings bereits ebenfalls angekündigt, eine Maskenpflicht an Schulen einzuführen. Sie werde bis zum Platz im Klassenzimmer gelten – auch in Grundschulen, sagte Kultusminister Michael Piazolo (Freie Wähler). Je nach Entwicklung der Corona-Pandemie sei regional auch eine Maskenpflicht während des Unterrichts möglich. Die Maskenpflicht ist Teil eines Vierstufensystems, das der Freistaat nach den Sommerferien startet. Es richtet sich nach dem Infektionsszenario in den jeweiligen Regionen. Ziel sei zum Schulstart der Regelbetrieb ohne Mindestabstand, aber unter besonderen Hygienebedingungen.

Kitas

Im August sollen bundesweit auch viele Kitas in den Regelbetrieb zurückkehren – unter Hygieneauflagen. Als Problemthema gilt die Frage, welche Symptome ein Kind haben muss, um nicht mehr in die Kita kommen zu dürfen. In Hamburg etwa werden keine Kinder mit Fieber und Husten betreut – es sei denn, die Symptome sind durch eine chronische Erkrankung hervorgerufen. In Berlin wies die Bildungssenatsverwaltung darauf hin, dass Symptome einfacher Erkältungen kein Grund sein müssten," ein Kind nicht zu betreuen."""
Starkes," emotionales Zeichen gegen Rassismus zum Restart der NHL;""Anzeige"

Matt Dumba, Verteidiger der Minnesota Wild, stand am Samstagabend beim Restart der NHL im Mittelpunkt. Besser gesagt: Er kniete. Während auf Videoleinwänden beim Auftakt in Edmonton (Kanada) die Botschaft „End Racism“ zu sehen war, kniete Dumba, einer der wenigen schwarzen Spieler der Liga, als erster NHL-Spieler während der US-Hymne.

Er hielt dabei eine emotionale Rede – im Namen der Liga und der Hockey Diversity Alliance. Diese Vereinigung hatte er nach dem Tod des Afroamerikaners George Floyd durch Polizeigewalt in Minnesota im Juni zusammen mit anderen schwarzen Spielern gegründet.

Lesen Sie auch Dirk Nowitzki „Es hätte sich nicht angefühlt, als ob ich das wäre“

„Ich weiß aus erster Hand, als eine Minderheit, die das großartige Spiel Eishockey spielt, von den unerklärlichen und schwierigen Herausforderungen, die damit verbunden sind“, sagte der Filippo-Kanadier, „Rassismus ist überall, und wir müssen dagegen kämpfen. Ich hoffe, das inspiriert eine neue Generation Hockeyspieler und -fans, weil schwarze Leben zählen. Eishockey ist so ein tolles Spiel, aber es könnte noch viel besser sein.“

Die NHL hat ihre erweiterten Play-offs im Zeichen des Kampfes gegen soziale Ungerechtigkeit und Rassismus begonnen Quelle: dpa/Jason Franson

Anzeige

Die ebenfalls schwarzen Spieler Malcolm Subban von den Blackhawks und Darnell Nurse von den Oilers standen dabei jeweils mit einer Hand auf Dumbas Schulter neben ihm.

Die Teams der NHL hatten sich bereits zuvor mit der Protestbewegung solidarisiert, auch die Liga startete das Play-off-Turnier in Edmonton und Toronto mit der Botschaft „We skate for Black Lives“. Im Gegensatz zu den weitgehend knienden Spielern der Basketball-Profiliga NBA hatten sich die NHL-Teams darauf verständigt, gemeinsam stehenzubleiben und stattdessen ihre Arme zu verschränken.

Draisaitl überzeugt – aber das Team verliert

Sportlich machte in Edmonton zumindest Leon Draisaitl da weiter, wo er in der im März abgebrochenen regulären Saison aufgehört hatte. Der 24-jährige Nationalspieler, der als erster Deutscher in einer US-Profiliga eine Auszeichnung als Topscorer gewann (Art Ross Trophy) und während der Corona-Pause für drei weitere Auszeichnungen, unter anderem als wertvollster Spieler der Hauptrunde, nominiert wurde, begann die Play-offs mit einem Treffer und zwei Assists. Allerdings unterlagen die Edmonton Oilers überraschend gegen die Chicago Blackhawks, die auf Platz zwölf der Western Conference gerade so in die erweiterten Play-offs gekommenen waren, mit 4:6 (1:4, 1:2, 2:0).

Lesen Sie auch Corona-Fälle in MLB „Mein Besorgnislevel ist von acht auf zwölf gestiegen“

Anzeige

Erfolgreicher lief der Wiederbeginn für die anderen deutschen Eishockey-Profis. Tobias Rieder brachte die Calgary Flames beim 4:1 (0:1, 3:0, 1:0) gegen die Winnipeg Jets in Unterzahl im zweiten Drittel in Führung. Die New York Islanders gewannen in Toronto mit Tom Kühnhackl, aber ohne Thomas Greiss im Tor mit 2:1 (1:0, 1:0, 0:1) gegen die Florida Panthers.

NBA-Profi Jonathan Isaac kniet nicht mit Der NBA-Profi Jonathan Isaac schließt sich nicht dem kollektiven Kniefall seiner Kollegen an. Er bleibt stehen und trägt auch kein Shirt mit dem Schriftzug „Black Lives Matter“. Nach dem Spiel begründet der Basketballer seinen Schritt. Quelle: WELT/ Kevin Knauer

Die NHL spielt ihre Saison in zwei Blasen in den kanadischen Städten Edmonton und Toronto zu Ende. Statt der üblichen 16 Mannschaften sind dieses Jahr 24 Teams in den Play-offs dabei. Während die vier bestplatzierten Mannschaften der Eastern und Western Conference in Mini-Turnieren ihre Setzlisten-Positionen ausspielen, müssen sich die anderen Teams in Best-of-Five-Serien für die danach normal weitergespielten Play-offs qualifizieren.

"Ungewohnt ist neben dem Format auch der Zeitpunkt des Turniers. Das Spiel in Toronto zwischen den Carolina Hurricanes und New York Rangers (3:2) war das erste im August in der NHL-Geschichte."""
"Bundesregierung verbietet Verkauf von Laser-Satellitentechnik nach China;""Anzeige"

Es kommt selten vor, dass die Bundesregierung Geschäfte deutscher Firmen mit China untersagt. Doch das junge deutsche Unternehmen Mynaric, ein Spezialist für Satellitenkommunikation über Laserstrahlen, hat aus Berlin einen Untersagungsbescheid für Geschäfte mit Peking bekommen. Das börsennotierte Unternehmen aus Oberpaffenhofen bei München beteuerte sofort, dass bislang noch keine Technik nach China geliefert wurde. Nach dem Lieferverbot würden nun sämtliche Geschäftskontakte und -aktivitäten abgebrochen, heißt es in einer Mitteilung. Stattdessen hofft Mynaric nunmehr auf einen Auftrag aus dem Pentagon.

Das Lieferverbot nach China ist bemerkenswert, weil Mynaric Kommunikationstechnik für den Zukunftsmarkt der Mega-Satellitenflotten entwickelt. Projekte wie das Starlink-Vorhaben des Technikunternehmers Elon Musk oder ein Projekt des Amazon-Gründers Jeff Bezos sehen in den nächsten Jahren Flotten mit Tausenden Satelliten im All vor. Sie sollen Milliarden Menschen auf der Erde mit Internetzugang versorgen. Elon Musk hat binnen eines Jahres bereits 540 Satelliten ins All transportiert und ist damit bereits weltgrößter Satellitenbetreiber. Aber auch die Militärs sind an der als abhörsicher geltenden Technik interessiert.

Lesen Sie auch Hongkong China lacht, die EU schaut zu

Die Satelliten sollen untereinander und mit Bodenstationen über Laserlichtdatenverbindungen kommunizieren. Dabei sollen teilweise Entfernungen über mehrere Tausend Kilometer überbrückt werden. Die Technologie funktioniert bereits. Entwickelt wurde das Verfahren am Deutschen Zentrum für Luft- und Raumfahrt (DLR). Bereits vor zehn Jahren kam es zur Gründung von Mynaric. Das Unternehmen sieht sich weltweit in der Spitzenposition bei der Technologie. Noch steckt Mynaric mit rund 140 Beschäftigten und 400.000 Euro Umsatz bei 7,8 Millionen Euro Verlust (2019) ganz am Anfang. Doch es wird ein riesiger Markt in der Lasersatellitenkommunikation erwartet. 2020 sei das Schlüsseljahr zur Unternehmensentwicklung, teilte Mynaric mit.

Anzeige

Den Angaben zufolge gab es Planungen in einem fortgeschrittenen Stadium, „die Geschäfte mit China durch ein Buy-out zu veräußern“. Insider sprechen von einer geplanten Abspaltung der China-Aktivitäten durch ein Management-Buy-Out. Vorsorglich habe das Unternehmen in Berlin um eine offizielle Klärung angefragt, aber einen Untersagungsbescheid erhalten. Bei Mynaric heißt es auf Anfrage, dass dadurch ein 1,7 Millionen-Euro-Auftrag mit China wegfällt. „Dieser Eingriff zum Schutz der auswärtigen Interessen beweist die geopolitische Bedeutung der Laserkommunikation und die strategische Wichtigkeit der Mynaric Produkte“, schreibt das Unternehmen.

Mynaric wendet sich in Richtung USA
