title;text

Das entspricht ungefähr zwei Dritteln des mittleren Abstands der Erde zur Sonne. Doch bis zum 23. Juli müssen Sternengucker nicht warten: Schon jetzt erscheint der Komet morgens gegen 3 Uhr am nordnordöstlichen Sternenhimmel – bevor er von der aufgehenden Sonne überstrahlt wird. „Ab dem 18. Juli ist er dann in Deutschland nur noch abends zu sehen“, sagt Liefke.

Wie hell der leuchtende Punkt mit seinem Schweif bei seiner größten Annäherung an die Erde scheinen wird, ist jedoch noch völlig unklar. „Kometen sind immer ein bisschen unberechenbar. Das müssen wir einfach abwarten“, schätzt die Expertin. Auch wo aus er tatsächlich zu sehen sein wird, ist ungewiss. Denn nach Angaben des Deutschen Wetterdienstes in Offenbach ziehen bis mindestens Samstag (11. Juli) immer wieder dichte Wolken über Deutschland hinweg," die den Blick in den Himmel versperren. Entdeckt wurde Neowise erst im März dieses Jahres von dem reaktivierten Weltraumteleskop gleichen Namens."""
In Havanna spielt man nachts;
Trump droht Schulen," die nicht öffnen wollen – und verweist auf Deutschland;""US-Präsident Trump droht Schulen bei Nichtöffnung mit Finanzierungsstopp. Als Argument führt er das Beispiel Deutschland an. Die USA verzeichneten zuletzt mehr als 60.000 Neuinfektionen an einem Tag."

Die Zahl der Corona-Infektionen in den USA steigt weiterhin. Trotzdem will US-Präsident Donald Trump nun die Schulen wieder öffnen. Der Bundesstaat Florida hat das bereits angeordnet. Andere Gouverneure sehen die Aufforderung kritisch.

Anzeige

Trotz der dramatisch hohen Fallzahlen dringt US-Präsident Donald Trump auf eine Öffnung der Schulen im Land nach den Sommerferien. „Wir werden Druck auf die Gouverneure (der Bundesstaaten) und alle anderen ausüben, die Schulen zu öffnen“, sagte Trump am Dienstag (Ortszeit) bei einem Runden Tisch zu dem Thema im Weißen Haus.

Der Republikaner warnte davor, Schulen aus politischen Erwägungen geschlossen zu halten. Er spielte damit auf demokratische Gouverneure von Bundesstaaten an, die sich in großer Zahl gegen Trumps Druck für eine schnelle Rückkehr zur Normalität wehren.

Trump schrieb am Mittwoch auf Twitter: „Die Demokraten denken, es wäre für sie politisch schlecht, wenn die US-Schulen vor der Wahl im November öffnen, aber es ist wichtig für die Kinder und Familien.“ Er drohte Bundesstaaten im Fall von weiterhin geschlossenen Schulen mit einem Entzug von Bundesmitteln, ohne dabei ins Detail zu gehen.

Lesen Sie auch US-Wahlkampf Trump in der TikTok-Falle

Anzeige

Trump schrieb weiter, in Deutschland, Dänemark, Norwegen, Schweden und vielen anderen Ländern hätten Schulen ohne Probleme geöffnet. Der Präsident teilte außerdem mit, er stimme mit den „sehr strengen und teuren Richtlinien“ der Gesundheitsbehörde CDC nicht überein.

An dieser Stelle finden Sie Inhalte aus Twitter Um mit Inhalten aus Twitter und anderen sozialen Netzwerken zu interagieren oder diese darzustellen, brauchen wir Ihre Zustimmung. Soziale Netzwerke aktivieren





Trump schloss am Dienstag einen erneuten Lockdown wegen der Pandemie aus. „Wir bleiben offen, wir schließen nicht.“ Der Präsident betonte, die Zahl der Todesfälle habe deutlich abgenommen – das ist im Vergleich zum Höhepunkt der Krise richtig. Allerdings sagte er auch, dass die Sterblichkeitsrate in den USA „die niedrigste auf der Welt“ sei, was nicht stimmt. Am Mittwoch relativierte er auf Twitter, die Sterblichkeitsrate in den USA gehöre zu den niedrigsten weltweit. Nach Daten der Johns-Hopkins-Universität (JHU) haben unter den 20 am schwersten von der Pandemie betroffenen Ländern 13 eine niedrigere Sterblichkeitsrate pro 100 bestätigter Corona-Infektionen als die USA.

Mehr als 60.000 Neuinfektionen an einem Tag

Anzeige

Die USA verzeichneten erstmals seit Beginn der Corona-Pandemie mehr als 60.000 Neuinfektionen an einem einzelnen Tag. Nach Angaben der JHU vom Mittwoch lag die Zahl der am Vortag registrierten Neuansteckungen bei 60.021. Den zuvor höchsten Wert verzeichnete die JHU mit gut 54.000 Fällen am vergangenen Donnerstag. Bis November könnten nach einem weithin beachteten Modell des Instituts IHME der Universität Washington in Seattle in den USA insgesamt rund 208.000 Menschen nach einer Infektion mit dem Coronavirus sterben.

Der deutliche Anstieg der täglichen Fallzahl könnte auch auf eine verzögerte Meldung von Fällen nach dem langen Feiertagswochenende zurückzuführen sein, am Vortag waren noch rund 45.000 Neuinfektionen registriert worden. Das gilt auch für die Zahl der Toten, die am Dienstag der JHU zufolge sprunghaft von 325 auf 1195 anstieg.

Lesen Sie auch Prof. Stefan Kluge Was ein Intensivmediziner über Covid-19 gelernt hat

Laut der Website der Johns-Hopkins-Universität zum Coronavirus wurden bis Mittwochmittag (Ortszeit) knapp 3,"01 Millionen Fälle registriert – die mit großem Abstand höchste Zahl weltweit. Demnach starben in den USA bereits mehr als 131.500 Menschen an den Folgen von Covid-19. Auch das ist ein trauriger weltweiter Rekord."""
Wie Hermann Gerland in Bermuda-Shorts seinen Traumjob bekam;Hermann Gerland hat mehr als ein Drittel seines Lebens beim FC Bayern verbracht. Der „Tiger“ ist in München eine Legende. Viele im Klub sind berühmter als er, aber kaum einer erfolgreicher. Lahm, Schweinsteiger, Müller, Alaba, Nerlinger, Babbel, Hargreaves - die Liste der Stars, die der Assistenz- und Nachwuchstrainer geformt hat, ist lang. Bei all den Erfolgen, die er mit den Bayern gefeiert hat, ist der knorrige Sohn eines Bergarbeiters sich treu geblieben. Nur bei den Birkenstock-Latschen, die er so gerne trägt, ist Gerland einst eingeknickt. Ein Fehler, der ihm nicht noch einmal passiert ist.
„Ein Land kann in sechs Monaten nicht alle Probleme bewältigen“;
"RTL-Team in Köln bei Dreharbeiten attackiert;""Anzeige"

Ein Team des Fernsehsenders RTL ist bei Recherchen in Köln von mehreren Personen angegriffen worden. Der Vorfall ereignete sich am Dienstagmittag im Stadtteil Ostheim, wie die Polizei mitteilte. Zunächst sei der Kleinbus des RTL-Teams durch ein Auto am Wegfahren gehindert worden. Danach sollen eine 28 Jahre alte Frau und ein 25 Jahre alter Mann aus dem Wagen ausgestiegen sein und das Fahrzeug des Senders mit Schlägen und Tritten beschädigt haben. Verletzte gab es den Angaben zufolge nicht. Es seien Anzeigen wegen Nötigung im Straßenverkehr, Beleidigung und Sachbeschädigung angefertigt worden, sagte eine Polizeisprecherin am Mittwoch.

Nach ersten Erkenntnissen soll der Angriff mit einem Fall zu tun haben, in dem es am 24. Juni Durchsuchungen der Polizei gegeben hatte. Fahnder gingen damals in Deutschland und Frankreich gegen eine mutmaßliche familiär verbundene Einbrecherbande vor. Die Mitglieder der Gruppierung sollen den damaligen Angaben zufolge zu einer aus dem früheren Jugoslawien stammenden Großfamilie gehören, die in Köln ansässig ist. Ein Teil der Gruppe soll vorwiegend Senioren mit Einbrüchen um ihre Ersparnisse gebracht haben.

Die Polizei rechnet die beiden mutmaßlichen Angreifer des RTL-Teams nun dem Umfeld der Personen zu, die damals Adressaten der Durchsuchungen waren. Die genauen Hintergründe seien aber noch Gegenstand laufender Ermittlungen.

Anzeige

Ein RTL-Sprecher bestätigte, dass das Fernsehteam zum Thema der Durchsuchungen im Juni recherchiert habe. „Wir sind sehr erleichtert, dass über die Sachbeschädigung hinaus niemand verletzt wurde“, erklärte er. „Wir werden den Vorfall in unseren Sendungen thematisieren," sobald unsere Recherchen zu dem Thema abgeschlossen sind.“"""
"WHO besorgt – Mehr als eine halbe Million Corona-Fälle in Afrika;""Der britische Gesundheitsminister Matt Hancock hat für London die zweithöchste Corona-Warnstufe ausgerufen. Das RKI meldet mit 6638 so viele Neuinfektionen an einem Tag wie noch nie seit Ausbruch der Coronavirus-Pandemie in Deutschland. Ein Überblick in Grafiken und Zahlen."

Anzeige

Die Zahl der binnen eines Tages mit dem Coronavirus neu infizierten Menschen in Deutschland ist erneut sprunghaft gestiegen und hat damit einen Rekordwert erreicht. Die Gesundheitsämter meldeten nach Angaben des Robert-Koch-Instituts vom Donnerstagmorgen 6638 Neuinfektionen – rund 1500 mehr als am Mittwoch. Da waren noch 5132 neue Fälle gemeldet worden. Bislang waren Ende März mit knapp 6300 Neuinfizierten die meisten registriert worden. Allerdings sind die jetzigen Werte nicht mit denen aus dem Frühjahr vergleichbar, weil mittlerweile wesentlich mehr getestet wird – und deshalb auch mehr Infektionen entdeckt werden.

Am Mittwoch vergangener Woche hatten die Gesundheitsämter dem RKI 4059 Neuinfektionen mitgeteilt. Damit war zum ersten Mal seit April die 4000er-Marke überschritten worden.

Bei den intensivmedizinisch behandelten Covid-19-Patienten zeichnet sich ein deutlicher Anstieg ab. Laut RKI-Lagebericht wurden am Donnerstag 655 Corona-Infizierte intensivmedizinisch behandelt, 329 davon wurden beatmet. Eine Woche zuvor (8.10.) hatte der Wert noch bei 487 (239 beatmet) gelegen, in der Woche davor (1.10.) bei 362 (193 beatmet). Rund 8700 Intensivbetten sind in Deutschland derzeit jedoch noch frei.

Anzeige

Die Zahl der Corona-Tests schwankt seit Mitte August zwischen rund 1,1 Millionen und 1,2 Millionen pro Woche. Die Rate der positiven Tests ist nach RKI-Angaben vom Mittwochabend jedoch deutlich gestiegen: von 0,74 Prozent Ende August auf 2,48 Prozent in der Woche vom 5. bis 11. Oktober.

An dieser Stelle finden Sie Inhalte von Drittanbietern Um mit Inhalten von Drittanbietern zu interagieren oder diese darzustellen, brauchen wir Ihre Zustimmung. Externe Inhalte aktivieren

In mehreren Labors gebe es einen Rückstau, einige gaben laut RKI Lieferschwierigkeiten für Reagenzien an. „Das RKI erreichen in den letzten Wochen zunehmend Berichte von Laboren, die sich stark an den Grenzen ihrer Auslastung befinden“, schreibt das Institut im Lagebericht vom Mittwoch. Der zusätzliche Testbedarf durch Urlauber nach Einführung des Beherbergungsverbots mit der Option zu einer „Freitestung“ habe die Situation weiter verschärft.

Seit Beginn der Corona-Krise haben sich nach RKI-Angaben mindestens 341.223 Menschen in Deutschland nachweislich mit dem Virus Sars-CoV-2 infiziert (Datenstand 15.10., 0 Uhr). Die Zahl der Todesfälle im Zusammenhang mit einer Corona-Infektion lag demnach bei 9710. Das waren 33 mehr als am Vortag. Nach Schätzungen des RKI gibt es etwa 284.600 Genesene.

An dieser Stelle finden Sie Inhalte von Drittanbietern Um mit Inhalten von Drittanbietern zu interagieren oder diese darzustellen, brauchen wir Ihre Zustimmung. Externe Inhalte aktivieren

Anzeige

Die Reproduktionszahl, kurz R-Wert, lag nach RKI-Schätzungen in Deutschland laut Lagebericht vom Donnerstag bei 1,08 (Vortag: 1,04). Das bedeutet, dass ein Infizierter im Mittel etwa einen weiteren Menschen ansteckt. Der R-Wert bildet jeweils das Infektionsgeschehen etwa eineinhalb Wochen zuvor ab.

Zudem gibt das RKI in seinem aktuellen Lagebericht ein sogenanntes Sieben-Tage-R an. Der Wert bezieht sich auf einen längeren Zeitraum und unterliegt daher weniger tagesaktuellen Schwankungen. Nach RKI-Schätzungen lag dieser Wert bei 1,22 (Vortag: 1,16). Er zeigt das Infektionsgeschehen von vor 8 bis 16 Tagen.

An dieser Stelle finden Sie Inhalte von Drittanbietern Um mit Inhalten von Drittanbietern zu interagieren oder diese darzustellen, brauchen wir Ihre Zustimmung. Externe Inhalte aktivieren

Weltweit gibt es laut der Johns-Hopkins-Universität mindestens 38.510.263 mit Covid-19 infizierte Personen (Stand 15.10., 8 Uhr). Davon sind 1.092.144 Menschen am Virus gestorben.

Anzeige

In Israel haben sich seit dem Ausbruch der Pandemie mehr als 300.000 Menschen mit dem Coronavirus angesteckt. Nach Angaben des Gesundheitsministeriums wurden am Donnerstagabend 300.201 Infektionen registriert. Mehr als 200.000 Fälle waren in dem Land am 23. September und mehr als 100.000 Fälle am 21. August ausgewiesen worden. Israel hat rund neun Millionen Einwohner. In Deutschland, das etwa neunmal so viele Einwohner hat, wurden zuletzt insgesamt 341.223 Infektionen registriert.

Die Pandemie verlief in Israel zunächst glimpflich, auch wegen eines strikten Kurses der Regierung. Nach Lockerungen und einer massiven Zunahme der Fallzahlen im Laufe des Sommers gilt seit dem 18. September und mindestens bis Sonntag ein zweiter landesweiter Lockdown mit strikten Regeln wie Ausgangsbeschränkungen. Zuletzt zeichnete sich ab, dass die Zahl der Neuinfektionen abnimmt.

In Israel starben bislang 2127 Menschen in Verbindung mit einer Corona-Infektion, in Deutschland 9710.

An dieser Stelle finden Sie Inhalte von Drittanbietern Um mit Inhalten von Drittanbietern zu interagieren oder diese darzustellen, brauchen wir Ihre Zustimmung. Externe Inhalte aktivieren

In Großbritannien mit 66,6 Millionen Einwohnern haben sich innerhalb von 24 Stunden nachweislich knapp 20.000 Menschen mit dem Coronavirus angesteckt. Das entspricht einem Anstieg von etwa 2500 im Vergleich zum Vortag. 137 Menschen sind an einer Covid-19-Erkrankung gestorben, wie die Gesundheitsbehörden am Mittwoch mitteilten. Besonders stark betroffen von der Pandemie sind der Norden Englands, Nordirland, Schottland und Teile von Wales. Die tatsächliche Zahl der Neuinfektionen dürfte aber noch höher liegen, da nicht genügend Tests zur Verfügung stehen. Der britische Gesundheitsminister Matt Hancock rief für London die zweithöchste Corona-Warnstufe aus. Er begründete dies am Donnerstag im Unterhaus mit rasch steigenden Infektionsraten in der Hauptstadt. Schnelles Handeln sei erforderlich, um das Virus unter Kontrolle zu bekommen, sagte er.

Angesichts rapide steigender Infektionszahlen dürfen sich Angehörige verschiedener Haushalte demnach in Innenräumen nicht mehr treffen, wie der Londoner Bürgermeister Sadiq Khan am Donnerstag bekannt gab. Auch Treffen in Pubs oder Restaurants sind nicht erlaubt, während sie in Grünanlagen gestattet bleiben. Schulen und der Einzelhandel bleiben geöffnet.
