title;text

Spott wegen Friseur-Ausgaben

Für Spott im Internet sorgte das Detail aus dem Bericht, dass Trump in der Zeit von „The Apprentice“ mehr als 70.000 Dollar an Friseur-Ausgaben steuerlich abgesetzt habe. Für seine Tochter Ivanka hätten neun Trump-Firmen Kosten von 95.464 Dollar für Frisuren und Make-up abgesetzt.

Lesen Sie auch Trump oder Biden Das müssen Sie zur US-Wahl 2020 wissen

Die „New York Times“ veröffentlichte keine Original-Unterlagen und erklärte dies damit, dass sie ihre Quellen schützen wolle. Das wäre eine berechtigte Vorsichtsmaßnahme: So können ausgedruckte Unterlagen für das menschliche Auge unsichtbare digitale Wasserzeichen enthalten, die einem bestimmten Drucker zugeordnet werden können.

Hier können Sie unsere WELT-Podcasts hören Wir nutzen den Player des Anbieters Podigee für unsere WELT-Podcasts. Damit Sie den Podcast-Player sehen können und um mit Inhalten aus Podigee und anderen sozialen Netzwerken zu interagieren oder diese darzustellen, brauchen wir Ihre Zustimmung. Soziale Netzwerke aktivieren

"Im Podcast „Inside USA“ erfahren Sie alles über den US-Wahlkampf – jeden Freitag neu."""
„Die CDU will die Auseinandersetzung verstecken, damit kommen sie nicht durch“;
"So wollen Klimaschützer das deutsche Parteiensystem „hacken“;""Anzeige"

Die Grünen werden das auf ihrem Weg in die Regierungsverantwortung nicht gern hören: „Es gibt im Deutschen Bundestag keine Partei, die für sozialgerechten Klimaschutz und das 1,5-Grad-Ziel einsteht“, sagt Bianca Praetorius. „Das ist zum Verzweifeln.“

Praetorius, 35, ihres Zeichens „Start-up Pitch Coach“ in Berlin, hatte immer schon ihre eigene Methode, um mit aufkommender Verzweiflung fertigzuwerden: Sie gründet dann meist eine politische Partei. Nach ersten Erfahrungen mit „Demokratie in Bewegung“ stand sie für „Demokratie in Europa“ 2019 selbst auf dem Wahlzettel.

Doch was die Bundestagswahl 2021 angeht, macht sich die Agenturbesitzerin natürlich keine Illusionen, auch nur in Sichtweite der Fünf-Prozent-Hürde zu kommen. Es ist zum Verzweifeln.

Lesen Sie auch Klimaschutz Jetzt schaltet die digitale Avantgarde in den „Thunberg-Modus“

Anzeige

Doch Aufgeben liegt Praetorius nicht: Gemeinsam mit der Magdeburger Polit-Aktivistin Franka Kretschmer, die bei Fridays for Future, Extinction Rebellion und der Flüchtlingshilfe Seebrücke engagiert ist, will sie das Parteiensystem bei der nächsten Bundestagswahl „hacken“.

Der „hack“ – Englisch für Kniff oder Trick – besteht darin, zahlreiche Mini-Parteien unter dem Querschnittsthema Klimaschutz zu vereinen und so gemeinsam über die Fünf-Prozent-Hürde zu kommen. Es gehe um „den Zusammenschluss aller progressiven Potenziale mit dem Ziel, die sozialgerechte Einhaltung des 1,5-Grad-Ziels ins Parlament zu bringen“, heißt es in dem Aufruf der Initiative „united4bundestag“.

Das Thema Klimaschutz kommt noch „obendrauf“

Dem Plan zufolge stellen Kleinstparteien wie die Piraten, die Tierschutzpartei oder die paneuropäische Volt keine eigenen Kandidaten mehr auf, sondern rufen zur Wahl der neuen Meta-Partei auf. Überspringt die Klimapartei die Fünf-Prozent-Hürde, wären gut 30 Sitze im Bundestag sicher, die dann unter den Kandidaten der teilnehmenden Kleinstparteien verteilt würden.

Anzeige

Während die Meta-Partei dann im Parlament für maximalen Klimaschutz streitet, würden die einzelnen Abgeordneten parallel dazu weiter die Partikularinteressen ihrer Ursprungsparteien vertreten. Das alles sei „völlig legal“, beteuert Praetorius.

Lesen Sie auch Klimaplan der EU 55 Prozent weniger CO₂ – Von der Leyen wagt beim Klima das Maximum

Aus Sicht der „United4bundestag“-Gründer müsste die Chance auf Bundestagssitze ziemlich attraktiv sein für die ansonsten chancenlosen Miniparteien. Weil das Thema Klimaschutz noch „obendrauf“ komme, würden alle von einem verstärkten Zulauf profitieren.

Ansprechen will man „insbesondere junge Menschen aus Fridays for Future, Extinction Rebellion, Seebrücke, Black Lives Matter, Grundeinkommensbewegung, Klimalisten, German Zero, die Partei, Tierschutzpartei, Piraten und Volt“, heißt es in dem Aufruf.

Quelle: Getty; Infografik WELT

Anzeige

„Die Idee eines gemeinsamen, Erfolg versprechenden Wahlantritts ist die einzige Möglichkeit für uns, jetzt parlamentarisch wirksam und sichtbar zu werden“, sagt Jessica Stolzenberger, Fridays-for-Future-Aktivistin und Vorstand der Klimaliste BaWü: „Wir dürfen diese Chance nicht verpassen – es könnte elementar für unsere Zukunft sein.”

Die angesprochenen Parteien hören dem Vernehmen nach den Vorschlägen interessiert zu, Entscheidungen sind noch nicht gefallen. Schließlich ist die Aufgabe einer eigenen Kandidatur auch mit finanziellen Risiken verbunden.

Die erfolgreichste aller Kleinstparteien

Nach dem Parteienfinanzierungsgesetz winkt jeder Partei, die bei der Bundestagswahl auf mehr als 0,5 Prozent kommt, ein staatlicher Zuschuss, früher „Wahlkampfkostenerstattung“ genannt. Dieses Geld würde allein dem neuen Klimabündnis zufallen.

Wenn aber die neue Meta-Partei an der Fünf-Prozent-Hürde scheitern würde, wäre das Geld für alle teilnehmenden Gruppierungen verloren. Denn eine Rückerstattung der Mittel aus der staatlichen Parteienfinanzierung an die Ursprungsgruppen wäre illegal.

Lesen Sie auch 20-Punkte-Plan Altmaiers aussichtsloser Klima-Alleingang

Um also garantiert über fünf Prozent zu kommen – und weil es organisatorisch leichter ist, als eine Partei neu zu gründen –, würde die Klima-Initiative gern die erfolgreichste aller Kleinstparteien als Vehikel für ihren Sturm auf den Bundestag nutzen: die vom Satiriker Martin Sonneborn gegründete Partei für Arbeit, Rechtsstaat, Tierschutz, Elitenförderung und basisdemokratische Initiative (Die Partei).

Der war es bei der letzten Europawahl immerhin gelungen, 2,4 Prozent aller abgegebenen Stimmen auf sich zu vereinen und ihr Ergebnis bei den Kommunalwahlen in Nordrhein-Westfalen in diesem Jahr auf ein Prozent zu verzehnfachen.

„Wir schreiben Dir diesen Liebesbrief, weil …“

Mit einem offenen „Liebesbrief“ versucht die Klima-Initiative deshalb, Sonneborns erfolgreiche Spaßpartei zu umgarnen und davon zu überzeugen, wie ein trojanisches Pferd die Klimaschützer in den Bundestag zu schmuggeln. „In den vergangenen Jahren warst Du oft ein Lichtblick in diesen üblen Zeiten“, heißt es in dem Schreiben. „Deine Satire zeigt nicht nur den aktuellen Wahnsinn auf, sie schafft es auch, Menschen zu erreichen, die in die restliche Parteienlandschaft kein Vertrauen mehr haben – auch uns geht es so.“

Anzeige

So geht die Ranschmeiße über zwei Seiten weiter: „Wir schreiben Dir diesen Liebesbrief, weil wir wissen, dass Dir die gleichen Werte zugrunde liegen wie uns und wir Dich mega feiern. Vor allem aber, weil wir Dich brauchen, denn gemeinsam haben wir das Potential, diesen notwendigen historisch relevanten Aufbruch zu organisieren.“

Lesen Sie auch Stiftungsgründung Weniger Kapitalismus, mehr Menschheit – Mars plant die ökologische Revolution

Die Partei samt ihrem Parteiorgan, dem Satiremagazin „Titanic“, könne „das fehlende Puzzleteil für eine neue, heterogene, kreative Protest-Fraktion“ im Bundestag werden. „Schon ‘ne geile Vorstellung“, heißt es im Schmachtbrief: „30 klimagerechte Chaot*innen sitzen, stehen, hüpfen im Bundestag und nicht mehr nur davor.“

Fraglich ist allerdings, ob die Klimaschützer richtig liegen, wenn sie bei der Satirepartei „gleiche Werte“ auszumachen glauben. Zwar zog Partei-Gründer Sonneborn mit der Forderung in den Europawahlkampf, Klimawandel-Leugnung künftig „mit der Höchststrafe Führerscheinentzug“ zu belegen.

Das trojanische Pferd für bierernste Klimapolitik

Doch stand dieser Programmpunkt auf einer Ebene mit der Forderung nach dem Bau einer deutschen Atombombe, der Einführung eines Existenzmaximums vom einer Mio. Euro und der „Gesundschrumpfung des Bruttoinlandsproduktes auf 50 Prozent“.

Im Regierungsprogramm zur letzten Bundestagswahl tauchte Klimaschutz gar nicht auf, wohl aber die Forderung nach einer Bierpreisbremse. Auch forderte die Partei da noch, „Managergehälter zukünftig an die BH-Größe zu koppeln, um die fruchtlose Debatte zum ,Gender Pay Gap‘ in Führungsriegen zu beenden.“

Lesen Sie auch Peter Thiel „Nuklearenergie ist das Wichtigste. Sie ist die saubere Energie der Zukunft“

Das Interesse der Partei, das trojanische Pferd für bierernste Klimapolitik zu spielen, ist entsprechend gering ausgeprägt. WELT fiel ein Schreiben des Partei-Bundesvorstandes an „die Kader“ in die Hände.

„Es gibt unsererseits keine Pläne für eine Fusionierung unbedeutender Kleinparteien wie „Piraten“, „Volt“, „SPD“ oder „Urbane HipHop Trottel“ zur Bundestagswahl 21 unter unserer Führung“ , heißt es in dem Schreiben Sonnenborns an die „lieben Partei-Freunde“. Dies sei „schon aus zeitlichen Gründen komplett unmöglich“.

Ohne das Zugpferd Partei bleibt dem Klimabündnis „united4bundestag“ jetzt wohl nur noch die harte Tour der eigenen Parteigründung – samt Satzung," Schatzmeister und Landesverbänden."""
„Das ist die tiefste Wirtschaftskrise unserer Generation“;
Der am meisten unterschätzte Faktor für eine glückliche Beziehung;
"Weshalb Bibiana Steinhaus ihre Karriere beendet;""Anzeige"

Sie hatte sich gedulden müssen. Als sie dann endlich debütieren durfte, wurde das zu einem Medienereignis. Der gastgebende Verein, es war Hertha BSC, nutzte ihren Erstligaeinstand im Männerfußball sogar für eine PR-Aktion.

Die ersten 250 Besucherinnen der Partie am 10. September 2017 gegen Werder Bremen, bei der mit Bibiana Steinhaus erstmals eine Schiedsrichterin in der Beletage des deutschen Fußballs im Einsatz war, erhielten einen um 50 Prozent ermäßigten Eintrittspreis.

Ausgeglichen, aber resolut: Schiedsrichterin Bibiana Steinhaus wusste auf dem Platz stets zu überzeugen Quelle: pa/Pressebildage/ULMER

