title;text
WELT: Haben Sie Kontakt zu Ihrem Mann?

Tichanowskaja: Wir halten Kontakt über eine Anwältin, die ihn jeden zweiten Tag sieht. Sie berichtet mir, wie es ihm geht.

WELT: Und wie geht es ihm?

Tichanowskaja: Im Gefängnis zu sitzen ist grundsätzlich kein Vergnügen. In letzter Zeit aber geht es meinem Mann besser. Er spürt immer deutlicher, dass die Weißrussen Veränderungen wollen und bereit sind, dafür und für ihre Rechte zu kämpfen. Mein Mann fängt deswegen wieder an, Hoffnung zu schöpfen. Manchmal kann ich es immer noch nicht glauben – nicht nur ich, mein Mann und ich haben nie gewagt, uns vorzustellen, dass wir einmal in so eine Situation geraten könnten. Vor einigen Wochen noch war ich eine einfache Frau, eine Mutter und Ehefrau und jetzt sitze ich hier.

Zehntausende demonstrieren gegen Lukaschenko In Weißrusslands Hauptstadt Minsk gehen erneut Zehntausende Menschen auf die Straße, um gegen Staatschef Lukaschenko zu demonstrieren. Die Demonstranten fordern den Rücktritt Lukaschenkos und eine Wiederholung der Wahl. Quelle: WELT

WELT: Sie konnten sich vor zwei Monaten nicht vorstellen, sich politisch zu betätigen?

Tichanowskaja: Vor zwei Monaten konnte ich mir nicht mal vorstellen, weiter zu kommen als bis zu unserer Küche. Natürlich mache ich jetzt nur Witze. Aber dass all das so schnell und auch radikal geschehen würde, davon ist niemand von uns ausgegangen.

Anzeige

WELT: Überraschend ist für viele Beobachter auch, wie beharrlich die Weißrussen auf die Straßen gehen – und wie friedlich sie dabei bleiben. Trotzdem ist die Situation in Ihrer Heimat angespannt. Die Sicherheitskräfte gehen mit Gewalt gegen die Protestierenden vor. Alexander Lukaschenko sieht wie jemand aus, der zunehmend den Bezug zur Realität verliert. Gerade erst posierte er mit einem Maschinengewehr. Sind Sie besorgt, dass die Situation weiter eskalieren könnte?

Tichanowskaja: Dass er versucht, seine eigene Bevölkerung einzuschüchtern, ist nichts Neues, es ist die für ihn typische Praxis. Einige sind eingeschüchtert. Niemand möchte geschlagen oder ins Gefängnis geworfen werden. Aber wir müssen auch sehen, dass Ex-Präsident Lukaschenko – so nenne ich ihn – nichts Anderes mehr tun kann, als seiner Bevölkerung zu drohen. Das zeigt, wie schwach er ist. Er mag vielleicht Macht über den Sicherheitsapparat haben, aber er hat keine Macht mehr über die einfachen Menschen, diejenigen, die auf die Straße gehen. Niemand mehr traut ihm, niemand will ihn als Präsidenten sehen. Das heißt, dass er früher oder später abtreten muss. Ich denke, eigentlich weiß auch er selbst das.

Lesen Sie auch Proteste in Weißrussland „Die Spezialkräfte sind hinter uns her“

WELT: Dennoch ist die Situation verfahren: Zwar protestieren die Weißrussen gegen Lukaschenko, fordern Veränderungen. Der aber kommt ihnen nicht entgegen. Er posiert stattdessen mit der Armee und bewegt sich keinen Schritt. Wie lässt sich das auflösen?

Tichanowskaja: Lukaschenko versteht, dass wir in einer schweren politischen Krise stecken und dass wir in eine Wirtschaftskrise geraten werden, wenn er nicht nachgibt. Ich glaube daran, dass jemand, der 26 Jahre an der Spitze einer Nation stand, die Menschen doch lieben muss. Wenn er es tatsächlich tut, dann wird er begreifen, dass es an der Zeit ist, zu gehen. Er wird verstehen, dass wir nicht nachgeben können. Wir werden bis zum Sieg weitermachen. Wir brauchen jetzt einen ernsthaften Dialog. Deswegen haben wir den Koordinierungsrat gegründet.

WELT: Werden Sie bald nach Weißrussland zurückkehren und im Koordinierungsrat diesen Dialog aufnehmen?

Tichanowskaja: Litauen ist wundervoll. Aber meine Heimat ist Weißrussland. Natürlich möchte ich so bald wie möglich zurück. Aber ich kann mich im Augenblick dort nicht sicher fühlen. Ich bleibe also erst mal hier. Sobald aber der Dialog mit der anderen Seite beginnt, werde ich da sein.

WELT: Was muss auf so einen Dialog folgen? Neuwahlen?

„Dialog und Deeskalation sind in jedermanns Interesse“ Nato-Generalsekretär Jens Stoltenberg ist zum Treffen der EU-Außenminister zu Besuch in Berlin. Schwerpunkt werden unter anderem die Lage in Weißrussland und die Krise im östlichen Mittelmeer sein. Vor den Gesprächen gibt er gemeinsam mit Kanzlerin Angela Merkel ein Statement. Quelle: WELT

Tichanowskaja: Aber natürlich.

Anzeige

WELT: Und werden Sie erneut kandidieren?

Tichanowskaja: Ich habe es nicht vor, nein. Ich verstehe mich als jemanden, der einen Übergang gestaltet. Ich weiß nicht, wie ich mich am besten nennen sollte.

WELT: Beobachter gehen davon aus, dass Sie die meisten Stimmen bekommen haben. Sie wurden bereits „gewählte Präsidentin“ oder „Übergangspräsidentin“ genannt.

Tichanowskaja: Ja, das sind Bezeichnungen, mit denen ich einverstanden bin. Ich bin jemand, der dafür sorgt, dass es zu freien, transparenten Wahlen kommt. Dann werden wir uns für einen Präsidenten entscheiden, der länger im Amt bleibt.

WELT: Könnte das Ihr Ehemann sein, der bereits vor seiner Verhaftung angetreten war?

Lesen Sie auch Weißrussland Die EU hat schon einen Lukaschenko-Nachfolger im Blick

Tichanowskaja: Ja, vielleicht. Erst mal muss er entlassen werden. Das ist der nächste Schritt. Eine Bedingung, zu der wir Gespräche führen werden, ist die Freilassung politischer Gefangener, Menschen, die wegen nichts einsitzen. Mein Mann könnte also schon bald frei sein. Und wenn er möchte, soll er dann wieder kandidieren. Jeder sollte die Möglichkeit haben, sich zur Wahl zu stellen.

Anzeige

WELT: Was für ein Land wird ein Weißrussland sein, in dem jeder sich zur Wahl stellen kann? Wird das Weißrussland der Zukunft ein demokratischer Rechtsstaat zwischen der EU und Russland sein?

Tichanowskaja: Was auch immer Weißrussland für ein Land sein wird, eines ist sicher: Es wird ein Land ohne Lukaschenko sein. Die Weißrussen akzeptieren ihn nicht mehr, seine Zeit an der Spitze läuft ab.

WELT: Was erwarten Sie nun von der EU, speziell von Deutschland?

Tichanowskaja: Wir bekommen bereits viel Unterstützung aus verschiedenen Ländern. Da ist zum einen die moralische Unterstützung, aber es gibt auch finanzielle Hilfe, zum Beispiel von Initiativen für Streikende oder Verletzte. Jedes Land weiß selbst am besten, wie es uns Weißrussen in dieser schwierigen Situation am besten helfen kann. Ich glaube, dass gerade Angela Merkel das Streben der Weißrussen nach Freiheit und Demokratie sehr gut verstehen kann. Das ist wichtig. Denn wir wissen alle, dass sie die mächtigste Frau der Welt ist. Sie kann direkt Kontakt zu Lukaschenko aufnehmen oder zum russischen Präsidenten und die Situation aus ihrer Sicht erklären. So kann sie alle Beteiligten dazu drängen, endlich in einen Dialog mit uns zu treten. Ich erwarte von Frau Merkel, dass sie die Situation positiv beeinflusst. Ich weiß nicht genau, wie, aber ich bin mir sicher, dass es möglich ist.

WELT: Sie erwähnten Russland. Was für eine Rolle spielt Moskau hier?

Tichanowskaja: Lukaschenko hat Russland darum gebeten, ihm zu helfen. Ich weiß nicht, was genau er sich erhofft. Aber ich kann es mir vorstellen. Ich bitte deswegen alle Länder, auch Russland, die Souveränität Weißrusslands zu respektieren. Was bei uns passiert, hat nichts mit Geopolitik zu tun, es geht nicht um den Einfluss anderer Länder, nicht um Russland oder die EU. Es geht um die Menschen in Weißrussland," die einfach nur faire und freie Wahlen wollen. Das sollen bitte alle respektieren."""
"„Wasser auf Mühlen der Verschwörungstheoretiker“ – Palmer eckt bei Markus Lanz an;""Der Tübinger Oberbürgermeister Boris Palmer war lange der Star der Grünen. Seine Äußerungen sind oft umstritten und seine Partei möchte ihn am liebsten loswerden. Warum sein Vater einen großen Anteil am heutigen Boris Palmer hat", sehen Sie hier.

Anzeige

Tübingens Oberbürgermeister Boris Palmer sorgte in der Corona-Pandemie einige Male für Schlagzeilen – zuletzt warb er mit Freibier für alle, die die Corona-App auf ihrem Smartphone vorzeigen konnten. Zu Markus Lanz wurde der Grünen-Politiker wohl vor allem deshalb eingeladen, weil er als Proband bei einem Corona-Impftest teilgenommen hatte. Mit dem Grünen-Politiker und den weiteren Talkshow-Gästen, der Journalistin Eva Quadbeck, der Virologin Melanie Brinkmann und dem Autor Kester Schlenz, sprach Lanz in seiner ZDF-Sendung über die Impfstoffentwicklung und über eine mögliche Corona-App-Verpflichtung.

Die Frage nach Palmers Erfahrungen bei der Impfstudie stellte Lanz gleich zu Beginn der Sendung. Er habe eigentlich nichts davon gemerkt und spüre keine Nebenwirkungen, erzählt Palmer. Da es sich dabei aber um eine Doppelblindstudie gehandelt habe, könne es auch gut sein, dass er nur Zucker in den Arm gespritzt bekommen habe. Doppelblind bedeutet, dass weder Arzt noch Patient wissen, wem tatsächlich der Wirkstoff verabreicht wurde. Er hoffe, dass er einen Impfstoff bekommen habe, sagt Palmer. Zur Wichtigkeit solcher Studien pflichtet ihm Virologin Melanie Brinkmann bei. Auch sie würde an einer seriösen Studie teilnehmen.

Palmer kann ebenso bei den anderen Gästen punkten mit einigen Ansätzen, die die Stadt Tübingen im Kampf gegen weitere Corona-Infektionen verfolgt – so zum Beispiel mit flächendeckenden Tests für alle Menschen, die in Pflegeberufen arbeiten, oder günstigen Taxifahrten für ältere Menschen. Kontrovers wird es in der Runde erst, als die Sprache auf die Corona-Warn-App fällt. Palmer plädiert nämlich dafür, eine Installation der App für alle Smartphone-Besitzer verpflichtend zu machen. Er habe dabei keinerlei Bedenken, wenn er es damit vergleiche, was die Menschen im April für massive Grundrechtsbeschränkungen hingenommen haben, sagt Palmer in Richtung der Journalistin Quadbeck. Man habe die Familie nur eingeschränkt sehen können, Kitas und Schulen waren geschlossen. Mit einer effektiven Kontrolle könne all das vermieden werden.

Lesen Sie auch RKI-Statistik Kaum Ansteckung in Bus und Bahn - Wo sich die Deutschen mit Corona infizieren

Quadbeck befürchtet, eine Pflicht sei „Wasser auf die Mühlen der Verschwörungstheoretiker“

Anzeige

Für Quadbeck gibt die Einführung einer Pflicht jedoch „Wasser auf die Mühlen der Verschwörungstheoretiker“, wie sie erklärt. Die Beschränkungen im März und April hätten deshalb funktioniert, weil die Menschen eingesehen hätten, dass diese notwendig waren. Große Teile der Bevölkerung hätten zudem überhaupt nicht die technischen Möglichkeiten, sich die App überhaupt zu installieren. Ihrer Meinung nach könne für die App geworben werden, und sie solle auch weiterentwickelt werden – vor allem täte laut Quadbeck eine Erfolgsmeldung der App gut.

Palmer beharrt jedoch auf der Sinnhaftigkeit einer Verpflichtung. Könnten beispielsweise Restaurantgäste, anstatt ihre Kontaktdaten auf einem Zettel zu hinterlassen, die App zeigen, „könnte sich die Nutzungsquote rasch verdoppeln“, sagt er. Auch dieses Argument sieht Quadbeck kritisch und entgegnet, dass man die Wirte nicht dazu zwingen könne, sich von den Gästen die App zeigen zu lassen.

Bei dieser Aussage gerät Palmer etwas aus der Fassung. „Wenn ich in der Corona-Verordnung schreiben kann, dass der jedem die Daten abnehmen muss, dann kann ich auch schreiben, dass er wahlweise auch seine App zeigen darf. Wo soll denn da das Problem sein?“, fragt Palmer und richtet seine Ansprache weiter an Quadbeck: „Warum sucht ihr Journalisten immer alles, was nicht geht. Sucht doch mal, was geht!“

Lesen Sie auch Einschränkungen für Bürger „Der Staat muss schnell und drastisch reagieren? Gilt nicht mehr“

Auch Virologin Brinkmann spricht sich gegen eine Pflicht aus

Anzeige

Quadbeck entgegnet, dass man aufpassen müsse, in der Corona-Krise nicht zu autoritär vorzugehen. „Was ist daran weniger autoritär, die Schulen zu schließen, zu verbieten, zur Arbeit zu gehen, oder Masken tragen zu müssen, als eine App zu installieren? Das ist doch kein Argument“, so Palmer weiter. Das sei der am wenigsten autoritäre Eingriff überhaupt, schließt er seine Argumentation ab.

Bei diesem Punkt springt Lanz Palmer zur Seite und weist die Journalistin darauf hin, dass auch der Kontaktzettel verpflichtend ist. Die bleibt jedoch bei der Ansicht, dass Verschwörungstheoretiker die App als Versuch ausmachen würden, das ganze Volk zu „scannen“. Sie würde an anderer Stelle ansetzen und einheitliche Regeln einführen, zum Beispiel dieselbe Personenbegrenzung bei Familienfeiern in allen Bundesländern. Auch Virologin Brinkmann spricht sich gegen eine Pflicht aus und plädiert dafür, Menschen zu überzeugen.

Lesen Sie auch Urlaub trotz Corona Das sind die Einreisebestimmungen der EU-Länder

Nach einem kurzen Themenwechsel spricht Lanz erneut die Corona-App an und fragt Palmer, wer die Pflicht denn kontrollieren solle. Seine Antwort: Die App habe eine Bluetooth-Schnittstelle, durch die übermittelt werden könne, ob sie angeschaltet ist. Das lässt auch Moderator Markus Lanz etwas kopfschüttelnd zurück. „Das ist ja Big Brother, über was wir hier reden“, sagt er etwas schockiert. „Das ist eine staatlich definierte Schnittstelle“, entgegnet Palmer wiederum. „Die Frage ist, wenn das die Alternative wäre, für was entscheide ich mich? Da entscheide ich mich dafür, dass die App überall funktioniert, und vermeide die anderen harten Eingriffe," die wir alle schon ertragen haben.“"""
