title;text
"Die interaktiven Möglichkeiten von Internet und Computer haben die Lernweise für Fremdsprachen verändert. """"Die heutige Generation der 'Digital Natives' ist an hohe visuelle Standards und Interaktion gewöhnt"," zudem fordert sie eine flexible Einteilung der Lernzeit. Computer- und Online-Sprachlernlösungen können diese Ansprüche erfüllen""""", berichtet Sylke Riester, Geschäftsführerin für Europa des Sprachlern-Anbieters Rosetta Stone http://www.rosettastone.de , im pressetext-Interview. Weniger Muße und höhere AnforderungenDie Bedeutung von Fremdsprachen steigt in der Wirtschaft im Zuge der Globalisierung," wobei die Finanzkrise den Trend nur verstärkt hat. """"Betriebe setzen mehr auf Qualifikation und Motivation der Mitarbeiter""""", so Riester. Seitens der Lerner werde immer höhere Effizienz und Vereinbarkeit mit dem Tagesablauf gefordert, weshalb die Wegstrecke in einen Kurs oft schon zur Hemmschwelle werde. Dementsprechend beliebt sind Selbststudium-Angebote bei Sprachlernern, um deren Gunst immer mehr Anbieter aus dem Software- und Online-Bereich buhlen.Der Weltmarkt des Sprachenlernens macht laut einer Nielsen-Studie mehr als 83 Mrd. Dollar aus, wovon 32 Mrd. auf Sprachlernmethoden für das Selbststudium fallen. Einer der größten Anbieter ist Rosetta Stone, das 95 Prozent seines Ertrags aus den USA bezieht. Die Konsumausgaben für das Sprachenlernen betragen dort rund fünf Mrd. Dollar, wovon zwei Mrd. auf Angebote des Selbststudiums zurückgehen. Das börsennotierte Unternehmen streckt derzeit die Fühler international aus mit Niederlassungen in England, Korea, Japan und neuerdings auch München.Neue Zugänge im WettbewerbDie Nische, die das US-Unternehmen dabei besetzen will," beruht auf seiner als """"Dynamic Immersion"""" bezeichneten Lernmethode. Sie imitiert das intuitive Sprachlernen", das beim kindlichen Erlernen der Muttersprache oder bei einem Auslandsaufenthalt stattfindet. Nachgestellt wird dieses Erlebnis in der Interaktion mit dem Computer - durch Bilder, die Wort- und Satzbedeutungen selbst erschließen lassen und den Einsatz von Muttersprachlern, deren Aussprache der eigenen gegenübergestellt wird. Zentrale Instrumente sind folglich ein Kopfhörer sowie ein Mikrofon mit Spracherkennung und Aussprache-Analyse.Der Wandel der Technologie stellt jedoch auch Rosetta Stone vor Herausforderungen," die es noch zu meistern gilt. """"Die Applikationen der Zukunft werden auf das iPhone und iPad abgestimmt werden. Der Trend zum mobilen Sprachenlernen hält an"," da die Nutzer eine möglichst große Integration des Lernens in den Alltag fordern und auch außer Haus lernen wollen"""""," so Riester. Ausständig sind auch - zumindest im deutschsprachigen Markt - Möglichkeiten der Online-Interaktion zwischen den Fremdsprachenlernern."""
"Xenotransplantation: Neue klinische Tests mit Diabecell;""Erste Ergebnisse sind viel versprechend"
Vier Personen mit Diabetes wird von Living Cell Technologies (LCT) http://www.lctglobal.com bald lebende Schweinezellen implantiert, die mit Algen überzogen sind. Damit soll die allgemeine Verbreitung von Tier-Mensch-Transplantationen wieder einen wichtigen Schritt näher rücken. Einige Typ-1-Diabetiker in Neuseeland und Russland haben bereits dieses als Diabecell bekannte Xenotransplantat erhalten. LCT hat jetzt die Zulassung der Regierung für die Durchführung einer Phase-II-Studie erhalten.Typ-1-Diabetes entsteht, wenn die Insulin produzierenden Zellen in der Bauchspeicheldrüse, die so genannten Inselzellen, zerstört werden. Insulin-Injektionen sind notwendig, um die Blutzuckerwerte zu normalisieren. Diese Werte schwanken jedoch und können zu Komplikationen im Nervensystem führen, die Lebenserwartung um ein Drittel senken, argumentiert Bob Elliott, der medizinische Direktor von LCT.Algenüberzug unterdrückt ImmunreaktionDas Unternehmen setzt Inselzellen von Schweinen ein, um die fehlenden Zellen zu ersetzen. Die Zellen werden in den Bauchraum implantiert, wo sie Insulin freisetzen. Um Immunreaktionen zu vermeiden, sind sie mit Algen überzogen. Weitere Medikamente sind laut Elliott nicht erforderlich. Das Alginat ermöglicht, dass Nährstoffe und Glukose und in die Inselzellen gelangen und dass Insulin abgegeben wird.In einer früheren Phase-I-Studie erhielten vier Patienten einige der Zellen. Sie gehörten zu jener Gruppe von Diabetikern, die nicht bemerkt, wenn die Blutzuckerwerte gefährlich niedrig werden. Bei einem Patienten verringerten die Implantate laut New Scientist die tägliche Insulindosis um 25 Prozent und die Hypoglykämie-Wahrnehmungsstörung verschwand. Die anderen drei Patienten werden noch beobachtet. Die Ergebnisse seien jedoch laut Elliot sehr viel versprechend.Bis zu 30 Millionen PatientenDie Studien in Russland sind bereits weiter fortgeschritten. Dort begann LCT bereits 2007 mit Tests. Fünf Patienten haben bisher höhere Dosen erhalten und reagieren entsprechend den Erwartungen. Der Wissenschaftler argumentiert, dass nicht genug menschliche Inselzellen zur Verfügung stehen, um die 20 bis 30 Mio. Menschen zu behandeln, die weltweit an Typ-1-Diabetes leiden. Schweinezellen seien daher die beste Alternative. Um das Risiko der Übertragung von Krankheiten zu minimieren, setzt LCT auf Zellen von Schweinen von den Auckland-Inseln. Diese Tiere haben seit 200 Jahren isoliert gelebt und sind laut Elliot bemerkenswert frei von Organismen," die Menschen infizieren können. LCT hat bereits 1996 ähnliche Transplantate eingesetzt. Diese Zellen sind heute noch am Leben. Nur wenige produzieren allerdings immer noch Insulin."""
"User akzeptieren Werbung im Online-TV;""Zuseher würde Verdoppelung von Werbeausmaß nicht stören"
Internet-User wären bereit, beinahe doppelt soviel Werbung im Online-TV über sich ergehen zu lassen als derzeit weitgehend üblich. Wie der Datendienstleister comScore http://comscore.com aufzeigt, werden aktuell pro Stunde schätzungsweise vier Minuten Werbung beim Online-Fernsehen konsumiert. Für die Zuseher wäre mit sechs bis sieben Minuten jedoch ein deutlich höheres Ausmaß an Einschaltungen erträglich. Medienanbieter haben ihr Potenzial im Web offenbar noch nicht ausgeschöpft.Keine Flucht vor WerbungAnders als von vielen Experten und Analysten angenommen, reflektiert die zunehmende Verlagerung des Publikums vom traditionellen Fernsehen ins Internet scheinbar keine Flucht vor der Werbung, meint comScore-Online-Video-Direktorin Tania Yuki. Die Toleranzgrenze für Werbebotschaften sei bei Online-TV-Usern noch nicht ausgereizt. Den gänzlichen Wert der Internet-TV-Medien hätten ihre Betreiber bisher nicht erschlossen und damit Erlöse liegen lassen.Für Cross-Plattform-User, die sowohl im Internet fernsehen als auch das traditionelle Medium TV nutzen, ist comScore zufolge beispielsweise die Freiheit in Zeit und Raum der wichtigste Grund dafür, einen Teil ihres Fernsehgehalts online zu konsumieren. Der Wunsch nach weniger Werbung spiele hingegen eine vergleichsweise untergeordnete Rolle. Für drei Viertel der Zuseher sei es von größerer Bedeutung, sich aussuchen zu können," wo und wann Inhalte gesehen werden. Werbepausen und Unterbrechungen empfinden viele nach wie vor als störend. In Sachen Qualität in Bild und Ton schneide das klassische Fernsehen aber besser ab als Online-TV."""
"Sharp zeigt 3D-Touchscreen für Handys;""Parallaxenschranken-Technologie erlaubt Verzicht auf Spezialbrille"
Der Elektronikkonzern Sharp http://sharp-world.com hat heute, Freitag, einen neuen LCD-Touchscreen für mobile Geräte vorgestellt, der zwischen 2D- und 3D-Betrieb umgeschaltet werden kann. Der 3D-Modus kommt dabei ohne spezielle Brillen aus, da er auf einer sogenannten Parallaxenschranke beruht. Im Vergleich zu herkömmlichen 3D-LCD-Ansätzen zeichne sich die Entwicklung nicht nur durch die Touch-Funktionalität, sondern auch durch eine hohe Helligkeit und ein beachtliches Kontrastverhältnis aus.Bekanntes 3D-Prinzip jetzt mit TouchDas Prinzip hinter dem 3D-Effekt des neuen Displays ist die Parallaxenschranke. Dabei handelt es sich um eine Anordnung vertikaler Schlitze, welche den Lichtweg zu den Augen so beeinflussen, dass ein Tiefenempfinden besteht. Dieses Prinzip haben in der Vergangenheit auch schon Konkurrenten wie beispielsweise Sanyo genutzt. Allerdings hat Sharp es nun geschafft," dieses Prinzip auch noch mit einer Touch-Funktionalität des Displays zu verknüpfen.""""Diese mobile 3D-LCD-Technologie ist überwältigend""""", urteilt das Technikportal Akihabara News. Das liegt auch daran, dass Sharp ein Kontrastverhältnis von 1000:1 verspricht, was etwa das Zehnfache bisheriger 3D-LCDs sein soll. Die Helligkeit wiederum ist laut Sharp mit 500 Candela pro Quadratmeter etwa doppelt so hoch. Das Unternehmen gibt weiters an, dass die Bildschirmauflösung mit 480 mal 854 Pixel deutlich höher liege als bisher.SchönheitsfehlerAls Problem der Parallaxenschranken-Technologie gilt, dass der Bildschirm aus einem relativ engen Bereich betrachtet werden muss, damit der 3D-Effekt wirklich zur Geltung kommt. Das konnte Sharp auch beim neuen 3D-Touch-Display nicht lösen, berichtet Akihihabara. Allerdings dürfte die Bildqualität außerhalb des Idealbereichs die Konkurrenz immer noch ausstechen.Dem Unternehmen zufolge ist das 3,4-Zoll-Display, das wahlweise auch ohne Touch-Funktionalität angeboten werden soll," ideal für Digitalkameras oder Handys. Denkbar wären freilich auch andere portable Geräte wie Konsolen. So soll Sharps Technologie Gerüchten zufolge bei Nintendos angekündigtem 3D-Spielehandheld (pressetext berichtete: http://www.pressetext.com/news/100323019/) zum Einsatz kommen."""
"Yahoo schließt Werbeplattform Publisher Network;""Seit Start im Jahr 2005 kaum Weiterentwicklung"
Yahoo wird seine Werbeplattform Publisher Network http://publisher.yahoo.com schließen. Der Beta-Service, der als direktes Konkurrenzprodukt zu Google AdSense galt, kam seit seinem Start im Jahr 2005 (pressetext berichtete: http://pressetext.com/news/050312004/) nie richtig vom Fleck. Nun will sich Yahoo nach eigenen Angaben mehr auf sein eigenes Anzeigengeschäft konzentrieren und die Plattform, über die Anbieter von Web-Content Anzeigen auf ihren Seiten platzieren können, mit 30. April schließen. Usern des Werbenetzwerks rät Yahoo zu einem Wechsel zum Werbedienst Chitika. Yahoo hält sich bedecktBis heute hat sich der Service nicht aus seinem anfänglichen Beta-Status, der nur auf Einladungsbasis zugänglich ist, heraus entwickelt. Wie viele Mitglieder Publisher Network hat, darüber hält sich Yahoo bedeckt. Eine Sprecherin gab allerdings gegenüber der New York Times an," die Gruppe sei """"klein"""". Yahoos Publisher Network ist nicht zu verwechseln mit einem ähnlichen Werbenetzwerk", dass der Internetkonzern für große Web-Anbieter betreibt. Dieses bleibt aktiv. In einer E-Mail die an die Nutzer von Publisher Network geschickt wurde, schreibt Yahoo, dass die letzten Auszahlungen mit 31. Mai erfolgen sollen. Man habe nach einer intensiven Prüfung des Services entschieden, dass die Ressourcen, die für eine Weiterentwicklung nötig wären, an anderer Steller besser verwendet werden könnten. Das Publisher Network ist allerdings nicht der erste Dienst," den Yahoo im Zuge seiner Umstrukturierung wieder abgedreht hat. Im April 2009 etwa wurde der Website-Hosting-Service Geocities eingestellt. Außerdem hat Yahoo den Business-Kommunikations- und Kollaborationsdienst Zimbra sowie die Karriereseite HotJobs an andere Unternehmen verkauft."""
"Apples iPad gräbt Netbooks das Wasser ab;""Leistungssteigerung wichtig - AMD als Alternative zu Intel"
"Apples Tablet-PC iPad http://apple.com/ipad scheint sich noch vor seiner flächendeckenden Markteinführung gegenüber den bisher tonangebenden Netbooks durchzusetzen. """"Netbooks sind nicht besser als alles andere. Sie sind lediglich billige Laptops""""", unterstrich Apple-Chef Steve Jobs schon bei der iPad-Präsentation Ende Januar. Die Einschätzung bestätigt sich mit Blick auf die Netbook-Verkaufszahlen. IDC zufolge stieg der Absatz im ersten Quartal 2010 nur um 33,"6 Prozent. Ein Jahr zuvor kletterten die Netbook-Verkäufe noch um 872 Prozent.Technologischer Anschluss wichtig""""Bei den Netbooks von einem Einbruch zu sprechen", wäre übertrieben. Schließlich weist das Segment noch immer zweistellige Wachstumsraten auf. Trotz alledem müssen sich die Geräte technologisch anpassen," um nicht den Anschluss zu verlieren"""""," erläutert Erste-Bank-Analyst Hans Engel http://erstebank.at auf Nachfrage von pressetext. Dem Fachmann zufolge ist die Rechenleistung vieler Netbooks oft deutlich begrenzt. Vor allem Intel sei aufgrund seiner Monopolstellung eine """"bremsende Kraft"""". AMD hingegen würde starke Partner benötigen.Der Hype um die handlichen PC-Winzlinge hat sich merklich abgekühlt und sorgt bereits in den Führungsetagen der Hersteller für helle Aufregung. Weil die Gewinnmargen bei kleinen Zehn-Zöllern offenbar nicht den gewünschten Erfolg gebracht haben", wollen Branchenriesen wie Hewlett-Packard oder Dell die Investitionsausgaben für die Geräte reduzieren (pressetext berichtete: http://pressetext.com/news/100402001/). Ein Umdenken ist nicht zuletzt aufgrund des iPads anzuraten. Denn das Netbook-Konzept orientiert sich lediglich am bestehenden PC.Preiskampf und volle Lager drücken GewinneAber nicht nur der angezettelte Preiskampf sowie mangelnde Zukunftsinnovationen belasten die Netbook-Branche langfristig. Auch die Lieferanten reagieren auf die geringere Nachfrage und kappen die Produktion für LCD-Netbook-Panels. Angesprochen auf das Problem, zeigen sich PC-Hersteller wie Hewlett-Packard, Dell und Acer wortkarg und geben keine Auskunft über Lagerbestände unverkaufter Netbooks. Wie die BusinessWeek heute, Freitag, berichtet," scheint die Branche - ähnlich wie damals beim iPhone - nach neuen Innovationen zu suchen.Die auch aufgrund der Krise und der Suche der Konsumenten nach günstigen PC-Alroundern verblasste Netbook-Euphorie dürfte vor allem der begrenzten Leistung der Geräte geschuldet sein. """"PC-Nutzer wollen weniger Abstriche machen und ähnlich wie beim großen Stand-PC auch mobil komplexe Anwendungen durchführen können""""", so Engel gegenüber pressetext. Sollte die Netbook-Nachfrage weiter sinken," dann könnten auch die Gewinne leiden. Denn Netbooks haben zu Ferienperioden Händlern nach 26 Prozent aller PC-Verkäufe ausgemacht."""
"Ötzi blieb dank Gefriertrocknung jung;""Geheimnis der guten Erhaltung der Gletschermumie entschüsselt"
"Die Gletschermumie """"Ötzi""""", die bis zu seiner Bergung 1991 über 5.300 Jahre im Schnee der Ötztaler Alpen vergraben war," verdankt seine gute Erhaltung dem Gefriertrocken des Bindegewebes. Zu diesem Schluss kommen Wissenschaftler der Universität München http://www.nanobiomat.de in der Zeitschrift """"Proceedings of the Royal Society B"""". Die Untersuchung der Kollagenschicht des Mannes aus dem Eis zeigte"," dass diese in Sachen Frische derjenigen eines lebenden Mannes entspricht. Verblüffende Frische""""Die Mumie ist eine der einzigen Zeugen aus der Jungsteinzeit", die wir in Europa haben. Es geht uns darum zu lernen, warum sie so lange konserviert bleiben konnte und auch, wie sie am besten weiter aufbewahrt werden kann. Denn heute ist noch kaum absehbar," was die Wissenschaft in 100 Jahren damit machen wird können""""", erklärt Studienleiter Robert Stark vom Department für Geo- und Umweltwissenschaften http://www.geo.uni-muenchen.de im pressetext-Interview. Die Forscher nahmen Strukturproteine von Ötzis Bindegewebes, sogenannte Kollagene, genauer unter die Lupe. Ihnen standen dafür drei fünf mal fünf Millimeter große Hautstücke der Mumie zum Test zur Verfügung, die sie mit frischem Hautgewebe eines Mannes verglichen, der etwa dasselbe Alter hatte wie der Eismensch bei seinem Tod. Unter dem Rasterkraftmikroskop zeigte sich ein identisches Bänderungsmuster in beiden Proben. Auch der Aufbau der Kollagenmoleküle - diesmal mit der Raman-Spektroskopie untersucht - war noch derselbe. Kein ausgiebiges SonnenbadAus dem Zustand der Kollagene können die Forscher einiges rückleiten. Das Kennzeichen dieser Proteine ist die lange, seilartige Verdrehung der Molekülketten in Form einer Tripelhelix," deren Stränge untereinander durch Wasserstoffbrücken verbunden sind. """"Durch Wasserverlust werden diese Verbindungen geschwächt oder reversibel getrennt"," wohingegen eine lange Einwirkung durch UV-Strahlen eine irreversible Zerstörung auslöst"""""," erklärt Stark. Das sei jedoch bei den Ötzi-Kollagenen nicht der Fall gewesen. """"Man kann somit ausschließen"," dass die Mumie über lange Zeit unbedeckt war"""""," so der Forscher. Einzig an Elastizität konnten die Mumien-Kollagenfasern nicht ganz mit dem frischen Gewebe mithalten. Die höhere Steifigkeit dürfte laut ihrer Ansicht auf die Austrocknung zurückgehen. """"Weitere Untersuchung sollen genetische Unterschiede zu den heutigen in der Region lebenden Menschen feststellen""""", so Stark. Geklärt werden soll auch," ob das Bindegewebe auf Molekülebene irgendwelche anatomische Veränderungen zu jenem von heute lebenden Menschen aufweist."""
"2030: Neue und alte Energien machen halbe-halbe;""Stromerzeuger teilen sich Europas Billionenmarkt"
Der Ausbaubedarf des europäischen Stromnetzes summiert sich innerhalb der kommenden 20 Jahre auf ein Investitionsvolumen von über einer Bio. Euro. Erneuerbare Energieträger werden neben den konventionellen Stromerzeugern bis dahin bereits die Hälfte des Marktes ausmachen," schätzt der Verband deutscher Maschinen- und Anlagenbau (VDMA). Ihr Anteil an der europaweiten Stromproduktion werde sich bis 2030 von 16 auf 48 Prozent verdreifachen. Verdrängen dürften sie die traditionellen Versorger aber nicht. Im Sinne der Versorgungssicherheit würden im EU-Strommix """"alle verfügbaren Energieträger benötigt"""".Konventionelle Energieträger unverzichtbar""""Wer glaubt", auf einzelne Energieträger verzichten zu können," irrt gewaltig""""", meint Thorsten Herdan, Geschäftsführer VDMA Power Systems. Neben regenerativen Energiequellen werde die Versorgung in 20 Jahren durch fossile und Kernkraftwerke zu Anteilen von 33 bzw. 19 Prozent sichergestellt. Für die Industrie eröffne ein Neubaubedarf von 800 Gigawatt an Kapazitäten starke Wachstumsmöglichkeiten. Schon in den vergangenen zehn Jahren sind Erneuerbare Energien dabei zu einem unverzichtbaren Wirtschaftsfaktor geworden, in denen sich ihr Anteil am Strommix auf 16 Prozent etwa in Deutschland mehr als verdoppelt hat.Zuletzt hatte die Weltbank vor einer Energiekrise gewarnt und in der Region Osteuropa, der ehemaligen Sowjetunion und Zentralasien einen Investitionsbedarf von rund 3,3 Bio. Dollar bis 2030 errechnet (pressetext berichtete: http://pressetext.com/news/100319009/). Die Summen sind realistisch, wie Experten gegenüber pressetext betonen. Dem VDMA nach wird der Ersatz ineffizienter und alter Anlagen aber einen wesentlichen Anteil der erforderlichen Investitionen verschlingen. Allein im Bereich Windkraft würden bis 2020 rund zwei Drittel der bestehenden Anlagen ersetzt.Kraftwerke veraltetAuf Effizienz und Wirtschaftlichkeit der Kraftwerke habe der Austausch zwar positive Effekte," wie der VDMA unterstreicht. Gleichzeitig werde so aber auch der Nettozubau gedämpft. Besonders der veraltete fossile Kraftwerkspark gefährde die Wettbewerbsfähigkeit Europas und die Erreichung der ambitionierten Klimaschutzziele.Schon in zehn Jahren soll der Anteil Erneuerbarer Energien am Strommix dem Bundesverband der Energie- und Wasserwirtschaft (BDEW) http://www.bdew.de nach auf 30 Prozent erneut beinahe verdoppelt werden. Anhand von Investitionen in Stromnetze und Speichertechnologien könnten die CO2-Emissionen bis dahin um 15 und bis 2030 sogar um 45 Prozent gedrosselt werden. Mit regenerativen Energien allein könne die Stromversorgung aber nicht garantiert werden.VDMA: """"Strommix in der EU27"""" (PDF-Download):"
"http://www.vdma.org/wps/wcm/connect/5fd0068041f547a68246cfb845449b5f/VDMA+PS_Strommix_Ausblick_FINAL.pdf?MOD=AJPERES&CACHEID;=5fd0068041f547a68246cfb845449b5f"""
"Gymnastik verhindert Depression nach der Geburt;""Kurse stärken das Wohlbefinden der frisch gewordenen Mutter"
Um dem Stimmungstief entgegenzuwirken, das sich bei Müttern nach der Geburt eines Kindes oft einstellt, helfen Bewegung und Maßnahmen," die das Wohlbefinden fördern. Das berichten australische Forscher in der Zeitschrift """"Physical Therapy"""". Sie untersuchten Frauen", die nach der Geburt unter Physiotherapeuten-Anleitung einen Kurs durchliefen, und verglichen die Ergebnisse bei einer Kontrollgruppe. Die Zahl der Wochenbettdepressionen betrug bei den Kursteilnehmerinnen nur die Hälfte.Babyblues bei jeder fünften zu langeDie Zeit nach der Entbindung ist bei fast allen Frauen mit großen Stimmungsschwankungen verbunden," besonders in den """"Heultagen"""" direkt nach der Geburt. Diese auch als """"Babyblues"""" bezeichneten Verstimmungen gehen auf Hormonumstellungen bei der Geburt zurück. Der überwiegende Teil der Frauen erholt sich nach der ersten Wochen wieder", während bei zehn bis 20 Prozent depressive Störungen auftreten, die bis zu einem Jahr andauern können. Als Anzeichen dafür gelten Schuldgefühle und fehlender Selbstwert, Desinteresse, Angst, Hoffnungs- und Antriebslosigkeit sowie innere Unruhe. An der australischen Studie nahmen 161 werdende Mütter teil, die vor der Geburt ihres Kindes nicht an Depressionen gelitten hatten. Ein Teil davon erhielt acht Wochen lang Gymnastikübungen unter Anleitung eines Physiotherapeuten und dazu auch Elternkurse. Den restlichen Frauen gab man bloß Broschüren mit denselben Informationen in gedruckter Form. Auf Grundlage von psychologischen Skalen erhob man am Kursende nach acht Wochen sowie ein Monat später, wie sich das Wohlbefinden der Frauen entwickelte," welche depressiven Symptome auftraten und auch das Ausmaß der Bewegung.Vorsorge stärkt in kritischer Zeit""""Wir konnten bei der Kursgruppe deutliche Verbesserungen im Wohlbefinden sowie auch in Sachen Depressionen gegenüber der Kontrollgruppe feststellen""""", berichtet Studienleiterin Emily Norman von der Universität Melbourne http://www.unimelb.edu.au . Die Anzahl der Mütter, bei denen eine Intervention für postnatale Depression nötig war, sank um die Hälfte, und dieser positive Effekt hielt auch noch ein Monat nach Kursende an. Bisher ist noch nicht ganz geklärt, was zu dieser seelischen Erkrankung führt. Häufiger betroffen sind Mütter, die schon in der Schwangerschaft depressiv waren, ein Zusammenhang dürfte es auch geben mit schlechtem sozialen Rückhalt, mangelnder Unterstützung durch das Umfeld, Geburtskomplikationen oder dem übertriebenen Wunsch, eine perfekte Mutter zu sein. Wenn auch der extremste Verlauf dieser Depression - die Entwicklung einer Psychose - äußerst selten ist, ist betroffenen Frauen unbedingt zu empfehlen, professionelle Hilfe zu suchen. Das Problem kann durch Gynäkologe, Hausarzt, Psychotherapeut oder Psychiater sehr gut behandelt werden.Entscheidende erste MonateWenn die Mutter Hilfe sucht," kommt das nicht zuletzt auch dem Kind zugute. """"Jede Beeinträchtigung der Emotionalität der Mutter hat Auswirkungen auf ihre Interaktion mit dem Kind. Diese ist in den ersten Lebensmonaten ganz besonders entscheidend für die weitere Entwicklung""""", erklärt Wolfgang Kaschnitz, Leiter der Ambulanz für Psychosomatik an der Universitätsklinik für Kinder- und Jugendheilkunde in Graz http://www.meduni-graz.at/kinderklinik ," gegenüber pressetext."""
"Facebook stiftet Verwirrung mit Community-Seiten;""Profile", Pages und Gruppen um weiteres Feature ergänzt
Facebook http://www.facebook.com ergänzt seine bestehenden Seitenangebote - Profile, Pages und Gruppen - um eine weitere Funktion. Ab sofort können auch Community-Seiten (Community-Pages) angelegt werden. Dies sorgt allerdings für ein wenig Verwirrung. Denn zu den bestehenden Seiten, von denen ein Facebook-User Fan werden kann, kommen nun Gemeinschafts-Fanseiten hinzu. Das neue Feature ähnelt sehr den bestehenden Fan-Pages," unterscheidet sich jedoch in einem Punkt davon. Es ist für sogenannte """"inoffizielle"""" Seiten gedacht", die häufig von Usern ins Leben gerufen werden," um bestimmte Themen gesellschaftlicher oder auch politischer Natur zu unterstützen. Ein Beispiel wäre """"Kann dieser Ziegelstein mehr Fans haben als xy"""". Für solche Zwecken sollen jetzt die Community-Pages herhalten. GemeinschaftsrechteEin weiterer Unterschied zu den bestehenden Fanseiten ist die Rechtevergabe auf den Community-Pages. Laut Facebook soll die Administration einer solchen Gemeinschaftsseite ab einem bestimmten Populariätsgrad an die Facebook-Nutzerschaft übergeben werden - sprich"," die Seiten ähnlichen dann einem Wiki-Prinzip. Im Gegensatz zu den neuen Community-Seiten sollen """"offizielle"""" Fanseiten - also etwa von Unternehmen oder Organisationen - weiterhin in den Händen der Markenbesitzer bleiben. Die Gemeinschaftsseiten würden den Usern aber die Möglichkeit bieten", ihre Begeisterung oder ihr Engagement für bestimmte Dinge und Themen zum Ausdruck zu bringen," argumentiert Facebook."""
"""PU_PA"": Ultraleichtes Elektroauto;""Konzeptfahrzeug zeigt Nutzen moderner Materialien"
