title;text
"Das Ding ist auf jeden Fall der Hingucker beim Autocorso nach dem Spiel""""", so Gierke, der zusätzlich auch noch kleinere Fahnen für die übrigen Autofenster anbietet (Seitenfensterfahne 39,99 Euro, Heckscheibenfahne 59,99 Euro). Dass Deutschland Italien schlagen wird," davon ist er überzeugt: """"Was soll bei so leidenschaftlicher Unterstützung schon schiefgehen?"""" Idee: mli; Foto [M]: Shutterstock"""
"Besser als Joe Hart: England stellt neuen Nationaltorhüter vor;""Die peinliche Niederlage der englischen Nationalmannschaft im EM-Achtelfinale gegen Island macht harte Einschnitte nötig. Nachdem bereits Trainer Roy Hodgson direkt nach dem Spiel zurückgetreten ist", soll als nächstes Pannen-Torhüter Joe Hart ersetzt werden. An seine Stelle treten wird wohl eine kompressorbetriebene aufblasbare Wackelfigur, wie man sie oft vor Autohäusern und Einkaufszentren sehen kann.

Unsere Statistiken haben ergeben, dass eine solche Wackelfigur, die völlig zufällige Bewegungen ausführt, mit höherer Wahrscheinlichkeit in die richtige Ecke springt als alle Torhüter," die derzeit für England spielen könnten""""", erklärt FA-Sprecher Dennis Williams, der die Nationalmannschaft betreut, bis ein neuer Trainer gefunden ist. 
Gerade bei Elfmetern und Freistößen macht es die Figur durch ihre ruckartigen Bewegungen für den Schützen deutlich schwerer, den Ball richtig zu platzieren. Zudem leisten ihre ausgefransten Armstümpfe einem rollenden Ball dank des ständigen Luftdrucks mehr Widerstand als die Hände von Joe Hart.
"Englands Star-Stürmer Wayne Rooney ist nach einer ersten Trainingseinheit positiv überrascht von seinem neuen Mannschaftskollegen: """"Er muss irre stark sein. Ich habe in 90 Minuten gegen ihn kein einziges Tor erzielen können. Nur hätte er nicht jedes Mal so übertrieben jubeln müssen"," wenn er was gehalten hat."""" Foto [M]: Shutterstock"""
Isländischer Trainer froh," dass er Sigthorsson statt Eigenthorsson aufgestellt hat;""Island verzaubert derzeit Fußball-Europa. Doch nun verriet Trainer Lars Lagerbäck", dass ausgerechnet Kolbeinn Sigthorsson, der gegen England in der 18. Minute das entscheidende Tor zum 2:1 schoss, fast nicht in der Aufstellung gewesen wäre. Erst im letzten Moment habe sich Lagerbäck nach Absprache mit seinem Kollegen Heimir Hallgrimsson entschieden, Sigthorsson anstelle des bereits fest gesetzten Krumbeinn Eigenthorsson auf den Platz zu schicken.



Bewies auch bei der Nominierung von Hannes Halldórsson zum ersten Torwart statt Lasse Reindórsson ein glückliches Händchen: Lars Lagerbäck 

"Im Training war Eigenthorsson ziemlich gut drauf"""""," so Lagerbäck. Eine halbe Stunde vor Anpfiff habe er allerdings ein ungutes Gefühl bekommen. """"Eigenthorsson ist ja in Island bekannt für seine manchmal etwas riskanten Aktionen im eigenen Strafraum."""" Außerdem soll der Stürmer und Teilzeit-Schafhirte in der isländischen Liga Torschüsse teilweise um bis zu 180 Grad verzogen haben. "
"Eigenthorsson zeigte sich enttäuscht: """"Hätte ich auflaufen dürfen"," wäre das Spiel locker 1:3 oder 1:4 ausgegangen – nicht nur 2:1. Aber die Entscheidung des Trainers muss ich natürlich akzeptieren""""", so der Stürmer, der vergangene Saison trotz 41 Treffern den Abstieg seines Teams FC Reykjavik Südwest (0 Punkte, Tordifferenz: 0:41) in die zweite und damit unterste Liga Islands nicht verhindern konnte.
Mit seiner spontanen Umstellung bewies Lagerbäck schließlich genau den richtigen Riecher. Ob der überzeugende Sigthorsson auch im Viertelfinale gegen Frankreich auflaufen wird, will der Trainer allerdings noch nicht verraten. Derzeit überlege er, stattdessen dem bisher noch einsatzlosen Ari Hattricksson eine Chance zu geben. Foto: Fouganthin," CC BY-SA 4.0; Hinweis: Einige auf Twitter hatten eine ähnliche Idee."""
"Feiernde Island-Fans versenken nach Sieg über England versehentlich ihre Insel;""Nach dem unerwarteten Sieg ihrer Nationalmannschaft im Achtelfinale gegen England feierten die Einwohner Islands so ausgelassen", dass weite Teile der Insel anschließend im Meer versanken. Offenbar wurde das nordwestlich von Großbritannien gelegene Eiland durch die Freudensprünge der rund 300.000 daheimgebliebenen Isländer förmlich ins Meer getreten.

Der ehemalige Leiter des Isländischen Geologischen Institutes, Prof. Dr. Gunnar Annordsson, konnte sich wie die Mehrheit seiner Landsleute auf ein Schiff retten. Er erklärt die Katastrophe, die zum Versinken der 103.000 Quadratkilometer großen Insel führte," so: """"Bereits kurz nach dem Spiel haben unsere Seismographen bedenkliche Werte speziell auf dem östlichen auf der Eurasischen Platte gelegenen Teil der Insel registriert."""""


Zum Glück konnten sich die Isländer auf Schiffe retten. Sie nehmen derzeit Kurs auf England.
Als kurz darauf im Rahmen der inselweiten Fanfeier der beliebte Song 'Jump' von Van Halen angestimmt worden sei," habe das gleichzeitige Auf- und Abspringen nahezu aller Inselbewohner zu einer sogenannen Resonanzkatastrophe geführt. Annordson: """"Der vulkanisch aktive und daher mit vielen Hohlräumen und Magmakammern durchzogene Untergrund sank in sich zusammen und verschlang die komplette Insel."""""
Wie genau es jetzt mit dem isländischen Volk nach der Evakuierung der Insel durch die isländische Marine und Fischfangflotte weitergeht, ist noch unklar. Islands Premierminister Sigurður Ingi Jóhannsson erklärte," man wolle zunächst die Küsten Englands plündern und brandschatzen: """"Wir rechnen nicht mit Gegenwehr."""" "
Langfristig könne sich Jóhannsson sogar vorstellen," dass sich die heimatlosen Isländer in England ansiedeln: """"Meine einzige Sorge ist"," dass wir das schwül-heiße mediterrane Klima Englands womöglich nicht vertragen."""""
pvi," dan"""
"Mario Götze darf endlich auf seiner Bayern-Stammposition spielen;""Diese Entscheidung des Bundestrainers dürfte für große Erleichterung bei Mario Götze sorgen. Seit dem Achtelfinale darf er endlich wieder auf der Position spielen", auf der er auch für den FC Bayern München in der vergangenen Saison am häufigsten eingesetzt wurde. Mit Erfolg: Götze agierte absolut fehlerlos, die Partie endete mit einem überzeugenden 3:0.

In der Gruppenphase habe ich erst versucht, Mario auf dem Rasen einzusetzen, was nicht so gut funktioniert hat," wie ich mir erhofft habe"""""," erklärte Bundestrainer Joachim Löw nach dem Achtelfinalspiel gegen die Slowakei. """"Heute dagegen konnte er auf seiner alten Lieblingsposition sofort an die Form anknüpfen"," die er beim FC Bayern hatte und wegen der ich ihn auch nominiert habe."""" "
Und tatsächlich: Im Spiel gegen die Slowakei wurde deutlich, dass Götze auf dieser Position perfekt mit seinen Bayern-Kollegen wie Neuer, Boateng," Müller oder Kimmich eingespielt ist. """"Die wissen im Spiel schon blind"," wo Mario sich gerade befindet. Das ist natürlich ein großer Vorteil""""", so Löw. 
Das Vertrauen des Bundstrainers belohnte Götze mit mehren starken Szenen – etwa, als er sich in der 29. Minute souverän einen Kaugummi in den Mund schob. In der 67. Minute hätte er beinahe einen Ball zurückgekickt, der ins Aus ging, wenn ihm Benedikt Höwedes nicht zuvorgekommen wäre. 
Die starke Leistung des 24-Jährigen schien Jogi Löw sichtlich zu beeindrucken: Erstmals bei der EM durfte Götze auf seiner Position durchspielen. Für das nächste Spiel gilt er unter Experten bereits als gesetzt. Foto: picture alliance/Foto Huebner

Weitere Artikel zu Götze:
Gesäßabdruck von Götze zu tief: FC Bayern muss Auswechselbank erneuern
FC Bayern kürzt Gehalt von Mario Götze," weil er immer nur faul auf der Bank sitzt"""
Nationalelf erhält Motivationsschub," weil Betrunkener in Berlin Leinwand anbrüllt;""Was für ein großartiger Typ! Weil Sandro Franke", ein betrunkener 28-Jähriger, eine Videoleinwand der Fanmeile in Berlin besonders intensiv angebrüllt hat, hat die gesamte deutsche Nationalmannschaft einen regelrechten Motivationsschub erhalten. Selbst Mario Götze, der beim Achtelfinale gegen die Slowakei eigentlich auf der Bank sitzt, will etwas gespürt haben.

Klasse, Sandro," danke""""", denkt etwa Jérôme Boateng, als er in der 20. Minute plötzlich davon angetrieben wird," dass Franke in 850 Kilometern Entfernung oberkörperfrei """"Deutschlaaaaand! Deutschlaaaaand!"""" skandiert und dabei wild mit einer Fahne wedelt. """"Genau das habe ich jetzt gebraucht""""", so Boateng weiter und köpft einen Ball aus dem Gefahrenbereich.


Spürt im 850 Kilometer entfernten Lille sofort die Unterstützung des betrunkenen Fans: Toni Kroos

Nur eine Minute später ist es Toni Kroos, der von der Aufmerksamkeit des Berliners, der sich nur zu großen Turnieren für Fußball interessiert," profitiert: """"Gerade überlege ich noch", wohin mit dem Ball, da brüllt Sandro," dass rechts einer frei ist. Der Tipp war natürlich goldrichtig"""""," schwärmt der Mittelfeldspieler. """"Der Mann hat ein Auge für so etwas – ein Teufelskerl!"""""
Mit einem Unterstützer wie Sandro Franke kann die deutsche Nationalmannschaft eigentlich nicht verlieren. Es sei denn, den drei kräftigen, ebenfalls stark alkoholisierten Fußballfans hinter ihm geht Frankes Fahnengeschwenke und Geschrei demnächst so auf die Nerven, dass sie ihn unsanft aus dem Verkehr ziehen. Foto oben: 360b/AGIF," Foto rechts: dpa; Hinweis: Erschien schon einmal so ähnlich."""
"Sensationstransfer: Toni Kroos wechselt für 41 Millionen Euro zu Spanien;""Spektakulärer Wechsel! Toni Kroos (26) verlässt die deutsche Nationalmannschaft mit sofortiger Wirkung und wird künftig im Trikot des amtierenden Europameisters Spanien auflaufen. Das bestätigte sowohl der DFB als auch der spanische Verband RFEF", die sich auf eine Ablösesumme von 41 Millionen Euro geeinigt haben. Kroos soll das zuletzt nicht vollends überzeugende Spiel im zentralen Mittelfeld verbessern und Impulse nach vorne setzen.

Kenner des spanischen Fußballs hatten bereits erwartet, dass sich der amtierende Weltmeister vor dem Achtelfinale noch einmal verstärken würde. Kroos soll auf der Position des zuletzt eher schwächelnden Gerard Piqué spielen und dürfte schon im Achtelfinale gegen Italien erstmals im Aufgebot der Spanier stehen. 
Der defensive Mittelfeldspieler, der zwischen 2010 und 2016 insgesamt 68 Spiele für die deutsche Nationalmannschaft bestritt und dabei 11 Tore erzielte," zeigte sich wehmütig: """"Diese sechs Jahre", die ich für Deutschland gespielt habe," das war einfach eine geile Zeit""""", so Kroos," der noch heute ins spanische Teamcamp auf der französischen Insel Île de Ré aufbrechen wird. """"Ich hab der Mannschaft und meinen Trainern viel zu verdanken. Aber jetzt freue ich mich auch auf meine neuen Aufgaben für Spanien"," wo ich mich hoffentlich weiterentwickeln werde und vielleicht auch den einen oder anderen Titel gewinnen kann."""" "
Seinen ehemaligen Teamkameraden wünscht Kroos viel Glück. Für den Fall, dass Spanien und Deutschland im Viertelfinale aufeinandertreffen, kündigte Kroos bereits an," """"aus Respekt nicht zu jubeln"""""," sollte er einen Treffer erzielen. Foto: dpa"""
"Wales benennt sich in Bales um;""Mit einem beeindruckenden 3:0-Sieg gegen wehrlose Russen hat sich Wales bei der Europameisterschaft überraschend den Sieg in Gruppe B erkämpft. Nun hat sich das euphorische Land zu Ehren von Fußballspieler Gareth Bale in einem Eilverfahren offiziell in Bales umbenannt."

Daran, dass wir bei unserer ersten EM-Teilnahme überhaupt direkt den Gruppensieg holen," hat Gareth Bale mit seinen drei Toren einen großen Anteil""""", erklärte Carwyn Jones, der Erste Minister von Bales, nach einer Blitzabstimmung der Nationalversammlung. Tatsächlich führt der 26-jährige Bale, der in jedem der drei Gruppenspiele traf," derzeit die Torschützenliste der EM an. """"Schon in der Qualifikation hat Bale sieben der elf walisischen- Verzeihung: balisischen Tore erzielt""""", so Jones.


"Ist nicht erfreut über seinen neuen Titel """"Prince of Bales"""": Charles."

Nur Stunden nach dem heutigen Beschluss läuft die Umstellung in Bales bereits auf Hochtouren: Seit dem späten Vormittag werden tausende Schilder mit dem alten Landesnamen ausgetauscht. Einigen besonders fußballbegeisterten balisischen Politikern geht die Namensänderung allerdings längst nicht weit genug. Sie forderten im Vorfeld," dass bei einer Umbenennung der Name des Trainers sowie jedes einzelnen Spielers im Kader berücksichtigt wird. """"Jeder von ihnen ist ein Held und sollte geehrt werden"""""," erklärt etwa die Abgeordnete Harriet Walton. """"Ich finde", ein Land, in dem es Ortsnamen wie Llanfairpwllgwyngyllgogery­chwyrndrobwllllantysiliogogogoch gibt, ohne dass sich jemand beschwert, kann sich auch ohne Probleme in BalesColemanHennesseyWardWilliamsChesterEdwardsKingLedley­RamseyVaughanChurchCotterillVokesRobson-Kanu unbenennen," wenn die Situation es erfordert."""" Bild rechts: Dan Marsh"," CC BY-SA 2.0"""
Ex-Nationalspieler, der nie was gewonnen hat, erklärt Weltmeister," wie man gewinnt;""Michael Ballack", der in seinen elf Jahren als Nationalspieler nie einen Titel gewinnen konnte, hat Weltmeister Deutschland nach dem zähen 0:0 gegen Polen in der Gruppenphase der Europameisterschaft hart kritisiert. Der Mannschaft mangele es an Persönlichkeit und Charakter, so der nullfache Weltmeister, nullfache Europameister und nullfache Champions-League-Sieger Ballack. 

Natürlich will man schönen Fußball spielen. Aber manchmal muss man sich auch einfach darauf konzentrieren," zu gewinnen""""", erklärte Ballack, der bei den Europameisterschaften 2000 und 2004 bereits in der Vorrunde scheiterte. 
Früher, als ich noch da war, hatte die Nationalmannschaft viel mehr Charakter. Das heutige Team kann doch gar nicht nachvollziehen, was es heißt," unter einem echten Leitwolf maximal Vize-Welt- oder Vize-Europameister zu werden"""""," so der 39-jährige Welt- und Europameister der Herzen. """"Das macht mich manchmal traurig."""""
Ballack erklärte sich gerne bereit, Jogi Löw seine Verbesserungsvorschläge, die unter anderem Medizinball-Training, viel Gebrüll und die Nachnominierung von Michael Ballack enthalten," in einem Gespräch von Aggressive Leader zu Bundestrainer darzulegen. """"Seltsamerweise hat mich bislang noch keine offizielle Bitte des DFB um Unterstützung erreicht"""""," so Ballack. Foto: fstockfoto / Shutterstock.com"""
UEFA droht Russen mit Disqualifikation," falls sie noch ein Spiel verlieren;""Ist das noch fair? Nachdem die UEFA der russischen Nationalmannschaft mit der Disqualifikation von der EM 2016 gedroht hat", falls es zu weiteren Krawallen durch russische Hooligans kommen sollte, verschärft sich der Ton erneut. In einer aktuellen Erklärung kündigte die UEFA an, die Russen bereits vom Turnier auszuschließen, falls sie ihr nächstes Spiel verlieren sollten.

"Das ist unsere letzte Warnung"""""," erklärte ein Sprecher der UEFA in Paris. """"Wenn Russland auch nach seinem dritten Spiel nur einen Punkt auf dem Konto hat", sehen wir uns gezwungen," die Mannschaft auszuschließen. Ohne Wenn und Aber. Russland ist nur noch auf Bewährung im Turnier."""" "
"Der russische Fußballverband RFS hat die Drohung der UEFA umgehend kritisiert und als politisch motiviert zurückgewiesen. """"Es ist traurig", dass Europa offenbar glaubt," hier einmal mehr gegen Russland Kampagne machen zu müssen""""", erklärte RFS-Präsident Witali Mutko in einer eigenen Pressekonferenz. Er kündigte an, juristische Schritte zu ergreifen, falls Russland tatsächlich aufgrund einer weiteren Niederlage nicht für das Achtelfinale zugelassen werden sollte.
"Einen Vorteil hätte die Disqualifikation durch die UEFA nach einer Niederlage allerdings: Russische Hooligans müssten sich dann nicht mehr zurückhalten. Foto oben: Marco Iacobucci EPP / Shutterstock.com"""
"Besser als ""Packing""! Revolutionäres Analyseverfahren ""Goaling"" zählt, wie oft Ball im Tor landet;""Mit dem Analysetool Packing sorgt die ARD derzeit bei der Europameisterschaft für Furore. Nun hat das ZDF nachgezogen und ebenfalls einen neuartigen Messansatz vorgestellt", der den Fußball revolutionieren dürfte: Beim sogenannten Goaling wird gezählt, wie oft es einer Mannschaft gelingt, den Ball ins gegnerische Tor zu befördern. Der Clou: Teams mit einer höheren Goaling-Rate als ihr Gegner gewinnen zu 100 Prozent.

"Auf so eine aussagekräftige Statistik hat der Sport lange gewartet""""", schwärmt Ex-Fußballer Reinard Stefantz," der das Goaling über einen Zeitraum von zwei Jahren in seiner Garage in Fulda entwickelt hat. """"Mein Hauptargument ist immer", dass die teuersten Spieler der Welt oft genau die mit den höchsten Goaling-Rates sind. Wer das für Zufall hält," hat die Methode nicht begriffen."""" "


Immer wenn der Ball auf regelkonforme Weise im Tor landet, steigt die Goaling-Rate eines Teams um 1.

Ein Beispiel: Die deutsche Nationalmannschaft kam im Spiel gegen die Ukraine auf einen durchaus soliden Goaling-Wert von 2. Wäre es der Ukraine irgendwie gelungen, einen Goaling-Wert von 3 oder mehr zu erreichen, hätte sie Deutschland schlagen können. Da der Goaling-Wert der Ukraine jedoch nur 0 betrug, konnte Deutschland am Ende klar mit 2:0 gewinnen.
Stefantz ist fest davon überzeugt, dass Trainer weltweit künftig gezielt versuchen werden, mit ihrer Mannschaft eine höhere Goaling-Rate zu erreichen als die gegnerische Mannschaft.
ZDF-Experte Oliver Kahn, der auf Twitter über die von der ARD verwendete Packing-Rate lästert," ist begeistert: """"Das heißt also", ich habe in meiner aktiven Zeit als Spieler instinktiv daran gearbeitet," die Goaling-Rate des Gegners niedrig zu halten. Das erklärt natürlich meinen immensen Erfolg."""""
Das ZDF will die Analyse-Methode Goaling, die von Stefantz für einen niedrigen achtstelligen Betrag zur Verfügung gestellt wird," für den weiteren Verlauf der EM in ihrer Berichterstattung verwenden. Foto oben: Shutterstock"""
Russland führt Hooligan-EM-Tabelle an, England auf Platz 2," Deutschland nur Dritter;""Fans sinnloser Gewalt durften sich bei der in diesem Jahr stattfindenden Hooligan-EM über einen brutalen Turnierauftakt freuen. Nach vier Tagen und mehreren hitzigen Begegnungen stehen Schläger aus Russland auf Platz 1. Dicht dahinter folgen die Hooligans aus England", die ebenfalls zahlreiche Verletzte erzielen konnten. Immerhin auf Platz 3 der Hooligan-Tabelle steht die deutsche Auswahl. 

Mit ihrem gut getimten, perfekt ausgeführten Überfall auf den englischen Fanblock im Anschluss an das erste Gruppenspiel ihrer Mannschaft haben die russischen Hooligans schon früh demonstriert," dass der Kampf um den Titel """"Heimat der größten Arschlöcher"""" wohl nicht ohne sie entschieden wird. Aber auch abseits der Stadien zeigte die russische Auswahl ihre Offensivstärke durch gezielte Schläge und Tritte gegen den Kopf."


Das Logo der Hooligan-EM 2016.

Die Engländer - immerhin Repräsentanten des Heimatlands des Hooliganismus - zeigten ebenfalls hohe Einsatzbereitschaft und konnten insbesondere bei hinterhältigen Überfällen auf französische Fans," bei denen sie """"ISIS"," where are you?"""" skandierten", und in Auseinandersetzungen mit Russen und der Polizei teils aus schwierigen Situationen viele Platzwunden, Beulen und Prellungen erzielen. Allerdings beklagten sich vereinzelt russische Hooligans darüber," sie seien """"gefairt"""" worden. """"Einmal hat mir ein Engländer die Hand gegeben", um mir wieder aufzuhelfen," nachdem ich gestürzt bin""""", berichtet ein schockierter Schläger. Der russische Hooliganverband hat bereits Beschwerde eingelegt. 
Spätestens am Donnerstag muss Deutschland gegen die als Geheimfavorit geltende polnische Hooligan-Auswahl brillieren, wenn es im Kampf um Platz 1 noch eine Rolle spielen will. Zwar konnten die Deutschen bereits mit Übergriffen auf ukrainische Fans und einer exzellent geschwenkten Reichskriegsflagge zeigen, dass mit ihnen zu rechnen ist – die ganz großen Aktionen blieben aber bisher aus. 
"Die Hooligan-Europameisterschaft findet alle vier Jahre statt. Den Veranstaltern zufolge ist das Zusammenfallen mit der gleichzeitig stattfindenden Fußball-EM reiner Zufall. Mit Fußball habe das alles nichts zu tun. Foto oben: Shutterstock"""
"Gauland: ""Kein Wunder, dass die Ukraine verloren hat. Bei denen waren alle Spieler Ausländer"";""Dass die deutsche Nationalelf ihre erste EM-Partie gegen die Ukraine gewinnen würde", kommt für den Fußball-Experten der AfD, Alexander Gauland, wenig überraschend. Immerhin, so Gauland, bestehe die gesamte ukrainische Mannschaft aus Ausländern. Von Nationalgefühl könne so keine Rede sein. 

Rakitskiy, Konoplyanka, Zozulya – bei solchen Namen braucht man sich doch nicht wundern," wenn es am Ende nichts wird"""""," erklärt Gauland. """"Die hatten ja ausschließlich Ausländer im Team"," das war nicht zu übersehen."""" "
"Das habe der deutschen Mannschaft einen entscheidenden Vorteil verschafft. """"Wir haben ja lediglich diesen Mustafa", den Özgül," meinen guten Freund Boateng und sonst fast nur Deutsche""""", so der AfD-Funktionär. 
"Trotz einiger """"schwarzer Schafe"""" zählt Gauland die deutsche Nationalelf zu den Favoriten des Turniers: """"Deutschland gehört immer noch zu den Mannschaften mit den wenigsten Ausländern. Bei den Türken beispielsweise hat jeder einzelne Spieler ganz offensichtlich einen Migrationshintergrund. Bei den Spaniern sieht es nicht besser aus. Das kann ja nichts werden. Die einzigen", die mit Deutschland noch mithalten können, weil bei ihnen ähnlich wenige Ausländer mitspielen," sind Österreich und die Schweiz."""""
Gauland betonte, dass er damit nicht sagen wolle," Ausländer könnten grundsätzlich nicht Fußball spielen. """"Aber bei den Ukrainern hat auch die Einstellung nicht gestimmt. Die haben ja noch nicht mal bei der deutschen Nationalhymne mitgesungen""""", so der AfD-Politiker. Foto: Olaf Kosinsky/Skillshare.eu," CC BY-SA 3.0 DE"""
"Mehr Privatsphäre: Jogi Löw nimmt künftig Wandschirm mit ins Stadion;""Am Donnerstag können deutsche Fans die DFB-Elf im zweiten Gruppenspiel gegen Polen wieder vor den Fernsehgeräten anfeuern – von Jogi Löw dürften sie allerdings wenig zu sehen bekommen. Wie der Bundestrainer heute mitteilte", will er künftig einen Wandschirm mit ins Stadion nehmen, um sich vor neugierigen Blicken zu schützen. 

"Als konkreten Anlass für den Sichtschutz führte Löw den Wunsch nach mehr Privatsphäre an: """"Mein Co-Trainer Thomas Schneider hat mich darauf hingewiesen", dass sich Kameras im Stadion befinden," die quasi jede Bewegung von mir einfangen"""""," erklärt der Weltmeistertrainer. """"Das war mir vorher nicht so präsent."""""
Löw befürchtet," Zuschauer könnten Situationen und Gesten fehlinterpretieren. """"Wenn ich zum Beispiel in der Spezialtasche im Inneren meiner Hose einen Taktikzettel suche und anschließend meine Hand zur Nase führe", um Götze zu signalisieren, dass ich mir von ihm einen besseren Torriecher erwarte," dann kommt das im TV womöglich falsch rüber."""" "
Künftig will sich Löw möglichst während des gesamten Spielablaufs hinter dem 1,70 Meter hohen Schirm aufhalten und allenfalls für taktische Anweisungen kurz hinter dem Sichtschutz hervortreten. 
Anschließend beendete Löw die Pressekonferenz," weil er """"noch einen Monsterpopel aus [s]einer Nase herausholen"""" müsse. Foto [M]: Shutterstock"""
