title;text
Assad hofft auf härteren Kampf Trumps gegen den IS;Der syrische Präsident Baschar al-Assad setzt auf ein härteres Vorgehen der neuen US-Regierung unter Präsident Donald Trump gegen die Extremistenmiliz IS.  Trump hatte zuletzt angedeutet, er könnte die amerikanische Unterstützung für die syrischen Rebellen kürzen und stattdessen Russland in Syrien im Kampf gegen den IS helfen. “Das ist vielversprechend, aber wir müssen abwarten - es ist zu früh für irgendwelche konkreten Schritte”, zitierte die staatliche Nachrichtenagentur Sana am Dienstag Äußerungen Assads gegenüber belgischen Journalisten. Eine Zusammenarbeit der USA und Russlands gegen die Extremisten würde sich aber positiv auswirken. Russland ist ein enger Verbündeter Assads. Die Menschenrechtsorganisation Amnesty International warf Assads Rührung vor, in einem Militärgefängnis bei Damaskus Tausende Menschen bei Massenhinrichtungen getötet und systematisch Folter ausgeübt zu haben.  Trump hat den Sieg über den IS zu einem Hauptziel seiner Präsidentschaft erklärt. Er unterzeichnete ein Dekret, in dem er das US-Verteidigungsministerium, den Generalstab und andere Behörden aufforderte, binnen 30 Tagen einen vorläufigen Plan vorzulegen, wie die USA den IS besiegen können. Im Kampf gegen den Terrorismus will der US-Präsident auch die Nato einspannen und mit Russland zusammenarbeiten. Dies dürfte in der westlichen Militärallianz allerdings auf Vorbehalte stoßen. Bisher unterstützen die USA syrische Rebellen, die auch gegen Assad kämpfen, im Vorgehen gegen den IS.  Die Menschenrechtsorganisation Amnesty International erklärte, im Sednaja-Gefängnis nördlich der Hauptstadt seien in den Jahren 2011 bis 2015 bis zu 13.000 Menschen gehenkt worden. Wahrscheinlich halte die Praxis weiter an. Das Ausmaß der Gewalttaten erfülle den Tatbestand des Kriegsverbrechens, erklärte Amnesty. Die Organisation forderte eine Untersuchung durch die Vereinten Nationen (UN). Insbesondere Russland als Verbündeter des Regimes müsse seinen Einfluss im UN-Sicherheitsrat geltend machen, um die ungesetzlichen  Hinrichtungen zu beenden, forderte Amnesty.  “Die Opfer waren zum allergrößten Teil Zivilisten, von denen angenommen wurde, dass sie in Opposition zur Regierung standen”, erklärte die Menschenrechtsorganisation. Viele Menschen in dem Gefängnis seien gestorben, nachdem sie systematischer Folter oder Hunger ausgesetzt worden seien. Dem Bericht zufolge fanden die Hinrichtungen heimlich statt. Die Opfer seien außerhalb von Damaskus beerdigt worden, ohne dass ihre Familien über das Schicksal ihrer Angehörigen informiert worden seien.
Trump erhöht Druck auf US-Berufungsgericht im Einreise-Streit;US-Präsident Donald Trump erhöht im Streit über Einreiseverbote kurz vor Beginn einer Gerichtsverhandlung den Druck auf die Richter.  “Die vom radikalislamischen Terrorismus ausgehende Gefahr ist sehr real”, twitterte er am Montagabend. “Gerichte müssen schnell handeln!” Vor dem Berufungsgericht in San Francisco sollte am Dienstag um 15.00 Uhr (00.00 MEZ) die Verhandlung über die vom Justizministerium beantragte Aufhebung der Annullierung der Einreiseverbote beginnen. Ein Bundesgericht in Seattle hatte den Bann gegen Bürger aus sieben muslimisch geprägten Ländern gekippt. Trump hatte zuvor angeordnet, die US-Grenzen für diese Menschen zu schließen. Er löste damit Proteste von Bürgerrechtsbewegungen aus, die von Teilen der IT-Wirtschaft und der oppositionellen Demokraten unterstützt werden. Vor dem Berufungsgericht müssen die Anwälte der gegen die präsidiale Anordnung klagenden Bundesstaaten Minnesota und Washington sowie die Vertreter des US-Justizministeriums ihre Argumente vortragen. Das Justizministerium kritisierte, mit dem Kippen der Einreiseverbote sei der Richter in Seattle, James Robart, zu weit gegangen. Allenfalls könnten Ausnahmen für Personen gemacht werden, denen die Einreise bereits zugesagt worden sei. Ausgenommen werden könnten auch Menschen, die die USA für eine Auslandsreise verlassen und zurückkehren wollten. Beobachter gehen davon aus, dass Trump kein leichtes Spiel vor dem Berufungsgericht haben wird. Grund ist, dass zwei der drei Richter von demokratischen Präsidenten ernannt wurden. Nur einer wurde von einem republikanischen Präsidenten in das Gericht entsandt. Von den in den USA möglichen Eingaben nicht am Prozess beteiligter Parteien haben rund 100 Unternehmen, Gewerkschaften und Bürgerrechtsbewegungen Gebrauch gemacht. Sie alle sprechen sich in rund zwölf Eingaben gegen die Einreiseverbote aus. Mit nur drei Schriftstücken fiel die Zahl der Unterstützer Trumps - im Wesentlichen zwölf konservative Gruppen - deutlich kleiner aus. TRUMP: ISLAMISTEN WOLLEN USA ANGREIFEN Trump verteidigte am Montag auch bei einem Besuch des Zentralkommandos des US-Militärs in Tampa sein Vorgehen: “Radikale islamistische Terroristen sind entschlossen, unser Heimatland anzugreifen, so wie sie es am 11. September (2001) getan haben.” Er wolle es “Leuten, die uns und unser Land zerstören wollen” nicht erlauben, in die USA zu kommen. Es wird damit gerechnet, dass der Streit an die letzte Instanz, dem Supreme Court, weitergereicht wird. Allerdings besteht in dem Verfassungsgericht ein Patt zwischen den vier demokratisch und den vier republikanisch geprägten Richtern.  Der Streit beunruhigt die US-Wirtschaft, am Montag schloss der Dow-Jones-Index mit einem Minus von 0,1 Prozent. Zuversichtlich zeigte sich der Chef der Fluglinie Qatar Airways, Akbar Al Baker. “Ich denke, wir müssen ihm noch ein bisschen Zeit geben, damit er lernen kann, wie eine Supermacht geleitet wird”, sagte er der “Fairfax Media” in Neuseeland. Er sei sich sicher, dass Trump langfristig einsehen werde, dass die muslimischen Golf-Staaten viel zur US-Wirtschaft beitragen würden.
Assad hofft auf härteren Kampf Trumps gegen den IS;Der syrische Präsident Baschar al-Assad setzt auf ein härteres Vorgehen der neuen US-Regierung unter Präsident Donald Trump gegen die Extremistenmiliz IS.  Trump hatte zuletzt angedeutet, er könnte die amerikanische Unterstützung für die syrischen Rebellen kürzen und stattdessen Russland in Syrien im Kampf gegen den IS helfen. “Das ist vielversprechend, aber wir müssen abwarten - es ist zu früh für irgendwelche konkreten Schritte”, zitierte die staatliche Nachrichtenagentur Sana am Dienstag Äußerungen Assads gegenüber belgischen Journalisten. Eine Zusammenarbeit der USA und Russlands gegen die Extremisten würde sich aber positiv auswirken. Russland ist ein enger Verbündeter Assads. Die Menschenrechtsorganisation Amnesty International warf Assads Rührung vor, in einem Militärgefängnis bei Damaskus Tausende Menschen bei Massenhinrichtungen getötet und systematisch Folter ausgeübt zu haben.  Trump hat den Sieg über den IS zu einem Hauptziel seiner Präsidentschaft erklärt. Er unterzeichnete ein Dekret, in dem er das US-Verteidigungsministerium, den Generalstab und andere Behörden aufforderte, binnen 30 Tagen einen vorläufigen Plan vorzulegen, wie die USA den IS besiegen können. Im Kampf gegen den Terrorismus will der US-Präsident auch die Nato einspannen und mit Russland zusammenarbeiten. Dies dürfte in der westlichen Militärallianz allerdings auf Vorbehalte stoßen. Bisher unterstützen die USA syrische Rebellen, die auch gegen Assad kämpfen, im Vorgehen gegen den IS.  Die Menschenrechtsorganisation Amnesty International erklärte, im Sednaja-Gefängnis nördlich der Hauptstadt seien in den Jahren 2011 bis 2015 bis zu 13.000 Menschen gehenkt worden. Wahrscheinlich halte die Praxis weiter an. Das Ausmaß der Gewalttaten erfülle den Tatbestand des Kriegsverbrechens, erklärte Amnesty. Die Organisation forderte eine Untersuchung durch die Vereinten Nationen (UN). Insbesondere Russland als Verbündeter des Regimes müsse seinen Einfluss im UN-Sicherheitsrat geltend machen, um die ungesetzlichen  Hinrichtungen zu beenden, forderte Amnesty.  “Die Opfer waren zum allergrößten Teil Zivilisten, von denen angenommen wurde, dass sie in Opposition zur Regierung standen”, erklärte die Menschenrechtsorganisation. Viele Menschen in dem Gefängnis seien gestorben, nachdem sie systematischer Folter oder Hunger ausgesetzt worden seien. Dem Bericht zufolge fanden die Hinrichtungen heimlich statt. Die Opfer seien außerhalb von Damaskus beerdigt worden, ohne dass ihre Familien über das Schicksal ihrer Angehörigen informiert worden seien.
Israelisches Parlament billigt nachträglich 4000 Siedlerwohnungen;Das israelische Parlament hat am Montag mit den Stimmen der konservativen Regierungskoalition nachträglich die Errichtung von 4000 Siedlerwohnungen auf palästinensischem Privatland für rechtens erklärt.  Das auch in Israel heftig umstrittene Gesetz passierte die Knesset mit 60 zu 52 Stimmen. Oppositionsführer Isaak Herzog sprach von einem “kranken Gesetz”, das die israelische Demokratie zu zerstören drohe.  Das Gesetz erlaubt es Siedlern, ihre auf palästinensischem Privatland errichteten Häuser und Wohnungen im besetzten Westjordanland zu behalten, wenn sie vor der Errichtung keine Kenntnis darüber hatten, dass sie auf palästinensischem Besitz bauen. Die Palästinenser-Politikerin Hanan Aschraui erklärte, das Gesetz gebe Siedlern “grünes Licht zur Fortsetzung ihres Landraubs”. Die Verabschiedung des Gesetzes hat auch innerhalb der Regierungskoalition die Spannungen erhöht. Auch Ministerpräsident Benjamin Netanjahu soll sich intern gegen die Parlamentsbefassung ausgesprochen haben. Er befürchte, dass das Gesetz Bestrebungen Auftrieb geben könnte, Israel vor dem Internationalen Strafgerichtshof in Den Haag zu verklagen, hieß es in Regierungskreisen. Auf Druck des Rechtsaußen-Koalitionspartners “Jüdisches Heim” wurde die Abstimmung dennoch angesetzt. Das Gesetz widerspricht auch der Rechtssprechung des Obersten Gerichtshofs und Generalstaatsanwalt Avischai Mandelblit hat bereits angekündigt, es bei Klagen vor dem Verfassungsgericht nicht zu verteidigen. Das Gesetz verstößt nach seinen Worten gegen die Verfassung und gegen internationales Recht, weil es die Enteignung von privatem Land in Gebieten erlaubt, die von Israel im Sechstagekrieg 1967 erobert wurden.
HINTERGRUND-Polen wird für Merkel zum Testfall für EU-Einheit;Bei ihren Gesprächen am Dienstag in Warschau kann Kanzlerin Angela Merkel nahtlos an die Debatten über die Zukunft der EU auf dem informellen Treffen auf Malta anknüpfen: Denn von der nationalkonservativen PiS-Regierung in Warschau wird nach Ansicht von Diplomaten maßgeblich abhängen, wie ambitioniert die Erklärung zum 60. Jahrestag der Union Ende März in Rom ausfallen wird.  Gibt die EU angesichts der Brexit-Entscheidung und der EU-kritischen Äußerungen des neuen US-Präsidenten Donald Trump ein Signal für eine engere Zusammenarbeit oder eines der Desintegration? Merkel sprach auf Malta davon, dass es “eine EU mit verschiedenen Geschwindigkeiten” bei der Integration geben werde. Das kommt den Polen entgehen. Vor allem der Nationalist Jaroslaw Kaczynski, die graue Eminenz der polnischen Politik, misstraut Deutschland fast so wie Russland. In einer Autobiografie hatte er Merkel vorgeworfen, sie wolle Deutschlands “imperiale Macht” wieder aufbauen und Polen unterordnen. Und Ministerpräsidentin Beata Szydlo machte in Malta keinen Hehl daraus, dass ihre Partei den Brexit als Signal sehe, die Zuständigkeiten der EU zu verringern. “Merkel will die Einheit der EU bewahren, und dafür braucht sie Polens Unterstützung für die Reformen”, mahnt Slawomir Debski, Chef des polnischen Instituts für internationale Angelegenheiten. Ein EU-Diplomat gibt zu Bedenken: “Allerdings wollen die Polen gleichzeitig eine viel engere Zusammenarbeit im Sicherheitsbereich, weil das Vertrauen in die USA durch die Wahl Donald Trumps schon erschüttert ist.” Ohnehin registriert man in Berlin, dass die Regierung in Warschau zwar ihren innenpolitischen Kurs mit der versuchten stärkeren Kontrolle über Medien und Gerichte fortsetze, sich aber seit dem Brexit-Referendum weniger EU-feindlich aufstelle. Kaczynski selbst sagte dem konservativen Wochenmagazin “Do Rzeczy”, er habe bereits im Sommer 2016 mit Merkel darüber gesprochen, die EU-Verträge zu ändern, was diese abgelehnt habe. Die Bundesregierung will sich über den Bericht nicht äußern. POLEN SUCHEN NACH BREXIT UND TRUMP ALLIANZEN Dementsprechend hoch sind die Erwartungen an die Gespräche, die Merkel nicht nur mit Regierungschefin Szydlo, sondern auch mit Kaczynski und Vertretern der Oppositionsparteien führen wird. “Merkels Hauptbotschaft muss sein, dass eine enge Zusammenarbeit mit der EU, vor allem aber mit Deutschland und Frankreich, zentrales strategisches Interesse Polens ist”, sagt Thomas Nord von der Linkspartei, der die deutsch-polnische Parlamentariergruppe im Bundestag leitet. Und der stellvertretende SPD-Fraktionschef Axel Schäfer sagt in Anspielung auf den traditionell versuchten Schulterschluss der Polen mit den USA: “Die Kanzlerin sollte darauf verweisen, dass die Oder an einigen Stellen 100 Meter breit ist, der Atlantik dagegen 6000 Kilometer.” Nach Ansicht des Grünen-Politikers Manuel Sarrazin wissen die Polen, dass Amerikaner und auch Briten viel weniger anbieten können als die EU. “Ich bin der festen Überzeugung, dass Trump und Brexit Polen und Deutschland enger zusammenrücken lassen.” Voraussetzung sei aber, dass Deutschland in den Brexit-Verhandlungen auch die Interessen von Hunderttausenden Polen hart vertrete, die in Großbritannien lebten. Hintergrund ist die Personenfreizügigkeit, die mit dem Austritt aus der EU infragesteht. Finanziell rechnet sich die EU-Mitgliedschaft für Polen: Das Land ist der größte Nettoempfänger in der Gemeinschaft und erwartet bis 2020 Zahlungen von Dutzenden Milliarden Euro aus EU-Kassen. In Umfragen geben regelmäßig mehr als zwei Drittel der Polen an, dass sie die EU positiv sähen.  STREITTHEMEN VON FLÜCHTLINGEN BIS TUSK Merkel stellt sich auf eine Wunschliste ein, die lautet: mehr Verteidigungskooperation, dafür weniger Brüsseler Einmischung in die Innenpolitik. Allerdings bleiben genügend Streitthemen. Denn auch wenn die Kanzlerin mit Blick auf die deutsch-polnische Vergangenheit direkte Kritik an den umstrittenen Reformen des Verfassungsgerichts und Gesetzen für Medien und Nichtregierungsorganisationen der EU-Kommission überlassen hat: Auf gemeinsame Werte als Grundlage der EU-Kooperation wird sie noch stärker pochen als früher. Sie wolle zudem wie andere “alte” EU-Staaten auf mehr Solidarität in der Flüchtlingskrise pochen, heißt es in Regierungskreisen - zumal derzeit auffallend viele Tschetschenen über die angeblich so gesicherte polnische Schengen-Außengrenze in die EU kämen. Ein Streitfall könnte auch die Personalie Donald Tusk werden, da bald über eine weitere Amtszeit des EU-Ratspräsidenten entschieden werden muss. Der frühere polnische Ministerpräsident wurde auf Malta zwar von den meisten EU-Regierungschefs gerade wegen seiner harten Worte zu Trump als “unser Donald” gefeiert. Aber für die konservative PiS ist der Liberale ein rotes Tuch. “Nur muss sich die polnische Regierung überlegen, wie sie dasteht, wenn sie einen Landsmann gegen den Willen der EU-Partner ablehnt”, sagt ein EU-Diplomat. Ein der PiS genehmer “Ersatz-Pole” werde den Posten jedenfalls nicht bekommen.
Handelsriese Metro wird aufgespalten – Aktionäre stimmen zu;Metro-Chef Olaf Koch kann seine Pläne zur Aufspaltung des Konzerns in einen Lebensmittel- und einen Elektronikhändler umsetzen.  Bei der Hauptversammlung am Montag in Düsseldorf stellten sich die Aktionäre fast einstimmig hinter die Aufteilung. Koch verspricht sich von dem Schritt mehr Schlagkraft für die beiden Unternehmensbereiche. Die neuen Firmen sollen im Sommer an den Start gehen und im MDax notiert sein. Aktionärsvertreter sagten, sie hofften auf Wachstum, steigende Kurse und höhere Dividenden. Es gab aber auch Kritik an Kochs Plänen – vor allem die Kosten der Aufspaltung und die Pläne für die Vorstandsgehälter standen dabei im Mittelpunkt. 99,95 Prozent des anwesenden Kapitals sprachen sich für die Aufspaltung aus. “Ich begrüße und unterstütze die Teilung”, sagte Alexander Elsmann, Vertreter der Schutzgemeinschaft der Kapitalanleger, bei dem Aktionärstreffen. “Wir sehen die Teilung durchaus positiv, es gibt viele Vorteile”, betonte auch Jella Benner-Heinacher von der Deutschen Schutzvereinigung für Wertpapierbesitz (DSW). “Heute ist ein besonderer Tag”, stimmte Koch die Aktionäre ein. “Wir schlagen Ihnen vor, die Gesellschaft aufzuspalten und eine vollkommen neue Episode zu schaffen.” Die beiden Unternehmensteile würden durch die Trennung besser und schneller werden, versprach der Manager. Denn für beide Gesellschaften werde es “weniger Ablenkung durch eine gemeinsame Konzernstruktur geben, die keine Synergien geboten hat.” STATT MEGA-LINER ZWEI SCHNELLE LKW Der Abschied vom weit verzweigten Metro-Reich fiel Aktionärsvertreter Elsmann nicht schwer. Seit 2010 sei der Umsatz gefallen und die Gewinnmarge gesunken, kritisierte Elsmann: “Wachstum sieht anders aus.” Die Aufspaltung sei die logische Konsequenz dieser Entwicklung. Benner-Heinacher sagte, aus dem “Mega-Liner” Metro sollten durch die Aufspaltung zwei schnelle und leicht zu lenkende Lastwagen werden. Die Großaktionäre der Metro hatten sich bereits vor dem Treffen für die Aufspaltung ausgesprochen. Nach der Entscheidung der Aktionäre wird der Lebensmittelhandel rund um die Großmärkte und die Supermarkt-Kette Real im Sommer abgetrennt. Auch das Immobilienvermögen der Metro wird dort gebündelt. So entsteht ein Unternehmen mit rund 37 Milliarden Euro Jahresumsatz und mehr als 150.000 Mitarbeitern in 35 Ländern. Die Anteilseigner der “alten” Metro sollen Aktien dieser neuen Gesellschaft erhalten. Das Zuteilungsverhältnis beträgt 1:1 - für jede Metro-Stammaktie gibt es also eine Stammaktie des Lebensmittelhändlers. MACHTKAMPF BEI MEDIA-SATURN Bei der bisherigen Metro verbleibt der Elektronikhändler Media-Saturn. Dessen Obergesellschaft firmiert künftig unter dem Namen Ceconomy und kommt auf einen Jahresumsatz von rund 22 Milliarden Euro mit 65.000 Mitarbeitern. Den Machtkampf mit Media-Saturn-Minderheitseigner Erich Kellerhals sieht Koch nicht als Hürde für die Entwicklung des Elektronikhändlers. “Wir kontrollieren dieses Unternehmen”, betonte der Manager. Metro sei aber auch offen für konstruktive Lösungen mit Kellerhals. So sei in der Vergangenheit etwa eine Aufteilung von Media-Saturn diskutiert worden, eine Lösung habe sich aber nicht ergeben. Seit einiger Zeit versucht der Investor Clemens Vedder, einen Lösung zwischen beiden Seiten zu vermitteln. Die Aufspaltung sei kein Allheilmittel, mahnte Aktionärsvertreter Elsmann. Baustellen blieben bestehen. Unklar sei etwa, wie es beim langjährigen Sorgenkind des Konzerns, der Supermarktkette Real, weitergehen solle. Diese ächzt unter dem erbitterten Wettbewerb in der Branche, Koch will investieren, um die Läden zu modernisieren. Auch sei offen, ob es bei den vom Vorstand genannten Kosten von rund 100 Millionen Euro für die Teilung bleiben werde, sagte Elsmann. Benner-Heinacher kritisierte die Vorstandsgehälter bei beiden Gesellschaften als zu hoch. Diese entsprächen eher denen von Dax-Konzernen. Doch sollten beide Konzernteile künftig im MDax notiert sein. Ceconomy-Chef Pieter Haas werde etwa bei für ihn optimaler Entwicklung rund 7,7 Millionen Euro im Jahr verdienen.
"Koalition will schärfer gegen ""Gefährder"" vorgehen;Union und SPD wollen nach dem Anschlag auf einen Weihnachtsmarkt in Berlin schärfer gegen als Gefährder eingestufte Verdächtige vorgehen.  Bei Beratungen in München bestätigten die Parteivorsitzenden von CDU", CSU und SPD am Montag entsprechende Vorschläge, die Innenminister Thomas de Maizière (CDU) und Justizminister Heiko Maas (SPD) vor vier Wochen vorgelegt hatten. Diese sehen unter anderem vor, Gefährder in Abschiebehaft zu nehmen, wenn es sich um Flüchtlinge handelt. “Der wehrhafte Rechtsstaat ist unsere Antwort auf terroristische Bedrohung”, erklärte Maas. “Wir sind uns einig: Die bestehenden Regeln müssen wir konsequent vollziehen. Wo es notwendig ist, müssen wir nachschärfen.” Wer “vollziehbar ausreisepflichtig” sei, müsse Deutschland auch verlassen. “Nur wenn wir unsere Regeln durchsetzen, werden wir die Akzeptanz für Zuwanderung dauerhaft erhalten.” Allein repressive Mittel reichten aber nicht. Die Koalition habe daher auch ein Programm zur Stärkung der Präventionsarbeit gegen islamischen Extremismus vereinbart. In Koalitionskreisen hieß es, die Unionsforderung nach Transitzonen bei der Einreise von Migranten sei angesprochen, von der SPD aber abgelehnt worden. Ein als gefährlich eingestufter Tunesier hatte kurz vor Weihnachten einen Schwerlaster in den Weihnachtsmarkt an der Berliner Gedächtniskirche gelenkt. Die Sicherheitsbehörden hatten sich vielfach mit ihm befasst, waren aber zu dem Schluss gekommen, dass er keinen Anschlag verüben werde. Die Nachfolge des zurückgetretenen Chefs der Deutschen Bahn, Rüdiger Grube, sei bei dem Treffen von Kanzlerin Angela Merkel (CDU), Bayerns Ministerpräsident Horst Seehofer (CSU) und Vizekanzler Sigmar Gabriel (SPD) nicht besprochen worden, verlautete aus Koalitionskreisen weiter. Das nächste Treffen der Koalitionsspitze, bei dem auch die Fraktionsvorsitzenden dabei seien, sei für den 07. März geplant.
EU will an Sanktionen gegen Russland nicht rütteln;Die Europäische Union hält an ihren Sanktionen gegen Russland wegen dessen Vorgehen im Ukraine-Konflikt fest.  Die im Zuge der Annexion der Halbinsel Krim vor drei Jahren verhängten Strafmaßnahmen würden nicht gelockert, sagte der britische Außenminister Boris Johnson am Montag während eines Treffens mit seinen EU-Kollegen in Brüssel. Die EU erkennt die Krim als Teil Russlands nicht an und sie fordert, dass sich die Regierung in Moskau an eine in Minsk getroffene Friedensvereinbarungen hält. Mit Blick auf den neuen US-Präsidenten Donald Trump, der sich für eine Verbesserung der Beziehungen zu Russland ausgesprochen hat, sagte die EU-Außenbeauftragte Federica Mogherini: “Ich kann nicht sagen, wie die US-Regierung dazu steht, aber ich kann sagen, wie die Europäer dazu stehen.”  Sie gehe davon aus, Ende der Woche in Washington das Thema Ukraine mit Trumps Nationalem Sicherheitsberater Michael Flynn sowie Regierungsberater Jared Kushner und mehreren US-Senatoren zu besprechen, sagte Mogherini. Am 20. Februar werde zudem US-Vizepräsident Mike Pence nach Brüssel kommen. Die Europäer befürchten, ein Abrücken der USA von deren Russland-Sanktionen könnte dazu führen, dass auch in der EU die Strafmaßnahmen nicht mehr von allen Mitgliedern unterstützt würden. Länder wie Ungarn und Bulgarien dringen bereits auf eine Wiederaufnahme von Wirtschaftsbeziehungen. Allerdings sagte Trumps Botschafterin bei den Vereinten Nationen, Nikki Haley, erst vor wenigen Tagen, dass die US-Sanktion ohne Abzug Russlands von der Krim nicht aufgehoben würden.
Bericht - Bundeswehr soll mehr Airbus A400M bekommen als geplant;Die deutsche Luftwaffe soll einem Zeitungsbericht zufolge mehr Transportflieger vom Typ Airbus A400M bekommen als geplant.  Statt 13 der Flugzeuge an andere Länder weiterzuverkaufen, solle die Bundeswehr einen “erheblichen Teil” dieser Maschinen behalten dürfen, berichtete die “Süddeutsche Zeitung” (Dienstagausgabe) laut Vorabmeldung. Das Blatt bezog sich dabei auf Planungen des Verteidigungsministeriums, das sich selbst nicht äußerte. Airbus kämpft bei dem viermotorigen Propellerflugzeug immer wieder mit Verzögerungen und Pannen. Ursprünglich war geplant, für die Bundeswehr 60 Exemplare zu bestellen. Diese Zahl wurde später auf 53 gesenkt. 13 davon sollten eigentlich an andere Länder verkauft werden, um Geld zu sparen. Die Bundeswehr sollte dann 40 bekommen. Der “SZ” zufolge ist nun vorgesehen, einen Teil der 13 Maschinen tatsächlich zu verkaufen. Sie sollten aber im Rahmen einer Kooperation in Deutschland stationiert werden. Dabei könnten die Partnerländer auf Ausbildung, Wartung und Betrieb auf die Bundeswehr zurückgreifen.
Trump - Medien ignorieren islamistische Attentate in Europa;US-Präsident Donald Trump hat den Medien vorgeworfen, islamistische Anschläge in Europa zu ignorieren.  “Überall in Europa passiert es”, sagte Trump mit Blick auf Attentate von Islamisten. “Es ist bis zu einem Punkt gekommen, an dem nicht einmal mehr darüber berichtet wird”, fügte er am Montag vor rund 300 Soldaten auf einer Luftwaffenbasis in Florida hinzu. “Und in vielen Fällen will die sehr sehr unehrliche Presse nicht darüber berichten. Sie haben ihre Gründe dafür und ihr versteht das”, sagte Trump zu den Soldaten. Konkrete Beispiele dazu, welche Medien er beschuldigt oder um welche Anschläge es sich gehandelt haben soll, nannte Trump nicht. Er erwähnte in seiner Rede Anschläge in Paris und Nizza, über die ausführlich berichtet wurde.  Später veröffentlichte das US-Präsidialamt eine Liste mit 78 Anschlägen weltweit zwischen September 2014 und Dezember 2016. Ein Mitarbeiter des Präsidialamts warf den Medien vor, nicht mehr so intensiv über islamistische Gewalt zu berichten, wie früher. “Es kann nicht erlaubt werden, dass das eine neue Normalität wird”, sagte er.   Medienwissenschaftler wiesen Trumps Anschuldigungen zurück. “Anzudeuten, Journalisten hätten ihre Gründe, nicht über IS-Angriffe zu berichten, ist haarsträubend”, sagte Al Tompkins vom Poynter Institute, einer Journalistenschule aus Florida.
