title;text
"Der japanische Chemiekonzern Teijin http://www.teijin.co.jp/english/ hat mit dem """"PU_PA"""" ein Elektroauto vorgestellt", das nicht einmal 500 Kilogramm auf die Waage bringt. Möglich machen den ultraleichten E-Flitzer neuartige Materialien und Fertigungsprozesse. Bislang handelt es sich allerdings um ein Konzeptfahrzeug, doch schätzt das Unternehmen, dass leichte Elektroautos mit seinen Materialien in fünf bis zehn Jahren den Markt erreichen werden.MaterialschlachtBauteile, die wie metallische Verkleidungen aussehen," bestehen beispielsweise aus """"Teflex"""". Das ist ein spezieller PET-Film"," der laut Unternehmen gut formbar ist. Zur Vernetzung der Fahrzeugelektronik kommt statt Kabel """"Cell Form"""" zum Einsatz. Das ist ein zweidimensionales Signalleitmaterial", welches laut Hersteller die Sicherheit einer kabelgebundenen Übertragung mit der Bequemlichkeit einer kabellosen Verbindung kombiniert.Die Kernstruktur des Fahrzeugkörpers nutzt indes ein Karbon-Kompositmaterial, bei dem ein Urethanschaum-Material zwischen zwei Prepreg-Platten unter Hitze gepresst und integriert wird, berichtet Tech-On. Anstelle von Glas kommt an vielen Stellen ein hitzebeständiges Polycarbonat-Harz zum Einsatz," das laut Teijin aber nicht für die Verwendung als Windschutzscheibe geeignet ist. Bei den Reifen setzt Teijin auf das Polyethylennaphthalat """"Teonex""""", was ein geringeres Fahrbahngeräusch in Aussicht stellt. LeichtgewichtInsgesamt kommt das PU_PA so auf ein Gewicht von nur 437 Kilogramm. Das ist nicht einmal die Hälfte dessen, was beispielswesie Mitsubishis Serien-Elektroauto i-MiEV (pressetext berichtete: http://pressetext.com/news/090605013/) auf die Waage bringt. Allerdings ist letzteres ein Vier-, das Teijin-Fahrzeug aber nur ein Zweisitzer.Mit einer Höchstgeschwindigkeit von 60 Stundenkilometern und einer Reichweite von 100 Kilometern wäre das Leichtgewicht auch eher als reiner Stadtflitzer interessant. Der Konzeptprototyp hat allerdings aufgrund einiger Sicherheitsbedenken keine Straßenfreigabe. Diese muss Teijin noch in den Griff bekommen," so das Konzept wirklich Realität werden soll."""
"Fotodienst: Wochenrückblick 28. März bis 2. April 2010;""Singapore Airlines", Österreichische Apothekerkammer und Kapsch CarrierCom
Der Fotodienst-Service der Nachrichtenagentur pressetext hat in der vergangenen Woche folgende Foto-Termine wahrgenommen. Die Pressefotos stehen auf http://www.fotodienst.at , http://www.fotodienst.cc und http://www.fotodienst.ch zum Download bereit.A-380 Inaugurationsflug des täglichen Shuttles von Zürich nach Singapore
Zürich-Airport (28. März) - Seit gestern fliegt die Singapore Airlines täglich einmal mit dem A-380 von Zürich nach Singapore und setzt damit einen weiteren Meilenstein in der Luftfahrtsgeschichte. Zürich ist die dritte A-380 Destination in Europa (nach London und Paris) und der siebte Airport, der von Singapore Airline weltweit angeflogen wird. Der A-380 ist mit 12 exklusiven Suiten und 60 äusserst komfortablen Business-Class-Sitzen ausgestattet. Für die Economy-Gäste stehen 399 Plätze zur Verfügung. Singapore Airlines hat zur Zeit zehn A-380 im Liniendienst. Siehe Album unter http://www.fotodienst.at/browse.mc?album_id=3119Immer mehr Hepatitisfälle in Österreich
Wien (30. März) - Hepatitis befindet sich in Österreich im Vormarsch. Infektionen mit dem A- und B- Virus nehmen stark zu. Wurden 2001 noch offiziell beim Bundesministerium für Gesundheit 133 Hepatitis A und 2010 Hepatitis B Fälle gemeldet, waren es 2008 bereits 142 Hepatitis A und 783 Hepatitis B Fälle! Die geschätzten Dunkelziffern liegen jedoch weit höher. Siehe Album unter http://www.fotodienst.at/browse.mc?album_id=3120Kapsch CarrierCom startet nach Kauf von Nortel-Assetes durch
Wien (1. April) - Die Kapsch CarrierCom AG hat heute, Donnerstag," im Rahmen einer Pressekonferenz Details zu einer der größten Übernahmen im Technologiebereich bekannt gegeben. Durch die Akquisition von Teilen von Nortel ist Kapsch nun global führend im Bereich GSM. Diese globale Präsenz geht mit einer Verdopplung der Mitarbeiteranzahl einher und stellt Herausforderungen an die gesamte Organisation. """"Während viele in der Krise klagen"," geht es uns hervorragend. Im GSM-R-Bereich haben wir jetzt die Weltmarktführerschaft inne""""", erläutert der neue Kapsch-CarrierCom-CEO Kari Kapsch im pressetext-Gespräch. Siehe Album unter http://www.fotodienst.at/browse.mc?album_id=3121Termindienst und Fotodienst 
Der Termindienst bietet eine Vorschau auf kommende Pressetermine http://www.termindienst.com . Der Fotodienst bietet direkten Zugriff auf Pressefotos von Presseveranstaltungen und Events. Allgemeine Informationen finden Sie unter http://www.fotodienst.at ," http://www.fotodienst.cc und http://www.fotodienst.ch . Fragen richten Sie bitte an die Fotodienst-Redaktion Tel.: +43 (1) 811 40 - 200 oder per E-Mail an fotodienst@pressetext.at . Fotodienst-Buchungen unter http://www.pressetext.at/produkte/fotodienst"""
"Wühltisch-Läden sorgen für Streit im Fachhandel;""Sportartikelhersteller halten weiterhin an Factory-Outlets fest"
Discount-Verkaufsfilialen in Form von Factory-Outlets rufen immer mehr Händlerverbände auf den Plan. Der Grund: Die Anfang der 1970er Jahre noch als Fabrikabverkauf in direkter Werksnähe angesiedelten Läden haben sich zu einem eigenständigen Vertriebskanal etabliert, der mit der Produktionsstätte nichts mehr zu tun hat. Sportartikelhersteller wie Adidas," Puma oder Nike wollen trotz der Kritik der Fachhändler an dem Konzept festhalten.Outlets schaden der Marke""""Die Konzerne verfolgen mit Outlet-Stores nur ein Ziel", nämlich Umsatz zu generieren. Das muss der Handel ausbaden. Dennoch sehe ich langfristig gute Chancen für Händler," weil sie mit qualitativ hochwertigen Produkten und nicht zuletzt Kundenberatung punkten können""""", sagt Oliver Kenn, Gesellschafter bei on tour Consulting http://ontourconsulting.at , gegenüber pressetext. Dem Insider nach schaden Outlets der Marke. Da die Kunden mit der Qualität der billig in Asien produzierten Ware nicht zufrieden sind," werden sie in den Handel wechseln.Die aktuellen Zahlen belegen den Trend zu Factory-Outlets. Einem Bericht des Handelsblatts nach betreibt Adidas weltweit bereits mehr als 750 dieser Discount-Verkaufsstellen - allein in China hat der Konzern in jüngster Zeit 120 solcher Läden aufgemacht. Aber auch Nike ist mit rund 300 dieser Verkaufsfilialen tätig. Die Kritik an den Stores mit Wühltischcharakter kommt nicht von ungefähr. Adidas erwirtschaftet dort zehn Prozent der Umsätze. Auf diese Weise verdient man mehr als im Geschäft mit Händlern. 2010 sollen 150 neue Shops hinzukommen.Hersteller wollen """"kontrolliert vermarkten""""Europas führender Verbund von Sportfachhändlern", Intersport http://intersport.de ," sieht """"jede Einzelhandelsaktivität der Industrie als Konkurrenz"""". Hersteller Puma rechtfertigt die Filialen damit", dass diese strategisch wichtig sind, um Muster," überschüssige Ware der Vorsaison und Artikel mit Fehlern """"kontrolliert zu vermarkten"""". Den Fachhandel wolle man damit aber nicht beeinträchtigen. Intersport lässt dieses Argument nicht gelten. So werde in den Outlet-Shops längst nicht nur Ware zweiter Wahl angeboten. Darum seien die Läden ständiges Streitthema.Es gibt aber auch Unternehmen"," die Factory-Outlets mit Wühltischen im Neonlicht ablehnen. """"Unsere geringen Überbestände verkaufen wir über unsere besten Handelspartner"," denen wir damit zum Saisonende ein Schnäppchen zukommen lassen""""", lässt sich Peter Schöffel, Chef des Outdoorspezialisten Schöffel http://schoeffel.de , zitieren. Dass das Outlet-Modell generell bestehen bleibt," dafür sprechen die Preise. Sportartikel werden in den Geschäften oft mit Rabatten von bis zu 30 Prozent angeboten. In der Krise dürften Kunden darauf anspringen."""
"Junge rauchende Männer haben niedrigeren IQ;""20.000 Soldaten zwischen 18 und 21 Jahren in Israel untersucht"
