title;text
SPD legt in Umfrage zu - Schulz gleichauf mit Merkel;Die SPD legt nach der Nominierung von Martin Schulz zum Kanzlerkandidaten in den Umfragen weiter zu.  In dem am Mittwoch veröffentlichten wöchentlichen Wahltrend des Meinungsforschungsinstituts Forsa für “stern” und RTL überspringen die Sozialdemokraten erstmals seit Oktober 2012 wieder die 30-Prozent-Marke auf nun 31 Prozent. Sie gewannen fünf Punkte hinzu. Stärkste Kraft blieben CDU und CSU, die einen Punkt auf 34 Prozent abgeben. Forsa-Chef Manfred Güllner führte den Zuspruch zur SPD vor allem darauf zurück, dass Parteichef Sigmar Gabriel auf Kanzlerkandidatur und Parteivorsitz verzichtet hat. “Man ist einfach froh, dass Gabriel nicht mehr da ist”, sagte Güllner zu Reuters-TV. Der SPD-Chef hatte am 24. Januar angekündigt, dass der bisherige Europapolitiker Schulz Kanzlerkandidat werden und auf einem Sonderparteitag am 19. März auch den Parteivorsitz übernehmen soll. Der Parteivorstand schlug Schulz mittlerweile für beide Ämter einstimmig vor. Gabriel plant jedoch keinen Rückzug: Er bleibt Vizekanzler und ist seit fast zwei Wochen Außenminister als Nachfolger von Frank-Walter Steinmeier, der am Sonntag zum Bundespräsidenten gewählt werden soll. Nach dem für “Bild” erstellten Insa-Wahltrend vom Montag[nL5N1FR3SH] ist die Forsa-Umfrage die zweite, in der die SPD auf 31 Prozent klettert. Bei Insa hatten die Sozialdemokraten sogar die Union (30 Prozent) überholt. Bundeskanzlerin und CDU-Chefin Angela Merkel büßt bei Forsa fünf Prozentpunkte an Zuspruch ein. Mit 37 Prozent liegt sie im direkten Duell nur noch gleichauf mit Schulz, der vier Prozentpunkte gutmachte. “Eine so entschiedene Wechselstimmung aber wie 1998, als Gerhard Schröder mit dem weit verbreiteten Überdruss an 16 Jahren Helmut Kohl punkten konnte, können wir momentan noch nicht ausmachen”, zitierte “stern” den Forsa-Chef. Zulauf bekommt die SPD laut Güllner von Anhängern anderer Parteien, auch von der AfD. Diese verliert in der Umfrage einen Punkt auf zehn Prozent. Einen Punkt abgeben müssen auch Linke (acht Prozent) und FDP, die mit fünf Prozent um ihren Einzug in den Bundestag bangen muss. Die Grünen verharren bei acht Prozent. Allein mit dem Thema soziale Gerechtigkeit wird es der SPD nach Einschätzung Güllners nicht gelingen, ihren Aufstieg in den Umfragen zu festigen. Er verwies darauf, dass die Sozialdemokraten zwischen 1998 und 2009 zehn Millionen Wähler verloren. “Die kommen aus der politischen und gesellschaftlichen Mitte”, sagte Güllner Reuters-TV. “Die muss Schulz ansprechen (...). Das gelingt nicht mit dem Thema soziale Gerechtigkeit.” Dazu müsse die SPD andere zukunftsorientierte Themen wie etwa Chancen für Kinder und Enkel wie auch Bildung besetzen.  Für den Wahltrend befragte Forsa vom 30. Januar bis 3. Februar 2501 Wahlberechtigte.
Syngenta-Übernahme soll im Frühjahr über die Bühne gehen;Die Aktionäre des Schweizer Agrarchemiekonzerns Syngenta dürfen mehr als ein Jahr nach dem Übernahmeangebot von ChemChina mit einem Abschluss des Deals rechnen.  Konzernchef Erik Fyrwald stellte am Mittwoch den Vollzug der 43 Milliarden Dollar schweren Transaktion für das zweite Quartal in Aussicht und rechnet nicht mit einer weiteren Verzögerung. Die für den Deal ausschlaggebenden Genehmigungsprozesse in den USA und der EU machten gute Fortschritte, sagte Fyrwald am Mittwoch der Nachrichtenagentur Reuters. Er sei auch überzeugt, dass das chinesische Handelsministerium (MOFCOM) zustimmen werde. “Das wird keine Verzögerung verursachen.” Ursprünglich wollten die beiden Konzerne den größten Auslandszukauf eines chinesischen Unternehmens bereits vergangenes Jahr in trockenen Tüchern haben. In Europa war das Vorhaben bei den Kartellwächtern dann aber auf Skepsis gestoßen, weil die Transaktion zu höheren Preisen und geringerer Auswahl für die Bauern führen könnte. Hintergrund ist die laufende Konsolidierungswelle in der weltweiten Pflanzenschutz- und Saatgutbranche: So will Bayer Monsanto schlucken und auch die US-Chemieriesen DuPont und Dow Chemical haben einen Zusammenschluss angekündigt. Kommen alle diese Deals zustande, teilen sich mit BASF vier Riesen den Markt weltweit auf. Insidern zufolge werden die EU-Behörden den Weg im kommenden Monat frei machen[nL5N1FN67X] und in den USA wird mit einer raschen Genehmigung gerechnet, denn ChemChina macht in den USA nur wenig Umsatz. Die Brückenfinanzierung für den Deal stehe unwiderruflich, sagte Syngenta-Finanzchef Mark Patrick.  Dass die Transaktion durch einen Zusammenschluss der Chinesen mit einer anderen Firma in Gefahr geraten könnte, befürchtet Syngenta-Chef Fyrwald nicht. “Ich spreche persönlich mit ChemChina-Präsident Ren Jianxin”, sagte Fyrwald. “Uns wurde wiederholt versichert, es gebe gegenwärtig keine Gespräche mit anderen über eine Fusion in China.” Der Staatskonzern war bereits im Januar Berichten über eine Übernahme des heimischen Rivalen Sinochem entgegengetreten. Im vergangenen Jahr sank der Gewinn des Pflanzenschutz-Weltmarktführers aus Basel in einem für die Branche anhaltend schwierigen Umfeld um zwölf Prozent auf 1,2 Milliarden Dollar Der Umsatz ging um fünf Prozent auf 12,8 Milliarden Dollar zurück. Eine Dividende fällt aus, eine Ausschüttung würde nämlich vom Angebotspreis von 465 Dollar je Aktie abgezogen. ChemChina hat den Eigentümern vor einem Jahr allerdings noch eine Sonderdividende von fünf Franken je Aktie beim Abschluss der Transaktion versprochen.
Warnstreik legt Berliner Airports lahm - Viele Flugausfälle;Ein Warnstreik des Bodenpersonals hat am Mittwochmorgen zu erheblichen Einschränkungen an den Berliner Flughäfen geführt.  In Tegel würden am Vormittag 134 Flüge ausfallen, in Schönefeld weitere 22, sagte ein Sprecher der Flughafen Berlin Brandenburg GmbH der Nachrichtenagentur Reuters. Auch nach dem von der Gewerkschaft Verdi für 11.00 Uhr angekündigten Streikende sei mit Einschränkungen im Flugverkehr zu rechnen. In Stuttgart und Hamburg wird ebenfalls gestreikt. Auch dort kommt es nach Gewerkschaftsangaben zu starken Beeinträchtigungen bis hin zu Flugausfällen. Laut Verdi folgten die meisten der 2000 Beschäftigten der Bodenverkehrsdienste in Berlin dem Aufruf, zwischen 5.00 Uhr und 11.00 Uhr die Arbeit niederzulegen. Der Gewerkschaft will damit ihren Forderungen im Tarifstreit mit den Arbeitgebern Nachdruck verleihen. Sie fordert für die Beschäftigten - die etwa in der Be- und Entladung, dem Check-in oder dem Einwinken von Flugzeugen arbeiten - eine Erhöhung der Stundenlöhne von derzeit etwa elf auf zwölf Euro. Zudem sollen die Beschäftigten bessere Aufstiegsmöglichkeiten erhalten. “Die Beschäftigten in den Bodenverkehrsdiensten leisten täglich harte und sicherheitsrelevante Arbeit im Schichtdienst, in einem risikoreichen Umfeld”, sagte Verdi-Bundesvorstand Christine Behle. “Dennoch wird diese Arbeit nicht angemessen entlohnt, hier muss sehr stark nachgebessert werden.”
HINTERGRUND-Zerreißprobe für Nato - Vom Bündnisschutz zum Anti-Terror-Kampf?;Die Nato steckt in einem bizarren Dilemma: Einerseits verleiht die Eiszeit mit Russland dem Militärbündnis eine so große Bedeutung wie nie seit dem Ende des Kalten Krieges.  Andererseits kämpft die Allianz ausgerechnet jetzt mit deutlichen Verschleißerscheinungen. Die scharfe Kritik des neuen US-Präsidenten Donald Trump zehrt an dem Bündnis. Seine Forderung nach einer stärkeren Rolle der Allianz im Kampf gegen die Extremistenmiliz IS - womöglich Seite an Seite mit Russland - könnte die Nato vor eine Zerreißprobe stellen. Der wichtige Bündnispartner Türkei driftet unterdessen politisch und militärisch immer weiter von der Allianz weg: Es gibt Ärger bei der Nutzung des Stützpunkts Incirlik, beim gemeinsamen Einsatz in der Ägäis. In Syrien bekämpft das türkische Militär zudem die Kurden-Miliz YPG und damit genau die Rebelleneinheit, die dort der schlagkräftigste Verbündete des Westens gegen den IS ist. Trump zeigte bereits vor seinem Amtsantritt klare Kante. “Die Nato hat Probleme. Sie ist obsolet, weil sie erstens vor vielen, vielen Jahren entworfen wurde. Zweitens zahlen die Länder nicht, was sie zahlen müssten”, sagte er der “Bild”-Zeitung. Die Ansage kam zu einem Zeitpunkt, als sich die meisten Länder ohnehin schon darauf eingestellt hatten, für ihre Verteidigung tiefer in die Tasche greifen zu müssen. Die US-Forderung nach einer gerechteren Lastenverteilung ist nicht neu, wenngleich Trumps Vorgänger weniger drastische Worte wählten. Zudem schreckte Russlands Vorgehen in der Ukraine-Krise gerade die osteuropäischen Staaten und nicht zuletzt Deutschland auf. So steigerte die Bundesregierung die Rüstungsausgaben bereits 2016 um über zehn Prozent. Auch militärisch übernimmt Deutschland eine stärkere Rolle: Die Bundeswehr führt eines der vier Nato-Kampfbataillone, die Russland wie ein Stolperdraht von einem Angriff auf Polen und die baltischen Staaten abhalten sollen. Bundesverteidigungsministerin Ursula von der Leyen besuchte die deutschen Soldaten am Dienstag in Litauen. FINANZIELLE FORDERUNGEN DER USA EINGEPREIST Während die finanziellen Forderungen der USA bereits weitgehend eingepreist sind, könnte eine Nato-Mission gegen den IS für größeren Ärger innerhalb der Allianz sorgen. Die transatlantische Verteidigungsgemeinschaft sei auch deshalb “obsolet, weil sie sich nicht um den Terrorismus gekümmert hat”, wetterte Trump im “Bild”-Interview. Schon in der Vergangenheit hatten die USA auf eine stärkere Rolle des Bündnisses im Nahen Osten gedrungen. Kritiker dagegen warnten davor, ausgerechnet die von den USA geführte und westlich dominierte Militärallianz in Syrien oder dem Irak einzusetzen und damit womöglich die Muslime in der Region zu provozieren. Als Konsequenz wurde 2014 am Rande des Nato-Gipfels in Wales eine breite Anti-IS-Koalition aus mehr als 60 Ländern gebildet, die auch etliche muslimische Staaten wie Jordanien, Saudi-Arabien, Katar, Bahrain und die Vereinigten Arabischen Emirate umfasst.      Eine direkte Nato-Mission gegen den IS dürfte seit der militärischen Intervention Russlands und der Türkei in Syrien sogar noch umstrittener sein als in der Vergangenheit. Kritiker fürchten, die Türkei könne einen solchen Einsatz als Deckmantel nutzen, um noch schärfer gegen die Kurden in der Region vorzugehen. Schwer vorstellbar auch, wie die Nato sich auf die Miliz abstützen könnte, während sie von der Türkei beschossen wird. Schon jetzt verfolgt die Regierung in Ankara jede Stärkung der YPG voll Argwohn. Der türkische Verteidigungsminister Fikri Isik forderte Trump noch vor dessen Amtsantritt auf, mit der Miliz zu brechen. Die Türkei betrachtet die YPG, die die syrischen Kurdengebiete entlang der türkischen Grenze militärisch hält, als Ableger der verbotenen Kurdischen Arbeiterpartei PKK.  Die Nato wiederum dürfte trotz aller Probleme mit der Regierung in Ankara wenig Interesse daran haben, es sich mit dieser zu verderben: Das Land am Bosporus bildet als einziges muslimisches Mitglied der Allianz eine Brücke zum Islam, seine Lage macht es zum idealen Sprungbrett für Militäreinsätze wie derzeit in Syrien und dem Irak.  KOOPERATION MIT RUSSLAND KÖNNTE BELASTUNGSPROBE WERDEN Auch eine Zusammenarbeit mit Russland im Anti-Terror-Kampf, wie Trump sie anstrebt und die auch Syriens Präsident Baschar al-Assad zuletzt als erstrebenswert bezeichnete, könnte zu einer Belastungsprobe für die Nato werden: Russland unterstützt die syrische Regierung militärisch und wandte durch seine Intervention in dem Krieg nach Einschätzung von Beobachtern Assads Niederlage ab. Der Westen und Nato-Generalsekretär Jens Stoltenberg warfen der Regierung in Moskau immer wieder vor, sie greife in Syrien vor allem Regierungsgegner an, um Assad zu stabilisieren, und viel seltener Stellungen der Extremistenmiliz IS.  Russland bestreitet dies. Dennoch vermieden die USA unter Trumps Vorgänger Barack Obama sehr sorgfältig eine engere militärische Abstimmung mit dem russischen Militär, soweit sie nicht der Vermeidung von Flugunfällen zwischen den Kampfjets beider Staaten über Syrien dient. Ein gemeinsamer Militäreinsatz gegen den IS würde eine völlige Kehrtwende der USA in der Syrien- ebenso wie der Russland-Politik bedeuten und vermutlich auf Bedenken anderer Nato-Partner stoßen. Dies dürfte spätestens beim Nato-Gipfel im Mai für heftige Diskussionen sorgen. Trump jedenfalls will sich der Debatte mit den irritierten Bündnispartnern stellen: Er sagte seine Teilnahme an dem Treffen inzwischen zu.
ABB stoppt Auftragsschwäche im Schlussquartal;Der Elektrokonzern ABB hat seinen Auftragsschwund im vierten Quartal vorerst gestoppt.  Auf vergleichbarer Basis seien neue Orders im Volumen von knapp 8,3 Milliarden Dollar eingegangen, drei Prozent mehr als vor Jahresfrist, teilten die Schweizer am Mittwoch mit. Der Umsatz stagnierte bei knapp neun Milliarden Dollar. Der Nettogewinn des Siemens-Rivalen konnte sich auf 489 Millionen Dollar mehr als verdoppeln. ABB blieb beim Überschuss allerdings deutlich hinter den Erwartungen der Analysten zurück. “Dank der starken Performance der Division Stromnetze sind wir im vierten Quartal trotz des schwierigen Marktumfelds gewachsen”, erklärte Konzernchef Ulrich Spiesshofer. Er hatte die Sparte trotz Abspaltungsforderungen von Aktionären bei ABB belassen.
IWF- Griechenland muss Rentenkosten senken;Griechenland muss nach Einschätzung des Internationalen Währungsfonds (IWF) seine Ausgaben für Rentenzahlungen verringern, Steuerraten senken und Ausnahmen bei der Besteuerung verringern, um wieder auf einen deutlichen Wachstumspfad zu kommen.  “Griechenland muss einige ziemlich schwierige Entscheidungen treffen, um seinen Haushalt deutlich wachstumsfreundlicher zu machen”, sagte IWF-Europa-Direktor  Poul Thomsen am Dienstag in Washington. Zuvor hatte sich das Direktoren-Gremium des IWF erstmals seit Jahren ausführlich mit der Finanzlage des Landes befasst.  Dabei waren Unstimmigkeiten über die Bewertung von Griechenlands Schuldenlast offenkundig geworden. Die meisten IWF-Direktoren waren der Ansicht, dass die bisherigen Sparanstrengungen des Landes ausreichen, um den Überschuss im Staatshaushalt ohne Zinszahlungen (Primärüberschuss) mittelfristig auf rund 1,5 Prozent des Bruttoinlandsprodukts (BIP) zu bringen. Einige andere Direktoren plädierten aber für einen Zielwert von 3,5 Prozent. Dies ist das Niveau, das in den Verhandlungen Griechenlands mit seinen Euro-Partnern für die Zeit ab 2018 vorgegeben wurde.  Zugleich bescheinigte der IWF  Griechenland in seinem Länderbericht erhebliche Reformfortschritte. Die wirtschaftliche Entwicklung habe sich stabilisiert. Wenn das Land seine Reformzusagen fristgerecht erfülle, könnte längerfristig ein durchschnittliches Jahreswachstum der Wirtschaftsleistung von nicht ganz einem Prozent erreicht werden.
USA erwägen Einstufung iranischer Revolutionsgarden als Terrorgruppe;Die US-Regierung erwägt, die iranischen Revolutionsgarden als Terrorgruppe einzustufen.  Wie die Nachrichtenagentur Reuters von mit der Angelegenheit vertrauten Personen erfuhr, könne es dazu möglicherweise eine Verfügung durch US-Präsident Donald Trump geben. Ob es dazu kommt, sei aber noch nicht entschieden.  Die Revolutionsgarden sind der einflussreichste Teil der iranischen Sicherheitskräfte. Sie haben auch die Kontrolle über Teile der iranischen Wirtschaft und verfügen über erheblichen politischen Einfluss.  Das Verhältnis zwischen dem Iran und den USA hatte sich mit dem Amtsantritt von Trump erheblich verschlechtert. Die Spannungen waren durch den Test einer Mittelstreckenrakete durch die Islamische Republik entstanden. Trump warf daraufhin der Führung in Teheran, die dem engen US-Verbündeten Israel mehrfach mit Vernichtung gedroht hatte, ein “Spiel mit dem Feuer” vor. Der Iran ist auch eines der sieben islamisch geprägten Länder, dessen Bürgern nach einer Verfügung Trumps vorübergehend die Einreise in die USA verweigert wurde. Diese Anordnung ist momentan durch einen Richterspruch ausgesetzt. 
SPD legt auch in Forsa-Umfrage zu - Schulz gleichauf mit Merkel;Die SPD befindet sich nach der Nominierung von Martin Schulz zum Kanzlerkandidaten weiter im Aufwind.  In dem am Mittwoch veröffentlichten Wahltrend des Meinungsforschungsinstituts Forsa für “stern” und RTL springen die Sozialdemokraten erstmals seit Oktober 2012 wieder über die 30-Prozent-Marke auf nun 31 Prozent. Das sind fünf Punkte mehr als in der Vorwoche. Anders als im für “Bild” erstellten Insa-Wahltrend vom Montag überholt die SPD aber in der Forsa-Erhebung noch nicht die Union. Allerdings verlieren CDU und CSU einen Prozentpunkt auf 34 Prozent. Bundeskanzlerin Angela Merkel büßt  zudem fünf Prozentpunkte an Zuspruch ein. Mit 37 Prozent liegt sie im direkten Duell nur noch gleichauf mit Schulz, der vier Prozentpunkte gutmachte. “Eine so entschiedene Wechselstimmung aber wie 1998, als Gerhard Schröder mit dem weit verbreiteten Überdruss an 16 Jahren Helmut Kohl punkten konnte, können wir momentan noch nicht ausmachen”, zitierte “stern” Forsa-Chef Manfred Güllner. Zulauf bekomme die SPD von bisherigen Anhängern anderer Parteien, auch von der AfD. Diese verliert in der Umfrage einen Prozentpunkt auf zehn Prozent. Ebenfalls einen Punkt abgeben müssen Linke (acht Prozent) und die FDP, die mit fünf Prozent um ihren Einzug in den Bundestag bangen muss. Die Grünen verharren bei acht Prozent.     Für den stern-RTL-Wahltrend befragte Forsa dem Vorabbericht zufolge vom 30. Januar bis 3. Februar 2501 Bundesbürger. Die statistische Fehlertoleranz lag demnach bei plus/minus 2,5 Prozentpunkten.
"Trump lobt Türkei als ""strategischen Nato-Verbündeten"";US-Präsident Donald Trump hat der Türkei eine enge politische Zusammenarbeit angeboten.  Das Land sei ein strategischer Partner und Nato-Verbündeter", der auf die Unterstützung durch die USA zählen könne, erklärte Trump nach Angaben des US-Präsidialamts am Montag in einem Telefonat mit dem türkischen Präsidenten Recep Tayyip Erdogan. Die Politiker hätten zudem den gemeinsamen Kampf gegen “den Terrorismus in allen seinen Formen” besprochen. Trump habe dabei ausdrücklich den Beitrag der Türkei im Kampf gegen die Islamisten-Miliz IS gewürdigt. 
Merkel und Putin pochen auf Waffenruhe in Ostukraine;Kanzlerin Angela Merkel und der russische Präsident Wladimir Putin pochen gemeinsam auf die Einhaltung der Waffenruhe in der Ostukraine.  Beide seien sich in einem Telefonat einig gewesen, dass neue Anstrengungen unternommen werden müssten, um die Kämpfe der vergangenen Tage zu stoppen, teilten die Regierungen in Berlin und Moskau am Dienstag mit. Merkel und die polnische Ministerpräsidentin Beata Szydlo betonten nach einem Treffen in Warschau, dass die EU-Sanktionen gegen Russland nicht aufgehoben werden könnten, weil es keine Fortschritte bei der Umsetzung des Minsker Friedensabkommen gebe. “Die Bundeskanzlerin appellierte an den russischen Staatspräsidenten, auf die Separatisten in diesem Sinne einzuwirken”, erklärte Merkels Sprecher Steffen Seibert. Das Präsidialamt in Moskau teilte mit, Merkel und Putin hätten ernste Sorgen über die hohe Zahl der Toten und Verletzten geäußert. Der russische Außenminister Sergej Lawrow lobte unterdessen die neue US-Regierung. Wenn Präsident Donald Trump ankündige, er wolle den Ukraine-Konflikt umfassend verstehen lernen, sei dies schon eine große Verbesserung gegenüber der Regierung von Barack Obama, sagte Lawrow nach einem Bericht der Nachrichtenagentur Tass. Es ließen sich nicht alle Probleme in der Ukraine lösen, wenn man einfach die Kontrolle über die Separatistengebiete zurückerhalte. Das verstehe auch die US-Regierung. Seit etwa zehn Tagen gibt es an der Front zwischen den  prorussischen Separatisten und ukrainischen Truppen schwere Gefechte, bei denen nach Angaben aus Kiew mindestens ein Dutzend Soldaten getötet und viele verletzt wurden. Die EU macht Russland für die militärische Unterstützung der Separatisten verantwortlich. Die Regierung in Moskau weist dies zurück.
Merkel lehnt Polens Wünsche zum Rückbau der EU ab;Kanzlerin Angela Merkel hat sich gegen polnische Wünsche zu einem Rückbau der EU ausgesprochen.  Bei einem Besuch in Warschau warnte sie am Dienstag vor Vertragsänderungen, für die sich die nationalkonservative Regierung ausgesprochen hat. “Ich kann mir im Augenblick auch nicht vorstellen, dass man eine realistische Möglichkeit hat, hier irgendwelche Dinge zurückzudrehen”, sagte Merkel zu polnischen Wünschen, die EU auf die Themen Binnenmarkt, Umwelt und Verteidigung zu konzentrieren. Im Streit über die innenpolitischen Reformen in Polen erinnerte sie daran, wie wichtig beim Sturz des Kommunismus freie Medien und eine freie Justiz gewesen seien. Merkel traf am Abend den Chef der Regierungspartei PiS, Jaroslaw Kaczynski, sowie Oppositionsvertreter. Bei den Gesprächen in Warschau wollte sie wie schon in Belgien, Luxemburg, Malta und Schweden sondieren, wie die 27 EU-Regierungen die Union nach dem Austritt Großbritanniens weiterentwickeln wollen. Kaczynski hatte in einem Interview vor für eine Begrenzung der EU-Kompetenzen geworben und einen zu starken Einfluss Deutschlands kritisiert. Ministerpräsidentin Beata Szydlo und Merkel betonten auf einer gemeinsamen Pressekonferenz aber die Fülle gemeinsamer Positionen wie eine engere Zusammenarbeit in der Verteidigungspolitik. Gleichzeitig betonte Szydlo, die Schlussfolgerung aus der Brexit-Entscheidung sei eine Stärkung der Nationalstaaten. Etliche andere EU-Staaten wollen aber mehr und nicht weniger Integration, weshalb Merkel in Warschau vor einer EU-Vertragsdebatte warnte, die im Chaos enden könne. Ende März will die EU bei den Feiern zum 60. Jahrestag der Römischen Verträge eine Perspektive für die kommenden zehn Jahre vorstellen. “Die Binnenmarkt-Definition ist umfassender als nur freier Warenverkehr und Umwelt”, wies Merkel Vorstellungen einer schlankeren EU zurück. KEINE ANNÄHERUNG IN STREIT ÜBER REFORMEN Im Streit über die Reformen der Regierung zur stärkeren Kontrolle der Justiz und der Medien gab es keine Annäherung. Der Vizepräsident der EU-Kommission, Jyrki Katainen, hatte am Montag im Reuters-Interview deutlich gemacht, dass die Kommission hart bleiben werde. “Entweder man beachtet den Rechtsstaat oder nicht. Und wenn nicht, kann Europa nicht schweigen.”[nL5N1FR4VG Merkel, die bisher direkte Kritik an der Regierung vermieden hatte, erinnerte daran, dass Polen in den 80er Jahren Vorbild für die Befreiung vom Kommunismus gewesen sei. Damals habe man erkannt, wie wichtig unabhängige Medien und Justiz seien. In einem Punkt ging die Kanzlerin auf Ängste ein: Die Regierung in Warschau hatte gewarnt, dass sich die 19 Euro-Staaten zu stark integrieren und gegenüber den künftig noch acht Nicht-Euro-Staaten abkoppeln könnten. Ein Europa der verschiedenen Geschwindigkeiten gebe es heute mit dem Euro und dem Schengen-Raum schon, an dem nicht alle Länder teilnähmen, betonte Merkel. Jedem Mitgliedstaat müsse es auch künftig frei stehen, weitere Integrationsschritte nicht mitzugehen. “Es kann (aber) nicht sein, dass man exklusive Clubs bildet, in die man nicht hineinkommt.”
