title;text
"Eigene Mitarbeiter bleiben größtes Sicherheitsrisiko;""Trotz aufgestockter IT-Budgets pfeifen Unternehmen auf Loyalität"
Trotz Defiziten in der IT-Security machen Unternehmen der Technologie-," Media- und Telekommunikationsbranche (TMT) in puncto innerer Sicherheit Fortschritte. Wie Deloitte http://deloitte.com in der aktuellen Erhebung """"2010 TMT Global Security Study - Bounce Back"""" herausgefunden hat"," gehen """"deutlich mehr"""" der 150 Befragten davon aus"," dass die Firmen spezifische Risiken im Griff haben und IT-Budgets steigen.Mehr Geld für die IT""""Unternehmen stecken viel Geld in die Optimierung technischer Sicherheitssysteme. Häufig lassen sie dabei jedoch die menschliche Komponente zu sehr außer Acht. Kaum verwunderlich also"," dass die eigenen Mitarbeiter unabsichtlich oder mit Vorsatz größtes Sicherheitsrisiko sind""""", sagt Christian Schaaf, Geschäftsführer der Münchner Corporate Trust Business Risk & Crisis Management GmbH http://corporate-trust.de , gegenüber pressetext.Obwohl kritische Bereiche wie Cloud Computing und M&A-Aktivit;äten problematisch sind, gibt sich die TMT-Branche zuversichtlich als eine der ersten gestärkt aus der Krise hervorzugehen. Auch wenn die Sicherheitsbudgets allmählich ansteigen, halten es Insider für fraglich, ob sie den realen Bedrohungsszenarien gewappnet sind. Die Befragten teilen diese Skepsis und schätzen, dass die Hälfte der Firmen massiven Nachholbedarf aufweist.Dass das Thema IT-Security an Bedeutung gewinnt, zeigt sich unter anderem daran, dass über ein Drittel Sicherheitsbudgets um bis zu zehn Prozent aufgestockt haben - ein Zehntel sogar um deutlich mehr. Vor allem Telekommunikationsunternehmen investieren in ihre Sicherheit. Medienanbieter hingegen zeigen die geringste Aktivität. Proaktives Handeln ist jedoch gefragt, da über die Hälfte der Firmen 2009 mindestens einen sicherheitsrelevanten Vorfall zu beklagen hatten.Gefahren durch M&A-Aktivit;ätenDie Bedrohungslage ist real. 2009 war ein Drittel der befragten Unternehmen wiederholt mit Software-Attacken konfrontiert. Die Zahlen sind auch deshalb so dramatisch," da 84 Prozent der Firmen digitalisierte Inhalte und Informationen als ihr wichtigste Kapital erachten. Aber auch die Gefährdung von innen durch die eigenen Mitarbeiter sollte nicht unterschätzt werden - sie bieten mit Abstand das größte Gefahrenpotenzial. Das Mitarbeitervertrauen steigt jedoch.""""Viele Unternehmen behandeln ihre Mitarbeiter nicht so", wie es der Firma zuträglich wäre. Es ist vor allem aber die Verbundenheit mit dem Arbeitgeber und die daraus resultierende Loyalität," die am Ende der Schlüssel zum Unternehmenserfolg ist"""""," sagt Schaaf im pressetext-Gespräch. Dem Experten nach spielt die Höhe der Bezahlung der Angestellten aber eine eher untergeordnete Rolle. """"Denn nur wer sich schlecht behandelt fühlt"," neigt dazu Informationen abzuzapfen.""""Neben dem fairen Umgang mit Humanressourcen weist Deloitte auch auf Sicherheitsrisiken durch M&A-Aktivit;äten hin. Werden Unternehmensteile zugekauft oder abgestoßen", muss besonderes Augenmerk auf die IT gelegt werden. Zugangsmöglichkeiten von Ex-Mitarbeitern zu hochsensiblen Daten sollten daher überprüft werden. Umfassende Zugangskontrollen sind daher unbedingt erforderlich," denn der Abfluss von sensiblen Daten wird dadurch verhindert."""
"Aufmerksamkeit als Beziehungsboost;""Alltägliche Dankbarkeit wichtig im Umgang mit Partner"
Mehr Aufmerksamkeit sorgt dafür, dass zwischenmenschliche Beziehungen angekurbelt werden und mehr Romantik ins Leben kommt. Das wiederum führt zu einer Verbesserung der Paarbeziehung und macht damit das Leben leichter - und auch schöner. Solche Aufmerksamkeiten sind zudem die wichtigsten Stabilisatoren einer Partnerschaft, berichten Forscher der University of North Carolina http://www.unc.edu im Fachmagazin Personal Relationships. Sie haben dazu mehr als 60 Paare untersucht.Im täglichen Leben mit Stress und Ablenkung vergisst man allzu oft darauf, dem Liebsten genug Aufmerksamkeit zu schenken. Doch gerade diese Gesten sind es, die für die Stabilisierung einer Beziehung so wichtig sind. Gemeint sind nicht große Geschenke," sondern kleine Aufmerksamkeiten. """"Jemand", der sich gegenüber seinem Partner dankbar zeigt und ihn dementsprechend liebevoll behandelt, tut auch sich selbst Gutes," denn das führt zu einer Steigerung des eigenen Wohlbefindens"""""," so Studien-Leitautorin Sara Algoe.Positive Gefühle fördern Beziehung""""Diese Gefühle der Dankbarkeit und der Großzügigkeit sind wichtig für die Verfestigung unserer Beziehungen mit den Menschen"," die wir gerne mögen."""" Das habe sowohl für denjenigen", dem diese Gefühle entgegengebracht werden als auch für den, der sie gibt Vorteile, erklärt die Wissenschaftlerin. Die Forscher haben als Probanden Paare genommen," deren Beziehung bereits gefestigt war und die einander gut verstanden. Sie haben dabei die tägliche Fluktuation in der Beziehungszufriedenheit für jeden einzelnen der Partner aufgezeichnet. """"Dankbarkeit", Wertschätzung und Liebe sind nahe miteinander verwandt. Wenn ich in Dankbarkeit schaue," schaue ich auch in Liebe. Das ist das Geheimnis"""""," meint Coach Christiane Deutsch http://www.christianedeutsch.com im pressetext-Interview. """"Wenn sich jemand auf Wertschätzung ausrichtet", wird er mehr entdecken," was er wertschätzen kann""""", meint die Expertin. In der Gegenwart von jemandem, der dankbar ist, falle es einem selbst auch leichter," Dankbarkeit zu empfinden. """"Oftmals übernehmen wir vom Partner Gefühle und Stimmungen."""" Es wäre schön"," wenn es positive sind.Das Fehlende selbst einbringen""""Der Psychotherapeut Chuck Spezzano meint", dass, wenn einem in einer Beziehung etwas fehlt," man es selbst hineinbringen soll"""""," so Deutsch. Dieser """"erwachsene"""" Ansatz", dass man bei Entdeckung eines Mankos selbst derjenige sein müsse, der etwas ändert," scheint eine Grundvoraussetzung für eine gelungene Beziehung zu sein. """"Dann fängt das gegenseitige Beschuldigen erst gar nicht an. Und man erkennt sich selbst als Schöpfer der eigenen Realität.""""""""Wenn ich bewusst danach trachte", was passt, werde ich auch automatisch mehr wahrnehmen," was passt"""""," meint Deutsch. Die Energie folge der Aufmerksamkeit. """"Wenn ich erkenne", welche Fülle bereits da ist, fällt es mir auch leichter," dankbar und großzügig zu sein."""" Das zeige auch", dass die Person nicht dem Mangeldenken verfallen ist.Viele Kleinigkeiten versüßen das Leben In der Studie wird die Bedeutung von kleinen Gesten beschrieben und der Fähigkeit, sich daran zu erfreuen. Meiner Meinung nach," kann man ein glückliches Leben oder eine glückliche Beziehung auch mit einem Bank-Konto vergleichen"""""," meint Deutsch. """"Es sind die oftmaligen kleinen Einzahlungen"," die letztendlich eine stattliche Summe zustande kommen lassen.""""""""Es sind kleine Gesten und Sätze der Wertschätzung"," die uns selbst und den anderen erfreuen und das Wohlgefühl steigern"""""," so die Expertin. """"Wenn ich meinen Dank ausdrücke"," so nehme ich auch bewusster an."""" Und unbewusst strebe der Mensch an", dem, der Gutes tut," wieder Gutes zurückgeben zu wollen. """"Daher ist es in jeder Hinsicht besser"," zu geben""""", erklärt Deutsch. Wer Dankbarkeit ausdrücken will," könne dies auf der Page http://www.dankstelle.com tun."""
"LinkedIn setzt verstärkt auf Twitter;""Business-Netzwerk führt vier neue Networking-Features ein"
Das Business-Netzwerk LinkedIn http://www.linkedin.com hat seine Networking-Funktionen weiter ausgebaut. Insgesamt gibt es vier neue Features, im Mittelpunkt steht dabei der Ausbau der Twitter-Applikation. Die App bietet den Usern nun erweiterte Suchmöglichkeiten bzw. die Recherche nach relevanten Kontakten, denen sie über Twitter sowie auf LinkedIn folgen können. Die Übersichtsseite wurde überarbeitet , sodass nun alle Kontakte, die mit Twitter verbunden sind," darauf erscheinen. Diese können per Mausklick zu einer dynamischen Twitter-Liste zusammengefasst werden. """"Die Twitter-App bietet die Möglichkeit", Status-Updates auf LinkedIn und Twitter miteinander zu verbinden. Die Applikation nutz eine gemeinsame Schnittstelle und ermöglicht LinkedIn-Mitgliedern," ihre Nachrichten automatisch mit ihren Twitter-Kontakten zu teilen"""""," erklärt ein LinkedIn-Sprecher gegenüber pressetext. Unternehmen verfolgenLinkedIn setzt aber auch intern auf das """"Verfolgen"""". Mit dem neuen Tool """"Company Follow"""" sollen die Nutzer jetzt aktuelle Entwicklungen jedes gewünschten Unternehmens", das auf der Seite vertreten ist, beispielsweise per E-Mailbenachrichtigung verfolgen. So sollen die User auch über Jobangebote und neue Mitarbeiter auf dem Laufenden bleiben. Darüber hinaus wurden die Suchmöglichkeiten nach Personen außerhalb des eigenen Netzwerkes verbessert. Die Filterfunktionen sind detaillierter gestaltet worden," damit Mitglieder die Liste der Personen anhand von Kriterien wie """"aktuelles Unternehmen"""" oder """"Ausbildungsstätte"""" durchsuchen können.Wissen austauschenMehr Gewicht verleiht LinkedIn auch dem Wissensaustausch unter den Mitgliedern. Dazu wurde der Bereich """"Netzwerk-Aktivitäten"""" ausgebaut und mit mehr Möglichkeiten ausgestattet"," um die eigenen Kontakte mit wissenswerten News zu versorgen oder Informationen weiterzugeben. Bei Verlinkungen auf Nachrichtenartikel integriert LinkedIn automatisch die ersten Zeilen einer Meldung und zeigt auch die Quelle an."""
"Freescale: ""Eine Tablet-Größe passt nicht jedem"";""Projekt entwickelt zielgruppenorientierte Gerätekonzepte"
"Der Chiphersteller Freescale http://www.freescale.com hat in Zusammenarbeit mit dem Savannah College of Art and Design http://www.scad.edu (SCAD) unterschiedliche Konzepte für zukünftige Mobil-PCs mit ARM-CPU erarbeitet. Dabei setzt das Unternehmen insbesondere auf Tablet-Designs und eine große Produktvielfalt. """"Eine Tablet-Größe passt nicht jedem""""", erklärt Glen Burchers, Freescale Director of Global Consumer Segment Marketing, im Unternehmensblog. Die erarbeiteten Ideen sollen daher den speziellen Anforderungen unterschiedlicher Nutzergruppen gerecht werden.Kein Markt für Mini-NotebooksFreescale zählte 2009 zu den Unternehmen," die sich auch für ARM-basierte Mininotebooks stark gemacht haben. Davon eher abzugehen ist aber wohl sinnvoll. """"Wir glauben nicht"," dass solche Geräte besonders erfolgreich sein werden""""", meint Bob O'Donnell, IDC Vice President Clients and Displays," gegenüber pressetext. Das Problem sind die Nutzererwartungen. """"Der Markt und unsere Forschungen zeigen", dass Kunden, die Clamshell-Mininotebooks kaufen," Windows wollen"""""," erklärt der Analyst. Auf ARM-Prozessoren läuft das vom Desktop vertraute Betriebssystem aber nicht.Bei Tablets ist die Situation nicht zuletzt dank Apple eine völlig andere. """"Geräte wie das iPad oder Media-Tablets mit Android werden eine wesentlich erfolgreichere Alternative sein und ARM-basierten Mininotebooks praktisch jegliches Marktpotenzial abgraben""""", sagt O'Donnell. Windows-Netbooks dagegen werde es trotz des ARM-Tablet-Drucks weiterhin geben, doch sei auch in diesem Marksegment mit einem Rückgang der Zuwachsraten zu rechnen.Zielgruppenorientierte ZukunftJedenfalls ist es sinnvoll, wie Freescale speziell Tablet-Designs zu studieren. Unter anderem haben sich das Unternehmen und SCAD dabei mit Stundenten befasst, die Kunst und Musik lieben. Diese Zielgruppe legt Wert auf ein Produkt, das einen Mehrwert für andere Elektronikprodukte schafft, die sie bereits besitzen, so Burchert. Die entsprechende Idee ist ein Tablet mit verschiedenen Docks für unterschiedliche Anwendungen. Diese erstrecken sich vom einfachen Aufsteller bis hin zum geradezu professionellen Audio-Dock für Hobby-DJs, das beispielsweise auch analoge Audio-Ausgänge bietet.Insgesamt hat Freescale mit dem SCAD Konzepte für neun verschiedene Nutzergruppen entwickelt, die derzeit nach und nach vorgestellt werden. Dazu zählt auch ein Tablet-Design, das merklich an andere Konzepte für E-Reader der nächsten Generation erinnert. Aber nicht alle Geräte sind tastaturlos. Ein Konzept zielt auf Zwölf- bis 14-Jährige ab, bei denen laut Studie portable Konsolen sehr beliebt sind. Hier wird auf Gamepad-artiger Steuertasten an den Seiten eines Keyboards gesetzt. Ob diese oder andere Freescale-SCAD-Ideen tatsächlich als Produkte umgesetzt werden," bleibt abzuwarten."""
"Deutsche Bank speckt Kunstberatungsabteilung ab;""Nachfrage nach Sachwerten als Anlageklasse zu gering"
"Die Deutsche Bank http://www.deutsche-bank.de schließt ihre Abteilung """"Art Banking"""" und macht es damit der UBS gleich. Wie der Konzern bekannt gab"," will man den Zweig für Kunstkredite jedoch ausbauen. Die größte deutsche Bank möchte vermögende Kunden im Bedarfsfall bei Kunstfragen aber weiterhin beraten. Der Service soll den 7.000 Kunden im Private Wealth Management """"stärker gebündelt"""" erhalten bleiben"," so ein Sprecher.Ausbau im Geschäft mit Kunstkrediten""""Dass private wie institutionelle Anleger in Krisenzeiten verstärkt in Sachwerte investieren"," lässt sich pauschal nicht sagen. Außerdem eignet sich diese Anlageklasse nicht unbedingt zur Geldanlage. Schließlich sind die Transaktionskosten zum Teil sehr hoch und man muss den Zeitpunkt für einen lohnenden Verkauf abwarten""""", sagt Andreas Beck, Vorstand des Instituts für Vermögensaufbau http://www.institut-va.de , gegenüber pressetext. Der Insider führt die Einsparungen bei der Deutschen Bank margenbedingt auf die zu geringe Nachfrage zurück.Von dem aktuellen Schritt hingegen unbeeinflusst bleiben soll die Präsenz des Konzerns auf Messen. Stattdessen wolle man bisherige allgemeine Informationsveranstaltungen im Umfang zurückfahren. Bewerkstelligen will das Unternehmen die abgespeckte Kundenbetreuung künftig nur noch mit zwei Mitarbeitern. Mit von der Partie ist die bisherige Abteilungsleiterin Christina Schroeter-Herrel, schreibt das Handelsblatt. Kunstkredite aber will man ausbauen.Keine Zusammenlegung mit Sal. OppenheimUm das Geschäft mit Kunstkrediten zu forcieren, wurde innerhalb des Wealth Managements die Position des Art Leading Specialist für die globale Kundenbetreuung neu geschaffen. Die Deutsche Bank wittert lukrative Gewinnchancen. Denn in dem Segment sind bislang fast nur die großen Branchenplayer wie die Bank of America, die Citibank," Sotheby's sowie die New Yorker Art Capital Group aktiv. Letztere wird jedoch eher als besseres Pfandhaus gesehen.Der erst kürzlich über die Bühne gegangene Kauf der Privatbank Sal. Oppenheim soll bei der Reorganisation der Deutschen Bank aber keine Rolle spielen. So ist eine Zusammenlegung der kunstbezogenen Dienstleistungen für reiche Privatkunden der Deutschen Bank mit denen der neuen Tochter nicht vorgesehen. Der Deutschen Bank zufolge soll Sal. Oppenheim weiter unabhängig bleiben. Dies gelte auch für die Kunstsammlung und den Investmentprozess."""
"US-Behörden klagen Scareware-Betrüger an;""Trick mit falscher Antiviren-Software bringt Millionenprofite"
Das FBI hat bekannt gegeben, dass in den USA Anklage gegen drei Männer erhoben wird, die den zuständigen Ermittlern zufolge Nutzern weltweit mehr als 100 Mio. Dollar mit Scareware abgeknöpft haben. Das ist eine Form des Betrugs, bei der mit den Ängsten der User gespielt wird, um sie um ihr Geld zu erleichtern. Im konkreten Fall waren es angebliche Sanner," die das Finden von Fehlern oder Viren im System vorgaukeln. Damit wurden Usern angebliche Programme zur Problemlösung angedreht.Diese Taktik zählt laut FBI zu den """"schnellst wachsenden und gängigsten Formen des Internet-Betrugs"""". Das hängt sicherlich mit den enormen Profiten zusammen", die solche Machenschaften versprechen. Denn die Schadensumme, die den Angeklagten vorgeworfen wird, ist noch relativ gering. Trend Micro kommt in einer aktuellen Analyse zum Schluss, dass eine auf falsche Antiviren-Software (Fake-AV) spezialisierte Online-Gang jährlich 180 Mio. Dollar einnimmt.Falsche Anzeigen, falsche HilfsprogrammeDas Trio aus zwei US-Bürgern und einem Schweden war dem FBI zufolge an einem Betrug beteiligt, bei dem Nutzer mithilfe falscher Online-Werbung auf von den Cyberkriminellen kontrollierte Webseiten umgeleitet wurden. Pop-ups, die wie Systemmeldungen aussehen, spielen dem User vor, dass ein Systemscan auf kritische Fehler oder Malware gestoßen ist. Damit wurden Anwender gedrängt, die angeblichen Hilfsprogramme der Betrüger zu kaufen, um so die angeblichen Probleme zu beseitigen.Der Anklage zufolge haben die Cyberkriminellen auf diese Art Nutzern in gut 60 Ländern über eine Mio. nutzlose Software-Produkte andreht und den Geschädigten dabei 30 bis 70 Dollar pro Programm entlockt. Doch auch Internet-Unternehmen, welche die angeblichen Anzeigen geschaltet haben, wurden geschädigt. Denn die Scareware-Bande hat sie den Ermittlern zufolge dafür nie bezahlt. Die wenigstens 85.000 Dollar an vorenthaltenen Entgelten sind allerdings ein Klacks im Vergleich zum Schaden durch den eigentlichen Scareware-Betrug.Riesige SchattenindustrieScareware ist ein beliebter Gauner-Trick. Gerade Fake-AV ist einer Google-Schätzung zufolge bereits für mehr als die Hälfte aller verseuchten Werbeanzeigen verantwortlich (pressetext berichtete: http://www.pressetext.com/news/100415030/). Andere Spielarten umfassen beispielsweise die im Frühjahr erstmals beobachteten Copyright-Scanner, welche Nutzer mit Urheberrechts-Klagen wegen Filesharing drohen.Wenn dem User bei einem Scareware-Betrug nur Geld abgenommen wird, kann er sich noch glücklich schätzen. Denn wer beispielsweise ein falsches AV-Programm erwirbt, handelt sich oft einen echten Schädling ein. Im von Trend Micro untersuchten Fall wurden User via Botnet mit dubioser Werbung überschwemmt," was Teil des Schatten-Geschäftsmodells war. Den Log-Dateien eines Kontrollservers der Bande zufolge hat allein dieser Server über solche Werbe-Impressionen 25.000 Dollar pro Tag erwirtschaftet. Doch die Kriminellen dürften eine Vielzahl entsprechender Botnetze betreiben."""
"Aerosole beeinflussen Klimageschehen;""US-Forscher: Entdeckung vereinfacht Blick auf atmosphärische Partikel"
Die große Menge an organischen Aerosolen in der Atmosphäre weisen genügend Gemeinsamkeiten auf, so dass man sie in verschiedenen Gruppen zusammenfassen kann. Aerosole wie beispielsweise Russpartikel oder Pollen sind jene flüssigen oder festen Teilchen in unserer Luft," die wenige millionstel bis mehrere tausendstel Millimeter groß sind. Das Forscherteam um Colette Heald von der Colorado State University http://www.colostate.edu hat im Fachmagazin Geophysical Research Letters eine Studie zum Thema """"Vereinfachte Beschreibung der Evolution von organischen Aerosolen"""" publiziert. Dort werden grundlegende Erkenntnisse über die Klassifizierung der Partikel beschrieben.""""Die Hoffnung von uns ist"," die organischen Aerosole und ihre Wirkung auf das Klima auch für Klimamodelle genauer zu erfassen""""", so Heald. Genau dies stellt die Forscher bisher vor große Probleme," bestätigt auch der Aerosol-Forscher Ernest Weingartner vom Paul Scherrer Institut http://www.psi.ch im pressetext-Interview. """"Dass Aerosole klimawirksam sind", ist unbestritten. Wie stark sie allerdings wirken," ist ungenügend erforscht.""""Viele unbekannte Faktoren""""Im Vergleich zu den Treibhausgasen und ihren Auswirkungen"," steht man bei den Aerosolen immer noch relativ unwissend da""""", so der Forscher. Es gebe keinen Platz auf der Erde," an dem keine organischen Aerosole existieren. """"Die Quellen der Aerosole sind einerseits in der Natur selbst"," andererseits werden sie auch vom Menschen gemacht."""" Zahlreiche offene Fragen gebe es etwa nach der genauen Zusammensetzung. """"Bekannt ist"," dass Aerosole in der Luft oxidieren und sich dadurch verändern."""" """"Wir wissen", dass Aerosole bei der Wolkenbildung von zentraler Bedeutung sind. Das heißt, dass erhöhte Aerosolkonzentrationen die Eigenschaften der Wolken verändern, was wiederum einen Einfluss auf deren Lebenszeit," die Verteilung von Niederschlägen und die Lichtstreuung hat""""", erklärt Weingartner. Damit lasse sich die Klimarelevanz der Aerosole definieren. Die Aerosoleffekte haben aufgrund ihrer Komplexität bilden einen großen Unsicherheitsfaktor in den gegenwärtigen Klimamodellen. Klassifizierung nach HauptbestandteilDas US-Forscherteam, dem auch eine Gruppe der Harvard University, des Massachusetts Institute of Technology und der Universität von Sao Paulo angehört, interessiert sich vor allem für die negativen Auswirkungen der Aerosole auf den Menschen und die Umwelt. Untersucht wurden zum Beispiel Aerosole im Smog der Metropolen Los Angeles und Mexico-City," aber auch im nahezu unbesiedelten Regenwald im Amazonas. Das besondere Interesse galt dabei dem Verhältnis von Wasserstoff zu Kohlenstoff- und Sauerstoff zu Kohlenstoff in den untersuchten Proben. Heald klassifizierte die Aerosole - je nach Anteil ihrer Zusammensetzung - in Sauerstoff- und Wasserstoffgruppen. """"Es ist immer noch wichtig", dass wir den Unterschied verschiedener individueller Spezies in der Atmosphäre verstehen. Aus der Perspektive der Klimamodelle gibt es uns jedoch Hoffnung," dass wir die Beschreibung der organischen Aerosol-Zusammensetzung vereinfachen."""" Aufschlüsselung sehr schwierigWeingartner", der sich seit Jahrzehnten mit der Aerosol-Forschung beschäftigt," vergleicht die chemische Aufschlüsselung von Aerosolen mit einer explodierten Apotheke. """"Atmosphärische Aerosole setzen sich aus zahlreichen", unterschiedlichen chemischen Verbindungen zusammen," welche sich kaum genau zuordnen lassen."""" Ein Grund dafür liege in den Alterungsprozessen während der Lebensdauer dieser Aerosole - die von wenigen Tagen bis zu Monaten betragen kann."""
"3D-Offensive: Content ist entscheidender Faktor;""Panasonic will bis Ende des Jahres eine Million 3D-TVs verkaufen"
"Im Rahmen des Grand Slam Tennis Turniers """"French Open"""" in Paris hat Panasonic http://www.panasonic.eu/ eine 3D-TV-Offensive gestartet. """"Wir erwarten uns bis zum Ende des Jahres 2010 rund eine Million verkaufte 3D-TV-Sets weltweit""""", erklärte Laurent Abadie, CEO von Panasonic Europe und Executive Officer von Panasonic Corporation Japan, im Gespräch mit pressetext. Als Schlüssel zum Erfolg wird der entsprechende Content betrachtet. Sportübertragung in 3DLaurent-Eric Le Lay, Chairman and CEO der Eurosport Group, ist davon überzeugt," neben Tennis auch andere Sportarten 3D-tauglich übertragen zu können. """"Wir denken hier vor allem an Fußball", Basketball, Baseball," Golf aber auch Rugby""""", so Le Lay gegenüber pressetext. Die French Open aus Paris werden in Frankreich von Orange sowie von Eurosport europaweit in 3D übertragen. Konsumenten können das 3D-Erlebnis derzeit bei mehr als 3.000 Händlern verteilt über ganz Europa testen. Parallel dazu sollen 3D-Filme wie Avatar und der Games-Bereich das 3D-Segment pushen. Bis Ende 2010 erwarten Experten rund 50 3D-Filme auf Blu-ray.3D hat PotenzialFür Tom Morrod, Senior Analyst Head of TV Technology von Screen Digest, hat 3D jedenfalls das Potenzial," sich durchzusetzen. """"In den nächsten fünf Jahren erwarten wir 20 bis 25 Prozent Penetration von 3D-TV-Sets in Europa""""", so Morrod im pressetext-Interview. Der Run auf 3D wird laut Morrod jedoch noch ein bisschen auf sich warten lassen.Noch nicht voll zufriedenstellend ist der Komfort. Derzeit wird noch eine aktive 3D-Shutter-Brille benötigt - Panasonic arbeitet bereits an einer Lösung, um ohne Brille auszukommen. Wenig konkret ist jedoch der Zeitpunkt, wann diese Möglichkeit für die Konsumenten verfügbar sein wird. Fraglich ist auch, wie lange konzentriertes 3D-TV-Sehen möglich ist. Hier gehen die Meinungen der Experten auseinander. Fakt ist auch, dass nicht jeder Content 3D-tauglich ist und 3D-TV als zusätzliches Feature gesehen wird und nicht als Ersatz von Full-HD.Ab 2.500 EuroDie ersten Geräte sind europaweit bereits ausgeliefert worden. Derzeit gibt es zwei Modelle mit 50 bzw. 65 Zoll. Der TX-P50VT20 (50 Zoll) kostet rund 2.500 Euro. Die Geräte sind derzeit jedoch schwierig zu bekommen, da die erste Welle so gut wie ausverkauft ist," wie auch Abadie gegenüber pressetext bestätigt. Zur IFA will Panasonic dann ein 3D-Gerät mit 152 Zoll präsentieren."""
"Ausbildung zum Google Professional mit AdWords-Prüfung;""AdWords-Professionalisierung für Unternehmen und Agenturen 23.-25.6.2010"
"Vom 23. bis 25.6. findet wieder das erfolgreiche Spezial-Training """"Google AdWords Professional"""" statt. Zielgruppe sind alle", die bereits Erfahrung mit AdWords haben und ihre Kampagnen und ihr Wissen nun professionalisieren wollen. Das Training schließt mit der offiziellen Zertifizierungs-Prüfung von Google ab!Expertenwissen vom Bestseller-Autor Alexander Beck
Als Trainer fungiert Alexander Beck," Autor des Bestsellers """"Google AdWords""""", der auf Amazon hervorragende Rezensionen vorweisen kann. Er gibt seine jahrelange Erfahrung mit internationalen Kunden und bei der Optimierung von komplexen Kampagnen an die Teilnehmer weiter und bereitet sie so ideal auf folgende Dinge vor:
* Die richtige Strategie und das richtige SEM-Konzept
* Die Optimierung von Kampagnen
* Die AdWords-Prüfung, die am letzten Tag abgelegt werden kannAuch Agenturen nehmen teil
Die Qualität des Trainings wird dadurch bestätigt, dass auch Agenturen ihre Mitarbeiter anmelden. Es werden Optimierungs-Tipps und -Konzepte vermittelt, die sogar Profis beim Arbeiten für ihre Kunden deutlich weiterhelfen.100% Erfolgsquote dank niedriger Teilnehmerzahl
