title;text

Das Pence-Team zoffte sich bis kurz vor Debattenbeginn mit den unabhängigen Organisatoren der TV-Debatten. Pence (Nebenjob: Leiter des Anti-Corona-Arbeitsstabs im Weißen Haus) lehnte die Installation einer Plexiglaswand aus Schutz vor Covid ab. Am Dienstag stimmte er dann doch zu. Dreieinhalb Meter sollen Pence und Harris voneinander entfernt sitzen. Harris war von Anfang an für diese Distanz.

Hier können Sie unsere WELT-Podcasts hören Wir nutzen den Player des Anbieters Podigee für unsere WELT-Podcasts. Damit Sie den Podcast-Player sehen können und um mit Inhalten aus Podigee und anderen sozialen Netzwerken zu interagieren oder diese darzustellen, brauchen wir Ihre Zustimmung. Soziale Netzwerke aktivieren

Mit gutem Grund: Pence hatte an der Präsentation von Trumps Kandidatin für den Supreme Court am 26. September im Rosengarten des Weißen Hauses teilgenommen. Dieses Ereignis erwies sich seither als Corona-Superspreader-Event. Mindestens zehn Teilnehmer sind inzwischen positiv auf Corona getestet.

Über Corona dürfte gewiss geredet werden in Salt Lake City," und über den Umgang des Präsidenten mit seiner Infektion erst recht."""
EU-Staaten ringen um Migrationspolitik – „Der Wille ist da“;
Wenn Menschen „unversicherbar“ werden;
„Und was machen wir dann mit den Menschen?“;
"Jäger und Sammler sitzen so viel herum wie wir – aber anders;""Auf der Couch", vor dem Computer, im Auto – das viele Sitzen macht uns krank. Die Hadza in Tansania verbringen ähnlich viel Zeit in sitzenden Positionen, aber bleiben fit dabei. Warum? Eine neue Studie klärt auf.

Anzeige

Es besteht kein Zweifel, wir sitzen zu viel. Der durchschnittliche Deutsche sitzt pro Tag etwa sieben bis neun Stunden, wie unterschiedliche Studien zeigen. Das Dauersitzen macht uns krank. Übergewicht, Rückenprobleme und erhöhte Risiken für Krebs, Diabetes und Herz-Kreislauf-Erkrankungen gehören zu den Folgen.

Aus evolutionsbiologischer Sicht stellt sich nun eine Frage: Wie kann ein Verhalten, das evolutionär grundsätzlich sinnvoll ist, so gesundheitsschädlich sein? Schließlich verbraucht der Körper in ruhenden, nicht aufrechten Positionen nur wenig Energie, was im Überlebenskampf ein Vorteil ist.

Um Antworten zu finden, hat ein Team von US-Biologen in einer aktuellen Studie die Gewohnheiten der Hadza untersucht. Die Volksgruppe ist eine der weltweit letzten Gemeinschaften, die naturnah als Jäger und Sammler lebt. Das überraschende Ergebnis:

Anzeige

Die Hadza verbringen pro Tag neun bis zehn Stunden in ruhenden Positionen – doch es macht sie nicht krank.





Der Stamm umfasst etwa tausend Menschen, die im Norden Tansanias leben, dies zum Teil wie unsere Vorfahren vor Zehntausenden von Jahren. Sie jagen mit Pfeil und Bogen, sammeln Früchte und Pflanzen, betreiben keinen Ackerbau und lagern keine Nahrungsmittel.

Anzeige

Die Forschergruppe um David Raichlen begleitete 28 Männer und Frauen mit einem Durchschnittsalter von Ende 30.

Die Probanden leben in einer traditionellen Siedlung, weit entfernt von Dörfer, ernähren sich fast vollständig von natürlicher Nahrung und haben ein geringes Risiko für Herz-Kreislauf-Erkrankungen.





Die Teilnehmer wurden mit Geräten ausgestattet, die Beschleunigung messen und somit Auskunft geben über die Aktivität ihrer Träger. Es zeigte sich, dass die Hadza täglich etwa eine Stunde hochaktiv waren – und sehr lange Ruhephasen einlegten.

Anzeige

Diese Phasen der Inaktivität verbrachten sie allerdings nicht auf einer Couch oder einem Schreibtischstuhl, sondern oft in hockender oder kniender Position.

Wer einmal längere Zeit in einer der Positionen verbracht hat, weiß: Das ist auf Dauer durchaus anstrengend. Das bestätigen auch Ergebnisse aus der Studie. Die Forscher hatten mit einem weiteren Gerät die Muskelaktivität in den Unterschenkeln der Probanden gemessen.

Da auch geringe Level von Muskelaktivität Energie brauchen, könnten Hocken und Knien weniger schädlich sein, als im Stuhl zu sitzen.

Danach wäre es also nicht das Problem, dass wir so viel Zeit des Tages in ruhenden Positionen verbringen, sondern die Positionen selbst. Wenn wir auf dem Sofa oder am Schreibtisch sitzen, verbraucht der Körper extrem wenig Energie. Gleichzeitig fehlen vielen Menschen die Phasen von hoher Aktivität, wie sie das Leben der Hadza auszeichnen.

Nicht umsonst raten Experten daher auch, lange Sitzphasen immer wieder zu unterbrechen. Kurz aufstehen, dehnen, strecken, einmal in die Küche laufen – all das kann helfen, die Gesundheitsschäden des Dauersitzens zu reduzieren.

Ob es allein oder vor allem der höhere Aktivitätslevel ist, der die Hadza vor einigen der Zivilisationskrankheiten bewahrt, ist offen. Die Ernährung dürfte ebenfalls eine große Rolle spielen.

Es ist nachgewiesen, dass die moderne westliche Ernährungsweise, die einen hohen Anteil an Tierprodukten, hochverarbeiteten Nahrungsmitteln, Fett und Zucker aufweist, ein wichtiger Risikofaktor für die genannten Krankheiten ist.

"Dieser Artikel wurde erstmals im März 2020 veröffentlicht."""
"Als das Jahr noch 372 Tage hatte;""Anzeige"

Ein Jahr ist die Zeitspanne, die der Planet Erde auf seiner Bahn um die Sonne benötigt, um sie einmal zu umrunden. Diese Umlaufzeit hat sich im Laufe der Jahrmillionen praktisch nicht verändert. Sie ergibt sich nach den Gesetzen der Himmelsmechanik aus den Massen von Sonne und Erde, deren zeitliche Veränderungen aber so klein sind, dass sie vernachlässigt werden können.

Die Erde fängt kontinuierlich Materie aus dem All in Form von Kometen und Asteroiden ein und wird dadurch etwas schwerer. Die Sonne verliert indes bei ihrer Energieproduktion an Masse und wird mithin leichter. Dieser Masseverlust wird in den kommenden 4,5 Milliarden Jahren, also der Restlebensdauer der Sonne, insgesamt nicht einmal ein Promille ihrer heutigen Masse ausmachen.

Kurzum: Ein Jahr war, ist und bleibt ein Jahr.

Anzeige

Ganz anders sieht es mit der Dauer eines Erdentages aus. Das ist die Zeit, die unser Planet für eine Rotation um die eigene Achse benötigt. Diese Drehgeschwindigkeit hat sich im Laufe der Erdgeschichte verändert – sie ist langsamer geworden. Der Grund dafür ist die Existenz des Mondes, der mit seiner Gravitationskraft die Gezeiten auf der Erde erzeugt. Die Gezeitenreibung entzieht dem Erde-Mond-System Energie, was zum einen die Rotationsgeschwindigkeit der Erde reduziert und zum anderen den Abstand zwischen Erde und Mond immer weiter vergrößert. Beide Effekte lassen sich heute mit hochpräzisen Messmethoden quantifizieren: Der Mond entfernt sich von uns mit knapp vier Zentimetern pro Jahr, und die Dauer eines Erdentages vergrößert sich dazu passend um rund 20 Millionstel Sekunden pro Jahr.

Lesen Sie auch Erdmagnetfeld Eine Umpolung in nur 100 Jahren ist möglich

Lesen Sie auch Brand Story Naturschutz Er schützt den Urwald mit alten Handys Anzeige

Diese Rate der Entschleunigung bei der Erdrotation kann aber nicht über die zurückliegenden Jahrmilliarden konstant gewesen sein. Denn wenn man die Änderung des Abstands mit dieser Geschwindigkeit zurückrechnet, ergibt sich, dass der Mond noch vor 1,4 Milliarden Jahren Teil der Erde gewesen sein müsste. Das Duo ist aber schon deutlich länger gemeinsam unterwegs.

Bis heute ist eine offene wissenschaftliche Frage, wie sich die Erdrotation und damit der Abstand des Mondes seit der Entstehung dieses Tandems im Detail entwickelt haben. Je nach Theorie soll ein Tag auf der Urerde 14 oder auch nur sechs Stunden gedauert haben. Wird man das jemals klären können?

Anzeige

Wie lange ein Tag vor 70 Millionen Jahren gedauert hat, also zu jener Zeit, als die Dinosaurier ausgestorben sind, weiß man jetzt allerdings ziemlich genau. Eine aktuelle Studie belegt, dass damals die Erde noch so schnell rotierte, dass ein Tag bereits nach 23,5 Stunden zu Ende war. Oder noch präziser ausgedrückt: damals hatte ein Jahr 372 Tage, statt heute 365. Wie konnten Forscher das so genau ermitteln? Ein in den Bergen von Oman gefundenes Fossil eines Meeresorganismus hat es möglich gemacht.

Wissenschaftler um den Geochemiker Niels de Winter von der Vrije Universiteit in Brüssel konnten zum einen das Alter der fossilen Mollusken (torreites sanchezi) auf rund 70 Millionen Jahre datieren. Zum anderen gelang es ihnen, die Zahl der „Tagesringe“ pro Jahr zu ermitteln. Ähnlich wie bei den Jahresringen der Bäume unterliegt nämlich der Stoffwechsel dieser Mollusken tageszeitlichen Schwankungen, die sich im Fossil in periodischen Verhältnissen der Konzentration von Magnesium zu Calcium, von Strontium zu Calcium, von Magnesium zu Lithium und von Strontium zu Lithium zeigen.

Lesen Sie auch Erdmagnetismus Wie der wandernde Nordpol unsere Smartphones beeinflusst

Jeden Tag produzierte das Tier in seiner Schale einen 40 Mikrometer dicken Ring. Durch deren Analyse hatten die Forscher also das Maß für einen Tag. Doch damit weiß man noch nicht, wie viele dieser Ringe in einem Jahr entstanden sind. Den Wissenschaftlern gelang es jedoch, auch jahreszeitliche Einflüsse auf den Stoffwechsel zu analysieren und so zu ermitteln, wie viele Tagesringe innerhalb eines klimatischen Jahres produziert worden sind.

Anzeige

Frühere Untersuchungen von Wachstumsringen fossiler Meeresorganismen hatten ergeben, dass vor 400 Millionen Jahren ein Jahr ungefähr 400 Tage hatte. Das ist ein weiterer Schnappschuss von der Dauer früherer Erdentage. Das Team von de Winter ist nun optimistisch, dass sich mit ihrer ultrapräzisen, laserbasierten Analysemethode künftig noch ältere Fossile analysieren lassen, sodass die Rotationsgeschwindigkeit der Erde in noch tieferer Vorzeit bestimmt werden kann. Bis an den Anfang der Erdgeschichte wird man mit der Analyse von Meerestieren allerdings nicht vordringen können.

"Dieser Artikel wurde erstmals im März 2020 veröffentlicht."""
„Wenn du ‘ne Million findest," bring mit!“;""Jahrelang sitzt der obdachlose Gabriel in Köln auf der hippen Ehrenstraße. So ist er eine kleine Berühmtheit geworden. Jetzt ist er tot. Fotograf Sebastian Trägner dokumentierte Gabriels Leben und dessen Weisheiten."

Anzeige

Auf der Ehrenstraße in Köln herrscht oft geschäftiges Treiben. Die Straße befindet sich im Herzen der Domstadt und ist für ihre hippen Bekleidungsgeschäfte und Cafés bekannt. Im „Café de Paris“ zeigen sich nicht selten Größen aus der Z-Prominenz. Wer bis vor Kurzem die Ehrenstraße in Richtung Hauptbahnhof runterlief, kam zwangsläufig an Gabriel vorbei. Gabriel war obdachlos und der Liebling der Straße. Es war kein ungewöhnlicher Anblick, wenn sich Passanten neben ihn setzten, um mit ihm zu reden. Seine Gesprächspartner schätzten, dass Gabriel aufmerksam war und sich ihre Hobbys und Leidenschaften merkte. Die ikonische Gabriel-Pose, mit Becher und Zeitung auf der Stufe vor einer Tür sitzend, änderte sich im Laufe der Jahre selten. Jetzt ist Gabriel tot, vermutlich verstarb er an einer Blutvergiftung. Köln ist so um eine lokale Berühmtheit ärmer.
