title;text

Anzeige Funkgerät Walkie-Talkie Set von AceLife jetzt online kaufen

Walkie-Talkies für größere Kinder

Wenn Ihr Kind allerdings bereits etwas älter ist und Sie ihm möglicherweise ein Gerät schenken wollen, das es noch länger nutzen kann, beziehungsweise Sie ein hochqualitatives Set für die ganze Familie suchen, könnten Sie anstatt eines Mini-Walkie-Talkies auch ein reguläres Modell kaufen. Hier kommt zum Beispiel das Midland G9* in Frage. Dieses gibt es auch im Set mit Koffer, Akkus Ladegerät und Headset. Technisch bietet es weit mehr Möglichkeiten bietet als die Kindermodelle.

Anzeige Funkgerät G9 Pro Funkset von Midland jetzt online kaufen

Deutlich günstiger, aber ebenfalls für größere Kinder und Erwachsene geeignet, ist das Outdoor-Set von DeTeWe* – das neben Akkus, einem Koffer und Gürtelclips auch zwei Headsets beinhaltet.

Anzeige Funkgerät Outdoor Funkset von DeTeWe jetzt online kaufen





*Dieser Text enthält Affiliate Links. Das bedeutet: Sollten Sie über die mit einem Stern gekennzeichneten Links einen Kauf abschließen, erhält WELT eine kleine Provision. Die Berichterstattung beeinflusst das nicht. Unsere Standards der Transparenz und journalistischen Unabhängigkeit finden Sie unter axelspringer.de/unabhaengigkeit.

"Dieser Artikel wurde erstmals am 17. Januar 2020 veröffentlicht."""
"Diese Geräte sorgen für blitzsaubere Böden;""Anzeige"

Hausarbeit macht nicht jedem Spaß – vor allem, wenn kleine Kinder oder Tiere im Haushalt leben, ist es erforderlich, häufig zu staubsaugen oder zu wischen. Saugroboter mit Wischfunktion können einem gleich zwei Aufgaben abnehmen – die Geräte inspizieren auf Knopfdruck oder nach einem zuvor eingestellten Reinigungsprogramm den Boden und beseitigen so automatisch Schmutz. Wenn auch Sie sich einen Saug-Wisch-Roboter zulegen möchten, haben wir hier einige Tipps für Sie, worauf beim Kauf zu achten ist und welche Produkte sich als wirklich hilfreich erweisen.

Anzeige Jetzt Prime gratis testen und Schnäppchen finden

Saugroboter mit Wischfunktion: Die wichtigsten Vorteile

Darum kann die Anschaffung eines Saug-Wisch-Roboters für Sie sinnvoll sein:

zeitsparende Reinigung in einem Durchgang

noch mehr Sauberkeit als beim bloßen Saugen

automatisierte Reinigung auf Knopfdruck oder nach Programmierung

für viele Bodentypen geeignet

Staubsauger-Roboter mit Wischfunktion: Worauf sollte man beim Kauf achten?

Saugen und wischen gleichzeitig: Roboter sind heute effizienter denn je – zumindest in der Theorie. Denn um ein gutes und für Ihre Bedürfnisse passendes Gerät zu erwerben, sollten Sie unbedingt einige Punkte beachten.

Anzeige

Passend für den Bodentyp: Achten Sie in der Produktbeschreibung darauf, ob das Gerät für die Reinigung Ihres Bodens geeignet ist. Viele Holzfußböden sollten nebelfeucht gewischt werden, einige Geräte wischen allerdings nass. Bei manchen Saugrobotern mit Wischfunktion lässt sich die Wasserabgabe allerdings individuell anpassen.

Ausreichend Power: Eine hohe Saugleistung ist entscheidend: Können größere Schmutzpartikel nicht aufgenommen werden, kann das Gerät sie mitschleifen und so Kratzer im Boden hinterlassen.

Die richtige Ausstattung: Bei Parkett ist besondere Vorsicht geboten: Saug-Wisch-Roboter, die mit einem Mikrofasertuch arbeiten, könnten feine Kratzer im Boden hinterlassen. Zudem ist wichtig, dass die Geräte in der Wischfunktion nicht ständig Wasser abgeben, wenn sie sich länger an einer Stelle befinden (zum Beispiel bei Spot-Reinigung oder wenn sie sich festgefahren haben). Dies könnte sonst zu unschönen Wasserflecken auf dem Holzboden führen.

Anzeige

Beachten Sie beim Kauf außerdem den Unterschied zwischen Wisch- und Saugroboter sowie einem Kombi-Gerät. Einige Produkte (zum Beispiel der Wischroboter von iRobot*) sind ausschließlich zum Wischen geeignet, während Saugroboter wie das Gerät von eufy* nur zum Saugen von Böden dienen.

Anzeige Nassreinigung Braava 390t von iRobot jetzt online kaufen

Anzeige Trockenreinigung Eufy Saugroboter RoboVac 11S jetzt online kaufen

Smarte Funktionen: Wenn Sie den Haushaltshelfer auch von unterwegs steuern möchten, kommt ein Saug-Wisch-Roboter mit WLAN und App-Funktion für Sie infrage.

Saugroboter mit Wischfunktion: Die beliebtesten Modelle

Mit dem günstigen Saug- und Wischroboter von Medion* erhalten Sie ein Gerät, das sich dem Hersteller zufolge auf Hartböden, dünnen sowie hochflorigen Teppichen, Fliesen und Laminat nutzen lässt und dort zuverlässig Staub, Pollen, Tierhaare und Schmutz entfernen kann. Dank des auffüllbaren Wassertanks und dem angebrachten Mikrofasertuch wischt das Gerät auf Wunsch auch durch, um nach getaner Arbeit selbständig an seine Ladestation zu fahren.

Anzeige Saug- & Wischroboter Medion MD 18501 jetzt online kaufen

Anzeige

Ähnlich funktioniert auch das Gerät von ZACO*, Der Wischroboter mit Wassertank und Saugbehälter kann insgesamt 180 Quadratmeter am Stück reinigen. Durch die Spot-Funktion können auch stärker verschmutzte Stellen gründlich gesäubert werden. Zudem ist die Timer-Funktion praktisch – stellen Sie eine gewünschte Zeit ein, damit das Gerät beispielsweise reinigen kann, während Sie unterwegs sind.

Anzeige Saug- & Wischroboter ZACO V5sPro jetzt online kaufen

Ein smarter Saugroboter mit Wischfunktion hat WLAN und kann über eine App betrieben werden – so wie der Proscenic 830 T*. Durch die Verbindung zum kabellosen Heimnetzwerk kann der Haushaltshelfer per App gesteuert werden. Zudem hört er auf Alexa-Befehle – über den Sprachassistenten können Sie das Gerät starten und stoppen, Reinigungspläne erstellen sowie den Modus wechseln. Besonders nützlich: Dank der Teppicherkennung schaltet der Wisch-Saug-Roboter automatisch in einen stärkeren Saugmodus. Auch die Abgabe aus dem Wassertank lässt sich anpassen.

Anzeige Saug- & Wischroboter Proscenic 830T jetzt online kaufen

Ein besonders saugstarker Helfer ist das Premium-Produkt von roborock* – der hohe Preis kann sich dank einiger zusätzlicher Features allerdings auszahlen: Das Gerät schützt sich selbst vor dem Festfahren. So können Sie auch eine punktuelle Wasserabgabe und dadurch entstehende Parkettschäden beim Wischen vermeiden. Mit einer Akkuladung können zudem gleich mehrere Räume gereinigt werden und mit der Bedien-App lassen sich praktische Sperrzonen einrichten.

Anzeige Saug- & Wischroboter roborock S6 von Xiaomi jetzt online kaufen





Dieser Artikel wurde erstmals am 27.01.2020 veröffentlicht.

*Dieser Text enthält Affiliate Links. Das bedeutet: Sollten Sie über die mit einem Stern gekennzeichneten Links einen Kauf abschließen," erhält WELT eine kleine Provision. Die Berichterstattung beeinflusst das nicht. Unsere Standards der Transparenz und journalistischen Unabhängigkeit finden Sie unter axelspringer.de/unabhaengigkeit."""
Zwillinge sollten die Arbeit am Samstag ausblenden;Sie wollen wissen, wie die Sterne am Samstag und Sonntag für Sie stehen? Unser Wochenendhoroskop verrät, was Sie am 8. und 9. August erwartet und welche Entscheidung Sie weiterbringen kann.
"An Kroos ist die wohl bitterste Erfahrung seiner Karriere abgeperlt;""Real Madrid tritt im Achtelfinale der Champions League in Manchester an. Im Hinspiel gegen City im Februar schmorte Toni Kroos 90 Minuten auf der Bank. Doch der deutsche Mittelfeldspieler rächte sich damals hintersinnig an seinem Trainer."

Anzeige

Toni Kroos hat sich nie von Kritiken beeindrucken lassen. Was ihn schon jung auszeichnete, hat er als mittlerweile 30-Jähriger perfektioniert.

In Podcasts gibt er sich betont ohne Filter, die Breitseiten in seiner Wahlheimat Spanien für Zweifel am Gehaltsverzicht in der Corona-Krise („Wie eine Spende ins Nichts”) waren so schnell passé, wie er mit unanfechtbaren Leistungen zu Real Madrids Meisterschaft beitrug.

Im Rückspiel des Champions-League-Achtelfinals treffen Toni Kroos und Real Madrid auf Manchester City. Mittlerweile ist der Deutsche wieder gesetzt Quelle: dpa/Uwe Anspach

Und auch die üblichen Nörgler in den sozialen Netzwerken entwaffnet er mit unangestrengter Ironie. „Kroos ist so was von überschätzt, Mann”, schrieb gerade ein Fan. „Ja, aber sag’s keinem weiter”, antwortete der Spieler.

