title;text
Spanien hat als erstes Land der Europäischen Union die Marke von 900.000 Coronavirus-Infektionen überschritten. Seit Beginn der Pandemie seien mehr als 908.000 Infektionen registriert worden, teilte das spanische Gesundheitsministerium mit. Spanien hat knapp 45 Millionen Einwohner. Offiziellen Angaben zufolge wurden mehr als 33.000 Todesfälle in Zusammenhang mit dem Virus registriert. Gesundheitsexperten glauben, dass die tatsächliche Zahl deutlich höher liegt, jedoch nicht ausreichend getestet wird.

An dieser Stelle finden Sie Inhalte von Drittanbietern Um mit Inhalten von Drittanbietern zu interagieren oder diese darzustellen, brauchen wir Ihre Zustimmung. Externe Inhalte aktivieren

Anzeige

In Großbritannien mit 66,6 Millionen Einwohnern haben sich innerhalb von 24 Stunden nachweislich knapp 20.000 Menschen mit dem Coronavirus angesteckt. Das entspricht einem Anstieg von etwa 2500 im Vergleich zum Vortag. 137 Menschen sind an einer Covid-19-Erkrankung gestorben, wie die Gesundheitsbehörden am Mittwoch mitteilten. Besonders stark betroffen von der Pandemie sind der Norden Englands, Nordirland, Schottland und Teile von Wales. Die tatsächliche Zahl der Neuinfektionen dürfte aber noch höher liegen, da nicht genügend Tests zur Verfügung stehen. Der britische Gesundheitsminister Matt Hancock rief für London die zweithöchste Corona-Warnstufe aus. Er begründete dies am Donnerstag im Unterhaus mit rasch steigenden Infektionsraten in der Hauptstadt. Schnelles Handeln sei erforderlich, um das Virus unter Kontrolle zu bekommen, sagte er.

Angesichts rapide steigender Infektionszahlen dürfen sich Angehörige verschiedener Haushalte demnach in Innenräumen nicht mehr treffen, wie der Londoner Bürgermeister Sadiq Khan am Donnerstag bekannt gab. Auch Treffen in Pubs oder Restaurants sind nicht erlaubt, während sie in Grünanlagen gestattet bleiben. Schulen und der Einzelhandel bleiben geöffnet.

Millionen Bewohner Nordenglands warten darauf, zu erfahren, ob sie unter die strengsten Corona-Regeln fallen. Für Liverpool wurden diese bereits angeordnet. Seit dieser Woche gibt es in Großbritannien ein dreistufiges Corona-Warnsystem.

An dieser Stelle finden Sie Inhalte von Drittanbietern Um mit Inhalten von Drittanbietern zu interagieren oder diese darzustellen, brauchen wir Ihre Zustimmung. Externe Inhalte aktivieren

Die Zahl der registrierten Neuinfektionen binnen 24 Stunden stieg am Mittwoch in Portugal mit 10,3 Millionen Einwohnern auf 2072 – das war der höchste Wert seit Beginn der Pandemie. Die Gesamtzahl der Fälle kletterte den amtlichen Angaben zufolge auf mehr als 91.000. Die Zahl der Menschen, die an Covid-19 starben, stieg um sieben auf 2117. Besonders betroffen sind der Norden und der Großraum Lissabon. Sorge bereitet vor allem die Tatsache, dass die Zahl der in Krankenhäusern behandelten Covid-19-Patienten in etwas mehr als einem Monat von gut 300 auf nun fast 1000 in die Höhe schoss.

Frankreichs Corona-Karte färbt sich immer tiefer rot

In Frankreich mit seinen knapp 67 Millionen Einwohnern haben die Gesundheitsbehörden 22.591 Neuinfektionen binnen 24 Stunden registriert. Es ist das dritte Mal in sechs Tagen, dass das Gesundheitsministerium einen Wert über 20.000 mitteilt. Insgesamt seien 779.063 Infektionsfälle verzeichnet worden. Die Zahl der Todesfälle in Kranken- und Pflegeheimen sei um 104 auf 33.037 gestiegen. Damit ist Frankreich weltweit das neunte Land weltweit, das mehr als 33.000 Todesfälle in Zusammenhang mit dem Coronavirus zu beklagen hat.

Zwar sank die Zahl der Neuinfektionen seit vergangenem Wochenende, wo zuletzt ein Rekordhoch von knapp 27.000 am Samstag verzeichnet wurde. Dennoch steigen die Infektionszahlen gegenüber der vergangenen Woche massiv. Die Karte des französischen Gesundheitsministeriums, auf der die Corona-Hotspots in Scharlachrot (auf Französisch „rouge écarlate“) markiert werden, färbt sich deshalb immer tiefer rot.

An dieser Stelle finden Sie Inhalte von Drittanbietern Um mit Inhalten von Drittanbietern zu interagieren oder diese darzustellen, brauchen wir Ihre Zustimmung. Externe Inhalte aktivieren

Dazu gehören mit der Hauptstadt Paris inzwischen neun Ballungsräume und ein Überseegebiet. Der Großraum Marseille, zu dem auch Aix-en-Provence zählt, ist ebenso betroffen wie die Großstädte Lyon, Grenoble, Saint-Etienne, Lille, Toulouse und Montpellier. Dazu gehört auch die Inselgruppe Guadeloupe in der Karibik.

Anzeige

In Bulgarien mit seinen sieben Millionen Einwohnern liegt die Zahl der neuen Positiv-Tests das vierte Mal binnen einer Woche auf Rekordniveau. Die Zahl der Fälle steigt nach offiziellen Daten um 785 auf insgesamt 25.774. Bislang starben 923 Menschen, die positiv auf das Coronavirus getestet wurden. Aktuell befinden sich 1307 Menschen in Krankenhäusern, 63 davon auf Intensivstationen.

In Tschechien meldet das Gesundheitsministerium 8325 neue Positiv-Tests. Das ist der bislang zweithöchste Wert in dem Land mit 10,7 Millionen Einwohnern, die meisten neuen Fälle gab es am vergangenen Freitag. Die Gesamtzahl der Fälle in Tschechien liegt inzwischen bei 129.747. Bislang starben 1106 Menschen, die positiv getestet wurden. Zu Monatsbeginn waren es noch 696 Todesfälle.

Rekorde in Polen und Kroatien

In Polen überschritt die Zahl der täglichen Neuinfektionen mit dem Coronavirus erstmals die Marke von 6000. Innerhalb von 24 Stunden kamen 6526 neue Fälle hinzu, die meisten davon in der Region um die Hauptstadt Warschau (1188). Das teilte das polnische Gesundheitsministerium am Mittwoch mit. Im gleichen Zeitraum starben 116 Menschen in Zusammenhang mit dem Virus. Seit Beginn der Pandemie gab es in Polen 3217 Todesfälle in Verbindung mit einer Covid-19-Erkrankung. Das Land hat rund 38 Millionen Einwohner. Polen ist das einzige Nachbarland Deutschlands, das bisher vom Auswärtigen Amt in Berlin noch nicht ganz oder teilweise als Risikogebiet eingestuft wurde.

Im EU-Land Kroatien verzeichneten die Behörden am Mittwoch einen Rekordwert an neuen Infektionen mit dem Coronavirus. In den vergangenen 24 Stunden sei bei 748 Menschen Sars-CoV-2 nachgewiesen worden, teilte der Krisenstab der kroatischen Regierung mit. Die bisher höchste Zahl von 542 Neuinfizierten hatte der Krisenstab am 8. Oktober registriert. Vier Menschen starben demnach in den letzte 24 Stunden in Verbindung mit einer Covid-19-Erkrankung. Seit Beginn der Pandemie im Februar haben sich in dem 4,2-Millionen-Einwohner-Land nachweislich 21.741 Menschen mit dem Coronavirus angesteckt. 334 Patienten starben mit dem Virus. Am Mittwoch wurden 441 Patienten im Krankenhaus behandelt, 27 von ihnen wurden künstlich beatmet.

Russland mit seinen 144,5 Millionen Einwohnern meldet einen Rekord an Neuinfektionen. Binnen der letzten 24 Stunden gibt es 14.231 weitere Coronavirus-Fälle. Die Gesamtzahl der Infektionen steigt damit auf 1,34 Millionen. Weitere 239 Menschen starben, wodurch sich die Zahl der Todesfälle auf 23.205 erhöht.

In Brasilien mit seinen 209,5 Millionen Einwohnern sterben nach Angaben des Gesundheitsministeriums 749 Menschen nach einer Infektion mit dem Coronavirus. In den vergangenen 24 Stunden sei die Zahl der positiv Getesteten um 27.235 auf 5.140.863 gestiegen. Insgesamt sind 151.747 Menschen an den Folgen der Ansteckung gestorben.

In Südkorea sind 110 neue Infektionen mit dem Coronavirus registriert worden. Die Hälfte der Fälle stehe in Verbindung mit einem Krankenhaus in der Stadt Busan, teilte die südkoreanische Behörde für Krankheitskontrolle und -prävention am Donnerstag mit. In dem Land mit gut 51 Millionen Einwohner liegt die offizielle Zahl der Fälle damit bei fast 25.000.

Mindestens 54 der Neuinfektionen stünden mit dem Krankenhaus für Ältere in Verbindung. Mehr als 40 seien in der dicht bevölkerten Metropolregion Seoul verzeichnet worden, mit Verbindungen zu Krankenhäusern, Kirchen, Schule und Büros.

Anzeige

Alle aktuellen und weltweiten Entwicklungen zum Coronavirus können Sie in unserem Live-Ticker verfolgen.

"Haben Sie Fragen zum Coronavirus? Hier finden Sie die wichtigsten Fakten und Informationen."""
Strandfeeling – Mann kauft Insel im Ruhrgebiet;
"„Der größte Schiffbruch vor der Küste Libyens in diesem Jahr“;""Ein Boot mit mehr als 40 Migranten an Bord ist auf dem Weg über das Mittelmeer gekentert. Mindestens 45 Menschen starben. Es ist das Bootsunglück mit den meisten Toten auf dem Mittelmeer in diesem Jahr."

Anzeige

Bei einem Schiffsunglück vor der Küste Libyens sind mindestens 45 Menschen gestorben. Das Unglück sei damit „der größte registrierte Schiffbruch vor der Küste Libyens in diesem Jahr“, teilten das Flüchtlingshilfswerk der Vereinten Nationen (UNHCR) und die Internationale Organisation für Migration (IOM) am Mittwoch mit. Unter den Opfern sollen auch fünf Kinder gewesen sein.

Etwa 37 Überlebende – hauptsächlich aus Senegal, Mali, Tschad und Ghana – wurden von einheimischen Fischern gerettet und bei der Ankunft an Land festgenommen, wie IOM mitteilte. Ihren Berichten zufolge war der Motor des Schiffes vor der Küste der nordwestlichen Stadt Zuwara explodiert.

Die beiden Organisationen fordern eine sofortige Überprüfung des Vorfalls sowie einen Ausbau der Such- und Rettungskapazitäten vor Ort. „Wir befürchten, dass viele Menschenleben verloren gehen, wenn die Rettungskapazität nicht erhöht wird“, schrieb der Sprecher des UN-Flüchtlingshilfswerks (UNHCR), Charlie Yaxley, auf Twitter. Nichtregierungsorganisationen sollten uneingeschränkt arbeiten dürfen.

Lesen Sie auch Minderjähriger Migrant Fünf Monate im Elend von Moria

Anzeige

„Wir fordern die Staaten nachdrücklich auf, rasch auf diese Zwischenfälle zu reagieren und den auf See geretteten Menschen systematisch einen berechenbaren Hafen der Sicherheit zur Verfügung zu stellen“, schrieben IOM und UNHCR. In den vergangenen Monaten sei es immer wieder zu inakzeptablen Verzögerungen und ausbleibender Hilfeleistung gekommen. Das gefährde unnötig Menschenleben. IOM-Sprecherin Safa Msehli erinnerte die Staaten daran, dass sie nach dem Völkerrecht verpflichtet sind, Zivilisten zu schützen.

An dieser Stelle finden Sie Inhalte aus Twitter Um mit Inhalten aus Twitter und anderen sozialen Netzwerken zu interagieren oder diese darzustellen, brauchen wir Ihre Zustimmung. Soziale Netzwerke aktivieren

Überfahrt in seeuntüchtigen Gummibooten

Libyen ist zu einem wichtigen Transitland für Migranten geworden, die vor Krieg und Armut nach Europa fliehen wollen. In dem Land herrscht seit dem mit westlicher Hilfe erfolgten Sturz des Langzeitherrschers Muammar al-Gaddafi im Jahr 2011 Bürgerkrieg. Die meisten Migranten wagen die gefährliche Überfahrt nach Europa in seeuntüchtigen Gummibooten.

Tausende wurden abgefangen und nach Libyen zurückgebracht. Bei Rückführungen nach Libyen kamen in diesem Jahr nach Angaben der beiden Organisationen mindestens 302 Migranten und Flüchtlinge ums Leben. Die tatsächliche Zahl der Todesopfer wird viel höher geschätzt.

Anzeige

Andere Flüchtlinge wagen die Route Richtung Kanaren. Auf der Suche nach einem am 15. August in Mauretanien aufgebrochenen Boot fand ein Flugzeug am Mittwoch das Schiff mit zehn Leichen, wie die spanische Seenotrettung mitteilte. Einige von ihnen lagen demnach in Wasser, das eingedrungen war. An Bord des aus Mauretanien aufgebrochenen Bootes waren etwa 40 Menschen gewesen. Ob es das gleiche war," blieb zunächst unklar."""
AfD-Politiker Brandner löst Polizeieinsatz im ICE aus;
Es ist an der Zeit," dass Europa seinen „Außenminister“ nach Moskau schickt;""Der Europäische Rat hat sich bei einem EU-Sondergipfel zur Lage in Weißrussland getroffen. Das Ergebnis ist eine deutliche Botschaft an den Machthaber Lukaschenko – aber auch an Putin."

Anzeige

Europa ist auf vier Hügeln errichtet worden: auf dem Berg Sinai, auf Golgatha, auf der Akropolis in Athen und auf dem Kapitol in Rom. In anderen Worten – die Europäische Union ist eine Wertegemeinschaft.

Allein aus diesem Selbstwertgefühl heraus kann sie es sich nicht erlauben, die Eskapaden des weißrussischen Präsidenten Alexander Lukaschenko gegenüber dem eigenen Volk durchgehen zu lassen. Zu lange hat dieser Tyrann mit dem Pokerface die Menschen seines Landes wie einen Haufen lächelnder Sklaven behandelt, die alle vier Jahre brav ihr Kreuz hinter Lukaschenkos Namen auf dem Wahlzettel setzen, um dann weitere vier Jahre das Kreuz bereitwillig zu tragen. Insofern ist es richtig und angemessen, dass alle 27 EU-Mitgliedstaaten Lukaschenkos erschummeltes Wahlergebnis als Betrug werten.

Lesen Sie auch Gewalt nach Wahl Jetzt rächt sich Europas Passivität in Belarus

Doch war das alles? Sollte es damit getan sein? Die EU ist zwar eine Wertegemeinschaft, aber sie ist nur sehr begrenzt in der Lage, strategisch zu denken – um es freundlich auszudrücken. Allein der bisherige Umgang mit Weißrussland, das ewige Hin und Her von Sanktionen, die mal erlassen und dann wieder aufgehoben werden, ohne dass sich Lukaschenkos Regime geändert hätte, weisen auf diese Schwäche hin. Selbst jetzt gibt es kaum einen Hinweis darauf, dass die Europäer in der Lage sind, eine strategische Gesamtschau zu halten.

Anzeige

Sie sieht wie folgt aus: Der Schlüssel für Weißrusslands Freiheit liegt nicht in Minsk. Er liegt in Moskau. Der Herr im Kreml fürchtet die weißrussische Demokratiebewegung aus einem innenpolitischen und einem geostrategischen Grund.

Lesen Sie auch Wahl in Weißrussland „Im Kindergarten und in der Schule nahm ich ihn als etwas Ewiges wahr“

Wladimir Putin wittert die Gefahr, dass ein Erfolg der weißrussischen Opposition die russische Bürgerrechtsbewegung stärken würde. Geostrategisch graut ihm davor, dass ein demokratisches Weißrussland der Ukraine folgen und sich aus dem russischen Einfluss verabschieden würde. Die innerrussische Angst kann die EU Putin nicht nehmen, die geostrategische schon.

