title;text

Chadwick Boseman: Es gab sicher Momente, die sich von jener Sorte Fan-Hysterie unterschieden, wie man sie vom roten Teppich her kennt. Ich sehe solche Begegnungen nicht als übertriebene Huldigung oder so was. Ich sehe sie eher als Ausdruck einer tief empfundenen Wertschätzung von Menschen, die ich ohne diesen Film gar nicht getroffen hätte. Für mich ist das oft wie ein Austausch. Da geht es auch um gegenseitige Wertschätzung. Ich wurde aber auch von sehr berühmten Leuten auf „Black Panther“ angesprochen.

"WELT: Von wem zum Beispiel?"""
„Erzählen Sie Ihrem Kind bloß nicht," dass Oma nur schläft“;""WELT: Sie werden täglich mit Trauer konfrontiert. Wie verkraften Sie das?"

Caitlin Doughty: Am Anfang habe ich mich oft gefragt, ob ich bei der Bestattung etwas falsch gemacht habe, weil die Angehörigen oft sehr gereizt oder wütend sind. Aber dann habe ich verstanden: Es geht nicht um mich. Sie sind einfach überwältigt. Sie wissen nicht, wohin mit ihren Emotionen, wie sie mit ihrer Wut und Trauer umgehen sollen. Das zu erkennen, war wichtig, um es in der Branche auszuhalten. Man geht zugrunde, wenn man die Traurigkeit auf sich überträgt. Meine Arbeit besteht darin, es für sie einfacher zu machen. Ich bin auch nicht da, um sie zu trösten. Das hilft niemanden, außerdem haben sie dafür jemanden. Ein guter Bestatterjob besteht darin, sie in ihrer Trauerarbeit zu begleiten, und nicht darin, mit ihnen zu weinen.

WELT: Die Anwesenheit von Kindern ist oft unerwünscht. Sie wiederum bezeichnen Kinder als „morbide, kleine Engel“, die auch Abschied nehmen müssen – und wollen.

Doughty: Genau. Zwar sollte niemand ein Kind zwingen, seine geliebte tote Oma zu sehen, wenn es das nicht will. Denn hinter vielen traumatischen Erlebnissen in der Kindheit stecken zwei entscheidende Erfahrungen: Entweder wurden die Kinder gezwungen, mit Verstorbenen gegen ihren Willen zu interagieren, wie ihre tote Oma im offenen Sarg zu küssen. Auf der anderen Seite wurden Kinder komplett herausgehalten: Ihnen wurde nicht erzählt, dass ihre Oma gestorben ist oder eine Beerdigung stattfand. Sie war einfach von heute auf morgen weg und die Kinder konnten sich nicht verabschieden. Solche Geschichten höre ich oft. Deshalb plädiere ich stark dafür," Kinder einzubeziehen."""
„Asoziale Hedonisten“ – Die neue Lust am Party Shaming;
Drachen schleudert 3-Jährige meterhoch durch die Luft;
Drachen reißt 3-Jährige meterhoch in die Luft;
"„Ich fühle mich unter Generalverdacht“;""Und dann steckte ich mich doch noch an. Mist", dachte ich, jetzt hat’s mich erwischt, ich muss verhindern, dass es völlig von mir Besitz ergreift. Es geschah bei Edeka: Ein Jugendlicher an der Kasse hatte in seiner Unbefangenheit, als gäbe es kein Morgen, mit seiner Maske einen Kompromiss gemacht: Mund bedecken, Nase rausgucken lassen. Ehe ich es verhindern konnte, hatte ich ihn darauf aufmerksam gemacht. Nicht mit Worten, sondern mit so einer herrischen Geste mit dem Finger.

Ich war zutiefst erschrocken – über mich. Es gibt nämlich ein paar Dinge, die habe ich noch nie getan. Aus Prinzip nicht, und ich hasse Prinzipien. Zum Beispiel habe ich mich noch nie über nachbarlichen Lärm beschwert. Ich habe auch nie deswegen die Polizei angerufen. Nicht, weil ich links bin, das bin ich nämlich weiß Gott nicht. Ich liebe die Polizei. Aber in meiner Welt ruft man sie nur in höchster Not. Um jemandem zu helfen, nicht um jemanden bestrafen zu lassen. So sind die Regeln in meiner Rock’n’Roll-Gemeinde," tut mir leid."""
„Wären nicht Männer vornehmlich Kunden," würden wir ernsthafter diskutieren“;""Anders als in vielen anderen Bundesländern dürfen ab dem 10. Juni in Rheinland-Pfalz Bordelle und Shisha-Bars unter Corona-Schutzauflagen wieder öffnen. Dabei müssen unter anderem die Kontakte aller Besucher erfasst werden."

Anzeige

Seit 2002 haben Prostituierte die Möglichkeit, sich gesetzlich sozialversichern zu können. 15 Jahre später trat das Prostituiertenschutzgesetz in Kraft, wonach sich Prostituierte bei ihren Kommunen registrieren und regelmäßig gesundheitlich beraten lassen müssen. Ob die Gesetzgebung die Lage der Betroffenen wirklich verbessert hat, bleibt umstritten. Die Legalisierung der Branche, so Kritiker, habe Deutschland zum „Bordell Europas“ gemacht.

Nach Schätzungen von Ver.di werden jährlich im deutschen Rotlichtmilieu 14,5 Milliarden Euro umgesetzt. Den Großteil davon bekommen allerdings nicht die schätzungsweise 400.000 Prostituierten, von denen etliche minderjährig sind und die wenigsten registriert. In diesem Frühjahr haben 16 Bundestagsabgeordnete von Union und SPD in einem gemeinsamen Brief an die Länderchefs über die Pandemie hinaus ein generelles Sexkaufverbot gefordert. Zu den Unterzeichnern gehört SPD-Gesundheitsexperte Karl Lauterbach.

WELT: Herr Lauterbach, seit März sind Bordelle geschlossen. Mittlerweile gehen überall in Deutschland Sexarbeiterinnen auf die Straße, um für Lockerungen der Vorschriften und damit für ihre Einnahmequelle zu kämpfen. Sie fordern nicht nur die Beibehaltung der Beschränkungen, sondern ein generelles Sexkaufverbot.

Anzeige

Karl Lauterbach: Es ist mir wichtig zu betonen, dass ich in der derzeitigen Situation kein generelles Verbot fordere. Jetzt darüber eine Grundsatzdiskussion zu führen oder gar eine gesetzgeberische Initiative einzuleiten, halte ich für falsch. Die Prostitution ist in eine Notlage geraten. Da müssen wir helfen, und zwar vorbehaltlos.

SPD-Gesundheitsexperte Karl Lauterbach Quelle: picture alliance / Eventpress Stauffenberg

WELT: Wie soll die Hilfe aussehen?

Lauterbach: Prostitution ist bei uns legal, wir haben den Beruf zugelassen. Deswegen müssen Prostituierte kurzfristig wie andere Soloselbstständige finanziell unterstützt werden. An den Kosten für die Kommunen kann sich auch der Bund beteiligen. Wenn Prostitution für die Dauer der Pandemie verboten ist, muss es ja etwas geben, wovon die Prostituierten leben können.

Anzeige

Ansonsten würden sie in die illegale und in der Zeit der Pandemie für sie und die Freier gesundheitsgefährdende Prostitution gedrängt werden. Die Folge wäre auch eine größere Gefahr für die öffentliche Gesundheit. Neben der finanziellen Unterstützung sollten wir Prostituierten aber auch die Möglichkeit anbieten, in andere Berufe umzusteigen.

WELT: Sie machen sich für das sogenannte nordische Modell stark, benannt nach dem 1999 in Schweden eingeführten Sexkaufverbot, das nicht die Prostituierten kriminalisiert, sondern die Freier, und zudem Ausstiegsprogramme finanziert. Tatsächlich ist in Schweden die Prostitution deutlich zurückgegangen. Es gibt aber auch Kritik. Demnach werde Prostitution durch das Verbot in die Illegalität gedrängt, was die Gefahr von Missbrauch und Gewalt befördere.

Lesen Sie auch Sex und Corona Prostitution gehört zu Deutschland, Herr Lauterbach!

Lauterbach: Prostitution bedeutet sehr oft auch Zwang und würdelose Behandlung von Frauen. Ein Sexkaufverbot gibt dem Gesetzgeber die Möglichkeit, eklatante Verstöße gegen die Menschenwürde rechtlich zu verfolgen. Für die Drohung, dass es durch das gut gemeinte Verbot noch schlimmer für die Prostituierten werde, dafür fehlt die empirische Evidenz.

Anzeige

Wenn man sich die Entwicklung in den Ländern mit dem nordischen Modell anschaut, bestätigt sich die Befürchtung nicht. Und es würde auch überraschen. Denn wenn Sexkauf verboten ist, machen sich die Freier strafbar. Wieso sollte das nicht dazu führen, dass viele auf diese strafbare Handlung verzichten?

WELT: Es gibt eine Reihe von Ländern, in denen das nordische Modell umgesetzt wird. In Frankreich gilt das Sexkaufverbot, auch in Norwegen, Island, Irland, Israel und Kanada. Warum gibt es bei uns einen so vehementen Widerstand gegen ein Sexkaufverbot?

Lauterbach: Ich kann das nicht wirklich erklären. Ich weiß nur, dass Deutschland eine Drehscheibe für Prostitution ist. Warum wir das zulassen und nicht ehrlicher diskutieren, hat meiner Meinung auch damit zu tun, dass es vor allem Frauen sind, die unter der Billigprostitution leiden.

Würden Männer nicht vornehmlich die Kunden sein, sondern diejenigen, die zu diesen Bedingungen in einem solchen Beruf arbeiten müssten, würden wir das Thema sicher ernsthafter diskutieren. Viele chauvinistische Vorurteile oder alte Muster, nach dem Motto: „Prostitution gab es doch schon immer“, spielen in dem mangelnden Bewusstsein für die Missstände eine Rolle.

Lesen Sie auch Bordelle in der Corona-Auszeit „Die Kunden warten. Sie sind sehr verzweifelt“

WELT: Es gibt aber auch männliche Sexarbeiter.

Lauterbach: Die arbeiten zumeist aber unter anderen Bedingungen, wo sie, salopp gesagt, ihr eigener Herr sind. Dagegen werden viele Frauen, darunter ein großer Teil aus Osteuropa, in schwerer Abhängigkeit gehalten unter Bedingungen, die einfach nicht akzeptiert werden können.

WELT: Es gibt eine ganze Reihe von Sexarbeiterinnen – und Sexarbeitern – mit eigenen Studios, die betonen, ihre Arbeit freiwillig und selbstbestimmt zu verrichten. Sollte in solchen Fällen nicht die Möglichkeit bestehen, registriert und staatlich kontrolliert seinen „Beruf“ ausüben zu können? Sind das nicht andere Bedingungen als die, unter denen die vielen osteuropäischen Frauen aus Armut oder aufgrund von Gewaltandrohung ihren Körper verkaufen müssen?

Anzeige

Lauterbach: Die Unterscheidung ist zunächst einmal schwer zu treffen. Ich bin auch der Ansicht, dass diese vollkommen freiwillige Start-up-Form der Prostitution eine Rarität ist, um damit die bekannten unwürdigen Verhältnisse zu rechtfertigen. Im Übrigen ist es jedem selbst überlassen, diese Art Lebensstil zu pflegen, ohne es zum Geschäft zu machen. Ich bin ja nicht der Moralapostel, der unverbindliche Sexualität zu kritisieren hätte. Aber Angebote dieser Art kann man auch machen, ohne davon leben zu müssen.

Lesen Sie auch Liebe extrem „Sexsucht ist Selbstmord auf Raten“

WELT: Ein Argument der Lobbyisten der Sexindustrie ist die Annahme, dass es ohne Prostitution mehr Sexualstraftaten geben würde.

Lauterbach: Das ist ein empirisch in keiner Weise haltbares Argument. Die Art und Weise, wie Frauen in der Prostitution von Zuhältern behandelt werden, ist aus meiner Sicht oft schon kriminelles Verhalten. Dass ich eine Straftat zulasse, um eine andere zu vermeiden, die angeblich noch schlimmer wäre, das ist mit unserem Rechtssystem nicht vereinbar. Ich kann auch nicht Diebstähle zulassen," damit es nicht zu Raubüberfällen kommt."""
"„Ein solcher Anschlag kann nicht ohne Putins Zustimmung durchgeführt werden“;""Die Schreie waren im ganzen Flugzeug zu hören. Sie kamen aus der Toilette", darin war Russlands bekanntester Oppositionspolitiker. Alexej Nawalny, der am Donnerstag vergangener Woche vom sibirischen Tomsk nach Moskau unterwegs war. Er muss furchtbare Schmerzen gehabt haben, bevor er bewusstlos wurde. Wohl nur, weil der Pilot sich zur Notlandung entschloss, lebt der 44-Jährige noch.

Sofort wurden Erinnerungen an den Fall Alexander Litwinenko wach, der 2006 in London an einer Vergiftung mit Polonium starb. Der Ex-Offizier des russischen Geheimdienstes galt in Moskau als Verräter und wurde wie andere Regimegegner ermordet. Sowohl Nawalny als auch Litwinenko brachen zusammen, nachdem sie einen Tee getrunken hatten.

Ein ehemals hochrangiger Mitarbeiter des Bundesnachrichtendienstes (BND), der anonym bleiben will," ist sich sicher."""
Bei Nike verpasste Neymar regelmäßig die großen Boni;
„Dass Kinder nicht zur Schule dürfen, nur weil die Nase läuft," kann keine Lösung sein“;""Welt am Sonntag: Corona hält uns als Dauerwelle alle fest im Griff. So stecken wir in einer Wirtschaftskrise. Worum handelt es sich Ihrer Meinung nach: um eine schwere", aber absehbare Rezession oder sogar um eine länger anhaltende Depression?

Katrin Göring-Eckardt: Wir wissen es noch nicht. Viele Unternehmen haben Angst vor einer zweiten Welle. Es geht nicht nur um kurzfristige Finanzhilfen. In den Gesprächen, die ich in Firmen und Betrieben führe, höre ich oft den Wunsch nach mittel- und langfristigen Regelungen. Die Frage, wie die ökologische Transformation gelingen kann, kommt sehr oft. Die Autoindustrie beschäftigt das genauso wie die Stahlindustrie. Wir führen da sehr intensive Gespräche. Und wir sollten die Kulturschaffenden und kleinen Selbstständigen nicht vergessen. Auch an der Kultur hängen Hunderttausende Arbeitsplätze.

Welt am Sonntag: Die Bundesregierung verschuldet sich in einem Ausmaß, das man vor Monaten noch nicht für möglich gehalten hat. Wo würden Sie eigentlich die Grenze ziehen? Ab wann müsste man sagen: Mehr geht nicht," wollen wir nicht wie Italien enden?"""
"Den Flüchtlingen drohen jetzt schwarze Gefängnisse;""Zwölf Hongkonger Aktivisten sind auf der Flucht nach Taiwan von der chinesischen Küstenwache aufgegriffen worden. Frühere Fälle lassen erahnen", was ihnen in China droht: Geheime Gerichte und Folter.

Es ist schlicht unvorstellbar," was unseren Mitstreitern in chinesischem Gewahrsam drohen könnte""""", schreibt Joshua Wong

Anzeige

Zwölf Hongkonger, die im vergangenen Jahr Teil der Demokratiebewegung waren, sind von der chinesischen Küstenwache festgenommen worden. Sie waren unterwegs nach Taiwan, um dort politisches Asyl zu beantragen, und wurden jetzt in China inhaftiert – darunter auch der Aktivist Andy Li. Li war bereits Anfang August einmal verhaftet worden, am selben Tag wie der Medienunternehmer Jimmy Lai. Ihm wurde Zusammenarbeit mit ausländischen Kräften im Rahmen des nationalen Sicherheitsgesetzes vorgeworfen, das Peking in Hongkong eingeführt hat.

In China gibt es ein noch strengeres Sicherheitsgesetz als in Hongkong sowie weitere drakonische Strafgesetze. Es ist besorgniserregend, dass die zwölf Hongkonger in Chinas sogenannte schwarze Gefängnisse und vor geheime Gerichte gebracht werden könnten – mit eingeschränktem Zugang zu Rechtsbeistand und dem hohen Risiko, für Geständnisse gefoltert zu werden.

Festnahme bekannter Hongkonger Aktivisten Nach Inkrafttreten des sogenannten Sicherheitsgesetzes sind in Hongkong mehrere Aktivisten festgenommen worden, darunter der Medienmogul Jimmy Lai und die bekannte Aktivistin Agnes Chow. Ihnen drohen lebenslange Haftstrafen. Quelle: WELT

Im vergangenen August wurde Simon Cheng – ein Hongkonger, der fast zwei Jahre für die britische Regierung gearbeitet hatte – während einer Reise auf das chinesische Festland 15 Tage lang festgehalten. China hatte Cheng unter Berufung auf das Security Administration Punishment Law (Strafgesetz der Sicherheitsbehörde), das vor allem kleinere Vergehen abdeckt, verhaftet. Ihm wurde „Kontaktanbahnung mit einer Prostituierten“ vorgeworfen.

Anzeige
