title;text
Anzeige Smart Home Lampen OSRAM Smart+ LED-Lampe jetzt online kaufen

Anzeige Smart Home Lampen Osram Gartenleuchte jetzt online kaufen

Wer nicht immer sein Smartphone benutzen möchte, kann auch mit dem Osram Smart-Lichtschalter* das Licht dimmen, Farben und Farbtemperaturen wechseln. Dieser kann sowohl als an der Wand befestigter Lichtschalter als auch als Fernbedienung genutzt werden – und das ganz ohne Smartphone oder Internetverbindung.

Anzeige Smart Home Lampen Osram Lightify Dimming jetzt online kaufen

Anzeige

Auch das Smart+System ist via Sprachsteuerung bedienbar – Sie haben hier die Wahl zwischen Amazon Echo oder Apple HomeKit.

Smart-Home-Beleuchtung: Alternative ohne Funkbrücke

Andere Systeme benötigen hingegen weder Funkbrücke noch WLAN. So brauchen Sie für die kostengünstigere ANTEN LED Deckenleuchte* kein Smartphone sondern steuern ihr gesamtes System über eine Fernbedienung. Das Setup ist somit extrem einfach: Sie müssen nur die Smart-Lampe installieren und können sofort loslegen. Allerdings bietet dieses System auch deutlich weniger Gestaltungs- und Kontrollmöglichkeiten. Außerdem ist bei der ANTEN Deckenleuchte keine Sprachsteuerung möglich.

Anzeige Smart Home Lampen ANTEN LED Deckenleuchte jetzt online kaufen

Auch das Eglo-Connect-System* benötigt weder Funkbrücke noch WLAN, sondern wird via Bluetooth miteinander verbunden und via App oder Fernbedienung gesteuert. Das Eglo Connect bietet laut Herstellerangaben mit 16 Millionen Farbtöne, und 50.000 Weißtönen jede Menge Gestaltungsmöglichkeiten. Allerdings verfügt es nicht über den ZigBee-Standard und ist somit nicht mit anderen Systemen kompatibel.

Anzeige Smart Home Lampen Eglo Deckenleuchte Sarsina jetzt online kaufen

Anzeige

Anzeige Smart Home Lampen Eglo LED-Leuchtmittel jetzt online kaufen

IKEAS Smart-Home-Lampen

Mit der Produktreihe TRÅDFRI* hat auch der schwedische Möbelriese IKEA ein eigenes Smart-Licht-System im Angebot. Auch hier brauchen Sie nicht unbedingt Router, denn Sie können einzelne Leuchtmittel auch via Fernbedienung steuern. Allerdings bietet diese Modellreihe auch die Möglichkeit, sein System via Funkbrücke in sein WLAN zu integrieren und es über eine Smartphone-App zu steuern. Smart-Home bzw. WLAN-Steckdosen sind besonders praktisch, um Ihre Lampen mit dem Internet zu verbinden. Sprachsteuerung ist via Apple HomeKit, Google Assistant oder Amazon Alexa möglich.

Anzeige Smart Home Lampen Trådfri Dimm-Set jetzt online kaufen

Smarte Lichtschalter

Wer auf Sprachsteuerung über Google Assistant oder Amazon Alexa setzt, hat außerdem eine große Auswahl an smarten Lichtschaltern, die in der Wand installiert und mit dem WLAN verbunden werden.

Anzeige Smart Home Lampen Meross Smart Dimmer Schalter jetzt online kaufen

Anzeige Smart Home Lampen Koaanw Smart Lichtschalter jetzt online kaufen

Anzeige Smart Home Lampen Hama Wi-Fi Touch Lichtschalter jetzt online kaufen

Philips-Hue: Das System im Überblick

2012 veröffentlichte Philips das heute omnipräsente Hue-System. Die Produktreihe umfasst eine breite Palette an Leuchten, Lampen, Sensoren und Schalter. Der Knotenpunkt des smarten Beleuchtungssystems ist ein Router, die sogenannte Hue-Bridge*, die in ihr WLAN integriert werden muss und als Steuerzentrale fungiert. Mit ihr können Sie bis zu 50 Elemente via Smartphone oder Fernbedienung ansteuern.

Anzeige Smart Home Lampen Philips Hue Bridge jetzt online kaufen

Dabei gibt es eine große Auswahl an gängigen Leuchtmitteln. Die Hue-Reihe umfasst den Standardsockel E27, GU12-Spots sowie E14-Sockel (Kerzenlicht-Spots). Dabei kommen die meisten Leuchtmittel sowohl in einer komplexeren Variante, die alle möglichen Farben annehmen kann sowie eine schlichtere, dafür günstigere Version, die sich auf Weißtöne konzentriert oder simple Dimmbarkeit konzentriert.

Anzeige Smart Home Lampen Philips Hue Ambiance Lampe jetzt online kaufen

Anzeige Smart Home Lampe Philips Hue White Lampe jetzt online kaufen

Das Praktische an der Philips-Hue-Reihe: Sie nutzt den gängigen ZigBee-Standard – und ist somit mit Smart-Lampen und Systemen anderer Hersteller kompatibel. Sie können das Hue-System (das in der Regel etwas hochpreisiger ist als einige andere Anbieter) somit beispielsweise mit günstigeren Lampen und Leuchten kombinieren. Das System unterstützt Sprachsteuerung mit Google Home, Amazon Echo und Apple HomeKit.

Fazit:

Anzeige

Mit Smart-Home-Lichtsystemen können Sie Ihr Zuhause mit geringem Aufwand und ohne tiefgehende technische Kenntnisse in ein ganz neues Licht tauchen. Für welches System Sie sich schlussendlich entschieden, kommt auf ihre Anforderungen an. Möchten Sie eventuell Systeme und Komponenten miteinander kombinieren, sollten Sie sich für ein System mit ZigBee-Standard entscheiden. Setzen Sie auf Sprachsteuerung, stellen Sie außerdem sicher, dass das jeweilige System ihre bevorzugte Spracheingabe unterstützt.





*Dieser Text enthält Affiliate Links. Das bedeutet: Sollten Sie über die mit einem Stern gekennzeichneten Links einen Kauf abschließen, erhält WELT eine kleine Provision. Die Berichterstattung beeinflusst das nicht. Unsere Standards der Transparenz und journalistischen Unabhängigkeit finden Sie unter axelspringer.de/unabhaengigkeit.

"Dieser Artikel wurde erstmals am 12. September 2019 veröffentlicht."""
„Viel zu früh für Wahlkampf – Keinen Einfluss für unsere Aufstellung“;
"Mit diesen Produkten rüsten Sie Ihr Zuhause clever auf;""Anzeige"

Inhaber einer Fritz!Box können ihr Zuhause mit nur wenigen Handgriffen und vergleichsweise kostengünstig zum Fritz-Smarthome aufrüsten. Denn: Sie besitzen mit dem Router bereits die Basisstation, die andere Smart-Home-Nutzer oft erst zusätzlich besorgen müssen. Hier erfahren Sie, welche AVM-Smart-Home-Produkte derzeit erhältlich sind und welche Vorteile sie bieten. Außerdem erhalten Sie Informationen darüber, wie sich auch einige Fremdgeräte mit einer Fritz!Box verbinden lassen.

Anzeige Prime Day Jetzt bei Amazon stöbern und Schnäppchen sichern Am 13. & 14. Oktober ist Amazon Prime Day. Das bedeutet: Tausende Artikel sind teils stark reduziert. Einzelne Produkte gibt es jetzt schon zum Schnäppchenpreis.

AVM Smart Home: Das sind die Vorteile

Das Berliner Unternehmen AVM hat anderen Smart-Home-Anbietern eines voraus: In Deutschland nutzen bereits viele Haushalte eine Fritz!Box, um mit dem Internet verbunden zu sein. Während bei anderen Herstellern oft noch eine Basisstation erworben werden muss, um Smart-Home-Produkte nutzen zu können, übernimmt die Fritz!Box bei kompatiblen Geräten die zentrale Steuerung. So lässt sich bei der Installation eines Smart-Home-Systems gleich zu Beginn Geld sparen.





Anzeige

Kompatible Fritz!Box-Smart-Home-Geräte arbeiten über DECT ULE (verkürzt für Digital Enhanced Cordless Telecommunications, Ultra-Low Energy) – also durch eine besonders energiesparende und störungsarme Funkverbindung mit zuverlässiger Reichweite. Die Bedienung von Fritz-Smart-Home-Geräten erfolgt über den Browser am Laptop, über ein Tablet, mit einem Fritz!Fon* oder auch mit Hilfe des Smartphones.

Anzeige Fritz Smart Home FRITZ!Fon jetzt online kaufen

Tipp: Wenn Sie bereits Smart-Home-Produkte besitzen, die nicht vom Hersteller AVM stammen, aber trotzdem mit der Fritz!Box genutzt werden sollen, könnte dies dank der „Han Fun“-Technologie möglich sein – dazu später mehr.

„Fritz!Box Smart Home“-Geräte: Überblick

Um das eigene Zuhause intelligent aufzurüsten, bietet der Hersteller der Fritz!Box Smart-Home-kompatible Geräte an. Dazu gehören bisher:

Fritz-Thermostat

Fritz-Steckdose

