title;text

In Südkorea sind 110 neue Infektionen mit dem Coronavirus registriert worden. Die Hälfte der Fälle stehe in Verbindung mit einem Krankenhaus in der Stadt Busan, teilte die südkoreanische Behörde für Krankheitskontrolle und -prävention am Donnerstag mit. In dem Land mit gut 51 Millionen Einwohner liegt die offizielle Zahl der Fälle damit bei fast 25.000.

Mindestens 54 der Neuinfektionen stünden mit dem Krankenhaus für Ältere in Verbindung. Mehr als 40 seien in der dicht bevölkerten Metropolregion Seoul verzeichnet worden, mit Verbindungen zu Krankenhäusern, Kirchen, Schule und Büros.

Alle aktuellen und weltweiten Entwicklungen zum Coronavirus können Sie in unserem Live-Ticker verfolgen.

"Haben Sie Fragen zum Coronavirus? Hier finden Sie die wichtigsten Fakten und Informationen."""
Stegner kann sich Haftstrafe für Tönnies vorstellen;
"Tausende Konzertgänger feiern dicht gedrängt – Bürgermeister verhängt Maskenpflicht;""Hinweisschilder und Lautsprecherdurchsagen halfen nicht: In Nizza feierten rund 5000 Menschen dicht an dicht auf einem Konzert an der berühmten Promenade. Der Bürgermeister zieht Konsequenzen – und stellt Forderungen an die Regierung in Paris."

Anzeige

Empörung in Frankreich über ein Konzert inmitten der Corona-Krise: Knapp 5000 Menschen versammelten sich am Samstagabend auf der berühmten Promenade des Anglais in der Hafenstadt Nizza – dort legte etwa der bekannte französische DJ The Avener auf.

Medienberichten zufolge wurden die Schutzmaßnahmen gegen Corona nicht eingehalten – die Menschen hielten keinen Abstand und trugen keine Masken. Auf Fotos und Videos war eine zum Teil dicht gedrängte Menge zu sehen.

Die Stadt versicherte, dass die Obergrenze von 5000 Menschen, die bei öffentlichen Veranstaltungen gilt, eingehalten worden sei. Eigentlich würde auf der Promenade Platz für 36.000 Menschen sein.

Der bekannte französische DJ The Avener legte am Samstagabend bei einem Konzert auf der berühmten Promenade des Anglais in der Hafenstadt Nizza auf Quelle: dpa/Yann Coatsaliou

Viele Besucher des Konzerts hielten Medienberichten zufolge keinen Abstand und trugen keine Masken Quelle: dpa/Yann Coatsaliou

Anzeige

Er wisse, dass es an einigen Stellen eng war, aber das Publikum sei in einer offenen Umgebung herumgelaufen, verteidigte Remi Recio von der zuständigen Präfektur im Sender BFMTV die Veranstaltung.

Lesen Sie auch Pauschalreisen Urlaub in Europa unsicher wie nie – So verhindern Sie das Chaos

Nizzas Bürgermeister Christian Estrosi bedauerte, dass die Anweisungen nicht ausreichend beachtet worden seien – es habe Schilder und Lautsprecherdurchsagen gegeben. In Nizza soll das Tragen von Schutzmasken nun bei allen Großveranstaltungen unter freiem Himmel verpflichtend sein. Estrosi rief die Regierung in Paris auf, eine solche Maßnahme landesweit durchzusetzen. Sicherheit und wirtschaftliche sowie kulturelle Erholung müssten in Einklang miteinander gebracht werden.

Mediziner sorgen sich vor einer möglichen zweiten Corona-Welle, weil es zahlreiche Franzosen in den Sommerferien mit Vorsichtsmaßnahmen nicht mehr so genau nehmen," obwohl landesweit schon mehr als 30.000 Infizierte gestorben sind."""
"Da soll schnell etwas durchgedrückt werden;""Der Corona-Ausbruch bei Tönnies warf ein Schlaglicht auf die Situation in der Fleischindustrie. Ab dem kommenden Jahr dürfen keine Werkverträge oder Leiharbeiter mehr eingesetzt werden. Was bedeutet das für den Verbraucher?"

Anzeige

Wenn ein Gesetzentwurf nur wenige Wochen braucht zwischen Initiierung und seiner Verabschiedung im Kabinett, dann ist Misstrauen angebracht. Wenn dann der Gesetzentwurf auch noch just an jenem Tag das Kabinett passiert, an dem sich auch das letzte Bundesland – Baden-Württemberg – in die Schulferien verabschiedet, dann dräut dem politisch geschulten Publikum: Da soll schnell etwas durchgedrückt werden, was im gleißenden Licht einer breiten Aufmerksamkeit Abwehrreaktionen größeren Ausmaßes ausgelöst hätte.

Hier können Sie unsere WELT-Podcasts hören Wir nutzen den Player des Anbieters Podigee für unsere WELT-Podcasts. Damit Sie den Podcast-Player sehen können und um mit Inhalten aus Podigee und anderen sozialen Netzwerken zu interagieren oder diese darzustellen, brauchen wir Ihre Zustimmung. Soziale Netzwerke aktivieren

Wie berechtigt der Argwohn ist im konkreten Fall – den schärferen Regeln für die Fleischbranche, auf die Arbeitsminister Hubertus Heil (SPD) seine Ministerkollegen eingeschworen hat – das belegen auch die wachsweichen und wechselnden Begründungen für den Vorstoß.

Lesen Sie auch Meinung Fall Tönnies Die Fleischwirtschaft braucht fairen Wettbewerb

Werkverträge und nun sogar auch Zeitarbeit in weiten Teilen der Fleischindustrie zu verbieten, das sollte ursprünglich, als der große Corona-Ausbruch in der Tönnies-Fabrik in Rheda-Wiedenbrück die Schlagzeilen beherrschte, der Pandemiebekämpfung dienen. So als hätte das Virus, das im Ostwestfälischen Hunderte Werkverträgler befiel, Zurückhaltung geübt, wenn die Arbeitskräfte fest angestellt gewesen wären.

Anzeige

Dass das Corona-Argument nicht weit tragen würde, wird Heil rasch gemerkt haben, jedenfalls wurde es alsbald fluffig. Von einer „gesamtgesellschaftlichen Frage, die auch mit Tierwohl zu tun hat“, sprach der Minister zuletzt, um gleich im nächsten Satz anzumerken: „Aber ich sag mal: die Ausbeutung von Menschen, viele von ihnen aus Rumänien und Bulgarien, ist beschämend.“

An dieser Stelle finden Sie Inhalte aus Twitter Um mit Inhalten aus Twitter und anderen sozialen Netzwerken zu interagieren oder diese darzustellen, brauchen wir Ihre Zustimmung. Soziale Netzwerke aktivieren

Dass das Wohl von Schweinen vom arbeitsrechtlichen Status ihrer Schlachter abhängen soll, kann glauben, wer will. Sich aber vorzustellen, dass es den Arbeitern aus Rumänien und Bulgarien besser gehen wird, wenn sich demnächst erhebliche Teile der Industrie dem Heil’schen Zugriff durch Abwanderung ins östliche Ausland entziehen, dazu gehört schon viel Fantasie.

Da liegt auch der Verdacht nahe, dass es Heil und den Seinen eigentlich um etwas anderes geht: den Einstieg zu finden in eine weitere Re-Regulierung der Arbeitswelt weit über die Fleischindustrie hinaus.

Anzeige

Entsprechend nervös sind weite Teile der Wirtschaft, wo Werkverträge wie Zeitarbeit gerade in der Ära des Fachkräftemangels ein unverzichtbares Instrument der flexiblen Arbeitsorganisation sind. Entsprechend verstört ist man auch, dass die marktwirtschaftlichen Restreflexe der Union selbst an dieser Stelle nicht funktionieren.

Lesen Sie auch Fall Tönnies Der Preis des Fleisches – was bessere Arbeitsbedingungen die Kunden kosten

Und wenn schon in der Sache von CDU/CSU nichts zu erwarten ist, dann hätte man doch hoffen dürfen, dass wenigstens wahltaktische Überlegungen Vernunft und Mäßigung zum Durchbruch verhelfen.

Nachdem er aber nun einmal den Fuß in der Tür hat," will der Arbeitsminister sich nach eigenem Bekunden „Branche für Branche angucken“. Einen Schlagzeilengaranten fürs Wahljahr hat sich Heil so geschaffen. Und die Union schaut zu."""
Daran erinnern, wer Real Madrid ist;
"48-Jährige vergewaltigt – Polizei nimmt drei Verdächtige fest;""Bereits im Mai sollen in Frankfurt mehrere Männer eine 48-jährige Frau mehrere Stunden in einem Abrissgebäude festgehalten und vergewaltigt haben. Die drei Männer sitzen inzwischen in Untersuchungshaft."

Anzeige

Die Polizei in Frankfurt am Main hat in den vergangenen Wochen drei Männer festgenommen, die im Mai eine 48 Jahre alte Frau über mehrere Stunden vergewaltigt und in einem Gebäude festgehalten haben sollen. Bei den Verdächtigen handelt es sich um Männer im Alter von 27, 43 und 52 Jahren, wie die Polizei am Montag mitteilte.

Festgenommen wurden die drei Tatverdächtigen bereits in den vergangenen zwei Monaten. Ein Hinweis eines Passanten habe die Beamten am Morgen des 21. Mai in das Abrissgebäude im Frankfurter Ostend geführt, das von Obdachlosen als Schlafplatz genutzt werde. Dort seien die Beamten auf die „völlig aufgelöste“ Frau getroffen.

„Diese vertraute sich den Beamten an und teilte ihnen mit, am Vortag von drei Männern gewaltsam gegen ihren Willen über mehrere Stunden zum Geschlechtsverkehr gezwungen worden zu sein. Diese hätten sie außerdem in dem Gebäude festgehalten“, teilte die Polizei mit. Einer der Verdächtigen, ein 43-jähriger Mann, sei noch am Tatort festgenommen worden.

Lesen Sie auch Geschichte einer Vergewaltigung „Kampf oder Flucht – das ist alles, woran man denkt“

Anzeige

Im Laufe der weiteren Ermittlungen konnte die Polizei anhand eines DNA-Tests einen weiteren Tatverdächtigen, den 52-jährigen Mann, ausfindig machen. Er wurde Ende Juni festgenommen. Durch einen „entscheidenden Hinweis aus dem persönlichen Umfeld eines Festgenommenen“ sei anschließend der dritte Tatverdächtige ermittelt worden. Der 27-Jährige wurde laut Polizei Mitte Juli verhaftet.

"Die drei Männer mit bulgarischer Staatsangehörigkeit sitzen mittlerweile in Untersuchungshaft."""
"Eisbären könnten in 80 Jahren ausgestorben sein;""In der Arktis steigen die Temperaturen an. Weil das Meereis schmilzt", haben Eisbären weniger Zeit zum Jagen und verlieren Kraft. Nach einer Prognose kanadischer Forscher könnten die Raubtiere schon bis 2100 fast vollständig aussterben.

Anzeige

Der Klimawandel bedroht den Lebensraum von Eisbären in freier Wildbahn – Forscher der kanadischen University of Toronto gehen nun davon aus, dass die meisten Eisbärarten bis zum Jahr 2100 aussterben werden. Wegen des Verschwindens ihres Lebensraums durch die steigenden Temperaturen fänden die Fleischfresser weniger Nahrung, hieß es in einer Studie, die am Montag in der Zeitschrift „Nature Climate Change“ veröffentlicht wurde. Dadurch gerieten die Raubtiere in einen Teufelskreis, weil hungrige, entkräftete Tiere anschließend auch weniger Erfolg bei der Jagd hätten.

In manchen Regionen sei das bereits zu beobachten, hieß es in der Studie. Wegen des anhaltenden Schrumpfens des Eises am Nordpol verkleinere sich etwa das Zeitfenster, das den Bären für die Robbenjagd bleibe. Mit weniger Körpergewicht kämen die Bären dann schlechter durch den arktischen Winter. „Für die Bären verlängert sich die Zeit ohne Nahrung, bevor das Eis wieder zufriert und sie sich erneut auf die Jagd machen können“, erklärte der Leiter der Studie, Steven Amstrup von der NGO Polar Bears International.

„Ihr Lebensraum schmilzt sprichwörtlich“

Die Forscher gingen in ihrer Studie von einem Anstieg der weltweiten Durchschnittstemperatur um 3,3 Grad Celsius im Vergleich zur vorindustriellen Zeit aus. Bereits die Erwärmung um ein Grad hat zu einer Häufung von Hitzewellen, Dürren und Stürmen geführt. In der Arktis steigen die Temperaturen sogar doppelt so schnell wie im weltweiten Durchschnitt.

Lesen Sie auch Klimawandel Die Problemeisbären

Anzeige

Nach Ansicht der Autoren der Studie werden zwölf von 13 untersuchten Eisbärpopulationen die nächsten 80 Jahre nicht überstehen. Selbst wenn die Menschheit den Anstieg der Durchschnittstemperatur auf 2,4 Grad begrenzen könnte – ein halbes Grad mehr als im Pariser Klimaschutzabkommen, aber dennoch kaum realistisch – würde dies das Aussterben der Bären wohl nur verzögern.
