title;text
Anzeige

Die Nächstenliebe und Seelsorge, so wie sie die Gütersloher praktizieren, kollidiert allerdings zunehmend mit der Ansicht der Beamten im Haus von Horst Seehofer (CSU). Im Bundesinnenministerium und im Bundesamt für Migration und Flüchtlinge (BAMF) wolle man das Kirchenasyl, das eine jahrhundertelange Tradition hat, am liebsten schleifen. So sehen es jedenfalls Vertreter der Kirchen. Und darauf deutet jetzt auch ein interner zweiseitiger Bericht mit dem Titel „Kirchenasyl – Evaluierung des neuen Verfahrens“ hin, der WELT vorliegt.

Asylbewerber müssen das Kirchenasyl eigentlich innerhalb von drei Tagen verlassen, wenn sie als Härtefall einen Ablehnungsbescheid bekommen. Doch die Praxis sehe anders aus: „Dies geschah in den letzten Jahren nicht“, heißt es in dem Bericht des Innenministeriums. Leider habe diese Entwicklung nach einer Neuregelung des Kirchenasyls, die von der Innenministerkonferenz im Juni 2018 beschlossen worden war, „nicht durchbrochen“ werden können.

Kurz gesagt: Die Kirchen sind sauer, dass die Behörden kaum Kirchenasyl-Fälle anerkennen.

Anzeige

Die Behörden wiederum sind sauer, dass die Kirchen ihre Ablehnungen selten akzeptieren und die Menschen im Kirchenasyl belässt.

Lesen Sie auch Horst Seehofer „Wir sind eine Partei der Mitte und der demokratischen Rechten“

Bei den meisten Personen, denen Kirchen Schutz anbieten, handelt es sich um sogenannte Dublin-Fälle. Es geht nicht darum, dass ihnen die Abschiebung in ihr Herkunftsland droht – sondern in jenen EU-Staat, in dem sie zuerst registriert wurden und der daher offiziell für ihr Asylverfahren zuständig ist. Das Ziel der Kirchengemeinde ist oft, die Personen so lange zu beherbergen, bis Deutschland sich bereit erklärt, die Zuständigkeit für das Asylverfahren zu übernehmen.

Nach heftigem Streit zwischen Behörden und Kirchen hatte man sich 2015 darauf geeinigt, dass die Gemeinden dem BAMF zügig solche Härtefälle melden, ebenso der jeweiligen Ausländerbehörde und den Kirchenleitungen. Das BAMF soll dann innerhalb eines Monats zusätzlich ein Dossier erhalten, das den Fall genau erläutert. Darin müssen die kirchlichen Ansprechpartner alle Gründe aufführen, die gegen eine Abschiebung sprechen. Beim BAMF wird dann über den Härtefall entschieden: Wird ein solcher nicht bestätigt, dann sollen die Personen eigentlich den Schutzraum Kirche verlassen.

Anzeige

2018 gab es eine Verschärfung der Regel: Entzieht sich ein Migrant wie etwa im Kirchenasyl dem Zugriff durch Behörden, wird er als „flüchtig“ eingestuft und die Zeit, innerhalb derer die Überstellung durchzuführen ist, wird auf 18 Monate verlängert. Asylsuchende müssen damit also statt sechs bis zu 18 Monate im Kirchenasyl bleiben, bis Deutschland die Zuständigkeit übernimmt – und die Asylbewerber für die Dauer des Verfahrens keine plötzliche Abschiebung fürchten müssen.

Aufnahme von Schutzbedürftigen soll aufgestockt werden In einer Umfrage von Infratest-Dimap im Auftrag der WELT AM SONNTAG forderte die Mehrheit, unerlaubte Einreisen von Asylsuchenden künftig zu beenden. Dafür sollten mehr Flüchtlinge aus Krisenregionen eingeflogen werden. Quelle: WELT/Laura Fritsch

Die Kritik an den Kirchen untermauern Seehofers Beamte in ihrem Bericht mit Zahlen. Im vergangenen Jahr seien bundesweit 635 Kirchenasyl-Meldungen erfolgt; dazu habe es 480 Härtefalldossiers gegeben. Was aber passiert bei Ablehnungen? „In nur zehn Prozent der Fälle“ hätten die Betroffenen das Kirchenasyl wieder verlassen. Anders ausgedrückt: In 90 Prozent seien die Regeln missachtet worden.

Die Verschärfung 2018 hatte für einen Rückgang der Fallzahlen gesorgt: Für 2020 hat die Ökumenische Bundesarbeitsgemeinschaft „Asyl in der Kirche“ zuletzt 357 Kirchenasyle mit insgesamt 550 Personen ausgewiesen. Im vergangenen Jahr ist dabei die Zahl der Kirchenasyl-Meldungen auf durchschnittlich 53 pro Monat gesunken. Anscheinend hat das mit der Neuregelung zu tun: Denn direkt im Anschluss, von August bis Dezember 2018, gab es monatlich 68 Meldungen im Schnitt. Davor waren es noch erheblich mehr. So verzeichnete man im Juli 2018 mit 204 Meldungen die bislang höchste Zahl. Der Rückgang sei „zu begrüßen“, heißt es ausdrücklich in Seehofers Bericht. Schließlich würde man das Kirchenasyl lediglich für absolute Ausnahmefälle mit besonderen Härten vorsehen.

„Belastung für Gemeinden, Einzelpersonen und Familien“

Die Evangelische Kirche in Deutschland (EKD) und auch die Deutsche Bischofskonferenz kritisieren insbesondere, dass Deutschland sich seit 2018 bis zu 18 Monate Zeit lasse, um Dublin-Fälle zu übernehmen. Diese Ausdehnung sei ohne ihre Zustimmung eingeführt worden. „Die Neuregelung stellt eine einseitige Veränderung der 2015 geschlossenen Vereinbarung durch die Innenministerkonferenz dar und belastet die Gemeinden, die Einzelpersonen und Familien im Kirchenasyl sehr“, sagt Martin Dutzmann, der Bevollmächtigte des Rates der EKD.

Prälat Dutzmann verweist auf die aktuelle Rechtsprechung. „Alle mit dieser Frage befassten Gerichte bestätigten bisher einhellig, dass eine Person, deren Aufenthaltsort den Behörden bekannt ist, im Kirchenasyl nicht ,flüchtig’ im Sinne der Dublin-Verordnung sein kann“, sagt er. Damit werde die Rechtsauffassung der beiden Kirchen bestätigt. Sein Fazit: „Der Beschluss der Innenministerkonferenz vom 7. Juni 2018 widerspricht der aktuellen Rechtsprechung.“ Die Deutsche Bischofskonferenz sieht dies ähnlich: Die 2018 beschlossenen Änderungen würden von den Kirchen „kritisch gesehen“, teilte man auf Anfrage mit. Sie stellten eine „erhebliche Belastung“ für die Schutzsuchenden dar.

Martin Dutzmann, Bevollmächtigter des Rates der EKD Quelle: picture alliance / dpa

Dutzmann sagt, innerhalb der EKD seien viele Gemeinden „frustriert“ über die Praxis des BAMF, das vorgelegte Fälle in der Regel negativ entscheide. So würden ärztliche Atteste bisweilen nicht berücksichtigt, bloß weil sie formalen Anforderungen nicht genügten. „Das gilt selbst bei Personen, die für längere Zeit in geschlossenen psychiatrischen Einrichtungen behandelt wurden“, moniert Dutzmann.

Auch im katholischen Lager wächst der Unmut. Gegenüber der Deutschen Bischofskonferenz beklagen Ordensgemeinschaften und Gemeinden, sie könnten die Ablehnungsbescheide des BAMF vielfach nicht nachvollziehen, weil die Schilderung von Härten häufig erkennbar nicht berücksichtigt werde.

Anzeige

Die Kirchen wiederum sitzen an einem mächtigen Hebel. Denn nach dem geltenden Recht sind ihre Gemeinden nicht dazu verpflichtet, einen Asylsuchenden an staatliche Stellen auszuliefern, wenn seelsorgliche Gründe dagegensprechen. Wegen dieser Praxis hatte sich bereits Seehofers CDU-Amtsvorgänger schwer mit den Kirchen angelegt. Thomas de Maizière, selbst bekennender Christ, lehnte im Januar 2015 das Kirchenasyl „prinzipiell und fundamental“ ab. Den Kirchen bescheinigte er, sie würden sich eigenmächtig über bestehende Gesetze hinwegsetzen.

Für diese schroffe Zurechtweisung musste de Maizière viel Kritik einstecken. Einen Monat später traf das BAMF mit der EKD, der Katholischen Kirche und den Freikirchen jene erste Absprache, eine rasche Lösung in humanitären Härtefällen zu finden. Diese beinhaltete, dass die Behörde ihre Bescheide nochmals ergebnisoffen überprüfen sollte.

Lesen Sie auch Migrationspolitik Wie Deutschland trotz EU-Abschiebestopp Doppelasylbewerber loswerden will

Mit dem BAMF hält Helge Hohmann, der Beauftragte für die Kirche von Westfalen, ständig Kontakt. Derzeit gibt es in den von ihm betreuten Gemeinden insgesamt 22 Kirchenasyle mit 34 Personen. Hohmann ist zudem Studienleiter am landeskirchlichen „Institut für Kirche und Gesellschaft“ in Schwerte, das sich intensiv mit Flucht, Migration und Integration beschäftigt. „Seit Juni 2018 werden circa 97 Prozent aller Härtefallanträge vom BAMF abgelehnt. Das betrifft sehr häufig schwer traumatisierte Menschen oder solche, die von wichtigen Familienmitgliedern getrennt werden würden, oder sogar schwangere Frauen und kleine Kinder“, sagt Hohmann.

Der Pfarrer erzählt, für die Gemeinden sei nicht mehr erkennbar, dass deren Einlassungen zum Kirchenasyl wirklich ernsthaft und mit dem Ziel geprüft würden, humanitäre Notlagen zu vermeiden. „Vielmehr entsteht der Eindruck, dass das Kirchenasyl auf kaltem verwaltungstechnischem Weg ausgehebelt werden soll“, klagt Hohmann. Wegen der Coronavirus-Krise fehle dem BAMF Personal, um Härtefalldossiers zu prüfen. Viele Mitarbeiter seien an die Bundesagentur für Arbeit ausgeliehen worden, weil es dort einen Berg von Anträgen auf Kurzarbeit gebe.

Sein Gütersloher Glaubensbruder Salzmann empfindet die Bearbeitungszeiten beim BAMF als großes Ärgernis. „Die fallen unterschiedlich aus und sind völlig unberechenbar – und aus unserer Sicht nicht nachvollziehbar. Mal geht es flott, mal vergeht unendlich viel Zeit“, so Salzmann. Der Theologe sagt, dass seine Gemeinde momentan keine weiteren Kirchenasyle plane. Im Notfall aber," stünden er mit seinen Mitstreitern dafür schnell bereit."""
Ralf Stegner – „Justiz muss dem mit aller Konsequenz nachgehen“;
"Ganze Hausgemeinschaften trafen sich zum Suizid am See;""Das Panzerdenkmal in Lalendorf östlich von Güstrow erinnert an den Einmarsch der Roten Armee 1945"

Als die Rote Armee im Mai 1945 in Güstrow in Mecklenburg einrückte, kam es zu einer entsetzlichen Selbstmordwelle. Dies zeigt eine neue Studie, die zugleich den Mythos von der „kampflosen Übergabe“ der Stadt widerlegt.

Anzeige

Die Stadt Güstrow in Mecklenburg-Vorpommern ist einer neuen wissenschaftlichen Untersuchung zufolge Anfang Mai 1945 nicht kampflos an die Rote Armee übergeben worden, sondern wurde widerstandslos besetzt. Die „kampflose Übergabe“ sei ein Mythos, erklärte der Rostocker Historiker Ingo Sens bei der Vorstellung seiner Forschungsergebnisse in Güstrow. Die Stadt sei beschossen worden. Sowjetische Soldaten hätten auch Einwohner getötet. Die Stadt hatte die Universität Rostock mit der Aufarbeitung der damaligen Ereignisse beauftragt. Für das Anfang 2018 gestartete Projekt stellte die Gemeinde rund 63.000 Euro zur Verfügung.

Der Einmarsch der sowjetischen Truppen habe am 2. Mai gegen 17 Uhr unter Artillieriebeschuss begonnen und zu mehreren Toten geführt, sagte der promovierte Historiker. Der Beschuss richtete nur geringe Schäden an Gebäuden an, etwa an den Türmen von Dom und Pfarrkirche. Bereits in den Morgenstunden des 3. Mai befand sich Güstrow vollständig in der Hand der sowjetischen Armee. Es kam zu ersten Plünderungen und Vergewaltigungen. Ein Drittel der Häuser wurde durch die Rote Armee geräumt.

Güstrow überstand den Zweiten Weltkrieg weitgehend unzerstört. Das Foto zeigt die Eisenbahnstraße, damals Adolf-Hitler-Straße Quelle: picture alliance / arkivi

Der Beschuss beim Einmarsch beweise auch, dass die Rote Armee Wilhelm Beltz (1890–1961) misstraut habe, sagte Sens. Der deutsche Hauptmann a.D. soll am 1. Mai zusammen mit einer ukrainischen Dolmetscherin und einer dritten, nicht mehr genau verifizierbaren Person in Plaaz mit den sowjetischen Truppen angeblich verhandelt haben. Laut Sens hatte Beltz dafür aber kein Mandat, keinen Auftrag. Offiziere der Roten Armee hätten Beltz dabei befragt, ob Widerstand in Güstrow zu erwarten sei.

Anzeige

Anders als etwa in Demmin kam es in Güstrow nicht schon im Vorfeld des Einzugs der sowjetischen Truppen zu vermehrten Suiziden, sondern erst, als die Rote Armee schon in der Stadt war, berichtete Sens. Ab dem 2. Mai abends bis zum 9. Mai gab es demnach 332 gesicherte Suizide und damit eine Selbstmordwelle.

Lesen Sie auch Massenselbstmord von Demmin Mütter banden Steine an ihre Kinder und ertränkten sie

Viele Familien und Hausgemeinschaften hätten sich gewissermaßen zum Suizid getroffen, etwa am See, so der Historiker. Weitere 43 Suizide wurden bis zum Jahresende 1945 registriert. Zudem wurden 50 Sterbefälle nach dem Einmarsch der Roten Armee bis Ende 1945 durch die Besatzungsmacht verursacht durch Erschießen, Überfahren oder Sprengkörperverletzungen.

Der evangelische Pastor an der Pfarrkirche, Sibrand Siegert (1890–1954), wurde nach Angaben zum Chronisten der Selbstmordwelle in Güstrow. Als Siegert im Januar 1945 aus dem Krieg nach Güstrow zurückkehrte, habe er eine Widerstandsgruppe aus bürgerlichen Kreisen aufgebaut, sagte Sens. Aus dieser Gruppe heraus sei die Kontaktaufnahme mit der Roten Armee am 1./2. Mai 1945 in Plaaz erfolgt.

Lesen Sie auch Kriegsende 1945 Als die Selbstmord-Epidemie Deutschland heimsuchte

Anzeige

Relativ schnell geriet Siegert in Konflikt mit den neuen Machthabern. Im November 1947 wurde der Theologe – inzwischen Landessuperintendent – vom sowjetischen Militärkommandanten der Stadt und des Kreises Güstrow mit einer Geldstrafe von 5000 Mark belegt, weil er im Kirchenarchiv „nazistische und militaristische“ Literatur aufbewahrt haben soll.

Als Fazit seiner Forschungsergebnisse schlug Ingo Sens der Stadt vor, das Gräberfeld auf dem Güstrower Friedhof zu einem zentralen Gedenkort zu machen und dabei auch falsche Namensschreibweisen und Sterbedaten zu korrigieren. Zudem sollte die Kommune ein Konzept zur Erinnerungskultur erarbeiten sowie zahlreiche Akten im Stadtarchiv im Rahmen eines Projektes vom Registratur- ins Archivgut überführen.

Nach Worten von Bürgermeister Arne Schuldt (parteilos) sollen die Forschungsergebnisse von Ingo Sens in einem Buch publiziert werden, das in der Güstrow-Information verkauft werden soll. Außerdem soll die Untersuchung Eingang ins Stadtmuseum finden.

Anzeige

Sie finden „Weltgeschichte“ auch auf Facebook. Wir freuen uns über ein Like.

Sollten Sie selbst das Gefühl haben, dass Sie Hilfe benötigen, kontaktieren Sie bitte umgehend die Telefonseelsorge. Unter der kostenlosen Rufnummer 0800-1110111 oder 0800-1110222 erhalten Sie Hilfe von Beratern," die Ihnen Auswege aus schwierigen Situationen aufzeigen können. Weitere Hilfsangebote gibt es bei der Deutschen Gesellschaft für Suizidprävention."""
"Kritik an Annie Leibovitz‘ Bildern von Turnerin Simone Biles;""An dieser Stelle finden Sie Inhalte aus Twitter Um mit Inhalten aus Twitter und anderen sozialen Netzwerken zu interagieren oder diese darzustellen", brauchen wir Ihre Zustimmung. Soziale Netzwerke aktivieren

Simone Biles ist der Titelstar der neuen „Vogue“-Ausgabe. Fans der US-amerikanischen Turnerin sind begeistert von dem bewegenden Feature. In der Titelgeschichte spricht die olympische Goldmedaillengewinnerin über ihren Weg zum Erfolg, ihre Vorbildrolle und wie sie nach dem Larry-Nassar-Skandal um sexuellen Missbrauch ihre Stimme wieder fand. Dennoch hagelt es in den sozialen Medien, insbesondere auf Twitter, auch viel Kritik.

Anzeige

Und zwar an den Porträts, die die bekannte amerikanische Fotografin Annie Leibovitz für das US-Magazin aufnahm. Die Kritik: Die Fotos des Cover-Shootings seien zu schlecht ausgeleuchtet und bearbeitet worden, sodass sie Biles‘ Hautfarbe nicht optimal schmeicheln würden.
