title;text
Wear OS ist das Betriebssystem für all jene Smartwatch-Nutzer, die auf Googles Android setzen möchten. Einer der Hauptunterschiede zwischen Wear-OS-Modellen und Apple Watches ist, dass das Android-basierte System nicht zwingend Smartphone voraussetzt, Apple-Watch-Nutzer hingegen ein iPhone benötigen.

Samsung-Smartwatch: Diese Alternativen laufen auf Tizen OS

Anzeige

Samsung setzt bei seinen neueren Smartwatch-Modellen hingegen nicht auf Wear OS, sondern auf das Betriebssystem Tizen OS. Zu den bekannten Samsung-Modellen gehört die Samsung Galaxy Watch* sowie die Galaxy Watch Active*.

Letztere bietet unter anderem GPS, einen Pulsmesser, einen Höhenmesser und ein Barometer. Die Galaxy-Watch kommt ohne diese Features, bietet aber unter anderem die Möglichkeit, die Uhr als MP3-Player zu nutzen und mit GPS-Streckenaufzeichnung ihre Fitness zu überprüfen. Die Galaxy Watch Active ist hingegen für Sportler konzipiert.

Optisch sehen die Modelle wie klassische Analoguhren auf, erst nach einem genaueren Blick entpuppen sie sich als digitale Smartwatches.

Anzeige Smartwatch Samsung Galaxy Watch jetzt online kaufen

Anzeige Smartwatch Samsung Galaxy Watch Active jetzt online kaufen

FitBit OS

Anzeige

Ein weiteres Betriebssystem ist FitBit OS der Firma Fitbit, die sich vor allem auf Fitnesstracker spezialisiert. iPhone-Fans könnten eventuell an der Optik der FitBit Versa Gefallen finden, die Apple-Modellen ähnlich sieht. Die FitBit Versa* bietet eine kontinuierliche Herzfrequenzmessung, einen MP3-Player sowie diverse Fitness-Apps – und das bei einer Akkulaufzeit von vier Tagen.

Anzeige Smartwatch Fitbit Versa jetzt online kaufen

Lesen Sie auch Kabellose In-Ear-Kopfhörer Sparen bei AirPods - das sind die Alternativen für Technik-Fans

iPhone Smartwatch: Diese sind kompatibel

Wer keine Apple Watch kaufen möchte, aber dennoch ein Modell sucht, das mit dem Betriebssystem iOS kompatibel ist, um es mit seinem iPhone zu nutzen, der hat die Wahl zwischen diversen Modellen.

Alle drei genannten Betriebssysteme bieten Modelle, die Sie auch mit Ihrem iPhone bedienen können. Wer auf WearOS-Uhren setzt, kann unter anderem die Watch GT des chinesischen Herstellers Huawei ins Auge fassen, die mit Apples Betriebssystem kompatibel ist.

Anzeige

Hier haben Sie die Wahl zwischen dem Elegant- und dem Active-Modell. Die elegante Version* besitzt ein 1,2-Zoll-AMOLED-Display und hat eine Akkulaufzeit von einer Woche. Das Active-Modell* hat eine deutlich höhere Batterieleistung: Bis zu zwei Wochen hält der Akku. Der Bildschirm ist mit 1,39“ (ebenfalls AMOLED) etwas größer. Beide Smartwatches verfügen über einen Speicherplatz von 128 MB und 16 MB Ram.

Auch Modelle von TicWatch* und Fossil* basieren auf dem Android-Betriebssystem und können mit dem iPhone kombiniert werden.

Anzeige Smartwatch TicWatch C2 jetzt online kaufen

Anzeige Smartwatch Fossil Q Venture jetzt online kaufen

Auch die FitBit Ionic*, die mit dem Betriebssystem FitBit OS läuft, ist vollständig mit iOS kompatibel und synchronisiert laut Herstellerangaben automatisch mit mit über 200 gängigen iOS, Android und Windows-Geräten. Die FitBit kommt optisch als moderne Smartwatch im simplen Design daher – ihr Display ist etwas kleiner als jenes der Apple Watches. Hier gibt es allerdings Einschränkungen: Textnachrichten können über die FitBit Blaze nicht beantwortet werden, auch die Apple-Health-App wird nicht unterstützt.

Anzeige Smartwatch Fitbit Ionic jetzt online kaufen

In einem besonderen Design – nämlich als Analoguhr mit kleinem digitalen Display kommt die Withings/Nokia Steel*. Das Besondere: Sie bietet laut Hersteller eine Akkulaufzeit von ganzen 25 Tagen. Eine besonderheit dieses Modells: Sie bietet Schlafmonitoring, analysiert Ihre Schlafphasen und bietet eine Smart Wake-Up Funktion an, die sie im richtigen Moment bzw. in der richtigen Schlafphase aufwecken soll.

Anzeige Smartwatch Withings Steel HR Hybrid jetzt online kaufen

Aber auch die Samsung Galaxy Watch lässt sich mit dem iPhone verbinden – mit einigen Grundvoraussetzungen: man benötigt iOS 9.0 oder eine neuere Version, Modelle vor dem iPhone 5 sind nicht kompatibel, iPad oder iPod Touch ebenfalls nicht.

Lesen Sie auch Für Alltag und Sport So finden Sie die richtige Fitness-Smartwatch

Apple Watch Alternative: Was Sie beim Kauf beachten müssen

Vor allem ältere iPhone- und Smartphone-Modelle sind oft nicht miteinander kompatibel – und nicht alle Smartwatches unterstützen alle Funktionen Ihres iPhones. Informieren Sie sich vor dem Kauf über die Mindestanforderungen. Besitzer einer Wear OS basierten Smartwatch können auf der von Google erichteten Website https://wearos.google.com erfahren, ob ihr Smartphone oder iPhone mit ihrer Smartwatch kompatibel ist. Prinzipiell sind Smartphones ab Android 6.0 und iPhones ab iOS 10.0 kompatibel.

*Sollten Sie über die mit einem Stern gekennzeichneten Links einen Kauf abschließen, erhält WELT eine geringe Provision. Unsere Standards der Transparenz und journalistischen Unabhängigkeit finden Sie unter axelspringer.de/unabhaengigkeit.

"Dieser Artikel wurde erstmals am 11.10.2019 veröffentlicht."""
"Sparen bei AirPods - das sind die Alternativen für Technik-Fans;""Anzeige"

Auch wenn Apple anfangs von Kritikern dafür verspottet wurde, mit den AirPods hochpreisige In-Ear-Kopfhörer entwickelt zu haben, die dank kabelloser Technik vor allem leichter zu verlieren seien, so haben sich Qualität, Design und Funktionalität der multifunktionalen Headphones mittlerweile durchgesetzt – so sehr, dass selbst die neue Variante Airpods Pro* für weit mehr als 200 Euro sehr gefragt ist. Dafür bekommen Technik-Fans aber auch die perfekte Passform und die lang ersehnte aktive Geräuschunterdrückung.

Anzeige Apple AirPods Pro jetzt online kaufen

Viele sehen sich aber auch nach Bluetooth-EarPods um, die günstiger als das Markenprodukt sind. Dabei fällt auf: Sowohl beim Design als auch bei der Technologie orientieren sich viele Hersteller inzwischen an den Wireless-Kopfhörern von Apple – nur dass die Preise oft deutlich niedriger sind.

Anzeige Prime Day Jetzt bei Amazon stöbern und Schnäppchen sichern Am 13. & 14. Oktober ist Amazon Prime Day. Das bedeutet: Tausende Artikel sind teils stark reduziert. Einzelne Produkte gibt es jetzt schon zum Schnäppchenpreis.

Bluetooth-EarPods: Diese sind fast wie das Original

Eines vorweg: Für Original-AirPods* mit kabellosem Ladecase zahlt man normalerweise 229 Euro – auf Amazon sind die In-Ear-Kopfhörer sogar noch für ein paar Euro weniger zu haben. Gerade für Sportler oder auf Reisen sind sie praktisch – genau hier muss bei EarPods Bluetooth meist Standard sein, um ohne störendes Kabel trainieren, arbeiten oder entspannen zu können.

Anzeige Apple AirPods Original mit kabellosem Ladecase

Anzeige

Das Konkurrenzprodukt Sony WF-1000XM3* bewegt sich in einem ähnlichen Preisrahmen, obwohl sich die Kosten dank häufiger Aktionen oder Rabatte teils knapp unter der 200-Euro-Grenze bewegen. Nutzer beschreiben die Noise-Cancelling-Funktion der Wireless Earbuds allerdings als konkurrenzlos.

Anzeige Sony Sony WF-1000 XM3 jetzt online kaufen

Eine hochwertige Alternative unter 200 Euro bieten zum Beispiel die Libratone Track Air True Wireless In-Ear-Kopfhörer*. Mit Ladecase beträgt die Akkulaufzeit bis zu 32 Stunden, davon 8 Stunden ohne Aufladen zwischendurch. Dank Doppelmikrofon werden störende Hintergrundgeräusche ausgefiltert. Ein weiteres Merkmal ist die programmierbare Touch-Steuerung. Schweiß oder Spritzwasser macht ihnen nichts aus.

Anzeige Libratone Libratone In-Ear-Kopfhörer jetzt online kaufen

Wer so viel nicht ausgeben möchte, findet ein gutes Preis-Leistungsverhältnis bei den Oneplus Buds*. Sie bieten eine Laufzeit von bis zu 6,5 Stunden, durch die Schnelladefunktion des mitgelieferten Case sind insgesamt 24 Stunden Nutzung möglich. Praktisch für alle, die ihre Buds auch für Telefonate nutzen: Drei Mikrofone sorgen dafür, dass Hintergrundgeräusche selbst an lärmintensiven Orten wie öffentlichen Verkehrsmitteln auf ein Minimum reduziert werden. Auch Gamer loben die Oneplus Buds für den nuancierten Sound.

Anzeige ONEPLUS Oneplus Buds jetzt online kaufen

AirPods Alternative unter 100 Euro

Anzeige

Eine Alternative, die für weniger als 100 Euro sauberen Klang und hübsches Design bietet, findet sich bei Bang & Olufsen: Die Beoplay E8 Bluetooth-Earbuds* kosten um die 85 Euro. Es gibt sie in den Farben schwarz und dunkelgrau, ein Ladecase ist im Lieferumfang enthalten.

Anzeige Bang & Olufsen Beoplay E8 Bluetooth-Earbuds jetzt online kaufen


