title;text
„Jeder Einzelne ist mitverantwortlich dafür," dass sich das Virus nicht weiter ausbreitet“;""Wie kommt die Wirtschaft", wie kommt die Gastronomie durch Herbst und Winter? Die Handelskammer Hamburg will weitere Beschränkungen des öffentlichen Lebens verhindern und richtet einen eindringlichen Appell an die Bürger.

Anzeige

Die Hamburger Wirtschaft verstärkt ihre Anstrengungen, um die Schutzmaßnahmen im Umgang mit dem Coronavirus zu verbessern und weitere Beschränkungen des öffentlichen Lebens zu verhindern. Norbert Aust, Präses der Handelskammer Hamburg, präsentierte am Freitag gemeinsam mit dem Ersten Bürgermeister Peter Tschentscher (SPD) die neue Kampagne „Wir geben Corona keine Chance!“.

Die Kammer stützt sie unter anderem mit Plakaten und Aufklebern, die in den Geschäftsräumen der Unternehmen zur Einhaltung der Gesundheitsregeln mahnen sollen. Aust sagte, ein weiterer Lockdown nach jenem im Frühjahr, „wäre für unsere Hamburger Wirtschaft ein erschreckendes Szenario und für unser Gemeinwesen verheerend. Jeder Einzelne ist mitverantwortlich dafür, dass sich das Virus nicht weiter ausbreitet.“

Lesen Sie auch Wachsende Corona-Gefahr Schule, Gastronomie, Ärzte - So ist Deutschland für die zweite Welle gerüstet

Aktuelle Befragungen der Handelskammer deuteten eine leichte Erholung der Hamburger Wirtschaft an, sagte Aust. Diese dürfe aber durch Leichtfertigkeit im Umgang mit dem Virus nicht gefährdet werden: „Jeder, der durch Abstandhalten, Händewaschen und das Tragen von Alltagsmasken seinen Beitrag leistet, sichert unsere Freiheit.“

Anzeige

Tschentscher sagte: „Alle Bürger müssen sich dieser Kampagne widmen.“ Hamburg sei bei den Infektionszahlen bislang bessergestellt als die meisten anderen deutschen Großstädte, weil die Bürger überwiegend diszipliniert seien. Der Senat unternehme alle Anstrengungen, um eine weitere Steigerung der Infektionszahlen zu vermeiden. An die Hamburgerinnen und Hamburger appellierte er: „Bitte vermeiden Sie Reisen in die aktuellen Risikogebiete.“

Beim Club Hamburger Wirtschaftsjournalisten (CHW) hatte Tschentscher diese Woche ausgeführt, dass das Bruttoinlandsprodukt der Hansestadt in diesem Jahr voraussichtlich stärker zurückgehen werde als in Deutschland insgesamt. Sorge bereiteten ihm vor allem Wirtschaftsbranchen wie die Luftfahrtindustrie, deren Geschäftsvolumen auch nach einem erhofften baldigen Ende der Pandemie womöglich nicht wieder das frühere Niveau erreiche.

Von den Auswirkungen der Pandemie waren in den vergangenen Monaten besonders auch die Gastronomie und die Hotelwirtschaft betroffen. Nach der weitgehenden Lockerung der Corona-Beschränkungen zeigte sich im Spätsommer vor allem auch in den Amüsiervierteln auf der Reeperbahn und im Schanzenviertel eine wachsende Sorg- und Disziplinlosigkeit der Gäste. Nach einem Corona-Ausbruch in der Szenebar „Katze“ im Schanzenviertel konnte die Stadtverwaltung nur mit großem Aufwand den Besucherkreis rekonstruieren, weil sich viele Gäste mit Fantasienamen wie „Darth Vader“ und mit falschen Telefonnummern in die obligatiorischen Kontaktlisten eingetragen hatten.

„Eine erneute Schließung kann sich niemand leisten“

Der Unternehmer Florian Brill, Vorsitzender des Ausschusses für Gesundheitswirtschaft der Handelskammer Hamburg, sagte: „In den Gastronomiebetrieben der Hansestadt sind auch ,Donald Trump‘ und ‚Asterix‘ willkommen, sofern sie nach ihren Besuchen die richtigen Telefonnummern hinterlassen.“ Ellen Kartenbeck, Vorsitzende des Ausschusses für Tourismus und Gastgewerbe, sagte, in den Hamburger Restaurants seien die Gäste sicher, die Vorkehrungen dafür seien getroffen. Letztlich komme es aber auf die Eigenverantwortung aller Beteiligten an," zum Beispiel dabei gemäß den Vorschriften Mund- und Nasenschutz zu tragen: „Eine erneute Schließung seines Restaurants aufgrund steigender Infektionszahlen kann sich niemand leisten.“"""
"Paul-Ehrlich-Institut genehmigt neue Impfstofftests;""Anzeige"

Das für die Zulassung von Impfstoffen zuständige Paul-Ehrlich-Institut hat erste Tests mit einem Covid-19-Impfstoff genehmigt, der auf einem Impfstoff gegen Pocken basiert. Die klinische Prüfung des Impfstoffs MVA-Sars-2-S soll noch Anfang Oktober im medizinischen Auftragsinstitut CTC North am Universitätsklinikums Hamburg-Eppendorf (UKE) starten, wie das UKE am Freitag mitteilte. Rekrutiert werden die ersten der insgesamt 30 Studienteilnehmer.

Antragsteller ist das Deutsche Zentrum für Infektionsforschung (DZIF), an dem neben dem UKE auch die Ludwig-Maximilians-Universität München (LMU), die Philipps-Universität Marburg und das Pharmaunternehmen IDT Biologika aus Dessau-Roßlau beteiligt sind. In der ersten Phase der klinischen Prüfung wird der Impfstoff auf Sicherheit, Verträglichkeit und auf seine spezifische Immunantwort gegen den Erreger untersucht. Es gibt bereits etliche Impfstoffe, die in der entscheidenden dritten Phase der klinischen Prüfung sind.

Lesen Sie auch Covid-19-Impfstoff Am Tag der Hiobsbotschaft vermeldet der deutsche Hoffnungsträger einen Erfolg

Lesen Sie auch Karl Lauterbach „Ich rechne erst im kommenden Jahr mit Antigentests“

Bei dem neuen Impfstoff handelt es sich den Angaben zufolge um einen sogenannten Vektor-Impfstoff gegen das Sars-CoV-2-Virus. Dabei wird die genetische Information für ein Oberflächenprotein des Sars-CoV-2-Virus in ein abgewandeltes und damit harmloses Pockenvirus (MVA) eingebaut. Dieser virale Vektor könne sich nicht vermehren. Allerdings könne die eingeschleuste DNA-Sequenz – das Bauteil des Coronavirus – eine Infektion simulieren und die Produktion von Antikörpern und T-Zellen auslösen.

Anzeige

„Ich gratuliere Frau Professorin Marylyn Addo und ihrem gesamten Team am Universitätsklinikum Hamburg-Eppendorf zu diesem ersten Meilenstein auf dem Weg zu einem wirksamen Corona-Impfstoff“, sagte Hamburgs Wissenschaftssenatorin Katharina Fegebank (Grüne) am Freitag. Sie freue sich, „dass Hamburger Wissenschaftlerinnen und Wissenschaftler mit ihrer herausragenden Forschungsarbeit einen entscheidenden Beitrag dazu leisten können, die Pandemie wirksam zu bekämpfen“. Klar ist Fegebank zufolge: „Nur mit exzellenter Forschung und wissenschaftlicher Expertise können wir das Virus dauerhaft in den Griff bekommen.“

Lesen Sie auch Uniklinikum Hamburg-Eppendorf Fehler, Hoffnung, Brillanz - und eine Katastrophe

Das Ausgangsvirus MVA wurde schon vor mehr als 30 Jahren an der LMU als sicherer Impfstoff gegen Pocken generiert und bereits erfolgreich für die Entwicklung eines Impfstoffs gegen das Mers-Coronavirus verwendet. Das Pharmaunternehmen IDT Biologika hat laut UKE nun eine Zelllinie und ein Verfahren zur großtechnischen Produktion von hochreinen MVA-Vektorimpfstoffen entwickelt.

Zudem seien die Produktion sowie die Abfüllung der Impfstoffdosen für die erste klinische Prüfung am Menschen bereits abgeschlossen. Dass der MVA-Vektorimpfstoff gegen Sars-CoV-2 die gewünschten Immunantworten und eine Schutzwirkung zeigt, konnte bereits in präklinischen Modellen der Universitäten Marburg und München gezeigt werden, wie es weiter aus dem UKE heißt.

Mitte Oktober sollen erste Freiwillige Corona-Impfstoff erhalten

Anzeige

Anfang Oktober wird die Studie mit den Voruntersuchungen und der Auswahl gesunder und freiwilliger Probanden in Hamburg beginnen. Voraussichtlich Mitte Oktober soll der erste Proband beziehungsweise die erste Probandin mit dem Impfstoff zunächst in einer niedrigen Dosis geimpft werden. Aus Sicherheitsgründen wird nur ein Proband geimpft und erst 24 Stunden später die nächsten zwei. Insgesamt werden die 30 Probanden im Alter von 18 bis 55 Jahren in acht Gruppen und in zwei aufsteigenden Dosierungen geimpft.

Die Studienteilnehmer erhalten zwei Impfungen im Abstand von vier Wochen und werden nach den Impfungen jeweils einige Stunden ärztlich überwacht. An den Tagen nach den Impfungen sowie im Verlauf der folgenden sechs Monate müssen die Probanden regelmäßig zu ambulanten Nachuntersuchungen kommen, um die Verträglichkeit des Impfstoffs, mögliche Nebenwirkungen sowie die Immunantwort anhand von Blutuntersuchungen und Befragungen zu überprüfen. Parallel messen die Wissenschaftler die Bildung von Antikörpern und T-Zellen im Körper und vergleichen diese mit der Immunreaktion von genesenen Covid-19-Patienten.

„Eine größere klinische Studie der Phase II ist für Ende des Jahres geplant, wenn die Ergebnisse der Phase I Studie ein gutes Sicherheitsprofil und gute Impfstoff-induzierte Immunantworten zeigen“," erklärte die Hamburger Medizinerin Addo. Sie ist die Leiterin der UKE-Infektiologie und leitet als verantwortliche Prüfärztin die klinische Studie."""
FC Bayern München gewinnt Supercup;
Flick lobt Kimmich und Team-Mentalität;
Darum stört Favre die Supercup-Pleite nicht;
"""Hätten auch gewinnen können"";"
"Das Image des Verkehrsministers wird zum Problem;""Erst in den frühen Morgenstunden wird Andreas Scheuer aus der Anhörung im Untersuchungsausschuss entlassen. Der Bundesvekehrsminister weist weiterhin alle Vorwürfe von sich – wird von den Maut-Betreibern jedoch schwer belastet."

Anzeige

Unser Gedächtnis ist tückisch. Wie der Schriftsteller Max Frisch schrieb: „Jeder von uns wird sich eines Tages die Biografie erfinden, die er für sein Leben hält.“ Politikern geht es dabei nicht anders. Doch es ist immer dumm, wenn sich Politiker auf Gedächtnislücken berufen. Zwar kann niemand verlangen, dass sich etwa ein Verkehrsminister an alle Details eines Gesprächs erinnert, das vor zwei Jahren stattfand. Doch weil es so ist, gibt es Protokolle – oder sollte es sie geben.

Eines der beunruhigendsten Ergebnisse des Parlamentarischen Untersuchungsausschusses zum Pkw-Maut-Desaster besteht in der Erkenntnis, dass es nicht nur Geheimgespräche zwischen Regierungs- und Unternehmensvertretern gegeben hat, sondern dass darüber offenbar keine Protokolle angefertigt worden sind.

So erinnerten sich plötzlich zuerst einer, dann drei Manager der mit der Mautabwicklung betrauten Firmen zwei Jahre nach den fraglichen Treffen, sie hätten dem Bundesverkehrsminister angeboten, die entsprechenden Verträge erst nach dem letztinstanzlichen Urteil des Europäischen Gerichtshofs (EuGH) zu unterzeichnen, was aber abgelehnt worden sei.

Lesen Sie auch Andreas Scheuer Warum die CSU an ihrem Pannen-Minister festhält

Anzeige

Der betreffende Minister, CSU-Mann Andreas Scheuer, hat das zunächst vor dem Parlament geleugnet und beruft sich nun auf Gedächtnislücken. Niemand ließ ein Aufnahmegerät laufen? Niemand schrieb mit? Niemand hielt anschließend die Ergebnisse fest? Seit wann wird ein Treffen in einer so trivialen Sache wie dem Abzocken ausländischer Autobahnbenutzer organisiert wie ein Meeting zwischen dem lizenzierten Killer 007 und seiner Chefin M: „Wenn etwas schiefläuft: Dieses Gespräch hat nie stattgefunden.“

Da die drei Manager Firmen vertreten, die hohe Regressforderungen an Scheuers Verkehrsministerium – also an uns, die Steuerzahler – haben, besteht kein zwingender Grund, ihnen mehr Glauben zu schenken als dem Minister. Man darf sich schon fragen, welches Interesse sie gehabt haben sollen, dem Minister einen Aufschub der Unterzeichnung der hochlukrativen Verträge anzubieten.

Hätte der EuGH Scheuers Mautpläne bewilligt, hätten sie viel Arbeit gehabt und viel Geld verdient; durch die Ablehnung bekamen sie die Möglichkeit, ohne viel Arbeit auf dem Klageweg Geld zu verdienen. Für sie doch eine Win-win-Situation. Eigentlich hätte es im Interesse des Ministers – und der Steuerzahlerinnen, deren Geld er ausgibt – gelegen, mit der Unterschrift zu warten.

Lesen Sie auch „Masterplan“ für die Bahn Vermassel‘ es noch einmal, Andi!

Anzeige

Es muss außerdem der Verdacht im Raum stehen, die Erinnerung an die Details jenes ominösen Geheimgesprächs sei plötzlich aufgetaucht, nachdem Scheuer im September letzten Jahres die beteiligten Betreiberfirmen CTS Eventim und Kapsch verklagen ließ, weil sie angeblich nach dem Kippen der Mautpläne durch den EuGH Verträge im Volumen von mehr als 576 Millionen Euro vergeben hätten.

Auf beiden Seiten wird gepokert

Diese Klage wiederum wurde von manchen Beobachtern als Manöver im Zusammenhang mit zu erwartenden Entschädigungsforderungen der Betreiberfirmen gesehen. Es wird also auf beiden Seiten gepokert, und ob der Untersuchungsausschuss, der eigentlich die Interessen der Geldgeber, also der Steuerbürger, vertreten soll, angesichts von Geheimtreffen und Gedächtnislücken je die Wahrheit ermitteln wird, ist fraglich.

Das hat allerdings vor allem der Minister zu verantworten. Dabei kann einem Andreas Scheuer schon leidtun. Die Häme über das Scheitern seiner Mautpläne war allgemein, obwohl der Ansatz richtig war und vom EuGH nicht bezweifelt wurde, der sich im Grunde genommen auf Detailfragen bezog.

Anzeige

Es schien einer Mehrheit der deutschen Politiker und Publizisten wichtiger, dass der als ausländerfeindlich abgestempelten CSU eins ausgewischt wurde, als dass in einem auch umwelt- und verkehrspolitisch entscheidenden Bereich die Wende hin zum Nutzer- und Verursacherprinzip eingeläutet wurde. Scheuer avancierte zum bayerischen Buhmann der Nation.

Lesen Sie auch Neuer Bußgeldkatalog Unfreie Fahrt für unfreie Bürger

Pech hatte Scheuer auch mit seinem neuen Bußgeldkatalog. Vor allem die Verschärfung der Strafen gegen Raser war überfällig und richtig und übrigens europarechtskonform. Jedoch erlaubte es – wie bei der Pkw-Maut – schlechte Detailarbeit, insbesondere schlechte juristische Begründungen, den grundsätzlichen Gegnern verschärfter Strafen, den Katalog zu kippen. Dass Scheuer dann seinerseits umkippte und sich plötzlich von seinem eigenen Werk distanzierte, schien das Vorurteil zu bestätigen, er sei kein Verkehrsminister, sondern Sachwalter der rückständigsten Fraktion unter den deutschen Autofahrern.

Solange die CSU die Taktik eines Wandels der AfD-Wähler durch Annäherung verfolgte, war dieses Vorurteil vielleicht sogar parteipolitisch nützlich und gewollt. Inzwischen, da sich Markus Söder mit Blick auf eine immer wahrscheinlicher werdende schwarz-grüne Regierungskoalition nach der Bundestagswahl 2021 eindeutig und selbstkritisch von der Taktik distanziert hat," wird das Image seines Verkehrsministers zum Problem. Deshalb – und nicht wegen seiner Gedächtnislücken – dürfte Scheuer bald ausgetauscht werden. Sein Nachfolger muss in jeder Hinsicht sauberer arbeiten."""
"So meistern Eltern die größte Aufgabe des Jahres;""Man kennt das aus dem Kino oder Fernsehen. Das Kind hat Geburtstag", es soll der schönste Tag des Jahres werden. Mindestens. Ein neues Fahrrad, ein Trampolin, ein iPad als Geschenk reichen nicht. Die Party soll unvergesslich sein. Inzwischen sieht die Wirklichkeit oft so aus wie im Film. Eltern schlafen in den Wochen vor dem Geburtstag schlecht. Und hinterher stellt sich heraus, dass ein paar Stunden Kinderspaß ungefähr so teuer waren wie ein Kurzurlaub.
