title,text,author,published,tags,source
Kritiker interessieren mich nicht,,,1594622407,"Sport,Zinedine Zidane",welt
Ein Blick hinter die Kulissen der „Bubble“,"Die NBA-Saison wird Ende Juli in einer sogenannten ""Bubble"" in der Walt Disney World in Orlando fortgesetzt. Wir blicken hinter die Kulissen der einzigartigen Basketball-Szenerie.",,1594622282,"Sport,NBA",welt
Jose Mourinho vergleicht Europa League mit Formel 2,,,1594622219,"Sport,Tottenham Hotspur",welt
Die wichtigsten Fragen zum Restart der NBA,"Die beste Basketball-Liga der Welt wagt den Restart – ausgerechnet in Florida. Es wird ein komplett neues Spiel zu sehen sein. Was Sie vor dem Beginn des NBA-Turniers in seiner Disney-„Blase“ wissen sollten.

Anzeige

Irgendetwas stimmte beim Testspiel der Miami Heat gegen die Sacramento Kings nicht. Die Spieler wirkten zwar schon gut in Form, doch die Menschen im Publikum erschienen ungewöhnlich groß. Kein Wunder, schließlich jubelten die Zuschauer virtuell auf einer fünf Meter hohen Videoleinwand, die rund um das Spielfeld aufgebaut war. Die Fans konnten sich per Liveschalte auf die Bildfläche beamen und so zumindest für etwas Stimmung sorgen.

Die Marketingexperten der National Basketball Association (NBA) haben dem Restart der besten Liga der Welt das Motto „WholeNewGame“ verpasst – und tatsächlich ist es ein völlig neues Spiel. Vieles hat sich geändert, seit die Saison im März wegen der Coronavirus-Pandemie unterbrochen wurde.

Ein Meister soll dennoch gekürt werden. „Der Sport steht für uns alle hier im Vordergrund. Nach viermonatiger Pause bin ich wieder heiß zu spielen“, sagt der deutsche Nationalspieler Maxi Kleber WELT AM SONNTAG. Das sollten Sie vor dem Wiederbeginn am Donnerstag wissen:

Wo wird gespielt?

Anzeige

In Zeiten ernster Corona-Realität erscheint es beinahe zynisch, dass die NBA ihre Saison in der Traumwelt Walt Disneys fertig spielt. Der Tross aus Spielern, Verantwortlichen und ausgewählten Medienvertretern lebt in Disney World Orlando im Bundesstaat Florida.

An dieser Stelle finden Sie Inhalte aus Twitter Um mit Inhalten aus Twitter und anderen sozialen Netzwerken zu interagieren oder diese darzustellen, brauchen wir Ihre Zustimmung. Soziale Netzwerke aktivieren

Dort wird in einem riesigen Sportkomplex gespielt, insgesamt stehen drei große Hallen bereit. Das Training findet in großen Sälen statt, in denen die NBA teilweise sogar die originalen Spielfelder der Teams verlegen ließ.

Was ist die „Bubble“?

Mit immensem Aufwand hat die NBA in den vergangenen Wochen und Monaten gemeinsam mit den örtlichen Behörden daran gearbeitet, die Saison beenden zu können. Dazu wurde ein Hygienekonzept mit mehr als 100 Seiten ausgearbeitet. Die Teams leben in einer „Bubble“ (Blase), abgeschottet von der Außenwelt und unter strengsten Sicherheitsmaßnahmen.

Anzeige

Die Abstände der Teambetreuer zum Parkett wurden eigens für das Turnier erhöht, Medienvertreter sitzen hinter hohen Scheiben. Schließlich zählt der Bundesstaat Florida zu den Virushotspots in den USA. „Jeden Tag werden wir auf Covid-19 getestet. Als Spieler fühlt man sich hier sehr sicher und gegen Infektionen geschützt“, berichtet Kleber.

Lesen Sie auch Dirk Nowitzki „Es hätte sich nicht angefühlt, als ob ich das wäre“

Nachdem die Spieler an den ersten beiden Tagen in Orlando nicht einmal ihre teils fensterlosen Hotelzimmer verlassen durften, sind die Regeln mittlerweile gelockert worden. Die Profis können auf dem Gelände beispielsweise golfen oder angeln. Zudem gibt es Räume mit Videospielen, Tischtennis und Kartentischen. Nach Angaben der US-Medien sind Doppel im Tischtennis aber verboten, und nach jedem Kartenspiel wird ein frischer Kartensatz empfohlen. Sogar ein kleiner Friseursalon wurde gebaut.

Kleber ist mit den Bedingungen zufrieden. „Wir sitzen viel am Pool, spielen Karten oder Golf. Für die Teamchemie ist das sehr wichtig. Die NBA hat einen richtig guten Job gemacht und dafür gesorgt, dass uns nicht langweilig wird. Bald sollen auch Teile des Vergnügungsparks für uns Spieler geöffnet werden“, erzählt der 28-Jährige.

Maxi Kleber spielt mit den Dallas Mavericks in Disney World Quelle: dpa/David Zalubowski

Anzeige

Wer die Blase allerdings unerlaubt verlässt, muss danach wieder zehn Tage in Quarantäne und negative Tests vorweisen. Beim Thema Maskenpflicht sind die Basketball-Spieler fortschrittlicher als der Rest der USA. Lediglich während des Trainings beim Essen und auf dem eigenen Zimmer, das niemand anderes betreten darf, gilt keine Maskenpflicht. Verstöße können bei einer anonymen Hotline gemeldet werden.

Welche Teams spielen?

Die NBA hat 22 Mannschaften nach Florida eingeladen. Um eine möglichst gerechte Auswahl zu treffen, hat die Liga sich für eine besondere Konstellation entschieden. Die 16 Teams, die zum Zeitpunkt der Saisonunterbrechung auf den Play-off-Rängen lagen, dürfen in Orlando starten. Dazu kommen sechs Klubs, die maximal sechs Siege Rückstand auf den achten Platz in ihrer Conference hatten. Der Westen stellt 13 Teams, der Osten neun.

Wie ist der Modus?

Jede Mannschaft absolviert vor dem Play-off-Start acht Begegnungen. Diese beginnen am Donnerstag und werden bis zum 14. August ausgetragen. Die ersten sieben Teams aus Ost und West nehmen sicher am Play-off teil.

Lesen Sie auch NBA in Disney World Essen bestellt, beim Lieferanten bezahlt, in Quarantäne geschickt

Darüber hinaus hat sich die NBA eine neue Regel ausgedacht: Sollte der Tabellenneunte maximal vier Siege hinter dem Achten liegen, würden beide Teams noch einmal gegeneinander antreten. Gewinnt der Achte, zieht dieser in das Play-off ein, gewinnt der Neunte, gibt es noch ein weiteres Duell. Das zweite Spiel entscheidet dann über die Teilnahme an der Meisterrunde.

Wie laufen die Play-offs?

Die Play-offs werden wie gewohnt ausgespielt. Zunächst tritt der Erste der jeweiligen Conference gegen den Achten an, der Zweite trifft auf den Siebten und so weiter. Wer zuerst vier Spiele gewonnen hat, zieht in die nächste Runde ein. Eine kleine Abweichung gibt es jedoch auch hier.

Neuer Slogan: Ein völlig anderes Spiel erwartet die NBA-Zuschauer Quelle: AP/Tim Reynolds

Der Heimvorteil, den sich das jeweils bessere Team in der Punkterunde erspielt hat, fällt in der Blase von Orlando natürlich weg. Wer es bis ins Finale schafft, wird übrigens noch lange Zeit im Freizeitpark verbringen. Der Finalstart ist für den 30. September angesetzt, ein mögliches siebtes Finalspiel würde erst am 13. Oktober ausgetragen.

Wer kämpft um den Titel?

Die Milwaukee Bucks um den wertvollsten Spieler der vergangenen Saison, Giannis Antetokounmpo, sind für viele Experten nach wie vor ein heißer Titelkandidat. Mit 53 Siegen und nur zwölf Niederlagen hatte sich das Team aus Wisconsin vor Corona die beste Bilanz der NBA erspielt.

LeBron James (hinten) gegen Giannis Antetokounmpo: Viele Experten halten die beiden Superstars für die Titelfavoriten Quelle: picture alliance / ZUMAPRESS.com

Anzeige

Zum Kreis der Titelanwärter zählen zudem die beiden Teams aus Los Angeles. Die Clippers treten mit ihren Superstars Kawhi Leonard und Paul George an, die Lakers halten mit Altmeister LeBron James und Center Anthony Davis dagegen. Außenseiterchancen werden den Toronto Raptors, den Boston Celtics und den Houston Rockets eingeräumt.

Doch vor allem die Lakers stehen im Blickpunkt. Der 35 Jahre alte James will trotz der ungewohnten Bedingungen unbedingt seinen vierten Meistertitel gewinnen. „Jeder fragt mich, wie es in der Blase ist, und ich sage immer: Es ist 2020. Nichts ist normal 2020. Niemand weiß, ob es jemals wieder so sein wird, wie es war. Aber du passt dich an und findest einen Weg. Darum geht es im Leben“, erklärte der Lakers-Star.

Sind Deutsche dabei?

Dennis Schröder will die Blase schon bald wieder verlassen. Der Aufbauspieler der Oklahoma City Thunder wird zum zweiten Mal Vater, der Geburtstermin soll in der zweiten Augustwoche liegen. „Ich werde meine Frau nicht allein lassen, während sie das zweite Baby bekommt“, betonte der 26-Jährige zuletzt.

Die Stars sind heiß auf den Restart Die NBA startet Ende Juli wieder in Disney World in Orlando. Die Stars sind schon aufgeregt. Das sind ihre Erwartungen vor dem Restart. Quelle: Omnisport

Kleber und die Dallas Mavericks zählen in Disney World zwar nicht zu den Meisterschaftskandidaten, könnten aber die Favoriten ärgern. Daniel Theis von den Boston Celtics sprach in Interviews derweil selbstbewusst davon, dass der Rekordmeister das beste Team aus dem Osten sei. Moritz Wagner und Isaac Bonga werden mit den Washington Wizards keine Rolle im Titelkampf spielen.

Lesen Sie auch Klopps Ernährungsberaterin „Antioxidantien sind kein Trend, sie sind maßgeblich“

Hier finden Sie unseren Live-Ticker mit allen relevanten Updates zur Corona-Krise.",Rouven Chlebna,1596003084,"Basketball,„WholeNewGame“",welt
"684 Neuinfektionen in Deutschland, R-Wert weiter deutlich über 1","Der britische Gesundheitsminister Matt Hancock hat für London die zweithöchste Corona-Warnstufe ausgerufen. Das RKI meldet mit 6638 so viele Neuinfektionen an einem Tag wie noch nie seit Ausbruch der Coronavirus-Pandemie in Deutschland. Ein Überblick in Grafiken und Zahlen.

Anzeige

Die Zahl der binnen eines Tages mit dem Coronavirus neu infizierten Menschen in Deutschland ist erneut sprunghaft gestiegen und hat damit einen Rekordwert erreicht. Die Gesundheitsämter meldeten nach Angaben des Robert-Koch-Instituts vom Donnerstagmorgen 6638 Neuinfektionen – rund 1500 mehr als am Mittwoch. Da waren noch 5132 neue Fälle gemeldet worden. Bislang waren Ende März mit knapp 6300 Neuinfizierten die meisten registriert worden. Allerdings sind die jetzigen Werte nicht mit denen aus dem Frühjahr vergleichbar, weil mittlerweile wesentlich mehr getestet wird – und deshalb auch mehr Infektionen entdeckt werden.

Am Mittwoch vergangener Woche hatten die Gesundheitsämter dem RKI 4059 Neuinfektionen mitgeteilt. Damit war zum ersten Mal seit April die 4000er-Marke überschritten worden.

Bei den intensivmedizinisch behandelten Covid-19-Patienten zeichnet sich ein deutlicher Anstieg ab. Laut RKI-Lagebericht wurden am Donnerstag 655 Corona-Infizierte intensivmedizinisch behandelt, 329 davon wurden beatmet. Eine Woche zuvor (8.10.) hatte der Wert noch bei 487 (239 beatmet) gelegen, in der Woche davor (1.10.) bei 362 (193 beatmet). Rund 8700 Intensivbetten sind in Deutschland derzeit jedoch noch frei.

Anzeige

Die Zahl der Corona-Tests schwankt seit Mitte August zwischen rund 1,1 Millionen und 1,2 Millionen pro Woche. Die Rate der positiven Tests ist nach RKI-Angaben vom Mittwochabend jedoch deutlich gestiegen: von 0,74 Prozent Ende August auf 2,48 Prozent in der Woche vom 5. bis 11. Oktober.

An dieser Stelle finden Sie Inhalte von Drittanbietern Um mit Inhalten von Drittanbietern zu interagieren oder diese darzustellen, brauchen wir Ihre Zustimmung. Externe Inhalte aktivieren

In mehreren Labors gebe es einen Rückstau, einige gaben laut RKI Lieferschwierigkeiten für Reagenzien an. „Das RKI erreichen in den letzten Wochen zunehmend Berichte von Laboren, die sich stark an den Grenzen ihrer Auslastung befinden“, schreibt das Institut im Lagebericht vom Mittwoch. Der zusätzliche Testbedarf durch Urlauber nach Einführung des Beherbergungsverbots mit der Option zu einer „Freitestung“ habe die Situation weiter verschärft.

Seit Beginn der Corona-Krise haben sich nach RKI-Angaben mindestens 341.223 Menschen in Deutschland nachweislich mit dem Virus Sars-CoV-2 infiziert (Datenstand 15.10., 0 Uhr). Die Zahl der Todesfälle im Zusammenhang mit einer Corona-Infektion lag demnach bei 9710. Das waren 33 mehr als am Vortag. Nach Schätzungen des RKI gibt es etwa 284.600 Genesene.

An dieser Stelle finden Sie Inhalte von Drittanbietern Um mit Inhalten von Drittanbietern zu interagieren oder diese darzustellen, brauchen wir Ihre Zustimmung. Externe Inhalte aktivieren

Anzeige

Die Reproduktionszahl, kurz R-Wert, lag nach RKI-Schätzungen in Deutschland laut Lagebericht vom Donnerstag bei 1,08 (Vortag: 1,04). Das bedeutet, dass ein Infizierter im Mittel etwa einen weiteren Menschen ansteckt. Der R-Wert bildet jeweils das Infektionsgeschehen etwa eineinhalb Wochen zuvor ab.

Zudem gibt das RKI in seinem aktuellen Lagebericht ein sogenanntes Sieben-Tage-R an. Der Wert bezieht sich auf einen längeren Zeitraum und unterliegt daher weniger tagesaktuellen Schwankungen. Nach RKI-Schätzungen lag dieser Wert bei 1,22 (Vortag: 1,16). Er zeigt das Infektionsgeschehen von vor 8 bis 16 Tagen.

An dieser Stelle finden Sie Inhalte von Drittanbietern Um mit Inhalten von Drittanbietern zu interagieren oder diese darzustellen, brauchen wir Ihre Zustimmung. Externe Inhalte aktivieren

Weltweit gibt es laut der Johns-Hopkins-Universität mindestens 38.510.263 mit Covid-19 infizierte Personen (Stand 15.10., 8 Uhr). Davon sind 1.092.144 Menschen am Virus gestorben.

Anzeige

In Israel haben sich seit dem Ausbruch der Pandemie mehr als 300.000 Menschen mit dem Coronavirus angesteckt. Nach Angaben des Gesundheitsministeriums wurden am Donnerstagabend 300.201 Infektionen registriert. Mehr als 200.000 Fälle waren in dem Land am 23. September und mehr als 100.000 Fälle am 21. August ausgewiesen worden. Israel hat rund neun Millionen Einwohner. In Deutschland, das etwa neunmal so viele Einwohner hat, wurden zuletzt insgesamt 341.223 Infektionen registriert.

Die Pandemie verlief in Israel zunächst glimpflich, auch wegen eines strikten Kurses der Regierung. Nach Lockerungen und einer massiven Zunahme der Fallzahlen im Laufe des Sommers gilt seit dem 18. September und mindestens bis Sonntag ein zweiter landesweiter Lockdown mit strikten Regeln wie Ausgangsbeschränkungen. Zuletzt zeichnete sich ab, dass die Zahl der Neuinfektionen abnimmt.

In Israel starben bislang 2127 Menschen in Verbindung mit einer Corona-Infektion, in Deutschland 9710.

An dieser Stelle finden Sie Inhalte von Drittanbietern Um mit Inhalten von Drittanbietern zu interagieren oder diese darzustellen, brauchen wir Ihre Zustimmung. Externe Inhalte aktivieren

In Großbritannien mit 66,6 Millionen Einwohnern haben sich innerhalb von 24 Stunden nachweislich knapp 20.000 Menschen mit dem Coronavirus angesteckt. Das entspricht einem Anstieg von etwa 2500 im Vergleich zum Vortag. 137 Menschen sind an einer Covid-19-Erkrankung gestorben, wie die Gesundheitsbehörden am Mittwoch mitteilten. Besonders stark betroffen von der Pandemie sind der Norden Englands, Nordirland, Schottland und Teile von Wales. Die tatsächliche Zahl der Neuinfektionen dürfte aber noch höher liegen, da nicht genügend Tests zur Verfügung stehen. Der britische Gesundheitsminister Matt Hancock rief für London die zweithöchste Corona-Warnstufe aus. Er begründete dies am Donnerstag im Unterhaus mit rasch steigenden Infektionsraten in der Hauptstadt. Schnelles Handeln sei erforderlich, um das Virus unter Kontrolle zu bekommen, sagte er.

Angesichts rapide steigender Infektionszahlen dürfen sich Angehörige verschiedener Haushalte demnach in Innenräumen nicht mehr treffen, wie der Londoner Bürgermeister Sadiq Khan am Donnerstag bekannt gab. Auch Treffen in Pubs oder Restaurants sind nicht erlaubt, während sie in Grünanlagen gestattet bleiben. Schulen und der Einzelhandel bleiben geöffnet.

Millionen Bewohner Nordenglands warten darauf, zu erfahren, ob sie unter die strengsten Corona-Regeln fallen. Für Liverpool wurden diese bereits angeordnet. Seit dieser Woche gibt es in Großbritannien ein dreistufiges Corona-Warnsystem.

An dieser Stelle finden Sie Inhalte von Drittanbietern Um mit Inhalten von Drittanbietern zu interagieren oder diese darzustellen, brauchen wir Ihre Zustimmung. Externe Inhalte aktivieren

In Spanien verzeichnen die Behörden mehr als 13.300 Neuinfektionen. Die Gesamtzahl der nachgewiesenen Ansteckungen steigt damit auf 921.374. Die Zahl der Todesfälle in Zusammenhang mit dem Virus steigt laut Gesundheitsministerium um 140 auf 33.553. Die Region Katalonien bereitet sich darauf vor, Bars und Restaurants zu schließen, um so eine Verbreitung des Virus einzudämmen.

Anzeige

In Frankreich haben die Gesundheitsbehörden 30.621 Neuinfektionen binnen 24 Stunden registriert. Seit Beginn der Pandemie verzeichnen die Behörden insgesamt 809.684 Infektionen. Die Zahl der Todesfälle stieg um 88 auf 33.125. Dies betrifft Patienten, die in Kranken- oder Pflegeheimen gestorben sind und bei denen das Virus nachgewiesen wude.

Die Zahl der registrierten Neuinfektionen binnen 24 Stunden stieg am Mittwoch in Portugal mit 10,3 Millionen Einwohnern auf 2072 – das war der höchste Wert seit Beginn der Pandemie. Die Gesamtzahl der Fälle kletterte den amtlichen Angaben zufolge auf mehr als 91.000. Die Zahl der Menschen, die an Covid-19 starben, stieg um sieben auf 2117. Besonders betroffen sind der Norden und der Großraum Lissabon. Sorge bereitet vor allem die Tatsache, dass die Zahl der in Krankenhäusern behandelten Covid-19-Patienten in etwas mehr als einem Monat von gut 300 auf nun fast 1000 in die Höhe schoss.

An dieser Stelle finden Sie Inhalte von Drittanbietern Um mit Inhalten von Drittanbietern zu interagieren oder diese darzustellen, brauchen wir Ihre Zustimmung. Externe Inhalte aktivieren

Neun weitere US-Bundesstaaten verzeichnen Höchststände bei den Neuinfektionen. Wisconsin etwa meldet 3747 bestätigte Fälle binnen 24 Stunden. In einigen Gegenden des Bundesstaats sind nach Angaben der Behörden nur noch zehn Prozent der Intensivbetten in Kliniken frei. „Wir befinden uns an einem sehr kritischen Punkt“, erklärt Gouverneur Tony Evers.

Russland mit seinen 144,5 Millionen Einwohnern meldet einen Rekord an Neuinfektionen. Binnen der letzten 24 Stunden gibt es 14.231 weitere Coronavirus-Fälle. Die Gesamtzahl der Infektionen steigt damit auf 1,34 Millionen. Weitere 239 Menschen starben, wodurch sich die Zahl der Todesfälle auf 23.205 erhöht.

Brasiliens Gesundheitsministerium meldet 713 weitere Corona-Todesfälle und 28.523 Neuinfektionen binnen 24 Stunden. Insgesamt sind in dem Land damit bislang 152.460 Menschen im Zusammenhang mit dem Virus gestorben. Die Zahl der bestätigten Fälle kletterte auf 5.169.386.

In Südkorea sind 110 neue Infektionen mit dem Coronavirus registriert worden. Die Hälfte der Fälle stehe in Verbindung mit einem Krankenhaus in der Stadt Busan, teilte die südkoreanische Behörde für Krankheitskontrolle und -prävention am Donnerstag mit. In dem Land mit gut 51 Millionen Einwohner liegt die offizielle Zahl der Fälle damit bei fast 25.000.

Mindestens 54 der Neuinfektionen stünden mit dem Krankenhaus für Ältere in Verbindung. Mehr als 40 seien in der dicht bevölkerten Metropolregion Seoul verzeichnet worden, mit Verbindungen zu Krankenhäusern, Kirchen, Schule und Büros.

Alle aktuellen und weltweiten Entwicklungen zum Coronavirus können Sie in unserem Live-Ticker verfolgen.

Haben Sie Fragen zum Coronavirus? Hier finden Sie die wichtigsten Fakten und Informationen.","'Elke Bodderas', 'Marc Pfitzenmaier'",1596002340,"Panorama,Daten, Karten, Grafiken",welt
"Banksy-Werk für 2,4 Millionen Euro versteigert – Spende nach Palästina","Mit diesem Ergebnis wurden alle Schätzungen übertroffen: Das Werk „Mediterranean Sea View 2017“ des britischen Künstlers Banksy wurde versteigert. Damit will er einem Krankenhaus in Palästina helfen.

Anzeige

Ein Werk des britischen Künstlers Banksy zur Flüchtlingskrise ist am Dienstag für 2,4 Millionen Euro versteigert worden und hat damit alle Schätzungen übertroffen. Das Auktionshaus Sotheby‘s gab den Verkaufspreis des Werks mit dem Titel „Mediterranean Sea View 2017“ („Mediterraner Meeresblick 2017“) am Abend in London bekannt. Banksy hatte zuvor angekündigt, den Erlös an ein palästinensisches Krankenhaus in Bethlehem spenden zu wollen.

Der Wert des Werks war zuvor auf 883.000 bis 1,3 Millionen Euro geschätzt worden. Das Werk besteht aus drei Ölgemälden. Sie zeigen eine wilde See und eine Küste voller orangefarbener Rettungswesten und Rettungsringe. Das Werk beziehe sich auf die Menschen, die während der Flüchtlingskrise des vergangenen Jahrzehnts ihr Leben im Meer verloren haben, erläuterte Sotheby‘s auf seiner Website.

Das Triptychon hing bis vor Kurzem in der Lobby des Hotels „Walled Off“ in Bethlehem im von Israel besetzten Westjordanland, das von Banksy mitgegründet wurde. Die Einnahmen aus dem Verkauf des Werks sollen an eine Klinik in der Stadt gehen. Mit ihnen soll die Einrichtung einer Station für Schlaganfallpatienten sowie Reha-Ausrüstung für Kinder finanziert werden.

Lesen Sie auch Sklavenhändler, Kolonialisten „Es scheint noch Gefahr von Denkmälern auszugehen“

Anzeige

Banksy ist als Graffiti-Künstler weltberühmt geworden, seine Identität ist aber nur einer Handvoll Vertrauter bekannt. Seine Werke haben häufig politische Botschaften. So liegt das „Walled Off“-Hotel in unmittelbarer Nähe des israelischen Sperrwalls und warb bei seiner Einweihung vor drei Jahren mit der „schlechtesten Aussicht der Welt“, weil der Blick von den Zimmern direkt auf ein Stück Betonmauer geht, die Bethlehem von Israel trennt.","'Henryk M. Broder', 'Daniel-Dylan Böhmer', 'Christine Kensche'",1596001525,"Panorama,London",welt
