title,text,author,published,tags,source
"Was, wenn die Bürger selbst die Maßnahmen festlegen?","Anzeige

Es war so etwas wie eine Zwischenbilanz der Corona-Maßnahmen, die Anne Will am Sonntag in ihrer Sendung mit ihren Gästen zog - denn gut sechs Monate ist es her, seit Bund und Länder im März erstmals mit strengen Regeln auf die Pandemie reagieren mussten. Jetzt ging es auch um die Frage, wie es im Herbst und Winter weitergehen soll.

Der Virologe Hendrik Streeck sprach sich dabei für ein Ampel-System aus, wie es beispielsweise bereits in Berlin existiert. Dieses solle bei den Menschen für eine bessere Einschätzung der Lage sorgen. Die rheinland-pfälzische Ministerpräsidentin Malu Dreyer ist dafür - die SPD-Politikerin will so raus aus dem Regel-Dschungel. Den will auch Weltärztepräsident Frank Ulrich Montgomery bekämpfen. Der Mediziner will einheitlichere Regelungen in Deutschland.

Die Autorin und ehemalige Piraten-Politikerin Marina Weisband forderte eine stärkere Einbeziehung der Bevölkerung - mit Bürgerräten will sie eine Mitbestimmung bei den Maßnahmen erreichen. Wissenschaftsjournalist Ranga Yogeshwar beklagte derweil die Spaltung der Gesellschaft in der Pandemie durch soziale Medien.

Die Frage des Abends

Anzeige

Schafft ein Ampel-System bei den Corona-Maßnahmen mehr Klarheit? In Österreich existiert es bereits. Eine Ampel zeigt dort die jeweilige Lage in den Regionen an. Je nach Stufe greifen unterschiedliche Maßnahmen. In die Lagebewertung fließt neben dem Verbreitungsrisiko auch die Kapazität des Gesundheitssystems mit ein.

Lesen Sie auch Pandemie Wie kritisch 2000 Neuinfektionen wirklich sind

Die Ampel sei einfacher „als, dass man die Zahlen nebeneinander sieht und nicht versteht, ob das ein großer Sprung ist oder ein kleiner Sprung“, findet Streeck. Yogeshwar zeigte sich dagegen mit Blick auf die Akzeptanz in der Bevölkerung skeptisch: „Die Basis der Ampel muss Vertrauen sein. Wenn dieses zerrüttet wird, wird es schwer“. Dreyer findet, dass die Ampel gerade dieses Vertrauen erhalten könnte. „Wenn wir nicht kommunizieren, sind die Leute auch verloren“, sagte die Ministerpräsidentin.

Die Golfplatz-Frage

An seiner Forderung nach „bundeseinheitlichen Regelungen“ arbeitete sich Montgomery über große Teile der Sendung ab. Der Mediziner stört sich am Regelungs-Wirrwarr zwischen den einzelnen Bundesländern. So habe ein Golfplatz, der zur Hälfte jeweils in Niedersachen und Bremen liegt, nur halb öffnen dürfen.

Frank Ulrich Montgomery (Vorstandsvorsitzender des Weltärztebundes) fordert mehr bundesweite Einheitlichkeit Quelle: NDR/Wolfgang Borrs/JM

Anzeige

„Der Bund muss in den Gesprächen der Ministerpräsidenten und der Gesundheitsminister festlegen, was unter bestimmten Bedingungen wann passiert“, fordert Montgomery. Es bleibe dann Sache der Bundesländer, dies im Einzelfall umzusetzen, wenn sich in einer Region die Lage verändert. „Das muss das Gesundheitsamt in Ludwigshafen genauso entscheiden wie in Mannheim“, findet der Radiologe.

Sollen Bürgerräte über Maßnahmen entscheiden?

„Jeder einzelne Mensch ist Experte auf seinem Gebiet“, findet Weisband. Die ehemalige Piraten-Politikerin bleibt den Forderungen ihrer früheren Partei nach mehr direkter Demokratie treu. Es brauche zufällig ausgeloste Bürgerräte. Diese sollten sich ein Wochenende lang mit Ärzten zusammensetzen und die Maßnahmen festlegen.

Lesen Sie auch Pandemie Warum die Corona-Zahlen in Bayern so schlecht sind

Damit solle bei den Bürgern die Akzeptanz für die Maßnahmen erhalten bleiben. Sie habe den Eindruck, dass bisher immer noch viel über politische Kontakte und Lobbyarbeit laufe. Diesen Eindruck kann man Weisband kaum übel nehmen - Gerade im Hinblick darauf, welchen Stellenwert anscheinend in der Politik derzeit Fans in Fußballstadien einnehmen.

Adressdaten an die Polizei?

Anzeige

Benjamin Blümchen oder Darth Vader – nicht immer geben Restaurantgäste auch korrekte Kontaktdaten an. Bei Infektionen in einer Hamburger Szenebar hatte rund jeder sechste Gast einen falschen Namen angegeben. „Wenn wir wollen, dass Leute ihre echten Adressdaten angeben, müssen wir dafür sorgen, dass die Polizei nicht auf diese zugreift“, findet Weisband.

Lesen Sie auch Corona in Großbritannien 11.000 Euro Geldstrafe, ein „Schutzschalter“ – und keine Tests

Dies war im Rahmen der Verbrechensaufklärung in mehreren Bundesländern vorgekommen. In Bayern sind Fälle bekannt, in denen auch zur Aufklärung von kleineren Delikten wie Diebstahl oder Beleidigung, die Listen genutzt wurden. Der dortige Innenminister Joachim Herrmann (CSU) warnte dagegen vor „falsch verstandenem Datenschutz“. Der Zugriff erfolgte rechtmäßig. Doch es bleibt ein politischer Vertrauensverlust. Und der bewirkt wohl im Zweifel eher das Gegenteil dessen, was mit den Listen erreicht werden sollte.",Björn-Hendrik Otte,1600646759,"Deutschland,„Anne Will“ zu Corona",welt
„Deutschland wird mehr Leute offiziell übernehmen“,,Ricarda Breyton,1600883101,"Deutschland,Europa und die Migration",welt
„Man kann dieses Virus nicht einfach wegtesten”,"„Die Pandemie wird jetzt erst richtig losgehen. Auch bei uns“, sagt Virologe Christian Drosten. Was er damit meint und was das für die kommenden Monate bedeutet, erklärt WELT-Reporterin Marie Przibylla.

Anzeige

Am Mittwoch warnte noch die Leopoldina-Akademie vor einer „schwer kontrollierbaren Entwicklung der Pandemie“, da im Herbst die Temperaturen sinken. Am Donnerstag dann hatte die Redaktion von Maybrit Illner bereits einen ersten Kontrollverlust: Eigentlich hätte Tobias Hans (CDU) zur Sendung kommen sollen. Das klappte aber nicht. Der Ministerpräsident des Saarlands befand sich am Donnerstagabend in freiwilliger Quarantäne aufgrund eines Kontakts zu einem Corona-Infizierten.

Genau über solche Fälle sollten die Gäste der Sendung diskutieren: „Der Sommer geht, Corona bleibt – wird der Herbst zum Risiko?“, lautete das Thema. Bedeutet das also weitere Einschränkungen, mehr Homeoffice und Feierverbote?

Lesen Sie auch Corona-Politik Der schwedische Weg erscheint verlockend wie nie – zu Recht?

In der Runde begrüßte Illner dazu die Virologieprofessorin Ulrike Protzer sowie Sibylle Katzenstein, Allgemeinmedizinerin in Berlin mit reichlich Corona-Test-Erfahrung. Außerdem zu Gast war Ute Teichert, Vorsitzende des Bundesverbands der Ärztinnen und Ärzte des Öffentlichen Gesundheitsdienstes.

Anzeige

Hans’ Corona-Test fiel negativ aus, dennoch trat in der Sendung Berlins Bürgermeister Michael Müller (SPD) an seine Stelle. Der angekündigte Christian Lindner (FDP) wurde von seinem Parteigeneralsekretär Volker Wissing vertreten.

Wie war die Moderatorin?

Zu Gast hatte Illner eine abgeklärte Runde aus unaufgeregten Wissenschaftlern und Medizinern, ergänzt um die zwei Politiker Müller und Wissing. Die ließen jedoch auch wenig Lust erkennen, sich gegenseitig zu beharken. Entsprechend selten war die Moderatorin als Streitschlichterin gefragt.

Dennoch war Illner betont bemüht, das Gespräch im Rahmen der von ihr gestellten Fragen zu halten. Wiederholungen von Forderungen, wie die von Wissing nach mehr parlamentarischer Debatte, ließ sie nicht durchgehen: „Das beklagen Sie jetzt schon zum dritten Mal.“

An dieser Stelle finden Sie Inhalte aus Twitter Um mit Inhalten aus Twitter und anderen sozialen Netzwerken zu interagieren oder diese darzustellen, brauchen wir Ihre Zustimmung. Soziale Netzwerke aktivieren

Anzeige

Illners schnellem Frage-Antwort-Ping-Pong fielen aber auch kleine Wortgefechte zum Opfer, die noch mehr Spannung hätten entwickeln können. So geschehen bei der Debatte zwischen Müller und Katzenstein um Corona-Tests für Lehrer: Der schob Illner mit einem schlichten „So!“ etwas vorschnell einen Riegel vor.

Thema des Abends

„Was ich nicht verstehe, ist, warum es den Leuten so schwer gemacht wird, an einen Test heranzukommen“, sagte Katzenstein und riss damit ein Thema an, das sich die gesamte Sendung hindurchziehen sollte: Corona-Schnelltests.

Katzenstein war der Meinung: „Der Test muss zum Patienten und nicht andersrum.“ Potenziell Erkrankte sollten nicht erst mit der U-Bahn fahren, in der Schlange stehen und das Virus somit weiterverbreiten, kritisierte sie. Ein anderes Argument für die Tests für zu Hause sei, dass so auch Zielgruppen erreicht werden könnten, die sich aktuell weigern, „zu irgendeiner Autorität zu gehen“, so Katzenstein.

An dieser Stelle finden Sie Inhalte aus Twitter Um mit Inhalten aus Twitter und anderen sozialen Netzwerken zu interagieren oder diese darzustellen, brauchen wir Ihre Zustimmung. Soziale Netzwerke aktivieren

Anzeige

Hier hakte Teichert ein. Sie unterstützt die Schnelltests zwar, gab aber zu bedenken, dass diese in erste Linie den Risiko- und systemrelevanten Gruppen zugutekommen müssten. Für Feierlustige könne man Schnelltests aufwenden, wenn man genug habe.

Protzer verlieh der Debatte die wissenschaftliche Komponente und erklärte das Problem der aktuellen Tests. Das sei „nicht die Testdauer an sich“, sondern die Zeit, die beim Vereinbaren eines Arzttermins, Verschicken des Materials und Aufbereiten im Labor verloren gehe. Weiter erklärte Protzer, dass Schnelltests durch geschultes Personal durchgeführt werden sollten. Dafür bräuchte es zusätzliche Infrastruktur, und die habe man aktuell nicht.

An dieser Stelle finden Sie Inhalte aus Twitter Um mit Inhalten aus Twitter und anderen sozialen Netzwerken zu interagieren oder diese darzustellen, brauchen wir Ihre Zustimmung. Soziale Netzwerke aktivieren

Wissing sah in den Schnelltests eine Chance, die Wirtschaft wieder anzukurbeln, denn „wir können nicht auf Dauer auf alles verzichten“. Dadurch könnten beispielsweise Geschäftsreisen in Risikogebiete unkomplizierter vonstattengehen. Immer wieder betonte der FDP-Generalsekretär: „Das Gesundheitssystem basiert auch auf dem wirtschaftlichen Erfolg.“

Dem ganzen Schnelltest-Hype stellte Protzer allerdings eines entgegen: Mehr Tests führten nicht zwangsläufig zu weniger Infizierten. „Ich glaube, man kann dieses Virus nicht einfach wegtesten.“

Experte des Abends

Eine Viertelstunde vor Sendungsende wurde Infektionsforscher Michael Meyer-Hermann aus Braunschweig zugeschaltet. Der nutzte die Gelegenheit, um ein paar kursierende Zahlen einzuordnen, etwa die der 2000 Neuinfektionen pro Tag.

Da diese aktuell immer weiter steigen, „ist es nicht wirklich möglich zu sagen, es ist in Deutschland eine stabile Situation“. Meyer-Hermann rief dazu auf, die Entwicklung genau zu beobachten, um früh eingreifen zu können, und mahnte: „Manchmal kriegt man das Schiff auch nicht mehr rum.“

Lesen Sie auch Megatrend-Report Wegen zwei Faktoren droht Deutschland die globale Außenseiterrolle

Gleichzeitig stellte der Experte klar: „Wir brauchen kein perfektes System, um diese Pandemie zu beherrschen.“ Es gebe immer Demonstranten und ungehemmte Partygänger, die neue Infektionsherde erzeugten. „Wir müssen unsere Maßnahmen so organisieren, dass wir das tolerieren können”, sagte der Immunologe und folgerte: „Die Fehler gehören zu einer lebendigen Gesellschaft dazu.“

Die Bitte des Abends

Anzeige

Mit Blick auf den kühlen Herbst hatte die Berliner Ärztin Katzenstein gegen Ende noch einen Wunsch an ihr Stadtoberhaupt Müller: Pilze vor den Praxen. Konkret: Heizpilze – um denjenigen, die für einen Test anstehen, die Warterei etwas angenehmer zu gestalten.

An dieser Stelle finden Sie Inhalte aus Twitter Um mit Inhalten aus Twitter und anderen sozialen Netzwerken zu interagieren oder diese darzustellen, brauchen wir Ihre Zustimmung. Soziale Netzwerke aktivieren

Denn, das hatte Katzenstein schon zuvor bemerkt: „Die Leute möchten sich testen lassen. Und die Schlange vor meiner Praxis ist 200 Meter lang.“ Da werde sich eine pragmatische Lösung finden lassen, versprach Müller. Bezugnehmend auf andere geforderte Dinge, die sich nicht so leicht umsetzen ließen, freute das auch Illner: „Okay, es gibt wenigstens die Heizpilze.“",Isabel Pogner,1600992364,"Panorama,Maybrit Illner",welt
So viele Neuinfektionen wie noch nie – aber Marseille wehrt sich gegen Corona-Verbote,"In Frankreich erreichen die Neuinfektionen einen Rekordwert. Die Regierung verhängt deshalb strenge Corona-Verbote. So müssen in Marseille ab Samstag alle Bars und Restaurants schließen – womit die Stadt überhaupt nicht einverstanden ist.

In Marseille kommen die neuen Beschränkungen nicht gut an

Anzeige

Einen Tag nach der weiteren Verschärfung der Corona-Maßnahmen hat Frankreich einen Rekord bei den neuen Infektionsfällen gemeldet. Binnen 24 Stunden seien weitere 16.096 Menschen positiv auf das Coronavirus getestet worden, teilte die Gesundheitsbehörde am Donnerstagabend mit. Das sind nochmals über 3000 Neuansteckungen mehr als beim bisherigen Rekord vom Vortag. Die Zahl der Corona-Toten stieg binnen eines Tages um 52.

Experten weisen allerdings darauf hin, dass die Infektionszahlen zu Beginn der ersten Coronawelle im März und April wegen der niedrigen Testkapazität nur einen Bruchteil der tatsächlichen Ansteckungen abbildeten und sich deshalb nicht mit den Zahlen seit Einführung der großflächigen Tests vergleichen lassen. Inzwischen werden mehr als 1,2 Millionen Tests wöchentlich gemacht, während im Frühjahr noch kaum Tests zur Verfügung standen.

Gesundheitsminister Olivier Véran räumte jedoch Probleme mit den Testkapazitäten ein. Tatsächlich gebe es in einigen Städten Verzögerungen bei den Ergebnissen, sagte Véran vor dem Senat. Doch sei der Stau bei der Auswertung der Tests „nicht für die neue Welle der Epidemie“ verantwortlich.

Lesen Sie auch Kampf gegen Corona Portugal auf der Suche nach der Lockdown-Alternative

Anzeige

Der ungebremste Anstieg der Neuinfektionen sorgt bei der französischen Regierung für wachsende Alarmstimmung. Am Mittwoch verschärfte sie die Maßnahmen vor allem in den Großstädten weiter. Unter anderem müssen in der am stärksten betroffenen Stadt Marseille ab Samstag alle Bars und Restaurants schließen, in Paris und anderen Städten müssen sie früher schließen. Zudem wurden Versammlungen von mehr als zehn Menschen etwa in Parks und auf Plätzen untersagt.

Ziel der Politik seiner Regierung sei es vor allem, eine Überlastung der Krankenhäuser zu vermeiden, sagte Castex weiter. Tatsächlich ist der Druck auf die Intensivstationen infolge der seit Wochen steigenden Corona-Infektionszahlen inzwischen so groß, dass die Pariser Krankenhäuser wieder nicht zwingend notwendige Operationen absagen müssen. Ab dem kommenden Wochenende werden zunächst 20 Prozent der geplanten OPs verschoben, wie die öffentliche Krankenhaus-Gesellschaft Assistance publique-Hôpitaux de Paris mitteilte.

Wut in Marseille

Die neuen strengen Maßnahmen treffen in Marseille auf große Wut und Unverständnis. Dass Restaurants und Bars ab Samstag in der südfranzösischen Hafenmetropole komplett schließen müssten, sei ohne jede Absprache entschieden worden, sagte Bürgermeisterin Michèle Rubirola dem Sender BFM TV. Das Rathaus forderte ein zehntägiges Moratorium. Es solle erst abgewartet werden, wie sich die Corona-Lage in der Stadt weiterentwickele.

Anzeige

Der Präsident der Region Provence-Alpes-Côte-d‘Azur (Paca), Renaud Muselier, kündigte via Twitter an, er werde am Freitag per Einspruch rechtlich gegen die Schließung der Lokale vorgehen. Er hatte die Maßnahmen zuvor als „kollektive Bestrafung“ scharf kritisiert. Sie seien ungerecht und unangemessen. Marseille liegt in der Region Paca.

Lesen Sie auch Coronavirus Bundesregierung verhängt Reisewarnungen für Lissabon, Dublin und Kopenhagen

Die Corona-Lage in Marseille ist seit Wochen angespannt. Die Zahl der Menschen, die sich dort innerhalb einer Woche mit dem Coronavirus infiziert haben, liegt dort nach Angaben der Regierung bei rund 250. Die Regierung hatte Marseille zuletzt aufgefordert, strengere Maßnahmen zu einzuführen. Dem ist die Stadt auch nachgekommen – sie hat etwa Einschränkungen beim Alkoholverkauf und bei Treffen und Veranstaltungen in der Öffentlichkeit verhängt.

Die Regierung hatte zuletzt immer wieder betont, dass die gewählten Vertreter in den Regionen am besten wüssten, was zu tun sei. Auch in Paris zeigt man sich unzufrieden mit den Entscheidungen des Gesundheitsministers. In der Hauptstadt gilt nun eine „hohe Alarmstufe“, Bars müssen ab Montag um 22.00 Uhr schließen. Bürgermeisterin Anne Hidalgo erklärte, sie sei kurzfristig informiert worden und nicht einverstanden.","'Virginia Kirst', 'Tobias Kaiser'",1600988997,"Panorama,Frankreich",welt
Ort in den USA möchte weiterhin Hakenkreuz heißen,"Seit dem Zweiten Weltkrieg hat es bereits mehrere Anfragen gegeben, den Namen zu ändern – aber der Ortsbeirat in Swastika (auf Deutsch Hakenkreuz) sieht dazu keinen Grund. Nur ein intoleranter Mensch könne annehmen, dass der Name etwas mit Nazis zu tun habe.

Hakenkreuzsymbole in einem Hindutempel in Toronto, Kanada. Auch im Hinduismus seien Hakenkreuze noch gebräuchlich, argumentiert ein Kommunalbeamter aus dem US-Ort Swastika

Anzeige

Ein Weiler im US-Staat New York will weiter Swastika heißen – auf Deutsch also Hakenkreuz. Der Ortsbeirat Swastika habe vergangene Woche keinen Grund gesehen, den seit mehr als 100 Jahren bekannten Namen zu ändern, sagte der Kommunalbeamte Jon Douglass aus Black Brook, zu dem Swastika gehört, dem Radiosender NPR.

Eines der vier Ratsmitglieder, Howard Aubin, sagte der Zeitung „Adirondack Daily Enterprise“, nur ein intoleranter Mensch könne annehmen, dass der Name etwas mit Nazis zu tun habe.

Lesen Sie auch Madeleine-Albright-Interview „Ich hoffe auf einen Aufstand der Anständigen“

Auf die Tagesordnung gekommen war das Thema durch den New Yorker Michael Alcamo, der im Sommer in der Gegend etwa 56 Kilometer südlich der kanadischen Grenze geradelt war und fand, der Name Swastika sei eine Beleidigung für US-Weltkriegsveteranen. Der Weiler hieß laut einem Zeitungsbericht von 1977 früher Goodrich Mills, stand aber seit 1913 als Swastika in den Postverzeichnissen.

Anzeige

Douglass räumte ein, das von den Nationalsozialisten genutzte Hakenkreuz sei ein Symbol des Hasses. „Aber ich denke, es gibt auch andere, die das nicht mit Hass verbinden“, sagte er. „Haben die Hindus und die (Buddhisten) und alle es wegen der Deutschen aus ihrer Religionsgeschichte entfernt?“ Der englische Begriff Swastika kommt aus dem altindischen Sanskrit und bedeutet Glücksbringer. Das Symbol wird seit Jahrtausenden verwendet.

Douglass sagte, nach dem Zweiten Weltkrieg habe es bereits mehrere Anfragen gegeben, den Namen zu ändern. Aber sogar Einwohner des Ortes, die selbst im Krieg gekämpft hätten, seien dagegen gewesen. „Einfach, weil Hitler versucht hat, die Bedeutung des Hakenkreuzes in Beschlag zu nehmen“.

Hier können Sie unsere WELT-Podcasts hören Wir nutzen den Player des Anbieters Podigee für unsere WELT-Podcasts. Damit Sie den Podcast-Player sehen können und um mit Inhalten aus Podigee und anderen sozialen Netzwerken zu interagieren oder diese darzustellen, brauchen wir Ihre Zustimmung. Soziale Netzwerke aktivieren

Im Podcast „Inside USA“ erfahren Sie alles über den US-Wahlkampf – jeden Freitag neu.","'Daniel Friedrich Sturm', 'Stefan Aust', 'Frauke Fentloh'",1600988794,"Ausland,Swastika im Staat New York",welt
