title,text,author,published,tags,source
"„Ich glaube, ich wäre nicht gefahren“","Bayern spielt in Budapest gegen den FC Sevilla um den Supercup. Obwohl die ungarische Hauptstadt Corona-Risikogebiet ist, sind Fans im Stadion zugelassen. Auch aus München sind Anhänger angereist. Bayerns Trainer Hansi Flick ist nachdenklich.

Supercup zwischen Bayern und Sevilla soll in Risikogebiet stattfinden

Anzeige

Im Hintergrund sind Fangesänge zu hören, ein Kameraschwenk zeigt Zuschauer auf den Tribünen. Der europäische Supercup zwischen dem FC Bayern München und dem FC Sevilla findet entgegen aller Warnungen nicht unter Ausschluss der Öffentlichkeit statt. Obwohl Budapest als Corona-Risikogebiet gilt, hat der europäische Fußballverband Uefa darauf bestanden, dass die Partie kein Geisterspiel ist.

Lesen Sie auch Duell in Budapest Söder – „Ich habe Bauchschmerzen, was den Supercup betrifft“

In der 67.000 Zuschauer fassenden Puskás-Arena stehen den Fans rund 30 Prozent der Plätze zur Verfügung. Sehr zum Ärger von Budapests Bürgermeister. „Hätte ich die rechtlichen Möglichkeiten, das zu entscheiden, würde ich das Match hinter geschlossenen Toren stattfinden lassen“, sagte Gergely Karácsony zur oppositionellen Tageszeitung „Népszava“.

Viele Fans, wenige Masken - der Supercup in Budapest Quelle: AP/Attila Kisbenedek

„Die Verantwortung liegt bei denen, die die Entscheidungsgewalt haben“, fügte er mit Blick auf die rechtsnationale Regierung von Ministerpräsident Viktor Orbán hinzu.

Anzeige

Obwohl Budapest Corona-Risikogebiet ist, ließen sich viele Bayern-Fans nicht davon abbringen, in die ungarische Hauptstadt zu reisen. Bayern-Trainer Hansi Flick antwortete vor dem Anpfiff bei Sky auf die Frage, ob er als Fan nach Budapest gereist wäre: „Ich glaube, ich wäre nicht gefahren.“

Hansi Flick beim Abschlusstraining vor dem Supercup Quelle: dpa/Attila Kisbenedek

Auch der ehemalige Nationalspieler und Bayern-Profi Markus Babbel äußerte sich verständnislos über den Austragungsort des Supercups. „Für mich ist es ein schlechtes Zeichen. Das Spiel hätte unter Ausschluss der Öffentlichkeit ausgetragen werden sollen“, sagte Babbel.

„Die sind heiß auf Fußball“

Angesprochen auf die Bayern-Fans, die trotz eindringlicher Warnungen des bayerischen Ministerpräsidenten Markus Söder (CSU) nach Ungarn angereist waren, sagte Babbel: „Es sind viele dabei, die das Virus nicht ganz so ernst nehmen. Die sind heiß auf Fußball.“

Der Empfehlung, auch auf den Tribünen Masken zu tragen, folgen nicht alle Zuschauer Quelle: AP/Tibor Ilyes

Das Spiel soll für die Uefa als Pilotprojekt dienen, um Fans auch in Pandemie-Zeiten in die Stadien zu bringen, heißt es in einer Mitteilung des Verbandes. Um die Sicherheit der Fans zu gewährleisten, werden strenge Hygienemaßnahmen verhängt. Zum Hygienekonzept gehören unter anderem das Tragen einer Mund-Nasen-Bedeckung, die Einhaltung des Mindestabstandes, möglichst häufiges Desinfizieren und Waschen der Hände sowie eine obligatorische Fiebermessung vor dem Betreten der Arena.",,1600978381,"Sport,Hansi Flick über Supercup",welt
Draisaitl als erster Deutscher zum wertvollsten NHL-Spieler gewählt,"In den Play-offs war Leon Draisaitl mit den Oilers außen vor – am Rande der Finalserie um den Stanley Cup aber hat der Eishockey-Profi nun dennoch eine Hauptrolle. Als erster Deutscher bekommt er die prestigeträchtigste Auszeichnung der NHL.

Ex-Bundestrainer Marco Sturm hält Leon Draisaitl für den ""wahrscheinlich besten Spieler dieser Saison"" in der besten Eishockey-Liga der Welt. Ein ähnliches Potenzial traut der Assistenztrainer der L.A. Kings auch Tim Stützle zu. Der 18-Jährige gilt als eines der größten Talente seiner Altersgruppe in Europa.

Anzeige

Leon Draisaitl ist ganz offiziell der wertvollste Spieler der NHL-Hauptrunde. Der 24 Jahre alte Kölner wurde in der stärksten Eishockey-Liga der Welt als MVP mit der Hart-Memorial-Trophy ausgezeichnet. Das gab die National Hockey League am Rande der Finalserie um den Stanley Cup bekannt.

Draisaitl ist erst der zweite Profi-Sportler aus Deutschland nach dem ehemaligen Basketballer Dirk Nowitzki, dem in einer der großen US-Sport-Ligen diese Ehre zuteilwird. Nowitzki war in der Saison 2006/2007 in der NBA als „Most Valuable Player“ ausgezeichnet worden.

„Ich bin sehr geehrt. Das ist eine große Ehre“, sagte Draisaitl während der Übertragung im TV-Sender NBCSN. Er hoffe, dass er durch die Auszeichnung Kinder in Deutschland zum Eishockeyspielen inspirieren könne.

Lesen Sie auch Leon Draisaitl Der „Deutschland-Sniper“

Anzeige

Seine Kollegen in der NHL wählten Draisaitl zudem zum herausragenden Spieler der Saison. Der Ted-Lindsay-Award wird von der Spielergewerkschaft NHLPA vergeben und ging ebenfalls zum ersten Mal an einen Sportler aus Deutschland. „Es ist etwas Besonderes, diese Anerkennung von den Kollegen zu bekommen, gegen die du das ganze Jahr spielst“, sagte Draisaitl. Die MVP-Auszeichnung beruht auf Stimmen von Journalisten.

Leon Draisaitl (r.) im Einsatz für die Edmonton Oilers Quelle: dpa/Jason Franson

In seiner persönlich erfolgreichsten Saison hatte Draisaitl schon in der Hauptrunde für ein Novum gesorgt. Mit 110 Punkten für Tore und Vorlagen aus 71 Spielen in der coronabedingt verkürzten Hauptrunde war er bester Scorer geworden – das war noch keinem Sportler aus Deutschland gelungen, weder in der NHL noch einer anderen großen Liga im nordamerikanischen Sport. Selbst Basketball-Ikone Dirk Nowitzki hatte dies in der NBA nie geschafft, gewann neben dem MVP-Titel 2007 aber 2011 mit den Dallas Mavericks die Meisterschaft.

Draisaitls Mannschaft hat große Defensiv-Schwächen

Trotz seines Karrieren-Meilensteins mit der MVP-Auszeichnung ist genau dies auch die große Sehnsucht von Draisaitl: der Gewinn des Stanley Cups in der NHL. „Was fehlt, ist eine Meisterschaft. Darum geht‘s. Das ist das Wichtigste“, hatte Draisaitl im vergangenen Winter im dpa-Interview gesagt.

Anzeige





Aktuell scheint er für dieses große Ziel indes im falschen Team zu spielen. So spektakulär die Offensive der Oilers mit Draisaitl und Kapitän Connor McDavid auch ist – defensiv hat die Mannschaft aus Kanada etliche Schwächen. Überraschend hatte Edmonton die Play-offs wegen eines 1:3 in der Qualifikationsrunde gegen Außenseiter Chicago erst gar nicht erreicht. Auch in den Jahren zuvor hatte Draisaitl im Mai stets Zeit, bei einer WM für Deutschland anstatt mit den Oilers um den NHL-Titel zu spielen.





Für sein großes Ziel arbeitet Draisaitl seit seiner Kindheit verbissen. Beim besten deutschen Spieler stehen Talent und Ehrgeiz im Einklang. Der Sohn des früheren Nationalspielers Peter Draisaitl ging als 17-Jähriger zu den Prince Albert Raiders in die kanadische Nachwuchsliga. 2014 wurde er beim NHL-Draft – der jährlichen Talente-Zuteilung – an dritter Stelle ausgewählt und damit so früh wie kein Deutscher zuvor. Seitdem ist der Ur-Kölner und Fan des Fußball-Bundesligisten 1. FC Köln kontinuierlich besser geworden.",'Jörg Lubrich',1600730815,"Sport,Eishockey",welt
