title,text,author,published,tags,source
Der Fleisch-GAU wird zur Last für die gesamte deutsche Wirtschaft,"Anzeige

Seit Wochen stehen die Arbeitsbedingungen in der Fleischindustrie nach den Corona-Ausbrüchen beim Schlachtkonzern Tönnies und auch anderen Unternehmen heftig in der Kritik. Bundesarbeitsminister Hubertus Heil (SPD) hat angekündigt, strikt durchgreifen zu wollen und unter anderem Werkverträge und Leiharbeit in der Branche zu verbieten.

Am Mittwoch soll das Bundeskabinett seinem Gesetzentwurf nun zustimmen. Doch die Pläne sind umstritten. Andere Branchen fürchten Einschränkungen. WELT beantwortet wichtige Fragen.

Was sind Werkverträge?

Mit einem Werkvertrag beauftragt ein Unternehmen ein anderes, ein bestimmtes „Werk“ für einen festgesetzten Preis zu erbringen. Auf diese Weise lassen sich sowohl Produktionsschritte auslagern, die zum Kerngeschäft des Auftraggebers gehören, als auch sogenannte Randprozesse.

Lesen Sie auch Italien Europas Ernte-Sklaven

Anzeige

Das beauftragte Unternehmen entscheidet selbst, wie und wo es die Aufgabe erledigt und wie viele Beschäftigte es einsetzt. Es ist auch für Arbeitszeit und Lohn verantwortlich.

Was ist der Unterschied zur Leiharbeit?

Leiharbeiter unterstützen die Stammbelegschaft eines Betriebs. Sie werden für eine begrenzte Zeit von Zeitarbeitsfirmen ausgeliehen. Die Arbeitsleistung wird nach Stunden abgerechnet.

Der Auftraggeber ist Leiharbeitern gegenüber weisungsbefugt, und sie haften nicht für Mängel. Werkvertragsmitarbeiter dagegen sind komplett unabhängig vom Auftraggeber und dürfen nicht mit der Stammbelegschaft vermischt werden.

Wie verbreitet sind Werkverträge in der Wirtschaft?

Anzeige

Werkverträge sind in der deutschen Wirtschaft sehr verbreitet. Mehr als 90 Prozent aller Unternehmen nutzen Werkverträge, zeigt eine Studie des Leibniz-Zentrums für Europäische Wirtschaftsforschung (ZEW) von 2017.

Lesen Sie auch Analphabeten Das deutsche Jobwunder ist zu Ende – und das sind die ersten Opfer

Zwölf Prozent der Unternehmen gaben an, dabei mit ausländischen Firmen zusammenzuarbeiten. Werkverträge werden aus unterschiedlichen Gründen eingesetzt, erklärt ZEW-Forscherin Angelika Ganserer: „Aufträge lassen sich so an Firmen mit spezialisierten Fachkräften vergeben, die man ansonsten auf dem Arbeitsmarkt nicht finden würde oder nur für eine bestimmte Aufgabe braucht.“ Ein Beispiel ist die Beschäftigung eines Handwerkers.

Aber auch saisonale Produktionsspitzen lassen sich so auffangen. Beim Wursthersteller Wolf aus Bayern zum Beispiel sind fast 500 Arbeiter mit Werkverträgen angestellt, vornehmlich im Sommer, wenn die Nachfrage nach Grillwürsten besonders hoch ist. Im Winter gehen dann viele zurück in die Heimat. „Oder sie arbeiten in der Lebkuchenproduktion“, wie Wolf von den Helfern im Werk Nürnberg berichtet.

Was ist das Problem an Werkverträgen?

Anzeige

Sie werden mitunter genutzt, um auf unrechtmäßige Weise Kosten zu sparen. Möglich ist etwa, dass die per Werkvertrag beschäftigten Arbeitskräfte in die laufende Produktion des Auftraggebers eingebunden sind und ähnliche Aufgaben erledigen wie die Stammbelegschaft – aber zu schlechteren Konditionen. Gezahlt wird dann zum Beispiel Mindestlohn, aber nicht Tariflohn.

Warum soll es ein Verbot für eine einzelne Branche geben?

Die Bundesregierung reagiert damit auf die Corona-Ausbrüche in Schlachthöfen und auf die jahrelange Diskussion über schlechte Arbeitsbedingungen in der Fleischindustrie. Selbstverpflichtungen, schärfere Regeln und Kontrollen hätten keine Verbesserung gebracht, heißt es im Gesetzentwurf des Arbeitsministers.

Bislang vermitteln Subunternehmen viele Tausend Beschäftigte aus dem Ausland, die in den Schlachtereien in der Kälte stehen und zum Beispiel Schweine zunächst ausnehmen, in Hälften trennen und später in Einzelteile zerlegen. Untergebracht sind die Arbeiter meist in Wohngemeinschaften, mancherorts gibt es aber auch beengte Sammelunterkünfte. Und dafür wird den Betroffenen oftmals noch ein hoher Betrag vom Lohn abgezogen. Auch von „Messergeld“ für die Ausrüstung ist teilweise die Rede.

Lesen Sie auch Fleisch Schweinefleisch zum Genießen. Trotz allem

Die neuen Regeln sollen sicherstellen, dass Schlachthofbetreiber die Verantwortung für Missstände nicht länger auf Subunternehmer abwälzen können, die über Werkverträge Arbeitsleistungen erbringen.

Laut Gesetzentwurf macht betriebsfremdes Personal in der Fleischindustrie vielfach über die Hälfte der Arbeitnehmer aus. Beschäftigte der verschiedenen Werkvertragsunternehmen und die Leiharbeitnehmer arbeiteten teilweise zusammen und führten vergleichbare Tätigkeiten aus.

„Dies führt zu einem nur schwer durchschaubaren Nebeneinander verschiedenster Beschäftigungsverhältnisse. Es sind in diesen Bereichen keine klaren Verantwortlichkeiten gegeben, was unter anderem dazu führt, dass auf die Einhaltung der arbeitsrechtlichen und arbeitsschutzrechtlichen Regelungen häufig nicht geachtet wird“, heißt es in dem Entwurf.

Was sieht der Gesetzentwurf genau vor?

Beim Schlachten, Zerlegen und in der Fleischverarbeitung dürfen Großbetriebe ab 2021 nur noch eigene Arbeitnehmer einsetzen. Ausgenommen von dem Verbot sind laut einem überarbeiten Entwurf des Gesetzes, über den Reuters berichtete, Unternehmen des Fleischerhandwerks mit bis zu 49 Beschäftigten.

Lesen Sie auch Lockdowns erschwert Dieses Urteil wird die Bekämpfung der Pandemie fundamental verändern

Anzeige

Das Arbeitsschutzkontrollgesetz schreibt zudem eine Mindestbesichtigungsquote bei Kontrollen vor: Ab 2026 soll pro Jahr mindestens jeder 20. Betrieb besucht werden. Die Arbeitszeit muss künftig zudem elektronisch aufgezeichnet werden, um Kontrollen zu erleichtern.

Was bedeutet das Vorgehen für andere Branchen?

Der Gesetzentwurf bezieht sich gezielt auf die Fleischindustrie. Doch Arbeitsminister Heil hat schon angekündigt, auch andere Branchen prüfen zu wollen. „Wir werden uns Branche für Branche angucken und dann für die jeweilige Branche geeignete Maßnahmen ergreifen, wenn es nötig ist“, sagte er.

Die Arbeitgeber fürchten weitreichende Einschränkungen. „Finger weg von einer allgemeinen Einschränkung von Werkverträgen und Arbeitnehmerüberlassung, wenn man nicht die Wirtschaft völlig abwürgen will“, hieß es zum Beispiel von Arbeitgeberpräsident Ingo Kramer. Werkverträge seien zum Beispiel für weite Bereiche des Handwerks, der Bauindustrie und des Anlagenbaus zwingend die Grundlage für ihre Wertschöpfung beim Kunden.

Warum ist das Konstrukt überhaupt wichtig für die Wirtschaft?

Werkverträge sind zentral für die Zusammenarbeit und Arbeitsteilung zwischen Firmen und regeln auch Haftungs- und Gewährleistungsrisiken. Deutlich wird das am Beispiel der Automobilindustrie, wo Werkverträge laut ZEW-Forscherin Ganserer sehr verbreitet sind – nämlich zwischen Herstellern und Zulieferern.

Beide sind tarifgebunden, im Lohnniveau gibt es häufig kaum Unterschiede. Warum verbauen Beschäftigte der Zulieferfirmen Teile am Band des Autoherstellers? „Im Werkvertrag wird klar definiert, welches Werk zu leisten ist, fehlerfrei und entsprechend der vereinbarten Qualität.

Lesen Sie auch Kapitalismus – kurz und mündig Warum Konsum die Lösung unserer Probleme sein kann

Für Kunden ist das nicht ersichtlich, für den Automobilhersteller aber im Fall einer Rückrufaktion wegen eines spezifischen Bauteils äußerst relevant“, erklärt Ganserer. Ist ein Teil defekt, erfolge der Rückruf erst mal durch den Hersteller. Der wiederum weiß eindeutig, welcher entsprechende Zulieferer verantwortlich ist und nun für Ersatz zu sorgen und vor allem die Kosten dafür zu tragen hat.

Beispiel Maschinenbau. „Die Unternehmen nutzen Werkverträge sowohl als Kunden als auch als Anbieter, weil sich anders eine auf Effektivität ausgerichtete Arbeitsteilung nicht aufrechterhalten lässt“, sagt Thilo Brodtmann, der Hauptgeschäftsführer des Verbands Deutscher Maschinen- und Anlagenbau (VDMA). „Eine Welt ohne Werkverträge können wir uns nicht vorstellen.“

Allerdings wird das Arbeitsmodell in der Vorzeigebranche auch nicht im Niedriglohnsektor genutzt, sondern im wertschöpfenden Bereich, also vor allem bei hoch qualifizierten Spezialisten, etwa beim Bau von Robotern.

Wie geht es für die Fleischindustrie weiter?

Anzeige

Die deutsche Fleischwirtschaft hält das von der Bundesregierung geplante Verbot von Werkverträgen und Leiharbeit in ihrer Branche für verfassungswidrig, weil es ein massiver Eingriff in die unternehmerische Freiheit sei. Unter anderem der Wursthersteller Wolf lässt daher bereits eine Verfassungsklage prüfen. Außerdem rechnet die Branche bei einem Verbot mit deutlich steigenden Fleischpreisen und einer Abwanderung von Produktionskapazitäten ins Ausland.

Lesen Sie auch Verpflichtende Corona-Tests Besonders eine Gruppe sorgt die deutsche Politik

Ein Gutachten für das Düsseldorfer Gesundheitsministerium hatte allerdings ergeben, dass ein auf die Branche begrenztes Verbot rechtlich möglich ist. Der Deutsche Gewerkschaftsbund (DGB) warnte indes vor neuen Schlupflöchern für die Fleischindustrie. Die Bundesländer müssten eine höhere Kontrolldichte erreichen.","Carsten Dierig, Christine Haas",1596000323,"Wirtschaft,Ende der Werkverträge",welt
Probebetrieb am Großstadtflughafen Berlin,,,1595999580,"Wirtschaft,Komparsen testen BER",welt
„Antivirale“ Mode – Das Geschäft mit der Corona-Angst,"Modemarken experimentieren mit Hightech-Materialien, die Viren abtöten sollen. Die neuen Produkte bringen mehr fürs Marketing denn für die Gesundheit. In Zukunft könnten sie trotzdem an Bedeutung gewinnen.

Anzeige

In der Mode redet man ja immer gerne von „Must-haves”: Kleidungsstücken oder Accessoires, die man haben muss, weil sie besonders modisch oder neu sind. Nun spielen diese Kriterien für viele Kunden derzeit kaum noch eine Rolle. Sie haben ganz andere Sorgen und fragen sich, wie sie gesund bleiben oder sich selbst und ihre Mitmenschen schützen können.

Aus ebendiesem Grund ist die Atemschutzmaske das wohl wichtigste Must-have dieses Sommers, und aus diesem Grund könnte noch eine ganz andere Kategorie in der Mode zum Überraschungstrend werden: antivirale Mode. Kleidung also, deren Materialien auf eine Art und Weise behandelt wurden, dass sie beim Kontakt mit Krankheitserregenden Viren und eben auch Sars-Cov-2-Viren diese abtöten können sollen. Was man eigentlich in Krankenhäusern oder Forschungslaboren verorten würde, will sich, angetrieben von der Pandemie, als Alltagsausrüstung für Normalverbraucher etablieren – zumindest, wenn es nach manchen Modemarken geht.

Beispielsweise kündigte das italienische Modelabel Diesel vergangene Woche an, dass es in der kommenden Frühlingskollektion für das Jahr 2021 eine Auswahl an Jeans aus antiviralem Denim anbieten wird. Artistic Denim Mills, ein führender Denim-Hersteller aus Pakistan, wird ab Oktober die Hosen seiner Eigenmarken ebenfalls mit einer in der Schweiz entwickelten Technologie behandeln, die 99,9 Prozent von Sars-Cov-2 Viren abtöten können soll. Und Vollebak, das Label von zwei Abenteuersportlern, das Outdoor-Kleidung für Extremsituationen entwickelt, hat Kupfer in eine Jacke eingearbeitet, die dadurch „krankheitsresistent” sein soll: Das Kupfer in dem „Full Metal Jacket” ist antimikrobiell und tötet Viren und Bakterien ab.

Diesel bietet in seiner Frühjahrskollektion eine antivirale Jeans an Quelle: PR

Anzeige

Klar, Mode spiegelt den Zeitgeist wider, aber sie tut es auch und oft dann, wenn sie ein Geschäft wittert. Dass die coole Jeans jetzt als virusfeste Schutzrüstung verkauft wird, ist in erster Linie eine weitere, mit viel Marketingexpertise ausgetüftelte Strategie, um überhaupt Jeans zu verkaufen – gerade jetzt, da die Branche mit einbrechenden Umsätzen kämpft. Andererseits reagieren die Firmen auch auf das Angebot von Textilherstellern und Chemielaboren, die angesichts der Pandemie an technologischen Innovationen forschen, die medizinische und nicht medizinische Bereiche und Räume sicherer machen sollen.

Viral Off® beispielsweise, die Substanz, mit der das Denim für Diesel behandelt wird, ist ein Produkt des schwedischen Chemieunternehmens Polygiene. Die Arbeit daran begann bereits in den frühen Nullerjahren als Reaktion auf die Sars-Epidemie und ruhte über Jahre, als das Interesse daran zurückging. Das hat sich geändert. Polygiene nahm die Forschung wieder auf und lancierte im April Viral Off®. Dessen Hauptbestandteil ist ein Biozid – also eine Chemikalie, die für Menschen gedachte Produkte vor Schädlingen schützen soll. Die Substanz wird gegen Ende der Kleidungsherstellung auf das Kleidungsstück aufgetragen, legt sich wie ein schützender Film auf den Stoff und sorgt dafür, dass darauf gelangende Viren und Bakterien innerhalb von zwei Stunden absterben.

Von der Schweizer Textilfirma HeiQ, die mit dem pakistanischen Denim-Riesen gearbeitet hat, stammt hingegen die Viroblock-Technologie, die im März vorgestellt wurde und auch schon bei Atemschutzmasken für Krankenhäuser zum Einsatz kommt. Das Unternehmen beschreibt seinen Schutz als zähflüssige Masse, mit der Kleidungsstücke in der letzten Phase der Herstellung beschichtet werden. Durch den chemischen Prozess, der beim Kontakt mit den Viren entsteht, werden diese außer Gefecht gesetzt. Beide Technologien wurden auf unterschiedliche Viren nach ISO-Standards getestet, Viral Off® wurde zudem von Öko-Tex auf Nachhaltigkeit und Unschädlichkeit für Mensch und Umwelt zertifiziert.

Die Idee basiert auf einer Gefahr, die nicht belegt ist

Anzeige

Hightech-Fashion im Kampf gegen das Virus: Das klingt erst mal schön aufregend und vor allem neu. Aus dem klassischen Design kommen heute kaum noch bahnbrechende Ideen, die Mode recycelt Trends und Stile aus der Vergangenheit und experimentiert lieber mit Social-Media-Plattformen denn mit Schnitten. Auch der Textilbereich wird jedoch als ein wichtiges Spielfeld für Innovationen gesehen.

Neuartige Textilien sollen dafür sorgen, dass unsere Kleidung immer mehr kann und immer besser funktioniert. Diese Ansprüche haben viele Kunden spätestens seit dem Erfolgszug von Athleisure: Kleidung soll praktisch und bequem sein, sich unterschiedlichen Temperaturen anpassen, knitterfrei aus dem Rollkoffer kommen – und uns jetzt bitte auch vor Krankheiten schützen.

Eine Modefrage, die der Lockdown aufgeworfen hat Styling-Frage Schluss mit dem Schluffi-Look oder Athleisure für immer?

In Sachen antiviraler Mode geht man allerdings von einer Gefahr aus, die, zumindest bisher, nicht belegt ist: Nämlich jener, dass man sich über kontaminierte Kleidung anstecken und an Covid-19 erkranken kann. „Für eine Übertragung des Virus durch Kontakt zu kontaminierten Gegenständen, wie zum Beispiel Bekleidung, oder über kontaminierte Oberflächen, wodurch nachfolgend Infektionen beim Menschen aufgetreten wären, gibt es derzeit keine belastbaren Belege”, heißt es dazu auf Anfrage vom Bundesinstitut für Risikobewertung.

Anzeige

Die viel besprochenen Schmierinfektionen, bei denen eine Ansteckung über den Kontakt von Schleimhäuten zu kontaminierten Oberflächen erfolgt, könnten zwar nicht ausgeschlossen werden. „Aber nach gegenwärtigem Kenntnisstand spielen sie in Alltagssituationen eine nachgeordnete Rolle bei der Übertragung von Sars-CoV-2.”

„Antiviral“ als kommerzielles Zauberwort

Das zu glauben und zu akzeptieren fällt manchen Menschen nicht so leicht bei einem so emotional aufgeladenen Thema, in dem Fakten oft untergehen in Debatten, in denen sich die Gegenseiten wahlweise Panikmache oder Rücksichtslosigkeit vorwerfen. Ob eine antivirale Jeans wirklich nötig ist, spielt für sie vielleicht erst mal keine Rolle, wenn sie sich dadurch subjektiv besser und sicherer fühlen. „Antiviral” wird da schnell zum kommerziellen Zauberwort, das, ähnlich wie „nachhaltig”, bestimmte Gefühle, Werte, oder, wie in diesem Fall, Ängste anspricht.

In den vergangenen Monaten sah man in Flugzeugen Menschen mit Schutzoveralls und Sicherheitsbrillen sitzen, jeder Zentimeter Haut abgeschirmt vom Kontakt zur Außenwelt. Über solche Auftritte kann man schmunzeln, aber man braucht sich nicht zu wundern, wenn Modemarken auf neue Bedürfnisse reagieren, die von gesellschaftlichen Ereignissen und Umwälzungen wie einer Pandemie hervorgerufen werden.

Das beste Beispiel ist die bereits genannte Atemschutzmaske. Vom kleinen Änderungsschneider nebenan bis zur globalen Luxusmarke haben sich unzählige Firmen in den vergangenen Monaten in die Maskenproduktion gestürzt, aus einem Kuriosum ist ein essenzieller Begleiter unseres Alltags geworden.

Maskentragen kann Probleme mit sich bringen Keine „Maskne“ So vermeidet man Pickel und gereizte Haut unter der Maske

Technologien wie Viroblock oder Viral Off® spielen im Rahmen von Forschungsarbeiten zum Virenschutz absolut eine wichtige Rolle, und damit behandelte Masken können den Träger zusätzlich schützen, erst recht im medizinischen Bereich. Antivirale Mode hingegen bringt als Marketingtool wohl mehr als Gesundheitsvorsorge. Aber sie deutet an, in welche Richtung sich die Bekleidungsindustrie entwickeln könnte, je mehr die Gesellschaft sich an die Präsenz und Gefahr eines Virus gewöhnt. Und sich dann – passend zum Zeitgeist – anziehen möchte.

Folgen Sie uns unter dem Namen ICONISTbyicon auch bei Facebook, Instagram und Twitter.",Silvia Ihring,1595999525,"Mode,Zweifelhafte Produkte",welt
Beide Mineralwasser-Testsieger stammen von Aldi Süd,,"'Carsten Dierig', 'Jörn Brien'",1595998943,"Panorama,Stiftung Warentest",welt
Stichtag 31. Juli – So bekommen Sie mehr Zeit für Ihre Steuererklärung,,Berrit Gräber,1595998609,"Verbraucher,Deadline vom Finanzamt",welt
