title,text,author,published,tags,source
Pop-up-Camps – Die Alternative zum Campingplatz,"Anzeige

Als Jobst von Paepcke und seine Kinder im März von ihrem Infekt mit dem neuartigen Coronavirus genesen waren, da traf der Familienvater einen Entschluss: Seine Kinder sollen 2020 den Sommer ihres Lebens verbringen, trotz all der widrigen Umstände, die das Leben sonst so erschwerten. Möglichst viel draußen, am Wasser, in der Natur sollten sie sein – und da von Paepke selbst seit vielen Jahren Surfer und Camper ist, natürlich auf Campingplätzen.

Stellte sich nur die Frage: wo? Wenn schon jetzt viele Plätze ausgebucht sind? Wohin mit Familie von Paepcke – und all denen, die sonst nach Italien, Spanien oder Frankreich fahren? Die Lösung fand von Paepcke schließlich selbst.

Lesen Sie auch Ein Mikroabenteuer Dann melden sich die Frösche – Eine Nacht an der Elbe

Lesen Sie auch Strand, Wald und Sterne Jenseits von Rügen – unbekannte Inseln in der Ostsee

Lesen Sie auch Alternative zur Flugreise Alkoven-Typ oder Glamour-Camper? So werden Sie zum Wohnmobil-Profi

Der Trend zum Camping ist nicht neu, die Übernachtungszahlen wachsen seit zehn Jahren jährlich um etwa eine Million. Und in diesem Jahr könnte der Boom einen neuen Höhepunkt erreichen, denn noch nie wurden so viele Wohnmobile neu zugelassen wie im Mai dieses Jahres. Laut Statistischem Bundesamt lag die Anzahl der Neuzulassungen mit mehr als 10.000 um fast 30 Prozent höher als im Mai 2019. Insgesamt sind in Deutschland heute 200.000 mehr Wohnmobile zugelassen als vor fünf Jahren. Auch der Zeltverkauf boomt, sogar bei den großen Discountern gab es zuletzt viele Angebote. Und die müssen schließlich, wenn sie nicht verboten stehen wollen, irgendwo bleiben.

Jobst von Paepcke nutzt auch Festivalgelände für seine Campingidee Quelle: dpa

Anzeige

„Es drohte und droht weiter ein riesiges Kapazitätsdefizit für Urlauber in Deutschland“, sagt Jobst von Paepcke. Er kennt sich mittlerweile aus mit Zahlen und Fakten der Branche, denn aus dem privaten Camper ist in den vergangenen Monaten ein Profi in Sachen Camping geworden. Nachdem die Umsätze seiner Hamburger Agentur für Filmproduktion coronabedingt von sechsstellig auf dreistellig geschrumpft sind – die Firma verdient ihr Geld mit Filmen über Festivals – und eine Änderung der Lage nicht in Sicht ist, wurde aus dem langjährigen Geschäftsführer auf einmal wieder ein Start-up-Unternehmer.

Pop-up-Camps hat der 44-Jährige seine Idee getauft, frei nach dem Prinzip von Geschäften, die ohne vorherige Renovierung oder gängige Einrichtung für eine gewisse Zeit auftauchen und dann wieder verschwinden. „Wir brauchen Flächen, die schnell zur Verfügung stehen, keine Infrastruktur benötigen und wenig kosten“, sagt er. Die erste Idee der neu gegründeten GmbH: Betreiber von Festivalflächen können ihre brach liegenden Gelände zu Campingplätzen auf Zeit umfunktionieren. „Auch diese Branche ist zurzeit tot und kann auf diese Weise Einnahmen erzielen“, sagt von Paepcke.

Lesen Sie auch Ab in die Natur Der Deutschen neue Lust aufs Wandern

Lesen Sie auch Urlaub in Corona-Zeiten So sieht es gerade in wichtigen Urlaubsländern aus

Aber: Camping ist die Jagd nach dem besten Platz, und gerade die neuen, jüngeren Camper zwischen Mitte 20 und Mitte 30 wollen – anders als die klassische Zielgruppe zwischen 50 und 70 – lieber einen Platz in der Natur als ein frisch saniertes Waschhaus. Die Musik, das sagt der Gründer selbst, spielt daher weniger in den großen Festivalflächen als bei den kleinen, feinen Privatleuten, die ihre Gärten und Hinterhöfe, Wiesen und Weiden für ein paar Fahrzeuge mit ausreichend Abstand zueinander öffnen.

Anzeige

„Das ist wie früher, als man den Bauer fragte, ob man für eine Nacht bei ihm zelten darf“, sagt der Sohn eines Landwirts aus der Nähe von Plön. „Nur dass die Eigentümer früher immer Ärger mit dem zurückgelassenen Müll der Gäste hatten.“ Heute dagegen läuft der Besuch ganz ordentlich nach vorheriger Anmeldung und vorgeschriebener Registrierung – und gegen Bezahlung.

Mehr als 100 private Anbieter in ganz Deutschland stehen derzeit auf der Liste der Pop-ups, von einer Wiese in Wallsbüll bei Flensburg für 10 Euro die Nacht bis zum Platz mit Blick auf die Ostsee in Schmoel nahe Hohwacht für 39 Euro, alles ohne die von festen Campingplätzen bekannte Infrastruktur wie Strom, Wasser und Waschhaus.

Lesen Sie auch Kanarische Insel Lanzarote und die große Leere

Für 25 Euro pro Nacht können autarke Camper zum Beispiel am Teich der Familie Burgsdorff auf Gut Doberstorf in der Holsteinischen Schweiz stehen. Im Preis inklusive ist die Angelerlaubnis. „Angelt so viel und so lange ihr wollt, die Fische könnt ihr direkt an unserem Grillplatz zubereiten“, wirbt Esther von Burgsdorff für ihr „Camping und Angeln im Grünen“. Coronabedingt konnte sie den Angelteich im Frühling nicht vermieten, die Idee des Pop-up-Camps kam für sie daher gerade recht.

Anzeige

„Das ist eine super Möglichkeit für uns, unseren Betrieb laufend weiterzuentwickeln“, sagt Esther von Burgsdorff. „Die ersten Buchungen haben wir schon, ich bin total gespannt, wer zu uns kommt.“ Bis zu 20 Camper finden auf ihrer großen, frisch gemähten Wiese Platz, theoretisch sogar mit Pferd oder Pony. Denn zum Gut gehört nicht nur der Teich, sondern auch ein Wald mit Reitwegenetz.

Für Jobst von Paepcke ist Familie Burgsdorff ein Idealfall seiner Idee. „Wir suchen permanent weitere private Anbieter“, sagt er. Für die Anbieter ist das Einstellen der Annonce kostenlos, bei Buchung berechnet die GmbH 20 Prozent Provision. Von Paepcke und sein Team beraten die Privatleute in Sachen Corona-Regeln und Genehmigung bei den Behörden, sie stellen das Buchungsportal inklusive automatischer Übernachtungsnachweise zur Verfügung. Über den Rest, also den Preis pro Übernachtung und die Anzahl der Plätze, entscheiden die Anbieter selbst.

„Wir dürfen das, was wir haben, nicht aufs Spiel setzen“

Die Genehmigung durch die jeweils zuständigen Ämter klappt nach den Erfahrungen der ersten Monate mal besser und mal schlechter, sagt von Paepcke. Er hofft weiterhin auf Zusagen – und darauf, dass die Behörden das wilde Campen nicht nur verbieten, sondern auch ahnden. Zumindest in Schleswig-Holstein trifft der Hamburger Geschäftsmann damit auf offene Ohren. Wildes Campen und das Abstellen von Reisemobilen in landschaftlich sensiblen Bereichen werde „von den Ordnungsbehörden konsequent unterbunden“, heißt es vom Ministerium für Wirtschaft, Verkehr, Arbeit, Technologie und Tourismus.

Auch in Kiel sieht man den Bedarf an zusätzlichen Flächen für Camping. „Viele Deutsche möchten aufgrund der internationalen Reisewarnungen und zum Gesundheitsschutz lieber im eigenen Land verreisen, satteln vermehrt von Flugzeug und Bahn auf Auto oder Wohnwagen um“, sagt Bettina Bunge, Geschäftsführerin der Tourismus-Agentur Schleswig-Holstein. „Das spiegelt sich auch in der Auslastung der Campingplätze wider. Hier bei uns in Schleswig-Holstein wird es in diesem Sommer, gegebenenfalls sogar im Herbst, kaum noch freie Kapazitäten geben, an Ost- und Nordsee wie auch im Binnenland.“

Dabei sind die Zahlen in Schleswig-Holstein in den vergangenen Jahren auch ohne Corona schon deutlich gewachsen: von 3,7 Millionen Übernachtungen im Jahr 2016 auf 4,3 Millionen im Jahr 2019, von 262 auf 275 Campingplätze. Noch mehr in die Vergrößerung fester Infrastruktur zu investieren, daran haben die Betreiber selbst offensichtlich wenig Interesse. Jedenfalls warnt der Chef-Camper des nördlichsten Bundeslandes davor, die Schraube noch weiterzudrehen. „Wir erleben zwar seit Jahren eine Renaissance des Campings“, sagt Gert Petzold, Vorsitzender des Landesverbands Schleswig-Holstein der Campingwirtschaft in Deutschland. „Aber ich warne davor, die Kapazitäten zu erweitern. Wir dürfen das, was wir haben, nicht aufs Spiel setzen: Das sind die Küsten und die Natur.“ Schließlich ist die Nähe zur möglichst unberührten Natur der Hauptgrund für diese Urlaubsform.

Es scheint also, als ob die plötzlichen Campingplätze eine gute Idee sind – auch, weil sie ebenso schnell wieder verschwinden können, wie sie aufgetaucht sind.

Dieser Text ist aus der WELT AM SONNTAG. Wir liefern sie Ihnen gerne regelmäßig nach Hause.

Quelle: WELT AM SONNTAG",Carolin George,1595998054,"Hamburg,Urlaub in Corona-Zeiten",welt
Finanzaufsicht soll Bundestag falsch informiert haben,,,1595997960,"Videos,Wirecard",welt
Mit dieser Attacke wollen die USA Nord Stream 2 endgültig beerdigen,"Mit aller Macht versuchen die USA, Nord Stream 2 zu verhindern. Ihre Sanktionsdrohungen richten sich nun direkt gegen deutsche Unternehmen. Selbst Mitarbeitern müssen drastische Konsequenzen befürchten. Politiker sehen einen „klaren Eingriff in Europas Souveränität“.

Die USA haben wiederholt versucht, den Bau der Ostseepipeline Nord Stream 2 mit Sanktionen zu verhindern. Nun erhöhen sie den Druck auf deutsche und europäische Firmen, die am Bau beteiligt sind.

Anzeige

Die US-Regierung hat den Druck auf das umstrittene russische Pipeline-Projekt Nord Stream 2 massiv erhöht. Die bislang unbestimmten Sanktionsdrohungen Washingtons gegen europäische Subunternehmer und Finanziers der Gasleitung zwischen St. Petersburg und dem deutschen Lubmin wurden konkretisiert, erweitert und mit Wirkung ab 15. Juli in Kraft gesetzt. Und dabei ist es nicht geblieben.

Nach Informationen von WELT hat das amerikanische Außenministerium unmittelbar nach diesem Schritt deutsche und europäische Unternehmen zu Einzelgesprächen per Videoschaltung gebeten und ihnen die weitreichenden Konsequenzen einer weiteren Projektbeteiligung deutlich gemacht. Wie es aus Kreisen der Wirtschaftsvertreter hieß, saßen deutsche Manager in den kurzfristig anberaumten Gesprächen bis zu zwölf Vertretern der drei US-Ministerien Department of State (Außen), Treasury (Finanzen) und Energie gegenüber.

Die Unternehmen sollten unter anderem erklären, was zur Erfüllung ihres Arbeitsauftrags an der Pipeline noch auszuführen sei. Die US-Vertreter hätten „in freundlichem Ton sehr deutlich gemacht, dass sie die Fertigstellung der Pipeline verhindern wollen“, berichtete ein Beobachter: „Ich glaube, dass die Drohung sehr, sehr ernsthaft ist.“

Auf einer Plattform am Pipeline-Verlegeschiff ""Castoro 10"" vor der Insel Rügen werden zwei Leitungsstücke der Ostsee-Erdgaspipeline Nord Stream 2 verbunden Quelle: picture alliance/dpa

Anzeige

Die Firmen selbst, darunter technische Dienstleister, aber auch große Energiekonzerne wie Uniper, Wintershall Dea und Shell, wollten dazu gegenüber WELT keinen Kommentar abgeben. Auch öffentlich zumeist unbekannte mittelständische Zulieferer des Pipeline-Projekts sind Adressaten der Sanktionsdrohung geworden.

Aus dem Außenministerium in Berlin hieß es: „Das Auswärtige Amt hat Kenntnis darüber, dass die US-Seite Gespräche mit deutschen Unternehmen führt, um die CAATSA-Durchführungsbestimmungen zu erläutern.“ Man sei „mit den Unternehmen dazu ebenfalls in Kontakt“.

Der Vorgang könnte die transatlantischen Spannungen verschärfen. Deutsche Wirtschaftsvertreter und EU-Parlamentarier fordern eine Gegenreaktion von Berlin und Brüssel. Sie sehen die deutsche und europäische Souveränität durch den amerikanischen Eingriff unzulässig eingeschränkt. Für den Parlamentarischen Geschäftsführer der CDU/CSU-Gruppe im Europäischen Parlament, Markus Pieper, sind die Sanktionsdrohungen „ein eindeutiger Verstoß gegen alles, was wir unter Handelsrecht verstehen“.

Quelle: Infografik Die Welt

Anzeige

Denn den Unternehmen droht der vollständige Ausschluss vom US-Markt, ihren Mitarbeitern Einreiseverbote und den Hausbanken der Ausschluss von allen Finanzinstrumenten, die dem Einfluss amerikanischer Regulierung unterliegen.

Die insgesamt zwölf Sanktionsmöglichkeiten listet der Countering America’s Adversaries Through Sanctions Act, kurz CAATSA, in Paragraf 235 auf. Das Ziel der Ausführungsbestimmungen zum Gesetz, „Guidance“ genannt, hatte US-Außenminister Mike Pompeo für die betroffenen Firmen so zusammengefasst: „Steigen Sie jetzt aus oder tragen Sie die Konsequenzen.“

Größte Investitionsruine der Welt?

Ein Sprecher der US-Botschaft in Berlin betonte, dass die Firmen damit hätten rechnen müssen: „Die USA haben klar und konsistent auf die Gefahr hingewiesen, die das Nord-Stream-2-Projekt für die gemeinsamen Sicherheitsinteressen Europas darstellt“, hieß es auf Nachfrage von WELT: „Und um ebenso klar zu sein: Auch wenn wir die Sanktionen nicht jetzt verhängen, sollten sich die Firmen darüber bewusst sein, dass eine weitere Verbindung mit Nord Stream 2 für sie riskant ist.“

Anzeige

Beobachter der Verhandlungen gehen davon aus, dass die Androhung einer Sanktion bereits eine ähnliche Wirkung entfalten könnte wie die Sanktion selbst. „Auch Unternehmen, die keine Exposition auf dem US-Markt haben, können ein Problem mit ihren Hausbanken bekommen, die es natürlich nicht riskieren können, von allen USA-Kontakten abgeschnitten zu werden“, sagte Sascha Lohmann, der sich in der Forschungsgruppe Amerika der Stiftung Wissenschaft und Politik (SWP) mit dem Vorgang befasst.

Die schweren letzten Meter von Nord Stream 2 Die Ostseepipeline Nord Stream 2 steht kurz vor der Fertigstellung. Auf den letzten Metern erschweren weitere US-Sanktionen die Arbeit der beteiligten Unternehmen. Quelle: WELT / Nicole Fuchs-Wiecha

Demnach wäre nicht ausgeschlossen, dass ein Teil der Unternehmen die restlichen Arbeiten an der Unterwasser-Pipeline abbricht. Von der 1230 Kilometer langen Ostsee-Röhre fehlen zur Fertigstellung nur noch rund 160 Kilometer. Mit Baukosten von rund acht Milliarden Euro droht sie zu einer der größten Investitionsruinen der Welt zu werden.

Die zum russischen Gazprom-Konzern gehörende Projektgesellschaft Nord Stream 2 im schweizerischen Zug lehnte es vergangene Woche ab, sich zu der Frage zu äußern, ob Auftragnehmer wegen der US-Drohungen bereits ihre Mitarbeit aufgekündigt haben. Nach Angaben der Gazprom-Tochter könnten die US-Sanktionen, „sofern sie verhängt werden, über 120 Unternehmen aus mehr als zwölf europäischen Ländern direkt treffen“.

„Ein klarer Eingriff in die europäische Souveränität“

Zu den Unternehmen, die bei Nord Stream 2 als Finanzinvestoren engagiert sind, gehören die Energiekonzerne Engie aus Frankreich, OMV aus Österreich, die niederländisch-britische Shell sowie Uniper und Wintershall Dea aus Deutschland.

Sie haben jeweils zwischen 700 Millionen und einer Milliarde Euro in den Bau der Pipeline investiert. Ob und inwieweit auch dieses frühe Finanzinvestment jetzt noch zu Sanktionen führen kann, scheint nach dem weit gefassten Wortlaut der US-Regeln nicht ganz eindeutig.

Lesen Sie auch Nord Stream 2 Ein Schiff vor Rügen schürt Amerikas Wut auf das abtrünnige Europa

„Wir gehen davon aus, dass Investitionen, die jetzt in Nord Stream 2 getätigt werden, unter diese neue Regelung fallen, aber nicht solche, die vor dem 15. Juli getätigt wurden“, erklärte der Energiekonzern Uniper. Experten der Bundesregierung warnen jedoch, dass „auch das fortgesetzte Bedienen von bestehenden Kredit- beziehungsweise finanziellen Verträgen“ unter die Definition des US-Gesetzes falle.

Uniper, eine Abspaltung der E.on SE, stellte „mit Bedauern fest, dass die USA mit der angekündigten Überarbeitung der CAATSA-Leitlinien weiterhin versuchen, ein wichtiges Infrastrukturprojekt zu untergraben, das unserer Meinung nach für die Energiesicherheit Europas wichtig ist“. Dies sei „ein klarer Eingriff in die europäische Souveränität“.

Lesen Sie auch Ende des schwarzen Goldes Das ist der Plan für eine Welt ohne Öl

Anzeige

Grundsätzlich können alle Personen, die sich ab dem 15. Juli an der Finanzierung, dem Bau, der Röhrenverlegung oder verwandten Dienstleistungen beteiligen, sanktioniert werden, sofern sie nicht glaubhaft darlegen können, dass sie ihre Handlungen in Bezug auf die Pipeline herunterfahren („wind down“). Weitergehender Altvertragsschutz wird nicht gewährt.

Der Industriedienstleister DNV GL (Germanischer Lloyd) etwa war von Nord Stream 2 damit beauftragt worden, die technische Integrität des Pipeline-Systems zu prüfen. Ob er den Auftrag noch abarbeitet, wurde aus der Stellungnahme nicht abschließend klar: „DNV GL befolgt alle gültigen Abkommen, Gesetze und Handelsverträge“, hieß es nur.

Diversifizierung der Import-Möglichkeiten

Erfolgreiche US-Sanktionen würden „Investitionen von rund zwölf Milliarden Euro in die Energieinfrastruktur der EU untergraben“, erklärte ein Sprecher von Nord Stream 2. Denn neben den Ausgaben von acht Milliarden Euro für die Pipeline selbst seien weitere fast vier Milliarden in die weiterführende Infrastruktur geflossen, darunter in die Pipeline EUGAL, die einen Teil des russischen Gases vom Anlandepunkt bei Greifswald in Richtung Tschechien transportieren soll.

Ende vergangenen Jahres hatte Washington bereits die Schweizer Firma Allseas als Betreiber der Verlegeschiffe zum sofortigen Abbruch der Arbeiten bewogen. Inzwischen hat Gazprom das eigene Spezialschiff „Akademik Tscherski“ herangeführt, das die Arbeit übernehmen soll.

Lesen Sie auch Russischer Supermarkt-Investor Was haben Sie mit Real vor, Herr Jewtuschenkow?

Durch die Ausweitung des Sanktionsgesetzes CAATSA greifen die USA das Projekt jetzt auch von anderer Seite her an. Dass Gazprom alle ausstehenden Arbeiten und Dienstleistungen selbst übernehmen könnte, erscheint nicht sehr wahrscheinlich.

Die Bundesregierung hatte sich hinter das Pipeline-Projekt gestellt, unter anderem durch Schreiben an US-Senatoren, die sich für Sanktionen starkgemacht hatten. Aus deutscher Sicht dient die Leitung der Diversifizierung der Import-Möglichkeiten, insbesondere da die europäische Gasförderung in den Niederlanden und in der Nordsee rückläufig ist.

Mit Anreizen zum Bau von Flüssiggas-Häfen an der Nordseeküste versucht die Bundesregierung zugleich, US-Interessen nach Gasexporten Rechnung zu tragen. Bundesaußenminister Heiko Maaß hatte die Konkretisierung der Sanktionsdrohungen bereits vergangene Woche kritisiert: „Die US-Regierung missachtet das Recht und die Souveränität Europas, selbst zu entscheiden, wo und wie wir unsere Energie beziehen. Die europäische Energiepolitik wird in Europa gemacht und nicht in Washington.“

„Ein gefährlicher Präzedenzfall“

Deutschen Wirtschaftsvertretern und EU-Parlamentariern reicht das nicht. Es stelle eine „neue, traurige Qualität“ dar, „wenn die USA ohne nennenswerte Konsultation der Bundesregierung deutschen Unternehmen Sanktionen androhen“, sagte Michael Harms, Geschäftsführer des Ost-Ausschusses der deutschen Wirtschaft: „Wenn wir uns von Drittstaaten unsere Energiepolitik diktieren lassen, ist das ein gefährlicher Präzedenzfall: Das Gleiche kann ja übermorgen auch den Chinesen einfallen.“

Anzeige

Vorhaltungen, Deutschland finanziere durch seine Gaskäufe die russische Rüstungsindustrie, seien „unfair“ und „nahe an Fake News“, kritisierte Harms. Die USA hätten ein weit höheres Handelsdefizit mit Russland als Deutschland – und dies basiere ebenfalls vor allem auf amerikanischen Öl-, zum Teil auch Gaskäufen in Russland.

„Wenn es darum gehen würde, Russland zu schwächen und Einnahmen zu verringern, hätten die USA also wunderbare Möglichkeiten dazu im eigenen Land“, kritisierte Harms. „Stattdessen beschließt man Sanktionsgesetze, die praktisch ausschließlich auf europäische Kosten gehen.“

Lesen Sie auch USA vs. China Der neue Kalte Krieg – So investieren Sie jetzt in die nächste Supermacht

Aus Sicht von SWP-Wissenschaftler Lohmann wäre Gegendruck allein von deutscher Seite „sehr unklug, da man sich damit auf einen rutschigen Abhang begeben würde“. Nach den US-Sanktionen erst gegen den Iran, jetzt gegen Russland werde es gleichwohl immer dringlicher, dass die EU in internationalen Handelsstreitigkeiten einen eigenen Standpunkt entwickelt und behauptet, sagte Lohmann mit Blick auf die sich rapide verschlechternden Beziehungen zwischen den USA und China: „Spätestens wenn deutsche Unternehmen durch US-Druck aus China rausgedrängt werden sollen, muss man etwas machen – denn dann wird es existenziell.“

EVP-Parlamentarier Pieper kritisierte, durch die jüngste Ausweitung des Sanktionsgesetzes von 2017 „werden deutsche Firmen jetzt auf eine Stufe mit dem Iran gestellt. Da hört der Spaß langsam auf.“ Deutschland und Europa müssten „dringend eine Gegenstrategie entwickeln“.

Dieser Text ist aus der WELT AM SONNTAG. Wir liefern sie Ihnen gerne regelmäßig nach Hause.",Daniel Wetzel,1595997343,"Wirtschaft,Ostsee-Pipeline-Pojekt",welt
