title,text,author,published,tags,source
„Alle hatten einen Lover in Spanien oder Griechenland!“,"Anzeige

Dass die Griechen alles, was nur denkbar ist, erfunden haben (zumindest vermeintlich), weiß man ja. Dass aber sogar die sexuelle Revolution und die komplette 68er-Bewegung in Griechenland, genauer auf einer griechischen Insel, ihren Ausgang nahm – das war Ihnen sicherlich neu! Mir übrigens auch.

Ich dachte, alles hätte seinen Ausgang in Kalifornien gehabt, an der Universität in Berkeley, bei Woodstock oder auch an der Sorbonne in Paris. Aber in Wahrheit war’s auf Rhodos, wie ich vor ein paar Jahren von ein paar reizenden älteren Herren erfahren durfte.

Diese Geschichte spielte sich in deren Jugend ab (die freilich genau zu jener Zeit war, als in Paris die Büstenhalter verbrannt wurden), und es scheint auf Rhodos eine wunderbare Jugend gewesen zu sein. Die älteren Herren schwärmten jedenfalls mit Begeisterung davon. Ich lernte sie kennen, als ich für das Magazin „Mare“ eine Reportage über Kamakia schreiben sollte, denn so wurden diese Herren in ihrer Jugend genannt.

Anzeige

In Italien nennt man diese Kategorie von Männern Pappagalli. Bei uns in Deutschland gibt es keinen speziellen Namen für sie, doch existiert das Phänomen sehr wohl auch hierzulande (ich sage nur: Skilehrer).

In Griechenland ging es schnell und fröhlich zur Sache

Aber um auf die Männer auf Rhodos zurückzukommen: Kamakia, das bedeutet Harpunen, was in diesem Fall freilich nicht das Geringste mit Sportfischen zu tun hatte, denn diese Typen waren nicht hinter Meeresbewohnern her, sondern hinter jungen Mädchen. Genauer gesagt: Touristinnen.

Aus heutiger Sicht keine große Sache. Was bedeutet schon ein kleiner Urlaubsflirt? Die älteren Herren von Rhodos aber finden, sie haben die Welt verändert. „Wir Kamakia waren es, die die Gesellschaft befreiten“, so sagt es beispielsweise Takis, ein sympathischer Mann im besten Alter, der damals als DJ arbeitete.

Traumhaft schön: die Ladiko-Bucht auf der Insel Rhodos Quelle: Getty Images/Andrei Troitskiy

Anzeige

Es sei doch so gewesen: Während man sich im Norden in WGs müde diskutierte und ein finnischer oder deutscher junger Mann erst mal zehn Bier brauchte, um ein Mädchen anzuquatschen, ging es unter griechischer Sonne schnell und fröhlich zur Sache. „Jedes Mädchen aus dem Norden hatte doch einen Lover in Spanien oder Griechenland!“ Und auf diesem angenehmen Wege wurde schließlich die ganze Gesellschaft befreit.

Zuvor herrschten in der Inselprovinz in den späten Sechzigern (und bis in die Neunzigerjahre) recht strenge Sitten. Anders als in griechischen Großstädten besaßen junge Griechinnen kaum Freiheiten. Die jungen Männer aber durften ungerechterweise zumeist tun und lassen, was sie wollten – doch ohne Mädchen war das langweilig. Drum blieben sie unter sich und konnten von Frauen lediglich träumen.

Auf Rhodos landeten die ersten Urlauberinnen

Der Wandel begann Ende der Sechzigerjahre. Die waren in Griechenland wegen der Militärdiktatur grundsätzlich alles andere als fröhlich. Doch dann passierte auf Rhodos Folgendes: Diktator Papadopoulos ließ einen vergleichsweise großen Flughafen errichten – eigentlich aus strategischen Gründen, um im Fall des Falles mit Kampfflugzeugen in die nahe Türkei starten zu können, zu der (mal wieder) ein angespanntes Verhältnis herrschte.

Anzeige

Statt Kampffliegern landeten aber sehr bald Urlaubsbomber, vollgepackt mit Gästen aus England, Deutschland, Skandinavien. Es war der Beginn des griechischen Massentourismus.

Auf Rhodos scheint an rund 360 Tagen im Jahr die Sonne. Die Meerestemperatur sinkt selbst im Winter kaum unter achtzehn Grad. Insbesondere die Skandinavierinnen tauten angesichts dieser Verhältnisse regelrecht auf, zumal die ganze Insel voller Verehrer war – die jungen Griechen konnten ihr Glück kaum fassen angesichts der Tatsache, dass die Mädchen allein anreisten.

Touristin in Lindos: Alleinreisende Urlauberinnen aus dem Norden sind heute nichts Ungewöhnliches mehr Quelle: Getty Images/Colin Paterson

Oder nicht ganz allein – meistens hatten sie ihre Freundinnen dabei. Doch sie reisten ohne Eltern oder anderes Aufsichtspersonal, und so kam es, wie es kommen musste: Die jungen Griechen und die jungen Touristinnen badeten, feierten, tanzen und liebten sich – gern auch bei Sternenlicht am Strand (zu sich nach Hause, wo die meist blutjungen Galane noch wohnten, konnten sie wegen der strengen Sitten keine Mädchen mitbringen).

Bald folgten Flughäfen auf weiteren griechischen Inseln. Die Fähren brachten ebenfalls immer mehr Touristen, die Urlauberzahlen stiegen von Jahr zu Jahr, und das Zeitalter des Tourismus verbreitete ein ganz neues griechisches Lebensgefühl, zusammengesetzt aus folgenden Komponenten: Ouzo, Sirtaki, antike Säulen, Sonne und Meer, bunte Strandkleider, blaue Ketten mit dem Auge des Meeres und über allem eine Prise Oregano.

Die Beatles wollten eine Insel kaufen

Eine Sache habe ich noch vergessen: die griechischen Sandalen aus hellbraunem Leder. Es gibt sie seit der Antike, schon damals in mannigfaltigen Ausführungen, aber immer wiedererkennbar. Mit ihnen schlendern Ausländer (und natürlich auch Inländer) über die Inseln, sie sind allerorten zu kaufen.

Und nicht nur dort, sondern auch in Athen, an den Touri-Ständen am Monastiraki – wo ein Händler namens Melissinos berühmt ist für seine Maßsandalen, die er seinerzeit sogar den Beatles Paul und John anpasste, bevor sie sich zu ihrem ganz persönlichen Inselabenteuer aufmachten. Sie wollten sich eine Insel kaufen – die Pilzkopfinsel. Die Sache war John Lennons Idee, der sich wünschte, gemeinsam mit der Band auf einer Insel in Ruhe zu leben.

John Lennon (l.) 1969 in Athen: Der Musiker träumte von einer eigenen Insel in Griechenland Quelle: Getty Images/Keystone Features

Offenbar besichtigten die Beatles mehrere Objekte. Eines davon war ein Eiland, das in Berichten jener Zeit als Insel Leslo bezeichnet wurde. Doch welche Insel dahintersteckt, lässt sich nicht mehr sagen.

Anzeige

Es gab allerdings noch eine weitere Favoritin: Agia Triada, eine kleine Privatinsel, auf der auch Winston Churchill schon mal Urlaub gemacht hatte. Zum Kauf kam es dann aber doch nicht – angeblich, weil die Besitzer von Agia Triada ihr Inselchen plötzlich nicht mehr veräußern wollten (vielleicht wollten sie auch nur den Preis hochtreiben).

Heute, rund fünfzig Jahre später, wird sie im Internet gerade mal wieder zum Kauf angeboten, für 48.000 Euro – angesichts ihrer Geschichte ein echtes Schnäppchen!

Auch wenn das Insel(s)hopping nicht klappte, vom Griechenlandurlaub kehrten John, Paul, George und Ringo 1967 tiefenentspannt zurück, und John hatte sogar ein Souvenir dabei: Auf Schwarz-Weiß-Bildern sieht man ihn mit einer griechischen Hirtentasche aus Schafswolle am Arm, bedruckt mit großen griechischen Mäander-Ornamenten.

Leonard Cohen verschlug es nach Hydra

Ein paar Jahre vor den Beatles hatte sich ein junger Kanadier nach Griechenland aufgemacht, er wollte aber nicht gleich eine ganze Insel erstehen, sondern kaufte für läppische 1500 Dollar ein Häuschen auf der bezaubernden Insel Hydra, auf der er dann seiner Muse, der Norwegerin Marianne, begegnete. Das war natürlich Leonard Cohen, und auch von ihm und Marianne gibt es schöne Schwarz-Weiß-Fotos, wie sie lachend mit Freunden beim Essen sitzen.

Dass es Cohen nach Hydra verschlug, kam so: Er hatte einen Gedichtband verkauft (damals war Cohen noch kein professioneller Musiker, sondern Dichter) und zudem eine kleine Erbschaft gemacht.

Die Idee, sich in Griechenland niederzulassen, soll ihm gekommen sein, als er auf der Bank beim Abheben seines Geldes einen Angestellten traf, der ihm von seinem Griechenlandurlaub vorschwärmte. Cohens Häuschen auf Hydra ist übrigens bis heute im Besitz seiner Familie und wird zum Beispiel von seinem Sohn Adam genutzt, den man hier an Sommerabenden am Hafen flanieren sehen kann.

Lesen Sie auch Poros Diese Insel in Griechenland ist noch ein Geheimtipp

Cohen, die Hippies, die Beatles, die jungen Aufreißer von Rhodos, die freizügigen Touristinnen aus dem Norden und viele mehr kreierten das ganz besondere griechische Urlaubsfeeling, das seither ständig weitergeformt wird – zum Beispiel durch den Film „Mamma Mia!“, diesem herrlich bunten Griechenland-Spektakel. Zusammengemixt ergibt all dies eine Art neuzeitlichen Greek Chic – nicht wirklich authentisch, aber spaßig.

Sirtaki ist kein traditioneller Tanz

Gut erklärbar ist dieses Phänomen am Beispiel von Sirtaki, dem vermeintlich traditionellen griechischen Tanz. Tatsächlich wurde der Sirtaki für die Verfilmung des Buches „Alexis Sorbas“ erfunden – die Musik, die da so leicht und eingängig klimpert, schrieb niemand Geringeres als Mikis Theodorakis, der als Komponist alles andere als ein Leichtgewicht ist. Aber dennoch: Um ein traditionelles Musikstück oder einen traditionellen Tanz handelt es sich bei Sirtaki nicht!

Anzeige

Die Grundlage des Sirtaki sind bestimmte griechische Tänze, die Sirtos genannt werden und die dem Sirtaki nicht unähnlich sind – davon ist der Film-Sirtaki inspiriert. Mittlerweile wird er als „Klassiker“ in Touristenlokalen auf den Inseln getanzt. Von Touristen für Touristen.

Der bei Griechen wohl beliebteste Tanz in Griechenland, den auch so gut wie jeder Grieche beherrscht, ist aber eigentlich der Kalamatianos, ein ländlicher Volkstanz.

Sowieso spielt man auf den Inseln eine ganz andere Musik, als die meisten Urlauber glauben. Sie heißt Nisiotika (was übersetzt sogar Inselmusik bedeutet). Die Instrumente dazu sind Geige und Lyra, ein typisches griechisches Saiteninstrument.

Nisiotika werden bei Taufen oder Inselfeiern von den Einheimischen gespielt und getanzt, auch Jüngere sind begeistert dabei und lernen derzeit wieder verstärkt Geige und Lyra. Einer der beliebtesten Tänze ist der Ikariotikos, der von der Insel Ikaria stammt.

Nisiotika gibt es aber in Touristenlokalen selten zu hören, denn sie sind ein bisschen gewöhnungsbedürftig und klingen etwas schrill. Was man Touristen stattdessen vorspielt, sind Laïka Tragoudia, die mit Bouzoukia (ebenfalls griechische Streichinstrumente) intoniert werden. Diese Lieder aber haben ihren Ursprung nicht auf den Inseln, sondern stammen aus dem städtischen Umfeld.

Augen schützen vor dem bösen Blick

Jetzt wissen Sie also Bescheid über die „wahre“ Musik der griechischen Inseln. Dann kann ich nun auch die Sache mit den blauen Mati aufdecken, den Anhängern, die seit den Sechzigerjahren in den Souvenirshops hängen: Sie sind gar keine rein griechischen Glücksbringer! Es gibt sie nämlich auch gegenüber an den türkischen Küsten und in den arabischen Ländern. Da heißen sie allerdings nicht Mati-, sondern Nazar-Amulette.

Anzeige

Aber wer hat’s erfunden? Die Griechen waren’s. Diesmal wirklich. Entwickelt haben sie sich bereits in der griechischen Antike. Damals schon wurden Augensymbole zum Abwehrzauber des bösen Blicks verwendet.

Die Sache mit dem bösen Blick beruht auf einer Theorie Plutarchs, der glaubte, dass Personen, die ihr Leben lang voller Neid auf andere blickten, schließlich die Konstitution ihres Körpers so weit schädigen, dass schädliche Ausdünstungen aus ihren Augen austreten (nun ja). Davor jedenfalls sollten die symbolisierten Augen schützen.

Vor dem Massentourismus sahen die Mati-Amulette aber noch anders aus, und man trug sie eher im Verborgenen: Neugeborenen und kleinen Kindern heftete man eine Sicherheitsnadel mit einem winzigen gold- oder silbergefassten Mati ans Unterhemdchen, oft hing noch ein ganz kleines besticktes Kissen daran, darin eingenäht ein garantiert echter Splitter vom Kreuz Christi (millionenfach hergestellt in einer griechischen Devotionalienfabrik). Das war noch in der Zeit, als alte Frauen einen anspuckten, um böse Blicke abzuwehren (ehrlich gesagt, tun das manche auch heute noch, nur nicht mehr ganz so viele).

Die Nackten vom Strand hatten kein Geld für Hotels

Doch soviel die Alten auch spucken mochten, das neue Zeitalter ließ sich nicht vertreiben: Nach Cohen und den Beatles und den Kamakia kamen in den Siebzigern die Nackten. Bärtig und langhaarig lagen sie am Strand, manche campierten den ganzen Sommer dort.

Als Kind bekam ich mit, dass einige Griechen sich darüber aufregten. Die allermeisten schmunzelten allerdings nur. Außerdem: Auch wenn die Nackten vom Strand kein Geld für Hotels hatten – in die Tavernen und Lebensmittelgeschäfte zog es sie doch, und das förderte den Umsatz.

Lesen Sie auch Tourismus „Entweder Corona oder Hunger“ – Griechenlands Kampf gegen die Krise

Kamakia jedenfalls gibt es heute (fast) keine mehr. In Wahrheit haben sie die sexuelle Revolution natürlich nicht erfunden, sondern sie lediglich ausgiebig genossen. Ehrlich gesagt haben die Kamakia von Rhodos sich nicht mal selbst erfunden, denn Kamakia gab es in Griechenland schon länger.

Vielleicht schon in der Antike. Ganz sicher aber in der Jugend meiner Mutter, und auch in meiner Jugend, und nicht nur auf den Inseln, sondern überall. Auf der Straße, in jedem Café, im Bus, am Strand: Überall wurde man angebaggert und genervt. Heute würde man wahrscheinlich Stalking dazu sagen…

Doch die alten Herren von den Inseln würden das anders sehen und schwärmen von ihren Eroberungen und von dem Spaß, den sie hatten. Ein Fakt, der für die Kamakia von Rhodos spricht: Kaum einer blieb lange Aufreißer. Mit 23 oder 24 hatten die meisten auf das ständige Rumbaggern keine Lust mehr und gaben es auf, oder sie hatten sich verliebt und wollten heiraten.

Die Frauen aber, mit denen sie vor den Altar traten, waren die lebenslustigen Touristinnen aus dem Norden, weshalb es auch nirgends so viele Mischehen gibt wie auf Rhodos. Viele dieser Paare sind nach wie vor zusammen. Und wenn sie nicht gestorben sind, dann lieben sie sich vielleicht sogar immer noch!

Der Text ist ein leicht gekürztes Kapitel aus der gerade erschienenen „Gebrauchsanweisung für die griechischen Inseln“ von Stella Bettermann, Piper Verlag, 221 Seiten, 15 Euro.",Stella Bettermann,1595991448,"Europa,Rhodos",welt
Warum so viele Ärztinnen jetzt Bikini-Fotos posten,"Eine amerikanische Studie hat untersucht, ob sich junge Chirurginnen und Chirurgen im Internet „unprofessionell“ verhalten. Die Methode? Umstritten. Das Resultat? Eine Flut an Bildern von Ärzten in Badesachen.

An dieser Stelle finden Sie Inhalte aus Instagram Um mit Inhalten von Instagram und anderen sozialen Netzwerken zu interagieren oder diese darzustellen, brauchen wir Ihre Zustimmung. Soziale Netzwerke aktivieren

Wie viele junge Chirurginnen und Chirurgen posten wohl „unprofessionelle“ Bilder von sich oder ihrem Privatleben im Internet? Weil sie diese Frage so interessant fanden, haben sieben Wissenschaftler (eine Frau und sechs Männer) dazu eine Studie aufgelegt, der Titel: „Prevalence of unprofessional social media content among young vascular surgeons“ – zu Deutsch: „Prävalenz unprofessioneller Social-Media-Inhalte unter jungen Gefäßchirurgen“.

Anzeige

Bereits Dezember 2019 wurde diese Studie der amerikanischen Gesellschaft für Gefäßchirurgie online veröffentlicht, doch jetzt sollten die Ergebnisse in der August-Ausgabe des „Journal of Vascular Surgery“ erscheinen – wenn nicht eine Flut an Bikini-Bildern von Ärztinnen unter dem Hashtag #medbikini dazwischen gekommen wäre.

An dieser Stelle finden Sie Inhalte aus Twitter Um mit Inhalten aus Twitter und anderen sozialen Netzwerken zu interagieren oder diese darzustellen, brauchen wir Ihre Zustimmung. Soziale Netzwerke aktivieren

Aber von vorn. Für die Studie haben drei Mitarbeiter versucht, möglichst viele der 480 dem Institut bekannten Chirurginnen und Chirurgen auf Social Media zu finden – 235 Profile konnten sie ausfindig machen und untersuchten diese auf „potenziell unprofessionelles Verhalten“. Gesichtet wurden Profile auf den Plattformen Facebook, Instagram und Twitter.

Politische Themen und provokante Fotos

Anzeige

Dabei wurde „eindeutig unprofessionelles“ und „potenziell unprofessionelles“ Verhalten unterschieden. Als „eindeutig unprofessionell“ galt der Besitz und das Zeigen von Drogen und Drogenutensilien, das Posten gemeiner Kommentare über die Arbeit oder über Patienten und Patientinnen.

Als „eventuell unprofessionell“ kategorisierte man: Mit alkoholischen Getränken zu posieren, unangebrachte Kleidung auf Fotos, kontroverse politische oder religiöse Kommentare und auch, kontroverse gesellschaftliche Themen anzusprechen. Kontrovers seien zum Beispiel die Themen Waffenbesitz oder Abtreibung. All das wurde von drei Mitarbeitern und zwei Prüfern analysiert und kategorisiert.

Es stellt sich die Frage, was genau eine „unprofessionelle Garderobe“ - auch im Privatleben - ausmacht. Auch das hatten die Autoren festgelegt: „Bilder in Unterwäsche, provokative Halloween-Kostüme, aufreizendes Posieren in Bikinis und Badesachen.“ Die Autoren kamen nach ihrer Analyse zu dem Ergebnis, Frauen würden sich öfter „unprofessionell“ auf Social Media verhalten.

An dieser Stelle finden Sie Inhalte aus Twitter Um mit Inhalten aus Twitter und anderen sozialen Netzwerken zu interagieren oder diese darzustellen, brauchen wir Ihre Zustimmung. Soziale Netzwerke aktivieren

Anzeige

Diese Einschätzung nahmen viele Ärztinnen und Ärzte, sowie Krankenpflegerinnen und -pfleger zum Anlass, Fotos von sich in Bikini und Badesachen zu posten. Sie kritisierten damit die implizite Voreingenommenheit der Autoren, die Methodik und die fehlende Diversität der Verfasser.

So auch die Schönheitschirurgin Lara Devgan, die die Studie in auf Instagram als „einseitig“ kritisiert und zu bedenken gibt, dass nur Fotos von Frauen in Bikinis als unprofessionell eingeschätzt wurden – nicht die von Männern in Badehosen. In ihren Instagram-Storys sagt Devgan: „Diese Doppelmoral und der Sexismus in der Medizin sind leider an der Tagesordnung.“

An dieser Stelle finden Sie Inhalte aus Instagram Um mit Inhalten von Instagram und anderen sozialen Netzwerken zu interagieren oder diese darzustellen, brauchen wir Ihre Zustimmung. Soziale Netzwerke aktivieren

Davon berichten auch Medizinerinnen in Deutschland. Der Deutsche Ärztinnenbund (DÄB) forderte etwa erst im März eine größere Objektivität bei der Beurteilung von Wissenschaftlerinnen - der Kontext war ein anderer, es ging darum, das Forscherinnen ihre Arbeiten in Fachmagazinen oft zu bescheiden ankündigen würden, aber auch hier wies die DÄB-Präsidentin Christiane Groß auf „gesellschaftlich bedingte Rollenklischees“ hin, die „unsere Wahrnehmung zum Nachteil von Frauen immer noch verzerren können“.

Anzeige

Eine 25 Jahre alte Medizinstudentin (ihr Name ist der Redaktion bekannt), die an der Berliner Charité arbeitet, erzählt: „Ich war in einer OP mit dem Chefchirurgen, bei der ich assistierte, und er hat mich gefragt, was ich später machen will. Als ich gesagt habe, dass ich mich auf Kardiologie spezialisieren wolle, meinte er, dass das für eine Frau auch besser geeignet sei als Chirurgie. Das sei nichts für Frauen, da sie zu emotional seien und dem nicht standhalten würden.“

Lesen Sie auch Unbewusste Vorurteile „Ich habe als Dolmetscherin gearbeitet und wurde für die Putzfrau gehalten“

Zwei Autoren der Social-Media-Studie, Jeffrey Siracuse and Thomas Cheng, haben sich inzwischen auf Twitter entschuldigt, danach ihren Account gelöscht. Sie hätten nur darauf hinweisen wollen, wie schnell auch Patienten entdecken könnten, was man postet. Die Ergebnisse hätten niemanden verurteilen sollen.

Auch die Redakteure vom „Journal of Vascular Surgery“ haben eine Erklärung veröffentlicht: Im Prozess der Überprüfung hätten sie darin „versagt“, die „Fehler im Design der Studie zu identifizeren“.

Viele Mediziner, aber auch die Leiter der Gesellschaft für Gefäßchirurgie hätten sich mit Feedback zu Methodik und Voreingenommenheit der Annahmen gemeldet, die Konsequenz sei es, die fehlerhafte Studie so nicht zu veröffentlichen. Sie wurde inzwischen auch offiziell zurückgezogen.",Beatrice Achterberg,1595990864,"Gesellschaft,Unprofessionell?",welt
„Was ist denn nur falsch an mir?“,,Christian Thiel,1595989252,"ICONIST,Frustrierter Single",welt
139 Minuten am Tag – Kinder spielen deutlich länger auf Handys und Tablets,"In den vergangenen Monaten waren vieler Eltern mangels Alternativen großzügiger, was die Mediennutzung ihrer Kinder angeht. Doch beschäftigen sich Kinder und Jugendliche stundenlang mit dem Smartphone, leidet die Entwicklung.

So beeinträchtigt zu viel Smartphone-Nutzung Kinder

Anzeige

Kinder und Jugendliche haben während des Corona-Lockdowns einer Studie zufolge 75 Prozent mehr Zeit mit digitalen Spielen verbracht. Zu diesem Ergebnis kommt eine Untersuchung zur Mediennutzung der Krankenkasse DAK-Gesundheit zusammen mit Forschern des Deutschen Zentrums für Suchtfragen des Kindes- und Jugendalters am Universitätsklinikum Hamburg-Eppendorf (UKE).

Demnach stieg bei Kindern und Jugendlichen im Alter zwischen zehn und 17 Jahren, die mindestens einmal pro Woche spielen, die Nutzungsdauer von digitalen Spielen auf Tablets, Smartphones, Spielkonsolen oder am PC deutlich an: Während im September vergangenen Jahres die durchschnittliche Spieldauer werktags noch bei 79 Minuten lag, kletterte sie im April – also rund vier Wochen nach Beginn des Corona-Lockdowns – auf 139 Minuten.

Lesen Sie auch Schulleiter über Regelbetrieb „Am Ende ist der Schüler der Gelackmeierte“

„Unsere Studie zeigt, dass wir dringend ein verlässliches und umfassendes Frühwarnsystem gegen Mediensucht brauchen“, sagte DAK-Vorstandschef Andreas Storm. Es dürfe nicht länger Zufall sein, Betroffene zu erkennen und ihnen Hilfsangebote zu machen. Neben Kindern wurden in der repräsentativen Untersuchung auch Erziehungsberechtigte in den rund 1200 Familien befragt.

Anzeige

Die Drogenbeauftragte der Bundesregierung, Daniela Ludwig (CSU), sprach angesichts der Zahlen von einem „heftigen Anstieg“, der so nicht weitergehen dürfe. „Was wir brauchen, ist eine bessere Medienkompetenz, gerade bei Kindern und jungen Erwachsenen überall in Deutschland.“ Sie müssten wissen, wie viel noch „OK“ sei und ab wann es „zu viel“ werde, sagte Ludwig den Zeitungen der Funke-Mediengruppe.","'Luisa Hofmeier', 'Claudia Becker', 'Céline Lauer'",1595989136,"Panorama,Mediennutzung",welt
Russland hilft Amerika im Kampf gegen Corona – behaupten Moskaus Trolle,,"'Stefan Beutelsbacher', 'Daniel Wetzel', 'Gerhard Hegmann', 'Eduard Steiner'",1595986781,"Ausland,Fake News",welt
Tage statt Monate – Kinofilme kommen deutlich schneller in den Online-Verleih,"Anzeige

Die weltgrößte Kinokette AMC und das Filmstudio Universal haben ihren erbitterten Streit mit einem Deal beigelegt, der die gesamte Branche verändern könnte. Sie einigten sich darauf, dass Universal in den USA seine Filme bereits 17 Tage nach dem Kinostart in den Online-Verleih bringen kann. Dabei geht es um sogenannte Premium-Angebote, bei denen Filme für 15 bis 20 Euro ausgeliehen werden können – also zum Preis eines Kinobesuchs. Über die Konditionen für Europa soll in den kommenden Wochen verhandelt werden, wie AMC und Universal mitteilten.

Traditionell werden neue Filme zuerst im Kino gezeigt und stehen erst einige Monate später zum Kauf, zur Ausleihe sowie zum Streaming zur Verfügung. Dieses Zeitfenster ist in den vergangenen Jahren bereits kürzer geworden. Doch die Corona-Krise beschleunigte den Wandel des Geschäfts noch einmal drastisch.

Lesen Sie auch Kulturkonsum Die Sofa-Ära hat begonnen

Während Kinos geschlossen blieben, brachte Universal seinen Animationsfilm „Trolls World Tour“ im Frühjahr stattdessen in den Online-Verleih. Das zahlte sich aus: In drei Wochen spielte der Film allein am US-Markt knapp 100 Millionen Dollar ein. Der Chef von NBCUniversal, Jeff Shell, machte daraufhin eine weitreichende Ankündigung: „Wir gehen davon aus, dass wir Filme in beiden Formaten veröffentlichen werden, wenn die Filmtheater wieder öffnen.“ Der Filmtheater-Betreiber AMC, zu dem in Deutschland die UCI-Kinos gehören, kündigte daraufhin an, gar keine Streifen des Studios mehr zu zeigen.

Anzeige

Kinos standen angesichts des Streaming-Booms bereits vor der Corona-Krise unter Druck und hielten sich mit Blockbustern wie den „Marvel“-Comic-Verfilmungen über Wasser. Universal hat potenzielle Kinohits wie die nächsten Filme der Reihen „Jurassic World“, „Fast & Furious“ und „Minions“ in der Pipeline.","'Henryk M. Broder', 'Birgit Herden', 'Tobias Kaiser', 'Hanns-Georg Rodek'",1595977702,"Wirtschaft,USA",welt
Das steckt hinter dem größten geplanten europäischen Rüstungsprojekt,,,1595968344,"Wirtschaft,Future Combat Air System",welt
