title,text,author,published,tags,source
Amazons Echo schaut dem Nutzer hinterher,"Anzeige

Amazons digitaler Sprachassistent Alexa war in der Vergangenheit etwas starrsinnig. Oder zumindest bewegungslos. Mit seinem neuen Echo Show 10 soll sich das künftig ändern. Das smarte Display des Technologiekonzerns wendet sich immer dem Nutzer zu – auch wenn dieser durch das Zimmer läuft. Das Gerät lokalisiert den Nutzer über den Ton und die eingebaute Kamera.

Der Echo Show 10 ist eines der zahlreichen Geräte, die Amazon am Donnerstag präsentiert hat und mit denen das Unternehmen in den Jahresendspurt geht. Dabei bekommen die meistverkauften Echo-Lautsprecher mit dem eingebauten digitalen Sprachassistenten Alexa ein komplett neues Design. Sahen sie bisher je nach Modell aus wie ein Zylinder oder ein Eishockey-Puck, haben sie künftig eine sphärische Form, wie eine Kugel.

Der Echo von Amazon sieht nicht mehr wie ein Zylinder aus Quelle: Amazon

Nach Angaben von Amazon wurden die Lautsprecher im neuen Echo, Echo Dot und Echo Show 10 verbessert. Im Echo Show 10 dreht sich nicht nur das Zehn-Zoll-Display. Auch die beiden frontseitigen Hochtonlautsprecher und der Woofer richten sich mit aus, sodass sie immer in Richtung Nutzer abstrahlen.

Anzeige Echo Show 10 von Amazon

Lesen Sie auch Automaten Ausgerechnet die Amazon-Idee bringt den Tante-Emma-Laden zurück

Anzeige

Wie auch beim Echo passt sich der Ton automatisch den jeweiligen Verhältnissen im Raum an. Diese Selbstkonfiguration – jeder Raum hat individuelle Reflektionsflächen – gab es bisher schon beim Echo Studio, einem Lautsprecher mit besserer Tonqualität.

Künftig auch Netflix auf dem Echo Show

Ein sich drehendes Display ist vor allem bei einem Videotelefonat sinnvoll, damit der Gesprächspartner nicht aus dem Blickfeld läuft. Der Echo Show 10 hat dafür eine 13-Megapixel-Weitwinkelkamera. Nutzer können auf dem Gerät aber auch Filme von Prime Video – und in Zukunft auch Netflix – schauen.

Alle neuen Echo-Geräte haben einen AZ1 Neural Edge Prozessor, den Amazon in Zusammenarbeit mit MediaTek entworfen hat. Er soll unter anderem die Spracherkennung beschleunigen. Der Echo Show 10 soll knapp 245 Euro kosten, der Echo knapp 100 Euro, der kleinere Echo Dot knapp 60 Euro und der Echo Dot mit eingebauter Uhr knapp 70 Euro.

Anzeige Amazon Echo jetzt vorbestellen

Anzeige Amazon Echo Dot jetzt vorbestellen

Anzeige Echo Dot mit Uhr jetzt vorbestellen

Anzeige

In Deutschland wird es auch neue Fire TV Sticks geben, die angeschlossen über eine HDMI-Schnittstelle dem Fernseher eine smarte Oberfläche geben. Amazon ist mit diesen Geräten in der Vergangenheit sehr erfolgreich gewesen und hat nach eigenen Angaben mehr als 100 Millionen dieser Medien-Streamer verkauft. Mit ihnen können Nutzer nicht nur auf die hauseigenen Dienste wie Prime Video zugreifen. Auch Anwendungen wie Netflix, Mediatheken und TV-Sender stehen zur Verfügung.

Anzeige Fire TV Stick jetzt online kaufen

Lesen Sie auch Sprachassistenten So viele Deutsche vertrauen schon Alexa, Siri und Co.

Die Nutzeroberfläche auf den Fire TV Sticks hat neue Funktionen bekommen und auch Alexa ist stärker integriert worden. Aufgerufen wird Alexa mit einem Knopf auf der mitgelieferten Fernbedienung, die auch ein Mikrofon eingebaut hat. Wegen eines stärkeren Prozessors sollen die Geräte nun 50 Prozent leistungsfähiger sein.

Der Fire TV Stick von Amazon bekommt eine neue Nutzeroberfläche Quelle: Amazon

Für knapp 40 Euro bietet Amazon seinen Fire TV Stick mit HDR und Dolby-Amos-Unterstützung an. Eine Lite-Version mit gibt es für knapp 30 Euro, dann aber mit etwas verminderter Bild- und Ton-Qualität, also ohne HDR und Dolby Atmos.

Anzeige

Während der Konzern noch kabellose Sicherheitskameras für drinnen und draußen nach Deutschland bringt, müssen Nutzer hierzulande auf andere Geräte vorerst verzichten, die im kommenden Jahr in den USA eingeführt werden sollen. Darunter eine Art Dashcam und eine Alarmanlage für das Auto.

Kamera fliegt die Wohnung ab

Noch ungewöhnlicher ist die Ring Always Home Camera, eine autonom fliegende Mini-Drohne als Sicherheitskamera, die einen vorher festgelegten Weg durch die Wohnung abfliegt und ein Live-Video übertragen kann. Diese Kamera beginnt ihren Flug, wenn die Ring-Türklingel unerwartete Erschütterungen an der Wohnungstür wahrnimmt. Neu ist auch ein Briefkasten-Sensor, der eine Benachrichtigung schickt, wenn der Postbote etwas in den Briefkasten legt.

Vorerst nur für die USA hat Amazon auch einen Gaming-Dienst über die Cloud mit der Bezeichnung Luna und einen dazugehörigen Controller präsentiert. Nutzer können die über die Cloud gestreamten Titel mit dem Controller auf einen PC, Mac, Fire TV, iPhone und iPad spielen. Android-Geräte sollen später hinzukommen. Dieser Streaming-Dienst ist zum Start nur auf Einladung verfügbar und soll monatlich sechs Dollar kosten. Ähnliche Dienste gibt es bereits bei Microsoft und Google.

Die Ring Always Home Camera startet, wenn es an der Haustür unerwartete Erschütterungen gibt Quelle: Ring

Bei seinem Sprachassistenten Alexa will Amazon künftig den Datenschutz verbessert und ein automatisches und sofortiges Löschen von Sprachaufzeichnungen ermöglichen. In der Vergangenheit hat es von Datenschützern hier Kritik gegeben.

So werden Sprachaufzeichnungen von Nutzern im Nachgang von Amazon-Mitarbeitern analysiert, um die Erkennung zu verbessern. Zwar konnten Nutzer diese Aufzeichnungen wieder löschen. Das mussten sie aber später über die Alexa-App anstoßen. Nun kann es voreingestellt werden.

Konkurrenten haben es schwer

Konkurrenten fürchten Amazon vor allem wegen seiner Strategie, seine Geräte zu einem Preis anzubieten, der keinen Gewinn allein durch den Verkauf erlaubt. Manager des Konzerns machen daraus auch kein Geheimnis. Ziel ist es, Nutzer an sich zu binden, indem sie Prime-Kunden werden.

In den monatlichen Prime-Gebühren sind dann verschiedene Dienste bereits enthalten, darunter beispielsweise Video- und Musikstreaming. Doch vor allem kaufen Prime-Kunden auf der Amazon-Plattform häufiger ein als Nicht-Prime-Kunden. Für Amazon sind seine Geräte also vor allem ein Mittel zum Zweck. Nicht zuletzt deswegen haben Konkurrenten Schwierigkeiten, mit diesen Angeboten zu konkurrieren.

Lesen Sie auch Videostreaming So klimaschädlich ist ein Netflix-Film

Anzeige

Amazon hat über die Jahre mit immer mehr Echo-Geräten die Reichweite seines digitalen Assistenten Alexa erhöht. Inzwischen hat der Konzern neben Lautsprechern, Smart Displays auch Ohrhörer, Küchengeräte und einen Alexa-Adapter für das Auto im Angebot.

Im August hat Amazon seinen Gesundheitstracker Halo angekündigt, der nicht nur die Bewegungsdaten und den Schlaf seines Besitzers beobachtet, sondern auch die Stimme seines Trägers analysiert und daraus die Emotionen erkennt. Ein Ganzkörper-Selfie über eine entsprechende Smartphone-App soll sogar eine Körperfettanalyse des Nutzers ermöglichen. Angaben dazu, ob und wann dieses Gerät nach Deutschland kommt, hat Amazon bisher noch nicht gemacht.",Thomas Heuzeroth,1600986927,"Wirtschaft,Neue Alexa-Gadgets",welt
AfD-Mann führt Geraer Stadtrat - Wahl stößt auf scharfe Kritik,"Anzeige

Der Geraer Stadtrat hat sich einen AfD-Politiker zum Vorsitzenden gewählt und damit eine heftige Kontroverse ausgelöst. „Für die Menschen in Gera und für Geras Wirkung nach außen ist dies ein verheerendes Signal“, sagte der Vizepräsident des Internationalen Auschwitz Komitees, Christoph Heubner, am Freitag. Die Wahl müsse „Überlebenden von Auschwitz wie Hohn in den Ohren klingen“.

Der Vorstandsvorsitzende der Mobilen Beratung gegen Rechts, Sandro Witt, warf den Stadträten vor, „ohne Not“ einen AfD-Mann zum Vorsitzenden ihres Gremiums gewählt zu haben. Sie nähmen damit entweder die Gefährlichkeit der extremen Rechten nicht wahr oder entschieden sich sogar bewusst. „Beides ist fatal.“

Auch Thüringer Spitzenpolitiker kritisierten die Personalie scharf. Vor allem aus den Reihen von Rot-Rot-Grün wurde der CDU vorgeworfen, mit der AfD zusammenzuarbeiten. „Das ist auch einen Tag später nicht zu fassen“, schrieb Umweltministerin Anja Siegesmund (Grüne) auf Twitter. Die Thüringer CDU müsse erklären, wie sie „gemeinsame Sache mit Demokratieverächtern“ machen könne.

Anzeige

Wirtschaftsminister und SPD-Landeschef Wolfgang Tiefensee (SPD) monierte, dass CDU und AfD schon zuvor im Stadtrat zusammengearbeitet hätten. Drei gemeinsam von ihnen unterschriebene Anträge sprächen eine eindeutige Sprache.

AfD-Politiker in geheimer Wahl gewählt

In geheimer Wahl war am Donnerstagabend der AfD-Stadtrat Reinhard Etzrodt zum Vorsitzenden des Kommunalparlaments von Thüringens drittgrößter Stadt gewählt worden. Der Arzt im Ruhestand erhielt 23 von 40 Stimmen; die AfD selbst verfügt nur über zwölf Plätze. AfD-Faktionschef Harald Frank sagte am Freitag, dass es mit den anderen Stadtratsfraktionen im Vorfeld keine Absprachen über das Wahlverhalten gegeben habe.

Lesen Sie auch Rechtsextremes Lager Anonyme Schmähungen von AfD-Politikern – Spur führt zu einem Parteikollegen

Die AfD selbst verfügt nur über zwölf Plätze in dem Kommunalparlament. Neben der Linken (acht Sitze) haben unter anderem die CDU (sechs), die Bürgerschaft Gera (drei), Für Gera (drei), die Grünen (drei) und die SPD (drei) mehr als einen Sitz im Stadtrat.

Anzeige

CDU-Landeschef Christian Hirte hatte Vorwürfe gegen seine Partei noch am Donnerstagabend entschieden zurückgewiesen: „Die CDU hat sich in der Fraktion klar darauf verständigt, den AfD-Kandidaten nicht zu wählen.“ Genauso sei dies auch erfolgt. Das bekräftigte am Tag darauf Generalsekretär Christian Herrgott: „AfD-Kandidaten finden bei der CDU Thüringen keine Unterstützung. So hat es die Geraer CDU und CDU-Fraktion vor der Abstimmung gestern entschieden, klar kommuniziert und sich auch daran gehalten.“

Auf Twitter wurde derweil daran erinnert, dass Anfang März Ministerpräsident Bodo Ramelow (Linke) als Abgeordneter im Landtag dem AfD-Kandidaten für den Posten des Vizepräsidenten, Michael Kaufmann, seine Stimme gegeben hatte. Auf diesen Hinweis reagierte Ramelow mit den Worten: „Ist Ihnen der Unterschied zwischen einem Vizepräsidenten und einem Vorsitzenden wirklich so unklar?“ Im August hatte zudem ein Fall im südthüringischen Hildburghausen für Aufsehen gesorgt, bei dem die SPD-Stadtratsfraktion zusammen mit der dortigen AfD-Fraktion agiert hatte.

Lesen Sie auch Demokratie Das beste Mittel gegen Populismus ist gutes Regieren

Der Wahl zum Stadtratsvorsitz war ein monatelanger Streit über die Rechtmäßigkeit der Geraer Hauptsatzung hierzu vorausgegangen. Der Satzung zufolge hat die stärkste Fraktion das Vorschlagsrecht für dieses Amt. Seit der Kommunalwahl im Mai 2019 ist das die AfD, die damals mit 28,8 Prozent stärkste Kraft wurde. Kurz vor der ersten Sitzung nach der Wahl hatte das Landesverwaltungsamt diesen Passus moniert, sieht nach Worten von Oberbürgermeister Julian Vonarb (parteilos) aktuell aber in dem Paragrafen keine Rechtswidrigkeit mehr. Wegen der rund 15 Monate langen Hängepartie um den Stadtratsvorsitz hatte Vonarb bisher die Sitzungen geleitet.","'Claudia Becker', 'Don Alphonso', 'Claus Christian Malzahn'",1600985058,"Deutschland,Thüringen",welt
Wollten Stasi-Leute mit der Ermordung des Treuhand-Chefs ihre Geschäfte kaschieren?,"Anzeige

Wurde Treuhand-Chef Detlev Karsten Rohwedder 1991 ermordet, um einer sich gerade formierenden Arbeiterbewegung in Ostdeutschland die Durchschlagskraft zu nehmen? Mit dieser abstrusen Verschwörungstheorie konfrontiert die „erste deutsche Netflix-Original-Doku-Serie“, so die Selbstbezeichnung der viermal 40 Minuten langen Produktion, den Zuschauer in der letzten Folge. Das ist bedauerlich, denn „Rohwedder. Einigkeit und Mord und Freiheit“ hätte alles gehabt, um ein wirklich gute Dokumentation zu werden.

Detlev Karsten Rohwedder war Anfang 1991 das Feindbild Nr. 1 bei vielen Ostdeutschen Quelle: Netflix

Die äußeren Umstände des Verbrechens sind bekannt: Am Ostermontag, dem 1. April 1991, wurden aus einem Kleingarten am linken Ufer des Rheins in Düsseldorf um 23.31 Uhr drei Schüsse aus einem Gewehr auf ein Fenster im Obergeschoss des Hauses Kaiser-Friedrich-Ring 71 abgegeben.

Die erste der aus 63 Meter Entfernung abgegebenen Kugeln traf den 58-jährigen Manager und Chef der ostdeutschen Treuhandanstalt tödlich; seine Frau wurde vom zweiten Schuss schwer verletzt, das letzte Geschoss schlug in ein Bücherregal ein. Drei Schüsse, zwei Treffer, und das bei leichtem Nieselregen an diesem Abend: Der Schütze war kein Anfänger.

Anzeige

Drei Minuten nach den Schüssen löste die nordrhein-westfälische Polizei Großalarm aus. Dennoch konnten die Täter entkommen; zurück blieben am Tatort ein Campingstuhl, ein Handtuch mit einem Haar, drei Zigarettenstummel und ein erstes, 13 Zeilen kurzes Bekennerschreiben mit dem RAF-Symbol, der Maschinenpistole im fünfzackigen roten Stern.

Treuhand-Vize Hero Brahms beim Interview für die Netflix-Produktion Quelle: Netflix

Drei Tage später folgte ein ausführliches fünfseitiges Schreiben, in dem es hieß: „Rohwedder saß seit 20 Jahren in Schlüsselpositionen in Politik und Wirtschaft. Als Bonner Wirtschaftsstaatssekretär organisierte er in den 1970er-Jahren die Rahmenbedingungen, die das BRD-Kapital für seine Profite in aller Welt braucht.“ Später sei er als „brutaler Sanierer“ tätig gewesen und solle nun „die Wirtschaft der Ex-DDR genauso wie die sozialen Strukturen dort vom Gesundheitssektor bis zu den Kinderkrippen systematisch zerstören“. Das war natürlich völlig wirr, aber in der Diktion der RAF formuliert und in ihrem Wahn vollkommen stringent.

Aufgeklärt werden konnte der Mordanschlag bis heute nicht: Niemand weiß, wer genau den tödlichen Schuss abgegeben hat. Beste Voraussetzungen also für eine „True-Crime“-Dokumentation: Der Rohwedder-Mord hat gesellschaftliche und politische Brisanz. Zudem gibt es viele bewegte Bilder, interessante Zeitzeugen und Experten. Leider aber ist das Experiment gründlich schiefgegangen.

BKA-Sprecher Willy Fundermann mit einem baugleichen Gewehr wie der Tatwaffe Quelle: Netflix

Anzeige

Der Streamingdienst Netflix hat die Regisseure Jan Peter (erfolgreich etwa mit „14 – Tagebücher des Ersten Weltkrieges“) und Georg Tschurtschenthaler (bekannt für „Lebt wohl, Genossen!“ über den Untergang des Kommunismus) sowie die Drehbuchautoren Christian Beetz und Martin Behnke offensichtlich mit sehr viel Geld ausgestattet. Die schiere Produktionsqualität jedenfalls hebt sich deutlich ab von dem, was Dokumentarfilmer beim deutschen Gebührenfernsehen abliefern dürfen. Die Spielszenen, die Gestaltung der Interviews, das verwendete Archivmaterial – alles auf höchstem Niveau.

Mit dem damaligen Abteilungsleiter Terrorismus beim Bundeskriminalamt Rainer Hofmeyer und Winfried Ridder, seinerzeit RAF-Experte beim Bundesamt für Verfassungsschutz, hat das Team die wichtigsten Experten für Interviews gewinnen können. Der Düsseldorfer Polizeireporter Günther Classen lässt die Umstände direkt nach dem Großalarm lebendig werden.

Günther Classen ist seit Jahrzehnten Polizeireporter beim ""Express"" in Düsseldorf Quelle: Netflix

Es wird deutlich: Beide Bekennerschreiben, das kurze wie das lange, stammten eindeutig von der RAF. Mit der Tatwaffe war bereits fünf Wochen zuvor bei einem anderen RAF-Anschlag über den Rhein hinweg auf die US-Botschaft nahe Bonn geschossen worden. Alles deutete auf die Täterschaft der deutschen Linksterroristen – und nichts in eine andere Richtung.

Anzeige

So weit, so gut. Der Vierteiler hätte nun weiter einen seriösen Weg beschreiten können, also darlegen, wie alle Fahndungsmaßnahmen ins Leere liefen. Wie es dann 2001 durch den technischen Fortschritt beim genetischen Fingerabdruck gelang, das sichergestellte Haar zweifelsfrei dem RAF-Topterroristen Wolfgang Grams zuzuordnen – der also auf jeden Fall zeitnah zum Anschlag am Tatort war. Eine Strafverfolgung war jedoch unmöglich, denn Grams hatte sich bei einem misslungenen Zugriff der GSG-9 auf dem Bahnhof Bad Kleinen 1993 selbst erschossen.

Rainer Hofmeyer, 1991 Chef der Abteilung Terrorismus beim BKA, vor dem ersten kurzen Bekennerschreiben der RAF zum Rohwedder-Mord Quelle: Netflix

Ein Schwenk auf all die Verschwörungstheorien, die über den Rohwedder-Mord in Umlauf gesetzt wurden, hätte das Bild abrunden können. Es wäre ein hervorragendes Stück Fernsehen geworden, aufwendig produziert, mit einer aktuellen, auch international vermarktbaren Ästhetik.

Leider haben Peter und Tschurtschenthaler jedoch diesen Weg nicht gewählt. Im Gegenteil steigen sie ein in das absurde Rennen um die möglichst wildeste Spekulation und präsentieren gleich drei einander ausschließende „alternative“ Versionen zur Realität.

Das erste RAF-Bekennerschreibens zum Rohwedder-Mord an Tatort (Nachstellung) Quelle: Netflix

Nach der ersten davon sei Rohwedder statt von einem RAF-Kommando von frustrierten ostdeutschen Scharfschützen ermordet worden, die ihn für seine Rolle bei der (unvermeidlichen) Abwicklung der maroden DDR-Staatswirtschaft bestrafen wollten. Laut Theorie Nr. 2 habe ihn ein Kommando aus ehemaligen Stasi-Leuten getötet, um die Aufdeckung von verschobenen Millionenguthaben zu verhindern. Die dritte Version: Westliche Experten hätten Rohwedder getötet, um einen Mitleidseffekt in Ostdeutschland auszulösen und auf diese Weise die im Frühjahr 1991 aufkeimende „neue Arbeiter- und Bürgerbewegung“ gegen die Politik der Treuhand auszubremsen.

Alle Varianten sind mit hervorragend gefilmten Spielszenen illustriert; die zur dritten fällt besonders famos aus: Nachdem der Scharfschütze mit Tarndecke und Sturmhaube verschwunden ist, „impft“ ein ganzer Trupp Männer in Spurensicherungsanzügen nächtens den Tatort mit vermeintlichen Spuren. Sie legen das erste Bekennerschreiben und das Handtuch ab, lassen aus einer Plastiktüte vorsichtig die Zigarettenstummel und das Haar herausfallen, das erst zehn Jahre später analysiert werden kann.

Lesen Sie auch Terrorismus So wenig weiß man über die dritte RAF-Generation

Aber in Wirklichkeit war die Düsseldorfer Polizei schon drei Minuten nach den Schüssen vor Ort. Es gab also überhaupt keine Zeit für das Manipulieren von Spuren. Wer hätte zudem Indizien gelegt, von denen seinerzeit noch unklar war, ob sie je würden ausgewertet werden können?

Die Regisseure und Drehbuchautoren lassen zudem ausgesprochen fragwürdige Gewährsleute ebenso zu Wort kommen wie die ausgewiesenen Experten Hofmeyer und Ridder. Zum Beispiel den wegen Doppelmordes verurteilten RAF-Terroristen Lutz Taufer, der auf angebliche Unterschiede zwischen dem Bekennerschreiben zum Rohwedder-Mord und anderen RAF-Botschaften hinweist. Doch legt man alle Botschaften der sogenannten dritten RAF-Generation nebeneinander, sind diese vermeintlichen Differenzen eben nicht zu entdecken: Es ist stets derselbe Duktus, derselbe Größenwahn.

Mit diesem hervorragend gestalteten Plakat wirbt Netflix für die leider misslungene Doku-Serie Quelle: Netflix

Anzeige

Hinzu kommt die längst widerlegte Diffamierung der Treuhand und ihrer Arbeit. Kurz vor dem Abspann der letzten Folge heißt es zum Beispiel, 94 Prozent der Betriebe in der ehemaligen DDR seien an westliche Investoren gegangen, nur sechs Prozent seien „den Menschen in Ostdeutschland“ geblieben. Dass der westdeutsche Steuerzahler hunderte Milliarden Mark in die Wirtschaft der ostdeutschen Bundesländer stecken musste, damit überhaupt irgendetwas erhalten blieb, wird dem Zuschauer vorenthalten.

Dokumentationen sollen Wirklichkeit soweit wie möglich abbilden und idealerweise unklare Zusammenhänge aufklären. Die erste deutsche Netflix-„Original-Doku-Serie“ tut das Gegenteil: Sie bedient alte Verschwörungstheorien und verbreitet neue Spekulationen. Das ist schade. Sehr schade.

Zu sehen bei Netflix, ab 25.9.

Sie finden „Weltgeschichte“ auch auf Facebook. Wir freuen uns über ein Like.",Sven Felix Kellerhoff,1600985009,"Geschichte,Verschwörungstheorien",welt
Bayern holt den Supercup und spielt die perfekte Saison,"Bayern holt auch den vierten Titel der Saison. Die Münchner schlagen in Budapest vor Fans den FC Sevilla und gewinnen den Supercup. Zum Helden wird in der Verlängerung einer, der wahrscheinlich sein letztes Spiel für die Bayern gemacht hat.

Quelle: Pool via REUTERS

Anzeige

Javi Martínez hat dem FC Bayern als Joker beim Comeback vor Publikum mit seinem Kopfballtor in der Verlängerung Titel Nummer vier im Corona-Jahr 2020 beschert. Der Spanier traf kurz nach seiner Einwechslung beim 2:1 gegen Europa-League-Sieger FC Sevilla in der 104. Spielminute. Es könnte ein tolles Abschiedsgeschenk von Martínez gewesen sein. Denn der Routinier steht vor einer Rückkehr zu Athletico Bilbao.

Zweiter Matchwinner bei der umstrittenen Finalpartie um den Uefa-Supercup im Corona-Hotspot Budapest war Torwart Manuel Neuer, der vor dem großen Moment von Martínez mit Reflexen zweimal den K.o. gegen Sevillass Joker Youssef En-Nesyri verhinderte.

In seinem wahrscheinlich letzten Spiel für die Bayern köpft Javi Martinez (l.) die Bayern zum Sieg im Supercup Quelle: AP/Bernadett Szabo

Mit dem erfolgreichen Kraftakt erweiterten Hansi Flicks weiter unaufhaltsame Allesgewinner ihre imposante Trophäensammlung nach Meisterschale, DFB-Pokal und dem Champions-League-Henkelpott um den nächsten Silberpokal. Schon am kommenden Mittwoch winkt im deutschen Supercup gegen Vizemeister Borussia Dortmund in München Titel Nummer fünf.

Anzeige

Auf den Jubel über das Siegtor von Martínez mussten die trotz aller Reisewarnungen nach Ungarn angereisten Bayern-Fans lange warten. Zuvor hatte der als Vorarbeiter schuftende Nationalspieler Leon Goretzka (34.) in der etwa zu einem Viertel gefüllten Puskas-Arena das frühe Elfmetertor von Sevillas Angreifer Lucas Ocampos (13.) ausgeglichen. Die Bayern wankten aber auch danach noch mehrmals.

Lesen Sie auch Hansi Flick über Supercup „Ich glaube, ich wäre nicht gefahren“

In der 87. Minute verhinderte Manuel Neuer im Eins-gegen-Eins gegen den frei vor ihm auftauchenden En-Nesyri erstmals das 1:2. Und Sevillas Joker hatte in der Verlängerung eine weitere Großchance, aber Neuer lenkte den Schuss noch an den Pfosten (92.). Dann kam Martínez und köpfte einen vom bis dahin guten Torwart Bono nach vorne abgewehrten Ball ins Tor. Glückstrahlend ließ er sich Flicks Überraschungs-Joker von den Kollegen feiern.

Sevillas Torwart Bono ist gegen Martinez‘ Kopfball machtlos Quelle: Pool via REUTERS

Als Fußballfan wäre Flick „nicht nach Budapest gefahren“, wie er vor dem Anpfiff im TV-Sender Sky sagte. Aber als Trainer kam er natürlich seinem Job an der Seitenlinie nach. Und er hörte, wie die Münchner Anhänger unter den laut Uefa 15.500 Zuschauern, ihr Team anfeuerten. „Hurra, hurra, die Bayern, die sind da“, skandierten sie. Die Geräuschkulisse sorgte wieder für ein anderes Fußballerlebnis.

Anzeige

Flick veränderte seine 8:0-Siegerelf aus dem Ligastart gegen Schalke nur auf einer Position. Der wieder fitte David Alaba nahm wieder die Position als Abwehrchef ein, erwischte aber einen unglücklichen Start. Nach einem Rempler gegen den vom FC Barcelona nach Sevilla zurückgekehrten Kroaten Ivan Rakitic zeigte Schiedsrichter Anthony Taylor auf den Punkt. Der Argentinier Ocampos überwand Neuer.

Neuer rettet die Bayern

Erst zum zweiten Mal nach der Wiederaufnahme des Spielbetriebs in Corona-Zeiten lagen die Bayern in Rückstand - und stellten sich der Herausforderung.

Thomas Müller wurde zum Initiator des Offensivspiels, gerade auch beim 1:1. Ein technisch anspruchsvoller Chipball mit dem Außenrist erreichte Robert Lewandowski. Der Torjäger legte ab, der in den Strafraum gesprintete Goretzka vollendete mit der Innenseite.

Der nächste Titel - die Bayern gewinnen den Supercup gegen den FC Sevilla Quelle: Pool via REUTERS

Zäh blieb es trotzdem, weil Sevilla sich widersetzte und gefährliche Stürmer wie in Luuk de Jong hatte. Der ehemalige Gladbachr zwang Neuer zur Parade (46.). Dann jubelte Bayern nach einem Gala-Angriff, den Lewandowski nach Doppelpass mit Müller erfolgreich abschloss (55.). Der Videobeweis ergab jedoch - knapp Abseits. Das Spiel spitzte sich zu. Die Kräfte schwanden. Neuer musste zweimal zum Retter werden, ehe Martínez aus dem Triple das Quadruple machte.",,1600983193,"Fußball,Vierter Titel",welt
Wie wirkungsvoll ist EMS-Training wirklich?,,,1600978561,"Videos,Fitness-Trend",welt
