title,text,author,published,tags,source
Warum Armin Laschet künftig auf seinen Enkeltrick verzichten sollte,"Anzeige

Wer Staatsschulden hochtreibt, versündigt sich an den Enkeln. Ja, Verschuldung ist ein Verbrechen an den kommenden Generationen – so predigten CDU und FDP auch in NRW. Bis Corona kam. Und Armin Laschet im März für NRW die größte Kreditaufnahme der Landesgeschichte beschloss: 25 Milliarden Euro plus allerlei Extras. Schlagartig galt so neu wie moralschwer: verschulden statt sparen. Was manch schwarz-gelben Wähler leicht irritierte.

Nun aber versuchte Laschet die Irritation auszuräumen. Da vollzog er die Rolle rückwärts. Vor Wirtschaftsvertretern forderte er, die gewaltigen Schulden müssten zügig zurückgezahlt werden. Das sei eine Frage der Gerechtigkeit gegenüber kommenden Generationen.

Lesen Sie auch Beispiellose Rettungspolitik Der deutsche Staat, das Supersozialamt

Da war sie wieder, die Enkel-Rhetorik. Mit der Laschet offenbar auch für sich im Rennen um Parteivorsitz und Kanzlerkandidatur werben möchte. Und da war es auch wieder, das alte Feindbild: Dass die NRW-SPD zeitgleich vorschlug, die notleidenden Kommunen mit weiteren Milliarden zu entlasten – das war für CDU und FDP plötzlich wieder die Sünde wider die Nachgeborenen.

Anzeige

Doch die Prediger des Schuldenabbaus leiden nun unter einem Glaubwürdigkeitsdefizit. Denn im NRW-Finanzministerium war die Angst vor Neuverschuldung im März doch sehr begrenzt. Dort vertraute man demonstrativ auf zwei Erkenntnisse, die der Düsseldorfer Volkswirt Jens Südekum jüngst im „Freitag“ benannte. Erstens: Solange die Zinsen niedrig bleiben, sind Schulden für den Staat ein gutes Geschäft. Immerhin zahlt er den Geldgebern einen Zins, der meist unter der Inflationsrate liegt. Und wenn die Wirtschaft wieder wächst, relativiert sich die Schuldenlast ohnehin. Zweitens, so Südekum, ist „Staatsverschuldung ein Verteilungsproblem zwischen denen, die die Zinsen zahlen, und denen, die die Staatsschulden besitzen und die Zinsen kassieren“. Meist verfügten „die reichsten zehn Prozent über den Mammutanteil an den Staatsschulden. Gegen diese Ungleichheit gibt es ja Instrumente“. Will heißen: Steuern auf Vermögen, Erbe, Kapitalerträge, Finanztransaktionen oder Digitalunternehmen. Und genau mit diesen Einsichten trösteten sich in der Hochphase der Neuverschuldung auch die Experten im CDU-geführten Finanzministerium von NRW. Südekum berät übrigens das Bundesministerium für Finanzen (SPD) – und das für Wirtschaft (CDU).

Lesen Sie auch Sozialausgaben Deutschland wird zum unbezahlbaren Wohlfahrtsstaat

Natürlich birgt Verschuldung auch Risiken, zum Beispiel können Zinsen wieder steigen oder Inflationsraten chronisch niedrig bleiben. Aber von Laschet und Co. darf man doch erwarten, dass sie ihr Plädoyer für Schuldenabbau künftig ohne Moralinsäure, ohne Katastrophen-Sound und ohne Enkel-Trick vortragen.

Dieser Text ist aus der WELT AM SONNTAG. Wir liefern sie Ihnen gerne regelmäßig nach Hause.",Till-Reimer Stoldt,1598887070,"Nordrhein-Westfalen,Kommentar",welt
Frau verklagt lokalen Brauchtumsverein wegen Diskriminierung,,,1598886386,"Panorama,„Nur für Männer“",welt
Ferrari-Fiasko - Vettels Chef resigniert,"Anzeige

Bei Ferrari wissen sie ziemlich genau, was sie den Tifosi antun. „Wir sind enttäuscht und wütend, genauso wie es zu Recht unsere Fans sind“, sagt Mattia Binotto. Der 50-Jährige ist der Teamchef der Scuderia. Er führt den Formel-1-Rennstall, der in diesem Jahr eigentlich wieder um die Weltmeisterschaft kämpfen und mit Glanz und Gloria seine 1000. Grand-Prix-Teilnahme feiern wollte.

Stattdessen muss sich Binotto nach dem Großen Preis von Belgien mehr denn je die Frage gefallen lassen, ob er noch geeignet ist, das Team aus seiner schweren Krise zu holen. Seine Antwort klingt nach Resignation. „Ob ich noch der richtige Mann bin, kann ich nicht beantworten“, sagte Binotto, das müssten andere. Er sagt es – wie es seine Art ist – recht nüchtern und unaufgeregt.

Fakt ist, dass Ferrari ein erschreckendes Bild abgibt und die Plätze 13 für Sebastian Vettel und 14 für Charles Leclerc in Belgien keine Verkettung unglücklichster Umstände waren, sondern schlichtweg dem Leistungsstand entsprachen. Sogar im Live-Ticker der Formel 1 fiel die Bilanz verheerend aus: „Nicht mal mehr die Fahrer verstehen das Auto. Helfen wird das nicht.“

Ferraris Krise schadet der Königsklasse

Anzeige

Nach den Dissonanzen wegen der Entscheidung gegen eine Verlängerung des Vettel-Vertrags habe sich diese Saison von schlecht zu noch schlechter für die Scuderia entwickelt, hieß es. Noch schlechter geht es mittlerweile kaum mehr. „Langsam, schäbig, unzuverlässig“, ätzt „La Repubblica“ aus Italien. Und die „Gazzetta dello Sport“ urteilt: „Ferrari zeigt einen Mangel an Ideen und Mut. Es gibt reichlich Arbeit zu tun, aber auch vieles, über das nachgedacht werden muss.“

Lesen Sie auch Presse über Ferrari „Langsam, schäbig, unzuverlässig“

Auch wenn die österreichische „Kronen-Zeitung“ die Darbietungen des einst so glorreichen Rennstalls „mitleiderregend“ findet, regt sich bei den Mitbewerbern eher Unmut über den Absturz des Zugpferds. „Ferrari ist eine ikonische Marke. Sie sollten ganz vorne kämpfen“, mahnt Toto Wolff. Der Teamchef von Branchenführer Mercedes macht sich Sorgen. Ein Krisenfall Ferrari schadet sportlich der Motorsport-Königsklasse. Wolff sagt: „Es ist nicht gut für die Formel 1. Es ist nicht gut für den Kampf an der Spitze.“

An dieser Stelle finden Sie Inhalte aus Twitter Um mit Inhalten aus Twitter und anderen sozialen Netzwerken zu interagieren oder diese darzustellen, brauchen wir Ihre Zustimmung. Soziale Netzwerke aktivieren

Auf Kritik des höchst erfolgreichen Mercedes-Teamchefs, dass bei Entscheidungen innerhalb des Teams von einigen Leuten nicht die richtigen Prioritäten gesetzt worden seien, reagiert der bislang erfolglose Teamchef Binotto so: „Darauf müssen wir nicht antworten.“ Seit 35 Jahren ist Binotto bei Ferrari, ein Ingenieur durch und durch. Eine Leidenschaft, wie sie die Tifosi leben, verkörpert Binotto nicht. Bei der Videopressekonferenz mit den beiden Fahrern nach dem sportlichen Desaster von Spa war er hier und da sogar noch zu kleinen Scherzen aufgelegt. Verwunderlich.

Eine Sache des Respekts

Anzeige

Dass am kommenden Wochenende keine Fans wegen der strengen Hygiene- und Sicherheitsmaßnahmen in den Königlichen Park von Monza kommen dürfen, schmerzt die Italiener. Viel besser als in Spa-Francorchamps dürften Vettel und Leclerc aber auch beim ersten Teil des Italien-Doppelpacks nicht abschneiden. Auf der Hochgeschwindigkeitsstrecke ist Motorkraft gefragt. Und daran hapert es in diesem Jahr besonders.

Lesen Sie auch Lewis Hamilton „Mick Schumacher imponiert mir sehr“

„Wenn wir die Wahl hätten, hätten wir gern Fans da“, betont Vettel. „Ich glaube nicht, dass wir ausgebuht würden.“ Dass die Fans leiden, weiß er aber auch. Dass er leidet, davon kann man ausgehen.

Angesprochen auf das, was ihn eigentlich noch antreibt, wenn ein einst so erfolgreicher Pilot, der schon 53 Rennen gewann, derzeit im hinteren Mittelfeld herumdümpelt, sagt Vettel: „Die Leute um mich herum, die Mechaniker, die Ingenieure in der Garage.“ Es sei sicher nicht der ganz große Spaß, um Platz 13 zu kämpfen. „Ich bin aber Teil des Teams, nicht wegen des Vertrags, sondern auch aus dem Teamgeist heraus.“ Es sei auch eine Sache des Respekts.",'Lennart Wermke',1598886004,"Formel 1,Großer Preis von Belgien",welt
Viele Maskenverweigerer profitieren von unbegründeten Attesten,"In öffentlichen Verkehrsmitteln – wie hier in München – sind Masken Pflicht. Viele befreien sich per ärztlichem Attest davon

Quelle: picture alliance / SvenSimon",Florian Sädler,1598885941,"Politik,Streit um Mund-Nasen-Schutz",welt
Besetzte Reichstagstreppe – Was kurz davor tatsächlich geschah,,"'Dirk Banse', 'Curd Wunderlich', 'Rainer Haubrich'",1598885682,"Deutschland,Corona-Demos in Berlin",welt
"Havertz? „Erwarte nicht, dass er zurückkommt”",,,1598885184,"Sport,Peter Bosz",welt
Niko Kovac feiert ersten Monaco-Sieg in Unterzahl,Ex-Bayern-Trainer Niko Kovac feiert in der Ligue 1 im zweiten Anlauf seinen ersten Sieg mit AS Monaco. Kovac muss beim Sieg beim FC Metz in Unterzahl aber lange um den Erfolg bangen.,,1598885053,"Sport,Ligue 1",welt
„Wie Real Madrid“: Jean-Luc Vasseur über historische Leistung,,,1598884910,"Sport,Olympique Lyon",welt
Mavs verlieren Playoff gegen Clippers,,,1598884835,"Sport,NBA",welt
Jugendlicher soll zwei Menschen bei Protesten in US-Stadt Kenosha erschossen haben,"Anzeige

Bei erneuten Protesten gegen Polizeigewalt gegen Schwarze ist in der US-Stadt Kenosha (Wisconsin) scharf geschossen worden. Dabei sind in der Nacht zum Mittwoch zwei Menschen getötet worden, ein dritter wurde verletzt. Am Mittwoch wurde nach übereinstimmenden US-Medienberichten ein Tatverdächtiger festgenommen. Danach soll der 17-Jährige Kyle Rittenhaus der Schütze gewesen sein. Er stammt aus Antioch (Illinois), rund 30 Minuten von Kenosha entfernt.

Es wird weiterhin untersucht, wie es zu den tödlichen Schüssen kam. Denkbar ist offenbar, dass dahinter ein Konflikt zwischen Demonstranten und einer Gruppe bewaffneter Männer stehe, die behaupteten, sie würden Geschäfte schützen, hieß es. Medienberichten zufolge lieferten sich zudem gegnerische, teils bewaffnete Demonstrantengruppen regelrechte Straßenschlachten. Fotos zeigten verletzte und blutende Menschen auf den Straßen.

In Videos in sozialen Netzwerken waren ebenfalls Schüsse zu hören. Die Aufnahmen stammten aus einem Vorort, wo Anwohner mit Gewehren und anderen Waffen lange nach der Ausgangssperre auf den Straßen waren. Vor dem Gericht in Kenosha feuerte die Polizei die dritte Nacht in Folge Tränengas auf Demonstranten. Auch in einem Park kam es zu Konfrontationen.

Demonstranten attackierten sich teils gegenseitig auf den Straßen von Kenosha Quelle: BRENDAN GUTENSCHWAGER

Anzeige

In dem Bundesstaat herrscht seit Dienstag der Notstand. Gouverneur Tony Evers hatte eine verstärkte Präsenz der Nationalgarde angeordnet. In der Nacht zuvor hatten aufgebrachte Menschenmengen Dutzende Gebäude beschädigt und mehr als 30 Feuer im Stadtzentrum gelegt. Unruhen hat es außerdem in Los Angeles, Wisconsins Hauptstadt Madison und in Minneapolis gegeben. Auslöser der Proteste war der umstrittene Polizeieinsatz gegen den Schwarzen Jacob Blake.

James Blake von der Hüfte abwärts gelähmt

Der 29-jährige Familienvater war am Sonntag durch sieben Schüsse der Polizei in seinen Rücken schwer verletzt worden, und das vor den Augen seiner Kinder im Alter von drei, fünf und acht Jahren. Nach Angaben des Anwalts der Familie, Ben Crump, ist Blake nun infolge der Schüsse von der Hüfte abwärts gelähmt. Die Kugeln hätten die Wirbelsäule getroffen. „Es wird ein Wunder brauchen, damit er wieder laufen kann“, sagte Crumb am Dienstag.

An dieser Stelle finden Sie Inhalte aus Twitter Um mit Inhalten aus Twitter und anderen sozialen Netzwerken zu interagieren oder diese darzustellen, brauchen wir Ihre Zustimmung. Soziale Netzwerke aktivieren

Blake habe auch Nieren- und Leberverletzungen und ihm seien große Teile des Dickdarms und des Dünndarms entfernt worden, sagte Patrick Salvi, ein weiterer Anwalt der Familie.

Anzeige

Blakes Mutter forderte derweil mit ergreifenden Worten das Ende von Rassismus in den USA. „Ich wende mich an alle, egal ob weiß, schwarz, japanisch, rot, braun. Niemand ist dem anderen überlegen“, sagte Julia Jackson am Dienstag bei einer Pressekonferenz in Kenosha. Sie kritisierte dabei auch die gewaltsamen Proteste, bei denen unter anderem Gebäude und Autos gebrannt hatten und Geschäfte geplündert wurden.

An dieser Stelle finden Sie Inhalte aus Twitter Um mit Inhalten aus Twitter und anderen sozialen Netzwerken zu interagieren oder diese darzustellen, brauchen wir Ihre Zustimmung. Soziale Netzwerke aktivieren

Die Nationalgarde hat deshalb ihre Präsenz in der Stadt verstärkt. Der demokratische Gouverneur Tony Evers steht dabei unter zunehmendem Druck aus Washington, die Situation unter Kontrolle zu bringen. „Vergangene Nacht war es nicht genug“, sagte der amtierende Vizeheimatschutzminister Ken Cuccinelli dem TV-Sender Fox News. „Ich stelle infrage, ob er genug unternimmt – und ausreichend schnell.“

Lesen Sie auch Schläge, Tritte, Pfefferspray Polizeigewalt oder „vorbildlicher Ablauf“? Fünf Einsätze sorgen für Diskussionen

Ungeachtet der Tatsache, dass die Nationalgarde bereits im Einsatz ist, verlangte Präsident Donald Trump, sie auf die Straßen zu bringen. „Beenden Sie das Problem schnell!“, forderte er Evers in einem Tweet auf. Der Gouverneur warnte die Demonstranten, dass es eine Grenze zwischen friedlichem Protest und Ausschreitungen gebe, die Familien und Geschäfte gefährdeten.

„Er ist ein Menschen, und er ist etwas wert“

Anzeige

In den USA sehen viele den umstrittenen Einsatz gegen den Afroamerikaner Jacob Blake als das jüngste Beispiel für Rassismus und Polizeigewalt in den USA. Auf einem Video ist zu sehen, wie Blake zu seinem Auto (in dem seine Kinder saßen) geht, gefolgt von zwei Polizisten mit gezogener Waffe. Eine der Waffen ist auf seinen Rücken gerichtet. Als Blake die Fahrertür öffnet und sich in den Wagen beugt, fallen Schüsse.

Julia Jackson, die Mutter von Jacob Blake, trat in Kenosha unter Tränen vor die Presse Quelle: AFP

„Er schoss sieben Mal auf meinen Sohn. Sieben Mal!“, sagte Jacob Blake Senior. „Als wäre er nichts wert. Aber er ist ein Menschen, und er ist etwas wert.“ Mutter Julia Jackson sagte unter Tränen, ihr Sohn wäre gegen die Gewalt, wenn er davon wüsste. „Wir brauchen Heilung.“

Harte Worte kamen auch von Blakes Schwester Letetra Widman: „Ich bin nicht traurig. Ich bin wütend und erschöpft. Ich habe nicht geweint. Ich habe vor Jahren aufgehört, zu weinen. Ich sehe seit Jahren, wie die Polizei Menschen, die wie ich aussehen, ermordet.“ Sie wolle kein Mitleid: „Ich will Wandel.“

Lesen Sie auch „Ich werde sterben, Mann“ Komplettes Video veröffentlicht – Das passierte vor George Floyds Festnahme

In den USA hatte der Tod des Afroamerikaners George Floyd bei einem brutalen Polizeieinsatz in Minneapolis (Minnesota) Ende Mai landesweite Proteste ausgelöst. Die Debatte spielt auch im US-Wahlkampf eine zentrale Rolle. Die Republikanischer Partei nahm Blake in das Gebet zum Auftakt des zweiten Tags ihres Parteitags auf.","'Daniel Friedrich Sturm', 'Hannes Stein'",1598466300,"Panorama,Fall Jacob Blake",welt
