title,text,author,published,tags,source
Demonstrieren mit Rechtsextremen? Die AfD bedauert nur eines,"Anzeige

Der sächsische Bundestagsabgeordnete Karsten Hilse machte auf besonders drastische Weise sichtbar, in welcher Gesinnungsgemeinschaft seine AfD am Samstag unterwegs war.

Auf Facebook postete Hilse ein Foto, das ihn und seinen Fraktionskollegen Robby Schlund während der Demonstration in Berlin vor Plakaten mit Bildmontagen zeigt, auf denen unter anderem der Virologe Christian Drosten, Bayerns Ministerpräsident Markus Söder (CSU) sowie einige Journalisten als Sträflinge verächtlich gemacht wurden. Dazu der Schriftzug „schuldig“. Fröhlich strahlten Hilse und Schlund dazu in die Kamera.

An dieser Stelle finden Sie Inhalte aus Facebook Um mit Inhalten aus Facebook und anderen sozialen Netzwerken zu interagieren oder diese darzustellen, brauchen wir Ihre Zustimmung. Soziale Netzwerke aktivieren

Hilse und Schlund waren längst nicht die einzigen. Mehr als zwei Dutzend AfD-Abgeordnete aus dem Bundestag und viele aus Landtagen waren in Berlin dabei. Für die Bundestagsabgeordneten war eigens eine wichtige Sitzung verschoben worden: Gemäß ursprünglicher Planung hätten von Freitag bis Sonntag die Chefs der 25 Fraktionsarbeitskreise, in denen die inhaltlichen Themen der AfD-Bundestagsfraktion bearbeitet werden, bei einer gemeinsamen Klausurtagung in Berlin die Strategie für die nächsten Monate besprechen sollen.

Anzeige

Das Treffen galt als sehr wichtig, weil während des Sommers fraktionsintern erhebliche Kritik an strategischen Defiziten laut geworden war. Aber noch wichtiger war offenbar die Demonstration: Das Treffen der Arbeitskreis-Leiter wurde um einen Tag verschoben, damit Gelegenheit zur Teilnahme an der Kundgebung bestand.

Lesen Sie auch Corona-Demo vor dem Reichstag Die gefährliche Legende vom „Sturm“

In wessen Gesellschaft sie am Samstag unterwegs sein würden, musste allen AfD-Parlamentariern klar gewesen sein. Schon Tage im Voraus hatten zahlreiche rechtsextreme Gruppen zur Teilnahme aufgerufen, darunter die NPD, der „Dritte Weg“ und die Identitäre Bewegung. Hiervor wurde auch intern gewarnt, und zwar von einem der Parteichefs, von Jörg Meuthen.

Laut einem Bericht des Redaktionsnetzwerks Deutschland, der sich mit WELT-Informationen deckt, wies Meuthen in mehreren Sitzungen darauf hin, dass man durch eine Teilnahme an den Demonstrationen Reichsbürger, Rechtsextreme und Verschwörungstheoretiker unterstützen würde.

Auch mancher Meuthen-Anhänger bei der Demo

Anzeige

Aber unbeeindruckt blieben von diesen Warnungen auch einige derjenigen Bundestagsabgeordneten, die sonst in innerparteilichen Auseinandersetzungen auf Meuthens Seite stehen und vorgeben, sich von Rechtsextremisten abzugrenzen. Etwa Joana Cotar, Jürgen Braun, Paul Viktor Podolay, Rüdiger Lucassen und Bruno Hollnagel. Stark vertreten war das Rechtsaußen-Lager der Partei. Der Bundestagsabgeordnete Steffen Kotré kam gar zusammen mit einer Delegation von polnischen Rechtspopulisten.

Zur Teilnahme aufgerufen hatte auch der Thüringer Rechtsextremist und AfD-Politiker Björn Höcke. Die Parteifahnen allerdings solle man zu Hause lassen, empfahl Höcke im Vorfeld.

An dieser Stelle finden Sie Inhalte aus Facebook Um mit Inhalten aus Facebook und anderen sozialen Netzwerken zu interagieren oder diese darzustellen, brauchen wir Ihre Zustimmung. Soziale Netzwerke aktivieren

In einem Video des vom Verfassungsschutz als Verdachtsfall geführten Netzwerks „Ein Prozent“ sprach Höcke am Samstagmittag von „überwältigenden“ Eindrücken. Er sei „stolz“, dabei zu sein, zusammen mit „Millionen Menschen wahrscheinlich“.

Anzeige

Mit dabei waren jedenfalls auch diejenigen, die später an diesem Samstag auf die Treppen des Reichstagsgebäudes liefen. Ganz vorn dabei war ein Mann aus dem brandenburgischen Rathenow, Mitglied der AfD-Jugendorganisation Junge Alternative. Diese hat sich inzwischen von der Aktion distanziert, der Mann ist ausgetreten.

An dieser Stelle finden Sie Inhalte aus Facebook Um mit Inhalten aus Facebook und anderen sozialen Netzwerken zu interagieren oder diese darzustellen, brauchen wir Ihre Zustimmung. Soziale Netzwerke aktivieren

Die Szene auf den Treppen war auch am Sonntag und Montag das Einzige, wovon sich Spitzenpolitiker der Partei im Nachhinein distanzierten. Dass sie sich insgesamt in einem gemeinsamen Zug mit vielen Reichsbürgern und harten Antisemiten bewegt hatten, war ihnen hingegen kein Ausdruck des Bedauerns wert. Fraktionschefin Alice Weidel nannte es am Sonntag „inakzeptabel, dass einige Chaoten nach der friedlichen Corona-Demonstration in Berlin die Polizei-Absperrungen vor dem Reichstag durchbrochen haben“.

Und Parteivize Beatrix von Storch fand jene kurzzeitige Treppen-Besetzung „auch nicht in Ordnung“, wie sie am Montag im SWR sagte. Sie warf aber dem hiernach fragenden Moderator sofort vor, er reduziere „diese ganze Bürger-Bewegung aus der Mitte der Gesellschaft auf diesen einen Punkt“. So wurde deutlich, dass an der Spitze der AfD so gut wie keine grundsätzlichen Zweifel an den am Samstag versammelten Gruppierungen bestehen.","Matthias Kamann, Annelie Naumann",1598890809,"Deutschland,Corona-Protest in Berlin",welt
"„Präsidenten sind immer willkommen, doch jetzt ist nicht die richtige Zeit“","US-Präsident Trump will die Stadt Kenosha in Wisconsin besuchen. Das ist die Stadt, in der der Afro-Amerikaner Jakob Blake von einem Polizisten niedergeschossen wurde und die seitdem immer wieder von heftigen Unruhen erschüttert wird. Nicht jeder freut sich auf den hohen Besuch.",,1598890503,"Ausland,Trump will Kenosha besuchen",welt
"„Die Polizei hat die Muskeln spielen lassen. Sie wollte zeigen, wer Herr im Haus ist“","Das Chaos in Berlin begann am Samstag schon am Vormittag. Gemeinsam mit dem Veranstalter, der „Initative Querdenken 711“ aus Stuttgart, hatte die Polizei die Friedrichsstraße und Unter den Linden als Aufstellstrecke für eine Demonstration bestimmt. Der Plan: Die Teilnehmer sollten in Blöcken von je 1000 Personen laufen. In den Blöcken sollte der Mindestabstand, eine Auflage der Versammlungsbehörde, gewahrt werden. Das scheiterte.

„Die Einsatzkonzeption ist einem außenstehenden Betrachter, der etwas Ahnung hat, nicht schlüssig geworden“, sagt Michael Knape, ehemaliger Direktor beim Polizeipräsidenten, zu WELT.","Sebastian Beug, Dirk Banse, Michael Behrendt, Christina Brause, Sabine Menkens",1598890430,"Deutschland,Kritik an Polizeieinsatz",welt
Ungarn schließt die Grenzen – füllt aber die Fußballstadien,"Ungarn will die erneute Ausbreitung des Coronavirus eindämmen. Aber Fußballspiele mit tausenden Zuschauern sind erlaubt. Offiziell unter „strengen Auflagen“. Unser Autor erlebte, was in der deutschen Bundesliga derzeit undenkbar ist.",Boris Kálnoky,1598889698,"Ausland,Corona",welt
Das entscheidende Treffen mit Abou-Chaker blieb Bushidos größtes Geheimnis,"Anzeige

Mit einer großen Gefäligkeit beginnt die Geschichte, mit der sich nun das Berliner Landgericht befassen muss. Es ist die Geschichte des jahrelang erfolgreichsten deutschen Rappers Bushido, bürgerlich Anis Ferchichi, und seiner Verbindung in die Unterwelt. Zu Arafat Abou-Chaker, Clan-Boss, zwischen 2004 und 2017 Geschäftspartner Bushidos – und lange dessen personifizierte Street-Credibility.

Abou-Chaker sitzt heute auf der Anklagebank. Er soll seinen früheren Protegér nach dessen Aufkündigung der Zusammenarbeit beschimpft und geschlagen haben. Einer seiner Brüder, von denen drei ebenfalls angeklagt sind, soll Bushido zudem um Geld betrogen haben. Der Rapper sagt als Hauptzeuge gegen die bekannte Großfamilie aus. Seit er in Interviews über die mutmaßlichen Machenschaften im Clan-Milieu aupackte, stehen der 41-Jährige und seine Familie unter Polizeischutz.

Am Montag, dem vierten Prozesstag des Mammutverfahrens, soll Bushido die Umstände erläutern, die ihn vor rund 16 Jahren überhaupt mit Abou-Chaker zusammengebracht hatten. Als „Trennungsphase Aggro“ beschreibt der Vorsitzende Richter dieses Kapitel. Aggro Berlin das ist zu Beginn der 2000er-Jahre das provokanteste und für eine Weile auch erfolgreichste Raplabel der Hauptstadt, die Heimat von Rappern wie Sido, Fler – und eben Bushido.

Hamudi Wasserkopf sorgte für den entscheidenden Kontakt

Anzeige

Als der nach einem Streit mit Labelmitgründer Halil Efe aussteigen will, kommt Abou-Chaker ins Spiel. So viel ist bereits bekannt und geschrieben worden. Und doch sind es die Details des Kennenlernens, die den Richter zu interessieren scheinen.

Bushido berichtet also, von den „Jungs aus Schöneberg“, die er zuerst damit beauftragt habe, im Streit mit seinem Label zu moderieren: Jungs aus der Steinmetzstraße, Araber, Türken, junge Männer vom Balkan. Man habe sich gekannt, sagt Bushido, die Aggro-Leute und die Schöneberger, alle hätten miteinander „abgehangen“. Vor allem der „Kopf der Bande“, ein Mann, der als „King Ali“ bekannt sei, hätte Respekt genossen.

Doch entgegen dessen Zusagen, zwischen Label und Künstler zu vermitteln, sei nichts passiert. Bushido sei in seinem Exklusivverrtrag mit Aggro Berlin gefangen gewesen. Bis ein anderer Mann mit ungewöhnlichem Spitznamen ihm eine Lösung vorschlug: Hamudi Wasserkopf.

Anzeige

„Ich habe einen Cousin. Ich bin verwandt mit Arafat Abou-Chaker“, habe Bushidos Bekanntschaft, die eigentlich Mohammed Nasrallah heiße, gesagt. Abou-Chaker sei „die einzige Person, die die Aggroberliner überzeugen könnte“. Zu diesem Zeitpunkt habe er von Abou-Chaker noch nie etwas gehört.

„Völliger Bullshit“, sagt Bushido vor Gericht

Ein erstes Treffen zwischen Rapper und mutmaßlichem Mediator habe an der Warschauer Straße vor dem Club Matrix stattgefunden. Beim Aufeinandertreffen unter der dunklen U-Bahn-Brücke habe Abou-Chaker „keinen sehr interessierten Eindruck gemacht“. Er habe „düster“ gewirkt und „unnahbar“. Nur an eines scheint sich Bushido lebhaft zu erinnern: „Er hat mich mit Zeigefinger und Daumen am Kiefer angefasst und meine Tätowierung angeschaut.“ Bushido meint das „B“, das groß an seinem Hals prangt und seit seinem Durchbruch als Markenzeichen gilt. „Er hat das nicht verstanden, warum man sich tätowiert“, sagt Bushido.

Dennoch kamen die beiden zusammen. Ein zweites Treffen habe in einem Café in der Kreuzberger Katzbachstraße stattgefunden. Dann, beim dritten Aufeinandertreffen im Mai 2004, so schildert es Bushido, seien beide zusammen zum Büro von Aggro Berlin gefahren.

Lesen Sie auch Berliner Rapper angeklagt Die Akte Fler

Anzeige

Über das, was dort passiert, gibt es unterschiedliche Auffassungen. Am Montagmorgen wird bekannt, dass die Aggro-Gründer Klage gegen Bushido eingereicht haben. Sie wollen ihm die Verbreitung falscher Darstellungen verbieten. Unter anderem bestehen sie darauf, dass Bushido und Abou-Chaker mit sechs weiteren Männern und einem „machentenartigen Messer“ bei ihnen aufgetaucht und sie „unter Androhung von Gewalt“ zur Unterschrift eines Auflösungsvertrages zu gezwungen hätten.

„Völliger Bullshit“, sagt Bushido vor Gericht. Es ist der einzige Moment, in dem der sonst sehr kontrolliert auftretende Rapper kurz ausfallend wird. In seiner Autobiografie hatte er geschildert, dass Abou-Chakers Präsenz allein gereicht hätte, die Aggro-Bosse zur Auflösung seines Vertrages zu bewegen.

Nach Bushidos erstem Angebot wurde Arafat wütend

Nun spricht er von einer Ohrfeige gegen Aggro-Mitgründer Efe und kurze lautstarke Diskussionen. Bushido habe als Kompromiss die Rechte an seiner bisher bei Aggro Berlin veröffentlichten Musik abgetreten. Abou-Chaker habe sogar noch zu ihm gesagt: „Wenn du das willst, dann kriegen die nix.“ Er jedoch hätte abgelehnt. Die Sache sei für ihn erledigt gewesen. Bushido war frei – zumindest für wenige Tage. Denn dann habe Abou-Chaker ihn angerufen. Es gebe etwas zu klären.

Für seine Gefälligkeit habe Abou-Chaker eine Gegenleistung verlangt, berichtet Bushido. Beide hätten im Auto des Angeklagten gesessen, einem silbernen Kombi. Er habe Abou-Chaker vorgeschlagen, 20.000 Euro zu zahlen. Das Majorlabel Universal hätte ihm gerade einen Vorschuss über 50.000 Euro für ein neues Album angeboten. Auch zu 25.000 Euro wäre er bereit gewesen, schildert Bushido. Für den Rapper, der aussagt, zu Aggro-Zeiten noch „ein Knax-Konto bei der Sparkasse“ gehabt zu haben, sei das viel Geld gewesen.

Abou-Chaker aber sei wütend geworden. „Er fragte, ob ich ihn verarschen will.“ Der Angeklagte habe eine prozentuale Beteiligung verlangt. „Ich solle ihn an allem beteiligen, was ich je verdienen würde in allen Bereichen.“ Abou-Chaker sei nun laut geworden und dominant. Er, Bushido, habe sich „total eingeschüchtert“ gefühlt. Schließlich schlug er ein. Abou-Chaker würde fortan dreißig Prozent von allem bekommen, was er verdienen würde. Bei 100.000 Euro Verdienst, habe er also im Café in der Katzbachstraße 30.000 Euro in Bar an Abou-Chaker übergeben. Abzüglich Steuern habe er selbst nur rund 20.000 Euro behalten.

Nun wird der Richter stutzig. Er lese Zeitungen, sagt er, und diese hätten immer wieder über die „dicke Freundschaft“ zwischen Bushido und dem Clan-Boss berichtet.

Von dem entscheidenden Treffen habe Bushido niemandem erzählt

Bushido, der mehrfach lockere Sprüche einschiebt und den Gerichtssaal zum Lachen bringt, wird plötzlich ungewöhnlich ernst. „Ich wurde gezwungen“, insistiert er. Niemals hätte er sich freiwillig an Abou-Chaker gebunden. Von diesem vierten Treffen in Abou-Chakers Kombi habe er bis vor einem Jahr niemandem erzählt. „Nicht einmal meiner Frau.“

Anzeige

Es ist nicht das einzige Mal, dass vor dem Berliner Landgericht die Diskrepanz zwischen öffentlicher Wahrnehmung des Rappers und dessen Tatsachenbeschreibung vor Gericht thematisiert werden. Minutenlang klopfen die Anwälte der Verteidigung Passagen aus Bushidos Autobiografie ab, in der er unter anderem gewalttätige Auseinandersetzungen in seiner Jugend und der frühen Aggro-Zeit schildert. Mit Rapperkollege Sido habe er einige „Wichser fertiggemacht“, die Sido beleidigt hätten, heiße es in dem Buch etwa. „Grob überspitzt“, sagt Bushido nun.

Lesen Sie auch Clan-Chef vor Gericht „Bis bald“, ruft Abou-Chakers Bruder den Beamten zum Abschied zu

Als „Kampfheuschrecken“ habe er Fler und sich beschreiben. „Das war der Ghostwriter“, sagt Bushido, der über die Passage selbst verdutzt scheint. Dieses Wort würde er nie verwenden. Ob es je körperliche Auseinandersetzungen gegeben habe, an denen er beteiligt gewesen wäre, will einer der Verteidiger wissen. „Nö“, sagt Bushido erst, bevor er nach einigem Nachhaken revidiert: „Dann würde ich lieber mal ja sagen.“

Sein Buch aber habe vor allem dem Image des Gangstarappers Bushido gedient, gibt er zu. Er sitze vor Gericht aber als Herr Ferchichi. Und Herr Ferchichi, so scheint es, kümmert sich nicht mehr um Streetcredibilty.

Am Mittwoch soll die Verhandlung fortgesetzt werden.",Lennart Pfahler,1598889197,"Panorama,Prozess in Berlin",welt
"„Kontrovers diskutieren gehört zur Demokratie, brüllen und beleidigen nicht“",,,1598888330,"Deutschland,Spahn zu Berliner Demonstrationen",welt
Zuweilen muss man sich schützend vor die Demokratie stellen,"Ein Polizist steht barhäuptig und brüllend vor dem Eingang des Reichstags. Mit der Wucht seiner Persönlichkeit hält er die Demonstranten in Schach und beruhigt seine beiden Kollegen. Wenn einer der drei die Nerven verliert und die Schusswaffe zieht, kann es sehr hässlich werden. Doch die Dreierkette hält. Auch die Demonstranten scheinen zu wissen, was auf dem Spiel steht. Zum Märtyrertum für was auch immer hat offenbar niemand Lust.

Die Szene symbolisiert für mich jenes Deutschland, das der britische Journalist John Kampfner „ein erwachsenes Land“ nennt. Ich habe selbst als junger Mann in West-Berlin andere Szenen erlebt: Brutale Polizisten, die ihr Handwerk noch unter den Nazis gelernt hatten, und fanatisierte Demonstranten, zu denen ich gehörte, die bei ihren Aktionen Tote durchaus einkalkulierten.",Alan Posener,1598887715,"Kommentare,Sturm auf den Reichstag",welt
Was eine Fotografie zum Kulturgut macht,"Wenn es zutrifft, dass sich das kollektive Gedächtnis in fotografischen Bildern verkörpert, besteht die deutsche Erinnerung nur noch aus Lücken, nahe der Amnesie. Seine materielle Basis hat sich auf Restbestände verringert. Denn in den vergangenen Jahrzehnten hat man den größten Teil der Bilder entsorgt, weil niemand etwas mit dem „Zeugs“ anfangen wollte und konnte. Ob die meisten Archive der Tageszeitungen, Illustrierten und Magazine oder die Nachlässe bedeutender Fotografinnen und Fotografen – unzählige Bilder von politischen, gesellschaftlichen und kulturellen Ereignissen und von maßgeblichen Persönlichkeiten sind auf immer verloren. An warnenden Stimmen hat es nicht gefehlt.",Klaus Honnef,1598887288,"Kunst,Nationales Fotozentrum",welt
Wenn Polizisten von „Versklavung“ durch Masken sprechen,"Anzeige

Bayerns Innenministerium hat eine dienstaufsichtliche Prüfung der Auftritte dreier bayerischer Polizisten bei der Demonstration gegen die Corona-Maßnahmen in Berlin angekündigt. Dies teilte Innenminister Joachim Herrmann (CSU) mit. Der freie Journalist Robert Andreasch hatte zuvor Bilder verbreitet, auf denen die drei Polizisten als Redner bei der Großdemonstration der Initiative „Querdenken 711“ zu sehen sind.

An dieser Stelle finden Sie Inhalte aus Twitter Um mit Inhalten aus Twitter und anderen sozialen Netzwerken zu interagieren oder diese darzustellen, brauchen wir Ihre Zustimmung. Soziale Netzwerke aktivieren

Bei den Rednern handelte es sich um den Polizeihauptkommissar Bernd Bayerlein aus Weißenburg, den Kriminalhauptkommissar Wolfgang Kauth aus Augsburg und den pensionierten Polizeihauptkommissar Karl Hilz aus München. Bayerlein und Hilz waren bereits zuvor auf Demonstrationen von Corona-Skeptikern aufgetreten. An der Berliner Versammlung am Samstag nahmen neben Personen aus dem bürgerlichen und esoterischen Spektrum auch zahlreiche Rechtsextremisten und sogenannte Reichsbürger teil. Die Veranstaltung war durch Anhänger von Verschwörungsmythen geprägt.

Polizisten als Redner bei den „Querdenkern“ (v. l.): Wolfgang Kauth, Karl Hilz und Bernd Bayerlein am Samstag in Berlin Quelle: Screenshots YouTube/watch?v=6JSZK7VQsOg&feature=youtu.be&t=10365; watch?v=6JSZK7VQsOg&feature=youtu.be&t=11130

Kauth sprach in seiner Rede von einer „angeblichen Pandemie“ und rief dazu auf, sich nicht nur in „Mainstream-Medien“, sondern auch in sogenannten alternativen Medien zu informieren. Der Polizist ist in Augsburg im Kommissariat für Eigentumsdelikte eingesetzt. Das Polizeipräsidium Schwaben Nord teilte mit, dass Kauth bis zur Prüfung des Vorgangs im reinen Innendienst ohne Außenkontakte eingesetzt werde.

Anzeige

Bayerlein kündigte in seiner Rede an, auch weiterhin „für die Gerechtigkeit, für die Freiheit und für die Wahrheit (zu) kämpfen“. Zuvor war er bereits am 8. August auf einer Demonstration in Augsburg aufgetreten. Durch die Verbreitung von Angst und Schrecken durch Politik und Medien habe sich Deutschland zu einem regelrechten Denunziantenstaat entwickelt, sagte der Polizist damals. Wesentliche Informationen würden durch die „Lückenpresse“ unterdrückt.

An dieser Stelle finden Sie Inhalte aus YouTube Um mit Inhalten aus YouTube und anderen sozialen Netzwerken zu interagieren oder diese darzustellen, brauchen wir Ihre Zustimmung. Soziale Netzwerke aktivieren

Nach seinem ersten Auftritt wurde ein Disziplinarverfahren gegen Bayerlein eingeleitet, der damalige Dienstgruppenleiter wurde in den Innendienst versetzt. In den Ausgang des Disziplinarverfahrens fließe das weitere Verhalten des Beamten ein, teilte das Polizeipräsidium Mittelfranken nun mit. Bis zum Abschluss der Bewertung werde der Beamte weder als Führungskraft noch im Dienst mit Bürgerkontakt eingesetzt. Zuletzt gab Bayerlein dem verschwörungsideologischen Portal „KenFM“ ein Interview.

Hilz trat mit einer weißen Rose in der Hand auf. „Ich erwarte von meinen Kollegen, die noch im Dienst sind, das Grundgesetz zu respektieren und gegebenenfalls zu demonstrieren, wenn ihnen von der Politik Dinge befohlen werden, die unseren Grundwerten, unseren Grundrechten widersprechen“, sagte er in seiner Rede. „Das Tragen von Masken versklavt und lässt die Menschen nicht mehr normal miteinander kommunizieren.“

Lesen Sie auch Corona-Demo vor dem Reichstag Die gefährliche Legende vom „Sturm“

Anzeige

Die Recherche- und Informationsstelle Antisemitismus Bayern erkennt in der Verwendung der weißen Rose eine Verharmlosung des Nationalsozialismus. „Damit vergleicht er die derzeitigen Maßnahmen gegen die Ausbreitung des Coronavirus mit dem Nationalsozialismus und imaginiert sich und die ‚Protestler‘ in der Rolle der studentischen Widerstandsgruppe der Weißen Rose“, sagt die Leiterin Annette Seidel-Arpaci. „Dadurch werden die Opfer des Nationalsozialismus verhöhnt.“ Auf Versammlungen in München und Passau hatte Hilz zuvor gefordert, dass dem Volk eine Verfassung zur Ratifizierung vorgelegt werden müsse. Dies nimmt Bezug auf die Ideologie der sogenannten Reichsbürger, nach der das Grundgesetz keine Verfassung sei.

„Polizisten haben da nichts zu suchen“

„Insbesondere wenn es sich um Reichsbürgerideologie handelt oder der Betreffende im extremistischen Milieu anzusiedeln ist, werden wir alle Hebel für harte Sanktionen in Bewegung setzen“, teilte Bayerns Innenminister Herrmann mit. Hier habe die Meinungsfreiheit auch von Polizisten im Ruhestand klare Grenzen. „Für so etwas fehlt mir jegliches Verständnis.“

Auch aus dem Landtag wird Kritik laut. „Solche Auftritte sind höchst problematisch, denn auf den Veranstaltungen findet sich eine gefährliche Mischung aus Rechtsextremen, Antisemiten, Verschwörungsideologen, Impfgegnern und Co. ein“, sagte die Grünen-Fraktionsvorsitzende Katharina Schulze. „Und mittendrin als Redner bayerische Polizisten, die die freiheitlich-demokratische Grundordnung eigentlich verteidigen sollen.“ Der bayerische Innenminister hätte als Dienstherr schon früher klar durchgreifen und alles daransetzen müssen, dass solche Auftritte nicht stattfinden, so Schulze.

Lesen Sie auch Corona-Protest in Berlin „Wir wollen den absoluten Weltfrieden!“ – Die bizarren Szenen einer Großdemo

Anzeige

„Auf einer Demonstration, die von Demokratiefeinden und Reichsbürgern geprägt ist, haben Polizisten nichts zu suchen“, sagte Florian Ritter, Rechtsextremismusexperte in der bayerischen SPD-Fraktion. Allein die Teilnahme sei problematisch. „Die Äußerungen von Herrn Kauth und Herrn Hilz gehen zudem deutlich über das Mäßigungsgebot hinaus. Das ist höchst alarmierend.“ Polizeibeamte verpflichteten sich dazu, die Verfassung zu schützen. In der Freizeit dann mit Verfassungsfeinden in einer Reihe zu laufen, dürfe nicht geduldet werden und müsse harte Konsequenzen haben.

Auch innerhalb der Polizei sorgen die Auftritte der Beamten für Kritik. „Wir als Gewerkschaft der Polizei (GdP) bewerten diese Auftritte als sehr bedenklich und wenig hilfreich“, sagte der Vizevorsitzende der GdP Bayern, Peter Pytlik. Selbstverständlich hätten Polizisten als Bürger auch das Recht auf freie Meinungsäußerung und Versammlungsfreiheit. Hier müsse jedoch ein notwendiges Maß an Neutralität und Zurückhaltung erfolgen. „Die Auftritte könnten geeignet sein, das Ansehen der Polizei in der Öffentlichkeit zu beschädigen und das künftige Einschreiten der Polizei bei Corona-Demos möglicherweise erschweren“, so Pytlik weiter.

Neben den drei bayerischen Polizisten trat auch der Kriminalhauptkommissar Michael Fritsch aus Hannover auf der „Querdenken 711“-Bühne auf. Wegen einer Rede vor Gegnern der Corona-Maßnahmen am 9. August in Dortmund, in der er Parallelen zum Nationalsozialismus zog, war er vorerst vom Dienst entbunden worden. Fritsch war für Sicherheitskonzepte für jüdische Gemeinden in Niedersachsen zuständig; seine Rede hatte dort für Beunruhigung gesorgt. Zu seiner Suspendierung sagte er am Samstag in Berlin: „Ja, das war es wert. Ich würde mit euch und für euch das immer wieder tun.“",Frederik Schindler,1598887168,"Deutschland,Corona-Demo in Berlin",welt
