title,text,author,published,tags,source
Egal wie es weitergeht – Putin hat gewonnen,"Wegen des Vorgehens von Präsident Lukaschenko gegen die Opposition in Weißrussland prüft die EU eine Ausweitung geplanter Sanktionen. „Wir arbeiten an einer Sanktionsliste, die alsbald verabschiedet werden soll“, so Bundesaußenminister Heiko Maas.

Anzeige

Nach drei Wochen gleicht die politische Krise in Weißrussland einem Patt. Die Demonstranten in Minsk und in der Provinz geben dem staatlichen Druck nicht nach. Der Präsident Alexander Lukaschenko hat in ihren Augen nach der manipulierten Wahl am 9. August jede Legitimität verloren, doch er denkt nicht ans Aufgeben. Bislang verweigert er sich jedem Dialog mit den Oppositionellen.

Im Gegenteil, Lukaschenko eskaliert: Er lässt das Militär in Minsk einmarschieren und seine Residenz schützen. Der Autokrat und sein minderjähriger Sohn zeigen sich bewaffnet und in voller Kampfmontur. Doch die Demonstranten beeindruckt das offenbar wenig. Lukaschenko selbst hingegen wird immer nervöser, er telefoniert häufig mit Russlands Staatspräsident Wladimir Putin und plant in den nächsten Wochen sogar einen Besuch in Moskau.

Der eigenwillige Autokrat, der sich in seinen 26 Jahren an der Macht häufig mit Russland anlegte, hat die Zügel nicht länger in der Hand. Doch wie die Krise in Weißrussland ausgeht, wird am Ende wohl nicht von den mutigen Oppositionellen entschieden. Sondern in Moskau.

Lesen Sie auch Folter in Weißrussland „Die schlimmsten Taten haben sie nachts verübt“

Anzeige

Das hat Putin kürzlich in einem Fernsehinterview klargemacht: Sollten sich die Proteste in Weißrussland radikalisieren, schickt Putin eine „Reserve“ russischer Spezialkräfte ins Nachbarland. Lange genug hat Putin das Geschehen in Minsk beobachtet und sich offenbar entschieden: Lukaschenko soll bleiben, obwohl Moskau peinlich darauf achtet, vom „Unionsstaat“ zu sprechen. Also von seinen Interessen in Weißrussland, statt von der Personalie Lukaschenko.

Unterstützer der Opposition demonstrieren in Minsk Quelle: AFP

Für den Autokraten aus Minsk ginge der Verbleib an der Macht allerdings mit dem Verlust geopolitischer Eigenständigkeit seines Landes einher. Denn der angeblich so meisterhafte Taktiker Alexander Lukaschenko hat in den letzten Wochen alles verspielt, was er sich aus Angst vor Moskaus Übermacht nach der Krim-Annexion erarbeitet hat.

Plötzlich redet Lukaschenko mit Putin über die Refinanzierung des russischen Anteils der weißrussischen Auslandsschulden in Höhe von rund einer Milliarde Dollar. Der Schein von Neutralität Weißrusslands, der Flirt mit dem Westen, ist dahin. Lukaschenkos neue notgedrungene Position ist weit entfernt von seiner alten Distanz zu den gewaltvollen Grenzüberschreitungen der „russischen Welt“.

Lesen Sie auch Proteste in Weißrussland Am Ende der Revolution könnte ein noch schlimmerer Diktator stehen

Anzeige

Die international kritisierte Annexion der Krim etwa hat Weißrussland nie offiziell anerkannt, doch das spielt keine Rolle mehr. Einem Autokraten, der Schützenpanzer gegen Zehntausende friedliche Demonstranten auffahren lässt und mit einer geladenen Kalaschnikow in seinem Präsidentenpalast posiert, steht die Vermittlerrolle zwischen Russland und der Ukraine ohnehin schlecht zu Gesicht.

Lukaschenko, der wohl so ikonisch wie der chilenische Präsident Salvador Allende während des Militärputsches von 1973 aussehen wollte, machte in den Augen seiner Staatsbürger und Nachbarn einen ganz anderen Eindruck. Er sah aus wie einer der Separatistenführer in der Ostukraine. Doch Moskau ist das egal. Schließlich steht Lukaschenko für einen prorussischen Kurs des Landes, und das ist für Moskau entscheidend. Den Oppositionellen geht es im Moment nicht um Westorientierung. Aber wer kann garantieren, dass es dabei bleibt?

Moskau kann also zufrieden sein. Nun sieht der ehemalige Vermittler, der noch vor wenigen Monaten unverhohlen von einer Bedrohung aus den zwei Himmelsrichtungen Osten und Westen sprach, ausgerechnet in Europa eine Gefahr. Lukaschenko fantasiert über einen Nato-Angriffskrieg gegen Weißrussland und torpediert essenzielle Wirtschaftsbeziehungen zu seinem Nachbarn Litauen.

Lesen Sie auch Weißrussland Die EU hat schon einen Lukaschenko-Nachfolger im Blick

Anzeige

Vor wenigen Monaten freute sich Lukaschenko, über den Ostseehafen Klaipeda, der zum Teil Weißrussland gehört, Öl aus Norwegen und Saudi-Arabien importieren zu können. So wollte er die Abhängigkeit von Ölimporten aus Russland reduzieren. Diese sind seit Jahren ein Streitpunkt zwischen Putin und Lukaschenko.

Polizisten stoppen einen Demonstrationszug in Minsk Quelle: AP

Vor zwei Tagen sagte der weißrussische Autokrat, er wolle die Warenströme, die über Litauen laufen, „umorientieren“. Im Klartext heißt das: über russische Häfen umleiten. Mehr noch, als Antwort auf kommende EU-Sanktionen gegen ihn drohte Lukaschenko, auf ein lukratives Geschäft zu verzichten, das Moskau bereits seit Jahren Ärger bereitet: den Reexport von Lebensmitteln aus der EU nach Russland, die wegen der russischen Gegensanktionen nach der Krim-Annexion eigentlich einem Embargo unterliegen.

Eine weitere traurige Entwicklung lässt Weißrussland noch näher an Russland rücken. Die IT-Branche Weißrusslands gehörte noch im vergangenen Jahr zu Lukaschenkos Vorzeigeprojekten: hoch qualifizierte Entwickler, vergleichsweise niedrige Löhne und eine IT-Sonderwirtschaftszone bei Minsk machten bekannte Projekte wie das Onlinespiel „World of Tanks“ möglich. Im vergangenen Jahr stellte der IT-Sektor mehr als ein Drittel der weißrussischen Exporte.

Lesen Sie auch Wahl in Weißrussland „Im Kindergarten und in der Schule nahm ich ihn als etwas Ewiges wahr“

Nun steht die Branche wegen Lukaschenkos wiederkehrenden Internetsperren und der Verfolgung demonstrierender IT-Experten vor dem Kollaps. Mehr als 2500 IT-Entwickler, Manager und Investoren riefen Lukaschenko in einem offenen Brief dazu auf, die Gewalt gegen Demonstranten zu stoppen und transparente Neuwahlen abzuhalten. Der russische Tech-Gigant Yandex, dem auch das Russland- und Weißrussland-Geschäft von Uber gehört, hat einen Teil seiner Mitarbeiter aus der Minsker Niederlassung evakuiert, nachdem diese von maskierten Spezialkräften durchsucht wurde.

Zwölf weitere Firmen wollen ihre Büros komplett ins Ausland verlagern, rund 60 weitere zumindest teilweise, darunter angeblich auch der „World of Tanks“-Hersteller Wargaming. Für internationale Investoren, die das Land noch vor wenigen Monaten als einen von Europas führenden Tech-Knotenpunkten bejubelten, werden die politischen Risiken nun unüberschaubar. Neue Projekte werden auf Monate oder Jahre eingefroren. Das führt dazu, dass das Land auf seine traditionellen Exportbranchen zurückfällt – wie den Export von Raffinerieprodukten. Schließlich braucht man dafür russisches Öl, nicht eigenwillige IT-Experten.",Pavel Lokshin,1598895378,"Ausland,Weißrussland",welt
Ode an die Freiheit der Regie,"Zum Neustart mit Corona-Regeln am Thalia Theater setzt Antú Romero Nunes eine amüsante „Ode an die Freiheit“ aus drei zerstückelten Dramen von Friedrich Schiller zusammen - und weckt Theatersehnsucht

Anzeige

Sie könnten Stücke von Friedrich Schiller spielen. Aber sie wollen nicht. Das interessiert sie nicht, am Thalia Theater. Deshalb griff der einfallsreiche und fantasievolle Regisseur Antú Romero Nunes jetzt für die Wiedereröffnungspremiere in Corona-Zeiten vor 300 Zuschauern zu drei Dramen, nämlich „Kabale und Liebe“, „Maria Stuart“ und „Wilhelm Tell“, die er stark zusammenkürzte, drastisch gegen den Strich bürstete und heftig mit eigenen Texten ergänzte.

Dazu bekundet er im Inszenierungserklärheft (früher: Programmheft): „Ich habe Schiller immer gern gelesen. Schillers Texte sind grandios.“ So grandios allerdings, dass man sich einen ganzen Abend etwa mit „Kabale und Liebe“ begnügen könnte, findet Nunes Schiller nicht. Nunes ist zweifellos grandioser, denn er weiß: „aber wir müssen rausfinden, was Schiller noch mit uns zu tun haben könnte.“ Pluralis Majestatis.

Ihro Regiemajestät Nunes

Wie nun finden Ihro Regiemajestät Nunes heraus, was Schiller mit ihr zu tun haben könnte. Mit Methode: „Am Anfang ist immer der Text, die Literatur, um dann einen Background zu haben für Improvisationen und thematische Ansätze. Wenn wir schon diese alten Stoffe spielen, dann wollen wir etwas damit machen und mit den Dingen jonglieren.“ Grandios. Und ist es auch Methode, so hat sie doch Regietheater-Wahnsinn.

Anzeige

Die drei Schiller-Fragmente sind nun unter dem Titel „Ode an die Freiheit“ zusammengebaut, wobei ganz klar die Freiheit des Regisseurs gemeint ist, der die Pflicht hat, über „diese alten Stoffe“ zu triumphieren, in seinem gut zweistündigen Triptychon „nach Friedrich Schiller“. Wobei „nach“ genauer „frei nach“ und mit Blick auf die Aussagen der Stücke nahezu „frei von“ bedeutet. Am Anfang ist zwar immer das Schiller-Wort. Aber dann ward es Thalia-Schauspielerfleisch und Nunes-Regiegeist.

„Wilhelm Tell“ als blöder Almöhi

Schiller, endlich von Gedankenfreiheit befreit (völlig frei von Don Karlos), geht so: Wilhelm Tell (Paul Schröder) tritt als Tracht tragender, bärtiger, verblödeter Almöhi vor die Bergpanorama-Kulisse und spricht im Schweizer Dialekt „Durch diese chole Gasse muss er chommen.“ Sein Sohn Walter lässt die nationalistischen Tiraden seines Vaters desinteressiert an sich abtröpfeln, pinkelt mal nach hinten in den Bergsee, damit auch möglichst bald einer die Hosen runterlassen kann, denn sonst hätte Schiller ja womöglich nichts Aktuelles.

Da ahnt man direkt, wie es weitergeht, und so geht es dann auch weiter. Aus Walter wird (huch, Doppelrolle) der nette Burgvogt Gessler (Thomas Niehaus). Den interessiert es nicht die Bohne, ob einer seinen Hut grüßt, der hasst die Schweiz, der will zurück in die Zivilisation. Tells Schuss auf den Apfel auf dem Haupt seines Sohnes resultiert aus einem böswilligen Hörfehler des verbohrten Tell, der Schuss auf Gessler geht versehentlich los.

Corona-Bewältigungsscherze auf der Bühne

Anzeige

Nunes hat mit der „Ode an die Freiheit“ übrigens seine vorläufig letzte Inszenierung am Thalia Theater abgeliefert. Er geht aus freiem Entschluss als Schauspieldirektor ausgerechnet ans Theater Basel in der Schweiz. Damit schießt er den Vogel ab.

Erster Corona-Bewältigungsscherz auf der Bühne: Gessler sinkt nieder und Tell, der ihm eigentlich die Hand reichen wollte, reicht ihm die Armbrust – wobei sich endlich aufklärt, warum die am vorderen Ende so einen albernen metallenen Bogen hat – an dem kann sich der Vogt hochziehen. Amüsant, amüsant. Walter bläst noch auf dem Alphorn, wobei nicht klar ist, wie weit das Ding Viren ins Parkett schleudern könnte. Amüsant. Alles kein Drama. Schillers Schatten rutscht übers gletscherkalte Gemüt.

Keiner verlässt den Saal. Wie auch?

Der Abend kennt coronabedingt keine Pause. Die Zuschauer wüssten nicht mal, wie sie den Saal verlassen könnten, wenn sie müssten. Dass jemand das jemals wollen könnte, glaubt das Theater nicht, in den Coronaregeln wird dieser Punkt nicht näher erläutert. Nun ja, bei den Abständen zwischen den Zuschauern muss niemand mehr während der Vorstellung die Darsteller um ihren Spielraum beneiden.

Anzeige

Der Tell also als schlichtes Satyrspiel, als erster Gang, wo sonst ein erster Akt gewesen wäre. Das Satyrspiel folgte in der Antike auf drei Tragödien. Heute folgen auf das Satyrspiel zwei weitere, das ist die Tragödie. Konzeptionell geht die „Ode an die Freiheit“ kaum über ein Schülerstück zu einer Abiturfeier hinaus. Das schauspielerische Niveau aber überragt die Leistung der Regie um Alpenhöhe. Auch sonst arbeiten alle an diesem Theater professionell. Das Bühnenbild von Matthias Koch ist so großformatig wie großartig und die Kostüme von Victoria Behr sind ein Traum.

Arsenlimonade, diesmal für die Eltern

Naheliegenderweise folgt auf den „Tell“ die jüngste Fassung von „Kabale und Liebe“. Schön ist das, wenn man „Kabale und Liebe“ schon mal gesehen hat. Gegen den Strich. Da sitzt die Familie Miller um den Frühstückstisch und spielt das Familiendrama in wechselnder Familienaufstellung und mit Außerhausrollen zu dritt durch, wobei immer mal jener diese und diese jenen abwesenden Darsteller verkörpert. Amüsant. Und dann haben sie noch den Subtext, den sie als solchen identifizieren konnten, in Sprechtext verwandelt.

Nun schimpfen sie ordentlich aufeinander ein. Der Vater, der Musikus Miller (Jörg Pohl) auf seine Frau (Cathérine Seifert) und seine über alles geliebte Tochter Luise (Lisa Hagmeister). Die Eltern Miller schimpfen zudem auf den Major Ferdinand, den die Tochter liebt, auf dessen Vater, den Präsidenten, auf den Herzog, auf dessen Geliebte Lady Milford, die Ferdinand liebt, der Luise liebt. Wenn geküsst wird, dann eine Glasscheibe von beiden Seiten. Amüsant.

„Maria Stuart“ ist nicht totzukriegen

Wenn Vater im ins Rollen gebrachte Rollenspiel Luises Hand greift, so steckt diese in einer dicken Stoffserviette (Corona!). Sehr amüsant. Damit uns das Stück heute noch etwas sagt, vergiftet zum Ende hin Luise ihre Eltern mit Arsenlimonade, statt selbst mit ihrem Ferdinand im Freitod zu scheiden. Dabei murmelt sie etwa: „ihr habt es ja so gewollt.“ So gemein. So frei.

Schiller hat es verdient. Seine Werke sind gemeinfrei, denn er ist länger als 70 Jahre tot. Und er mag ja mal grandios gewesen sein. Jetzt sind es andere. Der dritte Teil der „Ode an die Freiheit des Regisseurs“ aber beweist: Schiller Drama „Maria Stuart“ ist nicht totzukriegen. Schon gar nicht, wenn Barbara Nüsse (Elisabeth) und Karin Neuhäuser (Maria Stuart) die beiden Königinnen spielen. Das ist großes Theater, große Tragödie, ist der Schauplatz bei Nunes auch eine Bushaltestelle. Hier ist nichts lächerlich, nichts mehr nur amüsant.

Fragmentschmerz statt Schauspielgenuss

Der Dialog der beiden großen Rivalinnen um den englischen Thron zählt schlicht zur Weltliteratur, was offenbar die Improvisationsfreiheit in gewisser Weise einschränkt. Erfreulich. Umso mehr schmerzt das Fragment. Mit der Gewissheit, dass hier ein großer Theaterabend möglich gewesen wäre und der erweckten Erinnerung an viele große Premieren endete dieser Abend. Also, fast.

Dann verbeugten sich die Schauspieler und trugen dabei, weil sie sich an den Händen hielten, allesamt Handschuhe. Mit denen fassten sie einander coronagerecht an, bevor Intendant Joachim Lux auf die Bühne trat und seiner Freude über den Neustart unter Pandemiebedingungen Ausdruck verlieh. Damit sprach er nun wirklich allen aus dem Herzen. Denn was wäre ein Theater, das nur Literatur ist, nur Text. Das wären ja alte Stücke in verstaubten Büchern, die niemand mehr zum Leben erweckt.

Hoffnung auf ein Stück von Schiller

Um im Theater kann das ja auch nicht jedes Mal alles gelingen. Einen amüsanten Abend kriegen sie allemal gebacken. Was hat eine „Ode an die Freiheit“ mit ihm zu tun, und was mit uns? Uns bleibt die Hoffnung auf die Freiheit des nächsten Regisseurs. Da jetzt häufiger wieder die Rede von Visieren ist, spielen sie ja vielleicht sogar irgendwann mal wieder Stücke, in denen Ritter vorkommen, möglicherweise sogar eines von Friedrich Schiller.",Stefan Grund,1598895358,"Hamburg,Thalia Theater",welt
Wirecard-Skandal Thema im Finanzausschuss,,,1598894332,"Wirtschaft,Insolventer Zahlungsdienstleister",welt
„China ist hier eine Stütze für die weltweite Konjunktur“,,,1598893426,"Wirtschaft,Einkaufsmanagerindex PMI",welt
Historischer Flug von Tel Aviv nach Abu Dhabi,,,1598891956,"Ausland,Nahost-Friedensprozess",welt
„Staatsversagen auf verschiedenen Ebenen“ – anonymer Hinweis ignoriert,"Ex-Minister, bayerische Ermittler und russische Geheimdienste – sie alle spielen eine fragwürdige Rolle im Wirecard-Skandal. Die Stimmen, die einen Untersuchungsausschuss fordern, mehren sich. Die dann zu erwartende Zeugenliste könnte es in sich haben.

Anzeige

Die Opposition im Bundestag macht weiter Druck bei der politischen Aufarbeitung des Wirecard-Skandals. Die zentrale Frage ist für sie auch nach zig schriftlichen Anfragen bei Ministerien und beim Kanzleramt immer noch unbeantwortet: Warum hat’s keiner gemerkt?

Nicht nur für AfD, FDP und Linke ist ein Untersuchungsausschuss, der bis zur Bundestagswahl im kommenden Jahr arbeiten würde, unerlässlich. Auch die Grünen machten zu Wochenbeginn klar, dass sie ein solches Gremium angesichts der „bemühten, aber insgesamt sehr zähen“ Aufklärung durch die Bundesregierung, wie der Grünen-Politiker Danyal Bayaz sagte, für sehr wahrscheinlich halten. Mit einem Untersuchungsausschuss können zusätzliche Akten eingesehen und Zeugen befragt werden.

Von einem „multiplen Staatsversagen auf verschiedenen Ebenen“ sprach Florian Toncar, finanzpolitischer Sprecher der FDP, vor der zweitägigen Sondersitzung des Finanzausschusses zu Wochenbeginn. So habe es die Finanzaufsicht BaFin lange Zeit trotz klarer Hinweise auf Unregelmäßigkeiten versäumt, die nötigen Schritte zu gehen.

Lesen Sie auch Flüchtiger Wirecard-Manager Der Trick mit Moneta.ru – die Russland-Connection des Jan Marsalek

Anzeige

Die Behörde ist dem Bundesfinanzministerium von Olaf Scholz (SPD) unterstellt. Auch auf Landesebene habe es Versäumnisse gegeben. So sei Verdachtsmeldungen auf Geldwäsche, die es schon vor der Insolvenz des im bayerischen Aschheim angesiedelten Zahlungsdienstleisters gab, nur ungenügend von den bayerischen Ermittlungsbehörden nachgegangen worden.

Der inzwischen insolvente Zahlungsdienstleister Wirecard hatte im Juni Luftbuchungen von 1,9 Milliarden Euro eingeräumt. Die Münchner Staatsanwaltschaft geht davon aus, dass Wirecard seit 2015 Scheingewinne auswies – und ermittelt wegen gewerbsmäßigen Bandenbetrugs. Der Schaden für die kreditgebenden Banken und Investoren könnte sich auf 3,2 Milliarden Euro summieren.

Toncar erwähnte vor allem einen anonymen Hinweis, der laut Angaben des Bundesfinanzministeriums bereits Ende Januar 2019 einging und eigentlich „eine große Aufmerksamkeit verdient gehabt hätte“, so Toncar. Zum genauen Inhalt durfte er sich nicht äußern, da dieser den Abgeordneten in der Geheimschutzstelle des Bundestages offenbart wurde.

Warnhinweise nicht ans Kanzleramt weitergegeben

Anzeige

Im Finanzausschuss rückte zudem ein Aspekt in den Mittelpunkt, der ein Licht auf die Lobbyaktivitäten rund um das Kanzleramt wirft. Bundeskanzlerin Angela Merkel (CDU) hatte bei einer China-Reise im September 2019 für den Markteintritt von Wirecard in China geworben.

Die Kanzlerin hatte darauf verwiesen, dass ihr damals Unregelmäßigkeiten bei Wirecard noch nicht bekannt gewesen seien. Die Opposition verwies darauf, dass es im Herbst 2019 bereits kritische Berichte zu Unregelmäßigkeiten bei Wirecard gab. Unionsabgeordnete verwiesen in dem Zusammenhang dagegen auf das SPD-geführte Finanzministerium sowie die BaFin. Diese hätten „Warnhinweise“ zu Wirecard nicht ans Kanzleramt weitergegeben.

Lesen Sie auch Die Spur des „kluges“ Geldes Der Fluch des Dax – Was hinter der merkwürdigen Schwäche der Neulinge steckt

Die SPD-Politikerin Cansel Kiziltepe sagte dagegen, der „Wirecard-Lobbyismus“ im Kanzleramt sei erschreckend. Aufhorchen lassen in dem Zusammenhang vor allem zwei Namen, die für das einstige Dax-Unternehmen Lobbyarbeit gemacht haben: Ex-Verteidigungsminister Karl-Theodor zu Guttenberg mit seiner New Yorker Beratungsfirma Spitzberg Partners und der Ex-Geheimdienstkoordinator im Kanzleramt, Klaus-Dieter Fritsche.

Anzeige

Guttenberg hatte Anfang September 2019 im Vorfeld der China-Reise mit Merkel gesprochen. Kurz nach der Reise trafen sich auf Vermittlung des ehemaligen Kanzleramtsmitarbeiters Fritsche zudem zwei Wirecard-Vorstände mit Lars-Hendrik Röller, dem obersten Wirtschaftsberater der Kanzlerin. Dieses Gespräch habe „in erster Linie dem gegenseitigen Kennenlernen“ gedient, teilte das Bundesfinanzministerium mit.

Lesen Sie auch Podcast Was Kleinanleger aus der Wirecard-Pleite lernen sollten

„Gerade die Rolle von Herrn Fritsche sehe ich ausgesprochen kritisch“, sagte FDP-Politiker Toncar. Angesichts seiner Einblicke in die Aktivitäten der Geheimdienste stelle sich die Frage, welche Regeln es für Geheimnisträger nach deren Ausscheiden gebe. Die Beamtenversorgung sei auch dafür gedacht, dass verdiente Beamte nach ihrer Pensionierung solche Lobbytätigkeiten nicht mehr übernehmen müssten.

Die Bundesregierung sieht in Fritsches Aktivitäten zumindest keinen Verstoß gegen das Bundesbeamtengesetz. Eine am 23. Juli 2020 veranlasste Prüfung der Tätigkeit des ehemaligen Staatssekretärs habe ergeben, dass die Tätigkeit keiner Anzeigepflicht unterlag, heißt es in einer schriftlichen Antwort des Finanzministeriums auf Fragen der Fraktion Die Linke.

Die Finanzexpertin der Grünen, Lisa Paus, kritisierte die Regierung für ihren „blauäugigen“ Umgang mit Lobbyisten. „Wenn man in Deutschland die Unterstützung der Bundesregierung haben will, dann muss man sich offenbar an ehemalige Minister und Staatssekretäre wenden“, sagte die Obfrau der Grünen im Finanzausschuss nach der Befragung von Mitarbeitern des Bundeskanzleramts im Ausschuss.

Nachrichtendienstliche Bezüge zu Wirecard

Dann bekomme man offenbar einen Freifahrtschein für Termine mit Ministern oder Kanzlerinnen, die dann dazu führen, dass die Bundesregierung sich einem anderen Land gegenüber einsetzt.

Die Brisanz dieser Personalie rührt auch daher, dass dem per internationalen Haftbefehl gesuchten Ex-Wirecard-Vorstand Jan Marsalek Verbindungen zu ausländischen Geheimdiensten nachgesagt werden. Wie das „Handelsblatt“ unter Berufung auf Bekannte Marsaleks berichtete, befindet er sich auf einem Anwesen nahe Moskau. Dort stehe er unter Aufsicht des russischen Auslandsgeheimdienstes SWR.

In der Sondersitzung des Finanzausschusses teilte ein Vertreter des Kanzleramts mit, dass sich deutsche Geheimdienste in der Vergangenheit nicht mit dem pleitegegangenen Zahlungsabwickler Wirecard und dessen Vorstand beschäftigt hätten. Hierzu habe es weder eine gesetzliche Grundlage noch einen Anlass gegeben, sagte Staatsminister Hendrik Hoppenstedt laut Teilnehmern. Mittlerweile gebe es Prüfungen.

Lesen Sie auch Wirecard Die Betrugsmaschine bestand sogar den 50-Millionen-Euro-Test

Anzeige

„Ein Untersuchungsausschuss zu Wirecard ist zwingend erforderlich, um volle Akteneinsicht zu erhalten und auch etwaige nachrichtendienstliche Bezüge zu Wirecard auszuleuchten“, sagte der Linke-Finanzexperte Fabio De Masi. Linke und FDP sprechen sich seit Wochen für einen Untersuchungsausschuss aus. Sie wollen ihn allerdings nicht zusammen mit der AfD beschließen.

Um das notwendige Quorum von 25 Prozent der Abgeordneten zu erreichen, sind sie deshalb auf die Grünen angewiesen. Das Gremium könnte sich dann noch im September konstituieren, bis Ende Oktober Akten anfordern und womöglich im November schon erste Zeugen befragen.

Auf der Zeugenlisten könnten dann neben SPD-Kanzlerkandidat und Finanzminister Scholz und Wirtschaftsminister Peter Altmaier (CDU) auch Kanzlerin Merkel stehen. Bis zum Sommer 2021 könnte dann ein Abschlussbericht vorliegen – also kurz vor der Bundestagswahl.",Karsten Seibel,1598891731,"Wirtschaft,Wirecard",welt
