title;text
Die Gefahr, Opfer von Cyber-Attacken zu werden, hat im Laufe des vergangenen Jahres ein neues Rekordniveau erreicht. Wie der aktuelle Sicherheits-Jahresbericht des US-amerikanischen IT-Riesen Cisco http://cisco.com zeigt, kam es 2013 zu derart vielen Angriffen auf Netzwerke," Datendiebstählen und Betrugsfällen wie noch nie seit Beginn der Aufzeichnungen im Mai 2000. Dem """"Annual Security Report 2014"""" zufolge ist die allgemeine Verwundbarkeit 2013 im Vergleich zu 2012 um satte 14 Prozent gestiegen. Die neue Größenordnung der Bedrohung zeigt sich auch bei den 30 größten multinationalen Unternehmensnetzwerken"," deren generierter Web-Traffic laut dem Bericht zu 100 Prozent mit Malware verseucht sein soll.""""Cyber-Kriminalität hat sich von eher simplen Attacken mit überschaubarem Schaden zu einem organisierten Verbrechen entwickelt", das ausgeklügelte Strategien anwendet, bestens finanziert wird und in der Lage ist," signifikante wirtschaftliche und rufschädigende Konsequenzen für Opfer im öffentlichen und privaten Sektor anzurichten""""", so das ernüchternde Resümee der Cisco-Sicherheitsexperten. Zweck der Angriffe sei der versuchte Zugriff auf strategisch positionierte Web-Server und Datenzentren mit dem Ziel," die eingesetzte Malware auf so viele Teile der betroffenen Netzwerkinfrastruktur zu verstreuen wie nur möglich. """"Durch dieses Vorgehen untergraben die Angreifer das ganze Vertrauen in alles und jeden"," der mit dieser Infrastruktur verbunden ist""""", betont der Bericht.Neue AngriffsmöglichkeitenAls besonders besorgniserregend sehen die Security-Experten das Gefahrenpotenzial im Bereich von großen multinationalen Unternehmensnetzwerken. So hat eine sicherheitstechnische Überprüfung von insgesamt 30 namhaften Firmen," die in der Top-500-Liste des US-Wirtschaftsmagazins """"Fortune"""" zu finden sind", ergeben, dass sich in jeder einzelnen untersuchten Netzwerkinfrastruktur gefährliche Sicherheitslücken verstecken," die Nutzer auf bösartige Malware-Seiten weiterleiten.Als Ursachen für den drastischen Anstieg der Sicherheitsbedrohung sieht der Bericht nicht zuletzt die neuen technologischen Angriffsmöglichkeiten. """"Neue Geschäftsbereiche wie Cloud und Mobile Computing erweitern die Angriffsfläche rapide"""""," stellt Cisco klar. Im letztgenannten mobilen Bereich sei 2013 ein """"enormer Malware-Zuwachs"""" registriert worden. """"99 Prozent der Attacken in diesem Zusammenhang betreffen Android-Geräte""""", ergänzt das Unternehmen. Beide Ergebnisse werden auch von anderen Studien bestätigt (pressetext berichtete: http://pte.com/news/20131009013 ).Düstere Zukunft des InternetsWas die Bedrohungen und Problematiken aufgrund der wachsenden Internet-Kriminalität betrifft, hat Cisco bereits des Öfteren ein überaus düsteres Bild der Situation und der zukünftigen Entwicklung gezeichnet. Schon 2010 hatte der Netzwerkspezialist etwa prognostiziert, dass bis zum Jahr 2025 sowohl Privatpersonen als auch Unternehmen aus Angst vor böswilligen Attacken das Internet meiden werden und der Datenverkehr im Web ins Stocken geraten soll (pressetext berichtete: http://pte.com/news/20100903028 ). Für diese Misere wurden damals auch Organisationen und Regierungen verantwortlich gemacht," die mit der Professionalität und der Vielzahl der kriminellen Aktivitäten im Netz einfach überfordert seien."""
"Forscher weisen Lungenkrebs mit Atemtest nach;""Luftmessung identifiziert Krebs zu 95 Prozent und erübrigt Biopsien"
Forscher haben bei Tests der Atemluft von Personen krebsspezifische Substanzen erkannt. Falls die noch nicht veröffentlichten Studienergebnisse halten, was die Pretests versprechen, könnten bald auch Biopsieverfahren bei der Krebsgeschwür-Diagnose der Vergangenheit angehören. Die sogenannten Carbonyle im Atem können dabei Aufschluss geben, ob verdächtige Lungenläsionen, die im CT erkannt wurden, bösartig sind.Carbonyl-Niveau entscheidendDie Maschine, welche die Atemluft auf vier krebsspezifische Substanzen testet, wurde an der Universität in Louisville http://louisville.edu entwickelt. Die Tests haben ergeben, dass ein erhöhter Gehalt bei drei von vier Carbonylen in 95 Prozent der Fälle die Diagnose Lungenkrebs ergab, während normale Niveaus dieser Substanzen ein nicht krebsartiges Geschwür in 80 Prozent der Fälle voraussagte.Gemäß der Studie sank das Carbonyl-Niveau bei Krebspatienten nach einer Operation, bei der der Krebs entfernt wurde," auf ein normales Level. Den Vorteil dieser Diagnosemethode erklärt Studien-Autor Michael Bousamra: """"Anstatt", dass Patienten anstrengende Biopsie-Prozeduren über sich ergehen lassen müssen, wenn ein verdächtiges Gewächs in der Lunge identifiziert wurde, zeigt unsere Studie, dass die ausgeatmete Luft allein genügt, um zu entscheiden," welcher der Patienten eine sofortige Operation benötigt."""""""
"Kostenexplosion drückt Gewinne von Ölmultis;""2013 mehr als 90 Mrd. Euro Ausgaben zur Erhöhung der Fördermengen"
Die drei Ölkonzerne Chevron http://chevron.com , ExxonMobil http://exxon.com und Royal Dutch Shell http://shell.com haben 2013 zusammen knapp 90 Mrd. Euro ausgegeben, um ihre Öl- und Gasfördermengen zu erhöhen. Jedoch können die Unternehmen im Verhältnis zu ihren Ausgaben kaum Erfolge vorweisen. Bei den Jahresergebnissen werden folglich starke Gewinnrückgänge erwartet, berichtet das Wall Street Journal.Neue ÖlquellenEines der größten Probleme sind die wachsenden Kosten vieler neue Megaprojekte. Pläne für eine Bohrinsel im Kaspischen Meer kosten dem Konsortium von ExxonMobil und Shell 30 Mrd. Euro. Im Original-Budget ging man von umgerechnet etwa 7,"5 Mrd. Euro aus. Der Preis für ein Joint-Venture-Erdgasprojekt der drei Unternehmen in Australien mit dem Namen """"Gorgon"""" schwoll um 45 Prozent auf 40 Mrd. Euro an.Shell investiert etwa 7",5 Mrd. Euro in eine noch unerprobte Technologie, um eine Erdgasanlage auf einem großen Schiff aufzubauen, womit es möglich ist, die Erde auch in abgelegenen Plätzen anzuzapfen. In den zurückliegenden fünf Jahren haben die Ölkonzerne etwa 365 Mrd. Euro für die Exploration neuer Ölquellen ausgegeben.Teure KonzessionenDie produktivsten und langlebigsten Öl- und Gasförderflächen sind meist im Besitz von Staaten wie Venezuela oder Saudi Arabien. Daher müssen die Ölkonzerne immer tiefer in ihre Taschen greifen und bringen damit auch ihre normalerweise so verlässlichen Profitmargen in Gefahr. Allein die Beschaffung von Eigen- und Fremdkapital kostete Exxon 2013 etwa 30 Mrd. Euro.Auch, dass sich die drei Ölgiganten zu spät dem Boomthema Schiefergas gewidmet und dieses Feld kleineren Unternehmen überlassen haben, trägt mit dazu bei, dass kaum jemand bezweifelt, dass die Ölfirmen für 2013 einen Gewinnrückgang im Jahresbericht verzeichnen werden.Düstere VorahnungenLaut Analysten wird der kombinierte Gewinn von Chevron, ExxonMobil und Shell ungefähr 50 Mrd. Euro ergeben. 2012 betrug dieser etwa 20 Mrd. Euro mehr. Zu Beginn des Monats gab Shell seine erste Gewinnwarnung seit zehn Jahren aus. Die Jahreserträge werden voraussichtlich bei 12,3 Mrd. Euro liegen. Knapp 20 Mrd. Euro betrugen sie noch 2012. Die Jahresergebnisse für 2013 von ExxonMobil und Shell werden am Donnerstag bekannt gegeben, Chevron folgt mit seinen Ergebnissen morgen, Freitag.Die Verantwortlichen der Ölfirmen sind aber weiter optimistisch. ExxonMobil und Chevron wollen mit ihren Megaprojekten innerhalb der nächsten drei Jahre durchstarten. Und Shell will seinen Fokus nach der Gewinnwarnung wieder mehr auf die Profitabilität lenken und nicht so sehr die Produktivität seiner Ölfelder steigern.Experten sind jedoch skeptisch, wenn Ölfirmen versprechen," weniger in die Exploration neuer Ölfelder zu investieren. Denn der weltweite Wettkampf um neue Ölfelder geht ungebrochen weiter. """"Wenn man nicht investiert"," schrumpft man""""", meint dazu Dan Pickering, Präsident von Pickering Holt http://tphco.com ," einer Investmentbank in Houston."""
"Österreichs Tourismusforschung: Noch zeitgemäß?;""Travel Industry Club Networking-Abend am 21. Februar in Wien"
Marktanteilsverluste und Fachkräftemangel, Ungleichbehandlung bei der Energieabgabenrückvergütung, fehlender Stellenwert in der Politik und sinkende Tourismusgesinnung im Land. Droht Österreich seine führende Rolle im internationalen Tourismus zu verspielen? Laut WIFO ist Österreich mit Einnahmen von 1.752 Euro pro Kopf und Jahr noch Tourismusweltmeister. Im Report des World Economic Forums hingegen ist unser Land bezogen auf 15 Kriterien wie etwa Infrastruktur, Ausbildung, Sicherheit, Preisniveau, Sauberkeit und ökologischer Nachhaltigkeit bereits aus den Top 3 rausgeflogen. Vorne liegen die Schweiz, Deutschland, Frankreich und Schweden. Was ist passiert? Und was sagt die Tourismusforschung dazu?Der Travel Industry Club Austria (TIC-A), ein Think Tank von Meinungsbildnern und Entscheidern in der Reiseindustrie, beklagt, dass die F&E-Anstrengungen; der volkswirtschaftlichen Bedeutung des Tourismus in Österreich nicht mehr gerecht werden. Selbst Touristiker nehmen die Forschungsbemühungen entweder nicht wahr oder zeigten sich uninteressiert. Eine besondere Herausforderung stellt dabei die Grundlagenforschung dar, so TIC-Experten. http://www.travelindustryclub.de/Auf seinem nächsten Networking Event am 21. Februar in Wien diskutiert der Travel Industry Club mit Experten aus der Wissenschaft den Status und die Entwicklungsmögichkeiten der touristischen Forschung in Österreich (Hotel Le Meridien, ab 18.30 Uhr). Dr. Peter Laimer von der Statistik Austria wird eine 20-minütige Keynote zu den relevanten Forschungsausgaben geben. An der anschließenden Podiumsdiskussion nehmen u.a. Univ. Prof. Dr. Karl Wöber, Rektor der Modul University, Mag. Daniela Wagner und Dr. Christian Steckenbauer von der FH Krems und Mag. Dietmar Kepplinger von der Kondeor GmbH teil. Der Abend wird von Michael Kerbler vom Verein Kritischer Tourismus 2030 moderiert. Information: Harald Hafner, Präsident Travel Industry Club Austria 
"harald.hafner@hotmama.at; +43 (0) 6764169523"""
"""Holodeck""-Technologie bis 2024 ausgereift;""Experten warnen: """"User werden davon überfordert sein"""""
"Die virtuelle Simulation beliebiger Räume und Umgebungen nach dem Vorbild des aus der Science-Ficton-Reihe """"Star Trek"""" http://startrek.de bekannten """"Holodecks"""" wird spätestens bis zum Jahr 2024 technologisch ausgereift sein. Wenn die entsprechende Technik erst einmal Massentauglichkeit erreicht hat", dürfen sich die User über ein vollkommen neues Erlebnis von Video- und Computerspielen, Filmen, Präsentationen und Fotos freuen. Mit Versprechen wie diesen sorgen derzeit verschiedene Unternehmen aus der Computer- und Filmbranche für Aufsehen," die mit Hochdruck an der Umsetzung solcher Hologramme arbeiten. """"Viele User werden davon aber einfach überfordert sein"""""," befürchten hingegen viele Kritiker.Geteilte Meinungen""""So gerne ich auch hin und wieder einen Ego-Shooter spiele - Ich bin nicht sicher", dass es mir gefallen wird," durch eine Kriegszone zu rennen und lebensecht mit Blut und Gehirnteilen im Gesicht bespritzt zu werden"""""," bringt New-York-Times-Journalist Nick Bilton die Bedenken so mancher Experten auf den Punkt. Nicht jeder sei an einem derart intensiven virtuellen Erlebnis interessiert.""""Für viele ist das bestimmt zu viel Realität"""""," ist Bilton überzeugt. Aufgrund der Überreizung müssten dann wohl einige Spieler in """"virtuelle Therapie"""" geschickt werden"," vermutet der US-Branchenkenner. """"Die Umsetzung derartiger Hologramm- und Virtual-Reality-Technologie ist allgemein betrachtet ein zukunftsträchtiges Konzept""""", meint Game-Experte Hans Solar auf Nachfrage von pressetext. Zum jetzigen Zeitpunkt sei man allerdings von einer Massentauglichkeit noch weit entfernt.Experimente bei AMDDass die Entwicklung in Richtung Holodeck dennoch mit großen Schritten voranschreitet, zeigen verschiedene Projekte und Initiativen. Bestes Beispiel hierfür ist etwa der kalifornische Chip-Hersteller AMD http://amd.com , der eigenen Angaben zufolge bereits mit einer frühen Version der neuartigen Technologie experimentiert.So hat man im Hauptquartier in Sunnyvale in einer riesigen Kuppel einen Prototyp installiert, der mittels mehrerer spezieller Projektoren, Surround-Soundanlage und Augmented Reality versucht," die reale Welt in einer neuen Qualität zu simulieren. """"Noch vor zehn Jahren war es lediglich ein Traum. Jetzt fühlt es sich so an", als wären wir nicht mehr weit davon entfernt," dieses Ziel zu erreichen""""", wird Phil Rogers, Corporate Fellow bei AMD, zitiert.Filme als beliebte VorlageWenn es um die Entwicklung revolutionärer neuer Technologien geht," greifen Forscher und Computeringenieure offenbar besonders gerne auf Science-Fiction-Visionen aus bekannten Hollywood-Filmen zurück. Das Holodeck aus """"Star Trek"""" ist hier nur eines der prominentesten Beispiele.Daneben arbeiten findige Köpfe etwa auch an der Umsetzung einer innovativen dreidimensionalen Gestensteuerung"," wie sie im Zukunftsstreifen """"Minority Report"""" zu sehen ist (pressetext berichtete: http://pte.com/news/20120731025 ). Sogar das berühmte """"Hoverboard"""" aus """"Zurück in die Zukunft"""" soll nun per Crowd-Funding-Kampagne http://bit.ly/1by93eL auf Indiegogo endlich Realität werden."""
"""Snowden-Effekt"": Nutzer zensieren sich selbst;""Verzicht auf Suchanfragen und elektronische Kommunikation"
Die Aufdeckung der weltweiten Überwachungs- und Spionagepraktiken des US-Geheimdienstes NSA http://www.nsa.gov durch den Whistleblower Edward Snowden hat gravierende Auswirkungen auf das Sicherheitsbewusstsein der Internetnutzer. Diese Vermutung legt zumindest eine aktuelle Untersuchung aus Norwegen nahe," die von der Regierungsbehörde Norwegian Data Protection Authority (NDPA) http://datatilsynet.no vorgelegt worden ist und einen deutlichen """"Snowden-Effekt"""" aufzeigt. Demnach verhalten sich norwegische User seit der Überwachungsaffäre weitaus vorsichtiger im Cyberspace", zensieren sich selbst," vermeiden immer häufiger konkrete Suchanfragen und versuchen wenn möglich sogar vollends auf eine elektronische Kommunikation zu verzichten.Stärkeres Bewusstsein""""Ich muss sagen", ich bin wirklich erstaunt über die abkühlende Wirkung, die durch unsere Zahlen belegt wird. Wir sehen hier die ersten Anzeichen dafür, dass die Leute damit angefangen haben, sich in Bezug auf das, was sie im Internet tun," selbst zu beschränken""""", erklärt NDPA-Direktor Bjoern Erik Thon anlässlich der Veröffentlichung des aktuellen Berichts.Verantwortlich dafür sind die Enthüllungen von Edward Snowden (pressetext berichtete: http://pte.com/news/20130611026 ), die bei den Usern endgültig das Gefühl gestärkt hätten," sich um eine stärkere Kontrolle der eigenen Daten kümmern zu müssen. """"Ein signifikanter Teil von vollkommen durchschnittlichen Bürgern ist nun dazu übergegangen"," die eigenen Worte selbst zu zensieren""""", betont Thon.Sorge um PrivatsphäreWie weit die allgemeine Bereitschaft zur Selbstzensur geht, wird anhand verschiedener Kennzahlen verdeutlicht. So haben von insgesamt 1.501 befragten Personen 46 Prozent angegeben, seit den Snowden-Aufdeckungen wesentlich beunruhigter in Bezug auf die eigene Privatsphäre im Netz zu sein. Rund 16 Prozent verzichten seitdem etwa auf spezifische Suchanfragen im Web, da sie nicht sicher sein könnten, dass diese Informationen vielleicht zu einem späteren Zeitpunkt gegen sie verwendet werden. Ein Viertel der Teilnehmer ist bereits dazu übergegangen, elektronische Kommunikationsmittel wenn möglich gänzlich zu meiden und stattdessen wieder das persönliche Gespräch zu suchen.Was das generelle Sicherheitsbewusstsein betrifft, sei ein signifikanter Anstieg zu bemerken. Laut dem Bericht geben satte 87 Prozent der Befragten an," """"sehr"""" oder """"ziemlich"""" besorgt um die eigene Privatsphäre im Internet zu sein. 1997 lag der Vergleichswert noch bei 77 Prozent. Aufgeteilt auf die verschiedenen Geschlechter und Altersgruppen zeigt sich", dass vor allem jüngere Nutzer zunehmend in puncto Datenschutz aktiv werden. Faktoren wie Geschlecht und Bildungsgrad scheinen in diesem Zusammenhang hingegen keine gravierende Rolle zu spielen.Effekt bestätigtDass der Fall des US-Whistleblowers tatsächlich einen spürbaren Effekt auf das Nutzerverhalten im Web hat, wird nicht nur durch den NDPA-Bericht bestätigt. Erste Anzeichen dafür fand auch das Internet Project des Pew Research Centers in den Reihen der US-User. Von ihnen sollen inzwischen bereits 86 Prozent aktiv Schritte gesetzt haben, um ihre Spuren im Netz zu verwischen (pressetext berichtete: http://pte.com/news/20130906010 ). Auch dass gerade jüngere Menschen sich seit der Affäre stärker Gedanken über ihre Online-Präsenz machen, ist eine Erkenntnis," die erst kürzlich durch eine Studie von Harris Poll Online zutage gefördert worden ist (pressetext berichtete: http://pte.com/news/20131119003 )."""
"Bildung als Schlüssel im Kampf gegen die Armut;""Adveniat eröffnet bundesweite Weihnachtsaktion der katholischen Kirche"
Wo Bildung fehlt, schwinden Sinn und Mut zum Leben. Wo Bildung fehlt, schwinden die Aufmerksamkeit und Wachheit für Entwicklungsmöglichkeiten und Perspektiven. Wo Bildung fehlt," verlieren die Menschen Gegenwart und Zukunft gleichermaßen."""" Das hat der Bischof von Osnabrück", Franz-Josef Bode," am 1. Dezember betont. Im Dom zu Osnabrück hielt Bischof Bode die Predigt beim Eröffnungsgottesdienst der diesjährigen Weihnachtsaktion der katholischen Kirche. Unter dem Motto """"Hunger nach Bildung"""" stellt Adveniat", das Lateinamerika-Hilfswerk der katholischen Kirche in Deutschland, in diesem Jahr das Thema Bildungsgerechtigkeit für die Menschen in Lateinamerika und der Karibik in den Mittelpunkt. Gemeinsam mit Bischof Bode feierten unter anderem der Erzbischof von Concepción in Chile, Fernando Chomalí, der Vorsitzende der Bischöflichen Kommission Adveniat, Bischof Franz-Josef Overbeck, und Adveniat-Geschäftsführer Prälat Bernd Klaschka den Gottesdienst mit vielen weiteren Gästen aus Lateinamerika und Deutschland. Bischof Bode nahm in seiner Predigt Bezug auf Papst Franziskus und rief die Gläubigen dazu auf," """"die gegenwärtige Zeit"""" zu bedenken und nicht nur um sich selbst zu kreisen", sondern dorthin zu gehen," """"wo Menschen hungern und dürsten nach Gerechtigkeit"""". Das heiße", besonders zu denen zu gehen," """"die hungern und dürsten nach Bildung", Begleitung und Beistand," um den Herausforderungen des Lebens gewachsen zu sein"""". Es gelte", Menschen in der Nähe, aber besonders auch in der Ferne Bildungschancen zu eröffnen, sagte Bischof Bode. Gefragt sei eine Bildung," """"die den ganzen Menschen mit Leib und Seele", mit seinen Schwächen und Stärken, mit seinem Suchen und Sehnen," seinen Ängsten und Hoffnungen anspricht"""". Viele Menschen", so kritisierte der Bischof, hätten aber heute ihre Augen, Ohren und Herzen verschlossen vor dem Schrei der Menschen nach Bildung, Gerechtigkeit, Frieden und Liebe. Notwendig sei es aber," in der Adveniat-Aktion die """"Aufmerksamkeit"," Solidarität und Liebe neu entfachen zu lassen für die Menschen in Lateinamerika"""".José Argüello Lacayo", Laien-Theologe aus Nicaragua, ging auf die Situation in seiner Heimat ein. Er berichtete," dass dort in den sehr großflächigen Pfarreien Seelsorge nur möglich sei und Kirche nur präsent sein könne durch die Mitarbeit Hunderter Laien-Gemeindeleiter vor Ort. """"Obwohl sie in extremer Armut leben", organisieren sie Sonntag für Sonntag Wort-Gottes-Feiern. Sie legen die Heilige Schrift aus und versuchen, das Leben ihrer Gemeinden aufzuhellen," indem sie ihnen ihre wesentlichen Herausforderungen aufzeigen""""", sagte Argüello. Er gehört zu denjenigen, die drei bis vier Mal pro Jahr bis zu 1.000 Laien-Gemeindeleiter fortbilden und qualifizieren. Dabei versuchten sie," das Wort Gottes im Kontext alltäglicher Probleme zu betrachten. """"Wir sprechen eine einfache Sprache und gehen von den persönlichen Erfahrungen der Kursteilnehmer aus""""", sagte er. Und der Erfolg gibt diesem Vorgehen offensichtlich Recht. Denn die Gemeindeleiter würden etwa vor Ort die Menschen auch für Themen wie Umweltschutz oder ein friedliches Miteinander der verschiedenen Kulturen sensibilisieren, berichtete der Gast aus Nicaragua.Am Ende des Gottesdienstes dankte Bischof Overbeck den Gläubigen für ihre Spenden für die Menschen in Lateinamerika. Er betonte, dass es beim Thema Bildungsgerechtigkeit in Lateinamerika um ganzheitliche Bildung für alle und um die Frage gehe, wie christliche Werte vermittelt werden könnten. Der Bischof beklagte," dass die Schere zwischen Reich und Arm in Lateinamerika besonders groß sei. """"Den Armen wird der Zugang zur Bildung oft verweigert oder unmöglich gemacht"," weil die Ausbildung viel Geld kostet""""", kritisierte er. Papst Franziskus habe die Kirche aufgefordert, gerade bei den Armen an den Rändern der Gesellschaft zu wirken. In diesem Zusammenhang erinnerte Bischof Overbeck daran, dass der heutige Papst als Erzbischof von Buenos Aires Projektpartner von Adveniat gewesen sei und Bildungsprojekte insbesondere für junge Menschen angestoßen habe. Adveniat, das Lateinamerika-Hilfswerk der katholischen Kirche in Deutschland, steht für kirchliches Engagement an den Rändern der Gesellschaft und an der Seite der Armen. Dazu arbeitet Adveniat entschieden in Kirche und Gesellschaft in Deutschland. Getragen wird das Werk von Hunderttausenden Spenderinnen und Spendern - vor allem auch in der Weihnachtskollekte am 24. und 25. Dezember. Adveniat finanziert sich zu etwa 95 Prozent aus Spenden. Und die Hilfe wirkt: Im vergangenen Jahr konnten rund 2.700 Projekte gefördert werden, die mit einer durchschnittlichen Fördersumme von 13.000 Euro genau dort wirken, wo die Hilfe am meisten benötigt wird: an der Basis," direkt bei den Armen. Unter http://ww.adveniat.de/mediaportal stehen ab mittags Fotos zum kostenfreien Download bereit."""
"Social-Business-Plattform Smarp erhält Finanzspritze;""Investoren geben 225.000 Euro - Asien-Expansion mittelfristig im Fokus"
Die finnische Social-Business-Plattform Smarp http://smarpshare.com hat in einer Investitionsrunde 225.000 Euro einsammeln können und damit den Weg für weitere Expansionen geebnet. Mit den zusätzlichen Mitteln will das Start-up, bei dem Angestellte von Firmen motiviert werden sollen, arbeitgeberbezogene Inhalte in ihren persönlichen sozialen Netzwerken zu verbreiten, in Richtung Asien gehen, so das Fachmagazin Arcticstartup.Mitmachen bringt PreiseArbeitnehmer dazu ermuntern, ihren Arbeitgeber stärker in ihre sozialen Netzwerke wie LinkedIn oder Facebook zu integrieren, erfolgt mittels eines einfachen Spiels. Je mehr Arbeitgeberinhalte der Angestellte in seinen persönlichen sozialen Welten inkludiert, desto mehr Punkte bekommt er. Solche unternehmensbezogene Inhalte können zum Beispiel Blogs des Unternehmens, neue Produkte oder Rekrutierungsnachrichten der Firma sein.Die Mitarbeiter mit den meisten Punkten werden dafür mit einem Preis belohnt. Was für ein Preis das ist, hängt wiederum vom Unternehmen selbst ab. Zusätzlich erlaubt Smarp den Arbeitgebern, die Effektivität der Nachrichten zu überprüfen, die die Mitarbeiter über die Netzwerke verbreiten. Das Business-Modell hat sich nun bereits in Skandinavien und auch in Großbritannien etabliert.International erfolgreichDie Investoren halten dem Start-up aus Helsinki weiter die Stange. So berichten Unternehmen wie Metso http://metso.com , Caverion http://caverion.com oder Dreambroker http://dreambroker.com bereits von guten Ergebnissen, die durch die Nutzung von Smarp erzielt wurden. Die knappe Viertel Mio. Euro, die vom Venture-Kapitalisten Frontier http://frontier.fi bereitgestellt wurde, soll für die Expansion verwendet werden.Vor allem die Märkte des Mittleren Ostens sowie Asiens sollen nun erobert werden. Dabei soll auch die spezielle Expertise von Frontier in diesen Märkten helfen. So meint der Smarp-Chef Roope Heinilä," dass die erfolgreiche Investitionsrunde den internationalen Erfolg von Smarp verbessern und beschleunigen wird. """"Außerdem wird natürlich auch an der Weiterentwicklung des Smarpshare-Service gearbeitet"""""," so Heinilä abschließend."""
"Kinderschutz gegen Ausbeutung bleibt topaktuell;""ECPAT Österreich begeht zehnten Geburtstag - Erst Teilerfolge erzielt"
