title;text
Ich würde mir wünschen," dass es unsere Organisation in zehn Jahren gar nicht mehr geben muss""""", meint ECPAT-Geschäftsführerin Astrid Winkler http://ecpat.at im pressetext-Interview anlässlich des zehnten Geburtstags der Organisation. ECPAT hat es sich auf die Fahnen geheftet," etwas für den Schutz Minderjähriger vor sexueller Ausbeutung zu tun. """"Es ist viel geschehen in den vergangenen Jahren"," aber es bleibt weiterhin viel zu tun"""""," betont Winkler.""""Die Arbeit von ECPAT Österreich wird vom Grundsatz geleitet"," dass jedes Kind Anspruch auf umfassenden Schutz vor allen Formen der kommerziellen Ausbeutung und des sexuellen Missbrauchs hat""""", zitiert Winkler die UN-Kinderrechtskonvention. Die NGO fordert alle Bürger dazu auf, nicht wegzuschauen, sondern Websites," Inserate oder sonstige Hinweise auf Kinderpornografie bei der Meldestelle der Interpol Meldestelle@interpol.at anzuzeigen. Dabei sind auch anonyme Meldungen möglich.Jeder ist aufgefordert zu reagieren""""Seit Oktober 2010 gibt es die Möglichkeit"," Beobachtungen und verdächtige Situationen in Österreich oder im Ausland an die Experten des Bundeskriminalamtes zu melden"""""," so Winkler. """"Damit kann jeder Reisende dafür sorgen"," dass Kindesmissbrauch im Ausland und Kindersextourismus nicht als Kavaliersdelikte abgetan werden."""" Das gelte nicht nur für Prostitution"," sondern für alle Delikte gegen Kinder und minderjährige Jugendliche.""""Wenn einem im Urlaub etwas Verdächtiges auffällt", kann man an Ort und Stelle mit der Reiseleitung des Reiseveranstalters, dem Hotel, der Vertretung Österreichs im Urlaubsland wie Botschaft und Konsulat, oder mit der Touristenpolizei in Kontakt treten. Täter gehen oft davon aus," dass sie im Ausland nicht verfolgt werden"""""," weiß Winkler.Wie massiv das Thema """"sexuelle Ausbeutung und Kindesmissbrauch"""" tatsächlich ist", zeigen Zahlen der UNICEF. Demnach sind rund 150 Mio. Mädchen und 73 Mio. Jungen unter 18 Jahren von sexueller Gewalt betroffen. Geschätzte 1,8 Mio. Kinder werden zur Prosititution und Pornografie gezwungen. 1,2 Mio. Kinder werden weltweit wie Waren - häufig mit dem Ziel der Zwangsprosititution - verkauft.Großes kriminelles Business: Sex mit KindernSex mit Kindern ist ein globales Geschäft, das jährlich mehrere Mrd. Dollar in die Kassen krimineller Netzwerke spült, bestätigt auch Katlijn Declercq," Vorsitzende von ECPAT International http://ecpat.com . """"Ein weiteres schreckliches Verbrechen ist der zunehmende globale Menschenhandel", von dem natürlich auch Kinder betroffen sind," und die stark zunehmende Kinderpornografie im Internet.""""""""Kinderpornografie im Netz hat mittlerweile solche Dimensionen erreicht", dass zu jedem beliebigen Zeitpunkt schätzungsweise 750.000 Konsumenten kinderpornografisches Material im Netz ansehen. ECPAT fordert daher, Präventionsmaßnahmen zu verstärken. Dazu gehört etwa die Suchmaschinen-Blockierung," die eine Suche erschwert.Gesteigerte mediale Aufmerksamkeit als ErfolgDie mediale Aufmerksamkeit für das Thema """"sexuelle Ausbeutung von Kindern"""" ist laut Winkler gestiegen. Zudem wurden auch die gesetzlichen Rahmenbedingungen mit den EU-Richtlinien zur Bekämpfung von sexueller Ausbeutung von Kindern sowie zur Bekämpfung des Menschenhandels", die sich speziell mit den Anliegen von Kindern als Betroffene des Menschenhandels beschäftigt," verbessert.""""In Bezug auf sexuelle Ausbeutung von Kindern im Tourismus zählt vor allem die über mehrere Länder laufende Kampagne 'Gegen das Wegsehen' (als YouTube-Link angehängt) und die Kenntnis der Meldestelle für Verdachtsfälle von sexuellem Missbrauch zu den Erfolgen""""", so die Expertin abschließend im pressetext-Interview.EU-Richtlinien zur Bekämpfung von sexueller Ausbeutung von Kindern und des Menschenhandels:
"http://ecpat.at/fileadmin/download/EU-Richtlinie_gegen_Kindesmissbrauch_Nov2011.pdf http://ecpat.at/fileadmin/download/EU_Richtlinie_Menschenhandel_2011.pdf"""
"Vogel-Drohne ""Maveric"" revolutioniert Aufklärung;""Vom Boden aus kaum als Maschine zu erkennen - Einsatz in US-Militär"
Drohnen, die aussehen wie Vögel," setzt das US-Militär neuerdings ein. Als Tool für seine Kampfsoldaten hat das Pentagon bei der US-Firma Prioria Robotics http://prioria.com nun 36 sogenannte """"Maverics"""" bestellt", wie das Technologie-Magazin Wired berichtet. Die Drohnen können von einem einzelnen Soldaten verwendet werden und sollen für Aufklärungszwecke bei Spezialoperationen noch im Dezember zum Einsatz kommen.Einhändiger Start möglichDas Problem mit bisherigen Drohnen ist," dass sie eben aussehen wie Drohnen. Folglich waren sie bislang leicht zu erkennen und damit eine einfache Zielscheibe. Die Vogel-Optik schafft Abhilfe. Das Hightech-Fluggerät wiegt nur rund ein Kilogramm und lässt sich mit nur einer Hand in die Luft befördern. Der künstliche Vogel erreicht eine Spitzengeschwindigkeit von 105 Kilometern in der Stunde.""""Es gab eine Anforderung von Spezialeinheiten für ein Fluggerät"," das natürlich und biologisch aussieht""""", erklärt Derek Lyons von Prioria Robotics. Nach Angaben der Firma trainieren Spezialkräfte bereits mit Maveric," der pro Einheit zwischen 100.000 und 200.000 Dollar kostet. Die Drohne kann auch aus einem nur 15 Zentimeter dicken Rohr """"abgefeuert"""" werden", da sie flexible Schwingen hat, die sich dann erst entfalten. Wenn sie 100 Meter Höhe erreicht, erscheint sie vom Boden aus lautlos.Nur filmen, nicht angreifenDer Robotervogel kann aber sogar in Höhen von über siebeneinhalb Kilometern fliegen. Die Batterie reicht nur eine Stunde, kann aber in 30 Sekunden ausgetauscht werden. Die Drohne kann auf einem Feld landen oder in einem Netz aufgefangen werden. Ihre Kamera ermöglicht Überwachung und Aufklärung," im Herstellerfilm auf YouTube macht Maveric auch Infrarot-Aufnahmen und soll zudem andere Ausrüstung tragen können.""""Es ist unser Ziel"," den Kampfsoldaten zu unterstützen"""""," erklärt Prioria-Robotics-Chef Bryan da Frota. """"Wir glauben", in dem Maße wie sich Missionen ändern und entwickeln," wird Maveric eine wichtige Komponente zum Erreichen dieser Missionen werden."""" Die Drohne soll jedoch zurzeit bei Kampfhandlungen keine Verletzungen an Feinden verursachen. Für welche Einsätze genau die US-Armee die Maverics so dringend braucht"," ist nicht bekannt."""
"US-Gemeinde geht mit App auf Verbrecherjagd;""Auch Sexualstraftäter in der Umgebung der User werden aufgelistet"
Eine neue App für iPhones und Android-Geräte unterstützt die Polizei der Stadt Tampa im US-Bundesstaat Florida bei der Verbrecherjagd. Bürger können auf diese Weise anonyme Hinweise direkt an die Exekutivorgane senden. Zudem werden die Nutzer über die aktuell gesuchten Kriminellen und die noch ungelösten Kriminalfälle informiert, wie die Tampa Bay Times berichtet.Kritik von DatenschützernDie Applikation punktet mit ihrer breiten Angebotspalette. Denn ein weiteres Feature stellt die Möglichkeit dar," eine Inventarliste mit Fotos seiner Wertgegenstände hochzuladen. Im Falle eines Diebstahles werden diese Informationen und das Bildmaterial sofort der Polizei per E-Mail zugesendet. In den kommenden zwei Monaten sollen weitere Funktionen hinzukommen.Das Tampa Bay Police Department http://tampagov.net/dept_police will auch eine Liste von Sexualstraftätern in der Umgebung des Wohnortes des App-Users zur Verfügung stellen. """"Jemanden", der für sein Verbrechen bereits gesühnt hat, noch immer quasi als gefährlichen Verbrecher zu behandeln," ist total absurd""""", kritisiert Hans Zeger von Arge Daten http://argedaten.at die Pläne gegenüber pressetext.1.000 Downloads pro MonatTrotz der Kritik von Datenschützern haben bereits etwa 1.000 Personen die App seit ihrem Start vor einem Monat heruntergeladen. Allein durch diese Quelle bekommt die Polizei jeden Tag drei Hinweise, meint Tampa-Polizei-Chefin Jane Castor. Dabei handle es sich meistens um Drogenaktivitäten an einem bestimmten Platz oder um illegales Parken beziehungsweise Geschwindigkeitsübertretungen.Bill Todd, Chef von Fast Forward Marketing http://fastf.com , welches für das Design der App verantwortlich war, ist davon überzeugt," dass solcherlei Software künftig ein großes Geschäft für die Agenturen werden. """"Es gibt bereits Anfragen von weiteren US-Kommunen"," die sich für diese neuen Wege in der Verbrechensbekämpfung interessieren.""""Für Österreich sieht Zeger hingegen eine solche Entwicklung skeptisch: """"Eine App zur Bekämpfung von Verbrechen ist ein gnadenloser Blödsinn. Das Ausmaß des Shitstorms wäre so groß", dass die Polizei zu viel damit zu tun hätte," die guten von den schlechten Hinweisen zu trennen"""""," meint der Datenschutzexperte abschließend im pressetext-Gespräch."""
"Regionales Onlinemarketing im ganzheitlichen Konzept der Unternehmensberatung;""Mit wenig Aufwand zu mehr Erfolg 2014"
"Am Freitag dem 29.11.2013 war es soweit. Michael Appelt hat sein neues Trainingszentrum in Werdau eingeweiht. Ab sofort gibt es dieses neue Trainingsprogramm """"Führe Deine Idee ins Geschäft"""". Informationen über diesen neunen ganzheitlichen Ansatz in der Unternehmensberatung und - führung finden Sie", auf dieser Webseite: http://www.business-und-karriere.de .In diesem Zusammenhang möchten wir auch unsere Kooperation mit Michael Appelt der Öffentlichkeit vorstellen. Unser Unternehmen H & L Webseitenmanagement UG (http://www.hl-webseiten.com ), ist in dieser Kooperation der Partner für regionales Onlinemarketing. Die beiden Geschäftsführer Michael Appelt und Uwe Harras verbindet eine langjährige Geschäftsbeziehung. Michael Appelt hat erkannt, dass seine Idee nur in einem interdisziplinären Team bestmöglich umgesetzt werden kann. Dazu hat er sich aus verschieden Bereichen entsprechende Kooperationspartner ausgewählt und entsprechend mit eingebunden. Gerade für unser Unternehmen stellt dieses eine besondere Herausforderung dar, da wir nun mit unserem Expertenwissen einem noch größerem Publikum zur Verfügung stehen. Wir sind stolz darauf, dass wir auch an diesem Tag erste Erfolge erzielen konnten. Viele mit Unternehmern durchgeführte Gespräche zeigen uns, dass die Unternehmer zwar die Vorteile von regionalem Onlinemarketing wahrnehmen aber davor noch zurück schrecken.Hier möchten wir noch einmal darauf hinweisen, dass wir mit klaren Konzepten und einfachen technischen Mitteln unseren Kunden dazu verhelfen, dass sie im regionalen Bereich sehr schnell wahrgenommen werden. Unser Ziel ist es, dass unser Kunden ihre Internetseiten beherrschen und nicht die Internetseiten unsere Kunden. Jeder der sich mit den Officeprogrammen von Microsoft auskennt, ist in der Lage mit unserem System seine Internetseite selber zu pflegen und seinen Umsatz zu steigern.Die Internetseiten die wir für unsere Kunden erstellen sollen nur eine wesentliche Aufgabe erfüllen und die heißt: Umsatz und Gewinn zu steigern und das mit wenig Aufwand.Viele Unternehmer vergessen," dass mit Hilfe des regionalen Onlinemarketings Umsatzsteigerungen von 20% und mehr möglich sind. Dieses wird uns von unsern Kunden auch immer wieder bestätigt.Weitere Informationen finden Sie auf unserer Webseite: http://www.hl-webseiten.com"""
"AfB Shop belebt Ottakringer Straße mit grünen Computern;""IT-Unternehmen schafft Arbeitsplätze für Behinderte"
Günstig und sozial, also doppelt gut: Am 12. Dezember eröffnet in der Ottakringer Straße ein neues Geschäft von AfB, Europas erstem gemeinnützigen IT-Unternehmen. AfB beschäftigt Behinderte, die gebrauchte Computer wieder in Ordnung bringen und preiswert verkaufen.Monitore ab 45 Euro, PCs ab 99 Euro, Notebooks schon ab 179 Euro, alles Markengeräte und mit 12 Monaten Garantie. Wie das geht? Es sind gebrauchte Modelle, die von Behinderten hergerichtet, geprüft und verkauft werden. AfB, ein gemeinnütziges Unternehmen, schafft damit Arbeitsplätze für Menschen mit körperlichen oder geistigen Behinderungen. Auch für die Umwelt ergibt sich ein Nutzen, denn Altgeräte landen so nicht auf dem Sondermüll, sondern finden neue Besitzer," die sich über ein Schnäppchen freuen.Aktiver Beitrag zur Abfallvermeidung""""Es freut mich"," dass die erst kürzlich so erfolgreich umgebaute Ottakringer Straße ein attraktives Umfeld für nachhaltig wirtschaftende Unternehmen bietet - Reparaturbetriebe haben mehrfachen Nutzen und sind natürlich ein aktiver Beitrag zum Umweltschutz und zur Abfallvermeidung""""", so Umweltstadträtin Ulli Sima.Dass AfB hier einzog, war kein Zufall. Denn die Anrainer-Initiative Recycling-Kosmos bemüht sich gezielt darum, Reparaturbetriebe in die Ottakringer Straße zu bringen. Statt leerer Geschäftslokale soll in diesem Viertel ein bunter Reparatur-Cluster entstehen. Die engagierten Anrainer setzten sich mit AfB in Verbindung und machten auf eine günstige Möglichkeit an der Ecke Lindauergasse aufmerksam. Zufällig suchte AfB gerade einen zusätzlichen Standort in Wien, das passte.Die gelungene Zusammenarbeit geht weiter, Recycling-Kosmos wird im AfB Shop einen Raum beziehen und dort jeden Mittwoch von 14 bis 18 Uhr Reparatur-Beratung anbieten. Dort bekommt man gratis Tipps, wo man etwas günstig reparieren lassen kann und wie viel das kosten könnte. Auch PC-Workshops sind geplant, es wird Energieberatung geben," ein Nähcafé und eine Unternehmer-Lounge für lokale Geschäftsleute.Arbeitsplätze für Behinderte""""Für gebrauchte Computer interessieren sich umweltbewusste Kunden", aber auch Leute, die nicht so viel Geld haben - Studenten, Pensionisten," Zuwanderer""""", erklärt Kurt Essler," Geschäftsführer von AfB Österreich. """"In das Viertel rund um die Ottakringer Straße passen wir sehr gut hin. Wir haben Verkäufer", die Türkisch und Serbokroatisch verstehen," und möchten auch die vielen Zuwanderer in dieser Gegend wortwörtlich als Kunden ansprechen."""" AfB eröffnete 2010 eine erste österreichische Niederlassung am südlichen Stadtrand von Wien", mit Werkstatt und Lager. Mit dem neuen Standort rückt das Unternehmen nun näher zur Kundschaft.Die Idee für einen gemeinnützigen Computer-Betrieb stammt aus Deutschland. Denn um Arbeitsplätze für Behinderte zu schaffen, eignet sich die IT-Branche besonders gut. Auch Menschen mit Einschränkungen können in dieser Sparte Aufgaben erfüllen und Leistungen erbringen. Das Konzept: Unternehmen, die ihre Altgeräte entsorgen wollen, überlassen sie AfB. Dort werden die Daten zertifiziert gelöscht, die Geräte werden getestet, repariert und verkauft. Mit den Erlösen aus dem Verkauf finanziert AfB diese Arbeitsplätze.Über AfB
AfB ist Europas erstes gemeinnütziges IT-Systemhaus und beschäftigt geistig oder körperlich Behinderte. Ziel der Organisation ist es, möglichst viele dauerhafte Arbeitsplätze für Menschen mit Behinderungen zu schaffen. Dazu bietet AfB professionelle IT-Dienstleistungen an. Das wichtigste Geschäftsfeld besteht darin, Altgeräte, die AfB überlassen werden, zu testen, Daten zertifiziert zu löschen, die Geräte wieder in Ordnung zu bringen und sie zu verkaufen. Die Erträge werden nicht als Gewinn abgeführt, sondern in zusätzliche Arbeitsplätze investiert. AfB verfügt über zwei Niederlassungen in Österreich, zehn in Deutschland, eine in Frankreich und eine in der Schweiz. In Österreich ist AfB seit 2010 präsent und beschäftigt derzeit 35 Mitarbeiter," davon 20 mit Behinderungen. http://www.afb-group.at"""
"Viessmann: Vorreiter mit Brennstoffzellen in der Logistik;""Hessisches Umwelt- und Energieministerium besucht Heiztechnik-Hersteller"
Andreas Koch, Abteilungsleiter Energieförderung des Hessischen Ministeriums für Umwelt und Energie, hat den nordhessischen Heiztechnikhersteller Viessmann besucht, um sich dort über den Einsatz eines Brennstoffzellen-Staplers zu informieren. Das Unternehmen aus Allendorf ist der erste Anwender, der die Einsatzmöglichkeiten eines Brennstoffzellen-Staplers in Hessen im Produktionsalltag testet. Damit beteiligt sich Viessmann an einem hessischen Demonstrationsprojekt, das von der Wasserstoff- und Brennstoffzellen-Initiative Hessen e.V. sowie dem Hessischen Ministerium für Umwelt und Energie initiiert und über den Projektträger Hessen Agentur beauftragt wurde. Ziel ist es, einen Beitrag zum Markteintritt von Brennstoffzellen-Staplern zu leisten.Energie aus WasserstoffBei diesem Projekt haben Unternehmen in Hessen die Möglichkeit, einen speziell ausgerüsteten Gabelstapler der Firma Still zusammen mit einer mobilen Wasserstoff-Betankungsanlage zu testen. Brennstoffzellen-Stapler beziehen ihre Energie aus Wasserstoff, der mittels Brennstoffzellen an Bord in elektrischen Strom umgewandelt wird und zum Fahren und Bewegen der Stapler dient. Dadurch sind sie besonders energiesparend und klimafreundlich.Vorreiter im Bereich LogistikHessen ist Standort für viele Logistik-Unternehmen und daher besonders daran interessiert," die Entwicklung einer klimafreundlichen und energieeffizienten Logistik voranzutreiben. Koch zeigte sich von dem Einsatz des Brennstoffzelle-Staplers bei Viessmann begeistert: """"Ich freue mich"," dass wir in Hessen als Vorreiter der Brennstoffzellen-Technologie deren Einsatz im Logistikbereich vorantreiben.""""Wichtiger Beitrag zur EnergiewendeDie innovative Brennstoffzellen-Technologie kommt bei Viessmann nicht nur in der Fertigungslogistik zum Einsatz", sondern auch in einem Kraft-Wärme-Kopplungssystem," das im April kommenden Jahres in den Heiztechnikmarkt für Ein- und Zweifamilienhäuser eingeführt wird. """"Die dezentrale gleichzeitige Erzeugung von Wärme und Strom ist eine Hocheffizienz-Technologie"," die im Gebäudebereich einen wichtigen Beitrag zur politisch gewollten Energiewende in Deutschland leisten kann""""", sagte Jörg Schmidt, Leiter der Viessmann-Öffentlichkeitsarbeit. Dass es darüber hinaus vielfältige Einsatzmöglichkeiten für Brennstoffzellen gebe, beweise der Praxistest mit dem Stapler im Werk.Wasserstoff aus eigener ProduktionSchmidt erwähnte eine weitere Option. Im kommenden Jahr soll neben den beiden Biogasanlagen des Unternehmens ein Elektrolyseur aufgebaut werden. Diese Anlage produziert aus überschüssigem Wind- oder Sonnenstrom Wasserstoff. Der soll in einer der Biogasanlagen mithilfe eines mikrobiologischen Verfahrens in Methan gewandelt werden. Derzeit wird geprüft," ob der Wasserstoff nicht auch für die Betankung der Brennstoffzellenstapler verwendet werden könnte.Vorteile vereinenDie beiden positiven Eigenschaften """"schnelles Betanken"""" der verbrennungsmotorischen Stapler sowie der emissionsfreie Elektroantrieb von Elektro-Staplern werden in einem Wasserstoff-Brennstoffzellen-Stapler vereint. """"Der Stapler wird an einer mobilen Tankstelle der Firma Linde in wenigen Minuten betankt""""", erläutert Walter Hahn," Viessmann Projektleiter. """"Das Nachtanken nimmt weit weniger Zeit in Anspruch als ein Batteriewechsel. Bei herkömmlichen Elektrostaplern werden zwei Batteriesätze benötigt. Während der Stapler mit der ersten Batterie fährt"," muss der zweite Satz geladen werden."""" """"Wir sind auf dem richtigen Weg""""Der Niederlassungsleiter von Still Frankfurt", Michael Süßenguth," war ebenfalls vor Ort. Er freute sich besonders über die positive Resonanz der Viessmann-Staplerfahrer: """"Das Feedback zeigt uns"," dass wir auf dem richtigen Weg sind. Der erste hessische Brennstoffzellen-Gabelstapler wird sicherlich nicht der letzte sein.""""Das hessische Kompetenznetzwerk der Wasserstoff- und BrennstoffzellentechnologieUnd auch Dr. Joachim Wolf", Vorstandsvorsitzender des hessischen Kompetenznetzwerkes H2BZ-Initiative Hessen," zeigte sich zufrieden: """"Mit dieser Demonstrationskampagne haben wir bei dem ersten Nutzer erreicht"," was bezweckt war: Information und Sichtbarkeit der Einsatzmöglichkeiten von Wasserstoff und Brennstoffzellen. Am Prozedere zur Erlangung der Betriebserlaubnis der Betankungsanlagen muss allerdings noch kräftig gearbeitet werden.""""Kontakt:"
Geschäftsstelle H2BZ-Initiative Hessen e.V.
c/o HA Hessen Agentur GmbH
Alina Stahlschmidt
