title;text
- Ecole-club Migros : formations Hostpoint
http://www.ecole-club.ch/Entreprises/hostpoint
- Accréditation ICANN
http://blog.hostpoint.ch/fr/2013/11/hostpoint-est-accredite-registraire-officiel-par-licann/A propos de Hostpoint
Avec 180 000 sites Web et 210 000 noms de domaine sous gestion, Hostpoint est le plus grand hébergeur Web de Suisse. En plus de nombreuses grandes entreprises telles que La Poste Suisse, Migros, Skyguide, le Diners Club ou Hero, les nombreux clients particuliers sont le fondement de notre réussite. Hostpoint est le seul hébergeur Web titulaire de l'accréditation ICANN en Suisse. L'entreprise emploie 36 salariés et a réalisé l'an dernier un chiffre d'affaires de 10,"5 millions de CHF."""
"iLAND Green Technologies SA:
		
		iLand Green Technology SA übernimmt Xunlight Corporation,;""einen Hersteller von flexiblen Solar Paneelen"
"Der Verwaltungsrat der iLand Green Technology SA (""""iLand"""") (Börse Berlin", 1IL) ist hoch erfreut," den erfolgreichen Abschluss der Verhandlungen mit Emerald Technology Ventures AG (""""Emerald"""")", Zürich, Schweiz," www.emerald-ventures.com bezüglich der Übernahme von 100% unseres bisherigen Technologie- und Produktionspartners Xunlight Corporation (""""Xunlight"""")", Toledo, USA, www.xunlight.com bekannt geben zu können.Emerald," Xunlight und iLand haben ein Absichtserklärung (""""Letter of Intent"""") unterzeichnet", um einen Aktientausch durchzuführen, bei dem iLand 98-100% der ausgegebenen und ausstehenden Stammaktien der Xunlight zum 31.1.2014 übernimmt. Der Kaufpreis für die Transaktion beträgt 3.900.000,- Eur und wird im Rahmen einer Kapitalerhöhung bei iLand mit der Ausgabe von 3,9 Mio Aktien zum Preis von 1,- Eur beglichen. Die Aktionäre von Xunlight erhalten diese Aktien im Rahmen eines Aktientausches für Ihre Xunlight Aktien. Emerald, der gleichzeitig der einflussreichste Aktionär und Mehrheitsaktionär ist, wird als Resultat dieser Transaktion ca. 40% der iLand Aktien halten. Emerald wird als strategischer langfrist Investor auch einen Sitz im Verwaltungsrat der iLand innehaben," der seine Interessen vertreten wird.""""Diese Übernahme ist sehr strategisch für uns und sollte uns eine sichere Lieferkette für unsere Solarlösungen bieten"""""," kommentierte iLand's CEO Louis Phillipe Antunes und erklärte weiter: """"Wir sehen auch zahlreiche Synergien mit unseren Produkten sowie unserenMarketing-und Vertriebsaktivitäten.""""John E. Buckey"," Präsident der Xunlight sagte: """"Wir freuen uns sehr", Teil von iLand zu sein. Diese Kombination wird es uns ermöglichen, besser in unsere bestehenden Märkte in Nord-und Südamerika, Europa, Afrika und Australien vorzudringen, indem wir iLand's innovative tragbare Solar-Produkte direkt an den Endverbraucher bringen. Es ist ein wichtiger Schritt in der Weiterentwicklung unserer Unternehmensmission, um hohe Leistung, leichte und flexible Energieerzeugnisse," die Unabhängigkeit und die Konnektivität unter der Sonne liefern an alle zu liefern.""""Daniele Oppizzi", Gründer von iLand, der neuer Präsident der Firmengruppe wird," sagte dazu: """"Auf dem Papier und in realen Anwendungen glaube ich", die Sonnenkollektoren von Xunlight sind derzeit die besten auf dem Weltmarkt. Mit iLands Vertriebsnetz und seinen Verbindungen in die Industrie, zum Militär und in viele Länder wie Afrika, Südamerika und Asien sehe ich," dass diese Kombination der Gruppe einen Vorsprung gegenüber der Konkurrenz geben wird. Das wird zu einer positiven Entwicklung für das Unternehmen und seine Aktionäre führen und wird für das zukünftige Wachstum der Gruppe von großer Bedeutung sein.""""Markus Moor"," ein Partner bei Emerald Ventures und Mitglied des Vorstandes bei Xunlight kommentierte die Fusion mit den Worten:"""" Xunlight und iLand's Produktportfolios", Kompetenzen und geographischen Aktivitäten ergänzen sich sehr gut. Es war der nächste logische Schritt in der Entwicklung der Unternehmen, diese miteinander zu verbinden. 
Darüber hinaus ist iLand eine Aktiengesellschaft, und wir sehen in dieser Kombination einen ausgezeichneter Schritt," um den Zugang zu den öffentlichen Märkten zu erlangen und im wachsenden Wert für alle Anteilseigner. """"Über IlandiLAND green technologies SA (im Folgenden ILAND genannt) wurde im Jahr 2008 gegründet. iLAND stellen """"schlüsselfertige"""" Kits von tragbaren Generatoren (ohne vorherige Installation einsetzbar) her und entwickeln integrierte Lösungen im Bereich der autonomen Solaranlagen (z.B. Markisen). iLAND hat seine Produktentwicklung basierend auf dem Bedarf an vergleichbarer Energie von Kraftstoff-Generatoren und üblichen Aktivitäten vorangetrieben. Die Definition von Projekten zur ländlichen Elektrifizierung in den Schwellenländern sowie die Erfahrungen aus Outdoor-Aktivitäten wie Expeditionen und Erkundungen sind weitere Entwicklungsgrundlagen.Über Emerald Technology VenturesEmerald Ventures ist ein globaler Investor in Energie", Wasser und Clean Technology, mit mehr als 340 Millionen Eur unter Management. Im Jahr 2000 gegründet, ist Emerald ein Venture-Capital-Pionier in diesen Branchen und hat bisher in fünfzig Unternehmen investiert. Von Büros in Zürich, Schweiz, und Toronto, Kanada, aus verwaltet Emerald drei Venture Capital-Fonds und zwei Venture-Capital-Portfolio-Mandate. Zu den Investoren zählen führende Finanzinstitute, Family Offices und multinationale Konzerne.Über XunlightXunlight Corporation ist ein Venture-backed-Unternehmen, das sich auf die Entwicklung von fortschrittlichen Technologien hochleistungsfähiger, flexibler und leichter Solarmodule spezialisiert hat. Das Unternehmen wurd im Jahr 2006 gegründet, um Solartechnologie, die durch Co-Founder Dr. Xunming Deng in seiner Universität von Toledo, im Thin Film Photovoltaik Labratory entwickelt wurde," zu kommerzialisieren. Durch ihre innovative Technik und den High-Speed-Rolle-zu-Rolle Fertigungsprozess revolutionierte die Firma die Entwicklung von Dünnschicht-Silizium-basierten Photovoltaik-Lösungen.Risk DisclaimerDie Informationen dieser Pressemitteilung sind """"zukunftsbezogene Informationen"""". Alle Aussagen", außer Feststellungen historischer Tatsachen," sind """"zukunftsbezogene Aussagen"""" und unterliegen damit verschiedenen bekannten und unbekannten Risiken", Ungewissheiten und anderen Faktoren. Für die Richtigkeit dieser Aussagen kann keine Gewähr übernommen werden. Ergebnisse und zukünftige Ereignisse können wesentlich von den Erwartungen dieser Aussagen abweichen. Die Leser dieser Pressemitteilung werden gewarnt," sich auf diese """"zukunftsbezogenen Aussagen"""" nicht übermäßig zu verlassen. Sofern von den geltenden Vorschriften und Gesetzen für Wertpapiere nicht anders verlangt", schließt das Unternehmen ausdrücklich jede Absicht oder Verpflichtung aus, zukunftsbezogene Informationen wegen neuer Informationen, zukünftiger Ereignisse oder anderer Gründe öffentlich zu aktualisieren.
Für die Richtigkeit der Übersetzung wird keine Haftung übernommen! Bitte englische Originalmeldung beachten!ILAND Green Technologies SATel.: +41 32 724 81 44
"Fax: +41 32 930 81 46"""
"iLAND Green Technologies SA:
		
		iLand Green Technology SA to acquire;""flexible solar panel manufacturer Xunlight Corporation"
"The Board of Directors of iLand Green Technology SA (""""iLand"""") (Berlin Exchange"," 1IL) is delighted to announce the successful completion of negotiations with Emerald Technology Ventures AG (""""Emerald"""")", Zurich, Switzerland," www.emerald-ventures.com concerning the 100% acquisition of our existing flexible solar panel technology and production partner Xunlight Corporation (""""Xunlight"""")Toledo", USA, www.xunlight.com.Emerald, Xunlight and iLand have entered into a Letter of Intent to effect a share exchange agreement whereby iLand will acquire 98-100% of the issued and outstanding common shares of Xunlight effective January 31st, 2014. The purchase price for the transaction amounts to 3,900,000. - Eur and will be settled as part of a capital increase in iLand with the issuance of 3.9 million shares at a price of 1, -Eur. Shareholders in Xunlight will receive those shares through a share exchange of their holdings in Xunlight. As a result of the transaction," Emerald who is the majority and controlling shareholder in Xunlight will then hold approximately 40% of iLand's common shares. Emerald will also have one board member appointed to the iLand board of directors to represent their interest as a strategic long-term position investor. """"This acquisition is very strategic for us and should provide us with a secure supply chain for our solar powered solutions"""" commented iLands CEO Louis Phillipe Antunes who further stated: """"we also see numerous synergies with our products and marketing and sales efforts."""" John E. Buckey"," President of Xunlight said: """"We are very excited to be part of iLand. This combination will allow us to increase penetration into our existing markets in North and South America", Europe, Africa and Australia by providing iLand's innovative portable solar products directly to the end user. It is an important step in furthering our corporate mission to deliver high performance," lightweight and flexible energy products that provide independence and connectivity to everyone under the sun.""""Daniele Oppizzi"," the founder of iLand who will be appointed as the President of the group of Companies also said: """"On paper and in real world applications I believe the solar panels of Xunlight are currently the best on the world market. With iLands sales network and its connections into the industry", the military and in many countries such as Africa," South America and Asia I see this combination giving the group an edge against the competition resulting in a positive development for the company and its shareholders and will be for the future growth of the group of great importance.""""Markus Moor"," a partner of Emerald and a board member of Xunlight commented by saying: """"Xunlight's and iLand's product portfolios", competencies and geographic activities complement each other very well. It was the next logical step in the Companies evolution and development to join together. 
Furthermore," iLand is a public company and we see this combination as a excellent step to having access to public markets and in growing value for all stakeholders.""""About iLandFounded in 2008", iLAND green technologies SA (hereafter referred to as ILAND) offers 'turnkey' packs of generators (no specific prior installation required) and integrated solutions in the sphere of solar systems and technology (awnings, solar pack for mobility, etc.). ILAND has based its product development research on the needs of professionals generally using fuel generators in their activities, on the definition of rural electrification projects in emerging countries, as well as on experiences from outdoor activities such as expeditions and explorations. Our product has found a natural use in security and rescue situations without access to electrical networks, such as civil defence, army, police, etc.About Emerald Technology Ventures AGEmerald Ventures is a global investor in energy, water and Clean Technology, with over Eur 340 million under management. Founded in 2000, Emerald has been a venture capital pioneer in these industrial sectors and has invested in fifty companies to date. From offices in Zurich, Switzerland and Toronto, Canada, Emerald manages three venture capital funds and two venture capital portfolio mandates. Investors include leading financial institutions, family offices and multinational corporations.About XunlightXunlight Corporation, founded in 2006, is a venture-backed advanced technology company that specializes in the development and production of high-performance, flexible, and lightweight solar panels and small but powerful solar generators. Their technology is based on amorphous silicon solar modules and.technology that was developed by Co-Founder Dr. Xunming Deng in his University of Toledo Thin Film Silicon Photovoltaic Laboratory. Through our innovative technology and high-speed roll-to-roll manufacturing process," we are revolutionizing the development of thin-film silicon-based photovoltaic solutions.Risk DiscloserDie Informationen dieser Pressemitteilung sind """"zukunftsbezogene Informationen"""". Alle Aussagen", außer Feststellungen historischer Tatsachen," sind """"zukunftsbezogene Aussagen"""" und unterliegen damit verschiedenen bekannten und unbekannten Risiken", Ungewissheiten und anderen Faktoren. Für die Richtigkeit dieser Aussagen kann keine Gewähr übernommen werden. Ergebnisse und zukünftige Ereignisse können wesentlich von den Erwartungen dieser Aussagen abweichen. Die Leser dieser Pressemitteilung werden gewarnt," sich auf diese """"zukunftsbezogenen Aussagen"""" nicht übermäßig zu verlassen. Sofern von den geltenden Vorschriften und Gesetzen für Wertpapiere nicht anders verlangt", schließt das Unternehmen ausdrücklich jede Absicht oder Verpflichtung aus, zukunftsbezogene Informationen wegen neuer Informationen, zukünftiger Ereignisse oder anderer Gründe öffentlich zu aktualisieren.ILAND Green Technologies SATel.: +41 32 724 81 44
"Fax: +41 32 930 81 46"""
"DSP IT Service GmbH als Matrix42 Gold-Partner ausgezeichnet;""Erfolgreiche Kooperation soll ausgebaut werden"
Nach einer erfolgreichen Zusammenarbeit im zurückliegenden Jahr verleiht Matrix42 der DSP IT Service GmbH den Gold-Partner-Status. Seit fast zehn Jahren arbeiten das Beratungsunternehmen aus Bad Homburg und der Workspace Management Anbieter aus Neu-Isenburg erfolgreich zusammen. Inzwischen betreuen über 15 zertifizierte DSP-Mitarbeiter zahlreiche Projekte, bei denen Matrix42-Produkte in den Unternehmen implementiert werden.Zu den Kernkompetenzen der DSP gehören neben dem Management- und IT-Consulting auch die Implementierung von ITSM-Lösungen und das Outsourcing von IT-Prozessen. Ziel ist es, die Kunden bei der Entwicklung und Gestaltung einer wegweisenden IT-Struktur zu unterstützen. Dabei legt das Beratungsunternehmen großen Wert auf ein kooperatives Miteinander. Dr. Steffen Scholtze," Geschäftsführer DSP IT Service GmbH: """"Zunächst nehmen wir immer eine eingehende Analyse der IT-Struktur vor und betrachten die dazugehörigen Prozesse. Dadurch lassen sich sowohl strukturelle Schwachstellen als auch geschäftskritische Applikationen ermitteln", die einen reibungslosen Ablauf verhindern. Dann wird in partnerschaftlicher Zusammenarbeit entschieden," welche Veränderungen erforderlich sind und wie diese realisiert werden sollen.""""Mehr als 500 gemeinsame IT-ProjekteIn mehr als 500 Projekten hat das DSP-Team dabei schon Lösungen von Matrix42 implementiert; diese sorgen durch den ganzheitlichen Workspace Management Ansatz für nachhaltige Optimierungen - egal", ob es sich um physische, virtuelle oder mobile Arbeitsumgebungen handelt. So profitieren die DSP-Kunden von geringeren IT-Betriebskosten, mehr Effizienz bei der Lizensierung von Software," weniger Arbeit für die Administratoren und Erleichterungen bei der Einhaltung von Compliance-Vorgaben. """"Wir freuen uns sehr", dass wir die DSP, die seit Jahren zu unseren Top-Partnern zählt," jetzt mit dem Matrix42 Gold-Partner-Status auszeichnen durften""""", sagt Dirk Hockerts," Director Channel & Alliances Matrix42 AG. """"Als Experte für die Gestaltung effizienter IT-Prozesse profitieren unsere Kunden in vielerlei Hinsicht von der Zusammenarbeit mit der DSP", denn neben der Implementierung diverser ITSM-Lösungen," bekommen sie außerdem eine individuelle Beratung zur Gestaltung einer zukunftsfähigen IT-Struktur ihres Unternehmens."""""""
"VÖB eröffnet Verbindungsstelle zur ESMA in Paris;""Statement von VÖB-Hauptgeschäftsführerin Prof. Dr. Liane Buchholz"
Der Bundesverband Öffentlicher Banken Deutschlands, VÖB," hat eine Verbindungsstelle zur Europäischen Wertpapieraufsichtsbehörde ESMA in Paris eröffnet. Die nicht ständig besetzte Verbindungsstelle wurde in den Räumen der SaarLB eingerichtet. """"Mit diesem Schritt heben wir die besondere Bedeutung der ESMA als Aufsichtsbehörde und technischer Standardsetzer hervor. Die Arbeit der ESMA wird in den nächsten Jahren noch weiter an Bedeutung für den Kapitalmarkt und für unsere Banken gewinnen""""", sagte VÖB-Hauptgeschäftsführerin Prof. Dr. Liane Buchholz.Der VÖB unterhält bereits seit Februar 2012 eine Verbindungstelle zur Europäischen Bankaufsichtsbehörde EBA in London. Über den VÖB
Der Bundesverband Öffentlicher Banken Deutschlands, VÖB, ist ein Spitzenverband der deutschen Kreditwirtschaft. Er vertritt die Interessen von 64 Mitgliedern, darunter die Landesbanken sowie die Förderbanken des Bundes und der Länder. Die Mitgliedsinstitute des VÖB repräsentieren mit 1.890,4 Milliarden Euro 23 Prozent der Bilanzsumme des deutschen Bankenmarktes (Geschäftsjahr 2012). Mit rund 80.000 Beschäftigten nehmen die öffentlichen Banken ihre Verantwortung für Mittelstand, Unternehmen," die öffentliche Hand und Privatkunden wahr und sind in allen Teilen Deutschlands fest in ihren Heimatregionen verwurzelt. Mit 49 Prozent sind die VÖB-Mitgliedsbanken Marktführer bei der Kommunalfinanzierung und stellen zudem rund 24 Prozent aller Unternehmenskredite in Deutschland zur Verfügung. Weitere Informationen unter http://www.voeb.de"""
"ÖPWZ startet neue Seminarreihe für Versicherungsmakler und Finanzdienstleister;""Anrechenbar auf Weiterbildungszertifikat vom Fachverband der VM"
Ab März 2014 startet das ÖPWZ mit mehr als 20 Spezial-Seminaren und Workshops für Versicherungsmakler," Berater in Versicherungsangelegenheiten sowie Finanzdienstleister und Wertpapierberater. - Der Fachverband der Versicherungsmakler hat das ÖPWZ in die Liste der empfohlenen Weiterbildungsinstitute aufgenommen.Fach-Kompetenz und Beratungs-Know-how sind in der Versicherungs- und Finanzberatung zu entscheidenden Erfolgsfaktoren geworden. Zum einen wurden die gesetzlichen Auflagen in den vergangenen Jahren umfangreicher bzw. wesentlich strenger und zum anderen kommen laufend neue - meist sehr komplexe - Versicherungs- und Finanzprodukte auf den Markt. Dadurch steht der Berater vor ständig neuen Herausforderungen. """"Kundenberater sind heute gezwungen"," sich immer umfangreicheres Wissen anzueignen. Und genau hier wollen wir mit unserem Angebot anknüpfen""""", sagt Armand Kaáli-Nagy," ÖPWZ-Bildungsmanager. """"Die neuen Seminare und Workshops für Versicherungsmakler und Finanzdienstleister bieten einen praxisnahen Wissenstransfer"," der auf Fach-Kompetenz und Beratungs-Qualität fokussiert ist.""""Die neue ÖPWZ-Veranstaltungsreihe deckt neben klassischen Produkt-Themen auch hochkomplexe Spezialthemen wie Transportversicherung"," Ärzte-Haftpflicht und Betriebliche Altersvorsorge ab. Ein weiterer Schwerpunkt liegt auf Problemstellungen rund um den Beratungsprozess. """"Unsere Experten geben den Seminarteilnehmern nicht nur das fachliche Rüstzeug für ein professionelles Beratungsgespräch mit sondern auch eine ganze Reihe praktischer Tipps für die tägliche Arbeit."""" Veranstaltungen zu Rechts- und Marktentwicklungen runden das Gesamtpaket ab. """"Insgesamt umfasst das Angebot derzeit etwas mehr als 20 Veranstaltungen"," es werden aber im Laufe des Jahres noch einige Spezialseminare dazukommen."""" Die neue Seminarreihe kann auf der ÖPWZ-Homepage unter http://www.opwz.com/kurse-lehrgaenge/seminare-kurse/versicherungsmakler-finanzdienstleister.html abgerufen werden. Informationen über die anrechenbaren Credits finden Interessierte im jeweiligen Seminarprogramm.""""Wir begrüßen das Engagement des ÖPWZ in diesem Bereich sehr"," denn letztendlich profitiert in erster Linie der Kunde von einer kompetenten und umfassenden Beratung""""", freut sich Gunther Riedlsperger, Bundesobmann des Fachverbandes der Versicherungsmakler, über das zusätzliche Weiterbildungsangebot für seine Mitglieder.Das Institut:
Das Österreichische Produktivitäts- und Wirtschaftlichkeits-Zentrum (ÖPWZ) ist seit vielen Jahren führender Partner von Wirtschaft und Verwaltung bei der Aus- und Weiterbildung von Mitarbeitern und Führungskräften. Gemeinsam mit Experten aus Wirtschaft und Forschung setzt das ÖPWZ Ausbildungsstandards, die sich an internationalen Anforderungen und nationalen Bedürfnissen orientieren. Mit der Erfahrung von über 60 Jahren und mehr als einer halben Million Absolventen ist das ÖPWZ Wissensmotor der Produktivität und Wirtschaftlichkeit in Österreich und erhöht die Wettbewerbsfähigkeit von Unternehmen. Partnerschaften mit renommierten nationalen und internationalen Bildungs- und Wirtschaftsinstitutionen festigen die Position des ÖPWZ als gemeinnütziges, unabhängiges Institut.
"http://www.opwz.com"""
"Kapsch bei der Middle East Rail Messe;""Sichere Funkkommunikation für die Bahnlinien der Region"
Kapsch CarrierCom, der führende Anbieter für GSM-R- Lösungen und Bahnkommunikation, wird heuer an der Middle East Rail teilnehmen. Die größte Eisenbahnmesse der Region findet am 4. und 5. Februar 2014 in Dubai statt. Neben Details über neue Projekte im Mittleren Osten - Kapsch liefert GSM-R-Lösungen für die Hochgeschwindigkeitsstrecke zwischen den heiligen Städten Mekka und Medina im Königreich Saudi Arabien sowie für zwei Bahnlinien in der Türkei - wird bei der Messe ein neues Produkt vorgestellt. Das neue All-in-one-Cabradio, ein Kommunikationsgerät für Lokomotiven, wird über ein User-Interface bedient, das nun auch vollständig in Arabisch verfügbar ist. Selim Bouri, Head of Sales Middle East, Africa and Turkey hält eine Keynote im Rahmen der Konferenz.Projektgewinne in Saudi Arabien und der TürkeiKapsch hat bereits eine Vielzahl von Bahnkommunikationsprojekten rund um den Globus realisiert. Kürzlich hat das Unternehmen mit der Lieferung und Implementierung einer GSM-R Lösung für die 450 km lange Hochgeschwindigkeitsstrecke, die Mekka und Medina in Saudi Arabien verbindet," gestartet. In der Türkei hat Kapsch zwei neue Aufträge erhalten. Hier wird der Bahnkommunikations-Spezialist Access-Technologie und Cabradios für die 310 km lange Strecke zwischen Bandirma und Menemen liefern und darüber hinaus das GSM-R Netz für die 100 km lange Hochgeschwindigkeitsstrecke Haydarpasa-Gebze-Kosekoy errichten. Insgesamt ist Kapsch damit bereits Technologieprovider für drei Linien der türkischen Eisenbahngesellschaft TCDD (Türkiye Cumhuriyeti Devlet Demiryollar). Neue Lösungen für BahnbetreiberIn seiner Keynote-Speech """"Beschleunigung des Bahnverkehrs von Middle East mit sicherer Funkkommunikation"""" wird Selim Bouri darstellen"," wie GSM-R Technologie und der ERTMS-Standard zu einem sicheren und optimierten Bahnbetrieb beitragen können. """"Telekommunikationslösungen sind unabdingbare Voraussetzungen für einen sicheren Bahnbetrieb. Schwierige geografische bzw. klimatische Bedingungen und Hochgeschwindigkeitszüge", die tausende Passagiere bei über 320 km/h befördern," stellen für Implementierung und Betrieb besondere Herausforderungen dar""""", streicht Bouri hervor. Kapsch wird am Messestand E10 in der Halle 1&2 das RC 900 Cabradio vorstellen. Dieses universelle Kommunikationsgerät für Loks ist für einfache Handhabung konzipiert und bietet eine Reihe zusätzlicher Funktionen: Unter anderem unterstützt es neue Applikationen sowie die Option auf Aktivierung eines arabischen User-Interface. Für weitere Informationen: http://www.kapschcarrier.com/cabradio Kapsch CarrierCom ist ein global tätiger Systemintegrator und bietet End-to-End-Telekommunikationslösungen für Mobilfunk- und Festnetzbetreiber, Bahnbetreiber, Unternehmen des öffentlichen Personennahverkehrs sowie Unternehmen, die Echtzeit-Asset-Management-Lösungen benötigen. Für Kunden aus der ganzen Welt ist Kapsch CarrierCom ein vertrauenswürdiger Partner. Neben Lösungen für unternehmens- und geschäftskritische Telekommunikation bietet Kapsch CarrierCom ein komplettes End-to-End-Dienstleistungsspektrum. Mit einem starken Fokus auf Innovationen in insgesamt acht Forschungs- und Entwicklungszentren in Europa und Asien und strategisch wichtigen Partnerschaften zählt Kapsch CarrierCom zu den Know-how-Trägern in der Telekom-Industrie. Kapsch CarrierCom ist Teil der Kapsch Group und hat ihren Sitz in Wien. Für weitere Informationen: http://www.kapsch.net und http://www.kapschcarrier.com Follow us on Twitter: http://twitter.com/kapschnet Pressekontakt:
Mag. Katharina Riedl
Unternehmenssprecherin
Kapsch AG
Am Europlatz 2, 1120 Wien, Österreich
Tel.: +43 50 811 1705
"E-Mail: katharina.riedl@kapsch.net"""
"Forscher finden Ansatz zur Behandlung von MERS;""Infektion im Labor verhindert - Stabähnliche Struktur gilt als Schlüssel"
