title;text
Beide Teams spielten herzerfrischend und kompromisslos nach vorne. Diesmal köpfte de Jong Sevilla in Führung, doch diese hielt nur drei Minuten. Auf dem Weg in die Kabine gab es hitzige Diskussionen zwischen Spielern beider Lager und den Unparteiischen.

Anzeige

Nach der Pause spielten beide zumindest etwas kontrollierter," sowohl im Bezug auf Fouls als auch auf taktische Nachlässigkeiten. Der von Lukaku abgefälschte Fallrückzieher war dann die passende Pointe eines kuriosen Spiels."""
"Biden macht Senatorin Kamala Harris zur Vize-Kandidatin;""Der designierte demokratische US-Präsidentschaftskandidat Joe Biden zieht mit Kamala Harris als Vize an seiner Seite in den Wahlkampf gegen Amtsinhaber Donald Trump. Zum ersten Mal kandidiert damit eine schwarze Frau für das Amt."

Joe Biden will Senatorin Kamala Harris (Foto) als seine Stellvertreterin nominieren

Anzeige

Die schwarze US-Senatorin Kamala Harris wird Vize-Kandidatin des demokratischen Präsidentschaftskandidaten Joe Biden. Das gab der Herausforderer von Amtsinhaber Donald Trump am Dienstag auf Twitter bekannt.

Die 55-Jährige mit jamaikanisch-indischen Wurzeln sei eine „furchtlose Kämpferin für den kleinen Mann“, schrieb Biden.

An dieser Stelle finden Sie Inhalte aus Twitter Um mit Inhalten aus Twitter und anderen sozialen Netzwerken zu interagieren oder diese darzustellen, brauchen wir Ihre Zustimmung. Soziale Netzwerke aktivieren

US-Präsident Donald Trump hatte die Festlegung seines Herausforderers Joe Biden auf eine Frau als mögliche Vizepräsidentin bereits zuvor für riskant gehalten. „Ich wäre geneigt, einen anderen Weg zu gehen“, sagte der 74-Jährige am Dienstag in einem Interview bei Fox Sports Radio. „Manche Menschen würden sagen, dass Männer sich beleidigt fühlen dadurch. Manche würden sagen, das ist in Ordnung.“

Anzeige

Biden, der designierte Präsidentschaftskandidat der Demokraten, hatte schon Mitte März angekündigt, im Fall eines Wahlsiegs eine Frau zur Vizepräsidentin zu machen. Zuletzt war der Druck auf Biden gewachsen, eine nicht-weiße Kandidatin zu wählen.

Trump bezeichnete Bidens Entscheidung als „sehr wichtig“. „Es wird interessant sein, zu sehen, wen er wählt.“ Die Menschen würden aber nicht über einen Vize-Präsidenten abstimmen. „Joe wird auf seinen eigenen beiden Füßen stehen müssen, und uns geht es gut“, sagte Trump, der sich bei der Wahl am 3. November um eine zweite Amtszeit bewirbt.

"Mehr in Kürze"""
"Nawalny in Berlin gelandet – Polizisten vor der Charité;""Der Kreml-Kritiker Alexej Nawalny liegt seit Donnerstag im Koma. Nun ist er in Berlin gelandet und wurde zur Behandlung in die Charité gebracht. Vorausgegangen war ein Tauziehen zwischen deutschen und russischen Medizinern."

Nach langem Hin und Her hatten die Ärzte den schwer erkrankten Alexej Nawalny aus der Klinik entlassen. Inzwischen ist der russische Oppositionelle in Tegel gelandet und von dort aus in die Berliner Charité gebracht worden.

Anzeige

Mehrere Helfer heben vorsichtig die massive Trage aus der Maschine: Als am Samstagmorgen kurz vor neun Uhr der Rettungsflug mit Alexej Nawalny in Berlin-Tegel landet, ist der Nervenkrieg um Russlands prominenten Regierungskritiker vorläufig zu Ende. Stundenlang hatten Familienangehörige des Putin-Gegners und Ärzte noch im sibirischen Omsk um eine Ausreise des vermutlich vergifteten Politikers gerungen. Am Freitagabend gaben die Mediziner schließlich ihre Bedenken gegen einen Transport nach Deutschland auf. Der Zustand des Kremlkritikers sei „stabil“, heißt es bei seiner Ankunft.

Ein Intensivtransporter der Bundeswehr brachte Nawalny dann unter starkem Polizeischutz in die Universitätsklinik Charité in Berlin-Mitte. Nun kann der 44-Jährige ausführlich untersucht und behandelt werden. Nach der medizinischen Diagnostik und Rücksprache mit der Familie wollen sich die Ärzte zur Erkrankung und weiteren Schritten äußern, erklärte die Universitätsklinik. Die Untersuchungen würden einige Zeit in Anspruch nehmen. Sobald Erkenntnisse vorlägen, werde auch die Öffentlichkeit informiert. Eine Sprecherin der Charité erklärte, vor Montag sei nicht mit einer offiziellen Äußerung zum Gesundheitszustand Nawalnys zu rechnen.

Nawalnys engster Kreis hatte russischen Behörden und Ärzten vorgeworfen, mit einer Verzögerungstaktik einen raschen Transport verhindert und so mögliche Beweise vertuscht zu haben. „Nichts hat den Transport von Nawalny behindert. Es war notwendig, dass das so schnell wie möglich getan werden musste“, twitterte Nawalnys Sprecherin, Kira Jarmysch. Das hat vor allem seine Frau Julia Nawalnaja und sein Team möglich gemacht, die sehr hartnäckig den Behörden in ihrem Vorgehen widersprochen haben. Sie verdächtigen sogar die Ärzte, eindeutig gelogen zu haben. Nawalnaja bat dann Präsident Wladimir Putin persönlich, den Transport zu erlauben.

Lesen Sie auch Michail Chodorkowski „Wenn Putin beschließt, mich umzubringen, könnte ich mich kaum schützen“

Anzeige

Die Aktion war heikel, denn Nawalny ist einer der schärfsten Kritiker des Kremlchefs. Er ist der führende Kopf der liberalen Opposition. Nawalny holte die Opposition quasi aus der Schockstarre, nachdem der angesehene Regierungskritiker Boris Nemzow 2015 erschossen wurde. Mit detaillierten Recherchen zu Machtmissbrauch hat Nawalny den Kreml, den Geheimdienst und auch einflussreiche Oligarchen herausgefordert und gegen sich aufgebracht. 2017 schreckte er auch nicht zurück, den damaligen Regierungschef Dmitri Medwedew Korruption im großen Umfang vorzuwerfen. Nawalny löste so eine Protestwelle aus.

Steinmeier wünscht dem Politiker rasche Genesung

Bundespräsident Frank-Walter Steinmeier hofft auf eine baldige Aufklärung der Erkrankung. Es sei wichtig, „dass die Frage nach der Ursache der dramatischen Verschlechterung seines Gesundheitszustandes“ beantwortet werde, sagte Steinmeier am Samstag am Rande seines Besuchs bei den Salzburger Festspielen. „Ich hoffe, dass alle diejenigen, die zur Klärung dieser Frage etwas beitragen können, dies tatsächlich tun.“

Steinmeier zeigte sich erleichtert, dass Nawalny „in einem Krankenhaus und von Ärzten behandelt wird, die das Vertrauen der Familie genießen“. Er wünsche dem russischen Politiker eine rasche und vollständige Genesung, „damit seine Arbeitsfähigkeit wieder hergestellt wird“.

Anzeige

Bei der Ausreise hat möglicherweise auch Finnlands Präsident Sauli Niinistö eine vermittelnde Rolle gespielt. Er habe zunächst mit Kanzlerin Angela Merkel über Nawalny gesprochen und sei mit ihr übereingekommen, dass er die Sache in einem weiteren Telefonat mit Putin erörtern solle, sagte Niinistö dem finnischen Rundfunksender Yle. Er habe Putin in dem Gespräch gefragt, ob Nawalny zur Behandlung nach Deutschland gebracht werden könne, worauf der geantwortet habe, dass es dafür keine politischen Hindernisse gebe.

Aus Sicht russischer Ärzte kein Beleg für Vergiftung

Im Fokus steht Nawalnys Team auch, weil Regionalwahlen in Russland anstehen. Mit ihrer Strategie einer so bezeichneten „klugen Abstimmung“ will es der Kremlpartei Geeintes Russland Stimmen abspenstig machen und deren Dominanz in den Regionen brechen. Die Taktik: Jede beliebige Partei zu wählen – nur nicht Geeintes Russland. Damit waren sie auch schon in der Vergangenheit besonders für den Kreml unerwartet erfolgreich.

Deshalb sei es nicht auszuschließen, dass Nawalny Ziel eines Anschlags geworden sei, sagte Alexej Wenediktow, der Chefredakteur des renommierten Radiosenders Echo Moskwy. „Politisch ist das natürlich ein grandioser Schlag für das politische System Russlands.“ Die mögliche Vergiftung werde dieses System deutlich verändern.

Das Spezialflugzeug mit dem Kremlkritiker Nawalny an Bord auf dem Flughafen Tegel Quelle: dpa/Michael Kappeler

Anzeige

Trotz einer möglichen Vergiftung wollen sich die Mitarbeiter nicht einschüchtern lassen. Die Stiftung werde ihre Arbeit fortsetzen, schrieb der Fonds-Leiter Iwan Schdanow auf Twitter. Auch die regelmäßigen Live-Auftritte im Internet setzten Nawalnys Mitarbeiter trotzig fort – in der Hoffnung, dass das prominenteste Gesicht bald wieder dabei sein wird.

Auch die deutsche Regierung setzt auf eine erfolgreiche Behandlung Nawalnys in Berlin. „Die Bundesregierung hofft, dass die Behandlung in der Charité zu einer Besserung seines Zustands führt und eine vollständige Genesung ermöglicht“, teilte ein Regierungssprecher mit.

Lesen Sie auch Kreml-Kritiker im Koma Für seinen ambitionierten Plan zahlt Nawalny einen hohen Preis

Nawalnys Team geht davon aus, dass der Oppositionelle während einer Reise durch Sibirien vergiftet wurde. Aus Sicht der russischen Ärzte gibt es dafür jedoch keinen Beleg. Sie sprachen lediglich von einer Stoffwechselstörung.

Das Gesundheitsministerium in Omsk teilte am Samstag mit, dass bei keinem der bisherigen Tests Gift gefunden worden sei. Weder sogenannte Oxybutyrate noch Barbiturate, Strychnin oder synthetische Gifte seien im Körper Nawalnys festgestellt worden, hieß es. In seinem Urin waren demnach lediglich Alkohol und Koffein.

Der Jurist wollte am Donnerstag von Sibirien zurück nach Moskau fliegen. Am Flughafen in Tomsk habe er noch einen Tee getrunken, sagte Nawalnys Sprecherin. Während des Flugs habe er sich unwohl gefühlt und noch an Bord das Bewusstsein verloren. Das Flugzeug landete dann in Omsk, das 4000 Kilometer von der deutschen Hauptstadt entfernt liegt.

„Vielen Dank an alle für die Unterstützung. Der Kampf um Alexejs Leben und Gesundheit fängt gerade erst an, und es gibt noch viel zu tun. Zumindest ist aber jetzt der erste Schritt getan“, hatte Sprecherin Jarmysch nach dem Abflug geschrieben. Auch andere Oppositionelle zeigten sich erleichtert. „Ich bin so erleichtert, als hätten Terroristen nach langen Verhandlungen eine Geisel freigegeben“, schrieb der bekannte liberale Politiker Ilja Jaschin, ein jahrelanger Wegbegleiter Nawalnys. „Ich hoffe, dass diese für nichts und wieder nichts vergeudete Zeit Alexej nicht das Leben kosten wird.“

Lesen Sie auch Russland Wenn Ärzte aus dem Fenster stürzen

Der Flug nach Berlin war eine private Aktion der Initiative Cinema for Peace um den Filmproduzenten Jaka Bizilj. Nawalny ist nicht der erste prominente Oppositionelle aus Osteuropa, der nach einem mutmaßlichen Angriff in der Charité behandelt wird. Bei einer ähnlichen Aktion war vor zwei Jahren Pjotr Wersilow mit schweren Vergiftungssymptomen aus Moskau nach Berlin gekommen. „Es ist unglaublich, wie ähnlich die Route ist, die ich vor zwei Jahren genommen habe. Damals war ich bewusstlos“, twitterte Wersilow, der Mitglied der russischen Polit-Punk-Gruppe Pussy Riot ist.

Anzeige

Nawalny soll nach einem Bericht vor seiner möglichen Vergiftung von den Behörden genau beobachtet worden sein. „Das Ausmaß der Überwachung überrascht mich überhaupt nicht, wir waren uns dessen bereits bewusst“, schrieb seine Sprecherin Kira Jarmysch am Sonntag auf Twitter. „Aber es ist erstaunlich, dass sie nicht gezögert haben, allen davon zu erzählen.“ Hintergrund ist ein Artikel der Moskauer Boulevardzeitung „Moskowski Komsomolez“. Darin werden detailgenau alle Bewegungen des Oppositionellen bei seiner Reise durch Sibirien beschrieben.

In dem Artikel beruft sich die Zeitung auf nicht näher genannte Sicherheitskreise. Darin wird beschrieben, wo sich Nawalny zu jedem Zeitpunkt aufhielt, mit wem er sprach und wo er übernachtete. Das Team soll mehrere Hotelzimmer angemietet haben, Nawalny sei aber in eine „konspirative“ Wohnung gebracht worden. Jemand aus seinem Team soll Sushi bestellt haben. Dabei sollen die Behörden ihn die ganze Zeit beschattet haben, heißt es in dem Beitrag weiter.

Wenn es überhaupt eine Vergiftung gegeben haben soll, könne das wahrscheinlich nur am Flughafen oder im Flugzeug passiert sein," hieß es als Schlussfolgerung. „Alle Bewegungen und Kontakte in der Stadt wurden akribisch untersucht.“"""
"„Schulöffnungen spielen bei dem Anstieg keine große Rolle“;""Anzeige"

Nach dem Schrecken des Lockdowns kam die Erleichterung – und mit ihr die Reiselust. Beides bleibt nicht ohne Folgen. Seit Wochen steigen die Fallzahlen in Deutschland wieder an, um die 1400 bis 1500 Menschen werden derzeit Tag für Tag positiv auf das Sars-CoV-2 getestet, am vergangenen Samstag wurden sogar über 2000 gemeldet. Die Infektionswelle ist damit wieder auf dem Stand Ende April bis Anfang Mai angekommen.

Auffällig ist laut dem Robert-Koch-Institut (RKI) dabei, dass die Infektionen vor allem bei Menschen zwischen fünf und 34 Jahren häufiger werden, während es bei den über 60-Jährigen kaum eine Zunahme gibt.

Allerdings gibt es einen deutlichen Unterschied zur Situation im Mai: Ein großer Anteil der positiv Getesteten hat sich nicht in Deutschland, sondern im Ausland angesteckt. In der 33. Kalenderwoche (10. bis 16. August) waren es 39 Prozent aller Infizierten, in der Regel jüngere Menschen.

Lesen Sie auch Informationslücke beim RKI Wieso werden die Corona-Infektionen nicht zurückverfolgt?

Anzeige
