title;text
Anzeige

*Dieser Text enthält Affiliate Links. Das bedeutet: Sollten Sie über die mit einem Stern gekennzeichneten Links einen Kauf abschließen, erhält WELT eine kleine Provision. Die Berichterstattung beeinflusst das nicht. Unsere Standards der Transparenz und journalistischen Unabhängigkeit finden Sie unteraxelspringer.de/unabhaengigkeit.

"Dieser Artikel wurde erstmals im April 2020 veröffentlicht."""
Die EU muss raus aus ihrem mentalen Lockdown gegenüber Israel;
So verändert sich Ihr Gehirn, wenn sie zwei Mal pro Woche Sport machen;
"Diese Geräte sorgen für blitzsaubere Böden;""Anzeige"

Hausarbeit macht nicht jedem Spaß – vor allem, wenn kleine Kinder oder Tiere im Haushalt leben, ist es erforderlich, häufig zu staubsaugen oder zu wischen. Saugroboter mit Wischfunktion können einem gleich zwei Aufgaben abnehmen – die Geräte inspizieren auf Knopfdruck oder nach einem zuvor eingestellten Reinigungsprogramm den Boden und beseitigen so automatisch Schmutz. Wenn auch Sie sich einen Saug-Wisch-Roboter zulegen möchten, haben wir hier einige Tipps für Sie, worauf beim Kauf zu achten ist und welche Produkte sich als wirklich hilfreich erweisen.

Anzeige Jetzt Prime gratis testen und Schnäppchen finden

Saugroboter mit Wischfunktion: Die wichtigsten Vorteile

Darum kann die Anschaffung eines Saug-Wisch-Roboters für Sie sinnvoll sein:

zeitsparende Reinigung in einem Durchgang

noch mehr Sauberkeit als beim bloßen Saugen

automatisierte Reinigung auf Knopfdruck oder nach Programmierung

für viele Bodentypen geeignet

Staubsauger-Roboter mit Wischfunktion: Worauf sollte man beim Kauf achten?

Saugen und wischen gleichzeitig: Roboter sind heute effizienter denn je – zumindest in der Theorie. Denn um ein gutes und für Ihre Bedürfnisse passendes Gerät zu erwerben, sollten Sie unbedingt einige Punkte beachten.

Anzeige

Passend für den Bodentyp: Achten Sie in der Produktbeschreibung darauf, ob das Gerät für die Reinigung Ihres Bodens geeignet ist. Viele Holzfußböden sollten nebelfeucht gewischt werden, einige Geräte wischen allerdings nass. Bei manchen Saugrobotern mit Wischfunktion lässt sich die Wasserabgabe allerdings individuell anpassen.

Ausreichend Power: Eine hohe Saugleistung ist entscheidend: Können größere Schmutzpartikel nicht aufgenommen werden, kann das Gerät sie mitschleifen und so Kratzer im Boden hinterlassen.

Die richtige Ausstattung: Bei Parkett ist besondere Vorsicht geboten: Saug-Wisch-Roboter, die mit einem Mikrofasertuch arbeiten, könnten feine Kratzer im Boden hinterlassen. Zudem ist wichtig, dass die Geräte in der Wischfunktion nicht ständig Wasser abgeben, wenn sie sich länger an einer Stelle befinden (zum Beispiel bei Spot-Reinigung oder wenn sie sich festgefahren haben). Dies könnte sonst zu unschönen Wasserflecken auf dem Holzboden führen.

Anzeige

Beachten Sie beim Kauf außerdem den Unterschied zwischen Wisch- und Saugroboter sowie einem Kombi-Gerät. Einige Produkte (zum Beispiel der Wischroboter von iRobot*) sind ausschließlich zum Wischen geeignet, während Saugroboter wie das Gerät von eufy* nur zum Saugen von Böden dienen.

Anzeige Nassreinigung Braava 390t von iRobot jetzt online kaufen

Anzeige Trockenreinigung Eufy Saugroboter RoboVac 11S jetzt online kaufen

Smarte Funktionen: Wenn Sie den Haushaltshelfer auch von unterwegs steuern möchten, kommt ein Saug-Wisch-Roboter mit WLAN und App-Funktion für Sie infrage.

Saugroboter mit Wischfunktion: Die beliebtesten Modelle

Mit dem günstigen Saug- und Wischroboter von Medion* erhalten Sie ein Gerät, das sich dem Hersteller zufolge auf Hartböden, dünnen sowie hochflorigen Teppichen, Fliesen und Laminat nutzen lässt und dort zuverlässig Staub, Pollen, Tierhaare und Schmutz entfernen kann. Dank des auffüllbaren Wassertanks und dem angebrachten Mikrofasertuch wischt das Gerät auf Wunsch auch durch, um nach getaner Arbeit selbständig an seine Ladestation zu fahren.

Anzeige Saug- & Wischroboter Medion MD 18501 jetzt online kaufen

Anzeige

Ähnlich funktioniert auch das Gerät von ZACO*, Der Wischroboter mit Wassertank und Saugbehälter kann insgesamt 180 Quadratmeter am Stück reinigen. Durch die Spot-Funktion können auch stärker verschmutzte Stellen gründlich gesäubert werden. Zudem ist die Timer-Funktion praktisch – stellen Sie eine gewünschte Zeit ein, damit das Gerät beispielsweise reinigen kann, während Sie unterwegs sind.

Anzeige Saug- & Wischroboter ZACO V5sPro jetzt online kaufen

Ein smarter Saugroboter mit Wischfunktion hat WLAN und kann über eine App betrieben werden – so wie der Proscenic 830 T*. Durch die Verbindung zum kabellosen Heimnetzwerk kann der Haushaltshelfer per App gesteuert werden. Zudem hört er auf Alexa-Befehle – über den Sprachassistenten können Sie das Gerät starten und stoppen, Reinigungspläne erstellen sowie den Modus wechseln. Besonders nützlich: Dank der Teppicherkennung schaltet der Wisch-Saug-Roboter automatisch in einen stärkeren Saugmodus. Auch die Abgabe aus dem Wassertank lässt sich anpassen.

Anzeige Saug- & Wischroboter Proscenic 830T jetzt online kaufen

Ein besonders saugstarker Helfer ist das Premium-Produkt von roborock* – der hohe Preis kann sich dank einiger zusätzlicher Features allerdings auszahlen: Das Gerät schützt sich selbst vor dem Festfahren. So können Sie auch eine punktuelle Wasserabgabe und dadurch entstehende Parkettschäden beim Wischen vermeiden. Mit einer Akkuladung können zudem gleich mehrere Räume gereinigt werden und mit der Bedien-App lassen sich praktische Sperrzonen einrichten.

Anzeige Saug- & Wischroboter roborock S6 von Xiaomi jetzt online kaufen





Dieser Artikel wurde erstmals am 27.01.2020 veröffentlicht.

*Dieser Text enthält Affiliate Links. Das bedeutet: Sollten Sie über die mit einem Stern gekennzeichneten Links einen Kauf abschließen," erhält WELT eine kleine Provision. Die Berichterstattung beeinflusst das nicht. Unsere Standards der Transparenz und journalistischen Unabhängigkeit finden Sie unter axelspringer.de/unabhaengigkeit."""
„Dann kann ich bestimmt ein paar tausend Euro für bekommen“;
Fünf Stunden mit Maske in der Oper – ist das zumutbar?;
2200 Neuinfektionen sind keine „beliebige Schwankung“;
"Corona-Ausbruch bei Hochzeit könnte auf Krankenhauspanne zurückgehen;""Anzeige"

Erst eine Testpanne im Krankenhaus, dann eine Hochzeit, die womöglich zum Supersprading-Event wurde: Mehr als 30 Corona-Fälle in Passau werden nun noch einmal unter die Lupe genommen.

„Aus der Hochzeitsgesellschaft direkt haben sich bisher rund 25 Infektionsfälle bestätigt“, teilte ein Sprecher des Landratsamts Passau auf Anfrage mit. Zudem seien acht Personen positiv getestet worden, die im Kontakt mit Hochzeitsgästen gestanden hätten. Zwei Personen seien in stationärer Behandlung.

Zuvor hatte es eine Testpanne im Krankenhaus Vilshofen gegeben, bei der zwei Personen mit Symptomen zunächst nicht getestet und isoliert wurden, wie das Krankenhaus bestätigte.

Zusammenhänge sind derzeit noch Vermutungen

Anzeige

Mehrere Medien berichten über einen familiären Zusammenhang zwischen einer Patientin und der Hochzeit. Vom Landratsamt heißt es dazu: „Das Gesundheitsamt Passau kann die objektiven Folgen der Feier bestätigen. Die Zusammenhänge im Vorfeld bewegen sich aber letztlich im Bereich von Vermutungen, zu denen sich das Amt nicht äußert.“

Lesen Sie auch Corona und Maskenpflicht „Viele Ausbrüche in Schulen gingen von Lehrern aus“

Die Familie der Braut stellt diesen Zusammenhang allerdings her: Ihr Vater sagte der „Passauer Neuen Presse“, die Großmutter der Braut sei am Freitag, 4. September mit Covid-19-Symptomen eingeliefert worden, ein Test aber erst am 8. September erfolgt. Das positive Ergebnis habe am 9. September vorgelegen.

„Dazwischen hat meine Tochter aber am Sonntag mit 100 Leuten Hochzeit gefeiert. Hätten wir von der Covid-Erkrankung gewusst, hätten wir die Feier abgeblasen.“

Fortan werden im Krankenhaus alle Eingelieferten getestet

Anzeige
