title;text

Welcher Ranzen soll es sein, was für eine Schultüte und mit welchem Inhalt? Stil-Leitfaden Der stylische Shoppingguide für die Einschulung

Klappstullen im Tornister

Quelle: archiv broder

Anzeige

An meinen ersten Ranzen kann ich mich ebenso wenig erinnern wie an meinen ersten Schultag. Ich habe alles, was mit Schule zusammenhängt, komplett entsorgt. Neulich traf ich in Berlin einen Mann, der mich wie einen alten Bekannten begrüßte und behauptete, er sei mit mir auf derselben Schule gewesen, damals in Katowice, vermutlich sogar in derselben Klasse. Er hätte genauso gut behaupten können, wir hätten uns im Haus von Bert Brecht in West-Hollywood bei einer Lesung von Franz Werfel kennengelernt. Was nun den Inhalt des Ranzens angeht, der im Polnischen „Tornister“ heißt, so bin ich ebenfalls auf Vermutungen angewiesen. Für meine Mutter muss es eine schreckliche Vorstellung gewesen sein, ihr Kind könnte während der vier bis fünf Schulstunden verhungern. Sie stopfte den Ranzen voll mit Essen – Klappstullen, Apfelstücken und klein geschnittenen Karotten. Was am Ende des Schultages übrig blieb, verteilte ich an meine Klassenkameraden. Woher ich das weiß? Meine ältere Schwester hat es mir erzählt. Ihr gehörte auch der Ranzen. Henryk M. Broder

Achtung, Fälschung!

Quelle: Juia Hackober

Das Foto ist eine Fälschung. Am Tag meiner Einschulung 1996 regnete es, mein jüngerer Bruder trat nach dem Gottesdienst (Kleinstadtgrundschule in Baden-Württemberg halt) in Hundekot, ich kam zu spät zu meiner allerersten Schulstunde. Alles in allem nicht die besten Voraussetzungen für ein fröhliches Endlich-Schulkind-Foto. Deshalb stellte meine Mutter mich eine Woche später in meiner hellblauen Bluse noch mal in den Garten für ein sonniges Fotoshooting. „Kannst du dich noch an den Schulranzen erinnern?“, fragte ich sie dieser Tage beim Hervorkramen des Fotos. „Der war ja quasi genderneutral mit dem bunten Unterwasserwelt-Muster.“ – „Du wolltest auch nicht so ein kitschiges Ding wie die anderen Mädchen“, sagte meine Mutter. Ich musste lachen. „Nee, du wolltest das nicht!“ Ich sah die roten Bärchen-Ranzen meiner Freundinnen noch vor mir, alle hatten das gleiche Modell. Ich eben nicht. Mit sechs Jahren hatte ich gelernt, was es bedeutete, sich einem Modediktat zu widersetzen: nämlich ein bisschen neidisch auf die anderen und gleichzeitig unheimlich stolz auf den individuellen Geschmack zu sein. Julia Hackober

Vom durchgestylten Schulanfang Party, Party, Party Warum sind wir Deutschen plötzlich so feierwütig?

Schweres Leder

Anzeige

31. August 1970, Einschulung. Jetzt bloß keine Witze über die hochgezogenen Strümpfe! Der Ranzen war schwer, ein gewichtiges Stück aus Leder, sehr robust. Er hat sich nicht erhalten, anders als die Schiefertafel, zusammen mit Griffel und Schwämmchen, und das Lesebuch „Unsere neue Fibel“. Die Tafel hängt heute in der Küche für Einkaufsnotizen; die Fibel besitze ich ebenfalls noch. In meiner Erinnerung spielte der Ranzen keine identitätsbildende Rolle. Das einzige prägende Erlebnis war der Tag, an dem ich besonders leicht und beschwingt zur Schule ging – und dort feststellte, dass ich ganz ohne Ranzen dastand. Ich musste erneut nach Hause laufen und ihn holen. Holger Kreitling





Violetter Amigo

Quelle: Antonia Aravena

Als der Tag meiner Einschulung näher rückte, war ich schrecklich aufgeregt. Das Wichtigste: die perfekte Ausstattung. Ich wollte einen Scout-Ranzen. Und zwar den exakt gleichen, den meine Freundin hatte. Er war weiß und hatte ein für die 90er-Jahre typisches Muster aus wild durcheinandergewirbelten Dreiecken, Schlangen und Kreisen in Neonfarben. Bei Hertie dann die Katastrophe: Alle Scout-Ranzen waren ausverkauft. An der Kasse sah ich ein Kind aus meiner Kindergartengruppe. Er hatte den letzten – allerdings schwarzen – Scout ergattert. Und ich musste mir aus der B-Ware etwas anderes aussuchen. Horror! Meine Eltern entschieden sich für einen violetten Amigo. Bei der Einschulung war ich die Einzige ohne Scout. Mein chilenischer Vater fand’s lustig. Antonia Aravena

Was der Wechsel von der Kita in die Grundschule bedeutet Einschulung Das wird sich ändern, sobald Ihr Kind zur Schule geht

Anzeige





Dieser Text ist aus der WELT AM SONNTAG. Wir liefern sie Ihnen gerne regelmäßig nach Hause.

WELT AM SONNTAG Quelle: WELT AM SONNTAG

Folgen Sie uns unter dem Namen ICONISTbyicon auch bei Facebook," Instagram und Twitter."""
"Er war der Ekel an der Welt;""Es war nicht mein erster Besuch in Brüssel", aber ich habe ihn in Erinnerung behalten, weil alles, was schiefgehen kann, schiefging. Die Maschine hopste über die Wolken und fiel in Luftlöcher, ich fühlte mich wie in einer Wäscheschleuder, beim Einchecken ins Hotel stieß ich mit dem Kopf an die Decke der Dachkammer, die man mir zuwies, und mein Versuch, im Tauchsieder Tee zu kochen, löste Feueralarm aus.

Das flämische Publikum war empört, weil ich Französisch sprach, und die Simultanübersetzung war so schlecht," dass ich ..."""
"Warum die Briten mit Lewis Hamilton nichts anfangen können;""Anzeige"

Den direkten Draht zu seiner Heimat hat Lewis Hamilton in seinem Formel-1-Auto immer dabei. Auf seinem schwarzen Mercedes prangt in Weiß die Startnummer 44, Großbritanniens Landesvorwahl für internationale Telefonanrufe.

Schon seit seinen Zeiten als Kind im Kartsport ist die 44 Hamiltons Lieblingsnummer. Von 2014 an durften Formel-1-Piloten sich ihre Zahl auf dem Auto selbst aussuchen, zuvor hatte der Platz des jeweiligen Rennstalls in der Konstrukteurswertung über die Nummer entschieden. Hamilton wählte damals für sich die 44, die er sich einst als junger Kartfahrer vom Nummernschild seines Vaters abgeschaut hatte.

Obwohl ihm als Weltmeister immer auch die symbolkräftige Startnummer 1 zugestanden hätte, blieb er über die Jahre stets bei der 44. Die Heimat immer auf dem Auto. Und die Heimat im Herzen?

Verehrt wie Schumacher? Nein, weit entfernt davon

Anzeige

Das Verhältnis zwischen dem aktuell besten Piloten, der an diesem Nachmittag auch als Favorit in das zweite Rennen in Silverstone geht, und Großbritannien ist kompliziert. Auf dem Papier ist Hamilton, der im Qualifying hinter seinem Mercedes-Teamkollegen Valtteri Bottas und vor Nico Hülkenberg vom Rennstall Racing Point Zweiter wurde, schon jetzt der erfolgreichste Brite der Formel-1-Geschichte. Sechs Weltmeistertitel, 87 Rennsiege – Jack Brabham und Jackie Stewart, Idole des Motorsports auf der Insel, kommen lediglich auf drei Titel. In dieser Saison kann er sogar die lange als uneinholbar geltende Marke von Michael Schumacher, 51, erreichen und sich zum siebten Mal zum Weltmeister krönen.

Lesen Sie auch 70 Jahre Formel 1 „Während meiner Karriere starben 65 Fahrer“

Schumacher wird in Deutschland bis heute verehrt. Kritik an Deutschlands erstem Formel-1-Weltmeister wird von Flensburg bis an die Alpen schnell als Blasphemie aufgefasst. Der deutsche Sportheld ist unangreifbar. Jetzt steht Hamilton an der Schwelle zur gleichen Titelmarke und kann Schumachers 91 Rennsiege sogar übertreffen. Und doch ist er in England von einer Verehrung wie Schumacher in Deutschland weit entfernt.

Dabei ist das Urteil der britischen Fachleute unstrittig. Kommentatorenlegende Murray Walker, 96, adelt Hamilton vor dem zweiten Rennen in Silverstone: „Für mich ist er besser als Michael Schumacher oder Ayrton Senna, denn an verschiedenen Stellen in ihrer Karriere haben sie sehr diskussionswürdige Fahrmanöver gezeigt. Hamilton war nie so. Er fährt immer blitzeblank. So einen Fahrer wie ihn gab es nie zuvor.“

„Mit ihm als Person können sie nichts anfangen“

Anzeige

Warum mangelt es dann an Akzeptanz? Der Journalist Ben Hunt, 40, Formel-1-Korrespondent für die britische Zeitung „Sun“, begleitete Hamilton während seiner gesamten Karriere. Er analysiert: „Selbst heute, wo er die Chance hat, Michael Schumacher als erfolgreichsten Fahrer der Geschichte abzulösen, sehen die Leute ihn kritisch. Niemand zweifelt an seinem Talent und seinen Fähigkeiten, aber mit ihm als Person können sie nichts anfangen. Auch wenn das nicht wirklich logisch ist.“

Lesen Sie auch Silverstone-Qualifying Vettels Tour der Leiden geht weiter - Hülkenberg verblüfft

Als Gegenbeispiel gilt auf der Insel Anthony Joshua, 30, der derzeit beste Schwergewichtsboxer der Welt. Die Briten lieben ihren „AJ“, der sportlich ähnlich dominant wie Hamilton ist, dem es aber gelingt, ein anderes Image zu verkörpern. Bodenständiger, echter, kerniger, vielleicht dadurch auch nahbarer als der Formel-1-Superstar. Hamiltons Bild in der Öffentlichkeit ist immer noch geprägt von rot lackierten Privatjets, auffälligen Goldketten sowie konsequenter Steuervermeidung durch den Umzug nach Monaco, wo der Mercedes-Pilot – wie fast alle aktuellen Formel-1-Fahrer – heute lebt.

An dieser Stelle finden Sie Inhalte aus Instagram Um mit Inhalten von Instagram und anderen sozialen Netzwerken zu interagieren oder diese darzustellen, brauchen wir Ihre Zustimmung. Soziale Netzwerke aktivieren

Bestätigt sahen sich die Kritiker, als Hamilton im Dezember 2018 versehentlich in einer kurzen Rede auf einer Preisverleihung der BBC seine Heimat Stevenage, ein 80.000-Einwohner-Städtchen 40 Kilometer nördlich von London, mit Slums verglich, denen er als Kind habe „entkommen“ wollen. Obwohl sich der Brite im unmittelbaren Nachsatz korrigierte und das Wort „Slums“ zurücknahm, war der Skandal nicht mehr zu verhindern. Die britischen Medien empörten sich. Sogar der Bürgermeister von Stevenage sah sich zu einer Stellungnahme genötigt und zeigte sich „enttäuscht“ über Hamiltons Aussage.

Hamiltons Wandel ändert nichts am Image

Anzeige

Außerdem sind die Briten offenbar nachtragend. Der rote Privatjet? Längst verkauft. Die auffälligen Goldketten? Vom Hals verschwunden. Umstrittene Äußerungen zu seiner Heimat? Gibt es nicht mehr. Zwar lebt Hamilton noch in Monaco, doch wer ihn in den vergangenen Jahren gerade bei seinen Heimrennen in Silverstone erlebte, dürfte wohl nicht mehr an einer echten Leidenschaft zu seiner Heimat England zweifeln.

In einer Überraschungsaktion besuchte Mercedes-Pilot Hamilton dort unter anderem die Ordner und Streckenposten auf ihren Zeltplätzen, half bei der Essensverteilung und verteilte kleine Geschenke. Während der WM 2018 sinnierte er öffentlich darüber, ob er es trotz des sehr gut gefüllten Formel-1-Kalenders irgendwie als Fan zu einem möglichen Endspiel der englischen Nationalelf schaffen könne. Und wer ihm dabei zuhörte, wusste, dass es ihm ernst war.

Ikonische Pose: Lewis Hamilton reckt nach dem gewonnenen ersten Rennen in Silverstone seine Faust gen Himmel Quelle: dpa/Bryn Lennon

Während andere Piloten am frühen Abend längst aus dem Fahrerlager verschwunden sind, nimmt Hamilton sich vor allem in Silverstone Zeit für kleine Treffen mit Fans im Mercedes-Motorhome. Besonders Menschen mit Behinderung haben dabei immer wieder in einer geschützten, weniger hektischen Atmosphäre die Möglichkeit, ihrem Idol einmal nahe zu sein, Fotos zu machen oder einfach Fragen zu stellen.

Lesen Sie auch Tommie Smith „George Floyd? Für mich war es Mord – Punkt!“

Auch medial gibt sich Hamilton seit einiger Zeit reflektierter, ruhiger, überlegter als früher. Erklärte er gute Rundenzeiten früher auch schon mal prollig-arrogant mit „größeren Eiern“, geht es in Presserunden mit dem Briten heute meist mehr um den Kampf gegen Rassismus und tagespolitische Zusammenhänge als seine Leistung auf der Strecke. Denn nur, weil Hamilton weniger laut auftritt als noch vor einigen Jahren, ist ihm seine Stimme noch lange nicht abhandengekommen.
