title;text

Ploß versprach den Delegierten einen Aufbruch. „Ganz, ganz wichtig für den Neuanfang ist natürlich nicht nur eine inhaltliche Ausrichtung, dass wir uns kümmern, sondern dass wir vor allem geschlossen sind.“ In enger Zusammenarbeit mit der Bürgerschaftsfraktion und deren Vorsitzenden Dennis Thering „wollen wir die Kümmererpartei in den Hamburger Stadtteilen werden“, sagte er. In dem WELT-Gespräch hatte er jüngst deutlich gemacht, dass er Thering den Vortritt lassen würde, wenn für die Wahl 2025 ein Spitzenkandidat gesucht wird. Auch Thering gehört mit 36 Jahren zu der jungen Garde der Hamburger CDU.

Lesen Sie auch Online-Parteitag der CSU Söder will Reichskriegsflagge in Bayern verbieten

Anzeige

„Wenn wir es schaffen, Klimaschutz und Wirtschaftspolitik zusammen zu denken, zu zeigen, wie wir in frühkindliche Bildung investieren und damit Chancen schaffen, wenn wir zeigen, dass wir diejenigen sind, mit denen man in Hamburg sicher und noch viel sicherer lebt, dann bin ich überzeugt, dass wir nicht nur ein Gewinn für Hamburg sein werden, sondern dass wir auch wieder bessere Wahlergebnisse erzielen werden“, versprach er.

Lesen Sie auch Coronavirus Hamburg verhängt fast eine Million Euro an Corona-Bußgeldern

Ein überragendes Ergebnis sind die 86,6 Prozent für Ploß allerdings nicht, er blieb trotz einer Wahlempfehlung des alten Landesvorstands deutlich unter dem Ergebnis, mit dem sein Vorgänger Heintze 2015 ins Amt gekommen war. Damals stimmten 92,5 der Delegierten für den heute 47-Jährigen, der auch dem neuen Vorstand als Schatzmeister angehört. Vielleicht nahmen ihm einige der Delegierten übel, dass sich Ploß zuletzt so deutlich für Friedrich Merz als neuen Bundesvorsitzenden ausgesprochen hatten, weil dieser „gerade in der Nach-Coronazeit der richtige Mann“ wegen seiner Wirtschaftskompetenz sei.

Dennis Thering soll Spitzenkandidat der CDU Hamburg werden. Gewählt wird allerdings erst 2025. Quelle: dpa

Einem Richtungsstreit – „soll die CDU rechter werden, soll die CDU linker werden, soll die CDU eine liberale Großstadtpartei sein?“ – erteilte der neue Vorsitzende eine Absage. „Ich halte von diesen Diskussionen überhaupt nichts“, sagte Ploß. Vielmehr müsse sich die CDU den Themen der Menschen in der Stadt stellen. Und da stünden der Klimaschutz, die wirtschaftliche Entwicklung und derzeit auch die Sorge um den Arbeitsplatz oben an. „Das sind die großen Fragen, die durch Corona noch einen Turbo bekommen haben.“

Zu stellvertretenden Vorsitzenden wurden erneut der Bundestagsabgeordnete Christoph de Vries," die Bürgerschaftsabgeordnete Anke Frieling und die Wirtschaftshistorikerin Nathalie Hochheim gewählt. Neuer Stellvertreter ist der Hamburger JU-Vorsitzende Philipp Heißner."""
„Lassen unsere freiheitliche Demokratie nicht von Rechtsradikalen kapern“;
"Die 1001 Wörter der Nazis für Mord;""Die Nazis führten den größten Massenmord der Menschheitsgeschichte aus. Aber sie wollten es nicht so deutlich sagen. Deshalb gab es in den Akten des Terrors und in der Propaganda eine Fülle von Wörtern", mit denen die Tötung von Menschen bemäntelt wurde.

Anzeige

Gut zwei Wochen vor seinem Tod, kurz bevor Berlin eingeschlossen wurde und er sich in seinem Bunker verkroch, hatte Adolf Hitler keinen Grund mehr, seine Sprache zu verstellen. Im Tagesbefehl an die Soldaten der deutschen Ostfront gab er eindeutige Anweisungen für den Umgang mit Leuten, die am Sinn des bedingungslosen Weiterkämpfens zweifelten: „Wer euch Befehle zum Rückzug gibt, ohne dass ihr ihn genau kennt, ist sofort festzunehmen und nötigenfalls augenblicklich umzulegen, ganz gleich welchen Rang er besitzt.“

Das Wort umlegen war bis dahin zwar schon hinter den Kulissen gebraucht worden, um das Mordgeschehen zu rechtfertigen, aber die Leser der gleichgeschalteten Presse, die Hitlers Aufruf noch lesen konnten – kannten das Wort eher aus Kriminalromanen. Nun war jedoch keine Zurückhaltung mehr nötig. Ungehemmt redete der Diktator wie der Gangsterboss Arturo Ui, als den ihn Bertolt Brecht in einem Theaterstück karikiert hatte.

Lesen Sie auch Naziwörter Als Hitler das Dritte Reich verbot

In den zwölf Jahren zuvor hatte sich das Regime lange Mühe gegeben, sein mörderisches Planen und Handeln zu verschleiern. Für die Tötung von politischen Gegnern, Kranken und Menschen, die als rassisch minderwertig betrachtet wurden, ließ man sich eine Menge mehr oder weniger kaschierender Vokabeln einfallen. Das Regime hatte großen Bedarf an Synonymen für Mord. Und ganz pragmatisch wählte man seine Ausdrucksweise je nachdem, wer angesprochen war und was man damit erreichen wollte.

Anzeige

Wenn der Mord relativ klar benannt werden sollte, um eine Drohung an die Lebenden zu senden, nutzte die Propaganda oft das Verb ausmerzen. So berichtet der „Völkische Beobachter“ am 11. Januar 1942 über die Hinrichtung eines Mannes, der Militärgüter unterschlagen hatte: „Schnell und hart hat das Sondergericht ein gemeines Verbrechen gesühnt und einen Volksschädling ausgemerzt, der einen gemeinen Betrug am Volksgut begangen hatte, das für die Soldaten der Ostfront bestimmt ist.“

Das Gift sind immer die anderen

In den Anfangstagen war die Bedeutung dieses Wortes noch offener gewesen. Man bezog es im Sinne einer Säuberung auf Kultur und Politik. Im „Völkischen Beobachter“ wird schon Anfang März 1933 angekündigt: „Das jüdische Gift, das bewusst das deutsche Kulturleben jahrelang beeinflusst hat und eine moralische Verkommenheit aller Kreise zur Folge hat, wird durch rücksichtslose Maßnahmen unserer Regierung restlos ausgemerzt werden.“ Da konnte sich manche noch der Illusion hingeben, mit ausmerzen wäre ein eher administrativ politischer Vorgang gemeint.

Ganz ähnlich wurden die Wörter säubern und Säuberung, die man heutzutage gemeinhin eher mit dem Terror Stalins und seiner „tschistka“ 1937/38 in Verbindung bringt, von den Nazis zur Einschüchterung und Drohung benutzt – mit ihnen sprach man recht offen von Mord, ohne ihn ganz direkt zu benennen.

Lesen Sie auch Ernährung im NS-Staat „Der Führer legt keinen Wert auf Bio-Gemüse“

Anzeige

Hitler selbst rühmte damit 1944 die Konsequenzen aus dem gescheiterten Attentat vom 20. Juli: „So wie ich aber im Jahre 1934 die Revolte einer kleinen Gruppe innerhalb der Bewegung zum Anlaß ihrer Säuberung genommen habe, so wurde die neue Revolte jedenfalls zum Beginn einer gründlichen Überholung des gesamten Staatsapparates.“ Jeder wusste, dass 1934 im Rahmen der sogenannten „Säuberung“ die SA-Spitze ermordet worden war und dass allen, die mit der Juli-Verschwörung zu tun hatten, nun Ähnliches drohte.

Auch als Synonym für den Massenmord an Juden ist das Wort üblich gewesen: Am 31. Mai 1942 berichtet Ernst Zörner, der Gouverneur des Distrikts Lublin, dem Generalgouverneur des besetzten Polens, Hans Frank: „Man hoffe, im Laufe der Zeit eine möglichste Säuberung des Distrikts von Juden zu erreichen.“ Hier hat es aber eher einen akteninternen Charakter.

Aus dem Lexikon der Mörder

Noch häufiger findet man in solchen internen Dokumenten den Ausdruck Sonderbehandlung, dem der Historiker Joseph Wulf 1964 eine mit vielen Belegen aus Akten der SS grundierte Monografie namens „Aus dem Lexikon der Mörder“ gewidmet hat. Darin schreibt er einleitend: „Kein faschistischer Staat hat den vorbedachten, wohlüberlegten und also absolut vorsätzlichen Mord so bürokratisch genau geplant, gründlich organisiert und dann auch pedantisch nach dem Schema durchgeführt wie das Dritte Reich. Allein das nationalsozialistische Deutschland schuf in seiner Sprache so viele Worte, Ableitungen oder Zusammensetzungen für den Begriff Mord. Die nationalsozialistische Amtssprache ist in der Beziehung einmalig.“ Nicht von allen diesen Wörtern ist heute noch bekannt, welche grausige Bedeutung sie in der Todesbürokratie des NS-Regimes hatten.

Ermordung von Juden durch SS-Einsatzgruppen, vermutlich 1942 Quelle: picture alliance / Everett Colle

Anzeige

Das – neben Endlösung – heute wohl bekannteste Hüllwort der Nazis für Mord ist Euthanasie. Zwar hatte Hitler das Wort gar nicht gebraucht, als er 1939 den sogenannten „Euthanasiebefehl“, in dem er die Tötung von Erkranken und Behinderten anordnete. Doch unter den Ärzten, die so etwas guthießen und ausführten, war das Wort als Bezeichnung ihres Tuns ganz offensichtlich gang und gäbe.

Lesen Sie auch Erinnerungskultur Warum es niemals Hitler-Denkmäler gab

Was sich hinter diesem wohlklingenden bildungsgriechischen Ausdruck verbarg, war allgemeinen bekannt. So bekannt, dass 1941 nach einer geheimen Konferenz mit Propagandaminister Goebbels protokolliert wurde: „Der Minister betont, dass Thema ,Euthanasie’ dürfe jetzt auf keinen Fall berührt werden.“ Als im selben Jahr der Film „Ich klage an“ in die Kinos kam, wurde per Presseanweisung verboten, im Zusammenhang damit von Euthanasie zu schreiben. 1943 wurde die Universitätskinderklinik Jena aufgefordert, Euthanasie nicht mehr für beantragte oder durchgeführte Morde in ihren Krankenakten zu verwenden.

Zu diesem Zeitpunkt war der Ausdruck längst zum Schreckwort geworden. In den „Meldungen aus dem Reich“ des SD heißt es im März 1942: „Es hätten sich zum Beispiel viele Volksgenossen geweigert, an der Röntgenreihenuntersuchung teilzunehmen, da sie nach den Hetzpredigten des Bischofs von Münster und des Bischofs von Trier u. a. eine Ausscheidung (Euthanasie) als ,unproduktive’ Menschen befürchteten.“

Himmler und die „Juden-Evakuierung“

Weniger bekannt ist, dass auch evakuieren neben seiner offiziellen Bedeutung als Hüllwort für Mord diente. Im öffentlichen Sprachgebrauch bezeichnete man damit durch Kriegsfolgen bedingte Umquartierungsmaßnahmen, die durch den verstärkten Bombenkrieg immer häufiger wurden. Auch die angebliche Umsiedlung von Juden wurde sogenannt. Aber in den Akten, internen Befehlen und im mündlichen Sprachgebrauch der SS hatte das Wort ganz eindeutig die Bedeutung „töten“ oder noch viel deutlicher: „ausrotten“. Bezeugt hat das kein geringerer als der Reichsführer SS Heinrich Himmler, der in seiner ersten Posener Rede am 4. Oktober 1943 vor Brigade-, Gruppen- und Obergruppenführern sagte: „Unter uns soll es einmal ganz offen ausgesprochen sein, und trotzdem werden wir in der Öffentlichkeit nie darüber reden. (…) Ich meine jetzt die Juden-Evakuierung, die Ausrottung des jüdischen Volkes.“

Gelegentlich wurde auch das heute allgegenwärtige Bürokratiewort betreuen in den Akten des Regimes verwendet, um nicht allzu deutlich von Mord zu reden. Meist war mit diesem schon von Victor Klemperer und den Autoren von „Aus dem Wörterbuch des Unmenschen“ als Lieblingswort der Nazisprache identifizierten Ausdruck zwar die ideologische Indoktrination der sogenannten Volksgenossen gemeint. Doch wenn man es auf Menschen bezog, die außerhalb der Volksgemeinschaft standen, konnte damit auch Mord bezeichnet werden.

Der Schriftsteller und KZ-Überlebende H. G. Adler bezeugte, dass betreuen in diesem Sinne im Lager Theresienstadt gebräuchlich war. In seinem Buch „Der verwaltete Mensch“ zitiert Adler aus „Tätigkeitsberichten“ der SS über die Ermordung von Juden: „Die Judentransporte trafen in regelmäßigen Abständen in Minsk ein und wurden von uns betreut. So beschäftigten wir uns bereits am 18. und 19. Juni 1942 wieder mit dem Ausheben von Gruben im Siedlungsgelände.“

Heydrich erklärt, was Sonderbehandlung bedeutet

Auch die Rolle, die Sonderbehandlung im NS Wortschatz spielt, ist nicht sehr bekannt. Sonst wäre es wohl kaum einer „Spiegel“-Redakteurin 2018 unterlaufen, davon zu fabulieren, dass die „Sonderbehandlung Israels“ durch die deutsche Außenpolitik beendet werden müsse.

Anzeige

Den frühesten Beleg für Sonderbehandlung im Sinne von „Hinrichtung“ fand Wulf in einem Brief von Reinhard Heydrich, der per Fernschreiben am 20. September 1939, knapp drei Wochen nach Kriegsbeginn, verbreitet wurde. Darin unterscheidet der Chef der Sicherheitspolizei und des Sicherheitsdienstes Fälle von Bürgern des Deutschen Reichs, die durch ihre Äußerungen die Geschlossenheit und die Kampfmoral untergraben, „zwischen solchen, die auf dem bisher üblichen Wege erledigt werden können, und solchen, welche einer Sonderbehandlung zugeführt werden müssen. Im letzteren Falle handelt es sich um solche Sachverhalte, die hinsichtlich ihrer Verwerflichkeit, ihrer Gefährlichkeit oder ihrer propagandistischen Auswirkung geeignet sind, ohne Ansehung der Person durch rücksichtslosestes Vorgehen, nämlich durch Exekution, ausgemerzt zu werden.“

Hier bringt es Heydrich fertig, gleich mehrere „Mord“-Synonyme in einem Satz zu benutzen und das eine durch die anderen zu erklären. Neben Sonderbehandlung und ausmerzen ist es Exekution. Das Substantiv und das entsprechende Verb exekutieren tauchen immer wieder in SS-Akten und in Zeugenaussagen bei den Nürnberger Prozessen gegen die Hauptkriegsverbrecher auf. Am 28. September meldet die Einsatzgruppe C vom Standort Kiew: „Exekution von mindestens 50 000 Juden vorgesehen. Wehrmacht begrüßt Maßnahmen und erbittet radikales Vorgehen. Stadtkommandant öffentliche Hinrichtung von 20 Juden befürwortet.“

Weitere Wörter, die in den Akten und den Aussagen nach 1945 immer wieder auftauchen, sind austilgen, vernichten, ausrotten und umsiedeln – manchmal auch das konkrete Verb erschießen. Doch meist beließen die Mörder es beim etwas nebelhaften Wort Sonderbehandlung.

Lesen Sie auch Ein Mann, ein Wort Die Legende vom Nazi-Begriff „Altpartei“

Das Wort Sonderbehandlung taucht massenhaft in den Akten des Regimes auf und bezeichnet immer ganz unumwunden die Ermordung von Kriegsgefangenen, KZ-Häftlingen oder Deutschen im Reich, die sich irgendeines Vergehens schuldig gemacht hatten. Ursprünglich hatte es eine Tarnfunktion, aber die muss irgendwann so durchsichtig gewesen sein, dass seine Benutzung in den Medien und Heeresberichten genau wie die von liquidieren verboten wurde.

1943 forderte schließlich sogar Heinrich Himmler einen Inspekteur für Statistik auf, einen Bericht über die „Endlösung der europäischen Judenfrage“ umzuformulieren. Er wünsche, „dass an keiner Stelle von Sonderbehandlung der Juden gesprochen wird“. Stattdessen sollten gefälligst Formulierungen wie Transportierung nach dem russischen Osten oder durchschleusen verwendet werden.

Was die Nazis von Stalin lernten

Auch die Benutzung des Wortes liquidieren wurde der gleichgeschalteten Presse untersagt. Das Verbot musste mehrmals wiederholt werden, weil der Ausdruck so gängig war, dass er immer mal wieder durchschlüpfte. Im Nürnberger Kriegsverbrecherprozess berichtete der ehemalige Offizier der militärischen Abwehr Erwin von Lahousen, sein Chef Admiral Wilhelm Canaris habe am 12. September 1939 von Außenminister Ribbentrop den Auftrag bekommen, einen Aufstand in der galizischen Ukraine zu inszenieren, der als Vorwand für die Ausrottung der dort lebenden Juden und Polen zu dienen hätte und bei dem „alle Gehöfte in Flammen aufgehen“ sollten. Diese Formulierung habe ihn überrascht, denn: „Ansonsten wurde nur von ,liquidieren’ oder ,umlegen’ gesprochen.“

Den der Kaufmannssprache entstammenden Ausdruck liquidieren hatten zuerst die erklärten Todfeinde der Nazis als Euphemismus für Mord gebraucht: In Stalins Terrorregime war er schon im Sinne von „beseitigen“ und „töten“ im Gebrauch, bevor er im Dritten Reich aufkam.

Das und alle Verbote hielten Hitler selbst nicht davon ab, den Ausdruck noch ganz am Schluss in seinen letzten Allmachtsfantasien zu verwenden. In dem Film „Der Untergang”, der 2004 in die Kinos kam und weitestgehend auf historischen Quellen und Zeugenaussagen beruht, die Anthony Beevor und Joachim Fest kompiliert haben, schreit Hitler bei einem Wutanfall im Führerbunker: „Ich hätte gut daran getan, vor Jahren alle höheren Offiziere liquidieren zu lassen, wie Stalin!“

Der Artikel ist die leicht erweiterte Fassung eines Originalbeitrags für den Band „Nie wegsehen. Vom Mut, menschlich zu bleiben“, herausgegeben von Harald Roth, der im Dietz-Verlag erschienen ist (288 Seiten," 22 Euro)"""
