title;text
"Am 29. gelte dieselbe Zeit wie am 22. September: """"Bitte gehen Sie zwischen 8 und 18 Uhr in ihr Wahllokal. Niemand will"," dass Sie vor verschlossenen Türen stehen."""""
dav, Foto oben: Rufus46," CC BY-SA 3.0; Hinweis: Schnatterente hatte die selbe Idee schon etwas früher"""
"Fairer Lohn für Regierungsarbeit: FDP fordert bundesweiten Mindeststimmenanteil von 5%;""Die FDP hat heute überraschend einen Gesetzesentwurf eingebracht"," der einen sogenannten """"bundesweiten Mindeststimmenanteil"""" von 5 Prozent vorsieht. Damit soll gewährleistet werden", dass Parteien, die jahrelang harte Regierungsarbeit geleistet haben, genügend Stimmen erhalten, um davon leben zu können. Das Gesetz soll noch in dieser Legislaturperiode verabschiedet werden. 

"Leistung muss sich wieder lohnen"""""," erklärte FDP-Parteivorsitzender Philipp Rösler bei einer Pressekonferenz. """"Wenn eine Partei vier Jahre lang hart gearbeitet hat", soll sie dafür auch angemessen entlohnt werden. Es ist bereits ungerecht, wenn eine Partei ein Vielfaches der Stimmen erhält, nur weil sie eine Koalition anführt. Stimmenanteile von unter 5 Prozent jedoch sind menschenunwürdig und eine Schande für unser Land. Es kann nicht sein, dass man um Leihstimmen betteln muss," damit es zum Überleben reicht."""""


Soll die ganze Arbeit umsonst gewesen sein? Brüderle beim Anbau von Genkartoffeln
Fünf Prozent seien für Rösler die absolute Untergrenze, um sicherzustellen, dass Abgeordneten-Diäten und Spenden deutscher Unternehmen - etwa für die Verhinderung der Einführung eines  Mindestlohns - weiterfließen können. Sollte eine Regierungspartei bei Bundestagswahlen unter diese Schwelle fallen, müssten andere Parteien solidarisch so viele Stimmen abgeben, bis die 5 Prozent erreicht sind.
Ob der bundesweite Mindeststimmenanteil von fünf Prozent für Regierungsparteien tatsächlich kommen wird, ist noch unklar. Sämtliche Oppositionsparteien sowie zahlreiche Politiker von CDU und CSU erklärten bereits, dem Gesetz nicht zustimmen zu wollen. Ihrer Ansicht nach sei der Stimmenanteil von Regierungsparteien Sache der Tarifpartner. Wenn die Bürger der Bundesrepublik Deutschland (Arbeitgeber) die Arbeit einzelner Parteien (Arbeitnehmer) nicht großzügiger entlohnen wollen, dann sei es nicht Aufgabe der Politik, hier regulierend einzugreifen und einen Mindeststimmenanteil zu diktieren. Foto oben: Dirk Vorderstraße," Foto rechts: BASFPlantScience"""
"Politikverdrossenheit immer schlimmer: 20 Prozent weniger Wahlplakate verschandelt als 2009;""Interessieren sich die Deutschen immer weniger für Politik? Eine aktuelle Studie des Instituts für Politikwissenschaften der Freien Universität Berlin hat ergeben", dass im Vorfeld der Bundestagswahlen 2013 nur knapp 20.000 von rund einer Million Wahlplakaten mit Schnurrbärten, Teufelshörnern, Brillen oder abfälligen Schimpfwörtern verunziert wurden. Dies seien  20 Prozent weniger als 2009 – ein erschreckendes Signal.

Denn immer mehr Bundesbürger fühlen sich von der Politik so im Stich gelassen, dass sie sich nicht einmal mehr aufraffen können, ihren sogenannten Volksvertretern wenigstens ein Hitlerbärtchen aufzumalen – eigentlich eine Sache von nur wenigen Sekunden. 


Eine Schande: Auch wenn es nicht so aussieht, dieses Plakat ist völlig unverschandelt

Der langweilige Wahlkampf und die geringen Unterschiede zwischen den etablierten Parteien führen offenbar dazu, dass immer weniger Leute bereit sind," für ihre Überzeugungen nachts um die Häuser zu ziehen und sich mit Edding oder Spraydose politisch zu betätigen"""""," stellt Politikwissenschaftler Werner Unkenreuth fest. """"Dabei war schon 2009 mit etwa 25.000 beschmierten Wahlplakaten eines der schwächsten Wahljahre seit Gründung der Bundesrepublik."""""
Sollte der gegenwärtige Negativtrend anhalten, könnten die Parteien schon bei den Bundestagswahlen 2017 erstmals gezwungen sein, mit gemeinen Sprüchen, Zahnlücken oder einem stilisierten Penis vorverschandelte Plakate aufzuhängen," um wenigstens den Anschein einer funktionierenden Demokratie zu wahren. Idee: DerBlödmann"""
NSA beruhigt," weil es in deutschen Privat-Mails und -Telefonaten immer weniger um NSA-Skandal geht;""Aufatmen bei der NSA! Offenbar hat in der deutschen Bevölkerung das Interesse an den Überwachungs­tätigkeiten des US-amerikanischen Auslandsgeheimdienstes spürbar nachgelassen. Dies ist das Ergebnis einer NSA-internen Auswertung von 10.004 aktuellen Telefonaten sowie eine Volltextsuche in mehreren Millionen E-Mails und Online-Chats repräsentativ ausgewählter Bundesbürger. "

Angesichts dieser beruhigenden Entwicklung schloss sich NSA-Direktor Michael S. Rogers der Einschätzung von Kanzleramtsminister Ronald Pofalla (CDU) an, der den Überwachungsskandal bereits vor Monaten für beendet erklärt hat. 


Kann weiterlaufen: PRISM
