title;text
"Ab morgen rollt der Ball! FIFA richtet völlig überraschend WM 2015 aus;""Olé! Olé! Die ganze Welt ist im Fußballfieber! Denn soeben hat FIFA-Präsident Sepp Blatter in einer Pressekonferenz angekündigt", dass entgegen den üblichen Gepflogenheiten schon in diesem Jahr ganz spontan eine Fußballweltmeisterschaft stattfinden wird. Und das Beste: Das Turnier," das unter dem Motto """"Hey"," look! A Worldcup!"""" steht", geht schon morgen los!

"Die FIFA WM 2015 wird ein Freudenfest für die ganze Welt"""""," verkündete Sepp Blatter. """"Sechs Wochen Spannung pur", Public Viewing, grenzenloser Jubel und jede Menge Berichterstattung, in der es ausschließlich um die richtige Taktik," die Wade von Cristiano Ronaldo und die Leistung der Schiedsrichter geht."""" "


Das offizielle Logo der WM 2015

"Dabei steht noch nicht einmal der Austragungsort fest. """"Der FIFA ist egal", wo die WM 2015 stattfindet. Hauptsache," es geht bald los. Wir nehmen noch...""""", Blatter blickt kurz auf seine Uhr," """"...die nächsten 28 Minuten Bewerbungen an. Das Land", das spontan genug ist, ein Großturnier innerhalb weniger Stunden zu organisieren und imstande ist, morgen das Eröffnungsspiel auszurichten," erhält den Zuschlag."""""
"Die langwierige WM-Qualifikation entfällt vollständig. """"Qualifiziert sind alle Teams"," die rechtzeitig zum Anpfiff da sind""""", so der FIFA-Präsident. Auch die Übertragungsrechte werden derzeit ohne große Hürden direkt vergeben. In Deutschland wird die WM daher vollständig vom Shoppingsender QVC ausgestrahlt, dessen Redaktion sich als erste bei der FIFA meldete.  
Die Frage eines Journalisten, ob die FIFA trotz des Korruptionsskandals plane, morgen Sepp Blatter erneut zum Präsidenten zu wählen, ging im allgemeinen Jubel unter," als der FIFA-Präsident einen Original FIFA-WM-2015-Ball (Name: """"Diversion"""") in die begeisterte Reportermenge warf. Foto oben: Fotolia"""
"Sepp Blatter aus völlig unerfindlichen Gründen nicht unter den verhafteten FIFA-Funktionären;""Sechs Spitzenfunktionäre der FIFA", darunter Vize-Präsident Jeffrey Webb, wurden heute Morgen in Zürich wegen Geldwäsche und Korruption festgenommen. Was Kenner des Fußballweltverbandes verblüfft: Sepp Blatter war mysteriöserweise nicht unter den Verhafteten. Darüber, warum der FIFA-Präsident nicht längst im Gefängnis sitzt, gehen die Meinungen auseinander.



For the game. For the world. Am Arsch die Räuber.

Einige FIFA-Experten können sich vorstellen, dass sich der 79-Jährige einem Zugriff durch die Polizei durch eine überstürzte Flucht entzogen hat. Dagegen spricht jedoch, dass darüber bislang nichts bekannt ist und Blatter sich bereits an dem Ort befindet, an den Wirtschaftsverbrecher üblicherweise flüchten – in der Schweiz.
Andere mutmaßen, dass es Sepp Blatter gelungen sein könnte, genügend Fahnder, Mitwisser und überhaupt jede Person in seinem Umfeld zu bestechen, um - dank der sechs Bauernopfer - unbehelligt weiter an der Spitze der FIFA bleiben zu können. Dieses Szenario gilt vielen als das wahrscheinlichste. 
Als dritter Grund käme der Vollständigkeit halber noch in Frage, dass Blatter schlicht unschuldig ist. Allerdings brach bislang noch jede Person in irres Gelächter aus, die an diese Möglichkeit auch nur einen Gedanken verschwendete. Foto: Sputniktilt," CC BY-SA 3.0"""
"Wegen Bahnstreik: Hoffenheim-Fans fahren im Smart zum Auswärtsspiel;""Weil der Bahnstreik noch bis ins Bundesliga-Wochenende hineinragt", müssen die Fans von 1899 Hoffenheim umplanen: Anstatt wie gewohnt per Zug zum Spiel zu reisen, fährt die gesamte Anhängerschaft der TSG nun mit einem Smart zum Auswärtsspiel nach Frankfurt, wo die beiden ihre Mannschaft mit der gewohnten Leidenschaft unterstützen wollen.

Es ist natürlich eine Umstellung," aber für unseren Verein tun wir alles""""", erklärt Marcus Ewert," Vorsitzender der Fanclubs """"Two Man Revolution"""" und Anführer der umstrittenen Fanbewegung """"Ultras for life since 2013"""". Die sonst übliche Anreise des TSG-Fanblocks in einem Sonderdoppelsitz der Deutschen Bahn findet er bequemer. """"Jetzt darf halt leider die Hälfte von uns keinen Alkohol trinken"," das schlägt natürlich auf die Stimmung."""" Deshalb habe man diesmal auch nur einen halben Sixpack Bier mitgenommen. "
Der neue Anreiseweg der Hoffenheim-Fans wurde inzwischen auch von der Frankfurter Polizei bestätigt. Man werde die Kraichgauer nicht wie zuvor geplant am Hauptbahnhof mit einer Einschaft Polizisten empfangen. Stattdessen habe man einen zuverlässigen Beamten direkt vor dem Stadion abgestellt, um die eintreffenden Hoffenheimer dort abzuschirmen und in ihren Fanblock zu geleiten.  
Die TSG 1899 Hoffenheim ist nicht der einzige Klub, dessen Auswärtsfans aufgrund des Bahnstreiks umstellen müssen. So hat unter anderem die Anhängerschaft von Bayer 04 Leverkusen angekündigt, ersatzweise mit dem Tandem nach Mönchengladbach zu reisen. Damit alle Plätze besetzt sind," wird laut Fanhomepage noch """"ein/e Mitfahrer/in (hinten)"""" gesucht."
dav," Foto oben [M]: Fotolia"""
