title;text
Nach dem Ausbruch von Corona im Umfeld Trumps hat sich das Weiße Haus als unfähig und unverantwortlich gezeigt. So hat man etwa beschlossen, keine Kontaktnachverfolgung für die Veranstaltung im Rosengarten zu machen. Und auch andere Begegnungen des Präsidenten und infizierter Mitarbeiter wurden kaum oder nur mangelhaft nachverfolgt.

Lesen Sie auch Trump und das Coronavirus Schadenfreude - das ist Deutsch für Weltbürger

Anzeige

Das gilt auch für die Spendenveranstaltung in New Jersey, für die das Weiße Haus spät unvollständige Kontaktinformationen an die zuständigen Behörden übermittelte. Das ist umso erstaunlicher, weil inzwischen weit über 20 Menschen erkrankt sind, die entweder im Umfeld des Präsidenten arbeiteten oder engen Kontakt mit ihm und seinen Mitarbeitern hatten. Zuletzt hat es etwa Trumps Pressesprecherin Kayleigh McEnany erwischt. Das Weiße Haus, sagen Insider, ähnele inzwischen einer Geisterstadt.

Der Amts- und Regierungssitz des US-Präsidenten ist also zu einer Superspreader-Institution geworden. Und der Umgang mit den Infektionsketten weist im Kleinen denselben Mangel an Verantwortungsbewusstsein auf, den die Trump-Regierung in den vergangenen Monaten im Großen bei der Eindämmung der Corona-Pandemie an den Tag gelegt hat, die inzwischen schon 210.000 Amerikaner das Leben kostete.

Trump brachte viele Menschen in Gefahr

Und dann ist da noch der Präsident selbst. Es ist erschütternd, dass es Trump gänzlich gleich zu sein schien, wen er alles noch anstecken könnte. Statt früh in Quarantäne zu gehen, hat er Mitarbeiter, Unterstützer, Parteifreunde und Spender in Gefahr gebracht. Das gilt auch für die Agenten des Secret Service, die Trump bei seinem PR-Ausflug zu seinen Fans am Sonntag genauso begleiten mussten wie am Montag, als er trotz noch nicht ausgestandener Infektion per Helikopter zurück zum Weißen Haus gebracht werden wollte, wo er dann abermals gefilmt wurde, wie er ohne Maske auf engem Raum mit Angestellten redete. Secret-Service-Agenten sind bereit, wenn nötig ihr Leben für den Präsidenten zu geben. Das bedeutet aber nicht, dass man ihr Leben und ihre Gesundheit ohne Not in Gefahr bringen sollte.

Als Trump erkrankte, sprach CDU-Politiker Friedrich Merz über seine eigene Erfahrung mit Covid-19, die ihn demütiger gemacht habe. Er wünschte sich, dass Trump die Erkrankung ernst nehmen und entsprechend Konsequenzen ziehen werde im Umgang mit Corona. Von Demut und Ernst ist bei Trump jedoch wenig zu entdecken, seit er wie ein Triumphator ins Weiße Haus zurückkehrte.

Lesen Sie auch Trumps Corona-Therapie „Wir würden Angela Merkel in Deutschland nicht so behandeln“

Stattdessen spielte er das Virus weiter herunter, ganz so, als sei es nur eine Kleinigkeit gewesen, dass er selbst an Atemgeräte angeschlossen werden musste. „Lasst euch nicht davon dominieren“, sagte Trump in einem Twitter-Video über Corona, „habt keine Angst“. Er behauptete gar, es sei ein Ausdruck von Führungsqualität, dass er das Risiko einer Ansteckung eingegangen sei.

Und eine Sprecherin seiner Kampagne stellte es so dar, als sei Trumps Infektion etwas, das ihm einen wichtigen Erfahrungsvorsprung vor seinem Herausforderer Joe Biden gebe. Eine Erkrankung wohlgemerkt, die wahrscheinlich hätte vermieden werden können, wenn Trump verantwortungsvoller gehandelt hätte und er den Empfehlungen seiner eigenen Gesundheitsexperten gefolgt wäre.

An dieser Stelle finden Sie Inhalte von Drittanbietern Um mit Inhalten von Drittanbietern zu interagieren oder diese darzustellen, brauchen wir Ihre Zustimmung. Externe Inhalte aktivieren

Es sieht also nicht so aus, als sei der Präsident durch Erfahrung klug geworden. Und das ist eines der schlechtesten Ergebnisse, die dieses Trump-Corona-Drama haben konnte. Trump muss sich nicht nur vorwerfen lassen, dass seine Regierung kläglich versagt hat bei der Bekämpfung der Pandemie, woran die systematische Verharmlosung durch den Präsidenten großen Anteil hatte.

Anzeige

Er hat mit seiner Positionierung gegen Corona-Regeln und seinem schlechten persönlichen Vorbild auch dafür gesorgt, dass Maskentragen und soziale Distanz zu ideologisch und politisch aufgeladenen Themen wurden und zu einer Art Glaubensbekenntnis. Weshalb die harten Trump-Fans, die inzwischen zu einer politischen Sekte geworden sind, es als Ausdruck ihrer Treue zum Präsidenten sehen, auf Schutzmaßnahmen zu verzichten. Was wiederum die Ausbreitung des Virus begünstigt.

Es gab anfangs die Hoffnung, dass der Schreck der Erkrankung den Präsidenten und seine Fans zum Umdenken bewegen würde. Danach sieht es derzeit jedoch nicht aus. Stattdessen scheint sich Trump nur noch weiter in seiner Verharmlosungsposition einzuigeln. Und das ist keine gute Nachricht für ein Amerika, in dem die Pandemie immer noch auf hohem Niveau wütet.

Hier können Sie unsere WELT-Podcasts hören Wir nutzen den Player des Anbieters Podigee für unsere WELT-Podcasts. Damit Sie den Podcast-Player sehen können und um mit Inhalten aus Podigee und anderen sozialen Netzwerken zu interagieren oder diese darzustellen, brauchen wir Ihre Zustimmung. Soziale Netzwerke aktivieren

"Im Podcast „Inside USA“ erfahren Sie alles über den US-Wahlkampf – jeden Freitag neu."""
Senat berät über Alkoholverbote oder Sperrstunden für Berlin;Die Coronazahlen steigen wieder – vor allem in deutschen Großstädten. In Frankfurt am Main wurde nun mit Sperrstunden, Maskenpflicht im Freien und einem Alkoholverbot umfangreiche Verschärfungen beschlossen. Auch in der Hauptstadt wurde bei den Regeln nun nachgelegt.
Bundestrainer Löw äußert sich vor der Partie gegen die Türkei;Mit einem B-Kader und mitten in der Corona-Krise: Der Sinn des Testspiels gegen die Türkei erschließt sich nicht jedem Fan. Was Bundestrainer Löw und die Spieler Havertz und Brandt vor der Partie sagen, sehen Sie in der Pressekonferenz, hier live.
"Unbekannter Täter hielt Menschen in seiner Gewalt;""Anzeige"

Nach einem Banküberfall und einer Geiselnahme in Berlin-Köpenick hat die Berliner Polizei den mutmaßlichen Täter gefasst. Der Mann sei festgenommen worden, twitterte die Polizei am Dienstagnachmittag etwa drei Stunden nach dem ersten Alarm. Vorher habe die Polizei „längere Zeit in Kontakt mit dem Verdächtigen“ gestanden. „Er hatte zwei Frauen und einen Mann in der Postbank-Filiale bedroht.“

Gegen 14 Uhr war nach WELT-Informationen aus einer Bank-Filiale im gleichnamigen Stadtbezirk ein Notruf im Lagezentrum eingegangen. Demnach hatte ein offenbar bewaffneter Täter versucht, unter der Androhung von Gewalt an die Einnahmen des Geldinstituts zu gelangen.

Die Berliner Polizei evakuierte das Areal um das Einkaufszentrum, auch der naheliegende Bahnhof wurde gesperrt. Es kam und kommt zu zahlreichen Verkehrsbeeinträchtigubgen.

An dieser Stelle finden Sie Inhalte aus Twitter Um mit Inhalten aus Twitter und anderen sozialen Netzwerken zu interagieren oder diese darzustellen, brauchen wir Ihre Zustimmung. Soziale Netzwerke aktivieren

Einsatzkräfte der Polizei kommen mit dem Motorrad zum Einsatz Quelle: dpa/Britta Pedersen

Anzeige

Laut einer Sprecherin waren die genauen Umstände des Tathergangs und der Motivation des Täters noch unklar; offiziell wurde lange Zeit nicht von einer Geiselnahme gesprochen. Dennoch waren Elite-Polizisten des Spezialeinsatzkommandos (SEK) vor Ort, ein Hubschrauber kreist über dem Gebäude, Rettungskräfte stehen vor Ort bereit," um notfalls Verletzte versorgen zu können. Laut Polizei waren rund 200 Beamte im Einsatz."""
"In 24 Minuten rechnet Michelle Obama mit Donald Trump ab;""Michelle Obama hat sich in einem Video mit vernichtender Kritik an US-Präsident Donald Trump zu Wort gemeldet. Der Präsident sei dem Job nicht gewachsen. Sie rief schwarze Wähler dazu auf", ihre Stimme nicht zu „verschleudern“.

Michelle Obama hat sich in einem Video mit vernichtender Kritik an US-Präsident Donald Trump zu Wort gemeldet. Darin wirft sie Trump „vorsätzliches Missmanagement“ der Coronavirus-Krise und Rassismus vor.

Anzeige

Die frühere First Lady der USA, Michelle Obama, hat US-Präsident Donald Trump „vorsätzliches Missmanagement“ der Corona-Krise vorgeworfen. „Unser Land befindet sich im Chaos, weil der Präsident dem Job nicht gewachsen ist“, sagte sie am Dienstag in einem 24-minütigen Video mit dem Titel „Schlussplädoyer“ bei Twitter. Sie rief Schwarze und alle jungen Wähler auf, ihre Stimmen bei der Präsidentenwahl nicht zu „verschleudern“, sondern für den demokratischen Präsidentschaftskandidaten Joe Biden zu stimmen.

„Wenn Sie ein Elternteil sind wie ich, spüren Sie die Konsequenzen des Scheiterns des Präsidenten, diese Pandemie ernst zu nehmen.“ Der Präsident habe die Wichtigkeit von Masken und social distancing heruntergespielt. Er habe Druck auf Schulen ausgeübt, wieder zu öffnen, „ohne einen klaren Plan oder Unterstützung zu bieten für die Sicherheit von Lehrern und Schülern“.

Sie wies in dem Video, das auch vom Wahlkampfteam von Joe Biden veröffentlicht wurde, darauf hin, dass mehr Amerikaner im Zusammenhang mit Covid-19 gestorben seien als in den Kriegen im Irak, Afghanistan, Vietnam und Korea zusammen. In Bezug auf das Virus werde „unser Oberkommandeur“ traurigerweise „im Kampf vermisst“.

Anzeige

Obama nahm auch Bezug auf die Proteste gegen Rassismus und Polizeigewalt in den USA in den vergangenen Monaten. Trump agiere rassistisch, wenn er und andere Republikaner wahrheitswidrig behaupteten, dass Minderheiten die Vorstädte zerstören würden. Damit ziele er darauf ab, von seinem „atemberaubenden Versagen“ abzulenken.

An dieser Stelle finden Sie Inhalte aus Twitter Um mit Inhalten aus Twitter und anderen sozialen Netzwerken zu interagieren oder diese darzustellen, brauchen wir Ihre Zustimmung. Soziale Netzwerke aktivieren

„An alle jungen Menschen da draußen, an alle schwarzen (...) Leute, an alle, die sich frustriert und isoliert von diesem ganzen System fühlen, ich verstehe euch. Ich tue es wirklich“, sagte sie. „Aber angesichts des Frusts und der Isolation, die ich während meines Lebens erfahren habe, habe ich nicht zu wählen jemals für eine echte Option gehalten.“

Auf Twitter fügte sie hinzu, sie denke an alle, die vom Coronavirus erfasst worden seien, „von denen im Weißen Haus, besonders dem Secret Service und dem Personal, bis zu all jenen, deren Namen und Geschichten die meisten von uns leider niemals erfahren werden“. Das „Drama der vergangenen Tage“ habe deutlich gemacht, was bei dieser Wahl auf dem Spiel stehe, „vom Coronavirus bis hin zu einem ständigen Trommelschlagen aus Angst, Spaltung und Chaos“.

Hier können Sie unsere WELT-Podcasts hören Wir nutzen den Player des Anbieters Podigee für unsere WELT-Podcasts. Damit Sie den Podcast-Player sehen können und um mit Inhalten aus Podigee und anderen sozialen Netzwerken zu interagieren oder diese darzustellen, brauchen wir Ihre Zustimmung. Soziale Netzwerke aktivieren

Anzeige

Im Podcast „Inside USA“ erfahren Sie alles über den US-Wahlkampf – jeden Freitag neu

US-Präsident Donald Trump hatte vergangene Woche seine Infektion mit dem Coronavirus öffentlich gemacht. Neben First Lady Melania Trump steckten sich auch Trumps Wahlkampfmanager Bill Stepien und die Sprecherin des US-Präsidenten, Kayleigh McEnany," an."""
"Neue Verdienstgrenze bei Minijobs „längst überfällig“;""Die nordrhein-westfälische Landesregierung fordert die Anhebung der Verdienstgrenze für Minijobs. Der Vorstoß ist Teil einer Bundesratsinitiative des Landes zum Bürokratieabbau", die Ministerpräsident Armin Laschet (CDU) in Berlin vorgestellt hat.

NRW will Verdienstgrenze bei Minijobs auf 530 Euro erhöhen

Anzeige

Die nordrhein-westfälische Landesregierung fordert die Anhebung der Verdienstgrenze für Minijobs von 450 auf 530 Euro im Monat. Der Vorstoß ist Teil einer Bundesratsinitiative des Landes zum Bürokratieabbau, die Ministerpräsident Armin Laschet (CDU) und Wirtschaftsminister Andreas Pinkwart (FDP) am Dienstag in Berlin vorstellten. Die Erhöhung der seit 2013 unveränderten Verdienstgrenze sei „längst überfällig“, sagte Pinkwart.

NRW will die Initiative mit 48 Vorschlägen am Freitag in den Bundesrat einbringen. Darin wird gefordert, die Rettungs- und Konjunkturprogramme zur Bewältigung der Corona-Krise durch ein Programm zum Bürokratieabbau zu ergänzen. Die Landesregierung spricht sich darin unter anderem gegen die Einführung einer Vermögensteuer oder Vermögensabgabe sowie gegen eine Finanztransaktionssteuer aus.

Lesen Sie auch Beginn der Ausbildung Konto, Steuern, Sparplan – das müssen Azubis und Eltern jetzt wissen

Das Lieferkettengesetz sollte aus Sicht der NRW-Regierung erst dann eingeführt werden, wenn die Belastungen durch die Corona-Pandemie überwunden sind. Mit dem Lieferkettengesetz will Entwicklungsminister Gerd Müller (CSU) deutsche Unternehmen verpflichten, die Einhaltung sozialer und ökologischer Mindeststandards durch ausländische Lieferanten zu garantieren.

Anzeige

Die Höchstdauer für eine sachgrundlose Befristung eines Arbeitsverhältnisses soll nach den Vorstellungen der NRW-Regierung für die Dauer der Pandemie von zwei auf drei Jahre verlängert werden. Die Bundesratsinitiative enthält zudem Vorschläge zur Beschleunigung von Planungsverfahren bei Infrastrukturprojekten. Auf diesem Feld stehe sich Deutschland „selbst im Weg“," sagte Pinkwart."""
"Wie ein Gespräch mit Tuchel Draxler vom Bleiben überzeugte;""Anzeige"

