title;text
- Im Februar 2020 soll der Rapper zudem versucht haben, eine Sauerstoffflasche aus einem unverschlossenen Rettungsfahrzeug an einer Tankstelle zu stehlen.

Diesmal übertrifft der Richter sogar die Forderung der Staatsanwaltschaft, die eine Freiheitsstrafe von einem Jahr und zwei Monaten ohne Bewährung gefordert hatte. Die Strafe lautet: ein Jahr und sechs Monate Haft ohne Bewährung. In den Knast kommt Gzuz (erst mal) nicht, er bleibt auf freiem Fuß. Sein Verteidiger, der TV-Anwalt Christopher Posch, kündigte an, Rechtsmittel gegen das Urteil einzulegen. Damit wird der Fall wohl bald vor dem Landgericht verhandelt.

Das Rapperleben kann lukrativ sein

Anzeige

Richter Johann Krieten ist bekannt für seine konsequenten, manchmal harten Urteile. Im ersten Prozess zu den G-20-Krawallen hatte er einen Angeklagten für zwei Flaschenwürfe auf Polizisten zu zwei Jahren und sieben Monaten ohne Bewährung verurteilt. Das Urteil wurde in der nächsten Instanz revidiert, der Angeklagte zu einem Jahr und neun Monaten auf Bewährung verurteilt.

„Sie müssen auch an Ihrem Vermögen getroffen werden“, sagt Richter Krieten diesmal zu Gzuz, zu der Haftstrafe kommt eine Geldstrafe von 300 Tagessätzen à 1700 Euro, also insgesamt 510.000 Euro. Die Tagessätze orientieren sich an den Einnahmen des Angeklagten, das Gericht hatte große Anstrengungen unternommen, die hohen Einnahmen des Rappers aus Downloads, Konzerten, Gema-Gebühren und Zuwendungen der Plattenfirma zu ermitteln.

Ein Beispiel: Vom 1. August 2019 bis 31. Juli 2020 verfügte Gzuz laut Erkenntnissen des Gerichts über ein Einkommen von 1,4 Millionen Euro. Nach Abzug von Steuern, Unterhalt und weiteren Kosten blieben ihm 612.000 Euro, woraus der Richter den Tagessatz von 1700 Euro errechnete.

„Suchen Sie sich einen neuen Anwalt“

Der Verteidiger von Gzuz, Christopher Posch, hatte gefordert, den Angeklagten in allen Anklagepunkten freizusprechen. „Bei jedem anderen im Saal wäre ein solches Verfahren eingestellt worden“, hatte Posch erklärt. Nicht jedoch bei seinem Mandanten, der als „Staatsfeind“ und „böser Gangster-Rapper“ gelte.

Im Prozess hatte sich der Richter mehrmals einen Schlagabtausch mit dem Angeklagten geliefert, einmal schloss er ihn vom Prozess aus. Auch mit dem Anwalt lag der Richter über Kreuz. In seiner Urteilsbegründung watschte der Richter Posch, bekannt auch aus der RTL-Sendung „Christopher Posch - Ich kämpfe für Ihr Recht“, regelrecht ab.

An den Rapper gewandt, sagte der Richter: “Sie brauchen für die nächste Instanz einen besseren Anwalt.“ Posch sei, so Krieten, schlecht vorbereitet gewesen und hätte „geirrlichtert“. Zudem hätte der Anwalt abenteuerliche Zeugen präsentiert, die den Rapper entlasten sollten. „Manchmal dachte ich, ich bin in einem Fernsehstudio, das war Comedy“, sagte der Richter.

Kleinkrieg vor Gericht

Der Anwalt hatte seinerseits mehrere Befangenheitsanträge und eine Strafanzeige gegen den Richter gestellt, wegen Rechtsbeugung und Freiheitsberaubung. Krieten hatte im Februar einen Haftbefehl gegen den Rapper erlassen, da dieser nicht vor Gericht erschienen war. Gzuz meldete sich nachträglich auf der Geschäftsstelle und wurde dann für kurze Zeit in Haft genommen. Das hielt der Rechtsanwalt für nicht angemessen.

Anzeige

Gegen Ende der Urteilsbegründung wendet sich der Richter direkt an den Angeklagten, er sagt: „Sie sind ein Sozialrüpel. Sie missachten die Regeln des sozialen Miteinanders.“ Der antwortet: „Sie auch.“ Daraufhin sagt der Richter: „Das Schöne ist, dass ich hier das letzte Wort habe.“

"Zumindest bis die nächste Instanz wartet."""
Lionel Messi da – WM-Quali vor der Tür;
Lächeln," Posieren – doch nach dem Selfie nur noch freudlose Gesichter;""Es ist schon bitter: Während es sich andere am Strand gut gehen lassen", fristet man selbst ein trostloses Dasein. Die Masse an Selfies strahlender Urlauber ist überwältigend. Doch in der Realität blickt man oft in abgekämpfte, gelangweilte Gesichter.

Anzeige

Das Interessanteste am Selfie sind nicht die Pose und der Hintergrund, sondern das, was danach passiert. In der Altstadt Sarajevos beobachtete ich einmal zwei junge arabische Frauen in einem Café. Designerhandtaschen, teure Uhren. Womöglich kamen sie aus Katar oder Kuwait, die Hauptstadt Bosniens ist beliebt bei Touristen vom Persischen Golf.

Für ein gemeinsames Foto legten die Frauen ein strahlendes Lächeln auf. Performance auf den Punkt. Sobald der Auslöser betätigt war, kroch das Lächeln aus ihren Gesichtern wie das Mitgefühl aus einem Henker.

In Dubai fiel mir auf der Aussichtsplattform des Burj Khalifa ein junges französisches Pärchen auf. Beide schauten müde und genervt aus. Vielleicht hatten sie sich gestritten, und die Sache war noch nicht ausgeräumt.

Anzeige

Das Paar trat an die Balustrade und brachte einen Selfie-Stick in Position, im Hintergrund die dunstige Wüstenstadt. Eine Minute lang lächelten beide so überschwänglich in die Smartphone-Kamera, als hielten sie zum ersten Mal ihr Neugeborenes in den Armen. Mimik und Kopfstellung variierten sie immer nur geringfügig. Profis.

Irgendwann hatten sie für ihren großartigen Moment genug Beweise gesammelt, die sich triumphierend über die sozialen Netzwerke teilen ließen. Der gelangweilte, abgekämpfte, freudlose Gesichtsausdruck war wieder da.

Wie Urlauber gesehen werden möchten

Das Selfie-Gesicht ist zu einem globalen Phänomen geworden. Mit diesem ganz bestimmten Gesichtsausdruck, den ein Mensch sich für ein Selbstporträt zugelegt hat, drückt er aus, wie er wahrgenommen werden möchte. Auf Reisen am besten glücklich.

Anzeige

Das Selfie ist auch das Symptom einer digitalen Welt, in der jede Alltagshandlung zu einem Statement für die persönliche Social-Media-Öffentlichkeit werden kann. Manche behaupten, das Selfie zeige vor allem die existenzielle Angst, nicht beachtet zu werden.

Lesen Sie auch Handysucht Depressionen und die Angst, auf Facebook etwas zu verpassen

Vor einer Sehenswürdigkeit aufgenommen, geht es vielleicht auch um die Sehnsucht, sich in einen größeren Zusammenhang einzuordnen. Ich kann nicht beurteilen, ob die Menschen solche Erklärungsansätze reflektieren, wenn sie aus Versehen von Klippen stürzen, vor dem Trevi-Brunnen in Rom für das beste Bild mit Fäusten aufeinander losgehen oder sich mit angespülten Delfinen fotografieren, bis diese vertrocknet sind. Möglicherweise nicht.

Einen Menschen zum Lächeln aufzufordern, gleicht dem Versuch, aus Wasser eine Skulptur zu formen. Es braucht eine kühle Professionalität, damit die Bewegungen einfrieren. Was Models perfektioniert haben, können mittlerweile auch Touristen: für die Kamera auf Knopfdruck lächeln.

Internetcafés muten anachronistisch an

Anzeige

Im analogen Zeitalter ließ sich mit einem Farbfilm nur eine sehr begrenzte Anzahl von Bildern machen, und der Fotografierte hatte keine Kontrolle über den Auslöser. Irgendwer rief „Cheeese!“ und wenn man nicht aufpasste, waren die Augen zu.

Das ist heute nicht mehr schlimm. Reisefotos sind Massenproduktion. Urlauber fotografieren sich gefühlt dauernd und überall, doch die wenigsten empfinden dabei permanente Freude, daher das Selfie-Gesicht.

Lesen Sie auch Gefährliche Posen Wenn die Sucht nach Selfies tödlich endet

Ich kann mich noch an die Zeit erinnern, als es in Südamerika oder Afrika praktisch kein WLAN in den Hostels gab. Mein erstes Smartphone habe ich 2009 gekauft. Wenn ich mit dem Rucksack außerhalb Europas unterwegs war, ließ ich das teure Gerät aber daheim und nahm ein altes Billighandy für 30 Euro mit. Das fühlte sich sicherer an.

Um unterwegs Mails zu beantworten oder auf Facebook etwas mitzuteilen, musste man vor wenigen Jahren noch ein Internetcafé aufsuchen. Wir erinnern uns: düstere Kabuffe, die immer etwas dubios erschienen.

Aus heutiger Sicht völlig anachronistisch, wie Telefonzellen, als alle schon ein Handy besaßen. Doch damals, in der fernen Vergangenheit vor zehn Jahren, saß man unter Fremden vor einem Rechner, der lärmte wie ein Staubsauger, und suchte auf einer nikotingelben Tastatur das richtige Sonderzeichen, während nebenan ein peruanischer Junge einen Egoshooter durchballerte.

Die Wi-Fi-isierung der Welt schreitet unaufhaltsam voran. Auf Kreuzfahrtschiffen und in Flugzeugen werden die Datenübertragungsraten immer schneller, und die Roamingkosten sinken.

Lesen Sie auch Reise ins All Bald machen wir alle Selfies auf dem Mond

Wenn sich einmal der Weltraumtourismus durchgesetzt hat, werden Touristen in Raumschiffen durchs All schweben und auf die Erde herabschauen wie Götter, nur um im nächsten Moment zu lesen, dass die Kollegen die wichtige Präsentation für Montag immer noch nicht fertig haben.

Influencer-Marketing ist ein potenzieller Milliardenmarkt

Anzeige

Die Dokumentation von Urlaubsreisen hat sich dadurch grundlegend verändert. Früher erlebte man eine Reise erst einmal für sich – im Anschluss ließen sich Dias und später digitale Fotos präsentieren. Heute ist eine lückenlose Live-Dokumentation der Reise möglich. Der Tag beginnt mit einem Foto der Raw Vegan Chia Bowl für die Follower auf Instagram.

An dieser Stelle finden Sie Inhalte aus Instagram Um mit Inhalten von Instagram und anderen sozialen Netzwerken zu interagieren oder diese darzustellen, brauchen wir Ihre Zustimmung. Soziale Netzwerke aktivieren

Dieses Sendungsbewusstsein führt beim Empfänger zu einer verzerrten Wahrnehmung: Offensichtlich sind alle anderen permanent unterwegs, feiern grandiose Partys, lernen spannende Menschen kennen und entdecken versteckte Paradiese.

Ständig spült einem das Internet Selfies an makellosen Stränden, kristallklaren Bergseen und verschwenderischen Hotelpools in die Timeline. All diese Eindrücke konfrontieren dich mit einer entscheidenden Frage: Was machst du eigentlich in deinem Leben so?

Influencer-Marketing ist im Tourismus das große Ding der Stunde, ein potenzieller Milliardenmarkt. Reiseveranstalter, Airlines, Hotelketten und Destinationen bezahlen gut aussehende Frauen und Männer dafür, sich in Pools, Suiten und Badewannen für schicke Fotos in Szene zu setzen. Die Follower der Influencer sollen auf das Hotel, die Airline oder das Urlaubsziel aufmerksam werden.

Instagram-Fotos wecken falsche Erwartungen

