title;text

Deutsche Konsumenten nutzen die Verkaufsevents im Internet gern, um günstig Geschenke für Weihnachten einzukaufen – was auf Kosten des klassischen Weihnachtsgeschäfts geht.

Gerade größere Hersteller von Konsumartikeln treibe die Sorge um, dass sie nun schon vor der Cyber Week einen weiteren, von hoch gespannten Rabatt-Erwartungen geprägten Termin berücksichtigen müssen, sagte Nils Zündorf, Chef der Beratungsfirma Factor-a, die sich auf außenstehende Händler des Amazon-Marktplatzes spezialisiert hat.

Lesen Sie auch Schnäppchenjagd Diese Produkte sind am Black Friday am stärksten reduziert

Die Konsequenzen seien schon jetzt erkennbar. „Beim Amazon Prime Day sehen wir eine Abwanderung der größeren Anbieter“, erklärte Zündorf. Viele schalteten lieber auf firmenspezifische Aktionen um. So hatte Bosch im Juli seine Mähroboter, Akkuschrauber oder Klimageräte im Rahmen der selbst kreierten „Bosch Days“ laut Eigenwerbung mit Rabatten von teils 20 Prozent oder mehr über Amazon verkauft.

Anzeige

Der Badarmaturen-Hersteller Grohe verkaufte seine Produkte in einer „Grohe Week“ auf eigens gebauten Sub-Store-Seiten von Amazon. Die Anbieter hoffen, die Aufmerksamkeit der Kunden mit solchen firmenspezifischen Aktionen wirksamer auf ihre Marke und ihre Produkte zu lenken und weniger in der Masse der Prime-Day-Schnäppchen unterzugehen. Sie fahren ihr Engagement für das Hauptevent zurück, beobachtet Zündorf: „Viele Hersteller machen mit beim Prime Day, aber er hat nicht mehr die höchste Priorität.“

Kleine und mittlere Unternehmen im Mittelpunkt

Amazon macht aus der Not eine Tugend, indem es in diesem Jahr kleine und mittlere Unternehmen in den Mittelpunkt der Aufmerksamkeit rückt. Nach eigenen Angaben unterstützt der Konzern die Werbung kleinerer Firmen mit 85 Millionen Euro, um sie am Prime Day und in der Weihnachtssaison im Netz sichtbarer zu machen.

Dazu kommt eine gezielte Rabattaktion. Seit einigen Tagen erhalten Prime-Mitglieder, die bei ausgesuchten Kleinunternehmen einkaufen, einen virtuellen Gutschein von zehn Euro, den sie an den Aktionstagen am 13. und 14. Oktober wieder zum Einkauf bei Mini-Anbietern einsetzen können.

„In diesem außergewöhnlichen Jahr setzen wir alles daran, dass dieser Prime Day der erfolgreichste aller Zeiten für kleine und mittlere Unternehmen wird“, sagt Amazons Deutschland-Chef Ralf Kleber. Der US-Konzern, auch in Deutschland mit weitem Abstand Marktführer im E-Commerce, wirkt mit der Aktion zugleich Kritikern entgegen, die ihm eine Mitschuld am Siechtum deutscher Innenstädte geben.

Lesen Sie auch Ceconomy Erstmals deuten Mediamarkt und Saturn eine Strategie gegen Amazon an

„Wenn nun aber die Website von Amazon zum universellen Schaufenster wird und der Konsum sich weiter in Richtung E-Commerce verlagert, verlieren Einkaufs- und Flaniermeilen ihre Funktion“, schrieben etwa Marta Kwiatkowski und andere in einer Studie des Schweizer Gottlieb-Duttweiler-Instituts über „Die Zukunft des öffentlichen Raums“.

Für manche Kommunalpolitiker ist der E-Commerce regelrecht zum Feindbild geworden. Marktführer Amazon arbeitet auch jenseits seiner Verkaufsaktionen dagegen an. So startete der Online-Gigant Mitte September gemeinsam mit dem Handelsverband Deutschland (HDE), dessen Mitglied er seit Kurzem ist, am 15. September ein kostenloses Wissensportal namens Quickstart Online, das zögerliche kleine Kaufleute auf dem Weg ins Internet unterstützen soll.

Amazon setzt auf Eigenmarken

Bei der hauseigenen Verkaufsaktion setzt der US-Konzern darauf, die Zurückhaltung großer Marken mit eigenen Stärken zu kompensieren. „Elektronische Geräte von Amazons Eigenmarken wie Alexa, Kindle und allem, was mit dem Internet der Dinge zusammenhängt, werden bei diesjährige Prime Day einen starken Schwerpunkt bilden“, sagt Zündorf voraus.

Anzeige

Das lässt sich bereits an laufenden Schnäppchen-Offerten „zur Einstimmung auf den Prime Day“ (Eigenwerbung) ablesen. So ist ein WLAN-Set mit 163,18 Euro für Mitglieder des Kundenbindungsprogramms knapp 109 Euro billiger zu haben als zuvor. Ein Alarmsystem der Amazon-Tochter Ring ist für 193,98 Euro erhältlich, etwa ein Drittel weniger.

Amazon verfügt über einen kompletten Eigenmarken-Zoo mit Dutzenden von Labels quer durch die Konsumbedürfnisse, etwa Basics für Alltagsprodukte wie Batterien, Handtücher oder Töpfe, dazu Mode-Label wie Truth & Fable, Daily Rituals oder Lark & Ro bis hin zu Möbelmarken (Infinikit, Alkove) oder Produkten für die Baby- und Körperpflege (Mama Bear, Solimo).

Anzeige 48 Stunden Schnäppchenjagd beim Amazon Prime Day Am 13. und 14. Oktober sind Tausende Produkte teils stark reduziert - aber nur für Prime-Mitglieder. Auch mit einer Gratis-Testmitgliedschaft können Sie spontan Schnäppchen finden.

Bei seinen Eigenmarken habe Amazon jederzeit die Preishoheit und könne damit auch die Rabatte am Aktionstag zuverlässig steuern, so der Chef von Faktor-a. Das verbreitete Phänomen, dass das Preisniveau eines Produkts schon vor dem eigentlichen Schnäppchentag irgendwelchen Sonderverkäufen oder Aktionswochen des Handels zum Opfer fällt, sei damit gebannt.

Erstmals veranstaltete Amazon das Netz-Event am 15. Juli 2015 mit der Begründung, das 20-jährige Bestehen des Konzerns zu feiern. Dass damit auch das typische sommerliche Auslastungstief bei Logistik, Lagern und Absatz geglättet wurde, dürfte mehr als ein willkommener Nebeneffekt gewesen sein. 2019 wurde die Aktion erstmals auf zwei Tage ausgedehnt.

Letzter Herbst-Prime-Day

Auch in diesem Jahr läuft sie nach dem Start um 0:01 Uhr am 13. Oktober 48 Stunden lang. Der Prime Day funktioniert vor allem als Magnet für das Amazon-Kundenbindungsprogramm - ein Effekt, den der Konzern in diesem Jahr noch mit einem kostenfreien 30-tägigen Probezeitraum verstärkt.

Das verwässert zwar den Eindruck, Prime-Mitgliedern würden exklusive Privilegien gewährt, doch es erhöht die Chance auf steigende Mitgliederzahlen.

Lesen Sie auch Onlinehandel boomt Amazons neue Systemrelevanz wird für Deutschland gefährlich

Prime-Kunden sind für Amazon besonders attraktiv. Nach einer Schätzung der US-Marktbeobachtung Consumer Intelligence Research liegt der jährliche Bestellwert fast doppelt so hoch wie bei Nichtmitgliedern.

Einen weiteren Prime Day im Oktober wird es aber wohl nicht mehr geben – wenn es die Pandemie-Situation denn zulässt. Eine Durststrecke im Sommer und geballte Verkaufsaktionen im Herbst wie 2020, das könne eigentlich niemand wollen, ist sich Zündorf sicher. „Der Sommer wird für Anbieter und Kunden wesentlich attraktiver bleiben, wenn die Situation sich wieder normalisiert hat“," glaubt er."""
"Diese deutsche Firma wird das neueste Mitglied im Tesla-Imperium;""Anzeige"

Dass Elon Musk ein Anhänger deutscher Ingenieurskunst ist, weiß man nicht erst seit der Entscheidung vor einem knappen Jahr, die erste europäische Fabrik seines Elektroautobauers Tesla im brandenburgischen Grünheide zu bauen. Schon drei Jahre zuvor, im November 2016, hatte Musk seine Einkaufstour im deutschen Maschinenbau begonnen.

Damals kaufte Tesla den Anlagenbauer Grohmann Engineering in der Eifel. Seither firmiert das Tochterunternehmen unter dem Namen Tesla Grohmann Automation. „In Deutschland gibt es enorm viele Talente im Bereich der Automatisierung“, sagte Musk schon damals. „Tesla wird teilweise ein deutsches Unternehmen.“

Lesen Sie auch Beispiellose Performance Vorbild Tesla – Diese Aktien sind die neuen 12.000-Prozent-Kandidaten

Tatsächlich wird Tesla gerade wieder ein kleines Stück deutscher, denn Musk hat in den vergangenen Tagen den Kauf eines weiteren Maschinenbauers eingefädelt. Assembly & Test Europe (ATW) heißt das mit rund 210 Mitarbeitern kleine Unternehmen aus dem rheinland-pfälzischen Neuwied, das bald zum US-Autobauer gehören soll. Zwar bestätigen weder ATW noch Tesla das Geschäft, doch beim Bundeskartellamt ist bereits ein sogenannter Kontrollerwerb angemeldet, die deutsche Behörde soll also prüfen, ob Tesla mindestens die Mehrheit der Anteile an ATW übernehmen darf.

Anzeige

Beim kanadischen ATS-Konzern, zu dem ATW bislang gehört, bestätigte man vor wenigen Tagen immerhin, dass man eine Vereinbarung unter den Bedingungen geschlossen habe, „bestimmte Unternehmensteile zu verkaufen und Mitarbeiter eines deutschen Tochterunternehmens an eine dritte Partei zu transferieren“.

Vermögen aufbauen Lassen Sie Ihre Anlage-Strategie gratis prüfen! Als WELT-Leser können Sie an einem kostenlosen Geld-Check der V-BANK teilnehmen und Ihre Anlagen von einem unabhängigen Vermögensexperten unverbindlich überprüfen lassen. Profitieren Sie jetzt von einer Profi-Meinung.

Es ist die Rettung für ATW, denn noch im September hatte der kanadische Mutterkonzern angekündigt, dass man den deutschen Ableger ganz schließen werde. Die Jobs der Mitarbeiter galten als massiv gefährdet. Es war damals ein überraschender Schritt, den ATS zwar nach außen mit den Folgen der Corona-Pandemie erklärte, doch tatsächlich hatte das deutsche Tochterunternehmen schon vor Beginn der Virus-Krise Probleme und fuhr Verluste ein. Allerdings hätte man durchaus hoffen können, dass es sich nur um eine vorübergehende Phase roter Zahlen handelt. Denn ATW steckt wie große Teile der Autoindustrie in einem Umbruchprozess, bei dem das Unternehmen aber schon weit vorangekommen war.

Lesen Sie auch „Tenbagger“ Diese Aktien können ihren Wert verzehnfachen

ATW stellt nach eigenen Angaben Produktionsanlagen insbesondere für die Autoindustrie her. Waren es früher Fertigungslinien für Teile wie Getriebe, hat die Firma in den vergangenen Jahren auf die Automatisierung der Herstellung von sogenannten Batterie-Packs gesetzt. Dabei werden die Batteriezellen, die von asiatischen Herstellern zugekauft werden, zu größeren Packs zusammengefasst. Das übernehmen im Gegensatz zur Zellproduktion viele Fahrzeughersteller selbst. Laut dem Eintrag beim Wirtschaftsforum Neuwied gehörten zu den Kunden von ATW Schwergewichte wie BMW, Daimler und Volkswagen, aber auch Zulieferer wie Brose, Magna und ZF.

2019 rutscht das Unternehmen überraschend in die roten Zahlen

Anzeige

Eigentlich müsste es ein boomendes Geschäft für den Anlagenbauer sein, denn die Autobauer stellen immer größere Teile ihrer Produktion auf die Elektromobilität um. Und tatsächlich verzeichnete ATW laut dem gerade erst veröffentlichten Geschäftsbericht für das Jahr 2019, der WELT vorliegt, ein deutliches Plus beim Auftragseingang.

„Die neuen Technologien der E-Mobilität bei Kunden in der traditionellen automobilen Branche haben zu einer spürbaren Nachfragesteigerung geführt“, heißt es im Bericht. Der Auftragsbestand kletterte um 30,9 Prozent gegenüber dem Vorjahr auf 111,5 Millionen Euro. „Dieser Steigerung des Auftragseingangs liegen mehrere Bestellungen von Batteriemontage- und Prüfsystemen zugrunde“, heißt es im Geschäftsbericht.

Auch der Umsatz in dem am 31.3.2019 beendeten Geschäftsjahr stieg um mehr als 23 Prozent auf 33,9 Millionen Euro. Allerdings wurde das ursprünglich ausgegebene Ziel von 40 Millionen Euro Umsatz verfehlt. Und die Umstellung auf die neue Technologie lief auch bei ATW alles andere als reibungslos. Schon im Geschäftsjahr 2019 war das Unternehmen deshalb in die roten Zahlen gerutscht und verbuchte einen Verlust von fast 3,4 Millionen Euro, den der Mutterkonzern ausgleichen musste.

Lesen Sie auch Tesla-Gigafactory Deshalb musste Elon Musk seine Fabrik in Deutschland bauen

Anzeige

Noch im Jahr zuvor hatte ATW einen Gewinn von mehr als 900.000 Euro ausgewiesen. Zu Beginn des Geschäftsjahres war man noch von einem erneuten Gewinn von 3,5 Millionen Euro ausgegangen. Das negative Ergebnis komme durch „unerwartete Mehrkosten für Aufträge mit neuen Technologien“ zustande, heißt es im Geschäftsbericht.

Dennoch klangen die Aussichten für die kommenden Jahre durchaus optimistisch: „Das prozessorientierte und kostenbewusste Handeln hat dazu geführt, dass man im abgelaufenen Geschäftsjahr das Fundament für eine kostenoptimierte Zukunft gelegt hat“, heißt es im Bericht. „Die Ausrichtung der weltweiten Vertriebsaktivitäten sowie die Produktinnovationen lassen auch im derzeit ungewissen Umfeld weitere positive Impulse erwarten.“

Allerdings halbierte sich der Umsatz im Geschäftsjahr, das in diesem März endete, auf nur noch 14,4 Millionen Euro, dafür sollte er schon im nun laufenden Jahr auf einen Rekordwert von 74 Millionen Euro steigen. „Es wird jedoch davon ausgegangen, dass, bedingt durch die Abwicklung von Projekten im neuen Produktbereich der Batteriemontage, geringere Margen erzielt werden und damit die Umsatzrendite weiterhin unter den historisch erwirtschafteten Werten liegt“, heißt es im Geschäftsbericht.

Anzeige 48 Stunden Schnäppchenjagd beim Amazon Prime Day Am 13. und 14. Oktober sind Tausende Produkte teils stark reduziert - aber nur für Prime-Mitglieder. Auch mit einer Gratis-Testmitgliedschaft können Sie spontan Schnäppchen finden.

Dennoch plane man in Zukunft wieder mit Gewinnen, „bestandsgefährdende“ Risiken gebe es nicht. Umso überraschender kam daher die Entscheidung des Mutterkonzerns, den deutschen Standort ganz zu schließen.

