title;text
Quelle: Getty; Infografik WELT

Auch die Reisekultur dürfte sich allerdings ändern. Folgt man den Aussagen der Catella-Umfrage, wird es künftig wesentlich weniger nationale und internationale Geschäftsreisen geben, die „zeitintensiv“ sind:

72 Prozent der Befragten stimmten ganz oder teilweise der Aussage zu," dass es weniger nationale Geschäftsreisen geben werde. 74 Prozent erwarten weniger internationale Geschäftsreisen. Die Büroarbeiter Deutschlands werden sich also auf noch mehr Arbeitszeit zu Hause einstellen müssen."""
„Ich würde allen deutschen Richtern empfehlen," mal zu kiffen“;""Andreas Müller ist Richter am Amtsgericht Bernau und wurde bekannt als „Deutschlands härtester Jugendrichter“. Mit seinen Urteilen griff der heute 58-Jährige hart gegen jugendliche Straftäter und Rechtsradikale durch. Neonazis verbot er ihre Springerstiefel in seinem Gerichtssaal", jugendliche Schläger schickte er mit hohen Strafen in den Knast.

Sein zweites großes Thema ist seit zwei Jahrzehnten die Drogenpolitik. Hier setzt er nicht auf Abschreckung, sondern Toleranz und Aufklärung. Richter Müller ist eine der wichtigsten Stimmen für die Cannabis-Legalisierung in Deutschland – und eine der lautesten. Warum, darüber sprach er mit WELT.

WELT: Herr Müller, Wie ist Ihr persönliches Verhältnis zu Cannabis?

Müller: Ich habe mit 18 meinen ersten Joint geraucht. Ich würde auch allen deutschen Richtern empfehlen, mal zu kiffen. Die meisten würden gar nichts merken und die anderen würden sehen: Oh. Ist ja gar nicht so schlimm. Obwohl die meisten das wahrscheinlich eh aus ihrem Umfeld kennen. Oder auch persönliche Erfahrungen haben.

WELT: Sie sind Richter und Aktivist. Wie finden Sie, dass das zusammenpasst?

"..."""
Kurz vor seinem Tod bat er einen Freund um eine kugelsichere Weste;Ein Mann beleidigt in Youtube-Videos den Präsidenten Tschetscheniens. Dann wird er nahe Wien erschossen. Die Bluttat erinnert an den Tiergarten-Mord in Deutschland durch Schergen des Kremls. Aber es geht um mehr als eine Beleidigung.
Vetos im UN-Sicherheitsrat blockieren Hilfe für Millionen Syrer;
"Ich bereue nichts;""Ein türkisches Gericht habe eine Haftstrafe gegen ihn verhängt", um Präsident Erdogan nicht bloßzustellen, schreibt Deniz Yücel. Das zeige den erbärmlichen Zustand der Rechtsstaatlichkeit in der Türkei. Er lebe in Freiheit, aber Millionen Türken nicht.

Anzeige

Angesichts des Urteils des Verfassungsgerichts hätte es heute nur eine einzige Entscheidung geben können: Freispruch. Die 32. Istanbuler Strafkammer stand jedoch vor einer schwierigen Aufgabe: Entweder hätten die Richter mich freigesprochen und damit ein Urteil gefällt, das bedeutet hätte, dass Staatspräsident Recep Tayyip Erdogan mich zu Unrecht immer wieder als „Agentterrorist“ bezeichnet und sich durch diese öffentliche Vorverurteilung und Verleumdung strafbar gemacht hat.

Oder die Richter hätten mich verurteilt, sich also über das Verfassungsgericht hinweggesetzt und sich selbst strafbar gemacht. So oder so musste sich der türkische Staat heute blamieren. Das hat er auch. Dass die Richter entschieden haben, lieber das Verfassungsgericht bloßzustellen als den Staatspräsidenten, dass sie es sogar gewagt haben, die unantastbare Verteidigung des Angeklagten zu kriminalisieren, zeigt einmal mehr, wie es um die Rechtsstaatlichkeit in diesem Land bestellt ist: erbärmlich.

Und dass ein Witz über das Verhältnis von Kurden und Türken nun Gegenstand eines neuen Strafverfahrens („Verunglimpfung des Staates und seiner Symbole“) werden soll, ist ein Witz; dass auch der Begriff „Völkermord an den Armeniern“ weiter kriminalisiert wird, nicht.

Lesen Sie auch Lesung im Gefängnis „Letztlich wird man nicht gefragt. Sie werden das ja kennen“

Anzeige

Das ist ein politisches Urteil, wie die ganze Geschichte meiner Verhaftung politisch motiviert war: meine unrechtmäßige Verhaftung, die Vorverurteilungen aus der Staatsführung, der Versuch, mich als Geisel zu behandeln, die illegale Isolationshaft und schließlich die rechtswidrigen Umstände meiner Freilassung. Eine lange Kette von Staatskriminalität. Auch wenn meine Geschichte einige Besonderheiten aufweist, sind alle vergleichbaren Verfahren in der Türkei gegen Journalisten, Oppositionspolitiker oder Menschenrechtler politisch motiviert.

Letztlich ist mir dieses Urteil egal

Dieses Urteil einer zu Handlangern der Exekutive, zu Rechtsbrechern in Richterroben degradierten Justiz ändert nichts an dem, was ich vom Moment meiner Festnahme an wusste: Ich wurde gefangen genommen, weil ich meine Arbeit als Journalist gemacht habe. Daran bereue ich nichts. Und früher oder später wird ein Gericht das auch feststellen.

Natürlich wäre ein Freispruch nicht nur rechtlich zwingend, sondern auch erleichternd gewesen. Aber letztlich ist mir dieses Urteil egal, es hat auch keine praktischen Auswirkungen.

Lesen Sie auch Deniz Yücels Buch Mein Nachbar war also kein Geringerer als Recep Tayyip Erdoğan

Anzeige

Anfang 2018 hat Staatspräsident Erdogan im direkten Gespräch mit dem damaligen Bundesaußenminister Sigmar Gabriel für meine Freilassung die Bedingung gestellt, dass ich sofort das Land verlasse. Dieses Angebot habe ich zunächst abgelehnt, mich aber letztlich von meiner Frau Dilek und anderen Menschen, die an meiner Seite standen, überzeugen lassen.

Seither lebe ich in Freiheit. Doch mich schmerzt es, dass dieses großartige Land unter diesem autoritären, islamistisch-nationalistischen," vor allem aber kriminellen Regime leidet. Ich bin frei; Hunderte Journalisten und andere aus politischen Gründen Inhaftierte sind es nicht. Und Millionen in diesem Freiluftgefängnis Tayyipistan sind es auch nicht."""
"Deniz Yücel zu mehr als zwei Jahren und neun Monaten Haft verurteilt;""Gut drei Jahre nachdem sich WELT-Korrespondent Deniz Yücel in Istanbul der Polizei gestellt und dann fast ein Jahr in Haft verbracht hatte", ist in Abwesenheit das Urteil gefallen. In mehreren Anklagepunkten gab es einen Freispruch. Doch der Richter ordnete noch zwei neue Verfahren an.

Anzeige

WELT-Autor Deniz Yücel ist durch ein Gericht in Istanbul wegen Terrorpropaganda für die verbotene kurdische Arbeiterpartei PKK zu zwei Jahren, neun Monaten und 22 Tagen Haft verurteilt worden. Zugleich wurde Yücel freigesprochen vom Vorwurf der Terrorpropaganda für die Gülen-Organisation und vom Vorwurf der Volksverhetzung.

Das Gericht ordnete jedoch zwei weitere Ermittlungsverfahren gegen Yücel an, eines wegen Beleidigung des Staatspräsidenten sowie eines wegen Verunglimpfung des Staates und seiner Organe. Dabei beziehen sich die Richter zum einen auf zwei WELT-Artikel Yücels und zum anderen auf Einlassungen in seiner Verteidigungsschrift.

Der Verdacht der Beleidigung des Staatspräsidenten richtet sich auf die Überschrift eines Artikels in WELT AM SONNTAG nach dem versuchten Staatsstreich vom Juli 2016. Sie hatte „Der Putschist“ gelautet. Im Fall der Verunglimpfung des Staates und seiner Organe verweisen die Richter auf einen Witz über das Verhältnis von Türken und Kurden, den Yücel in einem anderen Artikel wiedergibt, sowie auf seine Erwähnung des Völkermordes an den Armeniern in einem dritten Text und auf Einlassungen in seiner Verteidigungsschrift im nun zu Ende gegangenen Verfahren.

Staatsanwaltschaft hatte bis zu 16 Jahre Haft gefordert

Anzeige

Yücels Anwalt Veysel Ok hatte einen Freispruch gefordert. Die Staatsanwaltschaft wiederum hatte unter anderem die Tatbestände der Terrorpropaganda und der Volksverhetzung als erfüllt angesehen, für die insgesamt eine Höchststrafe von bis zu 16 Jahren Haft möglich gewesen wäre. Vor etwa einem Jahr hatte das türkische Verfassungsgericht die Untersuchungshaft gegen Yücel nachträglich für unrechtmäßig erklärt.

„Angesichts des Urteils des Verfassungsgerichts hätte es heute nur eine einzige Entscheidung geben können: Freispruch“, schreibt Yücel in einem Text zu dem Urteil, der von WELT veröffentlicht wurde. „Die 32. Istanbuler Strafkammer stand jedoch vor einer schwierigen Aufgabe: Entweder hätten die Richter mich freigesprochen und damit ein Urteil gefällt, das bedeutet hätte, dass Staatspräsident Recep Tayyip Erdogan mich zu Unrecht immer wieder als ,Agentterrorist‘ bezeichnet und sich durch diese öffentliche Vorverurteilung und Verleumdung strafbar gemacht hat. Oder die Richter hätten mich verurteilt, sich also über das Verfassungsgericht hinweggesetzt und sich selbst strafbar gemacht. So oder so musste sich der türkische Staat heute blamieren. Das hat er auch. Dass die Richter entschieden haben, lieber das Verfassungsgericht bloßzustellen als den Staatspräsidenten, dass sie es sogar gewagt haben, die unantastbare Verteidigung des Angeklagten zu kriminalisieren, zeigt einmal mehr, wie es um die Rechtsstaatlichkeit in diesem Land bestellt ist: erbärmlich.“ Das Urteil sei, wie schon seine Gefangennahme und die Umstände seiner Freilassung, politisch motiviert.

Lesen Sie auch Türkei Ein alter Traum Erdogans steht kurz vor der Erfüllung

Der WELT-Korrespondent hatte sich im Februar 2017 bei der Istanbuler Polizei gemeldet, nachdem er von Ermittlungen gegen seine Person erfahren hatte. Er wurde festgenommen und später unter dem Vorwurf der Terrorpropaganda und der Volksverhetzung verhaftet. Als Belege für die Anschuldigungen dienten ausschließlich Artikel Yücels in WELT und WELT AM SONNTAG, unter anderem ein Interview mit dem Vizechef der verbotenen kurdischen Arbeiterpartei PKK Cemil Bayik und die Nacherzählung eines Witzes über das Verhältnis von Kurden und Türken.

Anzeige

In der später vorgelegten Anklageschrift kam noch die Verwendung des Begriffs „Völkermord an den Armeniern“ als weiterer Vorwurf hinzu. Neben Propaganda für die PKK hatte die Staatsanwaltschaft in ihrer Anklageschrift Yücel auch Propaganda für die Gülen-Organisation vorgeworfen, in ihrem Schlussplädoyer aber einen Freispruch für diesen Anklagepunkt gefordert.

Neun Monate in Isolationshaft

Yücel war fast ein Jahr lang gefangen gehalten worden, davon neun Monate in Isolationshaft. Zahlreiche Vertreter der Zivilgesellschaft in der Türkei wie in Deutschland hatten sich für seine Freilassung eingesetzt, ebenso die Bundesregierung. Der türkische Staatspräsident Recep Tayyip Erdogan hatte Yücel wiederholt öffentlich als Agenten und Terroristen bezeichnet und in vertraulichen Gesprächen eine Freilassung Yücels im Austausch gegen nach Deutschland geflohene ehemalige Offiziere der türkischen Armee angeboten.

Lesen Sie auch Lesung im Gefängnis „Letztlich wird man nicht gefragt. Sie werden das ja kennen“

Im Februar 2018 hatte ein Gericht in Istanbul verfügt, dass Yücel für die weitere Dauer des Verfahrens auf freien Fuß gesetzt werde. Er hatte daraufhin die Türkei verlassen. Staatspräsident Erdogan hatte in Gesprächen mit dem damaligen Bundesaußenminister Sigmar Gabriel Yücels Freilassung mit der Bedingung einer sofortigen Ausreise verknüpft.

Anzeige

Seither hatte es bereits ein höchstrichterliches Urteil in dem Fall gegeben. So hatte das türkische Verfassungsgericht im Juni 2019 Yücels Verhaftung für unzulässig erklärt. In ihrem Urteil hatten die Richter alle Vorwürfe gegen Yücel überprüft und dabei keine Anzeichen auf strafbare Handlungen gefunden. Vielmehr seien die ihm zur Last gelegten Äußerungen durch die Presse- und Meinungsfreiheit gedeckt.

Lesen Sie auch Deniz Yücels Buch Mein Nachbar war also kein Geringerer als Recep Tayyip Erdoğan

Auf dieses Urteil der obersten Instanz der Türkei hatte auch Yücels Anwalt Veysel Ok in seinem Schlussplädoyer bei der vorletzten Sitzung Ende Juni Bezug genommen. „Die Staatsanwaltschaft hat in ihrem Plädoyer das Urteil des Verfassungsgerichts entweder wissentlich ignoriert, oder es ist ihr nicht bekannt“, hieß es darin. Dass die Staatsanwaltschaft dennoch eine Verurteilung Yücels betreibe, zeige den „katastrophalen Zustand“ der türkischen Justiz.

Er kündigte an, im Namen seines Mandanten gegen das heutige Urteil der ersten Instanz vorzugehen. Bis zu einem Urteil in einem Berufungsverfahren gilt das Urteil nicht als rechtskräftig. „Wir sehen uns gezwungen, gegen dieses Urteil vorzugehen, weil sich das Gericht über das Verfassungsgericht hinweggesetzt und Verfassungsbruch begangen hat“, sagte Ok gegenüber WELT.

„Ich bin frei; Hunderte Journalisten und andere aus politischen Gründen Inhaftierte sind es nicht. Und Millionen in diesem Freiluftgefängnis Tayyipistan sind es auch nicht“, schreibt Yücel in seinem Text zum Urteil.

Lesen Sie auch Tourismus Gehört die Türkei zu Europa? In der Corona-Krise ist Berlins Antwort klar

Der CDU-Außenpolitiker Norbert Röttgen wertet das Urteil gegen Yücel als Abkehr der Türkei von demokratischen Werten. „Die Verurteilung von Deniz Yücel zeigt vor allem eins: Die Türkei wendet sich von den gemeinsamen demokratischen Werten ab“, sagte Röttgen WELT. „Denn das Urteil verletzt die Pressefreiheit, die sowohl in der Verfassung als auch in den Straßburger Urteilen, an die sich die Türkei als Mitglied des Europarats zu halten hat, verankert ist. Stattdessen sehen wir eine unter politischem Druck handelnde Justiz.“

Der Vorsitzende des Auswärtigen Ausschusses im Bundestag mahnte, Deutschland dürfe sich aber nicht von der Türkei abwenden – sie sei mehr als ihr Präsident Recep Tayyip Erdogan. „Teile der Bevölkerung lechzen nach Demokratie, Freiheit und Rechtsstaatlichkeit und riskieren viel bei ihrem Einsatz dafür“, so Röttgen. „Für all diejenigen müssen wir an den zivilgesellschaftlichen Brücken weiter festhalten.“

An dieser Stelle finden Sie Inhalte aus Twitter Um mit Inhalten aus Twitter und anderen sozialen Netzwerken zu interagieren oder diese darzustellen, brauchen wir Ihre Zustimmung. Soziale Netzwerke aktivieren
